{
  "baseUrl": "https://whop.com/f2p/?a=alexburnett21",
  "title": "Flip 2 Profit | Whop",
  "h1": "Flip 2 Profit",
  "bullets": [
    "Powered by FP Flip 2 Profit 4.8 ( 213 ) Contact seller Products $69.00 / month Join F2P Premium! 1 Month Premium 4.8 ( 134 ) Unmute $500.00 Lifetime access to F2P Lifetime Premium New Contact seller Reviews JR Jacob Reyes • 1 Month Premium 7 days ago Money making server Written 1 month after purchase",
    "O Omar • 1 Month Premium 1 month ago Great server, has everything you need to make so much money Written 1 month after purchase",
    "SP Shawn Perry 2 months ago Great Written 2 years after purchase",
    "JL Juanito Lewis • 1 Month Premium 2 months ago Alone and his team are LEGIT!! I studied all the material and now have weeks worth of content and already made my FIRST SALE DAY 1!!! THANK YOU AMON THANK YOU GARY Written 1 day after purchase"
  ],
  "paras": [
    "FP Flip 2 Profit 4.8 ( 213 ) Contact seller Products $69.00 / month Join F2P Premium! 1 Month Premium 4.8 ( 134 ) Unmute $500.00 Lifetime access to F2P Lifetime Premium New Contact seller Reviews JR Jacob Reyes • 1 Month Premium 7 days ago Money making server",
    "1 month ago Great server, has everything you need to make so much money",
    "2 months ago Great",
    "2 months ago Alone and his team are LEGIT!! I studied all the material and now have weeks worth of content and already made my FIRST SALE DAY 1!!! THANK YOU AMON THANK YOU GARY"
  ],
  "priceTokens": [
    "$69.00",
    "$500.00",
    "$1",
    "$1",
    "$1",
    "$21",
    "$1",
    "$1",
    "$1",
    "$1",
    "$28",
    "$1",
    "$28",
    "$28",
    "$28",
    "$28",
    "$3",
    "$3",
    "$3",
    "$10"
  ],
  "faq": [],
  "textSample": "Powered by FP Flip 2 Profit 4.8 ( 213 ) Contact seller Products $69.00 / month Join F2P Premium! 1 Month Premium 4.8 ( 134 ) Unmute $500.00 Lifetime access to F2P Lifetime Premium New Contact seller Reviews JR Jacob Reyes • 1 Month Premium 7 days ago Money making server Written 1 month after purchase O Omar • 1 Month Premium 1 month ago Great server, has everything you need to make so much money Written 1 month after purchase SP Shawn Perry 2 months ago Great Written 2 years after purchase JL Juanito Lewis • 1 Month Premium 2 months ago Alone and his team are LEGIT!! I studied all the material and now have weeks worth of content and already made my FIRST SALE DAY 1!!! THANK YOU AMON THANK YOU GARY Written 1 day after purchase See all reviews Flip 2 Profit | Whop",
  "finalUrl": "https://whop.com/f2p/?a=alexburnett21",
  "fetchedAt": "2025-11-04T18:10:40.739Z",
  "textHash": "ba5385f243e2eabc2d20d2ab02b1e915c78dece62e6f83d90fa2e85315aaabfe",
  "drilled": false
}