{
  "baseUrl": "https://whop.com/1on1-ads-mastery-mentorship-ecom/100-creativetm/",
  "title": "100 Creative™ | Whop",
  "h1": "100 Creative™",
  "bullets": [
    "Sign in CC 100 Creative™ ECOM MADE EASY. GROW FASTER, SELL MORE. 5.0 ( 55 ) Ecommerce Unlock the secrets of e-commerce success with expert-led courses. Learn at your own pace, access on any device, and enjoy lifetime access to all materials. This product doesn&#x27;t have any visible pricing options DM the creator to notify them Features Courses taught by industry experts with real-world experience.",
    "Access course content on any device, anywhere, anytime.",
    "In-depth modules covering all key aspects of the subject.",
    "Complete the course at your own pace with no time limits.",
    "Enjoy unrestricted access to all course materials and updates for life.",
    "EA Erica Anthony 8 days ago I’ve only been enrolled in Chase’s course for about a month, and I’m already seeing a huge difference in my sales! I had no prior experience with Facebook ads, but now I’m confidently running my own ad account — no more relying on an agency. Chase breaks everything down in a way that’s super easy to... Show more Written 1 month after purchase",
    "RG Riley Garden 11 days ago Working with Chase and his team has been a total game-changer. Sean’s coaching on media buying has completely transformed the way I look at ads. I used to just run everything broad, but now I understand how to strategically scale using advanced targeting and data-driven optimization. The software st... Show more Written 1 month after purchase",
    "ST SANDY TZATZOU 20 days ago Thanks to Chase and his team — Jake, Sean, and Myles — for being a huge help to my business. I’m genuinely grateful for the clarity and direction they’ve brought to my brand. Chase has this rare ability to simplify complex systems while making you think differently and act smarter. The team is great... Show more Written 8 months after purchase",
    "RF Raeem Farooq 1 month ago I joined the program 2 weeks ago! This program has been amazing. Specially thanks to Jake! He has been explaining and guiding me a lot! Written 18 days after purchase"
  ],
  "paras": [
    "Sign in CC 100 Creative™ ECOM MADE EASY. GROW FASTER, SELL MORE. 5.0 ( 55 ) Ecommerce Unlock the secrets of e-commerce success with expert-led courses. Learn at your own pace, access on any device, and enjoy lifetime access to all materials.",
    "Courses taught by industry experts with real-world experience. Access course content on any device, anywhere, anytime. In-depth modules covering all key aspects of the subject. Complete the course at your own pace with no time limits. Enjoy unrestricted access to all course materials and updates for life. Reviews 4.98 out of 5 55 total reviews 5 stars 4 stars 3 stars 2 stars 1 star EA Erica Anthony 8 days ago I’ve only been enrolled in Chase’s course for about a month, and I’m already seeing a huge difference in my sales! I had no prior experience with Facebook ads, but now I’m confidently running my own ad account — no more relying on an agency. Chase breaks everything down in a way that’s super easy to...",
    "Written 1 month after purchase RG Riley Garden 11 days ago Working with Chase and his team has been a total game-changer. Sean’s coaching on media buying has completely transformed the way I look at ads. I used to just run everything broad, but now I understand how to strategically scale using advanced targeting and data-driven optimization. The software st...",
    "Written 1 month after purchase ST SANDY TZATZOU 20 days ago Thanks to Chase and his team — Jake, Sean, and Myles — for being a huge help to my business. I’m genuinely grateful for the clarity and direction they’ve brought to my brand. Chase has this rare ability to simplify complex systems while making you think differently and act smarter. The team is great...",
    "Written 8 months after purchase RF Raeem Farooq 1 month ago I joined the program 2 weeks ago! This program has been amazing. Specially thanks to Jake! He has been explaining and guiding me a lot!",
    "About the creator CC View profile Chase Chappell @ chaseca • Joined Jul 2024 Chase Chappell, founder of Sirge.com, is a serial entrepreneur and expert in Facebook and TikTok ads, advising on over $200M in ad spend. He leads the Ads Mastery Mentorship program and is a partner at DOE Media, an agency recognized by Inc. 5000 as one the the fastest growing company in the US. FAQs Is there a time limit to complete the mentorship? Is This A true 1-on-1 Mentorship? &quot;I Don&#x27;t Have A Business Yet&quot; Do I Get On-Going Support? Affiliates CC Become an affiliate Chase Chappell 30% reward Earn money by bringing customers to Chase Chappell. Every time a customer purchases using your link, you&#x27;ll earn a commission."
  ],
  "priceTokens": [
    "$200",
    "$1",
    "$1",
    "$1",
    "$23",
    "$1",
    "$1",
    "$1",
    "$1",
    "$1",
    "$2",
    "$1",
    "$2",
    "$2",
    "$2",
    "$2",
    "$3",
    "$3",
    "$3",
    "$10"
  ],
  "faq": [],
  "textSample": "Sign in CC 100 Creative™ ECOM MADE EASY. GROW FASTER, SELL MORE. 5.0 ( 55 ) Ecommerce Unlock the secrets of e-commerce success with expert-led courses. Learn at your own pace, access on any device, and enjoy lifetime access to all materials. This product doesn&#x27;t have any visible pricing options DM the creator to notify them Features Courses taught by industry experts with real-world experience. Access course content on any device, anywhere, anytime. In-depth modules covering all key aspects of the subject. Complete the course at your own pace with no time limits. Enjoy unrestricted access to all course materials and updates for life. Reviews 4.98 out of 5 55 total reviews 5 stars 4 stars 3 stars 2 stars 1 star EA Erica Anthony 8 days ago I’ve only been enrolled in Chase’s course for about a month, and I’m already seeing a huge difference in my sales! I had no prior experience with Facebook ads, but now I’m confidently running my own ad account — no more relying on an agency. Chase breaks everything down in a way that’s super easy to... Show more Written 1 month after purchase RG Riley Garden 11 days ago Working with Chase and his team has been a total game-changer. Sean’s coaching on media buying has completely transformed the way I look at ads. I used to just run everything broad, but now I understand how to strategically scale using advanced targeting and data-driven optimization. The software st... Show more Written 1 month after purchase ST SANDY TZATZOU 20 days ago Thanks to Chase and his team — Jake, Sean, and Myles — for being a huge help to my business. I’m genuinely grateful for the clarity and direction they’ve brought to my brand. Chase has this rare ability to simplify complex systems while making you think differently and act smarter. The team is great... Show more Written 8 months after purchase RF Raeem Farooq 1 month ago I joined the program 2 weeks ago! This program has been amazing. Specially thanks to Jake! He has been explaining and guiding me a lot! Written 18 days after purchase See all reviews About the creator CC View profile Chase Chappell @ chaseca • Joined Jul 2024 Chase Chappell, founder of Sirge.com, is a serial entrepreneur and expert in Facebook and TikTok ads, advising on over $200M in ad spend. He leads the Ads Mastery Mentorship program and is a partner at DOE Media, an agency recognized by Inc. 5000 as one the the fastest growing company in the US. FAQs Is there a time limit to complete the mentorship? Is This A true 1-on-1 Mentorship? &quot;I Don&#x27;t Have A Business Yet&quot; Do I Get On-Going Support? Affiliates CC Become an affiliate Chase Chappell 30% reward Earn money by bringing customers to Chase Chappell. Every time a customer purchases using your link, you&#x27;ll earn a commission. 100 Creative™ No available pricing options DM the creator to notify them No available pricing options DM the creator to notify them 100 Creative™ | Whop",
  "finalUrl": "https://whop.com/1on1-ads-mastery-mentorship-ecom/100-creativetm/",
  "fetchedAt": "2025-11-04T18:10:42.049Z",
  "textHash": "e2f1afe6a8bc2a8f839ea067acd34fb0b5d4849f74d1e1325a586423cf05da9e",
  "drilled": false
}