{
  "baseUrl": "https://whop.com/vnkumartrades/vnkumar10kto50kchallenge/",
  "title": "10KTO50K CHALLENGE ELITE PLAN | Whop",
  "h1": "10KTO50K CHALLENGE ELITE PLAN",
  "bullets": [
    "Sign in V 10KTO50K CHALLENGE ELITE PLAN 3.9 ( 58 ) Trading $149.00 / month Pay Join Features Live screenshot of every play with entry and exit.",
    "Entry and exit every alert with screenshot will be posted",
    "Access to private telegram alert group",
    "Contract size and expiration will be posted in the alert.",
    "CC Chirag Chaudhari 1 month ago Very good at trading Written 4 months after purchase",
    "SC Saravanan Chinniah 9 months ago Kumar is an amazing trader with good return rate on his strangles! Appreciate and keep it up. Written 21 days after purchase",
    "NU Nageswara R Uppuluri 9 months ago King of Strangle player, always play on safe bet. Written 1 year after purchase",
    "S SKK 9 months ago Great Strangle player.. Safe calls!! Written 22 days after purchase"
  ],
  "paras": [
    "Sign in V 10KTO50K CHALLENGE ELITE PLAN 3.9 ( 58 ) Trading $149.00 / month Pay Join Features Live screenshot of every play with entry and exit. Entry and exit every alert with screenshot will be posted Access to private telegram alert group Contract size and expiration will be posted in the alert. Reviews 3.91 out of 5 58 total reviews 5 stars 4 stars 3 stars 2 stars 1 star CC Chirag Chaudhari 1 month ago Very good at trading",
    "9 months ago Kumar is an amazing trader with good return rate on his strangles! Appreciate and keep it up.",
    "9 months ago King of Strangle player, always play on safe bet.",
    "9 months ago Great Strangle player.. Safe calls!!",
    "About the creator VT View profile vnkumar trades @ vnkumartrades • Joined Feb 2023 Affiliates V Become an affiliate vnkumartrades 20% reward Earn money by bringing customers to vnkumartrades. Every time a customer purchases using your link, you&#x27;ll earn a commission."
  ],
  "priceTokens": [
    "$149.00",
    "$149.00",
    "$149.00",
    "$1",
    "$1",
    "$1",
    "$22",
    "$1",
    "$1",
    "$1",
    "$1",
    "$1",
    "$2",
    "$1",
    "$2",
    "$2",
    "$2",
    "$2",
    "$3",
    "$3"
  ],
  "faq": [],
  "textSample": "Sign in V 10KTO50K CHALLENGE ELITE PLAN 3.9 ( 58 ) Trading $149.00 / month Pay Join Features Live screenshot of every play with entry and exit. Entry and exit every alert with screenshot will be posted Access to private telegram alert group Contract size and expiration will be posted in the alert. Reviews 3.91 out of 5 58 total reviews 5 stars 4 stars 3 stars 2 stars 1 star CC Chirag Chaudhari 1 month ago Very good at trading Written 4 months after purchase SC Saravanan Chinniah 9 months ago Kumar is an amazing trader with good return rate on his strangles! Appreciate and keep it up. Written 21 days after purchase NU Nageswara R Uppuluri 9 months ago King of Strangle player, always play on safe bet. Written 1 year after purchase S SKK 9 months ago Great Strangle player.. Safe calls!! Written 22 days after purchase See all reviews About the creator VT View profile vnkumar trades @ vnkumartrades • Joined Feb 2023 Affiliates V Become an affiliate vnkumartrades 20% reward Earn money by bringing customers to vnkumartrades. Every time a customer purchases using your link, you&#x27;ll earn a commission. 10KTO50K CHALLENGE ELITE PLAN $149.00 / month +1 option Join $149.00 / month 1 option Pay Join Pay Join 10KTO50K CHALLENGE ELITE PLAN | Whop",
  "finalUrl": "https://whop.com/vnkumartrades/vnkumar10kto50kchallenge/",
  "fetchedAt": "2025-11-04T18:09:25.639Z",
  "textHash": "d8246c9fe8afad36822ebfdbfe5e570bc99bd22f61bd4c2abeafb4ae02f2f860",
  "drilled": false
}