{
  "baseUrl": "https://whop.com/luxury-picks-subscription/?a=alexburnett21",
  "title": "Luxury Picks | Whop",
  "h1": "Luxury Picks",
  "bullets": [
    "Powered by LP Luxury Picks I&#x27;ve dedicated my career to mastering the art of sports betting, focusing on analysis and strategy to deliver profitable picks. My goal is to ensure every client enjoys the thrill of sports with a win... More 5.0 ( 21 ) Contact seller Products Unmute $99.99 / month Free trial 3 DAYS FREE Luxury Picks Lock Sport Picks for VIPâ€™sğŸ” 4.9 ( 18 ) $49.99 / 2 weeks Lock Sports Picks for VIP MembersğŸ” Luxury Picks 2 Weeks 5.0 ( 2 ) Free Access Free Sports Picks on Telegram! Luxury Picks FREE (Not VIP) 5.0 ( 1 ) Contact seller Reviews DD Dhamalie Dias â€¢ Lock Sport Picks for VIPâ€™sğŸ” 7 months ago Crodie is the G.O.A.T at Betting frfr! Imagine being on the 7th streak of winning dollarzzz. What I rate about the guy is he doesnâ€™t bet on all game. He utilizes a strategic plan which the vast majority of times end up being successfulğŸ™ Highly recommend subscribing! Written 5 days after purchase",
    "EA Emmanuel Abule â€¢ Lock Sport Picks for VIPâ€™sğŸ” 7 months ago Just wanna let yall know itâ€™s legit just pay attention u should be alright he wonâ€™t stir you with mutiple foul plays Written 15 days after purchase",
    "F Finnsae1 â€¢ Luxury Picks 2 Weeks 7 months ago Really professional and respectful with quick response. Written 11 days after purchase",
    "YH Youssouf Hajji â€¢ Lock Sport Picks for VIPâ€™sğŸ” 7 months ago good predictions, and profit almost guaranteed over the long termâœ… Written 1 month after purchase"
  ],
  "paras": [
    "LP Luxury Picks I&#x27;ve dedicated my career to mastering the art of sports betting, focusing on analysis and strategy to deliver profitable picks. My goal is to ensure every client enjoys the thrill of sports with a win... More 5.0 ( 21 ) Contact seller Products Unmute $99.99 / month Free trial 3 DAYS FREE Luxury Picks Lock Sport Picks for VIPâ€™sğŸ” 4.9 ( 18 ) $49.99 / 2 weeks Lock Sports Picks for VIP MembersğŸ” Luxury Picks 2 Weeks 5.0 ( 2 ) Free Access Free Sports Picks on Telegram! Luxury Picks FREE (Not VIP) 5.0 ( 1 ) Contact seller Reviews DD Dhamalie Dias â€¢ Lock Sport Picks for VIPâ€™sğŸ” 7 months ago Crodie is the G.O.A.T at Betting frfr! Imagine being on the 7th streak of winning dollarzzz. What I rate about the guy is he doesnâ€™t bet on all game. He utilizes a strategic plan which the vast majority of times end up being successfulğŸ™ Highly recommend subscribing!",
    "7 months ago Just wanna let yall know itâ€™s legit just pay attention u should be alright he wonâ€™t stir you with mutiple foul plays",
    "7 months ago Really professional and respectful with quick response.",
    "7 months ago good predictions, and profit almost guaranteed over the long termâœ…"
  ],
  "priceTokens": [
    "$99.99",
    "$49.99",
    "$1",
    "$1",
    "$1",
    "$21",
    "$1",
    "$1",
    "$1",
    "$1",
    "$28",
    "$1",
    "$28",
    "$28",
    "$28",
    "$28",
    "$3",
    "$3",
    "$3",
    "$10"
  ],
  "faq": [],
  "textSample": "Powered by LP Luxury Picks I&#x27;ve dedicated my career to mastering the art of sports betting, focusing on analysis and strategy to deliver profitable picks. My goal is to ensure every client enjoys the thrill of sports with a win... More 5.0 ( 21 ) Contact seller Products Unmute $99.99 / month Free trial 3 DAYS FREE Luxury Picks Lock Sport Picks for VIPâ€™sğŸ” 4.9 ( 18 ) $49.99 / 2 weeks Lock Sports Picks for VIP MembersğŸ” Luxury Picks 2 Weeks 5.0 ( 2 ) Free Access Free Sports Picks on Telegram! Luxury Picks FREE (Not VIP) 5.0 ( 1 ) Contact seller Reviews DD Dhamalie Dias â€¢ Lock Sport Picks for VIPâ€™sğŸ” 7 months ago Crodie is the G.O.A.T at Betting frfr! Imagine being on the 7th streak of winning dollarzzz. What I rate about the guy is he doesnâ€™t bet on all game. He utilizes a strategic plan which the vast majority of times end up being successfulğŸ™ Highly recommend subscribing! Written 5 days after purchase EA Emmanuel Abule â€¢ Lock Sport Picks for VIPâ€™sğŸ” 7 months ago Just wanna let yall know itâ€™s legit just pay attention u should be alright he wonâ€™t stir you with mutiple foul plays Written 15 days after purchase F Finnsae1 â€¢ Luxury Picks 2 Weeks 7 months ago Really professional and respectful with quick response. Written 11 days after purchase YH Youssouf Hajji â€¢ Lock Sport Picks for VIPâ€™sğŸ” 7 months ago good predictions, and profit almost guaranteed over the long termâœ… Written 1 month after purchase See all reviews Luxury Picks | Whop",
  "finalUrl": "https://whop.com/luxury-picks-subscription/?a=alexburnett21",
  "fetchedAt": "2025-11-04T18:09:26.439Z",
  "textHash": "1874945eb53ca52b55a4cb5e1d031cbd1bf59722b1c13a15d95ff53aa5e36f2b",
  "drilled": false
}