{
  "baseUrl": "https://whop.com/4-leaf-clovers/3-leaf-clover/",
  "title": "3 Leaf Clover | Whop",
  "h1": "3 Leaf Clover",
  "bullets": [
    "Sign in Unmute Unmute CT 3 Leaf Clover Unlock Premium Alerts And Watch List 4.7 ( 19 ) Trading Join us to access exclusive trading alerts and watch list. Watch 7 Figure traders trade in real time. $125.00 / month Pay Shop now Join 49 members Features ➕Access To Private Channels In Our Discord",
    "➕Daily Watchlist, delivered in our private discord channel.",
    "➕Daily Alerts From The Clovers, as well as, other great traders, like Tim G",
    "➖Weekly Webinars",
    "➖Weekly Webinar Recordings",
    "DA Daniel Abernathy 14 days ago The best trading decision I've made was joining the 4 leaf. The captains are great, as well as the community in the Discord. Written 25 days after purchase",
    "GZ Giordan Zeas 8 months ago Worth it! great for beginners for sure! Written 2 hours after purchase",
    "JD Jordan Dodds 9 months ago (4 leaf subscriber) Great community/discord, a lot of value here with the automated custom alerts as well as the daily watchlist and frequent updates from the team. The content itself is endless (in a good way) and packed with value + the competency of the guys in what they do, the passion they hav... Show more Written 1 day after purchase",
    "AH Anders Heier 9 months ago Great for beginners Written 17 hours after purchase"
  ],
  "paras": [
    "Sign in Unmute Unmute CT 3 Leaf Clover Unlock Premium Alerts And Watch List 4.7 ( 19 ) Trading Join us to access exclusive trading alerts and watch list. Watch 7 Figure traders trade in real time.",
    "$125.00 / month Pay Shop now Join 49 members Features ➕Access To Private Channels In Our Discord ➕Daily Watchlist, delivered in our private discord channel. ➕Daily Alerts From The Clovers, as well as, other great traders, like Tim G ➖Weekly Webinars ➖Weekly Webinar Recordings Reviews 4.68 out of 5 19 total reviews 5 stars 4 stars 3 stars 2 stars 1 star DA Daniel Abernathy 14 days ago The best trading decision I've made was joining the 4 leaf. The captains are great, as well as the community in the Discord.",
    "8 months ago Worth it! great for beginners for sure!",
    "9 months ago (4 leaf subscriber) Great community/discord, a lot of value here with the automated custom alerts as well as the daily watchlist and frequent updates from the team. The content itself is endless (in a good way) and packed with value + the competency of the guys in what they do, the passion they hav...",
    "Written 1 day after purchase AH Anders Heier 9 months ago Great for beginners",
    "About the creator CT View profile Clover Team @ yamihiro • Joined Jan 2023 We are Clover Trading. What sets us apart is that all of our educators, Kyle (middle), Dom(Left), and Huddie(Right), are seven-figure traders with third-party verified track records. At Clover Trading, you&#x27;ll learn multiple strategies both long and short, giving you a competitive edge whether you&#x27;re new to trading or looking for a strong community to grow with Clover is the only place to be. FAQs How do I view the webinars? What is your refund policy? Will I be learning from people who actually trade? How do I access my content? Affiliates CT Become an affiliate Clover Trading 30% reward Earn money by bringing customers to Clover Trading. Every time a customer purchases using your link, you&#x27;ll earn a commission."
  ],
  "priceTokens": [
    "$125.00",
    "$125.00",
    "$125.00",
    "$1",
    "$1",
    "$1",
    "$22",
    "$1",
    "$1",
    "$1",
    "$1",
    "$1",
    "$2",
    "$1",
    "$2",
    "$2",
    "$2",
    "$2",
    "$3",
    "$3"
  ],
  "faq": [],
  "textSample": "Sign in Unmute Unmute CT 3 Leaf Clover Unlock Premium Alerts And Watch List 4.7 ( 19 ) Trading Join us to access exclusive trading alerts and watch list. Watch 7 Figure traders trade in real time. $125.00 / month Pay Shop now Join 49 members Features ➕Access To Private Channels In Our Discord ➕Daily Watchlist, delivered in our private discord channel. ➕Daily Alerts From The Clovers, as well as, other great traders, like Tim G ➖Weekly Webinars ➖Weekly Webinar Recordings Reviews 4.68 out of 5 19 total reviews 5 stars 4 stars 3 stars 2 stars 1 star DA Daniel Abernathy 14 days ago The best trading decision I've made was joining the 4 leaf. The captains are great, as well as the community in the Discord. Written 25 days after purchase GZ Giordan Zeas 8 months ago Worth it! great for beginners for sure! Written 2 hours after purchase JD Jordan Dodds 9 months ago (4 leaf subscriber) Great community/discord, a lot of value here with the automated custom alerts as well as the daily watchlist and frequent updates from the team. The content itself is endless (in a good way) and packed with value + the competency of the guys in what they do, the passion they hav... Show more Written 1 day after purchase AH Anders Heier 9 months ago Great for beginners Written 17 hours after purchase See all reviews About the creator CT View profile Clover Team @ yamihiro • Joined Jan 2023 We are Clover Trading. What sets us apart is that all of our educators, Kyle (middle), Dom(Left), and Huddie(Right), are seven-figure traders with third-party verified track records. At Clover Trading, you&#x27;ll learn multiple strategies both long and short, giving you a competitive edge whether you&#x27;re new to trading or looking for a strong community to grow with Clover is the only place to be. FAQs How do I view the webinars? What is your refund policy? Will I be learning from people who actually trade? How do I access my content? Affiliates CT Become an affiliate Clover Trading 30% reward Earn money by bringing customers to Clover Trading. Every time a customer purchases using your link, you&#x27;ll earn a commission. 3 Leaf Clover $125.00 / month +3 options Shop now $125.00 / month 3 options Pay Shop now Pay Shop now 3 Leaf Clover | Whop",
  "finalUrl": "https://whop.com/4-leaf-clovers/3-leaf-clover/",
  "fetchedAt": "2025-11-04T18:09:26.083Z",
  "textHash": "e96ae13c4b80c5890677dd982fc5f63a78907d4ea8982fc1bd634ce0982bf3d8",
  "drilled": false
}