{
  "baseUrl": "https://whop.com/3m-trading/?a=alexburnett21",
  "title": "Razza Trades | Whop",
  "h1": "Razza Trades",
  "bullets": [
    "Powered by RT Razza Trades I&#x27;m Raza, founder of 3M Trading. This mentorship program is designed to provide high-quality trading signals, real-time education, and a supportive community. With years of experience, I’m dedicated t... More 4.9 ( 322 ) Contact seller Products Unmute $100.00 / month Achieve Profitable Trading with Razza&#x27;s Trading Mentorship Raza&#x27;s VIP Mentorship Access 4.9 ( 174 ) Free THE ONLY TRADING COURSE YOU&#x27;LL NEED AND YES IT&#x27;S FREE Raza Trades Free Course 4.8 ( 82 ) Contact seller Reviews G GroblerTV • Raza Trades Free Course 4 days ago First time getting into trading and doing it here. so far it's been a lot to take in and I'm having patience and trying to learn as much as I can. I enjoy this friendly and like minded community and big shout out to Raza and the team for bring so much valuable information and guidance. 3M Winning! Written 3 days after purchase",
    "CP Chris Payne • Raza Trades Free Course 7 days ago 3m 4 lyfe Written 5 months after purchase",
    "P Pawann • Raza&#x27;s VIP Mentorship Access 15 days ago 3m trading is the best. got me funded and many others members with the trading strategy, highly recommend joining if you want to be locked in and stack some $. Written 1 year after purchase",
    "HB Hussein Babiker • Raza&#x27;s VIP Mentorship Access 15 days ago Great Written 10 months after purchase"
  ],
  "paras": [
    "RT Razza Trades I&#x27;m Raza, founder of 3M Trading. This mentorship program is designed to provide high-quality trading signals, real-time education, and a supportive community. With years of experience, I’m dedicated t... More 4.9 ( 322 ) Contact seller Products Unmute $100.00 / month Achieve Profitable Trading with Razza&#x27;s Trading Mentorship Raza&#x27;s VIP Mentorship Access 4.9 ( 174 ) Free THE ONLY TRADING COURSE YOU&#x27;LL NEED AND YES IT&#x27;S FREE Raza Trades Free Course 4.8 ( 82 ) Contact seller Reviews G GroblerTV • Raza Trades Free Course 4 days ago First time getting into trading and doing it here. so far it's been a lot to take in and I'm having patience and trying to learn as much as I can. I enjoy this friendly and like minded community and big shout out to Raza and the team for bring so much valuable information and guidance. 3M Winning!",
    "7 days ago 3m 4 lyfe",
    "15 days ago 3m trading is the best. got me funded and many others members with the trading strategy, highly recommend joining if you want to be locked in and stack some $.",
    "15 days ago Great"
  ],
  "priceTokens": [
    "$100.00",
    "$1",
    "$1",
    "$1",
    "$21",
    "$1",
    "$1",
    "$1",
    "$1",
    "$28",
    "$1",
    "$28",
    "$28",
    "$28",
    "$28",
    "$3",
    "$3",
    "$3",
    "$10",
    "$100,000"
  ],
  "faq": [],
  "textSample": "Powered by RT Razza Trades I&#x27;m Raza, founder of 3M Trading. This mentorship program is designed to provide high-quality trading signals, real-time education, and a supportive community. With years of experience, I’m dedicated t... More 4.9 ( 322 ) Contact seller Products Unmute $100.00 / month Achieve Profitable Trading with Razza&#x27;s Trading Mentorship Raza&#x27;s VIP Mentorship Access 4.9 ( 174 ) Free THE ONLY TRADING COURSE YOU&#x27;LL NEED AND YES IT&#x27;S FREE Raza Trades Free Course 4.8 ( 82 ) Contact seller Reviews G GroblerTV • Raza Trades Free Course 4 days ago First time getting into trading and doing it here. so far it's been a lot to take in and I'm having patience and trying to learn as much as I can. I enjoy this friendly and like minded community and big shout out to Raza and the team for bring so much valuable information and guidance. 3M Winning! Written 3 days after purchase CP Chris Payne • Raza Trades Free Course 7 days ago 3m 4 lyfe Written 5 months after purchase P Pawann • Raza&#x27;s VIP Mentorship Access 15 days ago 3m trading is the best. got me funded and many others members with the trading strategy, highly recommend joining if you want to be locked in and stack some $. Written 1 year after purchase HB Hussein Babiker • Raza&#x27;s VIP Mentorship Access 15 days ago Great Written 10 months after purchase See all reviews Razza Trades | Whop",
  "finalUrl": "https://whop.com/3m-trading/?a=alexburnett21",
  "fetchedAt": "2025-11-04T18:09:25.074Z",
  "textHash": "4aaa8e82641afdf4757096cad0c9798a8f9452b3f0c76d6e72d2b50110345559",
  "drilled": false
}