{
  "baseUrl": "https://whop.com/4orte/tarotiktokupgrade/",
  "title": "4ORTE TikTok Upgrade | Whop",
  "h1": "4ORTE TikTok Upgrade",
  "bullets": [
    "4ORTE TikTok Upgrade | Whop Sign in 4ORTE TikTok Upgrade Master TikTok &amp; Earn $10K+/Month 4.8 ( 144 ) Social media Unlock the secrets to consistently going viral and earning thousands every month through TikTok Creator Rewards and TikTok Shop. $50.00 / month Pay Join Join 269 members Features Handmade video tutorials with secret tips to go viral ğŸ“½",
    "Weekly Discord calls for live guidance and Q&amp;A ğŸ“²",
    "24/7 assistance from top coaches in an exclusive Discord ğŸ¤",
    "Constantly updated best niches and products for TikTok Shop ğŸ›ï¸",
    "Editing assets including presets, overlays, and sound effects ğŸ’»",
    "V Vitor 1 day ago very helpful and amazing content in the upgrade, canâ€™t wait to make it to the inner circle! Written 6 days after purchase",
    "VN Viet Nguyen 4 days ago I like it Written 5 days after purchase",
    "NF Nancy F 21 days ago Very informative. Iâ€™ve not seen anyone give this much info out for free. Thank you x Written 17 days after purchase",
    "M m4mory 1 month ago good basics Written 2 months after purchase"
  ],
  "paras": [
    "Sign in 4ORTE TikTok Upgrade Master TikTok &amp; Earn $10K+/Month 4.8 ( 144 ) Social media Unlock the secrets to consistently going viral and earning thousands every month through TikTok Creator Rewards and TikTok Shop.",
    "$50.00 / month Pay Join Join 269 members Features Handmade video tutorials with secret tips to go viral ğŸ“½ Weekly Discord calls for live guidance and Q&amp;A ğŸ“² 24/7 assistance from top coaches in an exclusive Discord ğŸ¤ Constantly updated best niches and products for TikTok Shop ğŸ›ï¸ Editing assets including presets, overlays, and sound effects ğŸ’» Reviews 4.78 out of 5 144 total reviews 5 stars 4 stars 3 stars 2 stars 1 star V Vitor 1 day ago very helpful and amazing content in the upgrade, canâ€™t wait to make it to the inner circle!",
    "4 days ago I like it",
    "21 days ago Very informative. Iâ€™ve not seen anyone give this much info out for free. Thank you x",
    "1 month ago good basics",
    "About the creator View profile 4ORTE @ 4orte â€¢ Joined Feb 2024 I&#x27;m Taro. I&#x27;ve spent years mastering TikTok&#x27;s algorithms and monetization methods. This course compiles everything I know to help you earn $10,000+ monthly through TikTok. I&#x27;m passionate about sharing these strategies so you can achieve financial freedom. FAQs How long until I start earning money? What do I need to get started? Will the course be updated? Affiliates Become an affiliate 4ORTE 10% reward Earn money by bringing customers to 4ORTE. Every time a customer purchases using your link, you&#x27;ll earn a commission."
  ],
  "priceTokens": [
    "$10",
    "$50.00",
    "$10,000",
    "$50.00",
    "$50.00",
    "$1",
    "$1",
    "$1",
    "$22",
    "$1",
    "$1",
    "$1",
    "$1",
    "$1",
    "$2",
    "$1",
    "$2",
    "$2",
    "$2",
    "$2"
  ],
  "faq": [],
  "textSample": "4ORTE TikTok Upgrade | Whop Sign in 4ORTE TikTok Upgrade Master TikTok &amp; Earn $10K+/Month 4.8 ( 144 ) Social media Unlock the secrets to consistently going viral and earning thousands every month through TikTok Creator Rewards and TikTok Shop. $50.00 / month Pay Join Join 269 members Features Handmade video tutorials with secret tips to go viral ğŸ“½ Weekly Discord calls for live guidance and Q&amp;A ğŸ“² 24/7 assistance from top coaches in an exclusive Discord ğŸ¤ Constantly updated best niches and products for TikTok Shop ğŸ›ï¸ Editing assets including presets, overlays, and sound effects ğŸ’» Reviews 4.78 out of 5 144 total reviews 5 stars 4 stars 3 stars 2 stars 1 star V Vitor 1 day ago very helpful and amazing content in the upgrade, canâ€™t wait to make it to the inner circle! Written 6 days after purchase VN Viet Nguyen 4 days ago I like it Written 5 days after purchase NF Nancy F 21 days ago Very informative. Iâ€™ve not seen anyone give this much info out for free. Thank you x Written 17 days after purchase M m4mory 1 month ago good basics Written 2 months after purchase See all reviews About the creator View profile 4ORTE @ 4orte â€¢ Joined Feb 2024 I&#x27;m Taro. I&#x27;ve spent years mastering TikTok&#x27;s algorithms and monetization methods. This course compiles everything I know to help you earn $10,000+ monthly through TikTok. I&#x27;m passionate about sharing these strategies so you can achieve financial freedom. FAQs How long until I start earning money? What do I need to get started? Will the course be updated? Affiliates Become an affiliate 4ORTE 10% reward Earn money by bringing customers to 4ORTE. Every time a customer purchases using your link, you&#x27;ll earn a commission. 4ORTE TikTok Upgrade $50.00 / month +1 option Join $50.00 / month 1 option Pay Join Pay Join",
  "finalUrl": "https://whop.com/4orte/tarotiktokupgrade/",
  "fetchedAt": "2025-11-05T17:29:37.196Z",
  "textHash": "5370657fdfd3bfd404073b19b5d3d59745876074717656f53f285cdeec247d75",
  "drilled": false
}