{
  "baseUrl": "https://whop.com/premium-membership-7e-8c6f/a-z-trading-guide/",
  "title": "A-Z Trading Guide ðŸ“– | Whop",
  "h1": "A-Z Trading Guide ðŸ“–",
  "bullets": [
    "Sign in OI A-Z Trading Guide ðŸ“– Master trading with advanced time/price models &amp; psychology. 5.0 ( 42 ) Trading Learn why time is the most important factor within trading. Master time &amp; price with the models, concepts, risk management, and psychology contentâ€”perfect for all types of traders. $50.00 one-time purchase Pay Join Features 12+ Concepts",
    "3+ Models",
    "Physcology",
    "Risk Management",
    "Future Updates to the Guide",
    "T TL 18 days ago Bucko has excellent knowledge on QT and has helped add clarity and conviction to my trading Written 4 days after purchase",
    "O OSAMA 23 days ago Best information Written 2 days after purchase",
    "R relle0074 1 month ago Has given me more clarity on my trading analysis and taken the emotion out it all. Finally an uncomplicated way to trade and so well explained and supported. Thank you Written 3 months after purchase",
    "P PmacTrades 1 month ago Bucko is the absolute GOAT, I have learned so much important information from him and now trading with QT concepts have become so much more clear. Forever grateful for his teachings! Written 1 month after purchase"
  ],
  "paras": [
    "Sign in OI A-Z Trading Guide ðŸ“– Master trading with advanced time/price models &amp; psychology. 5.0 ( 42 ) Trading Learn why time is the most important factor within trading. Master time &amp; price with the models, concepts, risk management, and psychology contentâ€”perfect for all types of traders.",
    "12+ Concepts 3+ Models Physcology Risk Management Future Updates to the Guide Reviews 5 out of 5 42 total reviews 5 stars 4 stars 3 stars 2 stars 1 star T TL 18 days ago Bucko has excellent knowledge on QT and has helped add clarity and conviction to my trading",
    "23 days ago Best information",
    "1 month ago Has given me more clarity on my trading analysis and taken the emotion out it all. Finally an uncomplicated way to trade and so well explained and supported. Thank you",
    "1 month ago Bucko is the absolute GOAT, I have learned so much important information from him and now trading with QT concepts have become so much more clear. Forever grateful for his teachings!",
    "About the creator B View profile bucko @ buckotrades â€¢ Joined Jan 2023 Iâ€™m a dedicated trader with years of experience, offering an exclusive teaching service to help you succeed in the markets. Whether you&#x27;re a beginner or experienced, I&#x27;ll guide you through proven strategies, risk management, and market analysis. My goal is to equip you with the skills and confidence to consistently win trades and read the markets so you know exactly when and where price will move. FAQs Is Oracle Insight&#x27;s beginner friendly? What is the main goal of Oracle Insights? How often do you give analysis? What assets do your provide analysis for? What time do you live trade? Affiliates OI Become an affiliate Oracle Insights 25% reward Earn money by bringing customers to Oracle Insights. Every time a customer purchases using your link, you&#x27;ll earn a commission."
  ],
  "priceTokens": [
    "$50.00",
    "$50.00",
    "$50.00",
    "$1",
    "$1",
    "$1",
    "$22",
    "$1",
    "$1",
    "$1",
    "$1",
    "$1",
    "$2",
    "$1",
    "$2",
    "$2",
    "$2",
    "$2",
    "$3",
    "$3"
  ],
  "faq": [],
  "textSample": "Sign in OI A-Z Trading Guide ðŸ“– Master trading with advanced time/price models &amp; psychology. 5.0 ( 42 ) Trading Learn why time is the most important factor within trading. Master time &amp; price with the models, concepts, risk management, and psychology contentâ€”perfect for all types of traders. $50.00 one-time purchase Pay Join Features 12+ Concepts 3+ Models Physcology Risk Management Future Updates to the Guide Reviews 5 out of 5 42 total reviews 5 stars 4 stars 3 stars 2 stars 1 star T TL 18 days ago Bucko has excellent knowledge on QT and has helped add clarity and conviction to my trading Written 4 days after purchase O OSAMA 23 days ago Best information Written 2 days after purchase R relle0074 1 month ago Has given me more clarity on my trading analysis and taken the emotion out it all. Finally an uncomplicated way to trade and so well explained and supported. Thank you Written 3 months after purchase P PmacTrades 1 month ago Bucko is the absolute GOAT, I have learned so much important information from him and now trading with QT concepts have become so much more clear. Forever grateful for his teachings! Written 1 month after purchase See all reviews About the creator B View profile bucko @ buckotrades â€¢ Joined Jan 2023 Iâ€™m a dedicated trader with years of experience, offering an exclusive teaching service to help you succeed in the markets. Whether you&#x27;re a beginner or experienced, I&#x27;ll guide you through proven strategies, risk management, and market analysis. My goal is to equip you with the skills and confidence to consistently win trades and read the markets so you know exactly when and where price will move. FAQs Is Oracle Insight&#x27;s beginner friendly? What is the main goal of Oracle Insights? How often do you give analysis? What assets do your provide analysis for? What time do you live trade? Affiliates OI Become an affiliate Oracle Insights 25% reward Earn money by bringing customers to Oracle Insights. Every time a customer purchases using your link, you&#x27;ll earn a commission. A-Z Trading Guide ðŸ“– $50.00 one-time purchase Join $50.00 one-time purchase Pay Join Pay Join A-Z Trading Guide ðŸ“– | Whop",
  "finalUrl": "https://whop.com/premium-membership-7e-8c6f/a-z-trading-guide/",
  "fetchedAt": "2025-11-05T10:04:19.789Z",
  "textHash": "6701d062def602deff71c7dc7d7a5d87fbf75e32825ee9630d8711bc91f41848",
  "drilled": false
}