{
  "baseUrl": "https://whop.com/access-07/?a=alexburnett21",
  "title": "The New Era | Whop",
  "h1": "The New Era",
  "bullets": [
    "Powered by TE The New Era 4.5 ( 14 ) Contact seller Products Â£99.00 / month The New Era - Daily Financial Education in 5 Minutes Tech Attitude LTD New Â£350.00 Deposit Deposit New Â£1.00 Get access to my gold signal group Limited action gold group 4.5 ( 13 ) Contact seller Reviews S Socrate 111 â€¢ Limited action gold group 1 month ago I hope this is gonna be epic like Switzyman style Written 5 hours after purchase",
    "S Sam â€¢ Limited action gold group 1 month ago I'm excited ğŸ’ªğŸ¼ Written 5 hours after purchase",
    "LC Lee Cradock 2 months ago Awesome Written 2 days after purchase",
    "M Maureen â€¢ Limited action gold group 1 month ago Written 18 days after purchase"
  ],
  "paras": [
    "TE The New Era 4.5 ( 14 ) Contact seller Products Â£99.00 / month The New Era - Daily Financial Education in 5 Minutes Tech Attitude LTD New Â£350.00 Deposit Deposit New Â£1.00 Get access to my gold signal group Limited action gold group 4.5 ( 13 ) Contact seller Reviews S Socrate 111 â€¢ Limited action gold group 1 month ago I hope this is gonna be epic like Switzyman style",
    "1 month ago I'm excited ğŸ’ªğŸ¼",
    "2 months ago Awesome",
    "1 month ago"
  ],
  "priceTokens": [
    "Â£99.00",
    "Â£350.00",
    "Â£1.00",
    "$1",
    "$1",
    "$1",
    "$21",
    "$1",
    "$1",
    "$1",
    "$1",
    "$28",
    "$1",
    "$28",
    "$28",
    "$28",
    "$28",
    "$3",
    "$3",
    "$3"
  ],
  "faq": [],
  "textSample": "Powered by TE The New Era 4.5 ( 14 ) Contact seller Products Â£99.00 / month The New Era - Daily Financial Education in 5 Minutes Tech Attitude LTD New Â£350.00 Deposit Deposit New Â£1.00 Get access to my gold signal group Limited action gold group 4.5 ( 13 ) Contact seller Reviews S Socrate 111 â€¢ Limited action gold group 1 month ago I hope this is gonna be epic like Switzyman style Written 5 hours after purchase S Sam â€¢ Limited action gold group 1 month ago I'm excited ğŸ’ªğŸ¼ Written 5 hours after purchase LC Lee Cradock 2 months ago Awesome Written 2 days after purchase M Maureen â€¢ Limited action gold group 1 month ago Written 18 days after purchase See all reviews The New Era | Whop",
  "finalUrl": "https://whop.com/access-07/?a=alexburnett21",
  "fetchedAt": "2025-11-05T09:11:57.546Z",
  "textHash": "46108bc6bcfaa3e0d58c37b5078d1969fc86bcad6b746e6a93fd6d77ed5e0321",
  "drilled": false
}