{
  "baseUrl": "https://whop.com/comunidade-alpha/?a=alexburnett21",
  "title": "Comunidade Alpha | Whop",
  "h1": "Comunidade Alpha",
  "bullets": [
    "Powered by CA Comunidade Alpha 4.9 ( 141 ) Contact seller Products Unmute â‚¬19.99 / month Aproveita a Altseason com os Melhores Acesso Alpha 4.9 ( 106 ) Unmute Free Acede Ã  parte gratuita do servidor! Acesso Gratuito 5.0 ( 33 ) â‚¬498.00 Acesso Lifetime Acesso Excellence 5.0 ( 2 ) Contact seller Reviews BP Bruno Pereira â€¢ Acesso Alpha 3 days ago top em todos os aspetos Written 4 months after purchase",
    "JS JoÃ£o SimÃµes â€¢ Acesso Alpha 4 days ago Perfeito, que comunidade Written 19 days after purchase",
    "FS Francisco Soares â€¢ Acesso Alpha 4 days ago Top Written 3 months after purchase",
    "NF Nuno Fernandes â€¢ Acesso Excellence 21 days ago Muito bomðŸ˜œðŸ’ª Written 21 days after purchase"
  ],
  "paras": [
    "CA Comunidade Alpha 4.9 ( 141 ) Contact seller Products Unmute â‚¬19.99 / month Aproveita a Altseason com os Melhores Acesso Alpha 4.9 ( 106 ) Unmute Free Acede Ã  parte gratuita do servidor! Acesso Gratuito 5.0 ( 33 ) â‚¬498.00 Acesso Lifetime Acesso Excellence 5.0 ( 2 ) Contact seller Reviews BP Bruno Pereira â€¢ Acesso Alpha 3 days ago top em todos os aspetos",
    "4 days ago Perfeito, que comunidade",
    "4 days ago Top",
    "21 days ago Muito bomðŸ˜œðŸ’ª"
  ],
  "priceTokens": [
    "â‚¬19.99",
    "â‚¬498.00",
    "$1",
    "$1",
    "$1",
    "$21",
    "$1",
    "$1",
    "$1",
    "$1",
    "$28",
    "$1",
    "$28",
    "$28",
    "$28",
    "$28",
    "$3",
    "$3",
    "$3",
    "$10"
  ],
  "faq": [],
  "textSample": "Powered by CA Comunidade Alpha 4.9 ( 141 ) Contact seller Products Unmute â‚¬19.99 / month Aproveita a Altseason com os Melhores Acesso Alpha 4.9 ( 106 ) Unmute Free Acede Ã  parte gratuita do servidor! Acesso Gratuito 5.0 ( 33 ) â‚¬498.00 Acesso Lifetime Acesso Excellence 5.0 ( 2 ) Contact seller Reviews BP Bruno Pereira â€¢ Acesso Alpha 3 days ago top em todos os aspetos Written 4 months after purchase JS JoÃ£o SimÃµes â€¢ Acesso Alpha 4 days ago Perfeito, que comunidade Written 19 days after purchase FS Francisco Soares â€¢ Acesso Alpha 4 days ago Top Written 3 months after purchase NF Nuno Fernandes â€¢ Acesso Excellence 21 days ago Muito bomðŸ˜œðŸ’ª Written 21 days after purchase See all reviews Comunidade Alpha | Whop",
  "finalUrl": "https://whop.com/comunidade-alpha/?a=alexburnett21",
  "fetchedAt": "2025-11-04T19:56:22.243Z",
  "textHash": "f0fb55afb40363bd18a3a40e2c9925e40e1b4e5015a637377e00d8690478075b",
  "drilled": false
}