{
  "baseUrl": "https://whop.com/agency-domain/ad-plus/",
  "title": "AD Plus+ | Whop",
  "h1": "AD Plus+",
  "bullets": [
    "Sign in Unmute Unmute AD AD Plus+ Each step my agency took to go from 50k to $2M a month 5.0 ( 118 ) Other The exact blueprint to take your agency the next level in operations, finance, sales, lead gen, and local. It&#x27;s time to take it to the next level. $197.00 / month Pay Join Join 5 members Features Comprehensive Courses on Ops, Sales, Lead Gen, Local, &amp; Finances",
    "Live Coaching Calls from 7, 8 and 9-figure Agencies Owners",
    "Strong Community of Verified Agency Founders",
    "Regular Access to In-Person Events all over the World",
    "A Aslan 4 months ago Very valuable group to be part of, especially for the price point it is at. Personally, I had bottlenecks around my fb ads and sales calls, which Ive received great feedback on. Their 80hr+ course filled with top industry leaders, is absolute gold. Written 16 days after purchase",
    "JD Josh Drylie 8 months ago Super blown away by what agency domain has to offer. Each call comes with so much value, the hosts of each call over deliver to the max. The only reason somebody wouldn’t join is if they hate making money Written 14 days after purchase",
    "IR Iñaki Arteaga Ruiz 8 months ago Just starting but enjoying so much the content of the course ♥️ Thank you guys. Written 11 days after purchase",
    "MD Mohamed Darwish 8 months ago Just renewed my second month, I guess I will be here learning for at least the rest of this year. I couldn't find practical info elsewhere, there is no chance for comparison with any other community. Thank You Guys Written 1 month after purchase"
  ],
  "paras": [
    "Sign in Unmute Unmute AD AD Plus+ Each step my agency took to go from 50k to $2M a month 5.0 ( 118 ) Other The exact blueprint to take your agency the next level in operations, finance, sales, lead gen, and local.",
    "It&#x27;s time to take it to the next level.",
    "$197.00 / month Pay Join Join 5 members Features Comprehensive Courses on Ops, Sales, Lead Gen, Local, &amp; Finances Live Coaching Calls from 7, 8 and 9-figure Agencies Owners Strong Community of Verified Agency Founders Regular Access to In-Person Events all over the World Reviews 4.95 out of 5 118 total reviews 5 stars 4 stars 3 stars 2 stars 1 star A Aslan 4 months ago Very valuable group to be part of, especially for the price point it is at. Personally, I had bottlenecks around my fb ads and sales calls, which Ive received great feedback on. Their 80hr+ course filled with top industry leaders, is absolute gold.",
    "8 months ago Super blown away by what agency domain has to offer. Each call comes with so much value, the hosts of each call over deliver to the max. The only reason somebody wouldn’t join is if they hate making money",
    "8 months ago Just starting but enjoying so much the content of the course ♥️ Thank you guys.",
    "8 months ago Just renewed my second month, I guess I will be here learning for at least the rest of this year. I couldn't find practical info elsewhere, there is no chance for comparison with any other community. Thank You Guys",
    "About the creator ES View profile Eddie Maalouf and Zach Schubert @ agencydomain • Joined Jun 2023 The right information and the right network have the power to transform any business... After generating over a billion dollars online, Eddie Maalouf, Zach Schubert, and Ashton Shanks came together to create Agency Domain—the coaching community they wish they had when they first started. Today, they&#x27;ve made it accessible to anyone with the drive to succeed. Welcome to Agency Domain wanderer. Affiliates AD Become an affiliate Agency Domain 30% reward Earn money by bringing customers to Agency Domain. Every time a customer purchases using your link, you&#x27;ll earn a commission."
  ],
  "priceTokens": [
    "$2",
    "$197.00",
    "$197.00",
    "$197.00",
    "$1",
    "$1",
    "$1",
    "$22",
    "$1",
    "$1",
    "$1",
    "$1",
    "$1",
    "$2",
    "$1",
    "$2",
    "$2",
    "$2",
    "$2",
    "$3"
  ],
  "faq": [],
  "textSample": "Sign in Unmute Unmute AD AD Plus+ Each step my agency took to go from 50k to $2M a month 5.0 ( 118 ) Other The exact blueprint to take your agency the next level in operations, finance, sales, lead gen, and local. It&#x27;s time to take it to the next level. $197.00 / month Pay Join Join 5 members Features Comprehensive Courses on Ops, Sales, Lead Gen, Local, &amp; Finances Live Coaching Calls from 7, 8 and 9-figure Agencies Owners Strong Community of Verified Agency Founders Regular Access to In-Person Events all over the World Reviews 4.95 out of 5 118 total reviews 5 stars 4 stars 3 stars 2 stars 1 star A Aslan 4 months ago Very valuable group to be part of, especially for the price point it is at. Personally, I had bottlenecks around my fb ads and sales calls, which Ive received great feedback on. Their 80hr+ course filled with top industry leaders, is absolute gold. Written 16 days after purchase JD Josh Drylie 8 months ago Super blown away by what agency domain has to offer. Each call comes with so much value, the hosts of each call over deliver to the max. The only reason somebody wouldn’t join is if they hate making money Written 14 days after purchase IR Iñaki Arteaga Ruiz 8 months ago Just starting but enjoying so much the content of the course ♥️ Thank you guys. Written 11 days after purchase MD Mohamed Darwish 8 months ago Just renewed my second month, I guess I will be here learning for at least the rest of this year. I couldn't find practical info elsewhere, there is no chance for comparison with any other community. Thank You Guys Written 1 month after purchase See all reviews About the creator ES View profile Eddie Maalouf and Zach Schubert @ agencydomain • Joined Jun 2023 The right information and the right network have the power to transform any business... After generating over a billion dollars online, Eddie Maalouf, Zach Schubert, and Ashton Shanks came together to create Agency Domain—the coaching community they wish they had when they first started. Today, they&#x27;ve made it accessible to anyone with the drive to succeed. Welcome to Agency Domain wanderer. Affiliates AD Become an affiliate Agency Domain 30% reward Earn money by bringing customers to Agency Domain. Every time a customer purchases using your link, you&#x27;ll earn a commission. AD Plus+ $197.00 / month +1 option Join $197.00 / month 1 option Pay Join Pay Join AD Plus+ | Whop",
  "finalUrl": "https://whop.com/agency-domain/ad-plus/",
  "fetchedAt": "2025-11-05T09:56:39.029Z",
  "textHash": "954c16343200e968e5ec1b26ed4b2f892fa4f3cdbf6824e6fd3f9b486b06c931",
  "drilled": false
}