{
  "baseUrl": "https://whop.com/7-days-free/no-bs-english-group/",
  "title": "Advanced English Community | Whop",
  "h1": "Advanced English Community",
  "bullets": [
    "Sign in Unmute Unmute Unmute Unmute AG Advanced English Community Stop Feeling Stuck. Start Speaking Fluently. 5.0 ( 4 ) Social media Live lessons, daily support, and expert guidance for advanced learners to become fluent. Overcome barriers and speak English fluently and confidently with the EQUC method! $60.00 / month 7 day trial Pay Join waitlist Features Weekly live seminars and training sessions",
    "Conversation Classes 3x a month!",
    "Daily video lessons and coaching by Teacher Ash",
    "Huge advanced video lesson library!",
    "Exclusive group discussions and quizzes",
    "AL Amel LAIDI 1 year ago Joining the No BS english group was hands down the best decision ever !! As an English tutor but non-native I often had a gazillion questions especially on specific topics and when I came accross Ash's group, it was a no-brainer for me ! Ash is very available and always comes up with new information... Show more Written 7 months after purchase",
    "AF Ambrose Fulgori 2 years ago Teacher Ash is very attentive! Congrats for you mate ğŸ‘ğŸ¼ğŸ˜Š! Written 3 days after purchase",
    "DU Deleted user 3 years ago Really good for people who want to practice speaking, improve communication skills or learn british accent. Written 2 days after purchase",
    "LK Learn Darija With KAWTAR 3 years ago Such a wonderful teacher, I enjoyed attending his classes. Fun and informative ğŸ‘ŒğŸ» Written 6 days after purchase"
  ],
  "paras": [
    "Sign in Unmute Unmute Unmute Unmute AG Advanced English Community Stop Feeling Stuck. Start Speaking Fluently. 5.0 ( 4 ) Social media Live lessons, daily support, and expert guidance for advanced learners to become fluent. Overcome barriers and speak English fluently and confidently with the EQUC method!",
    "$60.00 / month 7 day trial Pay Join waitlist Features Weekly live seminars and training sessions Conversation Classes 3x a month! Daily video lessons and coaching by Teacher Ash Huge advanced video lesson library! Exclusive group discussions and quizzes Reviews 5 out of 5 4 total reviews 5 stars 4 stars 3 stars 2 stars 1 star AL Amel LAIDI 1 year ago Joining the No BS english group was hands down the best decision ever !! As an English tutor but non-native I often had a gazillion questions especially on specific topics and when I came accross Ash's group, it was a no-brainer for me ! Ash is very available and always comes up with new information...",
    "Written 7 months after purchase AF Ambrose Fulgori 2 years ago Teacher Ash is very attentive! Congrats for you mate ğŸ‘ğŸ¼ğŸ˜Š!",
    "3 years ago Really good for people who want to practice speaking, improve communication skills or learn british accent.",
    "3 years ago Such a wonderful teacher, I enjoyed attending his classes. Fun and informative ğŸ‘ŒğŸ»",
    "FAQs Can I cancel anytime? Where are the LIVE seminars and discussions held? I&#x27;m a Beginner, can I join? Where is the group? Affiliates AG Become an affiliate Advanced Fluency Group 30% reward Earn money by bringing customers to Advanced Fluency Group. Every time a customer purchases using your link, you&#x27;ll earn a commission."
  ],
  "priceTokens": [
    "$60.00",
    "$60.00",
    "$60.00",
    "$1",
    "$1",
    "$1",
    "$22",
    "$1",
    "$1",
    "$1",
    "$1",
    "$1",
    "$2",
    "$1",
    "$2",
    "$2",
    "$2",
    "$2",
    "$3",
    "$3"
  ],
  "faq": [],
  "textSample": "Sign in Unmute Unmute Unmute Unmute AG Advanced English Community Stop Feeling Stuck. Start Speaking Fluently. 5.0 ( 4 ) Social media Live lessons, daily support, and expert guidance for advanced learners to become fluent. Overcome barriers and speak English fluently and confidently with the EQUC method! $60.00 / month 7 day trial Pay Join waitlist Features Weekly live seminars and training sessions Conversation Classes 3x a month! Daily video lessons and coaching by Teacher Ash Huge advanced video lesson library! Exclusive group discussions and quizzes Reviews 5 out of 5 4 total reviews 5 stars 4 stars 3 stars 2 stars 1 star AL Amel LAIDI 1 year ago Joining the No BS english group was hands down the best decision ever !! As an English tutor but non-native I often had a gazillion questions especially on specific topics and when I came accross Ash's group, it was a no-brainer for me ! Ash is very available and always comes up with new information... Show more Written 7 months after purchase AF Ambrose Fulgori 2 years ago Teacher Ash is very attentive! Congrats for you mate ğŸ‘ğŸ¼ğŸ˜Š! Written 3 days after purchase DU Deleted user 3 years ago Really good for people who want to practice speaking, improve communication skills or learn british accent. Written 2 days after purchase LK Learn Darija With KAWTAR 3 years ago Such a wonderful teacher, I enjoyed attending his classes. Fun and informative ğŸ‘ŒğŸ» Written 6 days after purchase About the creator TA View profile Teacher Ash @ teacherash â€¢ Joined Dec 2022 I&#x27;ve dedicated my career to helping English teachers sound more natural and professional. By joining this group, you&#x27;ll access secret tools, resources, and feedback to elevate your teaching career. FAQs Can I cancel anytime? Where are the LIVE seminars and discussions held? I&#x27;m a Beginner, can I join? Where is the group? Affiliates AG Become an affiliate Advanced Fluency Group 30% reward Earn money by bringing customers to Advanced Fluency Group. Every time a customer purchases using your link, you&#x27;ll earn a commission. Advanced English Community $60.00 / month +1 option Join $60.00 / month 1 option Pay Join Pay Join Advanced English Community | Whop",
  "finalUrl": "https://whop.com/7-days-free/no-bs-english-group/",
  "fetchedAt": "2025-11-05T09:34:10.957Z",
  "textHash": "9a6b69df61ba6e447957ff6cdda0eadffbbc66d822e871d61ccdaf5a088c4436",
  "drilled": false
}