{
  "baseUrl": "https://whop.com/1-on-1-amazon-mentorship-66/basic-mentorship/",
  "title": "AEmentorship Basic Mentorship | Whop",
  "h1": "AEmentorship Basic Mentorship",
  "bullets": [
    "Sign in A AEmentorship Basic Mentorship Scale your Amazon Selling Biz - Fastest + Proven Strategies. 5.0 ( 4 ) Amazon FBA Join AEuniversity&#x27;s Basic Mentorship to access discord leads, price glitches, guides, and more. Scale your Amazon entrepreneurship journey with the fastest and proven strategies. $7.99 / week Pay Join Features 90+ profitable leads delivered straight to you every month.",
    "Access to guides on software, suppliers, and business setup.",
    "Weekly group calls focusing on important categories to help you succeed.",
    "Join a community of like-minded entrepreneurs sharing success and motivation.",
    "S Shakib 9 months ago Nice guy who responds quick and drops a lot of free game recommend for beginner sellers Written 2 days after purchase",
    "JS Jake Santorini 9 months ago Really good value, highly recommend even if you‚Äôre new to selling on Amazon Written 3 days after purchase",
    "SC stake clipper 10 months ago I‚Äôve been in AEmentorship for about 2 weeks and I already hit 1k in sales. Kevin really takes pride of his work and recommend him as a mentorüëç Written 5 days after purchase",
    "N Nora 10 months ago I feel wonderful since joining this group! Such a supportive community and boundless strategies! Written 5 days after purchase"
  ],
  "paras": [
    "Sign in A AEmentorship Basic Mentorship Scale your Amazon Selling Biz - Fastest + Proven Strategies. 5.0 ( 4 ) Amazon FBA Join AEuniversity&#x27;s Basic Mentorship to access discord leads, price glitches, guides, and more. Scale your Amazon entrepreneurship journey with the fastest and proven strategies.",
    "90+ profitable leads delivered straight to you every month. Access to guides on software, suppliers, and business setup. Weekly group calls focusing on important categories to help you succeed. Join a community of like-minded entrepreneurs sharing success and motivation. Reviews 5 out of 5 4 total reviews 5 stars 4 stars 3 stars 2 stars 1 star S Shakib 9 months ago Nice guy who responds quick and drops a lot of free game recommend for beginner sellers",
    "9 months ago Really good value, highly recommend even if you‚Äôre new to selling on Amazon",
    "10 months ago I‚Äôve been in AEmentorship for about 2 weeks and I already hit 1k in sales. Kevin really takes pride of his work and recommend him as a mentorüëç",
    "10 months ago I feel wonderful since joining this group! Such a supportive community and boundless strategies!",
    "FAQs What‚Äôs the refund policy? How long does it take to start making money? How do I get help? Affiliates A Become an affiliate AEmentorship 30% reward Earn money by bringing customers to AEmentorship. Every time a customer purchases using your link, you&#x27;ll earn a commission."
  ],
  "priceTokens": [
    "$7.99",
    "$7.99",
    "$7.99",
    "$1",
    "$1",
    "$1",
    "$22",
    "$1",
    "$1",
    "$1",
    "$1",
    "$1",
    "$2",
    "$1",
    "$2",
    "$2",
    "$2",
    "$2",
    "$3",
    "$3"
  ],
  "faq": [],
  "textSample": "Sign in A AEmentorship Basic Mentorship Scale your Amazon Selling Biz - Fastest + Proven Strategies. 5.0 ( 4 ) Amazon FBA Join AEuniversity&#x27;s Basic Mentorship to access discord leads, price glitches, guides, and more. Scale your Amazon entrepreneurship journey with the fastest and proven strategies. $7.99 / week Pay Join Features 90+ profitable leads delivered straight to you every month. Access to guides on software, suppliers, and business setup. Weekly group calls focusing on important categories to help you succeed. Join a community of like-minded entrepreneurs sharing success and motivation. Reviews 5 out of 5 4 total reviews 5 stars 4 stars 3 stars 2 stars 1 star S Shakib 9 months ago Nice guy who responds quick and drops a lot of free game recommend for beginner sellers Written 2 days after purchase JS Jake Santorini 9 months ago Really good value, highly recommend even if you‚Äôre new to selling on Amazon Written 3 days after purchase SC stake clipper 10 months ago I‚Äôve been in AEmentorship for about 2 weeks and I already hit 1k in sales. Kevin really takes pride of his work and recommend him as a mentorüëç Written 5 days after purchase N Nora 10 months ago I feel wonderful since joining this group! Such a supportive community and boundless strategies! Written 5 days after purchase About the creator K View profile KB.amz @ kevinb04 ‚Ä¢ Joined Aug 2023 I founded AEmentorship to help aspiring Amazon entrepreneurs achieve their dreams. With years of experience in e-commerce, I know the challenges you face. That&#x27;s why I&#x27;ve built a community offering support, daily leads, and essential guides to ensure your success. FAQs What‚Äôs the refund policy? How long does it take to start making money? How do I get help? Affiliates A Become an affiliate AEmentorship 30% reward Earn money by bringing customers to AEmentorship. Every time a customer purchases using your link, you&#x27;ll earn a commission. AEmentorship Basic Mentorship $7.99 / week Join $7.99 / week Pay Join Pay Join AEmentorship Basic Mentorship | Whop",
  "finalUrl": "https://whop.com/1-on-1-amazon-mentorship-66/basic-mentorship/",
  "fetchedAt": "2025-11-05T17:38:44.257Z",
  "textHash": "526254e6a3abb02cce9aaadf734583b9b38060d5573857a37b64ba423065330a",
  "drilled": false
}