{
  "baseUrl": "https://whop.com/ai-signals-premium/?a=alexburnett21",
  "title": "AI Signals | Whop",
  "h1": "AI Signals",
  "bullets": [
    "Powered by AS AI Signals 4.5 ( 13 ) Contact seller Products $157.00 / month Unlock AI Trading signals AI Signals Premium 3.7 ( 3 ) $299.00 / month Unlock Market Potential with AI-Signals AI Signals Elite 2.0 ( 1 ) $995.00 Unlock AI Trading signals AI-Signals Premium New Contact seller Reviews EN Erik Nielsen 1 year ago Great tools for active traders. Highly recommend! Written 20 days after purchase",
    "EN Erik Nielsen 1 year ago Great tools for active traders. Highly recommend! Written 20 days after purchase",
    "SR Sebastian Ruckhofer • AI Signals Premium 1 year ago Good indicators, great Community. Good devs. N1 to be Here. My portfolio ist growing fast after Join this Community. Good Job ai signals Written 5 days after purchase",
    "JH Justin Hollis • AI Signals Premium 1 year ago I was skeptical at first. I think I heard about them on a random YouTube video but they got me hooked and I wanted to try it. Turns out their package is PRETTY legit dude. I use pretty much all their indicators on one chart but the reversal signals and the reversal setting on the V2 is pure money. T... Show more Written 17 days after purchase"
  ],
  "paras": [
    "AS AI Signals 4.5 ( 13 ) Contact seller Products $157.00 / month Unlock AI Trading signals AI Signals Premium 3.7 ( 3 ) $299.00 / month Unlock Market Potential with AI-Signals AI Signals Elite 2.0 ( 1 ) $995.00 Unlock AI Trading signals AI-Signals Premium New Contact seller Reviews EN Erik Nielsen 1 year ago Great tools for active traders. Highly recommend!",
    "1 year ago Great tools for active traders. Highly recommend!",
    "1 year ago Good indicators, great Community. Good devs. N1 to be Here. My portfolio ist growing fast after Join this Community. Good Job ai signals",
    "1 year ago I was skeptical at first. I think I heard about them on a random YouTube video but they got me hooked and I wanted to try it. Turns out their package is PRETTY legit dude. I use pretty much all their indicators on one chart but the reversal signals and the reversal setting on the V2 is pure money. T..."
  ],
  "priceTokens": [
    "$157.00",
    "$299.00",
    "$995.00",
    "$1",
    "$1",
    "$1",
    "$21",
    "$1",
    "$1",
    "$1",
    "$1",
    "$28",
    "$1",
    "$28",
    "$28",
    "$28",
    "$28",
    "$3",
    "$3",
    "$3"
  ],
  "faq": [],
  "textSample": "Powered by AS AI Signals 4.5 ( 13 ) Contact seller Products $157.00 / month Unlock AI Trading signals AI Signals Premium 3.7 ( 3 ) $299.00 / month Unlock Market Potential with AI-Signals AI Signals Elite 2.0 ( 1 ) $995.00 Unlock AI Trading signals AI-Signals Premium New Contact seller Reviews EN Erik Nielsen 1 year ago Great tools for active traders. Highly recommend! Written 20 days after purchase EN Erik Nielsen 1 year ago Great tools for active traders. Highly recommend! Written 20 days after purchase SR Sebastian Ruckhofer • AI Signals Premium 1 year ago Good indicators, great Community. Good devs. N1 to be Here. My portfolio ist growing fast after Join this Community. Good Job ai signals Written 5 days after purchase JH Justin Hollis • AI Signals Premium 1 year ago I was skeptical at first. I think I heard about them on a random YouTube video but they got me hooked and I wanted to try it. Turns out their package is PRETTY legit dude. I use pretty much all their indicators on one chart but the reversal signals and the reversal setting on the V2 is pure money. T... Show more Written 17 days after purchase See all reviews AI Signals | Whop",
  "finalUrl": "https://whop.com/ai-signals-premium/?a=alexburnett21",
  "fetchedAt": "2025-11-04T21:36:16.571Z",
  "textHash": "a9aeb41e6fa074373003c5d8aecde1bb013632f0c5970feacbc662fe77c9380f",
  "drilled": false
}