{
  "baseUrl": "https://whop.com/essential-traders/all-in-one-etu-indicator-package/",
  "title": "ETU Elite Indicators | Whop",
  "h1": "ETU Elite Indicators",
  "bullets": [
    "Sign in Unmute Unmute ET ETU Elite Indicators Automate Your Trading Analysis 4.9 ( 16 ) Trading Unlock the full potential of your trading strategy with the ETU Elite Indicators Package—my complete set of top-performing tools at a special discounted price (original value $1,199). POI Indicator – Automatically marks valid Points of Interest with full customization, discount/premium ranges, and up to 7 timeframe POIs on your chart. IFVG Indicator – Detects and tracks Fair Value Gaps &amp; Inverse FVGs in real time with built-in quality filtering, perfect for scalpers and intraday traders. Daily Bias Indicator – Gives daily market bias, true day open, PDH, and PDL levels. KillZone Sessions Indicator – Highlights key trading sessions, ranges, and previous session highs/lows with alerts. Structure &amp; DOL Indicator – Plots market structure (BOS, CHoCH, Sweeps) with fake vs real BOS detection and institutional order flow confirmation. Private Watermark – Customizable watermark with key market stats. ETU Elite All-in-One – Combines all indicators into one seamless script so you never have to load multiple tools again. All indicators include alert functionality to save time. These are the exact tools I use daily to achieve consistent profitability—now you can too. $49.00 / month Pay Get access Features ETU POI Indicator",
    "ETU IFVG Indicator",
    "ETU Killzone Indicator",
    "ETU Daily Bias Indicator",
    "ETU Structure/DOL Indicator + ETU All-In-One Indicator",
    "MW Marcus W 3 months ago I've been trading for 4 years and the profound knowledge found within the course has been insane. I’ve learned concepts I had never come across before, and I can now read the market with a level of clarity I didn’t think was possible. It's amazing. The weekly 1on1 private lessons have also been incr... Show more Written 9 days after purchase",
    "JP Justin Perez 3 months ago I found J through his YouTube live streams and took his advice. I got the 100RR course and went straight to backtesting. The results blew me away. The strategy is clear, effective, and delivers incredible stats. My ultimate goal is to become a full-time trader, and after learning this incredible st... Show more Written 10 days after purchase",
    "KT Kevin Tran 4 months ago The ETU Elite Indicators completely transformed my trading. At first I thought 2025 price action was just bad, but after using the indicators, it immediately CHANGED the way I view the markets now....my win rate skyrocketed thanks to the precision and easy-to-understand setups. I use them daily in m... Show more Written 6 days after purchase",
    "TS Tuneoasis Shop 6 months ago I just purchased the100RR course from J trades. And I've been killed it the last 2 weeks Along with his indicators, I'm truly learning a lot. And im gonna really make an awesome career. Thanks to Mr. J trades. Thanks Bud. Written 7 days after purchase"
  ],
  "paras": [
    "Sign in Unmute Unmute ET ETU Elite Indicators Automate Your Trading Analysis 4.9 ( 16 ) Trading Unlock the full potential of your trading strategy with the ETU Elite Indicators Package—my complete set of top-performing tools at a special discounted price (original value $1,199).",
    "POI Indicator – Automatically marks valid Points of Interest with full customization, discount/premium ranges, and up to 7 timeframe POIs on your chart.",
    "IFVG Indicator – Detects and tracks Fair Value Gaps &amp; Inverse FVGs in real time with built-in quality filtering, perfect for scalpers and intraday traders.",
    "Daily Bias Indicator – Gives daily market bias, true day open, PDH, and PDL levels.",
    "KillZone Sessions Indicator – Highlights key trading sessions, ranges, and previous session highs/lows with alerts.",
    "Structure &amp; DOL Indicator – Plots market structure (BOS, CHoCH, Sweeps) with fake vs real BOS detection and institutional order flow confirmation.",
    "Private Watermark – Customizable watermark with key market stats.",
    "ETU Elite All-in-One – Combines all indicators into one seamless script so you never have to load multiple tools again.",
    "All indicators include alert functionality to save time. These are the exact tools I use daily to achieve consistent profitability—now you can too.",
    "$49.00 / month Pay Get access Features ETU POI Indicator ETU IFVG Indicator ETU Killzone Indicator ETU Daily Bias Indicator ETU Structure/DOL Indicator + ETU All-In-One Indicator Reviews 4.94 out of 5 16 total reviews 5 stars 4 stars 3 stars 2 stars 1 star MW Marcus W 3 months ago I've been trading for 4 years and the profound knowledge found within the course has been insane. I’ve learned concepts I had never come across before, and I can now read the market with a level of clarity I didn’t think was possible. It's amazing. The weekly 1on1 private lessons have also been incr...",
    "Written 9 days after purchase JP Justin Perez 3 months ago I found J through his YouTube live streams and took his advice. I got the 100RR course and went straight to backtesting. The results blew me away. The strategy is clear, effective, and delivers incredible stats. My ultimate goal is to become a full-time trader, and after learning this incredible st...",
    "Written 10 days after purchase KT Kevin Tran 4 months ago The ETU Elite Indicators completely transformed my trading. At first I thought 2025 price action was just bad, but after using the indicators, it immediately CHANGED the way I view the markets now....my win rate skyrocketed thanks to the precision and easy-to-understand setups. I use them daily in m...",
    "Written 6 days after purchase TS Tuneoasis Shop 6 months ago I just purchased the100RR course from J trades. And I've been killed it the last 2 weeks Along with his indicators, I'm truly learning a lot. And im gonna really make an awesome career. Thanks to Mr. J trades. Thanks Bud.",
    "About the creator ET View profile Essential Traders @ essentialtraders • Joined May 2023 I&#x27;m a seasoned trader who has mastered a mechanical trading system yielding ~100RR monthly returns. My course shares the strategies that led me to financial freedom, aiming to shortcut your path to profitability. With a high win rate and risk-to-reward ratio, my techniques have been refined through personal experience to maximize your trading success. FAQs What do you trade? What is your trading style? Can This Replace My 9-5 Job/Income? What experience level is your trading mentorship or courses designed for? What is your refund policy? Affiliates ET Become an affiliate Essential Traders 30% reward Earn money by bringing customers to Essential Traders . Every time a customer purchases using your link, you&#x27;ll earn a commission."
  ],
  "priceTokens": [
    "$1,199",
    "$49.00",
    "$49.00",
    "$49.00",
    "$1",
    "$1",
    "$1",
    "$23",
    "$1",
    "$1",
    "$1",
    "$1",
    "$1",
    "$2",
    "$1",
    "$2",
    "$2",
    "$2",
    "$2",
    "$3"
  ],
  "faq": [],
  "textSample": "Sign in Unmute Unmute ET ETU Elite Indicators Automate Your Trading Analysis 4.9 ( 16 ) Trading Unlock the full potential of your trading strategy with the ETU Elite Indicators Package—my complete set of top-performing tools at a special discounted price (original value $1,199). POI Indicator – Automatically marks valid Points of Interest with full customization, discount/premium ranges, and up to 7 timeframe POIs on your chart. IFVG Indicator – Detects and tracks Fair Value Gaps &amp; Inverse FVGs in real time with built-in quality filtering, perfect for scalpers and intraday traders. Daily Bias Indicator – Gives daily market bias, true day open, PDH, and PDL levels. KillZone Sessions Indicator – Highlights key trading sessions, ranges, and previous session highs/lows with alerts. Structure &amp; DOL Indicator – Plots market structure (BOS, CHoCH, Sweeps) with fake vs real BOS detection and institutional order flow confirmation. Private Watermark – Customizable watermark with key market stats. ETU Elite All-in-One – Combines all indicators into one seamless script so you never have to load multiple tools again. All indicators include alert functionality to save time. These are the exact tools I use daily to achieve consistent profitability—now you can too. $49.00 / month Pay Get access Features ETU POI Indicator ETU IFVG Indicator ETU Killzone Indicator ETU Daily Bias Indicator ETU Structure/DOL Indicator + ETU All-In-One Indicator Reviews 4.94 out of 5 16 total reviews 5 stars 4 stars 3 stars 2 stars 1 star MW Marcus W 3 months ago I've been trading for 4 years and the profound knowledge found within the course has been insane. I’ve learned concepts I had never come across before, and I can now read the market with a level of clarity I didn’t think was possible. It's amazing. The weekly 1on1 private lessons have also been incr... Show more Written 9 days after purchase JP Justin Perez 3 months ago I found J through his YouTube live streams and took his advice. I got the 100RR course and went straight to backtesting. The results blew me away. The strategy is clear, effective, and delivers incredible stats. My ultimate goal is to become a full-time trader, and after learning this incredible st... Show more Written 10 days after purchase KT Kevin Tran 4 months ago The ETU Elite Indicators completely transformed my trading. At first I thought 2025 price action was just bad, but after using the indicators, it immediately CHANGED the way I view the markets now....my win rate skyrocketed thanks to the precision and easy-to-understand setups. I use them daily in m... Show more Written 6 days after purchase TS Tuneoasis Shop 6 months ago I just purchased the100RR course from J trades. And I've been killed it the last 2 weeks Along with his indicators, I'm truly learning a lot. And im gonna really make an awesome career. Thanks to Mr. J trades. Thanks Bud. Written 7 days after purchase See all reviews About the creator ET View profile Essential Traders @ essentialtraders • Joined May 2023 I&#x27;m a seasoned trader who has mastered a mechanical trading system yielding ~100RR monthly returns. My course shares the strategies that led me to financial freedom, aiming to shortcut your path to profitability. With a high win rate and risk-to-reward ratio, my techniques have been refined through personal experience to maximize your trading success. FAQs What do you trade? What is your trading style? Can This Replace My 9-5 Job/Income? What experience level is your trading mentorship or courses designed for? What is your refund policy? Affiliates ET Become an affiliate Essential Traders 30% reward Earn money by bringing customers to Essential Traders . Every time a customer purchases using your link, you&#x27;ll earn a commission. ETU Elite Indicators $49.00 / month +2 options Get access $49.00 / month 2 options Pay Get access Pay Get access ETU Elite Indicators | Whop",
  "finalUrl": "https://whop.com/essential-traders/all-in-one-etu-indicator-package/",
  "fetchedAt": "2025-11-05T10:04:18.247Z",
  "textHash": "7e9817ef42f26a80bc36e0761721a9a5daf05572c70b570c357644083c349e12",
  "drilled": false
}