{
  "baseUrl": "https://whop.com/sourcedbetting/?a=alexburnett21",
  "title": "Sourced Betting | Whop",
  "h1": "Sourced Betting",
  "bullets": [
    "Powered by SB Sourced Betting We&#x27;ve spent years mastering the art of sports betting, focusing on maximizing bankroll growth with accurate, high-volume strategies. Join us in this marathon, where we continuously improve and strive ... More 4.8 ( 70 ) Contact seller Products $24.99 / month Free trial Maximize your mispriced lines profit Bots New $49.99 / month Free trial Maximize your bankroll growth All Access 4.8 ( 56 ) $9.99 / month Maximize your boosts and promos profit Boosts &amp; Promos 4.0 ( 4 ) Unmute Free Learn To Maximize Your Betting Potential Sourced Betting Course New Contact seller Reviews HB Hugh Barnett • All Access 2 months ago Consistent and constant posts - they don't miss a bet which is great Written 1 month after purchase",
    "B bloxom80 • Boosts &amp; Promos 8 months ago If you wanna money this is the place for you. I love it and you will too! Written 6 months after purchase",
    "CA Cristian Amores • All Access 1 year ago Contributors are very helpful and consistently put out good plays. Written 1 year after purchase",
    "CO Christopher O’Toole • Boosts &amp; Promos 1 year ago You'd be crazy not to join. If you like money, sign up. If not, stay broke. Written 16 days after purchase"
  ],
  "paras": [
    "SB Sourced Betting We&#x27;ve spent years mastering the art of sports betting, focusing on maximizing bankroll growth with accurate, high-volume strategies. Join us in this marathon, where we continuously improve and strive ... More 4.8 ( 70 ) Contact seller Products $24.99 / month Free trial Maximize your mispriced lines profit Bots New $49.99 / month Free trial Maximize your bankroll growth All Access 4.8 ( 56 ) $9.99 / month Maximize your boosts and promos profit Boosts &amp; Promos 4.0 ( 4 ) Unmute Free Learn To Maximize Your Betting Potential Sourced Betting Course New Contact seller Reviews HB Hugh Barnett • All Access 2 months ago Consistent and constant posts - they don't miss a bet which is great",
    "8 months ago If you wanna money this is the place for you. I love it and you will too!",
    "1 year ago Contributors are very helpful and consistently put out good plays.",
    "1 year ago You'd be crazy not to join. If you like money, sign up. If not, stay broke."
  ],
  "priceTokens": [
    "$24.99",
    "$49.99",
    "$9.99",
    "$1",
    "$1",
    "$1",
    "$21",
    "$1",
    "$1",
    "$1",
    "$1",
    "$28",
    "$1",
    "$28",
    "$28",
    "$28",
    "$28",
    "$3",
    "$3",
    "$3"
  ],
  "faq": [],
  "textSample": "Powered by SB Sourced Betting We&#x27;ve spent years mastering the art of sports betting, focusing on maximizing bankroll growth with accurate, high-volume strategies. Join us in this marathon, where we continuously improve and strive ... More 4.8 ( 70 ) Contact seller Products $24.99 / month Free trial Maximize your mispriced lines profit Bots New $49.99 / month Free trial Maximize your bankroll growth All Access 4.8 ( 56 ) $9.99 / month Maximize your boosts and promos profit Boosts &amp; Promos 4.0 ( 4 ) Unmute Free Learn To Maximize Your Betting Potential Sourced Betting Course New Contact seller Reviews HB Hugh Barnett • All Access 2 months ago Consistent and constant posts - they don't miss a bet which is great Written 1 month after purchase B bloxom80 • Boosts &amp; Promos 8 months ago If you wanna money this is the place for you. I love it and you will too! Written 6 months after purchase CA Cristian Amores • All Access 1 year ago Contributors are very helpful and consistently put out good plays. Written 1 year after purchase CO Christopher O’Toole • Boosts &amp; Promos 1 year ago You'd be crazy not to join. If you like money, sign up. If not, stay broke. Written 16 days after purchase See all reviews Sourced Betting | Whop",
  "finalUrl": "https://whop.com/sourcedbetting/?a=alexburnett21",
  "fetchedAt": "2025-11-05T09:16:15.312Z",
  "textHash": "beeb4e11627c59fb655bc95a77a345ac2136a39a6d6d586973219836a77f2ac5",
  "drilled": false
}