{
  "baseUrl": "https://whop.com/adt/adt-crypto/",
  "title": "CRYPTO | Whop",
  "h1": "CRYPTO",
  "bullets": [
    "CRYPTO | Whop Sign in Unmute Unmute Unmute Unmute AL CRYPTO CRYPTO MEMBERSHIP 5.0 ( 442 ) Trading Crypto Education Training. All access with be delivered thru Discord $50.00 / month 7 day trial Pay Join Join 31 members Features Access to our Discord server for free educational resources.",
    "Zoom Live Call (Once Per Week)",
    "Crypto Terms &amp; Education",
    "Training Videos",
    "MK Mike Kaye 10 days ago Only twelve days in and have learned so much from Coach and the team. I have the Diamond membership and it's the best deal ever, you get access to everything. I'm not much on reading so Coach having so many very informative videos help me so much. I have been trading for two and a half years followi... Show more Written 15 days after purchase",
    "K Kyle 17 days ago I have progressively upgraded my membership as I go along and the diamond is by far the way to go. So much content and learning material to review. The mentorship classes are that much more personal, and the people teaching the class have a long background of trading in the stock market to deliver t... Show more Written 14 days after purchase",
    "JM Jeff Monroe 19 days ago Wow!!!!!! Written 14 days after purchase",
    "R RockinUSA 22 days ago Only been trading 5 months. This education is a great step forward in stock trading. Everyone here is so helpful in your trading journey. Written 5 months after purchase"
  ],
  "paras": [
    "Sign in Unmute Unmute Unmute Unmute AL CRYPTO CRYPTO MEMBERSHIP 5.0 ( 442 ) Trading Crypto Education Training. All access with be delivered thru Discord",
    "$50.00 / month 7 day trial Pay Join Join 31 members Features Access to our Discord server for free educational resources. Zoom Live Call (Once Per Week) Crypto Terms &amp; Education Training Videos Reviews 4.95 out of 5 442 total reviews 5 stars 4 stars 3 stars 2 stars 1 star MK Mike Kaye 10 days ago Only twelve days in and have learned so much from Coach and the team. I have the Diamond membership and it's the best deal ever, you get access to everything. I'm not much on reading so Coach having so many very informative videos help me so much. I have been trading for two and a half years followi...",
    "Written 15 days after purchase K Kyle 17 days ago I have progressively upgraded my membership as I go along and the diamond is by far the way to go. So much content and learning material to review. The mentorship classes are that much more personal, and the people teaching the class have a long background of trading in the stock market to deliver t...",
    "Written 14 days after purchase JM Jeff Monroe 19 days ago Wow!!!!!!",
    "22 days ago Only been trading 5 months. This education is a great step forward in stock trading. Everyone here is so helpful in your trading journey."
  ],
  "priceTokens": [
    "$50.00",
    "$50.00",
    "$50.00",
    "$1",
    "$1",
    "$1",
    "$22",
    "$1",
    "$1",
    "$1",
    "$1",
    "$1",
    "$2",
    "$1",
    "$2",
    "$2",
    "$2",
    "$2",
    "$3",
    "$3"
  ],
  "faq": [],
  "textSample": "CRYPTO | Whop Sign in Unmute Unmute Unmute Unmute AL CRYPTO CRYPTO MEMBERSHIP 5.0 ( 442 ) Trading Crypto Education Training. All access with be delivered thru Discord $50.00 / month 7 day trial Pay Join Join 31 members Features Access to our Discord server for free educational resources. Zoom Live Call (Once Per Week) Crypto Terms &amp; Education Training Videos Reviews 4.95 out of 5 442 total reviews 5 stars 4 stars 3 stars 2 stars 1 star MK Mike Kaye 10 days ago Only twelve days in and have learned so much from Coach and the team. I have the Diamond membership and it's the best deal ever, you get access to everything. I'm not much on reading so Coach having so many very informative videos help me so much. I have been trading for two and a half years followi... Show more Written 15 days after purchase K Kyle 17 days ago I have progressively upgraded my membership as I go along and the diamond is by far the way to go. So much content and learning material to review. The mentorship classes are that much more personal, and the people teaching the class have a long background of trading in the stock market to deliver t... Show more Written 14 days after purchase JM Jeff Monroe 19 days ago Wow!!!!!! Written 14 days after purchase R RockinUSA 22 days ago Only been trading 5 months. This education is a great step forward in stock trading. Everyone here is so helpful in your trading journey. Written 5 months after purchase See all reviews About the creator CC View profile Chad Christian @ coachcwc â€¢ Joined Sep 2023 American Dream Trading is a leading stock market education platform with over 6,000 Discord and 11,000 WHOP members. Offering 12-hour daily live Zoom training, expert-led discussions, and curated stock picks, we empower traders with real-time insights and a vibrant community. Backed by 33 years of expertise and collaborative forums help members achieve financial success. Results may vary. CRYPTO $50.00 / month +3 options Join $50.00 / month 3 options Pay Join Pay Join",
  "finalUrl": "https://whop.com/adt/adt-crypto/",
  "fetchedAt": "2025-11-04T21:57:38.637Z",
  "textHash": "4e1b73497d9d643a883b512fd02bca248a4368df066644bf44d586fbd3327843",
  "drilled": false
}