{
  "baseUrl": "https://whop.com/raw-trader/futures-insider/",
  "title": "RAW Trader | Whop",
  "h1": "RAW Trader",
  "bullets": [
    "Sign in RT RAW Trader Trade Live with a Pro Trader 5.0 ( 22 ) Trading trade live with Us &amp; Master futures markets $49.00 / month Pay Get access Join 134 members Features âœ… Trade Live With Me Every Day at NYSE Market Open",
    "âœ… Daily pre-market-plans and market zones, order flow breakdown",
    "âœ… Elite Discord Community",
    "âœ… Exclusive networking with dedicated and ambitious traders.",
    "âœ… Direct Q&amp;A and priority support in Discord",
    "Z zgerv 1 month ago The first trade I took with their levels literally paid for my subscription for 6 months ðŸ’€ðŸ˜‚ These people know what theyâ€™re doing. Written 3 months after purchase",
    "E ezvgeaz 1 month ago Best decision I made this year. Feels like youâ€™re learning with friends, not some random dude selling a course. Live trades, clear rules, and actual support when you need it. Written 3 months after purchase",
    "V vegae 1 month ago I was hesitant bc Iâ€™ve been scammed before, but after 2 months here I feel way more confident. The daily breakdowns are gold, especially before NY open. Written 3 months after purchase",
    "V vgae 1 month ago The spin-to-win thing got me hooked lol. Ended up joining the VIP and wow, these guys are legit. The energy in the group is ðŸ”¥ Written 3 months after purchase"
  ],
  "paras": [
    "Sign in RT RAW Trader Trade Live with a Pro Trader 5.0 ( 22 ) Trading trade live with Us &amp; Master futures markets",
    "Join 134 members Features âœ… Trade Live With Me Every Day at NYSE Market Open âœ… Daily pre-market-plans and market zones, order flow breakdown âœ… Elite Discord Community âœ… Exclusive networking with dedicated and ambitious traders. âœ… Direct Q&amp;A and priority support in Discord Reviews 4.95 out of 5 22 total reviews 5 stars 4 stars 3 stars 2 stars 1 star Z zgerv 1 month ago The first trade I took with their levels literally paid for my subscription for 6 months ðŸ’€ðŸ˜‚ These people know what theyâ€™re doing.",
    "1 month ago Best decision I made this year. Feels like youâ€™re learning with friends, not some random dude selling a course. Live trades, clear rules, and actual support when you need it.",
    "1 month ago I was hesitant bc Iâ€™ve been scammed before, but after 2 months here I feel way more confident. The daily breakdowns are gold, especially before NY open.",
    "1 month ago The spin-to-win thing got me hooked lol. Ended up joining the VIP and wow, these guys are legit. The energy in the group is ðŸ”¥",
    "About the creator TT View profile The Raw Trader @ rawtrader â€¢ Joined Mar 2025 Dedicated trader who transformed setbacks into success. After facing and overcoming major challenges in his own trading journey. FAQs Who is this group for? What is your trading style? What platforms do you use for trading? How can I contact support? Affiliates RT Become an affiliate RAW TRADER 30% reward Earn money by bringing customers to RAW TRADER. Every time a customer purchases using your link, you&#x27;ll earn a commission."
  ],
  "priceTokens": [
    "$49.00",
    "$49.00",
    "$49.00",
    "$1",
    "$1",
    "$1",
    "$22",
    "$1",
    "$1",
    "$1",
    "$1",
    "$1",
    "$2",
    "$1",
    "$2",
    "$2",
    "$2",
    "$2",
    "$3",
    "$3"
  ],
  "faq": [],
  "textSample": "Sign in RT RAW Trader Trade Live with a Pro Trader 5.0 ( 22 ) Trading trade live with Us &amp; Master futures markets $49.00 / month Pay Get access Join 134 members Features âœ… Trade Live With Me Every Day at NYSE Market Open âœ… Daily pre-market-plans and market zones, order flow breakdown âœ… Elite Discord Community âœ… Exclusive networking with dedicated and ambitious traders. âœ… Direct Q&amp;A and priority support in Discord Reviews 4.95 out of 5 22 total reviews 5 stars 4 stars 3 stars 2 stars 1 star Z zgerv 1 month ago The first trade I took with their levels literally paid for my subscription for 6 months ðŸ’€ðŸ˜‚ These people know what theyâ€™re doing. Written 3 months after purchase E ezvgeaz 1 month ago Best decision I made this year. Feels like youâ€™re learning with friends, not some random dude selling a course. Live trades, clear rules, and actual support when you need it. Written 3 months after purchase V vegae 1 month ago I was hesitant bc Iâ€™ve been scammed before, but after 2 months here I feel way more confident. The daily breakdowns are gold, especially before NY open. Written 3 months after purchase V vgae 1 month ago The spin-to-win thing got me hooked lol. Ended up joining the VIP and wow, these guys are legit. The energy in the group is ðŸ”¥ Written 3 months after purchase See all reviews About the creator TT View profile The Raw Trader @ rawtrader â€¢ Joined Mar 2025 Dedicated trader who transformed setbacks into success. After facing and overcoming major challenges in his own trading journey. FAQs Who is this group for? What is your trading style? What platforms do you use for trading? How can I contact support? Affiliates RT Become an affiliate RAW TRADER 30% reward Earn money by bringing customers to RAW TRADER. Every time a customer purchases using your link, you&#x27;ll earn a commission. RAW Trader $49.00 / month Get access $49.00 / month Pay Get access Pay Get access RAW Trader | Whop",
  "finalUrl": "https://whop.com/raw-trader/futures-insider/",
  "fetchedAt": "2025-11-05T10:47:00.156Z",
  "textHash": "76653fa97d8467f9579c705c74a1a942c13005e211a8f1d9300130abc5825d49",
  "drilled": false
}