{
  "baseUrl": "https://whop.com/thewolfpack/archetype/",
  "title": "THE WOLFPACK | Whop",
  "h1": "THE WOLFPACK",
  "bullets": [
    "Sign in TW THE WOLFPACK üëë JOIN THE #1 CRYPTO GROUP 4.8 ( 45 ) Trading Access real-time buy/sell alerts, degen trading and a global community. Enjoy priority support and exclusive insights on your journey to financial freedom. $39.99 / month Pay Join Join 216 members Features Access to buy/sell alerts and degen trading 24/7/365.",
    "Join an exclusive Discord community with 1000+ members.",
    "Track influencers trades, breaking news and new listings!",
    "24/7 personalized support for all members.",
    "Real-time portfolio updates with degen, meme, and long-term holds.",
    "C Cynthia 4 months ago Archetype has a very well rounded intelligent and evolving approach to crypto. He is a great mentor in the crypto space. Love the discord! Its‚Äôs a great supportive community and Archetype is very active in it! Written 9 months after purchase",
    "BS Brandon Slaughter 4 months ago David is the truth man great community everyone is there to help and uplift üíØüôèüèæüî• Written 10 months after purchase",
    "J J 4 months ago David with the absolute banger of a call with blaze! This man is doing gods work! Thank you sir grateful to be apart of this amazing group. Written 6 days after purchase",
    "JV Jhonnatan Vargas 4 months ago Best group you can ever join! Thank you David! Written 6 months after purchase"
  ],
  "paras": [
    "Sign in TW THE WOLFPACK üëë JOIN THE #1 CRYPTO GROUP 4.8 ( 45 ) Trading Access real-time buy/sell alerts, degen trading and a global community. Enjoy priority support and exclusive insights on your journey to financial freedom.",
    "$39.99 / month Pay Join Join 216 members Features Access to buy/sell alerts and degen trading 24/7/365. Join an exclusive Discord community with 1000+ members. Track influencers trades, breaking news and new listings! 24/7 personalized support for all members. Real-time portfolio updates with degen, meme, and long-term holds. Reviews 4.82 out of 5 45 total reviews 5 stars 4 stars 3 stars 2 stars 1 star C Cynthia 4 months ago Archetype has a very well rounded intelligent and evolving approach to crypto. He is a great mentor in the crypto space. Love the discord! Its‚Äôs a great supportive community and Archetype is very active in it!",
    "4 months ago David is the truth man great community everyone is there to help and uplift üíØüôèüèæüî•",
    "4 months ago David with the absolute banger of a call with blaze! This man is doing gods work! Thank you sir grateful to be apart of this amazing group.",
    "4 months ago Best group you can ever join! Thank you David!",
    "About the creator DA View profile David | ARCHETYPE‚ö°Ô∏è @ archetypex ‚Ä¢ Joined Jan 2024 I&#x27;m a self-made crypto millionaire helping others attain financial freedom. I&#x27;ve spent years navigating the crypto landscape, learning from every success and setback. This community is my way of sharing real-time insights, strategies and support to help you thrive in the crypto world. FAQs Is this financial advice? What is your refund policy? Affiliates TW Become an affiliate THE WOLFPACK 30% reward Earn money by bringing customers to THE WOLFPACK. Every time a customer purchases using your link, you&#x27;ll earn a commission."
  ],
  "priceTokens": [
    "$39.99",
    "$39.99",
    "$39.99",
    "$1",
    "$1",
    "$1",
    "$22",
    "$1",
    "$1",
    "$1",
    "$1",
    "$1",
    "$2",
    "$1",
    "$2",
    "$2",
    "$2",
    "$2",
    "$3",
    "$3"
  ],
  "faq": [],
  "textSample": "Sign in TW THE WOLFPACK üëë JOIN THE #1 CRYPTO GROUP 4.8 ( 45 ) Trading Access real-time buy/sell alerts, degen trading and a global community. Enjoy priority support and exclusive insights on your journey to financial freedom. $39.99 / month Pay Join Join 216 members Features Access to buy/sell alerts and degen trading 24/7/365. Join an exclusive Discord community with 1000+ members. Track influencers trades, breaking news and new listings! 24/7 personalized support for all members. Real-time portfolio updates with degen, meme, and long-term holds. Reviews 4.82 out of 5 45 total reviews 5 stars 4 stars 3 stars 2 stars 1 star C Cynthia 4 months ago Archetype has a very well rounded intelligent and evolving approach to crypto. He is a great mentor in the crypto space. Love the discord! Its‚Äôs a great supportive community and Archetype is very active in it! Written 9 months after purchase BS Brandon Slaughter 4 months ago David is the truth man great community everyone is there to help and uplift üíØüôèüèæüî• Written 10 months after purchase J J 4 months ago David with the absolute banger of a call with blaze! This man is doing gods work! Thank you sir grateful to be apart of this amazing group. Written 6 days after purchase JV Jhonnatan Vargas 4 months ago Best group you can ever join! Thank you David! Written 6 months after purchase See all reviews About the creator DA View profile David | ARCHETYPE‚ö°Ô∏è @ archetypex ‚Ä¢ Joined Jan 2024 I&#x27;m a self-made crypto millionaire helping others attain financial freedom. I&#x27;ve spent years navigating the crypto landscape, learning from every success and setback. This community is my way of sharing real-time insights, strategies and support to help you thrive in the crypto world. FAQs Is this financial advice? What is your refund policy? Affiliates TW Become an affiliate THE WOLFPACK 30% reward Earn money by bringing customers to THE WOLFPACK. Every time a customer purchases using your link, you&#x27;ll earn a commission. THE WOLFPACK $39.99 / month +1 option Join $39.99 / month 1 option Pay Join Pay Join THE WOLFPACK | Whop",
  "finalUrl": "https://whop.com/thewolfpack/archetype/",
  "fetchedAt": "2025-11-05T10:29:54.877Z",
  "textHash": "ba8dc787e9b56ab6b08e63f646b27a46fb786f29e77adfeae35e03209f902065",
  "drilled": false
}