{
  "baseUrl": "https://whop.com/aura-picks/vip-pass-monthly-8b/",
  "title": "Aura Picks VIP Pass | Whop",
  "h1": "Aura Picks VIP Pass",
  "bullets": [
    "Sign in Unmute Unmute AP Aura Picks VIP Pass Join Aura Picks for Daily Winning Bets 5.0 ( 7 ) Sports betting All Sports - All VIP Bets + Parlays - Private VIP Chat PROFIT $250 IN 2 DAYS OR REFUND ✅ $22.50 / month 1 day trial Pay Join Join 6 members Features Daily picks with 90-97.5% confidence for multiple sports.",
    "Access to Betting University video course.",
    "24/7 support and guidance from expert cappers.",
    "Algorithm-based picks and AI model insights.",
    "Custom developed tools for player projections and prop analysis.",
    "JA James Anglade 1 year ago By far one of the best in the business, the other servers don’t even come close to aura picks . Written 25 days after purchase",
    "JA James Anglade 1 year ago One of the best sport pick on this app , I’ve been in other group before but this takes it to another level , very professional and well research . Written 18 days after purchase",
    "CJ Christopher Jennings 1 year ago Your gonna find anyone that's more genuine, more detailed and authentic then Aura, he puts alot of work into this and it shows not only that, he really wants you to win, the pick are solid the best one I've seen definitely worth it! Written 13 days after purchase",
    "JT Jabari Thomas 1 year ago I love his picks. But what I really love the most is the information and the great detail he gives! The information he gives are in depth and it just helps with your decision making on games Written 23 days after purchase"
  ],
  "paras": [
    "Sign in Unmute Unmute AP Aura Picks VIP Pass Join Aura Picks for Daily Winning Bets 5.0 ( 7 ) Sports betting All Sports - All VIP Bets + Parlays - Private VIP Chat PROFIT $250 IN 2 DAYS OR REFUND ✅",
    "1 day trial Pay Join Join 6 members Features Daily picks with 90-97.5% confidence for multiple sports. Access to Betting University video course. 24/7 support and guidance from expert cappers. Algorithm-based picks and AI model insights. Custom developed tools for player projections and prop analysis. Reviews 5 out of 5 7 total reviews 5 stars 4 stars 3 stars 2 stars 1 star JA James Anglade 1 year ago By far one of the best in the business, the other servers don’t even come close to aura picks .",
    "1 year ago One of the best sport pick on this app , I’ve been in other group before but this takes it to another level , very professional and well research .",
    "1 year ago Your gonna find anyone that's more genuine, more detailed and authentic then Aura, he puts alot of work into this and it shows not only that, he really wants you to win, the pick are solid the best one I've seen definitely worth it!",
    "1 year ago I love his picks. But what I really love the most is the information and the great detail he gives! The information he gives are in depth and it just helps with your decision making on games",
    "About the creator AP View profile Aura Picks @ aurapicks • Joined Apr 2024 I’ve dedicated my life to sports betting, combining human expertise with AI to offer you the best picks. With Aura Picks VIP, you’ll join a community that truly cares about your success, providing 24/7 support and top-tier betting strategies. FAQs What sports does Aura provide picks for? How do I receive picks after paying? Affiliates AP Become an affiliate Aura Picks 30% reward Earn money by bringing customers to Aura Picks. Every time a customer purchases using your link, you&#x27;ll earn a commission."
  ],
  "priceTokens": [
    "$250",
    "$22.50",
    "$22.50",
    "$22.50",
    "$1",
    "$1",
    "$1",
    "$22",
    "$1",
    "$1",
    "$1",
    "$1",
    "$1",
    "$2",
    "$1",
    "$2",
    "$2",
    "$2",
    "$2",
    "$3"
  ],
  "faq": [],
  "textSample": "Sign in Unmute Unmute AP Aura Picks VIP Pass Join Aura Picks for Daily Winning Bets 5.0 ( 7 ) Sports betting All Sports - All VIP Bets + Parlays - Private VIP Chat PROFIT $250 IN 2 DAYS OR REFUND ✅ $22.50 / month 1 day trial Pay Join Join 6 members Features Daily picks with 90-97.5% confidence for multiple sports. Access to Betting University video course. 24/7 support and guidance from expert cappers. Algorithm-based picks and AI model insights. Custom developed tools for player projections and prop analysis. Reviews 5 out of 5 7 total reviews 5 stars 4 stars 3 stars 2 stars 1 star JA James Anglade 1 year ago By far one of the best in the business, the other servers don’t even come close to aura picks . Written 25 days after purchase JA James Anglade 1 year ago One of the best sport pick on this app , I’ve been in other group before but this takes it to another level , very professional and well research . Written 18 days after purchase CJ Christopher Jennings 1 year ago Your gonna find anyone that's more genuine, more detailed and authentic then Aura, he puts alot of work into this and it shows not only that, he really wants you to win, the pick are solid the best one I've seen definitely worth it! Written 13 days after purchase JT Jabari Thomas 1 year ago I love his picks. But what I really love the most is the information and the great detail he gives! The information he gives are in depth and it just helps with your decision making on games Written 23 days after purchase See all reviews About the creator AP View profile Aura Picks @ aurapicks • Joined Apr 2024 I’ve dedicated my life to sports betting, combining human expertise with AI to offer you the best picks. With Aura Picks VIP, you’ll join a community that truly cares about your success, providing 24/7 support and top-tier betting strategies. FAQs What sports does Aura provide picks for? How do I receive picks after paying? Affiliates AP Become an affiliate Aura Picks 30% reward Earn money by bringing customers to Aura Picks. Every time a customer purchases using your link, you&#x27;ll earn a commission. Aura Picks VIP Pass $22.50 / month Join $22.50 / month Pay Join Pay Join Aura Picks VIP Pass | Whop",
  "finalUrl": "https://whop.com/aura-picks/vip-pass-monthly-8b/",
  "fetchedAt": "2025-11-05T10:07:06.107Z",
  "textHash": "5044e03cd0d0d0f8d0d67813618fec408072aced0cbdf70cd48d74a30e79895d",
  "drilled": false
}