{
  "baseUrl": "https://whop.com/ballerpicks/?a=alexburnett21",
  "title": "BallerPicks | Whop",
  "h1": "BallerPicks",
  "bullets": [
    "BallerPicks | Whop Powered by B BallerPicks As a passionate sports enthusiast, I&#x27;ve spent years perfecting the art of sports betting. With my team of 8 analysts, we&#x27;ve been delivering consistent profits for over 4 years. Our extensive data anal... More 5.0 ( 22 ) Contact seller Products $25.00 / month Join Our Proven Sports Betting Community BallerPicks VIP 5.0 ( 16 ) $75.00 50% OFF!!! BallerPicks NFL VIP Package New Contact seller Reviews MB Marco Bamako • BallerPicks VIP 9 months ago This server changed my life, i was just a poor guy from Douala, Cameroon, After 3 years of tailing those guys, i finally move out of africa to follow my dream of moving to Canada, these guys are the best in the domain, there is no doubt, this price is nothing for what you get in return, the communit... Show more Written 20 days after purchase",
    "E ed • BallerPicks VIP 9 months ago Baller Picks was my first guide in the betting world lock in with them Written 4h after purchase",
    "NT Nicole tapley 9 months ago In over 14 months in the discord I’ve never had a losing month. These guys are consistently excellent. Written 1 year after purchase",
    "RL Ruhan Li • BallerPicks VIP 9 months ago Highly recommend. Friendly people and good bets Written 10 months after purchase"
  ],
  "paras": [
    "B BallerPicks As a passionate sports enthusiast, I&#x27;ve spent years perfecting the art of sports betting. With my team of 8 analysts, we&#x27;ve been delivering consistent profits for over 4 years. Our extensive data anal... More 5.0 ( 22 ) Contact seller Products $25.00 / month Join Our Proven Sports Betting Community BallerPicks VIP 5.0 ( 16 ) $75.00 50% OFF!!! BallerPicks NFL VIP Package New Contact seller Reviews MB Marco Bamako • BallerPicks VIP 9 months ago This server changed my life, i was just a poor guy from Douala, Cameroon, After 3 years of tailing those guys, i finally move out of africa to follow my dream of moving to Canada, these guys are the best in the domain, there is no doubt, this price is nothing for what you get in return, the communit...",
    "Written 20 days after purchase E ed • BallerPicks VIP 9 months ago Baller Picks was my first guide in the betting world lock in with them",
    "9 months ago In over 14 months in the discord I’ve never had a losing month. These guys are consistently excellent.",
    "9 months ago Highly recommend. Friendly people and good bets"
  ],
  "priceTokens": [
    "$25.00",
    "$75.00",
    "$1",
    "$1",
    "$1",
    "$21",
    "$1",
    "$1",
    "$1",
    "$1",
    "$28",
    "$1",
    "$28",
    "$28",
    "$28",
    "$28",
    "$3",
    "$3",
    "$3",
    "$10"
  ],
  "faq": [],
  "textSample": "BallerPicks | Whop Powered by B BallerPicks As a passionate sports enthusiast, I&#x27;ve spent years perfecting the art of sports betting. With my team of 8 analysts, we&#x27;ve been delivering consistent profits for over 4 years. Our extensive data anal... More 5.0 ( 22 ) Contact seller Products $25.00 / month Join Our Proven Sports Betting Community BallerPicks VIP 5.0 ( 16 ) $75.00 50% OFF!!! BallerPicks NFL VIP Package New Contact seller Reviews MB Marco Bamako • BallerPicks VIP 9 months ago This server changed my life, i was just a poor guy from Douala, Cameroon, After 3 years of tailing those guys, i finally move out of africa to follow my dream of moving to Canada, these guys are the best in the domain, there is no doubt, this price is nothing for what you get in return, the communit... Show more Written 20 days after purchase E ed • BallerPicks VIP 9 months ago Baller Picks was my first guide in the betting world lock in with them Written 4h after purchase NT Nicole tapley 9 months ago In over 14 months in the discord I’ve never had a losing month. These guys are consistently excellent. Written 1 year after purchase RL Ruhan Li • BallerPicks VIP 9 months ago Highly recommend. Friendly people and good bets Written 10 months after purchase See all reviews",
  "finalUrl": "https://whop.com/ballerpicks/?a=alexburnett21",
  "fetchedAt": "2025-11-05T09:56:37.063Z",
  "textHash": "ecb1d04e7c8cc7377ad086485a92aaded7e74c9c21ad1373fee669021e8db10b",
  "drilled": false
}