{
  "baseUrl": "https://whop.com/vip-money-lines/bankroll-bros/",
  "title": "BANKROLL BROS WEEKLY | Whop",
  "h1": "BANKROLL BROS WEEKLY",
  "bullets": [
    "Sign in BB BANKROLL BROS WEEKLY Join the #1 Player Prop Community 5.0 ( 2 ) Other 15+ daily picks. Join our expert-led community of 250+ for real-time insights and support. Your profit is our priority! $8.99 / week + $1.00 initial fee Pay Join Join 2 members Features Bankroll Management ğŸ“Š",
    "24/7 support for all betting inquiriesğŸ—£ï¸",
    "10-15 daily expert picks ensuring profitable outcomesğŸ’",
    "75% win rate with a consistent trackğŸ“ˆ",
    "Access to premium chatsğŸ’¬",
    "S Sab 6 months ago Support is amazing the owner himself deals with everything and helps with everything he can. Lock in Written 5 days after purchase",
    "MW Mason Wyatt 8 months ago Cash out everyday, all day. Taking my girl to Cancun because of this cord ğŸï¸ Written 20 days after purchase"
  ],
  "paras": [
    "Sign in BB BANKROLL BROS WEEKLY Join the #1 Player Prop Community 5.0 ( 2 ) Other 15+ daily picks. Join our expert-led community of 250+ for real-time insights and support. Your profit is our priority!",
    "Join 2 members Features Bankroll Management ğŸ“Š 24/7 support for all betting inquiriesğŸ—£ï¸ 10-15 daily expert picks ensuring profitable outcomesğŸ’ 75% win rate with a consistent trackğŸ“ˆ Access to premium chatsğŸ’¬ Reviews 5 out of 5 2 total reviews 5 stars 4 stars 3 stars 2 stars 1 star S Sab 6 months ago Support is amazing the owner himself deals with everything and helps with everything he can. Lock in",
    "8 months ago Cash out everyday, all day. Taking my girl to Cancun because of this cord ğŸï¸",
    "Affiliates BB Become an affiliate Bankroll Bros 15% reward Earn money by bringing customers to Bankroll Bros. Every time a customer purchases using your link, you&#x27;ll earn a commission."
  ],
  "priceTokens": [
    "$8.99",
    "$1.00",
    "$8.99",
    "$8.99",
    "$1",
    "$1",
    "$1",
    "$22",
    "$1",
    "$1",
    "$1",
    "$1",
    "$1",
    "$2",
    "$1",
    "$2",
    "$2",
    "$2",
    "$2",
    "$3"
  ],
  "faq": [],
  "textSample": "Sign in BB BANKROLL BROS WEEKLY Join the #1 Player Prop Community 5.0 ( 2 ) Other 15+ daily picks. Join our expert-led community of 250+ for real-time insights and support. Your profit is our priority! $8.99 / week + $1.00 initial fee Pay Join Join 2 members Features Bankroll Management ğŸ“Š 24/7 support for all betting inquiriesğŸ—£ï¸ 10-15 daily expert picks ensuring profitable outcomesğŸ’ 75% win rate with a consistent trackğŸ“ˆ Access to premium chatsğŸ’¬ Reviews 5 out of 5 2 total reviews 5 stars 4 stars 3 stars 2 stars 1 star S Sab 6 months ago Support is amazing the owner himself deals with everything and helps with everything he can. Lock in Written 5 days after purchase MW Mason Wyatt 8 months ago Cash out everyday, all day. Taking my girl to Cancun because of this cord ğŸï¸ Written 20 days after purchase About the creator J View profile JD @ sasop â€¢ Joined Oct 2024 Affiliates BB Become an affiliate Bankroll Bros 15% reward Earn money by bringing customers to Bankroll Bros. Every time a customer purchases using your link, you&#x27;ll earn a commission. BANKROLL BROS WEEKLY $8.99 / week Join $8.99 / week Pay Join Pay Join BANKROLL BROS WEEKLY | Whop",
  "finalUrl": "https://whop.com/vip-money-lines/bankroll-bros/",
  "fetchedAt": "2025-11-05T09:31:59.461Z",
  "textHash": "3e30779dfd5787d640b9158aa447fb80e17829b75ec9f7333417277cede8cf4c",
  "drilled": false
}