{
  "baseUrl": "https://whop.com/betsportsdaily/?a=alexburnett21",
  "title": "Bet Sports Daily | Whop",
  "h1": "Bet Sports Daily",
  "bullets": [
    "Powered by BD Bet Sports Daily 5.0 ( 26 ) Contact seller Products $6.99 / month Unlock Daily Expert Sports Picks with High Accuracy! Bet Sports Daily (Monthly) 5.0 ( 25 ) $69.99 / year Unlock Daily Expert Sports Picks with High Accuracy! Bet Sports Daily (Yearly) New Contact seller Reviews HT Henry Tyre 5 days ago Best out there! Written 2 months after purchase",
    "………… • Bet Sports Daily (Monthly) 18 days ago Best in the game Written 5 months after purchase",
    "MJ mekhi j • Bet Sports Daily (Monthly) 19 days ago Legit made my bread back x10 the first day Written 3 days after purchase",
    "BJ Briar Jackson • Bet Sports Daily (Monthly) 19 days ago Highly recommend anyone to join this group!! He is the most active of anyone I’ve seen and always responds right away!! Written 5 months after purchase"
  ],
  "paras": [
    "BD Bet Sports Daily 5.0 ( 26 ) Contact seller Products $6.99 / month Unlock Daily Expert Sports Picks with High Accuracy! Bet Sports Daily (Monthly) 5.0 ( 25 ) $69.99 / year Unlock Daily Expert Sports Picks with High Accuracy! Bet Sports Daily (Yearly) New Contact seller Reviews HT Henry Tyre 5 days ago Best out there!",
    "18 days ago Best in the game",
    "19 days ago Legit made my bread back x10 the first day",
    "19 days ago Highly recommend anyone to join this group!! He is the most active of anyone I’ve seen and always responds right away!!"
  ],
  "priceTokens": [
    "$6.99",
    "$69.99",
    "$1",
    "$1",
    "$1",
    "$21",
    "$1",
    "$1",
    "$1",
    "$1",
    "$28",
    "$1",
    "$28",
    "$28",
    "$28",
    "$28",
    "$3",
    "$3",
    "$3",
    "$10"
  ],
  "faq": [],
  "textSample": "Powered by BD Bet Sports Daily 5.0 ( 26 ) Contact seller Products $6.99 / month Unlock Daily Expert Sports Picks with High Accuracy! Bet Sports Daily (Monthly) 5.0 ( 25 ) $69.99 / year Unlock Daily Expert Sports Picks with High Accuracy! Bet Sports Daily (Yearly) New Contact seller Reviews HT Henry Tyre 5 days ago Best out there! Written 2 months after purchase ………… • Bet Sports Daily (Monthly) 18 days ago Best in the game Written 5 months after purchase MJ mekhi j • Bet Sports Daily (Monthly) 19 days ago Legit made my bread back x10 the first day Written 3 days after purchase BJ Briar Jackson • Bet Sports Daily (Monthly) 19 days ago Highly recommend anyone to join this group!! He is the most active of anyone I’ve seen and always responds right away!! Written 5 months after purchase See all reviews Bet Sports Daily | Whop",
  "finalUrl": "https://whop.com/betsportsdaily/?a=alexburnett21",
  "fetchedAt": "2025-11-05T09:28:22.748Z",
  "textHash": "8f0bfa91a7bfbd19513386cca3b00d866f0b8771522432337aab41bb3f5118d6",
  "drilled": false
}