{
  "baseUrl": "https://whop.com/betropolis/betropolis-esports-bot/",
  "title": "Betropolis VIP+ Esports Bot | Whop",
  "h1": "Betropolis VIP+ Esports Bot",
  "bullets": [
    "Sign in Unmute Unmute Unmute Unmute BV Betropolis VIP+ Esports Bot Betropolis VIP+ Esports BOT 5.0 ( 22 ) Sports betting Unlock full access to the Betropolis VIP+ Discord and our powerful Esports Bot â€” the ultimate toolkit for sharp, +EV esports betting. $20.00 / month Pay Join Join 15 members Features ğŸ¤– Get automated Esport slips generated from our bots in-house model",
    "ğŸ“Š Mathematically profitable bets!",
    "âœ… Transparent performance with verified results and real-time bet tracking",
    "ğŸ”” Never miss a play again â€” receive instant alerts when new slips are posted",
    "ğŸ™ï¸ Includes full VIP access to the Betropolis Discord",
    "J Jon 6 days ago Absolutely worth! Joined and the first day went up 50 units! Great guys, put out a lot of volume and always are in chat helping and giving tips! love it and going to stick around for a long time! Written 1 day after purchase",
    "IS Isaac sprouse 19 days ago Betropolis is honestly the best discord Iâ€™ve ever joined. And the people in it treat you like family.â¤ï¸ Written 21 minutes after purchase",
    "JH John Hommerding 19 days ago Always finding new edges and looking to improve there services! Written 5 months after purchase",
    "T TheSetBack 19 days ago Best in the business! Super sharp cord, your BR will thank you âœ… Written 1 month after purchase"
  ],
  "paras": [
    "Sign in Unmute Unmute Unmute Unmute BV Betropolis VIP+ Esports Bot Betropolis VIP+ Esports BOT 5.0 ( 22 ) Sports betting Unlock full access to the Betropolis VIP+ Discord and our powerful Esports Bot â€” the ultimate toolkit for sharp, +EV esports betting.",
    "Join 15 members Features ğŸ¤– Get automated Esport slips generated from our bots in-house model ğŸ“Š Mathematically profitable bets! âœ… Transparent performance with verified results and real-time bet tracking ğŸ”” Never miss a play again â€” receive instant alerts when new slips are posted ğŸ™ï¸ Includes full VIP access to the Betropolis Discord Reviews 5 out of 5 22 total reviews 5 stars 4 stars 3 stars 2 stars 1 star J Jon 6 days ago Absolutely worth! Joined and the first day went up 50 units! Great guys, put out a lot of volume and always are in chat helping and giving tips! love it and going to stick around for a long time!",
    "19 days ago Betropolis is honestly the best discord Iâ€™ve ever joined. And the people in it treat you like family.â¤ï¸",
    "19 days ago Always finding new edges and looking to improve there services!",
    "19 days ago Best in the business! Super sharp cord, your BR will thank you âœ…",
    "About the creator BV View profile Betropolis VIP @ betropolisvip â€¢ Joined Mar 2025 Betropolis is led by a sharp, data-driven team focused on long-term betting success. Built on transparency, results, and mathematical edge, they specialize in +EV strategies that consistently beat the market. With custom tools, automated bots, and expert insights, Betropolis gives members everything they need to stay ahead of the books. FAQs How is this different from other betting groups? How do I join? What is our refund policy? What is the bot? Affiliates BV Become an affiliate Betropolis VIP 30% reward Earn money by bringing customers to Betropolis VIP. Every time a customer purchases using your link, you&#x27;ll earn a commission."
  ],
  "priceTokens": [
    "$20.00",
    "$20.00",
    "$20.00",
    "$1",
    "$1",
    "$1",
    "$22",
    "$1",
    "$1",
    "$1",
    "$1",
    "$1",
    "$2",
    "$1",
    "$2",
    "$2",
    "$2",
    "$2",
    "$3",
    "$3"
  ],
  "faq": [],
  "textSample": "Sign in Unmute Unmute Unmute Unmute BV Betropolis VIP+ Esports Bot Betropolis VIP+ Esports BOT 5.0 ( 22 ) Sports betting Unlock full access to the Betropolis VIP+ Discord and our powerful Esports Bot â€” the ultimate toolkit for sharp, +EV esports betting. $20.00 / month Pay Join Join 15 members Features ğŸ¤– Get automated Esport slips generated from our bots in-house model ğŸ“Š Mathematically profitable bets! âœ… Transparent performance with verified results and real-time bet tracking ğŸ”” Never miss a play again â€” receive instant alerts when new slips are posted ğŸ™ï¸ Includes full VIP access to the Betropolis Discord Reviews 5 out of 5 22 total reviews 5 stars 4 stars 3 stars 2 stars 1 star J Jon 6 days ago Absolutely worth! Joined and the first day went up 50 units! Great guys, put out a lot of volume and always are in chat helping and giving tips! love it and going to stick around for a long time! Written 1 day after purchase IS Isaac sprouse 19 days ago Betropolis is honestly the best discord Iâ€™ve ever joined. And the people in it treat you like family.â¤ï¸ Written 21 minutes after purchase JH John Hommerding 19 days ago Always finding new edges and looking to improve there services! Written 5 months after purchase T TheSetBack 19 days ago Best in the business! Super sharp cord, your BR will thank you âœ… Written 1 month after purchase See all reviews About the creator BV View profile Betropolis VIP @ betropolisvip â€¢ Joined Mar 2025 Betropolis is led by a sharp, data-driven team focused on long-term betting success. Built on transparency, results, and mathematical edge, they specialize in +EV strategies that consistently beat the market. With custom tools, automated bots, and expert insights, Betropolis gives members everything they need to stay ahead of the books. FAQs How is this different from other betting groups? How do I join? What is our refund policy? What is the bot? Affiliates BV Become an affiliate Betropolis VIP 30% reward Earn money by bringing customers to Betropolis VIP. Every time a customer purchases using your link, you&#x27;ll earn a commission. Betropolis VIP+ Esports Bot $20.00 / month Join $20.00 / month Pay Join Pay Join Betropolis VIP+ Esports Bot | Whop",
  "finalUrl": "https://whop.com/betropolis/betropolis-esports-bot/",
  "fetchedAt": "2025-11-05T09:59:22.902Z",
  "textHash": "14adee6c9fbeea9d8cc62b002adbb2ba46a04e9017eb855988b236459ff5aa24",
  "drilled": false
}