{
  "baseUrl": "https://whop.com/blastoise-premium/blastoise-lifetime-premium/",
  "title": "Blastoise&#x27;s Lifetime Premium | Whop",
  "h1": "Blastoise&#x27;s Lifetime Premium",
  "bullets": [
    "Blastoise&#x27;s Lifetime Premium | Whop Sign in BP Blastoise&#x27;s Lifetime Premium Join Blastoise Trades Lifetime Premium Here 4.9 ( 139 ) Trading Gain lifetime access to Blastoise&#x27;s active community with daily live trades, alerts, and educational resources for stock and futures trading. $500.00 one-time purchase Pay Join Join 537 members Features Thousands of hours of educational content and trade ideas.",
    "Daily live trading calls with the community.",
    "90% win-rate on our consistent daily alerts.",
    "Extremely active community committed to helping you learn.",
    "Access to daily watchlists and market breakdowns.",
    "OS Oscar sanchez 12 days ago Great teacher Written 7 months after purchase",
    "JS Jose Salazar 14 days ago Patience. No forcing trades is the key to trading succeed. Blastoise helps teach you exactly that in discord. ðŸ¤‘ðŸ¤‘ðŸ¤‘ Written 14 days after purchase",
    "MM Mike Moeller 21 days ago David is extremely clear on his trade rules and also very clear on what trades he is taking and why. I would give him 10 stars if I could Written 21 days after purchase",
    "JM Jeffrey Montgomery 22 days ago The best community out there! Written 9 months after purchase"
  ],
  "paras": [
    "Sign in BP Blastoise&#x27;s Lifetime Premium Join Blastoise Trades Lifetime Premium Here 4.9 ( 139 ) Trading Gain lifetime access to Blastoise&#x27;s active community with daily live trades, alerts, and educational resources for stock and futures trading.",
    "Join 537 members Features Thousands of hours of educational content and trade ideas. Daily live trading calls with the community. 90% win-rate on our consistent daily alerts. Extremely active community committed to helping you learn. Access to daily watchlists and market breakdowns. Reviews 4.94 out of 5 139 total reviews 5 stars 4 stars 3 stars 2 stars 1 star OS Oscar sanchez 12 days ago Great teacher",
    "14 days ago Patience. No forcing trades is the key to trading succeed. Blastoise helps teach you exactly that in discord. ðŸ¤‘ðŸ¤‘ðŸ¤‘",
    "21 days ago David is extremely clear on his trade rules and also very clear on what trades he is taking and why. I would give him 10 stars if I could",
    "22 days ago The best community out there!",
    "About the creator BT View profile Blastoise Trades @ blastoisetrades â€¢ Joined Mar 2023 At Blastoiseâ€™s Premium, we provide a top-tier educational platform for stock options and futures traders. Our active community offers daily trade alerts, live trading sessions, and comprehensive educational resources. With thousands of hours of content and a supportive environment, weâ€™re dedicated to helping traders of all levels achieve consistent success in the markets. FAQs Do you guys also alert Future Alerts? Does this include stock/calls &amp; puts Options? Affiliates BP Become an affiliate Blastoise&#x27;s Premium 30% reward Earn money by bringing customers to Blastoise&#x27;s Premium. Every time a customer purchases using your link, you&#x27;ll earn a commission."
  ],
  "priceTokens": [
    "$500.00",
    "$500.00",
    "$500.00",
    "$1",
    "$1",
    "$1",
    "$22",
    "$1",
    "$1",
    "$1",
    "$1",
    "$1",
    "$2",
    "$1",
    "$2",
    "$2",
    "$2",
    "$2",
    "$3",
    "$3"
  ],
  "faq": [],
  "textSample": "Blastoise&#x27;s Lifetime Premium | Whop Sign in BP Blastoise&#x27;s Lifetime Premium Join Blastoise Trades Lifetime Premium Here 4.9 ( 139 ) Trading Gain lifetime access to Blastoise&#x27;s active community with daily live trades, alerts, and educational resources for stock and futures trading. $500.00 one-time purchase Pay Join Join 537 members Features Thousands of hours of educational content and trade ideas. Daily live trading calls with the community. 90% win-rate on our consistent daily alerts. Extremely active community committed to helping you learn. Access to daily watchlists and market breakdowns. Reviews 4.94 out of 5 139 total reviews 5 stars 4 stars 3 stars 2 stars 1 star OS Oscar sanchez 12 days ago Great teacher Written 7 months after purchase JS Jose Salazar 14 days ago Patience. No forcing trades is the key to trading succeed. Blastoise helps teach you exactly that in discord. ðŸ¤‘ðŸ¤‘ðŸ¤‘ Written 14 days after purchase MM Mike Moeller 21 days ago David is extremely clear on his trade rules and also very clear on what trades he is taking and why. I would give him 10 stars if I could Written 21 days after purchase JM Jeffrey Montgomery 22 days ago The best community out there! Written 9 months after purchase See all reviews About the creator BT View profile Blastoise Trades @ blastoisetrades â€¢ Joined Mar 2023 At Blastoiseâ€™s Premium, we provide a top-tier educational platform for stock options and futures traders. Our active community offers daily trade alerts, live trading sessions, and comprehensive educational resources. With thousands of hours of content and a supportive environment, weâ€™re dedicated to helping traders of all levels achieve consistent success in the markets. FAQs Do you guys also alert Future Alerts? Does this include stock/calls &amp; puts Options? Affiliates BP Become an affiliate Blastoise&#x27;s Premium 30% reward Earn money by bringing customers to Blastoise&#x27;s Premium. Every time a customer purchases using your link, you&#x27;ll earn a commission. Blastoise&#x27;s Lifetime Premium $500.00 one-time purchase Join $500.00 one-time purchase Pay Join Pay Join",
  "finalUrl": "https://whop.com/blastoise-premium/blastoise-lifetime-premium/",
  "fetchedAt": "2025-11-04T20:06:43.952Z",
  "textHash": "30908fcc0daf8706f6f7eea7c98588a53d4a2270e3f7716676e3a52b2a2c5ab7",
  "drilled": false
}