{
  "baseUrl": "https://whop.com/blastoise-premium/?a=alexburnett21",
  "title": "Blastoise&#x27;s Premium | Whop",
  "h1": "Blastoise&#x27;s Premium",
  "bullets": [
    "Powered by BP Blastoise&#x27;s Premium At Blastoiseâ€™s Premium, we provide a top-tier educational platform for stock options and futures traders. Our active community offers daily trade alerts, live trading sessions, and comprehensive educa... More 4.9 ( 140 ) Contact seller Products $50.00 / month Join the Blastoise Trades Monthly Premium Here Blastoise&#x27;s Premium 4.9 ( 107 ) $500.00 Join Blastoise Trades Lifetime Premium Here Blastoise&#x27;s Lifetime Premium 5.0 ( 16 ) $750.00 Get mentored by Blastoise 1 on 1 Here Blastoise&#x27;s 1 on 1 Mentorship 5.0 ( 5 ) Free Quality Trades with Blastoise&#x27;s Premium Blastoise&#x27;s FVG Cheat Sheet 5.0 ( 8 ) Free Join for Quality Trades &amp; Alerts Blastoise&#x27;s Free Discord 5.0 ( 4 ) Contact seller Reviews OS Oscar sanchez â€¢ Blastoise&#x27;s Premium 12 days ago Great teacher Written 7 months after purchase",
    "JS Jose Salazar â€¢ Blastoise&#x27;s Lifetime Premium 14 days ago Patience. No forcing trades is the key to trading succeed. Blastoise helps teach you exactly that in discord. ðŸ¤‘ðŸ¤‘ðŸ¤‘ Written 14 days after purchase",
    "MM Mike Moeller â€¢ Blastoise&#x27;s 1 on 1 Mentorship 21 days ago David is extremely clear on his trade rules and also very clear on what trades he is taking and why. I would give him 10 stars if I could Written 21 days after purchase",
    "JM Jeffrey Montgomery â€¢ Blastoise&#x27;s Premium 22 days ago The best community out there! Written 9 months after purchase"
  ],
  "paras": [
    "BP Blastoise&#x27;s Premium At Blastoiseâ€™s Premium, we provide a top-tier educational platform for stock options and futures traders. Our active community offers daily trade alerts, live trading sessions, and comprehensive educa... More 4.9 ( 140 ) Contact seller Products $50.00 / month Join the Blastoise Trades Monthly Premium Here Blastoise&#x27;s Premium 4.9 ( 107 ) $500.00 Join Blastoise Trades Lifetime Premium Here Blastoise&#x27;s Lifetime Premium 5.0 ( 16 ) $750.00 Get mentored by Blastoise 1 on 1 Here Blastoise&#x27;s 1 on 1 Mentorship 5.0 ( 5 ) Free Quality Trades with Blastoise&#x27;s Premium Blastoise&#x27;s FVG Cheat Sheet 5.0 ( 8 ) Free Join for Quality Trades &amp; Alerts Blastoise&#x27;s Free Discord 5.0 ( 4 ) Contact seller Reviews OS Oscar sanchez â€¢ Blastoise&#x27;s Premium 12 days ago Great teacher",
    "14 days ago Patience. No forcing trades is the key to trading succeed. Blastoise helps teach you exactly that in discord. ðŸ¤‘ðŸ¤‘ðŸ¤‘",
    "21 days ago David is extremely clear on his trade rules and also very clear on what trades he is taking and why. I would give him 10 stars if I could",
    "22 days ago The best community out there!"
  ],
  "priceTokens": [
    "$50.00",
    "$500.00",
    "$750.00",
    "$1",
    "$1",
    "$1",
    "$21",
    "$1",
    "$1",
    "$1",
    "$1",
    "$28",
    "$1",
    "$28",
    "$28",
    "$28",
    "$28",
    "$3",
    "$3",
    "$3"
  ],
  "faq": [],
  "textSample": "Powered by BP Blastoise&#x27;s Premium At Blastoiseâ€™s Premium, we provide a top-tier educational platform for stock options and futures traders. Our active community offers daily trade alerts, live trading sessions, and comprehensive educa... More 4.9 ( 140 ) Contact seller Products $50.00 / month Join the Blastoise Trades Monthly Premium Here Blastoise&#x27;s Premium 4.9 ( 107 ) $500.00 Join Blastoise Trades Lifetime Premium Here Blastoise&#x27;s Lifetime Premium 5.0 ( 16 ) $750.00 Get mentored by Blastoise 1 on 1 Here Blastoise&#x27;s 1 on 1 Mentorship 5.0 ( 5 ) Free Quality Trades with Blastoise&#x27;s Premium Blastoise&#x27;s FVG Cheat Sheet 5.0 ( 8 ) Free Join for Quality Trades &amp; Alerts Blastoise&#x27;s Free Discord 5.0 ( 4 ) Contact seller Reviews OS Oscar sanchez â€¢ Blastoise&#x27;s Premium 12 days ago Great teacher Written 7 months after purchase JS Jose Salazar â€¢ Blastoise&#x27;s Lifetime Premium 14 days ago Patience. No forcing trades is the key to trading succeed. Blastoise helps teach you exactly that in discord. ðŸ¤‘ðŸ¤‘ðŸ¤‘ Written 14 days after purchase MM Mike Moeller â€¢ Blastoise&#x27;s 1 on 1 Mentorship 21 days ago David is extremely clear on his trade rules and also very clear on what trades he is taking and why. I would give him 10 stars if I could Written 21 days after purchase JM Jeffrey Montgomery â€¢ Blastoise&#x27;s Premium 22 days ago The best community out there! Written 9 months after purchase See all reviews Blastoise&#x27;s Premium | Whop",
  "finalUrl": "https://whop.com/blastoise-premium/?a=alexburnett21",
  "fetchedAt": "2025-11-05T09:11:59.184Z",
  "textHash": "d1dfd583b8a139ac9b98460a2ba7004ab49e29e67214f5c1ad923c9fddd6d62e",
  "drilled": false
}