{
  "baseUrl": "https://whop.com/blw-forex-room-signals-group/blw-master-app/",
  "title": "BLW Master APP | Whop",
  "h1": "BLW Master APP",
  "bullets": [
    "Sign in BP BLW Master APP Live Trading Sessions Everyday 4.7 ( 3 ) Trading This is the PRIVATE Live Trading Room from Cristian AP, where he shares his screen while Live Trading $29.99 / month Pay Get access Join 25 members Features Live Trading Sessions",
    "Downleadable MT4 Custom Indicator",
    "Complete FREE Training inside",
    "AA alaa anqawi 9 days ago Written 3 days after purchase",
    "W Wael 1 month ago Written 5 months after purchase",
    "DJ David valentin jr. 1 month ago Written 3 months after purchase"
  ],
  "paras": [
    "Sign in BP BLW Master APP Live Trading Sessions Everyday 4.7 ( 3 ) Trading This is the PRIVATE Live Trading Room from Cristian AP, where he shares his screen while Live Trading",
    "$29.99 / month Pay Get access Join 25 members Features Live Trading Sessions Downleadable MT4 Custom Indicator Complete FREE Training inside Reviews 4.67 out of 5 3 total reviews 5 stars 4 stars 3 stars 2 stars 1 star AA alaa anqawi 9 days ago",
    "1 month ago",
    "1 month ago",
    "FAQs Do I need any experience? Where are the Live Sessions? What times are the sessions? Affiliates BP Become an affiliate BLW Trading Products 20% reward Earn money by bringing customers to BLW Trading Products. Every time a customer purchases using your link, you&#x27;ll earn a commission."
  ],
  "priceTokens": [
    "$29.99",
    "$29.99",
    "$29.99",
    "$1",
    "$1",
    "$1",
    "$22",
    "$1",
    "$1",
    "$1",
    "$1",
    "$1",
    "$2",
    "$1",
    "$2",
    "$2",
    "$2",
    "$2",
    "$3",
    "$3"
  ],
  "faq": [],
  "textSample": "Sign in BP BLW Master APP Live Trading Sessions Everyday 4.7 ( 3 ) Trading This is the PRIVATE Live Trading Room from Cristian AP, where he shares his screen while Live Trading $29.99 / month Pay Get access Join 25 members Features Live Trading Sessions Downleadable MT4 Custom Indicator Complete FREE Training inside Reviews 4.67 out of 5 3 total reviews 5 stars 4 stars 3 stars 2 stars 1 star AA alaa anqawi 9 days ago Written 3 days after purchase W Wael 1 month ago Written 5 months after purchase DJ David valentin jr. 1 month ago Written 3 months after purchase About the creator CA View profile cristian argueta @ cristianblwofficial â€¢ Joined Sep 2024 FAQs Do I need any experience? Where are the Live Sessions? What times are the sessions? Affiliates BP Become an affiliate BLW Trading Products 20% reward Earn money by bringing customers to BLW Trading Products. Every time a customer purchases using your link, you&#x27;ll earn a commission. BLW Master APP $29.99 / month +4 options Get access $29.99 / month 4 options Pay Get access Pay Get access BLW Master APP | Whop",
  "finalUrl": "https://whop.com/blw-forex-room-signals-group/blw-master-app/",
  "fetchedAt": "2025-11-05T10:43:29.286Z",
  "textHash": "8952ccdd9aabe837576df2d66aa15ac2d7b5f92a2684f80aa47de0e8a92d16a7",
  "drilled": false
}