{
  "baseUrl": "https://whop.com/free-community-82-5dc8/bookie-breaker/",
  "title": "Bookie Breakers VIP | Whop",
  "h1": "Bookie Breakers VIP",
  "bullets": [
    "Sign in BB Bookie Breakers VIP Join the #1 Sports Betting Community! 4.8 ( 36 ) Other Access daily plays, player props, and other income opportunities! We&#x27;re a community of winning bettors with educational resources and stat tools. $7.50 / week Pay Join Join 722 members Features Daily picks from professional cappers for ALL sports leagues",
    "Educational videos and resources for long-term success",
    "Join a community pot and benefit from profitable weeks.",
    "BC Brittany Charless 1 year ago I’ve joined a few chats and this one has made me more than any of the other one. They are consistent and know what they’re doing! Written 2 months after purchase",
    "AP Anthony Pliszak 1 year ago Great picks and cappers are active daily Written 7 days after purchase",
    "LW Leyton White 1 year ago Best sports betting discord on the website. Up 50+ units since I joined in April! Written 2 months after purchase",
    "LH Luke Hudson 2 years ago Been in here for a few days and I’ve made upwards of $1k already using $20 units… don’t miss out Written 5 days after purchase"
  ],
  "paras": [
    "Sign in BB Bookie Breakers VIP Join the #1 Sports Betting Community! 4.8 ( 36 ) Other Access daily plays, player props, and other income opportunities! We&#x27;re a community of winning bettors with educational resources and stat tools.",
    "$7.50 / week Pay Join Join 722 members Features Daily picks from professional cappers for ALL sports leagues Educational videos and resources for long-term success Join a community pot and benefit from profitable weeks. Reviews 4.83 out of 5 36 total reviews 5 stars 4 stars 3 stars 2 stars 1 star BC Brittany Charless 1 year ago I’ve joined a few chats and this one has made me more than any of the other one. They are consistent and know what they’re doing!",
    "1 year ago Great picks and cappers are active daily",
    "1 year ago Best sports betting discord on the website. Up 50+ units since I joined in April!",
    "2 years ago Been in here for a few days and I’ve made upwards of $1k already using $20 units… don’t miss out",
    "About the creator BB View profile Bookie Breakers @ bookiebreakersllc • Joined Apr 2023 I&#x27;ve dedicated my career to mastering sports betting strategies, and I want to share my insights and winning picks with a community of passionate bettors. Join us to elevate your game and profit together. FAQs How many plays are posted per day? How are plays sent out? Affiliates BB Become an affiliate Bookie Breakers | Sports Betting 30% reward Earn money by bringing customers to Bookie Breakers | Sports Betting. Every time a customer purchases using your link, you&#x27;ll earn a commission."
  ],
  "priceTokens": [
    "$7.50",
    "$1",
    "$20",
    "$7.50",
    "$7.50",
    "$1",
    "$1",
    "$1",
    "$22",
    "$1",
    "$1",
    "$1",
    "$1",
    "$1",
    "$2",
    "$1",
    "$2",
    "$2",
    "$2",
    "$2"
  ],
  "faq": [],
  "textSample": "Sign in BB Bookie Breakers VIP Join the #1 Sports Betting Community! 4.8 ( 36 ) Other Access daily plays, player props, and other income opportunities! We&#x27;re a community of winning bettors with educational resources and stat tools. $7.50 / week Pay Join Join 722 members Features Daily picks from professional cappers for ALL sports leagues Educational videos and resources for long-term success Join a community pot and benefit from profitable weeks. Reviews 4.83 out of 5 36 total reviews 5 stars 4 stars 3 stars 2 stars 1 star BC Brittany Charless 1 year ago I’ve joined a few chats and this one has made me more than any of the other one. They are consistent and know what they’re doing! Written 2 months after purchase AP Anthony Pliszak 1 year ago Great picks and cappers are active daily Written 7 days after purchase LW Leyton White 1 year ago Best sports betting discord on the website. Up 50+ units since I joined in April! Written 2 months after purchase LH Luke Hudson 2 years ago Been in here for a few days and I’ve made upwards of $1k already using $20 units… don’t miss out Written 5 days after purchase See all reviews About the creator BB View profile Bookie Breakers @ bookiebreakersllc • Joined Apr 2023 I&#x27;ve dedicated my career to mastering sports betting strategies, and I want to share my insights and winning picks with a community of passionate bettors. Join us to elevate your game and profit together. FAQs How many plays are posted per day? How are plays sent out? Affiliates BB Become an affiliate Bookie Breakers | Sports Betting 30% reward Earn money by bringing customers to Bookie Breakers | Sports Betting. Every time a customer purchases using your link, you&#x27;ll earn a commission. Bookie Breakers VIP $7.50 / week +2 options Join $7.50 / week 2 options Join Bookie Breakers VIP | Whop",
  "finalUrl": "https://whop.com/free-community-82-5dc8/bookie-breaker/",
  "fetchedAt": "2025-11-05T09:33:32.820Z",
  "textHash": "ed6453cd934ff73120dbb2cf0bd48c017f0099f613956971feba4a785b82f2aa",
  "drilled": false
}