{
  "baseUrl": "https://whop.com/lifetime-vip-6b/vip-discord-monthly/",
  "title": "Bullish Bandits VIP Access | Whop",
  "h1": "Bullish Bandits VIP Access",
  "bullets": [
    "Sign in BB Bullish Bandits VIP Access Exclusive Access to Bullish Bandits monthly membership 5.0 ( 5 ) Marketing agency 600+ Members Live Trading everyday✅ Course Videos + Live mentorships twice a week $75.00 / month 7 day trial Pay Get offer Join 2 members Features Monthly access to live trading and 1-on-1 mentorship.",
    "Access to 50+ ebooks and comprehensive trading courses.",
    "Precision trading setups with high win rates.",
    "6x09 1 month ago absolutely gas, amazing content for the price, worth every penny Written 1 month after purchase",
    "T Tim 8 months ago One of the best trading servers I have been to. These guys really helped me out, and the free value is amazing. Written 3 days after purchase",
    "SB Sam Brown 1 year ago I was able to feed my family, grow 5k into 50k through funded accounts. Now I live in PR with a hot ass Latina and life is good. there is so much amazing info in here that actually changed everything for my trading from big as SLs to catching moves to the TICK. get this shit ... Show more Written 1 month after purchase",
    "CL Camden Lytle 1 year ago They provide a bunch of free value. Super helpful taught me how to trade like them in WEEKS they made everything super simple very glad I found them. Written 7 days after purchase"
  ],
  "paras": [
    "Sign in BB Bullish Bandits VIP Access Exclusive Access to Bullish Bandits monthly membership 5.0 ( 5 ) Marketing agency 600+ Members Live Trading everyday✅ Course Videos + Live mentorships twice a week",
    "$75.00 / month 7 day trial Pay Get offer Join 2 members Features Monthly access to live trading and 1-on-1 mentorship. Access to 50+ ebooks and comprehensive trading courses. Precision trading setups with high win rates. Reviews 5 out of 5 5 total reviews 5 stars 4 stars 3 stars 2 stars 1 star 6x09 1 month ago absolutely gas, amazing content for the price, worth every penny",
    "8 months ago One of the best trading servers I have been to. These guys really helped me out, and the free value is amazing.",
    "1 year ago I was able to feed my family, grow 5k into 50k through funded accounts. Now I live in PR with a hot ass Latina and life is good. there is so much amazing info in here that actually changed everything for my trading from big as SLs to catching moves to the TICK. get this shit ...",
    "Written 1 month after purchase CL Camden Lytle 1 year ago They provide a bunch of free value. Super helpful taught me how to trade like them in WEEKS they made everything super simple very glad I found them.",
    "About the creator AX View profile Arbi Xhengo @ arbixh • Joined Oct 2023 I&#x27;ve crafted Bullish Bandits to empower traders with precision, accuracy, and an unbeatable community. Over the years, I&#x27;ve developed a passion for guiding others to success with our vast ICT knowledge and daily live streams. FAQs How should I start? What is your Refund Policy? Is any of this financial advice? Affiliates BB Become an affiliate Bullish Bandits 50% reward Earn money by bringing customers to Bullish Bandits. Every time a customer purchases using your link, you&#x27;ll earn a commission."
  ],
  "priceTokens": [
    "$75.00",
    "$75.00",
    "$75.00",
    "$1",
    "$1",
    "$1",
    "$22",
    "$1",
    "$1",
    "$1",
    "$1",
    "$1",
    "$2",
    "$1",
    "$2",
    "$2",
    "$2",
    "$2",
    "$3",
    "$3"
  ],
  "faq": [],
  "textSample": "Sign in BB Bullish Bandits VIP Access Exclusive Access to Bullish Bandits monthly membership 5.0 ( 5 ) Marketing agency 600+ Members Live Trading everyday✅ Course Videos + Live mentorships twice a week $75.00 / month 7 day trial Pay Get offer Join 2 members Features Monthly access to live trading and 1-on-1 mentorship. Access to 50+ ebooks and comprehensive trading courses. Precision trading setups with high win rates. Reviews 5 out of 5 5 total reviews 5 stars 4 stars 3 stars 2 stars 1 star 6x09 1 month ago absolutely gas, amazing content for the price, worth every penny Written 1 month after purchase T Tim 8 months ago One of the best trading servers I have been to. These guys really helped me out, and the free value is amazing. Written 3 days after purchase SB Sam Brown 1 year ago I was able to feed my family, grow 5k into 50k through funded accounts. Now I live in PR with a hot ass Latina and life is good. there is so much amazing info in here that actually changed everything for my trading from big as SLs to catching moves to the TICK. get this shit ... Show more Written 1 month after purchase CL Camden Lytle 1 year ago They provide a bunch of free value. Super helpful taught me how to trade like them in WEEKS they made everything super simple very glad I found them. Written 7 days after purchase See all reviews About the creator AX View profile Arbi Xhengo @ arbixh • Joined Oct 2023 I&#x27;ve crafted Bullish Bandits to empower traders with precision, accuracy, and an unbeatable community. Over the years, I&#x27;ve developed a passion for guiding others to success with our vast ICT knowledge and daily live streams. FAQs How should I start? What is your Refund Policy? Is any of this financial advice? Affiliates BB Become an affiliate Bullish Bandits 50% reward Earn money by bringing customers to Bullish Bandits. Every time a customer purchases using your link, you&#x27;ll earn a commission. Bullish Bandits VIP Access $75.00 / month +1 option Get offer $75.00 / month 1 option Pay Get offer Pay Get offer Bullish Bandits VIP Access | Whop",
  "finalUrl": "https://whop.com/lifetime-vip-6b/vip-discord-monthly/",
  "fetchedAt": "2025-11-04T21:59:21.979Z",
  "textHash": "bb58cb3a6ba18d20fbcf8fa4c810565af0e429b8ee27ec9ba08500958d644bb0",
  "drilled": false
}