{
  "baseUrl": "https://whop.com/the-chart-hackers/chart-hackers-crypto/",
  "title": "Chart Hackers-Pay with Crypto | Whop",
  "h1": "Chart Hackers-Pay with Crypto",
  "bullets": [
    "Sign in CH Chart Hackers-Pay with Crypto Get the entry, sell the top, take the profit 4.8 ( 41 ) Trading Get access to Dylan&#x27;s (AKA: the Lord of Entry) private Discord and Telegram trading communities. Powered by Indicators and Automated trading Bots to help you win. Sign up today! $299.00 for 3 months Pay Join Join 28 members Features Pay with crypto and access exclusive automated trading bots and indicators.",
    "Join a private trading community on Discord &amp; Telegram.",
    "Learn expert entry and exit strategies from top traders.",
    "Get real-time insights and high-level trade ideas.",
    "Suitable for both beginners and advanced traders.",
    "B Brandon 3 days ago The best trading community out there! If you are looking for an education, supportive community, world class traders of all different backgrounds and areas of expertise, you came to the right place! This group has exceeded my expectations by miles! Every trader who leads this group has a different... Show more Written 2 months after purchase",
    "FV Fabian Vanderstraeten 13 days ago A community like no other! A real community, These guys care about the evolution of their members. Education like I've never seen before. Yes it comes with a price, but what you get in return is priceless! Not a factory, a Family! Written 7 months after purchase",
    "B BubaI888 13 days ago If u like to learn and earn, welcome here Written 3 days after purchase",
    "TA Tiaan van Aswegen 13 days ago The best community. There for you through the good and bad times. I don't have money to invest in crypto right now, but I made sure I have enough for my Chart Hackers membership at least. The education is invaluable. Written 4 months after purchase"
  ],
  "paras": [
    "Sign in CH Chart Hackers-Pay with Crypto Get the entry, sell the top, take the profit 4.8 ( 41 ) Trading Get access to Dylan&#x27;s (AKA: the Lord of Entry) private Discord and Telegram trading communities. Powered by Indicators and Automated trading Bots to help you win. Sign up today!",
    "Join 28 members Features Pay with crypto and access exclusive automated trading bots and indicators. Join a private trading community on Discord &amp; Telegram. Learn expert entry and exit strategies from top traders. Get real-time insights and high-level trade ideas. Suitable for both beginners and advanced traders. Reviews 4.80 out of 5 41 total reviews 5 stars 4 stars 3 stars 2 stars 1 star B Brandon 3 days ago The best trading community out there! If you are looking for an education, supportive community, world class traders of all different backgrounds and areas of expertise, you came to the right place! This group has exceeded my expectations by miles! Every trader who leads this group has a different...",
    "Written 2 months after purchase FV Fabian Vanderstraeten 13 days ago A community like no other! A real community, These guys care about the evolution of their members. Education like I've never seen before. Yes it comes with a price, but what you get in return is priceless! Not a factory, a Family!",
    "13 days ago If u like to learn and earn, welcome here",
    "13 days ago The best community. There for you through the good and bad times. I don't have money to invest in crypto right now, but I made sure I have enough for my Chart Hackers membership at least. The education is invaluable.",
    "About the creator CB View profile Crypto Banter @ banteradmin • Joined Feb 2024 FAQs Is this suitable for beginners? How do I join? Affiliates CH Become an affiliate Chart Hackers 15% reward Earn money by bringing customers to Chart Hackers. Every time a customer purchases using your link, you&#x27;ll earn a commission."
  ],
  "priceTokens": [
    "$299.00",
    "$299.00",
    "$299.00",
    "$1",
    "$1",
    "$1",
    "$22",
    "$1",
    "$1",
    "$1",
    "$1",
    "$1",
    "$2",
    "$1",
    "$2",
    "$2",
    "$2",
    "$2",
    "$3",
    "$3"
  ],
  "faq": [],
  "textSample": "Sign in CH Chart Hackers-Pay with Crypto Get the entry, sell the top, take the profit 4.8 ( 41 ) Trading Get access to Dylan&#x27;s (AKA: the Lord of Entry) private Discord and Telegram trading communities. Powered by Indicators and Automated trading Bots to help you win. Sign up today! $299.00 for 3 months Pay Join Join 28 members Features Pay with crypto and access exclusive automated trading bots and indicators. Join a private trading community on Discord &amp; Telegram. Learn expert entry and exit strategies from top traders. Get real-time insights and high-level trade ideas. Suitable for both beginners and advanced traders. Reviews 4.80 out of 5 41 total reviews 5 stars 4 stars 3 stars 2 stars 1 star B Brandon 3 days ago The best trading community out there! If you are looking for an education, supportive community, world class traders of all different backgrounds and areas of expertise, you came to the right place! This group has exceeded my expectations by miles! Every trader who leads this group has a different... Show more Written 2 months after purchase FV Fabian Vanderstraeten 13 days ago A community like no other! A real community, These guys care about the evolution of their members. Education like I've never seen before. Yes it comes with a price, but what you get in return is priceless! Not a factory, a Family! Written 7 months after purchase B BubaI888 13 days ago If u like to learn and earn, welcome here Written 3 days after purchase TA Tiaan van Aswegen 13 days ago The best community. There for you through the good and bad times. I don't have money to invest in crypto right now, but I made sure I have enough for my Chart Hackers membership at least. The education is invaluable. Written 4 months after purchase See all reviews About the creator CB View profile Crypto Banter @ banteradmin • Joined Feb 2024 FAQs Is this suitable for beginners? How do I join? Affiliates CH Become an affiliate Chart Hackers 15% reward Earn money by bringing customers to Chart Hackers. Every time a customer purchases using your link, you&#x27;ll earn a commission. Chart Hackers-Pay with Crypto $299.00 for 3 months Join $299.00 for 3 months Join Chart Hackers-Pay with Crypto | Whop",
  "finalUrl": "https://whop.com/the-chart-hackers/chart-hackers-crypto/",
  "fetchedAt": "2025-11-05T17:31:21.924Z",
  "textHash": "383713f892321c79bba56f6f76a5d557c35e23e95af7df872cf978b002c510fc",
  "drilled": false
}