{
  "baseUrl": "https://whop.com/clippie-ai-lite/?a=alexburnett21",
  "title": "Clippie AI | Whop",
  "h1": "Clippie AI",
  "bullets": [
    "Powered by CA Clippie AI 4.7 ( 7 ) Contact seller Products $19.99 / month Viral Clips 100x Faster Clippie AI - Lite 4.5 ( 4 ) $34.99 / month Viral Clips 100x Faster Clippie AI - Creator 5.0 ( 1 ) $69.99 / month Viral Clips 100x Faster Clippie AI - Pro New $294.00 / year Viral Clips 100x Faster Clippie AI - Creator (yearly) 5.0 ( 1 ) $179.00 / year Viral Clips 100x Faster Clippie AI - Lite (yearly) New $499.00 / year Viral Clips 100x Faster Clippie AI - Pro (yearly) New Contact seller Reviews B Boyko • Clippie AI - Creator (yearly) 1 month ago is a good product easy to use, has a lot of features Written 2 months after purchase",
    "RH Rehan Hussain • Clippie AI - Lite 7 days ago Written 1 month after purchase",
    "TM Tamar Malone • Clippie AI - Lite 7 days ago Written 1 month after purchase",
    "K Kamyar 10 days ago Written 14 days after purchase"
  ],
  "paras": [
    "CA Clippie AI 4.7 ( 7 ) Contact seller Products $19.99 / month Viral Clips 100x Faster Clippie AI - Lite 4.5 ( 4 ) $34.99 / month Viral Clips 100x Faster Clippie AI - Creator 5.0 ( 1 ) $69.99 / month Viral Clips 100x Faster Clippie AI - Pro New $294.00 / year Viral Clips 100x Faster Clippie AI - Creator (yearly) 5.0 ( 1 ) $179.00 / year Viral Clips 100x Faster Clippie AI - Lite (yearly) New $499.00 / year Viral Clips 100x Faster Clippie AI - Pro (yearly) New Contact seller Reviews B Boyko • Clippie AI - Creator (yearly) 1 month ago is a good product easy to use, has a lot of features",
    "7 days ago",
    "7 days ago",
    "10 days ago"
  ],
  "priceTokens": [
    "$19.99",
    "$34.99",
    "$69.99",
    "$294.00",
    "$179.00",
    "$499.00",
    "$1",
    "$1",
    "$1",
    "$21",
    "$1",
    "$1",
    "$1",
    "$1",
    "$28",
    "$1",
    "$28",
    "$28",
    "$28",
    "$28"
  ],
  "faq": [],
  "textSample": "Powered by CA Clippie AI 4.7 ( 7 ) Contact seller Products $19.99 / month Viral Clips 100x Faster Clippie AI - Lite 4.5 ( 4 ) $34.99 / month Viral Clips 100x Faster Clippie AI - Creator 5.0 ( 1 ) $69.99 / month Viral Clips 100x Faster Clippie AI - Pro New $294.00 / year Viral Clips 100x Faster Clippie AI - Creator (yearly) 5.0 ( 1 ) $179.00 / year Viral Clips 100x Faster Clippie AI - Lite (yearly) New $499.00 / year Viral Clips 100x Faster Clippie AI - Pro (yearly) New Contact seller Reviews B Boyko • Clippie AI - Creator (yearly) 1 month ago is a good product easy to use, has a lot of features Written 2 months after purchase RH Rehan Hussain • Clippie AI - Lite 7 days ago Written 1 month after purchase TM Tamar Malone • Clippie AI - Lite 7 days ago Written 1 month after purchase K Kamyar 10 days ago Written 14 days after purchase See all reviews Clippie AI | Whop",
  "finalUrl": "https://whop.com/clippie-ai-lite/?a=alexburnett21",
  "fetchedAt": "2025-11-04T21:35:10.517Z",
  "textHash": "50a3670c165d75fc3ff4abac958ed826a431f5b27208d928c7bb71ab43e571d9",
  "drilled": false
}