{
  "baseUrl": "https://whop.com/clippersflow/clippers-flow-premium/",
  "title": "Clippers Flow Premium | Whop",
  "h1": "Clippers Flow Premium",
  "bullets": [
    "Sign in CF Clippers Flow Premium Crea clips, postealos &amp; gana dinero! 4.8 ( 128 ) Clipping agency Te vamos a conectar con compaÃ±ias/creadores de contenido que te pagan por hacer clip/crear contenido &amp; postearlo! $50.00 one-time purchase Pay Join Join 170 members Features Curso de EdiciÃ³n Avanzado",
    "Llamadas de Coaching diarias",
    "Acceso a campaÃ±as exclusivas",
    "Comunidad de Clippers Expertos",
    "M Maurichi 2 days ago Buenazo Written 4 days after purchase",
    "W wimapro 4 days ago ðŸ”¥ðŸ”¥ðŸ”¥ Written 2 days after purchase",
    "SD Samuel DESAUGUSTE 12 days ago 5 estrellas, perfecto Written 3 days after purchase",
    "J javier 14 days ago le doy 5 estrellas, excelente Written 2 days after purchase"
  ],
  "paras": [
    "Sign in CF Clippers Flow Premium Crea clips, postealos &amp; gana dinero! 4.8 ( 128 ) Clipping agency Te vamos a conectar con compaÃ±ias/creadores de contenido que te pagan por hacer clip/crear contenido &amp; postearlo!",
    "Join 170 members Features Curso de EdiciÃ³n Avanzado Llamadas de Coaching diarias Acceso a campaÃ±as exclusivas Comunidad de Clippers Expertos Reviews 4.84 out of 5 128 total reviews 5 stars 4 stars 3 stars 2 stars 1 star M Maurichi 2 days ago Buenazo",
    "4 days ago ðŸ”¥ðŸ”¥ðŸ”¥",
    "12 days ago 5 estrellas, perfecto",
    "14 days ago le doy 5 estrellas, excelente",
    "About the creator JH View profile Jesus Hernandez @ jesushndez â€¢ Joined Aug 2023 Founder @ Clippers Flow - Creamos sistemas de viralizaciÃ³n para artistas, marcas, influencers, y streamers mediante distribuciÃ³n masiva de contenido corto. Affiliates CF Become an affiliate Clippers Flow 30% reward Earn money by bringing customers to Clippers Flow. Every time a customer purchases using your link, you&#x27;ll earn a commission."
  ],
  "priceTokens": [
    "$50.00",
    "$50.00",
    "$50.00",
    "$1",
    "$1",
    "$1",
    "$22",
    "$1",
    "$1",
    "$1",
    "$1",
    "$1",
    "$2",
    "$1",
    "$2",
    "$2",
    "$2",
    "$2",
    "$3",
    "$3"
  ],
  "faq": [],
  "textSample": "Sign in CF Clippers Flow Premium Crea clips, postealos &amp; gana dinero! 4.8 ( 128 ) Clipping agency Te vamos a conectar con compaÃ±ias/creadores de contenido que te pagan por hacer clip/crear contenido &amp; postearlo! $50.00 one-time purchase Pay Join Join 170 members Features Curso de EdiciÃ³n Avanzado Llamadas de Coaching diarias Acceso a campaÃ±as exclusivas Comunidad de Clippers Expertos Reviews 4.84 out of 5 128 total reviews 5 stars 4 stars 3 stars 2 stars 1 star M Maurichi 2 days ago Buenazo Written 4 days after purchase W wimapro 4 days ago ðŸ”¥ðŸ”¥ðŸ”¥ Written 2 days after purchase SD Samuel DESAUGUSTE 12 days ago 5 estrellas, perfecto Written 3 days after purchase J javier 14 days ago le doy 5 estrellas, excelente Written 2 days after purchase See all reviews About the creator JH View profile Jesus Hernandez @ jesushndez â€¢ Joined Aug 2023 Founder @ Clippers Flow - Creamos sistemas de viralizaciÃ³n para artistas, marcas, influencers, y streamers mediante distribuciÃ³n masiva de contenido corto. Affiliates CF Become an affiliate Clippers Flow 30% reward Earn money by bringing customers to Clippers Flow. Every time a customer purchases using your link, you&#x27;ll earn a commission. Clippers Flow Premium $50.00 one-time purchase Join $50.00 one-time purchase Pay Join Pay Join Clippers Flow Premium | Whop",
  "finalUrl": "https://whop.com/clippersflow/clippers-flow-premium/",
  "fetchedAt": "2025-11-05T09:58:34.774Z",
  "textHash": "6b15ec2fee221564dc351aa9518661471668476cf67506860ef8d73835994758",
  "drilled": false
}