{
  "baseUrl": "https://whop.com/clube-de-membros-vip/clube-de-membros-vip/?a=alexburnett21",
  "title": "Clube de Membros VIP | Whop",
  "h1": "Clube de Membros VIP",
  "bullets": [
    "Sign in CM Clube de Membros VIP Impulsione suas vendas na Amazon 5.0 ( 2 ) Amazon FBA O Clube de Membros √© a comunidade exclusiva para Amazon Sellers brasileiros que vendem (ou querem vender) na Amazon dos Estados Unidos. Aqui voc√™ encontra ferramentas, leads, estrat√©gias de sourcing e um networking poderoso com outros vendedores que entendem os desafios de atuar no mercado americano. Seja voc√™ iniciante ou j√° com opera√ß√µes rodando nos EUA, nossa comunidade vai te ajudar $49.90 / month 3 day trial Pay Join waitlist Join 6 members Features ü§ù Networking com Amazon Sellers brasileiros nos EUA",
    "üì¶ Leads de produtos atualizados diariamente",
    "üìö Estrat√©gias avan√ßadas de sourcing",
    "üöÄ Conte√∫dos VIP e mentorias",
    "‚è≥ Evite erros e economize tempo e dinheiro",
    "MT MARCILENE D TEIXEIRA 2 years ago OTIMO CANAL! POUPA TEMPO PARA QUEM TRABALHA FAZENDO ARBITRAGEM. OTIMOS LEADS! Written 3 months after purchase",
    "RS Ricardo Silva 2 months ago Written 8 months after purchase"
  ],
  "paras": [
    "Sign in CM Clube de Membros VIP Impulsione suas vendas na Amazon 5.0 ( 2 ) Amazon FBA O Clube de Membros √© a comunidade exclusiva para Amazon Sellers brasileiros que vendem (ou querem vender) na Amazon dos Estados Unidos.",
    "Aqui voc√™ encontra ferramentas, leads, estrat√©gias de sourcing e um networking poderoso com outros vendedores que entendem os desafios de atuar no mercado americano.",
    "Seja voc√™ iniciante ou j√° com opera√ß√µes rodando nos EUA, nossa comunidade vai te ajudar",
    "$49.90 / month 3 day trial Pay Join waitlist Join 6 members Features ü§ù Networking com Amazon Sellers brasileiros nos EUA üì¶ Leads de produtos atualizados diariamente üìö Estrat√©gias avan√ßadas de sourcing üöÄ Conte√∫dos VIP e mentorias ‚è≥ Evite erros e economize tempo e dinheiro Reviews 5 out of 5 2 total reviews 5 stars 4 stars 3 stars 2 stars 1 star MT MARCILENE D TEIXEIRA 2 years ago OTIMO CANAL! POUPA TEMPO PARA QUEM TRABALHA FAZENDO ARBITRAGEM. OTIMOS LEADS!",
    "2 months ago",
    "FAQs O que √© o Clube de Membros? Preciso j√° vender na Amazon US para participar? Qual a diferen√ßa entre Free e VIP? Os leads s√£o atualizados com que frequ√™ncia? O Clube substitui uma mentoria individual? Affiliates CM Become an affiliate Clube de Membros 10% reward Earn money by bringing customers to Clube de Membros. Every time a customer purchases using your link, you&#x27;ll earn a commission."
  ],
  "priceTokens": [
    "$49.90",
    "$49.90",
    "$49.90",
    "$1",
    "$1",
    "$1",
    "$23",
    "$1",
    "$1",
    "$1",
    "$1",
    "$1",
    "$2",
    "$1",
    "$2",
    "$2",
    "$2",
    "$2",
    "$3",
    "$3"
  ],
  "faq": [],
  "textSample": "Sign in CM Clube de Membros VIP Impulsione suas vendas na Amazon 5.0 ( 2 ) Amazon FBA O Clube de Membros √© a comunidade exclusiva para Amazon Sellers brasileiros que vendem (ou querem vender) na Amazon dos Estados Unidos. Aqui voc√™ encontra ferramentas, leads, estrat√©gias de sourcing e um networking poderoso com outros vendedores que entendem os desafios de atuar no mercado americano. Seja voc√™ iniciante ou j√° com opera√ß√µes rodando nos EUA, nossa comunidade vai te ajudar $49.90 / month 3 day trial Pay Join waitlist Join 6 members Features ü§ù Networking com Amazon Sellers brasileiros nos EUA üì¶ Leads de produtos atualizados diariamente üìö Estrat√©gias avan√ßadas de sourcing üöÄ Conte√∫dos VIP e mentorias ‚è≥ Evite erros e economize tempo e dinheiro Reviews 5 out of 5 2 total reviews 5 stars 4 stars 3 stars 2 stars 1 star MT MARCILENE D TEIXEIRA 2 years ago OTIMO CANAL! POUPA TEMPO PARA QUEM TRABALHA FAZENDO ARBITRAGEM. OTIMOS LEADS! Written 3 months after purchase RS Ricardo Silva 2 months ago Written 8 months after purchase About the creator BS View profile Bruno Silva @ silvabruno ‚Ä¢ Joined Jul 2023 Sou Bruno Silva, apaixonado por ajudar vendedores a crescerem na Amazon. Com anos de experi√™ncia, criei este clube para oferecer suporte, ferramentas e uma comunidade vibrante para impulsionar suas vendas. FAQs O que √© o Clube de Membros? Preciso j√° vender na Amazon US para participar? Qual a diferen√ßa entre Free e VIP? Os leads s√£o atualizados com que frequ√™ncia? O Clube substitui uma mentoria individual? Affiliates CM Become an affiliate Clube de Membros 10% reward Earn money by bringing customers to Clube de Membros. Every time a customer purchases using your link, you&#x27;ll earn a commission. Clube de Membros VIP $49.90 / month +1 option Join $49.90 / month 1 option Pay Join Pay Join Clube de Membros VIP | Whop",
  "finalUrl": "https://whop.com/clube-de-membros-vip/clube-de-membros-vip/?a=alexburnett21",
  "fetchedAt": "2025-11-05T10:49:42.141Z",
  "textHash": "3323aac49870b7ae1b0f3110666fdb279a2911d8aa9a5597850c715bbdafce7f",
  "drilled": true
}