{
  "baseUrl": "https://whop.com/codycoverspreads/vip-all-access-ef/",
  "title": "Codycoverspreads VIP | Whop",
  "h1": "Codycoverspreads VIP",
  "bullets": [
    "Codycoverspreads VIP | Whop Sign in C Codycoverspreads VIP Gain Access to Cody&#x27;s Exclusive Plays 4.4 ( 530 ) Other Get access to Cody&#x27;s private Telegram for exclusive sports betting picks and 24/7 support from the GOAT of sports betting. $199.00 for 1 day Pay Join Join 1,120 members Reviews 4.36 out of 5 530 total reviews 5 stars 4 stars 3 stars 2 stars 1 star C Cmedz 9 days ago Havenâ€™t wonâ€™t yet but keeping good faith one will hit Written 1 day after purchase",
    "D Derek 11 days ago I need my refund it just got taken out of my account out of nowhere Written 2 days after purchase",
    "18 days ago Too the moon ðŸŒ– Written 6 months after purchase",
    "M Matt 24 days ago Great app. 5 stars across the board Written 16 days after purchase"
  ],
  "paras": [
    "Sign in C Codycoverspreads VIP Gain Access to Cody&#x27;s Exclusive Plays 4.4 ( 530 ) Other Get access to Cody&#x27;s private Telegram for exclusive sports betting picks and 24/7 support from the GOAT of sports betting.",
    "$199.00 for 1 day Pay Join Join 1,120 members Reviews 4.36 out of 5 530 total reviews 5 stars 4 stars 3 stars 2 stars 1 star C Cmedz 9 days ago Havenâ€™t wonâ€™t yet but keeping good faith one will hit",
    "11 days ago I need my refund it just got taken out of my account out of nowhere",
    "18 days ago Too the moon ðŸŒ–",
    "24 days ago Great app. 5 stars across the board",
    "About the creator C View profile Codycoversspreads @ coversznpayments â€¢ Joined Jan 2024 I&#x27;ve been betting professionally for over 5 years, developing a 76% win rate and a 220% ROI on parlays. My passion is to help others succeed in sports betting through my exclusive plays and analysis. FAQs How long has Cody been betting professionally for? If this is my first time tailing Cody, which package should I check out? If I have general questions or need help, where can I reach out? Affiliates C Become an affiliate Codycoverspreads 30% reward Earn money by bringing customers to Codycoverspreads. Every time a customer purchases using your link, you&#x27;ll earn a commission."
  ],
  "priceTokens": [
    "$199.00",
    "$199.00",
    "$199.00",
    "$1",
    "$1",
    "$1",
    "$22",
    "$1",
    "$1",
    "$1",
    "$1",
    "$1",
    "$2",
    "$1",
    "$2",
    "$2",
    "$2",
    "$2",
    "$3",
    "$3"
  ],
  "faq": [],
  "textSample": "Codycoverspreads VIP | Whop Sign in C Codycoverspreads VIP Gain Access to Cody&#x27;s Exclusive Plays 4.4 ( 530 ) Other Get access to Cody&#x27;s private Telegram for exclusive sports betting picks and 24/7 support from the GOAT of sports betting. $199.00 for 1 day Pay Join Join 1,120 members Reviews 4.36 out of 5 530 total reviews 5 stars 4 stars 3 stars 2 stars 1 star C Cmedz 9 days ago Havenâ€™t wonâ€™t yet but keeping good faith one will hit Written 1 day after purchase D Derek 11 days ago I need my refund it just got taken out of my account out of nowhere Written 2 days after purchase 18 days ago Too the moon ðŸŒ– Written 6 months after purchase M Matt 24 days ago Great app. 5 stars across the board Written 16 days after purchase See all reviews About the creator C View profile Codycoversspreads @ coversznpayments â€¢ Joined Jan 2024 I&#x27;ve been betting professionally for over 5 years, developing a 76% win rate and a 220% ROI on parlays. My passion is to help others succeed in sports betting through my exclusive plays and analysis. FAQs How long has Cody been betting professionally for? If this is my first time tailing Cody, which package should I check out? If I have general questions or need help, where can I reach out? Affiliates C Become an affiliate Codycoverspreads 30% reward Earn money by bringing customers to Codycoverspreads. Every time a customer purchases using your link, you&#x27;ll earn a commission. Codycoverspreads VIP $199.00 for 1 day +6 options Join $199.00 for 1 day 6 options Pay Join Pay Join",
  "finalUrl": "https://whop.com/codycoverspreads/vip-all-access-ef/",
  "fetchedAt": "2025-11-05T09:19:10.573Z",
  "textHash": "345eacc122d3949f0b4251216a27dc1f84710ea56bf09cfd6b34c2ff554c348a",
  "drilled": false
}