{
  "baseUrl": "https://whop.com/criscatalyst/content-ai/",
  "title": "Copy-Paste Digital Creator | Whop",
  "h1": "Copy-Paste Digital Creator",
  "bullets": [
    "Sign in Unmute Unmute C Copy-Paste Digital Creator Build a $5k/month Personal Brand in 90 days 5.0 ( 95 ) Social media Build a $5k/month personal brand in 90 days working 45 minutes a day, or I keep coaching you until you do. $97.00 one-time purchase Pay Get access Join 22 members Features Advanced Social Media Training",
    "Instagram Automations",
    "Arbitrary Growth System",
    "Ready-to-Sell Digital Products",
    "Weekly Group Calls",
    "TT Trinerty Thompson 5 months ago Very Informative course, Iâ€™m learning a lot and still have a lot to learn!! Written 5 months after purchase",
    "D DAVID 6 months ago Very interesting and informative ! Thanks Written 4 months after purchase",
    "MM Marlon Manalo 6 months ago Thanl you for this free course, i will study hard to learn. Written 2 hours after purchase",
    "S Siddharth 6 months ago Thank you, this course helped me a lot Written 1 hour after purchase"
  ],
  "paras": [
    "Sign in Unmute Unmute C Copy-Paste Digital Creator Build a $5k/month Personal Brand in 90 days 5.0 ( 95 ) Social media Build a $5k/month personal brand in 90 days working 45 minutes a day, or I keep coaching you until you do.",
    "Join 22 members Features Advanced Social Media Training Instagram Automations Arbitrary Growth System Ready-to-Sell Digital Products Weekly Group Calls Reviews 4.99 out of 5 95 total reviews 5 stars 4 stars 3 stars 2 stars 1 star TT Trinerty Thompson 5 months ago Very Informative course, Iâ€™m learning a lot and still have a lot to learn!!",
    "6 months ago Very interesting and informative ! Thanks",
    "6 months ago Thanl you for this free course, i will study hard to learn.",
    "6 months ago Thank you, this course helped me a lot",
    "About the creator CC View profile Cristiano Capasso @ criscatalyst â€¢ Joined Jun 2024 I help creators scale fast with content systemsðŸš€ Affiliates C Become an affiliate criscatalyst 40% reward Earn money by bringing customers to criscatalyst. Every time a customer purchases using your link, you&#x27;ll earn a commission."
  ],
  "priceTokens": [
    "$5",
    "$5",
    "$97.00",
    "$97.00",
    "$97.00",
    "$1",
    "$1",
    "$1",
    "$22",
    "$1",
    "$1",
    "$1",
    "$1",
    "$1",
    "$2",
    "$1",
    "$2",
    "$2",
    "$2",
    "$2"
  ],
  "faq": [],
  "textSample": "Sign in Unmute Unmute C Copy-Paste Digital Creator Build a $5k/month Personal Brand in 90 days 5.0 ( 95 ) Social media Build a $5k/month personal brand in 90 days working 45 minutes a day, or I keep coaching you until you do. $97.00 one-time purchase Pay Get access Join 22 members Features Advanced Social Media Training Instagram Automations Arbitrary Growth System Ready-to-Sell Digital Products Weekly Group Calls Reviews 4.99 out of 5 95 total reviews 5 stars 4 stars 3 stars 2 stars 1 star TT Trinerty Thompson 5 months ago Very Informative course, Iâ€™m learning a lot and still have a lot to learn!! Written 5 months after purchase D DAVID 6 months ago Very interesting and informative ! Thanks Written 4 months after purchase MM Marlon Manalo 6 months ago Thanl you for this free course, i will study hard to learn. Written 2 hours after purchase S Siddharth 6 months ago Thank you, this course helped me a lot Written 1 hour after purchase See all reviews About the creator CC View profile Cristiano Capasso @ criscatalyst â€¢ Joined Jun 2024 I help creators scale fast with content systemsðŸš€ Affiliates C Become an affiliate criscatalyst 40% reward Earn money by bringing customers to criscatalyst. Every time a customer purchases using your link, you&#x27;ll earn a commission. Copy-Paste Digital Creator $97.00 one-time purchase Get access $97.00 one-time purchase Pay Get access Pay Get access Copy-Paste Digital Creator | Whop",
  "finalUrl": "https://whop.com/criscatalyst/content-ai/",
  "fetchedAt": "2025-11-05T09:34:13.543Z",
  "textHash": "b025cf8efc8780c06230e35d9d014004548c2d693088003687b804e2365737e8",
  "drilled": false
}