{
  "baseUrl": "https://whop.com/the-copytrader/copytrader-s-worst-copytraders/",
  "title": "CopyTrader&#x27;s WORST Copytraders | Whop",
  "h1": "CopyTrader&#x27;s WORST Copytraders",
  "bullets": [
    "Sign in TC CopyTrader&#x27;s WORST Copytraders Profitable Forex Signals from reversing the worst traders! 3.1 ( 43 ) Trading Want to make consistent profits from copying forex trading signals? This ultimate trading strategy is exactly what you&#x27;re looking for. You&#x27;ll receive trade signal messages daily! $49.99 / month Pay Join Join 12 members Features Copier-friendly signals for easy automation",
    "1 take profit level and no partials",
    "Cancel anytime",
    "SK Sng Wei Kiat 1 month ago Believe in the process! I have been s subscriber for all three channels but I find The worst copy trader the best. What impress me most is Antonio's responsible actions and monthly follow-up. Sure there are great months and brutal months. What is assuring is that he will provide his honest update an... Show more Written 2 months after purchase",
    "DU Deleted user 2 months ago I don't understand where I was before because this is the best signal provider ever! I have ever seen on the entire internet. I see that I am fulfilling my life's dream here. Thank you &lt;3 &lt;3 Written 1 hour after purchase",
    "TM Tiago Monteiro 2 months ago Excellent group, I earned more money in this group about a month ago than in all the other groups... honest results ðŸ‘Œ Written 1 month after purchase",
    "RR REHAM ABDUL RHMAN 2 months ago Antonio has introduced me to many new strategies and groups. Extremely honest and transparent and itâ€™s extremely profitable. I made 10% in just over 30 days with him which got me a payout. Written 1 month after purchase"
  ],
  "paras": [
    "Sign in TC CopyTrader&#x27;s WORST Copytraders Profitable Forex Signals from reversing the worst traders! 3.1 ( 43 ) Trading Want to make consistent profits from copying forex trading signals? This ultimate trading strategy is exactly what you&#x27;re looking for. You&#x27;ll receive trade signal messages daily!",
    "Join 12 members Features Copier-friendly signals for easy automation 1 take profit level and no partials Cancel anytime Reviews 3.14 out of 5 43 total reviews 5 stars 4 stars 3 stars 2 stars 1 star SK Sng Wei Kiat 1 month ago Believe in the process! I have been s subscriber for all three channels but I find The worst copy trader the best. What impress me most is Antonio's responsible actions and monthly follow-up. Sure there are great months and brutal months. What is assuring is that he will provide his honest update an...",
    "Written 2 months after purchase DU Deleted user 2 months ago I don't understand where I was before because this is the best signal provider ever! I have ever seen on the entire internet. I see that I am fulfilling my life's dream here. Thank you &lt;3 &lt;3",
    "2 months ago Excellent group, I earned more money in this group about a month ago than in all the other groups... honest results ðŸ‘Œ",
    "2 months ago Antonio has introduced me to many new strategies and groups. Extremely honest and transparent and itâ€™s extremely profitable. I made 10% in just over 30 days with him which got me a payout.",
    "About the creator AA View profile Antonio Angotti @ thecopytrader â€¢ Joined Feb 2024 The CopyTrader was founded by an experienced trader dedicated to helping others succeed in Forex trading. With a passion for sharing knowledge and a commitment to transparency, he has tested numerous signal channels and curated a service that simplifies the trading process. By focusing on profitability and accessibility, The CopyTrader empowers individuals to achieve their financial goals. FAQs What profits can I expect? What should I risk per trade? Do I need a copier to follow the signals? What profits can I expect? What drawdowns should I be prepared for? Affiliates TC Become an affiliate The CopyTrader 30% reward Earn money by bringing customers to The CopyTrader. Every time a customer purchases using your link, you&#x27;ll earn a commission."
  ],
  "priceTokens": [
    "$49.99",
    "$49.99",
    "$49.99",
    "$1",
    "$1",
    "$1",
    "$23",
    "$1",
    "$1",
    "$1",
    "$1",
    "$1",
    "$2",
    "$1",
    "$2",
    "$2",
    "$2",
    "$2",
    "$3",
    "$3"
  ],
  "faq": [],
  "textSample": "Sign in TC CopyTrader&#x27;s WORST Copytraders Profitable Forex Signals from reversing the worst traders! 3.1 ( 43 ) Trading Want to make consistent profits from copying forex trading signals? This ultimate trading strategy is exactly what you&#x27;re looking for. You&#x27;ll receive trade signal messages daily! $49.99 / month Pay Join Join 12 members Features Copier-friendly signals for easy automation 1 take profit level and no partials Cancel anytime Reviews 3.14 out of 5 43 total reviews 5 stars 4 stars 3 stars 2 stars 1 star SK Sng Wei Kiat 1 month ago Believe in the process! I have been s subscriber for all three channels but I find The worst copy trader the best. What impress me most is Antonio's responsible actions and monthly follow-up. Sure there are great months and brutal months. What is assuring is that he will provide his honest update an... Show more Written 2 months after purchase DU Deleted user 2 months ago I don't understand where I was before because this is the best signal provider ever! I have ever seen on the entire internet. I see that I am fulfilling my life's dream here. Thank you &lt;3 &lt;3 Written 1 hour after purchase TM Tiago Monteiro 2 months ago Excellent group, I earned more money in this group about a month ago than in all the other groups... honest results ðŸ‘Œ Written 1 month after purchase RR REHAM ABDUL RHMAN 2 months ago Antonio has introduced me to many new strategies and groups. Extremely honest and transparent and itâ€™s extremely profitable. I made 10% in just over 30 days with him which got me a payout. Written 1 month after purchase See all reviews About the creator AA View profile Antonio Angotti @ thecopytrader â€¢ Joined Feb 2024 The CopyTrader was founded by an experienced trader dedicated to helping others succeed in Forex trading. With a passion for sharing knowledge and a commitment to transparency, he has tested numerous signal channels and curated a service that simplifies the trading process. By focusing on profitability and accessibility, The CopyTrader empowers individuals to achieve their financial goals. FAQs What profits can I expect? What should I risk per trade? Do I need a copier to follow the signals? What profits can I expect? What drawdowns should I be prepared for? Affiliates TC Become an affiliate The CopyTrader 30% reward Earn money by bringing customers to The CopyTrader. Every time a customer purchases using your link, you&#x27;ll earn a commission. CopyTrader&#x27;s WORST Copytraders $49.99 / month Join $49.99 / month Pay Join Pay Join CopyTrader&#x27;s WORST Copytraders | Whop",
  "finalUrl": "https://whop.com/the-copytrader/copytrader-s-worst-copytraders/",
  "fetchedAt": "2025-11-05T09:29:48.664Z",
  "textHash": "c6414451be106bb54b79d8b13b0dfbf4bc7645da721fc9d7b5af01c003cef487",
  "drilled": false
}