{
  "baseUrl": "https://whop.com/cryptoarchie/?a=alexburnett21",
  "title": "Crypto Archie | Whop",
  "h1": "Crypto Archie",
  "bullets": [
    "Powered by CA Crypto Archie Archie, a 21-year-old self-made multimillionaire, built his fortune through cryptocurrency investments. At 18, he relocated to Dubai. Now he mentors others and shares his trades. 5.0 ( 106 ) Contact seller Products $145.00 / month #1 Crypto Group Crypto Archie VIP 5.0 ( 73 ) $399.00 / month Get Direct access to Crypto Archie Mentor 5.0 ( 2 ) $4,499.00 Save BIG with Crypto Archie&#x27;s Bundle Crypto Archie Big Bundle 5.0 ( 11 ) $149.99 Crypto Exit Strategy - by Kriptex Crypto Exit Strategy 5.0 ( 12 ) Free Book a quick 15 min call with one of Archie&#x27;s crypto experts. Book A Call 5.0 ( 7 ) Contact seller Reviews W wael1975 • Crypto Exit Strategy 15 days ago It's useful group fantastic TA buy sell alerts all what you need is ARCHIE \"S crypto. Written 1 month after purchase",
    "JC JESUS CASTANEDO • Crypto Archie VIP 15 days ago Fantastic People. I’ve Written 1 year after purchase",
    "R Rick • Crypto Archie VIP 22 days ago Very informative and helpful. I highly recommend this group. Written 1 month after purchase",
    "D Dawn • Crypto Archie VIP 23 days ago Best Discord, Archie knows what he is talking about and most honest .. the chats are a huge bonus, a lot of members in the group have really good advice and knowledge. Highly recommend this group, it’s 100 percent worth it! Written 1 month after purchase"
  ],
  "paras": [
    "CA Crypto Archie Archie, a 21-year-old self-made multimillionaire, built his fortune through cryptocurrency investments. At 18, he relocated to Dubai. Now he mentors others and shares his trades. 5.0 ( 106 ) Contact seller Products $145.00 / month #1 Crypto Group Crypto Archie VIP 5.0 ( 73 ) $399.00 / month Get Direct access to Crypto Archie Mentor 5.0 ( 2 ) $4,499.00 Save BIG with Crypto Archie&#x27;s Bundle Crypto Archie Big Bundle 5.0 ( 11 ) $149.99 Crypto Exit Strategy - by Kriptex Crypto Exit Strategy 5.0 ( 12 ) Free Book a quick 15 min call with one of Archie&#x27;s crypto experts. Book A Call 5.0 ( 7 ) Contact seller Reviews W wael1975 • Crypto Exit Strategy 15 days ago It's useful group fantastic TA buy sell alerts all what you need is ARCHIE \"S crypto.",
    "15 days ago Fantastic People. I’ve",
    "22 days ago Very informative and helpful. I highly recommend this group.",
    "23 days ago Best Discord, Archie knows what he is talking about and most honest .. the chats are a huge bonus, a lot of members in the group have really good advice and knowledge. Highly recommend this group, it’s 100 percent worth it!"
  ],
  "priceTokens": [
    "$145.00",
    "$399.00",
    "$4,499.00",
    "$149.99",
    "$1",
    "$1",
    "$1",
    "$21",
    "$1",
    "$1",
    "$1",
    "$1",
    "$28",
    "$1",
    "$28",
    "$28",
    "$28",
    "$28",
    "$3",
    "$3"
  ],
  "faq": [],
  "textSample": "Powered by CA Crypto Archie Archie, a 21-year-old self-made multimillionaire, built his fortune through cryptocurrency investments. At 18, he relocated to Dubai. Now he mentors others and shares his trades. 5.0 ( 106 ) Contact seller Products $145.00 / month #1 Crypto Group Crypto Archie VIP 5.0 ( 73 ) $399.00 / month Get Direct access to Crypto Archie Mentor 5.0 ( 2 ) $4,499.00 Save BIG with Crypto Archie&#x27;s Bundle Crypto Archie Big Bundle 5.0 ( 11 ) $149.99 Crypto Exit Strategy - by Kriptex Crypto Exit Strategy 5.0 ( 12 ) Free Book a quick 15 min call with one of Archie&#x27;s crypto experts. Book A Call 5.0 ( 7 ) Contact seller Reviews W wael1975 • Crypto Exit Strategy 15 days ago It's useful group fantastic TA buy sell alerts all what you need is ARCHIE \"S crypto. Written 1 month after purchase JC JESUS CASTANEDO • Crypto Archie VIP 15 days ago Fantastic People. I’ve Written 1 year after purchase R Rick • Crypto Archie VIP 22 days ago Very informative and helpful. I highly recommend this group. Written 1 month after purchase D Dawn • Crypto Archie VIP 23 days ago Best Discord, Archie knows what he is talking about and most honest .. the chats are a huge bonus, a lot of members in the group have really good advice and knowledge. Highly recommend this group, it’s 100 percent worth it! Written 1 month after purchase See all reviews Crypto Archie | Whop",
  "finalUrl": "https://whop.com/cryptoarchie/?a=alexburnett21",
  "fetchedAt": "2025-11-05T09:54:02.421Z",
  "textHash": "b4b46965ed952101eabe0574276d01c2e2ca7e4bcc05ebd84425575e72573930",
  "drilled": false
}