{
  "baseUrl": "https://whop.com/datawise/?a=alexburnett21",
  "title": "DataWise | Whop",
  "h1": "DataWise",
  "bullets": [
    "Powered by D DataWise DataWise is dedicated to empowering sports bettors with the strategies, tools, and community needed for long-term success. With over $100,000 in profit in 2023, our platform caters to both newcomers a... More 4.9 ( 156 ) Contact seller Products Unmute $19.99 / week Unlock Profitable Sports Betting with DataWise DataWise | Sports Betting 4.9 ( 130 ) Contact seller Reviews BK Benjamin Knupfer 1 month ago Great group of guys. I’m just done gambling! Written 2 years after purchase",
    "T Theevmachine 6 months ago Great discord, amazing +ev bots and a overall very helpful and friendly community! Written 1 year after purchase",
    "JL Josh Lore 1 year ago Only real discord that actually is interested in helping the customer! Written 2 months after purchase",
    "BW Brandon Weiser 1 year ago Been here from the beginning and will be here for life! The community is amazing, the tools are top notch and this place just continues to improve every day. Don't doubt it for one second, you will be profitable!! Written 1 year after purchase"
  ],
  "paras": [
    "D DataWise DataWise is dedicated to empowering sports bettors with the strategies, tools, and community needed for long-term success. With over $100,000 in profit in 2023, our platform caters to both newcomers a... More 4.9 ( 156 ) Contact seller Products Unmute $19.99 / week Unlock Profitable Sports Betting with DataWise DataWise | Sports Betting 4.9 ( 130 ) Contact seller Reviews BK Benjamin Knupfer 1 month ago Great group of guys. I’m just done gambling!",
    "6 months ago Great discord, amazing +ev bots and a overall very helpful and friendly community!",
    "1 year ago Only real discord that actually is interested in helping the customer!",
    "1 year ago Been here from the beginning and will be here for life! The community is amazing, the tools are top notch and this place just continues to improve every day. Don't doubt it for one second, you will be profitable!!"
  ],
  "priceTokens": [
    "$100,000",
    "$19.99",
    "$1",
    "$1",
    "$1",
    "$21",
    "$1",
    "$1",
    "$1",
    "$1",
    "$28",
    "$1",
    "$28",
    "$28",
    "$28",
    "$28",
    "$3",
    "$3",
    "$3",
    "$10"
  ],
  "faq": [],
  "textSample": "Powered by D DataWise DataWise is dedicated to empowering sports bettors with the strategies, tools, and community needed for long-term success. With over $100,000 in profit in 2023, our platform caters to both newcomers a... More 4.9 ( 156 ) Contact seller Products Unmute $19.99 / week Unlock Profitable Sports Betting with DataWise DataWise | Sports Betting 4.9 ( 130 ) Contact seller Reviews BK Benjamin Knupfer 1 month ago Great group of guys. I’m just done gambling! Written 2 years after purchase T Theevmachine 6 months ago Great discord, amazing +ev bots and a overall very helpful and friendly community! Written 1 year after purchase JL Josh Lore 1 year ago Only real discord that actually is interested in helping the customer! Written 2 months after purchase BW Brandon Weiser 1 year ago Been here from the beginning and will be here for life! The community is amazing, the tools are top notch and this place just continues to improve every day. Don't doubt it for one second, you will be profitable!! Written 1 year after purchase See all reviews DataWise | Whop",
  "finalUrl": "https://whop.com/datawise/?a=alexburnett21",
  "fetchedAt": "2025-11-05T10:29:56.346Z",
  "textHash": "ebc98976751cad44f80ec0c1afdc166af2999251175eb22f66ff1a19a04113e3",
  "drilled": false
}