{
  "baseUrl": "https://whop.com/thedocprop/thedocprop-gold/",
  "title": "Doc Prop Gold | Whop",
  "h1": "Doc Prop Gold",
  "bullets": [
    "Sign in TP Doc Prop Gold Bet Smarter with DrProp&#x27;s PrizePicks 4.7 ( 244 ) Sports betting Join The Doc Prop and bet smarter using math and data. Get access to +EV Prizepicks slips and correlation slips. $15.99 / 2 weeks Pay Join Features Access to Prize Pick, Fliff, and Rebet plays",
    "Engage in our premium chat for strategies and tips",
    "Daily end-of-day results and insights on PIKKIT",
    "Comprehensive support and education on profitable betting",
    "Participation in monthly cash prize giveaways",
    "C Chapo 9 days ago Solid mix of +EV betting on various apps, green days outnumber the red days Written 24 days after purchase",
    "DM Diego Moreno 9 days ago Good they hit Written 21 days after purchase",
    "M MOJO 25 days ago The best Written 4 days after purchase",
    "M Mekeil 1 month ago ðŸ”¥ Written 3 months after purchase"
  ],
  "paras": [
    "Sign in TP Doc Prop Gold Bet Smarter with DrProp&#x27;s PrizePicks 4.7 ( 244 ) Sports betting Join The Doc Prop and bet smarter using math and data. Get access to +EV Prizepicks slips and correlation slips.",
    "$15.99 / 2 weeks Pay Join Features Access to Prize Pick, Fliff, and Rebet plays Engage in our premium chat for strategies and tips Daily end-of-day results and insights on PIKKIT Comprehensive support and education on profitable betting Participation in monthly cash prize giveaways Reviews 4.71 out of 5 244 total reviews 5 stars 4 stars 3 stars 2 stars 1 star C Chapo 9 days ago Solid mix of +EV betting on various apps, green days outnumber the red days",
    "9 days ago Good they hit",
    "25 days ago The best",
    "1 month ago ðŸ”¥",
    "About the creator D View profile DrProp @ thedocprop â€¢ Joined Aug 2024 I&#x27;ve spent years mastering the art of profitable betting using data and math. My passion is to help you navigate the betting world with confidence and precision, offering you exclusive access to my strategies and community. Join me on this journey to outsmart the odds. FAQs How do I connect discord? How many slips are posted a day? How many cappers do you have? What books are included in the membership? Are there refunds? Affiliates TP Become an affiliate The Doc Prop 30% reward Earn money by bringing customers to The Doc Prop. Every time a customer purchases using your link, you&#x27;ll earn a commission."
  ],
  "priceTokens": [
    "$15.99",
    "$15.99",
    "$15.99",
    "$1",
    "$1",
    "$1",
    "$22",
    "$1",
    "$1",
    "$1",
    "$1",
    "$1",
    "$2",
    "$1",
    "$2",
    "$2",
    "$2",
    "$2",
    "$3",
    "$3"
  ],
  "faq": [],
  "textSample": "Sign in TP Doc Prop Gold Bet Smarter with DrProp&#x27;s PrizePicks 4.7 ( 244 ) Sports betting Join The Doc Prop and bet smarter using math and data. Get access to +EV Prizepicks slips and correlation slips. $15.99 / 2 weeks Pay Join Features Access to Prize Pick, Fliff, and Rebet plays Engage in our premium chat for strategies and tips Daily end-of-day results and insights on PIKKIT Comprehensive support and education on profitable betting Participation in monthly cash prize giveaways Reviews 4.71 out of 5 244 total reviews 5 stars 4 stars 3 stars 2 stars 1 star C Chapo 9 days ago Solid mix of +EV betting on various apps, green days outnumber the red days Written 24 days after purchase DM Diego Moreno 9 days ago Good they hit Written 21 days after purchase M MOJO 25 days ago The best Written 4 days after purchase M Mekeil 1 month ago ðŸ”¥ Written 3 months after purchase See all reviews About the creator D View profile DrProp @ thedocprop â€¢ Joined Aug 2024 I&#x27;ve spent years mastering the art of profitable betting using data and math. My passion is to help you navigate the betting world with confidence and precision, offering you exclusive access to my strategies and community. Join me on this journey to outsmart the odds. FAQs How do I connect discord? How many slips are posted a day? How many cappers do you have? What books are included in the membership? Are there refunds? Affiliates TP Become an affiliate The Doc Prop 30% reward Earn money by bringing customers to The Doc Prop. Every time a customer purchases using your link, you&#x27;ll earn a commission. Doc Prop Gold $15.99 / 2 weeks +1 option Join $15.99 / 2 weeks 1 option Pay Join Pay Join Doc Prop Gold | Whop",
  "finalUrl": "https://whop.com/thedocprop/thedocprop-gold/",
  "fetchedAt": "2025-11-05T09:59:23.533Z",
  "textHash": "b41813e76ca7c278b0bdad3a23ea437e8c1d09e3978bb9bcf2861a8ce8d4e9c2",
  "drilled": false
}