{
  "baseUrl": "https://whop.com/kenangrace/kenan-grace-78/",
  "title": "Doctorate ðŸŽ“ | Whop",
  "h1": "Doctorate ðŸŽ“",
  "bullets": [
    "Sign in KG Doctorate ðŸŽ“ Learn to Trade &amp; Invest From A Top 1% Trader 4.9 ( 54 ) Trading Learn from the best online trading coach on the market! $164.99 / month Pay Join Features Full KGU Access (Deans List) + Sniper Gang Alerts ðŸ¤«",
    "Watch Kenan Trade Live",
    "(Legacy) Options + Chart Class",
    "All Sales Are Final",
    "AW Allison Wong 6 days ago Very worth it Written 3 months after purchase",
    "FG Fred Graves 19 days ago Worth the investment! Written 3 months after purchase",
    "JS Jorge Silva 2 months ago The best Written 3 months after purchase",
    "DD Devil Dog 6 2 months ago As a beginner Iâ€™ve found KGU is really about helping me learn . Written 3 months after purchase"
  ],
  "paras": [
    "Sign in KG Doctorate ðŸŽ“ Learn to Trade &amp; Invest From A Top 1% Trader 4.9 ( 54 ) Trading Learn from the best online trading coach on the market!",
    "Full KGU Access (Deans List) + Sniper Gang Alerts ðŸ¤« Watch Kenan Trade Live (Legacy) Options + Chart Class All Sales Are Final Reviews 4.93 out of 5 54 total reviews 5 stars 4 stars 3 stars 2 stars 1 star AW Allison Wong 6 days ago Very worth it",
    "19 days ago Worth the investment!",
    "2 months ago The best",
    "2 months ago As a beginner Iâ€™ve found KGU is really about helping me learn .",
    "About the creator KG View profile Kenan Grace @ kenangrace â€¢ Joined Dec 2024 Iâ€™m Kenan Grace, a stock market educator with over 500K YouTube subscribers and features on Forbes, Fox Business, and Nasdaq. I provide clear, actionable investing strategies, market analysis, and stock alerts to help you maximize earnings, build wealth, and achieve financial independence. FAQs What makes this program different from others? What is the difference between the Doctorate and Bachelor&#x27;s tiers? Affiliates KG Become an affiliate Kenan Grace 10% reward Earn money by bringing customers to Kenan Grace. Every time a customer purchases using your link, you&#x27;ll earn a commission."
  ],
  "priceTokens": [
    "$164.99",
    "$164.99",
    "$164.99",
    "$1",
    "$1",
    "$1",
    "$22",
    "$1",
    "$1",
    "$1",
    "$1",
    "$1",
    "$2",
    "$1",
    "$2",
    "$2",
    "$2",
    "$2",
    "$3",
    "$3"
  ],
  "faq": [],
  "textSample": "Sign in KG Doctorate ðŸŽ“ Learn to Trade &amp; Invest From A Top 1% Trader 4.9 ( 54 ) Trading Learn from the best online trading coach on the market! $164.99 / month Pay Join Features Full KGU Access (Deans List) + Sniper Gang Alerts ðŸ¤« Watch Kenan Trade Live (Legacy) Options + Chart Class All Sales Are Final Reviews 4.93 out of 5 54 total reviews 5 stars 4 stars 3 stars 2 stars 1 star AW Allison Wong 6 days ago Very worth it Written 3 months after purchase FG Fred Graves 19 days ago Worth the investment! Written 3 months after purchase JS Jorge Silva 2 months ago The best Written 3 months after purchase DD Devil Dog 6 2 months ago As a beginner Iâ€™ve found KGU is really about helping me learn . Written 3 months after purchase See all reviews About the creator KG View profile Kenan Grace @ kenangrace â€¢ Joined Dec 2024 Iâ€™m Kenan Grace, a stock market educator with over 500K YouTube subscribers and features on Forbes, Fox Business, and Nasdaq. I provide clear, actionable investing strategies, market analysis, and stock alerts to help you maximize earnings, build wealth, and achieve financial independence. FAQs What makes this program different from others? What is the difference between the Doctorate and Bachelor&#x27;s tiers? Affiliates KG Become an affiliate Kenan Grace 10% reward Earn money by bringing customers to Kenan Grace. Every time a customer purchases using your link, you&#x27;ll earn a commission. Doctorate ðŸŽ“ $164.99 / month Join $164.99 / month Pay Join Pay Join Doctorate ðŸŽ“ | Whop",
  "finalUrl": "https://whop.com/kenangrace/kenan-grace-78/",
  "fetchedAt": "2025-11-05T09:20:31.856Z",
  "textHash": "5ef5ed0781393446dcea91bdc9765488c013992797bd2a9e19cdb2662ec362c6",
  "drilled": false
}