{
  "baseUrl": "https://whop.com/dsplocks/?a=alexburnett21",
  "title": "DSPLocks | Whop",
  "h1": "DSPLocks",
  "bullets": [
    "Powered by D DSPLocks I&#x27;ve always been passionate about sports betting and have formed an expert team to bring you the best plays daily. Our specialized cappers in each sport ensure top-notch analysis and picks. With years... More 4.9 ( 23 ) Contact seller Products $10.00 / month Join Expert Sports Bettors Today! DSPLocks Premium 4.9 ( 22 ) $110.00 / year Unlock Your Winning Potential! DSPLocks DSP Yearly New $400.00 Join Our Expert Sports Bettors DSPLocks Lifetime New $5.00 / week Unlock Your Winning Potential! DSP Weekly 5.0 ( 1 ) Contact seller Reviews JE JaeAnthony Medina Eurich • DSP Weekly 8 months ago nhl, esports, nfl, nba they have it all in DSP, went from $15 bets to placing $50 bets, always consistent, group is a vibe during the games, overall i have just been greening out in DSP for only $10 a month Written 8 days after purchase",
    "DS Diego Sandoval • DSPLocks Premium 1 year ago This is about a discord, everything about this discord is amazing. The people in this discord are really friendly. The owner Danny gives out slips that hit as well as other cappers that gives out slips I really made a lot of profit from this discord and I really appreciate it. Written 1 month after purchase",
    "MJ Marvin Jax • DSPLocks Premium 1 year ago Crazy how much value you can get for just $10 a month!! Already paid for it with my first slip in premium and SO MUCH MORE. I’ve never cashed in other discords like I have in DSPPPPP Written 18 days after purchase",
    "D diljee • DSPLocks Premium 1 year ago Consistent and and the best vibe group Written 15 days after purchase"
  ],
  "paras": [
    "D DSPLocks I&#x27;ve always been passionate about sports betting and have formed an expert team to bring you the best plays daily. Our specialized cappers in each sport ensure top-notch analysis and picks. With years... More 4.9 ( 23 ) Contact seller Products $10.00 / month Join Expert Sports Bettors Today! DSPLocks Premium 4.9 ( 22 ) $110.00 / year Unlock Your Winning Potential! DSPLocks DSP Yearly New $400.00 Join Our Expert Sports Bettors DSPLocks Lifetime New $5.00 / week Unlock Your Winning Potential! DSP Weekly 5.0 ( 1 ) Contact seller Reviews JE JaeAnthony Medina Eurich • DSP Weekly 8 months ago nhl, esports, nfl, nba they have it all in DSP, went from $15 bets to placing $50 bets, always consistent, group is a vibe during the games, overall i have just been greening out in DSP for only $10 a month",
    "1 year ago This is about a discord, everything about this discord is amazing. The people in this discord are really friendly. The owner Danny gives out slips that hit as well as other cappers that gives out slips I really made a lot of profit from this discord and I really appreciate it.",
    "1 year ago Crazy how much value you can get for just $10 a month!! Already paid for it with my first slip in premium and SO MUCH MORE. I’ve never cashed in other discords like I have in DSPPPPP",
    "1 year ago Consistent and and the best vibe group"
  ],
  "priceTokens": [
    "$10.00",
    "$110.00",
    "$400.00",
    "$5.00",
    "$15",
    "$50",
    "$10",
    "$10",
    "$1",
    "$1",
    "$1",
    "$21",
    "$1",
    "$1",
    "$1",
    "$1",
    "$28",
    "$1",
    "$28",
    "$28"
  ],
  "faq": [],
  "textSample": "Powered by D DSPLocks I&#x27;ve always been passionate about sports betting and have formed an expert team to bring you the best plays daily. Our specialized cappers in each sport ensure top-notch analysis and picks. With years... More 4.9 ( 23 ) Contact seller Products $10.00 / month Join Expert Sports Bettors Today! DSPLocks Premium 4.9 ( 22 ) $110.00 / year Unlock Your Winning Potential! DSPLocks DSP Yearly New $400.00 Join Our Expert Sports Bettors DSPLocks Lifetime New $5.00 / week Unlock Your Winning Potential! DSP Weekly 5.0 ( 1 ) Contact seller Reviews JE JaeAnthony Medina Eurich • DSP Weekly 8 months ago nhl, esports, nfl, nba they have it all in DSP, went from $15 bets to placing $50 bets, always consistent, group is a vibe during the games, overall i have just been greening out in DSP for only $10 a month Written 8 days after purchase DS Diego Sandoval • DSPLocks Premium 1 year ago This is about a discord, everything about this discord is amazing. The people in this discord are really friendly. The owner Danny gives out slips that hit as well as other cappers that gives out slips I really made a lot of profit from this discord and I really appreciate it. Written 1 month after purchase MJ Marvin Jax • DSPLocks Premium 1 year ago Crazy how much value you can get for just $10 a month!! Already paid for it with my first slip in premium and SO MUCH MORE. I’ve never cashed in other discords like I have in DSPPPPP Written 18 days after purchase D diljee • DSPLocks Premium 1 year ago Consistent and and the best vibe group Written 15 days after purchase See all reviews DSPLocks | Whop",
  "finalUrl": "https://whop.com/dsplocks/?a=alexburnett21",
  "fetchedAt": "2025-11-04T21:52:19.281Z",
  "textHash": "e0e9f4184249b3e2341f5f9812d4be6bad9240686420e43635376927bd55a805",
  "drilled": false
}