{
  "baseUrl": "https://whop.com/dynamo/?a=alexburnett21",
  "title": "Dynamo | Whop",
  "h1": "Dynamo",
  "bullets": [
    "Powered by D Dynamo I&#x27;ve brought together the top cappers all in one Discord! We post picks in all sports, EVERYDAY! Lock in for our favorite daily picks. PrizePicks and Underdog player props is our specialty. 5.0 ( 4 ) Contact seller Products $24.99 / month Transparent Player Props &amp; Betting Picks Dynamo VIP 5.0 ( 3 ) $9.99 / week Unlock Weekly Picks &amp; Projections Dynamo VIP New $8.99 Unlock VIP Picks &amp; Projections for 3 Days Dynamo VIP Pass New Free Discord Access FREE Access New Contact seller Reviews TA Trey Alaniz • Dynamo VIP 9 months ago This group is legit! I have been apart of this discord for about a week and I have cashed out almost every single day! The cappers are very consistent with their picks and very helpful as well with any questions you have. Give it a try and you won’t regret it! Written 6 days after purchase",
    "PC 2104 Preakness Court • Dynamo VIP 2 years ago Legitness to the max no cap come get green with the money team Written 8 days after purchase",
    "NS Navin sihanantharath • Dynamo VIP 2 years ago Being apart of this discord has been so helpful, in a span of 20 days ive been able to make up to $3000 and there hasn’t been a day where i felt discouraged to make a bet! Great group of cappers as well as other vip members Written 20 days after purchase",
    "S sportsvideos 2 years ago I mean $25/mo I made my money back +more first day with the picks. Tons of cappers posting slips for all sports just take the ones you like and follow the cappers that win the most in each sport. Costs essentially nothing for someone who plays more money everyday than what the membership is monthly Written 2 days after purchase"
  ],
  "paras": [
    "D Dynamo I&#x27;ve brought together the top cappers all in one Discord! We post picks in all sports, EVERYDAY! Lock in for our favorite daily picks. PrizePicks and Underdog player props is our specialty. 5.0 ( 4 ) Contact seller Products $24.99 / month Transparent Player Props &amp; Betting Picks Dynamo VIP 5.0 ( 3 ) $9.99 / week Unlock Weekly Picks &amp; Projections Dynamo VIP New $8.99 Unlock VIP Picks &amp; Projections for 3 Days Dynamo VIP Pass New Free Discord Access FREE Access New Contact seller Reviews TA Trey Alaniz • Dynamo VIP 9 months ago This group is legit! I have been apart of this discord for about a week and I have cashed out almost every single day! The cappers are very consistent with their picks and very helpful as well with any questions you have. Give it a try and you won’t regret it!",
    "2 years ago Legitness to the max no cap come get green with the money team",
    "2 years ago Being apart of this discord has been so helpful, in a span of 20 days ive been able to make up to $3000 and there hasn’t been a day where i felt discouraged to make a bet! Great group of cappers as well as other vip members",
    "2 years ago I mean $25/mo I made my money back +more first day with the picks. Tons of cappers posting slips for all sports just take the ones you like and follow the cappers that win the most in each sport. Costs essentially nothing for someone who plays more money everyday than what the membership is monthly"
  ],
  "priceTokens": [
    "$24.99",
    "$9.99",
    "$8.99",
    "$300",
    "$25",
    "$1",
    "$1",
    "$1",
    "$21",
    "$1",
    "$1",
    "$1",
    "$1",
    "$28",
    "$1",
    "$28",
    "$28",
    "$28",
    "$28",
    "$3"
  ],
  "faq": [],
  "textSample": "Powered by D Dynamo I&#x27;ve brought together the top cappers all in one Discord! We post picks in all sports, EVERYDAY! Lock in for our favorite daily picks. PrizePicks and Underdog player props is our specialty. 5.0 ( 4 ) Contact seller Products $24.99 / month Transparent Player Props &amp; Betting Picks Dynamo VIP 5.0 ( 3 ) $9.99 / week Unlock Weekly Picks &amp; Projections Dynamo VIP New $8.99 Unlock VIP Picks &amp; Projections for 3 Days Dynamo VIP Pass New Free Discord Access FREE Access New Contact seller Reviews TA Trey Alaniz • Dynamo VIP 9 months ago This group is legit! I have been apart of this discord for about a week and I have cashed out almost every single day! The cappers are very consistent with their picks and very helpful as well with any questions you have. Give it a try and you won’t regret it! Written 6 days after purchase PC 2104 Preakness Court • Dynamo VIP 2 years ago Legitness to the max no cap come get green with the money team Written 8 days after purchase NS Navin sihanantharath • Dynamo VIP 2 years ago Being apart of this discord has been so helpful, in a span of 20 days ive been able to make up to $3000 and there hasn’t been a day where i felt discouraged to make a bet! Great group of cappers as well as other vip members Written 20 days after purchase S sportsvideos 2 years ago I mean $25/mo I made my money back +more first day with the picks. Tons of cappers posting slips for all sports just take the ones you like and follow the cappers that win the most in each sport. Costs essentially nothing for someone who plays more money everyday than what the membership is monthly Written 2 days after purchase Dynamo | Whop",
  "finalUrl": "https://whop.com/dynamo/?a=alexburnett21",
  "fetchedAt": "2025-11-04T20:10:11.265Z",
  "textHash": "a3f0fd128a58fc6d4863f168d80998120ba5bd40c901b9e815d03ce5aa771488",
  "drilled": false
}