{
  "baseUrl": "https://whop.com/edgeecom/?a=alexburnett21",
  "title": "EDGE | Whop",
  "h1": "EDGE",
  "bullets": [
    "Powered by E EDGE Wir selbst sind ein Team aus Amazon H√§ndlern die vor circa 2 Jahren mit Online Arbitrage gestartet haben. In der Zeit haben wir einiges an Erfahrung gesammelt und zahlreiche Methoden getestet um leich... More 5.0 ( 9 ) Contact seller Products ‚Ç¨249.00 / month Revolutioniere dein Sourcing ‚ö°Ô∏è EDGE PRO | ‚ú® Beliebt ‚ú® 5.0 ( 9 ) Unmute ‚Ç¨50.00 / month Upgrade deine Leistung f√ºr die SpySearch SPY SEARCH | +50 SELLER New ‚Ç¨349.00 / month Die K√∂nigsklasse des Sourcing ‚ú® EDGE PRO+ New ‚Ç¨179.00 / month Dein Start in die Welt des effizienten Sourcing üß† EDGE LITE New Unmute Free Jetzt Early Access sichern üëÄ EDGE 3.0 New Unmute ‚Ç¨35.00 / month Upgrade deine Leistung f√ºr die SpySearch SPY SEARCH | +30 SELLER New Mehr Leistung f√ºr dein Reverse Sourcing auf Knopfdruck SPY SEARCH | +50 SELLER New Unmute ‚Ç¨100.00 / month Upgrade deine Leistung f√ºr die SpySearch SPY SEARCH | +100 SELLER New Unmute ‚Ç¨249.00 / month Upgrade deine Leistung f√ºr die SpySearch SPY SEARCH | +250 SELLER New Unmute ‚Ç¨100.00 / month Upgrade deine Leistung f√ºr die Preiswecker PREISWECKER | +10K New Contact seller Reviews RC Ridvan Can ‚Ä¢ EDGE PRO | ‚ú® Beliebt ‚ú® 12 days ago Alles bestens! Die Software ist Top, der Support ist mehr als genial! Written 9 months after purchase",
    "K Kolja ‚Ä¢ EDGE PRO | ‚ú® Beliebt ‚ú® 1 year ago Bin sehr zufrieden mit dem Tool. Mittlerweile source ich nur noch mit EDGE ist gar nicht mehr vorstellbar, ohne zu sourcen. Written 1 month after purchase",
    "FG Florian Ginter ‚Ä¢ EDGE PRO | ‚ú® Beliebt ‚ú® 1 year ago Top Tool f√ºr Amazon OA sowohl f√ºr Inland als auch f√ºr Ausland. Spart sehr viel Zeit. Sehr professionell und Support immer schnell zur Hilfe. Written 25 days after purchase",
    "TT Timo Teller ‚Ä¢ EDGE PRO | ‚ú® Beliebt ‚ú® 1 year ago Die beste Amazon FBA Software die ich bis jetzt genutzt habe! Written 1 month after purchase"
  ],
  "paras": [
    "E EDGE Wir selbst sind ein Team aus Amazon H√§ndlern die vor circa 2 Jahren mit Online Arbitrage gestartet haben. In der Zeit haben wir einiges an Erfahrung gesammelt und zahlreiche Methoden getestet um leich... More 5.0 ( 9 ) Contact seller Products ‚Ç¨249.00 / month Revolutioniere dein Sourcing ‚ö°Ô∏è EDGE PRO | ‚ú® Beliebt ‚ú® 5.0 ( 9 ) Unmute ‚Ç¨50.00 / month Upgrade deine Leistung f√ºr die SpySearch SPY SEARCH | +50 SELLER New ‚Ç¨349.00 / month Die K√∂nigsklasse des Sourcing ‚ú® EDGE PRO+ New ‚Ç¨179.00 / month Dein Start in die Welt des effizienten Sourcing üß† EDGE LITE New Unmute Free Jetzt Early Access sichern üëÄ EDGE 3.0 New Unmute ‚Ç¨35.00 / month Upgrade deine Leistung f√ºr die SpySearch SPY SEARCH | +30 SELLER New Mehr Leistung f√ºr dein Reverse Sourcing auf Knopfdruck SPY SEARCH | +50 SELLER New Unmute ‚Ç¨100.00 / month Upgrade deine Leistung f√ºr die SpySearch SPY SEARCH | +100 SELLER New Unmute ‚Ç¨249.00 / month Upgrade deine Leistung f√ºr die SpySearch SPY SEARCH | +250 SELLER New Unmute ‚Ç¨100.00 / month Upgrade deine Leistung f√ºr die Preiswecker PREISWECKER | +10K New Contact seller Reviews RC Ridvan Can ‚Ä¢ EDGE PRO | ‚ú® Beliebt ‚ú® 12 days ago Alles bestens! Die Software ist Top, der Support ist mehr als genial!",
    "1 year ago Bin sehr zufrieden mit dem Tool. Mittlerweile source ich nur noch mit EDGE ist gar nicht mehr vorstellbar, ohne zu sourcen.",
    "1 year ago Top Tool f√ºr Amazon OA sowohl f√ºr Inland als auch f√ºr Ausland. Spart sehr viel Zeit. Sehr professionell und Support immer schnell zur Hilfe.",
    "1 year ago Die beste Amazon FBA Software die ich bis jetzt genutzt habe!"
  ],
  "priceTokens": [
    "‚Ç¨249.00",
    "‚Ç¨50.00",
    "‚Ç¨349.00",
    "‚Ç¨179.00",
    "‚Ç¨35.00",
    "‚Ç¨100.00",
    "‚Ç¨249.00",
    "‚Ç¨100.00",
    "$1",
    "$1",
    "$1",
    "$21",
    "$1",
    "$1",
    "$1",
    "$1",
    "$28",
    "$1",
    "$28",
    "$28"
  ],
  "faq": [],
  "textSample": "Powered by E EDGE Wir selbst sind ein Team aus Amazon H√§ndlern die vor circa 2 Jahren mit Online Arbitrage gestartet haben. In der Zeit haben wir einiges an Erfahrung gesammelt und zahlreiche Methoden getestet um leich... More 5.0 ( 9 ) Contact seller Products ‚Ç¨249.00 / month Revolutioniere dein Sourcing ‚ö°Ô∏è EDGE PRO | ‚ú® Beliebt ‚ú® 5.0 ( 9 ) Unmute ‚Ç¨50.00 / month Upgrade deine Leistung f√ºr die SpySearch SPY SEARCH | +50 SELLER New ‚Ç¨349.00 / month Die K√∂nigsklasse des Sourcing ‚ú® EDGE PRO+ New ‚Ç¨179.00 / month Dein Start in die Welt des effizienten Sourcing üß† EDGE LITE New Unmute Free Jetzt Early Access sichern üëÄ EDGE 3.0 New Unmute ‚Ç¨35.00 / month Upgrade deine Leistung f√ºr die SpySearch SPY SEARCH | +30 SELLER New Mehr Leistung f√ºr dein Reverse Sourcing auf Knopfdruck SPY SEARCH | +50 SELLER New Unmute ‚Ç¨100.00 / month Upgrade deine Leistung f√ºr die SpySearch SPY SEARCH | +100 SELLER New Unmute ‚Ç¨249.00 / month Upgrade deine Leistung f√ºr die SpySearch SPY SEARCH | +250 SELLER New Unmute ‚Ç¨100.00 / month Upgrade deine Leistung f√ºr die Preiswecker PREISWECKER | +10K New Contact seller Reviews RC Ridvan Can ‚Ä¢ EDGE PRO | ‚ú® Beliebt ‚ú® 12 days ago Alles bestens! Die Software ist Top, der Support ist mehr als genial! Written 9 months after purchase K Kolja ‚Ä¢ EDGE PRO | ‚ú® Beliebt ‚ú® 1 year ago Bin sehr zufrieden mit dem Tool. Mittlerweile source ich nur noch mit EDGE ist gar nicht mehr vorstellbar, ohne zu sourcen. Written 1 month after purchase FG Florian Ginter ‚Ä¢ EDGE PRO | ‚ú® Beliebt ‚ú® 1 year ago Top Tool f√ºr Amazon OA sowohl f√ºr Inland als auch f√ºr Ausland. Spart sehr viel Zeit. Sehr professionell und Support immer schnell zur Hilfe. Written 25 days after purchase TT Timo Teller ‚Ä¢ EDGE PRO | ‚ú® Beliebt ‚ú® 1 year ago Die beste Amazon FBA Software die ich bis jetzt genutzt habe! Written 1 month after purchase See all reviews EDGE | Whop",
  "finalUrl": "https://whop.com/edgeecom/?a=alexburnett21",
  "fetchedAt": "2025-11-05T10:32:01.862Z",
  "textHash": "8109160d75f2abd267b9cbe14023546da837f305c91b5d4d3be1926dbb405715",
  "drilled": false
}