{
  "baseUrl": "https://whop.com/ant-and-ryans-analysis/education-trading-group/",
  "title": "Education Trading Group | Whop",
  "h1": "Education Trading Group",
  "bullets": [
    "Sign in AA Education Trading Group Learn to master the forex markets 4.0 ( 8 ) Other Join our Forex Education Group and learn everything you need to become a consistently profitable trader. Master technical analysis, trading psychology and risk management Â£90.00 / month Pay Join Features 5 live sessions per week with experts to analyse and discuss market trends",
    "Fresh trade setups shared daily to keep you market-ready",
    "Connect, share insights, and grow with like-minded traders",
    "Watch missed live sessions anytime with on-demand access",
    "Learn and improve with new lessons delivered weekly",
    "ZM Zurgham Mehar 1 year ago Send me promo code i can apply nd join your vip Written 8 months after purchase",
    "AG Abhinav Gupta 2 years ago He is worth i will never cancel my subscription apart from trading he motivates alotâ¤ï¸ Written 1 month after purchase",
    "BS BHUPENDRA SINGH 2 years ago Best Community Of Forex Trading Journey I Never got Before It. thanks ğŸ™ Written 1 month after purchase",
    "MB Monik Bhimani 2 years ago It was really great, I loved how Ant explain how to trade; it gives me inside and an amazing way to trade and get profitableğŸ™ğŸ» Written 2 months after purchase"
  ],
  "paras": [
    "Sign in AA Education Trading Group Learn to master the forex markets 4.0 ( 8 ) Other Join our Forex Education Group and learn everything you need to become a consistently profitable trader. Master technical analysis, trading psychology and risk management",
    "Â£90.00 / month Pay Join Features 5 live sessions per week with experts to analyse and discuss market trends Fresh trade setups shared daily to keep you market-ready Connect, share insights, and grow with like-minded traders Watch missed live sessions anytime with on-demand access Learn and improve with new lessons delivered weekly Reviews 4 out of 5 8 total reviews 5 stars 4 stars 3 stars 2 stars 1 star ZM Zurgham Mehar 1 year ago Send me promo code i can apply nd join your vip",
    "2 years ago He is worth i will never cancel my subscription apart from trading he motivates alotâ¤ï¸",
    "2 years ago Best Community Of Forex Trading Journey I Never got Before It. thanks ğŸ™",
    "2 years ago It was really great, I loved how Ant explain how to trade; it gives me inside and an amazing way to trade and get profitableğŸ™ğŸ»",
    "About the creator AA View profile Ant &amp; Ryan&#x27;s Analysis @ user0fc92133583 â€¢ Joined Nov 2023 We have spent the last eight years mastering forex trading, navigating through market trends, and developing successful strategies. My passion lies in elevating others by sharing insights, conducting live analysis, and creating a thriving community of like-minded individuals. Join us as we explore the exciting world of trading together. FAQs What is the cost of joining? Are sessions suitable for beginners? How can I participate in live streams? What experience level is required to join? Do you offer refunds? Affiliates AA Become an affiliate Ants Analysis 30% reward Earn money by bringing customers to Ants Analysis. Every time a customer purchases using your link, you&#x27;ll earn a commission."
  ],
  "priceTokens": [
    "Â£90.00",
    "Â£90.00",
    "Â£90.00",
    "$1",
    "$1",
    "$1",
    "$23",
    "$1",
    "$1",
    "$1",
    "$1",
    "$1",
    "$2",
    "$1",
    "$2",
    "$2",
    "$2",
    "$2",
    "$3",
    "$3"
  ],
  "faq": [],
  "textSample": "Sign in AA Education Trading Group Learn to master the forex markets 4.0 ( 8 ) Other Join our Forex Education Group and learn everything you need to become a consistently profitable trader. Master technical analysis, trading psychology and risk management Â£90.00 / month Pay Join Features 5 live sessions per week with experts to analyse and discuss market trends Fresh trade setups shared daily to keep you market-ready Connect, share insights, and grow with like-minded traders Watch missed live sessions anytime with on-demand access Learn and improve with new lessons delivered weekly Reviews 4 out of 5 8 total reviews 5 stars 4 stars 3 stars 2 stars 1 star ZM Zurgham Mehar 1 year ago Send me promo code i can apply nd join your vip Written 8 months after purchase AG Abhinav Gupta 2 years ago He is worth i will never cancel my subscription apart from trading he motivates alotâ¤ï¸ Written 1 month after purchase BS BHUPENDRA SINGH 2 years ago Best Community Of Forex Trading Journey I Never got Before It. thanks ğŸ™ Written 1 month after purchase MB Monik Bhimani 2 years ago It was really great, I loved how Ant explain how to trade; it gives me inside and an amazing way to trade and get profitableğŸ™ğŸ» Written 2 months after purchase See all reviews About the creator AA View profile Ant &amp; Ryan&#x27;s Analysis @ user0fc92133583 â€¢ Joined Nov 2023 We have spent the last eight years mastering forex trading, navigating through market trends, and developing successful strategies. My passion lies in elevating others by sharing insights, conducting live analysis, and creating a thriving community of like-minded individuals. Join us as we explore the exciting world of trading together. FAQs What is the cost of joining? Are sessions suitable for beginners? How can I participate in live streams? What experience level is required to join? Do you offer refunds? Affiliates AA Become an affiliate Ants Analysis 30% reward Earn money by bringing customers to Ants Analysis. Every time a customer purchases using your link, you&#x27;ll earn a commission. Education Trading Group Â£90.00 / month +1 option Join Â£90.00 / month 1 option Pay Join Pay Join Education Trading Group | Whop",
  "finalUrl": "https://whop.com/ant-and-ryans-analysis/education-trading-group/",
  "fetchedAt": "2025-11-04T21:47:21.881Z",
  "textHash": "df2e0da39dd35384b7e6e9323ded4f53617f4b4e90c073d6a0839b0dbb7f9a1d",
  "drilled": false
}