{
  "baseUrl": "https://whop.com/mobile-home-elite-investors/?a=alexburnett21",
  "title": "Mobile Home Elite Investors | Whop",
  "h1": "Mobile Home Elite Investors",
  "bullets": [
    "Powered by MI Mobile Home Elite Investors Mobile Home Elite Investors exists to help people create income, options, and ownership through mobile homes. We teach proven strategiesâ€”wholesaling, flipping, rentals, land and parksâ€”and back it with... More 4.6 ( 9 ) Contact seller Products $39.99 / month Free trial Mobile Home Investing â€” All Courses &amp; Community MHEI Institute 4.0 ( 4 ) Unmute $647.00 / month Weekly Coaching + Deal Support for Serious Mobile Home Investors Elite Squad Mentorship 5.0 ( 5 ) Contact seller Reviews PL Paula C Lilly â€¢ Elite Squad Mentorship 2 months ago Great group of investors, lots of info, contracts, etc, shared, dependable leader if you need help. Written 4 months after purchase",
    "CC Cherice Carter â€¢ Elite Squad Mentorship 2 months ago Mobile Home Elite Investor group have given me gems to create generational wealth. Byron is a great instructor. Written 1 month after purchase",
    "NC Nick Corner â€¢ Elite Squad Mentorship 2 months ago This group is such a gem I canâ€™t recommend it enough. Great network of people as well Written 8 days after purchase",
    "AC Anthony Cavitt â€¢ Elite Squad Mentorship 2 months ago This is the best networking group to be involved with hands down ðŸ”¥ðŸ”¥ðŸ”¥â€¦ Written 1 month after purchase"
  ],
  "paras": [
    "MI Mobile Home Elite Investors Mobile Home Elite Investors exists to help people create income, options, and ownership through mobile homes. We teach proven strategiesâ€”wholesaling, flipping, rentals, land and parksâ€”and back it with... More 4.6 ( 9 ) Contact seller Products $39.99 / month Free trial Mobile Home Investing â€” All Courses &amp; Community MHEI Institute 4.0 ( 4 ) Unmute $647.00 / month Weekly Coaching + Deal Support for Serious Mobile Home Investors Elite Squad Mentorship 5.0 ( 5 ) Contact seller Reviews PL Paula C Lilly â€¢ Elite Squad Mentorship 2 months ago Great group of investors, lots of info, contracts, etc, shared, dependable leader if you need help.",
    "2 months ago Mobile Home Elite Investor group have given me gems to create generational wealth. Byron is a great instructor.",
    "2 months ago This group is such a gem I canâ€™t recommend it enough. Great network of people as well",
    "2 months ago This is the best networking group to be involved with hands down ðŸ”¥ðŸ”¥ðŸ”¥â€¦"
  ],
  "priceTokens": [
    "$39.99",
    "$647.00",
    "$1",
    "$1",
    "$1",
    "$21",
    "$1",
    "$1",
    "$1",
    "$1",
    "$28",
    "$1",
    "$28",
    "$28",
    "$28",
    "$28",
    "$3",
    "$3",
    "$3",
    "$10"
  ],
  "faq": [],
  "textSample": "Powered by MI Mobile Home Elite Investors Mobile Home Elite Investors exists to help people create income, options, and ownership through mobile homes. We teach proven strategiesâ€”wholesaling, flipping, rentals, land and parksâ€”and back it with... More 4.6 ( 9 ) Contact seller Products $39.99 / month Free trial Mobile Home Investing â€” All Courses &amp; Community MHEI Institute 4.0 ( 4 ) Unmute $647.00 / month Weekly Coaching + Deal Support for Serious Mobile Home Investors Elite Squad Mentorship 5.0 ( 5 ) Contact seller Reviews PL Paula C Lilly â€¢ Elite Squad Mentorship 2 months ago Great group of investors, lots of info, contracts, etc, shared, dependable leader if you need help. Written 4 months after purchase CC Cherice Carter â€¢ Elite Squad Mentorship 2 months ago Mobile Home Elite Investor group have given me gems to create generational wealth. Byron is a great instructor. Written 1 month after purchase NC Nick Corner â€¢ Elite Squad Mentorship 2 months ago This group is such a gem I canâ€™t recommend it enough. Great network of people as well Written 8 days after purchase AC Anthony Cavitt â€¢ Elite Squad Mentorship 2 months ago This is the best networking group to be involved with hands down ðŸ”¥ðŸ”¥ðŸ”¥â€¦ Written 1 month after purchase See all reviews Mobile Home Elite Investors | Whop",
  "finalUrl": "https://whop.com/mobile-home-elite-investors/?a=alexburnett21",
  "fetchedAt": "2025-11-05T10:37:18.486Z",
  "textHash": "384c7f4b5f52153bfa28d3ef6eee27c0b44a1127f32765eebf6e0baca415bd2d",
  "drilled": false
}