{
  "baseUrl": "https://whop.com/enrichtrades/?a=alexburnett21",
  "title": "Enrich Trades | Whop",
  "h1": "Enrich Trades",
  "bullets": [
    "Powered by ET Enrich Trades I’ve built a community designed to turn dedicated traders into the top 1%. I teach a proven strategy and give you the tools to master it — from swing trading and $SPY to compounding long-term portfoli... More 4.7 ( 35 ) Contact seller Products $59.99 / month Join the Top 1% of Traders Today Enrich Trades Blueprint 4.7 ( 30 ) $699.00 Join the Top 1% of Traders Today Enrich Trades Lifetime 5.0 ( 5 ) Contact seller Reviews SV Sasanka Vannemreddy • Enrich Trades Blueprint 1 month ago Enrich is amazing. His trades are always spot on. Good community to be part of. Thanks for all you do. Written 1 month after purchase",
    "CB Connor Borkowski • Enrich Trades Blueprint 1 month ago One of the best communities I’ve seen out there. Highly recommend to anyone! Written 5 months after purchase",
    "D Dak • Enrich Trades Blueprint 1 month ago Enrich is a great trader and host of the discord. Written 24 days after purchase",
    "SK Sijan Kafle • Enrich Trades Blueprint 1 month ago Enrich is an absolute goat Written 2 months after purchase"
  ],
  "paras": [
    "ET Enrich Trades I’ve built a community designed to turn dedicated traders into the top 1%. I teach a proven strategy and give you the tools to master it — from swing trading and $SPY to compounding long-term portfoli... More 4.7 ( 35 ) Contact seller Products $59.99 / month Join the Top 1% of Traders Today Enrich Trades Blueprint 4.7 ( 30 ) $699.00 Join the Top 1% of Traders Today Enrich Trades Lifetime 5.0 ( 5 ) Contact seller Reviews SV Sasanka Vannemreddy • Enrich Trades Blueprint 1 month ago Enrich is amazing. His trades are always spot on. Good community to be part of. Thanks for all you do.",
    "1 month ago One of the best communities I’ve seen out there. Highly recommend to anyone!",
    "1 month ago Enrich is a great trader and host of the discord.",
    "1 month ago Enrich is an absolute goat"
  ],
  "priceTokens": [
    "$59.99",
    "$699.00",
    "$1",
    "$1",
    "$1",
    "$21",
    "$1",
    "$1",
    "$1",
    "$1",
    "$28",
    "$1",
    "$28",
    "$28",
    "$28",
    "$28",
    "$3",
    "$3",
    "$3",
    "$10"
  ],
  "faq": [],
  "textSample": "Powered by ET Enrich Trades I’ve built a community designed to turn dedicated traders into the top 1%. I teach a proven strategy and give you the tools to master it — from swing trading and $SPY to compounding long-term portfoli... More 4.7 ( 35 ) Contact seller Products $59.99 / month Join the Top 1% of Traders Today Enrich Trades Blueprint 4.7 ( 30 ) $699.00 Join the Top 1% of Traders Today Enrich Trades Lifetime 5.0 ( 5 ) Contact seller Reviews SV Sasanka Vannemreddy • Enrich Trades Blueprint 1 month ago Enrich is amazing. His trades are always spot on. Good community to be part of. Thanks for all you do. Written 1 month after purchase CB Connor Borkowski • Enrich Trades Blueprint 1 month ago One of the best communities I’ve seen out there. Highly recommend to anyone! Written 5 months after purchase D Dak • Enrich Trades Blueprint 1 month ago Enrich is a great trader and host of the discord. Written 24 days after purchase SK Sijan Kafle • Enrich Trades Blueprint 1 month ago Enrich is an absolute goat Written 2 months after purchase See all reviews Enrich Trades | Whop",
  "finalUrl": "https://whop.com/enrichtrades/?a=alexburnett21",
  "fetchedAt": "2025-11-04T20:03:32.041Z",
  "textHash": "3c077ac0f5e782a0a6f5ba5e706be18770cea76631f619ab2a871a10cb2cff53",
  "drilled": false
}