{
  "baseUrl": "https://whop.com/new-money-blueprint/new-money-blueprint-copy/",
  "title": "Envelope Business Deposit | Whop",
  "h1": "Envelope Business Deposit",
  "bullets": [
    "Sign in Unmute Unmute Unmute Unmute Unmute Unmute NB Envelope Business Deposit Learn how to sell products online to old people Other Includes 55 educational videos covering everything from A-Z $499.00 one-time purchase Pay Join Join 3 members Features Save your spot for the done for you store before it closes",
    "I make An Envelope Business For You + Ads",
    "Lifetime Access To My Private 1on1 Help",
    "55 educational videos ( a-z outline, important things to know, case study)",
    "Picked Products For You"
  ],
  "paras": [
    "Sign in Unmute Unmute Unmute Unmute Unmute Unmute NB Envelope Business Deposit Learn how to sell products online to old people Other Includes 55 educational videos covering everything from A-Z",
    "Join 3 members Features Save your spot for the done for you store before it closes I make An Envelope Business For You + Ads Lifetime Access To My Private 1on1 Help 55 educational videos ( a-z outline, important things to know, case study) Picked Products For You About the creator MR View profile Matt Rutkowski @ infothenewmoney • Joined Feb 2025 -I&#x27;m an immigrant from Poland / Started ecom 8 years ago / Dropped out of college studying mechanical engineering / Made millions of schmickles selling products online to old people / Specialize in Meta ads Affiliates NB Become an affiliate New Money Blueprint 2 30% reward Earn money by bringing customers to New Money Blueprint 2. Every time a customer purchases using your link, you&#x27;ll earn a commission."
  ],
  "priceTokens": [
    "$499.00",
    "$499.00",
    "$499.00",
    "$1",
    "$1",
    "$1",
    "$22",
    "$1",
    "$1",
    "$1",
    "$1",
    "$1",
    "$2",
    "$1",
    "$2",
    "$2",
    "$2",
    "$2",
    "$3",
    "$3"
  ],
  "faq": [],
  "textSample": "Sign in Unmute Unmute Unmute Unmute Unmute Unmute NB Envelope Business Deposit Learn how to sell products online to old people Other Includes 55 educational videos covering everything from A-Z $499.00 one-time purchase Pay Join Join 3 members Features Save your spot for the done for you store before it closes I make An Envelope Business For You + Ads Lifetime Access To My Private 1on1 Help 55 educational videos ( a-z outline, important things to know, case study) Picked Products For You About the creator MR View profile Matt Rutkowski @ infothenewmoney • Joined Feb 2025 -I&#x27;m an immigrant from Poland / Started ecom 8 years ago / Dropped out of college studying mechanical engineering / Made millions of schmickles selling products online to old people / Specialize in Meta ads Affiliates NB Become an affiliate New Money Blueprint 2 30% reward Earn money by bringing customers to New Money Blueprint 2. Every time a customer purchases using your link, you&#x27;ll earn a commission. Envelope Business Deposit $499.00 one-time purchase Join $499.00 one-time purchase Pay Join Pay Join Envelope Business Deposit | Whop",
  "finalUrl": "https://whop.com/new-money-blueprint/new-money-blueprint-copy/",
  "fetchedAt": "2025-11-05T09:59:21.852Z",
  "textHash": "160719b1977ab442027c0cad6af0b949d4182ab088e2db7c0461af9c038c4e6c",
  "drilled": false
}