{
  "baseUrl": "https://whop.com/titansinnercircle/tiktoktitans/",
  "title": "Exclusive | Whop",
  "h1": "Exclusive",
  "bullets": [
    "Exclusive | Whop Sign in Unmute Unmute TT Exclusive Ready to take TikTok Shop Affiliate serious? 4.8 ( 60 ) Social media Get instant access to step-by-step TikTok Shop affiliate training, 1:1 support from real coaches, and a private creator community with 1,000+ active members. Free 3-day Available! $50.00 / month 3 day trial Pay Join Join 103 members Features Step-by-step course to easily master TikTok Shop.",
    "Access brand deals, free samples, and group calls.",
    "Access Premium Titan AI Tools",
    "Full livestream setup guide.",
    "Network daily in our active Discord community with other elite affiliates.",
    "SO Stephen Opoku 23 days ago Cool Written 4 months after purchase",
    "AM Ashley Nichole Mills 1 year ago This course is amazing and definitely worth investing in. Written 16 days after purchase",
    "MM Mina Mena 1 year ago This course is definitely worth investing in it’s filled with amazing knowledge!!! Written 6 days after purchase",
    "JS Jayme Smith 1 year ago The amount of info you get out of the discord is unreal. You can get everything from retainer deals, higher commission, free samples, 1 on 1 coaching, feedback on videos, everything you need to have success is in this course! Written 1 month after purchase"
  ],
  "paras": [
    "Sign in Unmute Unmute TT Exclusive Ready to take TikTok Shop Affiliate serious? 4.8 ( 60 ) Social media Get instant access to step-by-step TikTok Shop affiliate training, 1:1 support from real coaches, and a private creator community with 1,000+ active members. Free 3-day Available!",
    "3 day trial Pay Join Join 103 members Features Step-by-step course to easily master TikTok Shop. Access brand deals, free samples, and group calls. Access Premium Titan AI Tools Full livestream setup guide. Network daily in our active Discord community with other elite affiliates. Reviews 4.82 out of 5 60 total reviews 5 stars 4 stars 3 stars 2 stars 1 star SO Stephen Opoku 23 days ago Cool",
    "1 year ago This course is amazing and definitely worth investing in.",
    "1 year ago This course is definitely worth investing in it’s filled with amazing knowledge!!!",
    "1 year ago The amount of info you get out of the discord is unreal. You can get everything from retainer deals, higher commission, free samples, 1 on 1 coaching, feedback on videos, everything you need to have success is in this course!",
    "About the creator JM View profile John M @ faultt • Joined Oct 2022 I’ve dedicated my career to mastering TikTok, creating a thriving community where ambitious creators can learn, grow, and earn. With TikTok Titans, I’m here to guide you to success. FAQs How much will I make in a month with TikTok Shop? Can I get a refund? How fast can I get started? What is TikTok Titans? Affiliates TT Become an affiliate Tiktok Titans 1% reward Earn money by bringing customers to Tiktok Titans. Every time a customer purchases using your link, you&#x27;ll earn a commission."
  ],
  "priceTokens": [
    "$50.00",
    "$50.00",
    "$50.00",
    "$1",
    "$1",
    "$1",
    "$22",
    "$1",
    "$1",
    "$1",
    "$1",
    "$1",
    "$2",
    "$1",
    "$2",
    "$2",
    "$2",
    "$2",
    "$3",
    "$3"
  ],
  "faq": [],
  "textSample": "Exclusive | Whop Sign in Unmute Unmute TT Exclusive Ready to take TikTok Shop Affiliate serious? 4.8 ( 60 ) Social media Get instant access to step-by-step TikTok Shop affiliate training, 1:1 support from real coaches, and a private creator community with 1,000+ active members. Free 3-day Available! $50.00 / month 3 day trial Pay Join Join 103 members Features Step-by-step course to easily master TikTok Shop. Access brand deals, free samples, and group calls. Access Premium Titan AI Tools Full livestream setup guide. Network daily in our active Discord community with other elite affiliates. Reviews 4.82 out of 5 60 total reviews 5 stars 4 stars 3 stars 2 stars 1 star SO Stephen Opoku 23 days ago Cool Written 4 months after purchase AM Ashley Nichole Mills 1 year ago This course is amazing and definitely worth investing in. Written 16 days after purchase MM Mina Mena 1 year ago This course is definitely worth investing in it’s filled with amazing knowledge!!! Written 6 days after purchase JS Jayme Smith 1 year ago The amount of info you get out of the discord is unreal. You can get everything from retainer deals, higher commission, free samples, 1 on 1 coaching, feedback on videos, everything you need to have success is in this course! Written 1 month after purchase See all reviews About the creator JM View profile John M @ faultt • Joined Oct 2022 I’ve dedicated my career to mastering TikTok, creating a thriving community where ambitious creators can learn, grow, and earn. With TikTok Titans, I’m here to guide you to success. FAQs How much will I make in a month with TikTok Shop? Can I get a refund? How fast can I get started? What is TikTok Titans? Affiliates TT Become an affiliate Tiktok Titans 1% reward Earn money by bringing customers to Tiktok Titans. Every time a customer purchases using your link, you&#x27;ll earn a commission. Exclusive $50.00 / month Join $50.00 / month Pay Join Pay Join",
  "finalUrl": "https://whop.com/titansinnercircle/tiktoktitans/",
  "fetchedAt": "2025-11-05T17:31:23.232Z",
  "textHash": "9d4401f2ed7c7d8ec9b3416d08279be63868bba385d054fa5a857d553fe4acfa",
  "drilled": false
}