{
  "baseUrl": "https://whop.com/finupwise-en/finupwise-de/",
  "title": "Finupwise DE | Whop",
  "h1": "Finupwise DE",
  "bullets": [
    "Sign in F Finupwise DE Lerne, Geld zu managen &amp; Verm√∂gen aufzubauen 5.0 ( 3 ) Personal finance Mit praxisnahen Kursen, einfachen Strategien und pers√∂nlichem Coaching helfe ich dir, finanzielle Klarheit zu gewinnen und dein Verm√∂gen Schritt f√ºr Schritt aufzubauen. Join Join 5 members Features Effektive Videolektionen",
    "Langfristiger Verm√∂gensaufbau",
    "Klare Umsetzungsschritte",
    "Starkes Finanzvertrauen",
    "Klare Finanzstrategie",
    "B Betty 14 days ago Written 4 days after purchase",
    "E Eric 1 month ago Written 4 months after purchase",
    "S Steph 1 month ago Written 1 day after purchase"
  ],
  "paras": [
    "Sign in F Finupwise DE Lerne, Geld zu managen &amp; Verm√∂gen aufzubauen 5.0 ( 3 ) Personal finance Mit praxisnahen Kursen, einfachen Strategien und pers√∂nlichem Coaching helfe ich dir, finanzielle Klarheit zu gewinnen und dein Verm√∂gen Schritt f√ºr Schritt aufzubauen.",
    "Join 5 members Features Effektive Videolektionen Langfristiger Verm√∂gensaufbau Klare Umsetzungsschritte Starkes Finanzvertrauen Klare Finanzstrategie Reviews 5 out of 5 3 total reviews 5 stars 4 stars 3 stars 2 stars 1 star B Betty 14 days ago",
    "1 month ago",
    "1 month ago",
    "FAQs Wer kann von deinem Finanzcoaching und deinen Kursen profitieren? Brauche ich Vorkenntnisse im Finanzbereich, um an den Kursen teilzunehmen? Wie lange habe ich Zugriff auf die Kursmaterialien? Wie wird das Coaching durchgef√ºhrt? Kann ich pers√∂nliche Beratung bekommen? Affiliates F Become an affiliate Finupwise 20% reward Earn money by bringing customers to Finupwise. Every time a customer purchases using your link, you&#x27;ll earn a commission."
  ],
  "priceTokens": [
    "‚Ç¨55.00",
    "‚Ç¨55.00",
    "$1",
    "$1",
    "$1",
    "$22",
    "$1",
    "$1",
    "$1",
    "$1",
    "$1",
    "$2",
    "$1",
    "$2",
    "$2",
    "$2",
    "$2",
    "$3",
    "$3",
    "$3"
  ],
  "faq": [],
  "textSample": "Sign in F Finupwise DE Lerne, Geld zu managen &amp; Verm√∂gen aufzubauen 5.0 ( 3 ) Personal finance Mit praxisnahen Kursen, einfachen Strategien und pers√∂nlichem Coaching helfe ich dir, finanzielle Klarheit zu gewinnen und dein Verm√∂gen Schritt f√ºr Schritt aufzubauen. Join Join 5 members Features Effektive Videolektionen Langfristiger Verm√∂gensaufbau Klare Umsetzungsschritte Starkes Finanzvertrauen Klare Finanzstrategie Reviews 5 out of 5 3 total reviews 5 stars 4 stars 3 stars 2 stars 1 star B Betty 14 days ago Written 4 days after purchase E Eric 1 month ago Written 4 months after purchase S Steph 1 month ago Written 1 day after purchase About the creator R View profile Roberto @ robello ‚Ä¢ Joined Apr 2025 üá¨üáßWealth Management/ Personal finance Coach ‚Äî Helping you achieve financial clarity and build lasting wealth üá©üá™Verm√∂gensverwaltung / Personal Finance Coach ‚Äì Ich helfe dir, finanzielle Klarheit zu gewinnen und dauerhaft Verm√∂gen aufzubauen. FAQs Wer kann von deinem Finanzcoaching und deinen Kursen profitieren? Brauche ich Vorkenntnisse im Finanzbereich, um an den Kursen teilzunehmen? Wie lange habe ich Zugriff auf die Kursmaterialien? Wie wird das Coaching durchgef√ºhrt? Kann ich pers√∂nliche Beratung bekommen? Affiliates F Become an affiliate Finupwise 20% reward Earn money by bringing customers to Finupwise. Every time a customer purchases using your link, you&#x27;ll earn a commission. Finupwise DE ‚Ç¨55.00 one-time purchase Join ‚Ç¨55.00 one-time purchase Join Finupwise DE | Whop",
  "finalUrl": "https://whop.com/finupwise-en/finupwise-de/",
  "fetchedAt": "2025-11-05T10:00:43.652Z",
  "textHash": "327b936d1c980f2aa9946e81822f4bc12afaa7e6710a67c46eda430bd257f7a5",
  "drilled": false
}