{
  "baseUrl": "https://whop.com/flipping-to-freedom-1/ftf-lego-access/",
  "title": "Flipping To Freedom Lego | Whop",
  "h1": "Flipping To Freedom Lego",
  "bullets": [
    "Sign in FF Flipping To Freedom Lego Unlock Profits with Lego Investing 5.0 ( 54 ) Amazon FBA FTF provides a Lego-centric platform for resellers to access expert advice, specialized bots, and a robust investment database to boost ROI. £9.99 / month Pay Join Join 19 members Features Comprehensive lead sheet with 100+ profitable leads monthly",
    "Exclusive Lego bot for top retailer deals",
    "24/7 access to Lego and reselling experts",
    "Four Virtual Assistants sourcing 200+ leads monthly",
    "Access to a dedicated Lego specialist",
    "L Lewisallison 1 year ago Great owners and staff and members all really helpful and friendly. Never feel like your asking a dumb question 100% worth it. Written 6 months after purchase",
    "GS Grant sharman 1 year ago Great group, always help you with anything Amazon related in a quick time. Lots of valuable info for both beginners and experienced sellers Written 5 months after purchase",
    "M mif 1 year ago Been a member of FTF for 2 years, easily the best investment to date. This group adds new features on a weekly basis and is a great environment for support with growing your Amazon business Written 1 year after purchase",
    "V Viperzx 1 year ago Great service, fully recommend if wanting to get started in lego investing Written 6 months after purchase"
  ],
  "paras": [
    "Sign in FF Flipping To Freedom Lego Unlock Profits with Lego Investing 5.0 ( 54 ) Amazon FBA FTF provides a Lego-centric platform for resellers to access expert advice, specialized bots, and a robust investment database to boost ROI.",
    "Join 19 members Features Comprehensive lead sheet with 100+ profitable leads monthly Exclusive Lego bot for top retailer deals 24/7 access to Lego and reselling experts Four Virtual Assistants sourcing 200+ leads monthly Access to a dedicated Lego specialist Reviews 5 out of 5 54 total reviews 5 stars 4 stars 3 stars 2 stars 1 star L Lewisallison 1 year ago Great owners and staff and members all really helpful and friendly. Never feel like your asking a dumb question 100% worth it.",
    "1 year ago Great group, always help you with anything Amazon related in a quick time. Lots of valuable info for both beginners and experienced sellers",
    "1 year ago Been a member of FTF for 2 years, easily the best investment to date. This group adds new features on a weekly basis and is a great environment for support with growing your Amazon business",
    "1 year ago Great service, fully recommend if wanting to get started in lego investing",
    "About the creator F View profile FTF @ flippingtofreedom • Joined Jun 2023 I&#x27;ve been entrenched in the reselling world, helping individuals transform their Amazon businesses. With FTF, I&#x27;ve cultivated a community that thrives on collaboration and growth. Our powerful lead sheets, expert insights, and exclusive partnerships offer unparalleled support to empower every reseller. Join us and transform your passion into profit. FAQs How do I join the FTF Discord server? Why choose FTF? Do I need any prior experience to join? Affiliates FF Become an affiliate Flipping To Freedom 30% reward Earn money by bringing customers to Flipping To Freedom. Every time a customer purchases using your link, you&#x27;ll earn a commission."
  ],
  "priceTokens": [
    "£9.99",
    "£9.99",
    "£9.99",
    "$1",
    "$1",
    "$1",
    "$22",
    "$1",
    "$1",
    "$1",
    "$1",
    "$1",
    "$2",
    "$1",
    "$2",
    "$2",
    "$2",
    "$2",
    "$3",
    "$3"
  ],
  "faq": [],
  "textSample": "Sign in FF Flipping To Freedom Lego Unlock Profits with Lego Investing 5.0 ( 54 ) Amazon FBA FTF provides a Lego-centric platform for resellers to access expert advice, specialized bots, and a robust investment database to boost ROI. £9.99 / month Pay Join Join 19 members Features Comprehensive lead sheet with 100+ profitable leads monthly Exclusive Lego bot for top retailer deals 24/7 access to Lego and reselling experts Four Virtual Assistants sourcing 200+ leads monthly Access to a dedicated Lego specialist Reviews 5 out of 5 54 total reviews 5 stars 4 stars 3 stars 2 stars 1 star L Lewisallison 1 year ago Great owners and staff and members all really helpful and friendly. Never feel like your asking a dumb question 100% worth it. Written 6 months after purchase GS Grant sharman 1 year ago Great group, always help you with anything Amazon related in a quick time. Lots of valuable info for both beginners and experienced sellers Written 5 months after purchase M mif 1 year ago Been a member of FTF for 2 years, easily the best investment to date. This group adds new features on a weekly basis and is a great environment for support with growing your Amazon business Written 1 year after purchase V Viperzx 1 year ago Great service, fully recommend if wanting to get started in lego investing Written 6 months after purchase See all reviews About the creator F View profile FTF @ flippingtofreedom • Joined Jun 2023 I&#x27;ve been entrenched in the reselling world, helping individuals transform their Amazon businesses. With FTF, I&#x27;ve cultivated a community that thrives on collaboration and growth. Our powerful lead sheets, expert insights, and exclusive partnerships offer unparalleled support to empower every reseller. Join us and transform your passion into profit. FAQs How do I join the FTF Discord server? Why choose FTF? Do I need any prior experience to join? Affiliates FF Become an affiliate Flipping To Freedom 30% reward Earn money by bringing customers to Flipping To Freedom. Every time a customer purchases using your link, you&#x27;ll earn a commission. Flipping To Freedom Lego £9.99 / month Join £9.99 / month Pay Join Pay Join Flipping To Freedom Lego | Whop",
  "finalUrl": "https://whop.com/flipping-to-freedom-1/ftf-lego-access/",
  "fetchedAt": "2025-11-05T10:45:34.310Z",
  "textHash": "052ca3b61864e3c0c175d01df67961d91b609c1033cfd1cce7a4dcae7f985465",
  "drilled": false
}