{
  "baseUrl": "https://whop.com/swiss-trading-hall/sth/",
  "title": "Forex Kurs: Funded werden | Whop",
  "h1": "Forex Kurs: Funded werden",
  "bullets": [
    "Sign in SH Forex Kurs: Funded werden Traden mit System: Dein Weg zum Funded Account 4.8 ( 18 ) Other Vom ersten Trade bis zur Auszahlung – dieser Kurs zeigt dir, wie du Funded Accounts mit System und dem Fixed Entry Modell bestehst. Klar. Direkt. Ohne BlaBla. $999.00 one-time purchase Pay Join waitlist Join 13 members Features Zugang zur vollständigen Fixed Entry Strategie – exakt, replizierbar, profitabel",
    "Ausführliches PDF-Handbuch zur Strategie mit Setups, Regeln &amp; Trade-Management",
    "Tools &amp; Vorlagen zur direkten Umsetzung deiner eigenen Setups",
    "Regelmäßige Strategie-Updates &amp; Erweiterungen basierend auf Marktentwicklungen",
    "Lerne, wie profitable Trader Entry-Zonen planen und exekutieren",
    "CY Cansu Yukus 6 months ago Super Community, alle sehr hilfreich und nett! Written 3 months after purchase",
    "LR Lowis Rachowski 8 months ago Diese Trading-Gruppe ist der Wahnsinn! Man lernt hier wirklich alles von A bis Z – egal, ob man kompletter Anfänger ist oder schon etwas Erfahrung hat. Die Analysen sind extrem fundiert und leicht verständlich erklärt. Es gibt regelmäßig hilfreiche Tipps und klare Ratschläge, wie man vorgehen sollte... Show more Written 3 months after purchase",
    "MA Mohamad Ali 8 months ago Super Commmunity extrem zufrieden mit dem trading bot. Signale und Lernkurse sind auch alle sehr gut und verständlich. Written 23 days after purchase",
    "D Davis 8 months ago Top Trading Community! Für den kleinen monatlichen Preis, den man bezahlt bekommt man extrem viel: Trading Signale von verschiedenen Analysten, die nachweislich funded und dementsprechend profitabel sind, Zugang zu Copytradingprofilen auf ByBit mit profitablen Trackrecord und eine aktive Community, ... Show more Written 19 days after purchase"
  ],
  "paras": [
    "Sign in SH Forex Kurs: Funded werden Traden mit System: Dein Weg zum Funded Account 4.8 ( 18 ) Other Vom ersten Trade bis zur Auszahlung – dieser Kurs zeigt dir, wie du Funded Accounts mit System und dem Fixed Entry Modell bestehst. Klar. Direkt. Ohne BlaBla.",
    "Join 13 members Features Zugang zur vollständigen Fixed Entry Strategie – exakt, replizierbar, profitabel Ausführliches PDF-Handbuch zur Strategie mit Setups, Regeln &amp; Trade-Management Tools &amp; Vorlagen zur direkten Umsetzung deiner eigenen Setups Regelmäßige Strategie-Updates &amp; Erweiterungen basierend auf Marktentwicklungen Lerne, wie profitable Trader Entry-Zonen planen und exekutieren Reviews 4.78 out of 5 18 total reviews 5 stars 4 stars 3 stars 2 stars 1 star CY Cansu Yukus 6 months ago Super Community, alle sehr hilfreich und nett!",
    "8 months ago Diese Trading-Gruppe ist der Wahnsinn! Man lernt hier wirklich alles von A bis Z – egal, ob man kompletter Anfänger ist oder schon etwas Erfahrung hat. Die Analysen sind extrem fundiert und leicht verständlich erklärt. Es gibt regelmäßig hilfreiche Tipps und klare Ratschläge, wie man vorgehen sollte...",
    "Written 3 months after purchase MA Mohamad Ali 8 months ago Super Commmunity extrem zufrieden mit dem trading bot. Signale und Lernkurse sind auch alle sehr gut und verständlich.",
    "8 months ago Top Trading Community! Für den kleinen monatlichen Preis, den man bezahlt bekommt man extrem viel: Trading Signale von verschiedenen Analysten, die nachweislich funded und dementsprechend profitabel sind, Zugang zu Copytradingprofilen auf ByBit mit profitablen Trackrecord und eine aktive Community, ...",
    "Written 19 days after purchase See all reviews About the creator SH View profile Swiss Trading Hall @ swisstradinghall • Joined Jun 2023 Ich bin ein erfahrener Trader aus der Schweiz und verwalte über 1 Million Euro an Vermögenswerten. Mit meiner Expertise helfe ich anderen, ihre Handelsstrategien zu optimieren und erfolgreich zu traden. FAQs Ist der Discord Server wirklich kostenlos? Muss ich eine Kreditkarte hinterlegen? Gibt es Premium-Features, die extra kosten? Wie bekomme ich Zugang zu den privaten Channels? Was passiert, wenn ich keine Rolle erhalte? Affiliates SH Become an affiliate Swiss Trading Hall (German) 10% reward Earn money by bringing customers to Swiss Trading Hall (German). Every time a customer purchases using your link, you&#x27;ll earn a commission."
  ],
  "priceTokens": [
    "$999.00",
    "$999.00",
    "$999.00",
    "$1",
    "$1",
    "$1",
    "$22",
    "$1",
    "$1",
    "$1",
    "$1",
    "$1",
    "$2",
    "$1",
    "$2",
    "$2",
    "$2",
    "$2",
    "$3",
    "$3"
  ],
  "faq": [],
  "textSample": "Sign in SH Forex Kurs: Funded werden Traden mit System: Dein Weg zum Funded Account 4.8 ( 18 ) Other Vom ersten Trade bis zur Auszahlung – dieser Kurs zeigt dir, wie du Funded Accounts mit System und dem Fixed Entry Modell bestehst. Klar. Direkt. Ohne BlaBla. $999.00 one-time purchase Pay Join waitlist Join 13 members Features Zugang zur vollständigen Fixed Entry Strategie – exakt, replizierbar, profitabel Ausführliches PDF-Handbuch zur Strategie mit Setups, Regeln &amp; Trade-Management Tools &amp; Vorlagen zur direkten Umsetzung deiner eigenen Setups Regelmäßige Strategie-Updates &amp; Erweiterungen basierend auf Marktentwicklungen Lerne, wie profitable Trader Entry-Zonen planen und exekutieren Reviews 4.78 out of 5 18 total reviews 5 stars 4 stars 3 stars 2 stars 1 star CY Cansu Yukus 6 months ago Super Community, alle sehr hilfreich und nett! Written 3 months after purchase LR Lowis Rachowski 8 months ago Diese Trading-Gruppe ist der Wahnsinn! Man lernt hier wirklich alles von A bis Z – egal, ob man kompletter Anfänger ist oder schon etwas Erfahrung hat. Die Analysen sind extrem fundiert und leicht verständlich erklärt. Es gibt regelmäßig hilfreiche Tipps und klare Ratschläge, wie man vorgehen sollte... Show more Written 3 months after purchase MA Mohamad Ali 8 months ago Super Commmunity extrem zufrieden mit dem trading bot. Signale und Lernkurse sind auch alle sehr gut und verständlich. Written 23 days after purchase D Davis 8 months ago Top Trading Community! Für den kleinen monatlichen Preis, den man bezahlt bekommt man extrem viel: Trading Signale von verschiedenen Analysten, die nachweislich funded und dementsprechend profitabel sind, Zugang zu Copytradingprofilen auf ByBit mit profitablen Trackrecord und eine aktive Community, ... Show more Written 19 days after purchase See all reviews About the creator SH View profile Swiss Trading Hall @ swisstradinghall • Joined Jun 2023 Ich bin ein erfahrener Trader aus der Schweiz und verwalte über 1 Million Euro an Vermögenswerten. Mit meiner Expertise helfe ich anderen, ihre Handelsstrategien zu optimieren und erfolgreich zu traden. FAQs Ist der Discord Server wirklich kostenlos? Muss ich eine Kreditkarte hinterlegen? Gibt es Premium-Features, die extra kosten? Wie bekomme ich Zugang zu den privaten Channels? Was passiert, wenn ich keine Rolle erhalte? Affiliates SH Become an affiliate Swiss Trading Hall (German) 10% reward Earn money by bringing customers to Swiss Trading Hall (German). Every time a customer purchases using your link, you&#x27;ll earn a commission. Forex Kurs: Funded werden $999.00 one-time purchase Get access $999.00 one-time purchase Pay Join waitlist Pay Join waitlist Forex Kurs: Funded werden | Whop",
  "finalUrl": "https://whop.com/swiss-trading-hall/sth/",
  "fetchedAt": "2025-11-05T09:20:31.206Z",
  "textHash": "1f8345bb82e4626418f5d86543754e8b2ced692bf13f6f864322bbdaad1b0b63",
  "drilled": false
}