{
  "baseUrl": "https://whop.com/fullportuniversity/?a=alexburnett21",
  "title": "Full Port University | Whop",
  "h1": "Full Port University",
  "bullets": [
    "Full Port University | Whop Powered by FU Full Port University I&#x27;ve dedicated my career to mastering the art of trading alongside WallSt. traders. Teaching others to navigate this complex world is my passion. With Full Port University, I aim to bring you the same... More 4.8 ( 164 ) Contact seller Products $99.00 / month Free trial Learn To Trade From Proven Analysts FPU VIP 4.8 ( 110 ) $999.00 Learn Trading from Experts FPU LifeTime 4.9 ( 23 ) Contact seller Reviews HC Hector A. Cruz • FPU LifeTime 3 days ago great app Written 2 months after purchase",
    "CL Cindy Dung Le • FPU LifeTime 21 days ago Great community Written 6 months after purchase",
    "C Chop1247 • FPU LifeTime 1 month ago Makin sick money and they offer live day trading help love it Written 17 days after purchase",
    "ML Matthew Lui • FPU LifeTime 2 months ago Making money ! Written 10 months after purchase"
  ],
  "paras": [
    "FU Full Port University I&#x27;ve dedicated my career to mastering the art of trading alongside WallSt. traders. Teaching others to navigate this complex world is my passion. With Full Port University, I aim to bring you the same... More 4.8 ( 164 ) Contact seller Products $99.00 / month Free trial Learn To Trade From Proven Analysts FPU VIP 4.8 ( 110 ) $999.00 Learn Trading from Experts FPU LifeTime 4.9 ( 23 ) Contact seller Reviews HC Hector A. Cruz • FPU LifeTime 3 days ago great app",
    "21 days ago Great community",
    "1 month ago Makin sick money and they offer live day trading help love it",
    "2 months ago Making money !"
  ],
  "priceTokens": [
    "$99.00",
    "$999.00",
    "$1",
    "$1",
    "$1",
    "$21",
    "$1",
    "$1",
    "$1",
    "$1",
    "$28",
    "$1",
    "$28",
    "$28",
    "$28",
    "$28",
    "$3",
    "$3",
    "$3",
    "$10"
  ],
  "faq": [],
  "textSample": "Full Port University | Whop Powered by FU Full Port University I&#x27;ve dedicated my career to mastering the art of trading alongside WallSt. traders. Teaching others to navigate this complex world is my passion. With Full Port University, I aim to bring you the same... More 4.8 ( 164 ) Contact seller Products $99.00 / month Free trial Learn To Trade From Proven Analysts FPU VIP 4.8 ( 110 ) $999.00 Learn Trading from Experts FPU LifeTime 4.9 ( 23 ) Contact seller Reviews HC Hector A. Cruz • FPU LifeTime 3 days ago great app Written 2 months after purchase CL Cindy Dung Le • FPU LifeTime 21 days ago Great community Written 6 months after purchase C Chop1247 • FPU LifeTime 1 month ago Makin sick money and they offer live day trading help love it Written 17 days after purchase ML Matthew Lui • FPU LifeTime 2 months ago Making money ! Written 10 months after purchase See all reviews",
  "finalUrl": "https://whop.com/fullportuniversity/?a=alexburnett21",
  "fetchedAt": "2025-11-04T21:41:06.480Z",
  "textHash": "dd08675c58814ad4b77e74ba4f5ea1ea5b7eea082504b88f9435ba3b32c5d018",
  "drilled": false
}