{
  "baseUrl": "https://whop.com/gold-signals-xauuse/forexsignalsfxpremiere-com/",
  "title": "Global FX Signals Hub | Whop",
  "h1": "Global FX Signals Hub",
  "bullets": [
    "Global FX Signals Hub | Whop Sign in Unmute Unmute F Global FX Signals Hub Daily Forex Signals for Busy Swing Traders Seeking Steady Gains 3.7 ( 7 ) Trading 15% off with COUPON CODE ( salenow15% ) Get daily signals via Telegram for FX, GOLD, US30, SP500, NASDAQ. Access over 40 providers and aim for up to 1300 pips daily. $49.00 / month Pay Purchase Join 61 members Features Access to over 40 Forex Signal sources via Telegram/Discord.",
    "Up to 15 Forex Signals per day, aiming for 1000 pips!",
    "Live Chat via Telegram for instant support and updates.",
    "1000+ FX Learning Guides",
    "Open Fx Account",
    "SC Sarah Caldon 10 months ago Absolutely Amazing - I can see over 1000 Articles on how to trade and its blown my mind on how good the content is. thankyou fxpremiere Written 4 days after purchase",
    "SC Sarah Caldon 10 months ago Absolutely Amazing - I can see over 1000 Articles on how to trade and its blown my mind on how good the content is. thankyou fxpremiere Written 4 days after purchase",
    "SC Sarah Caldon 1 year ago Absolutely great signals and a professional team good to see after 10 years they are now on whop Written 5 days after purchase",
    "BF Baptiste Ferry 11 days ago Written 16 days after purchase"
  ],
  "paras": [
    "Sign in Unmute Unmute F Global FX Signals Hub Daily Forex Signals for Busy Swing Traders Seeking Steady Gains 3.7 ( 7 ) Trading 15% off with COUPON CODE ( salenow15% ) Get daily signals via Telegram for FX, GOLD, US30, SP500, NASDAQ. Access over 40 providers and aim for up to 1300 pips daily.",
    "$49.00 / month Pay Purchase Join 61 members Features Access to over 40 Forex Signal sources via Telegram/Discord. Up to 15 Forex Signals per day, aiming for 1000 pips! Live Chat via Telegram for instant support and updates. 1000+ FX Learning Guides Open Fx Account Reviews 3.71 out of 5 7 total reviews 5 stars 4 stars 3 stars 2 stars 1 star SC Sarah Caldon 10 months ago Absolutely Amazing - I can see over 1000 Articles on how to trade and its blown my mind on how good the content is. thankyou fxpremiere",
    "10 months ago Absolutely Amazing - I can see over 1000 Articles on how to trade and its blown my mind on how good the content is. thankyou fxpremiere",
    "1 year ago Absolutely great signals and a professional team good to see after 10 years they are now on whop",
    "11 days ago",
    "About the creator FF View profile FX Signals by FxPremiere @ forexsignalssms • Joined Dec 2023 Daily Telegram Signals by FxPremiere FAQs How long has FxPremiere been in business? How can I cancel my membership? Affiliates F Become an affiliate FxPremiere.com 30% reward Earn money by bringing customers to FxPremiere.com. Every time a customer purchases using your link, you&#x27;ll earn a commission."
  ],
  "priceTokens": [
    "$49.00",
    "$49.00",
    "$49.00",
    "$1",
    "$1",
    "$1",
    "$23",
    "$1",
    "$1",
    "$1",
    "$1",
    "$1",
    "$2",
    "$1",
    "$2",
    "$2",
    "$2",
    "$2",
    "$3",
    "$3"
  ],
  "faq": [],
  "textSample": "Global FX Signals Hub | Whop Sign in Unmute Unmute F Global FX Signals Hub Daily Forex Signals for Busy Swing Traders Seeking Steady Gains 3.7 ( 7 ) Trading 15% off with COUPON CODE ( salenow15% ) Get daily signals via Telegram for FX, GOLD, US30, SP500, NASDAQ. Access over 40 providers and aim for up to 1300 pips daily. $49.00 / month Pay Purchase Join 61 members Features Access to over 40 Forex Signal sources via Telegram/Discord. Up to 15 Forex Signals per day, aiming for 1000 pips! Live Chat via Telegram for instant support and updates. 1000+ FX Learning Guides Open Fx Account Reviews 3.71 out of 5 7 total reviews 5 stars 4 stars 3 stars 2 stars 1 star SC Sarah Caldon 10 months ago Absolutely Amazing - I can see over 1000 Articles on how to trade and its blown my mind on how good the content is. thankyou fxpremiere Written 4 days after purchase SC Sarah Caldon 10 months ago Absolutely Amazing - I can see over 1000 Articles on how to trade and its blown my mind on how good the content is. thankyou fxpremiere Written 4 days after purchase SC Sarah Caldon 1 year ago Absolutely great signals and a professional team good to see after 10 years they are now on whop Written 5 days after purchase BF Baptiste Ferry 11 days ago Written 16 days after purchase See all reviews About the creator FF View profile FX Signals by FxPremiere @ forexsignalssms • Joined Dec 2023 Daily Telegram Signals by FxPremiere FAQs How long has FxPremiere been in business? How can I cancel my membership? Affiliates F Become an affiliate FxPremiere.com 30% reward Earn money by bringing customers to FxPremiere.com. Every time a customer purchases using your link, you&#x27;ll earn a commission. Global FX Signals Hub $49.00 / month +1 option Purchase $49.00 / month 1 option Pay Purchase Pay Purchase",
  "finalUrl": "https://whop.com/gold-signals-xauuse/forexsignalsfxpremiere-com/",
  "fetchedAt": "2025-11-05T09:19:13.079Z",
  "textHash": "57d200d943cdaed9dc3daf367811870ae8306dc13ecc90c3f008183712bcd390",
  "drilled": false
}