{
  "baseUrl": "https://whop.com/best-forex-pips-vip/global-trade-empire-vip-forex-signals/",
  "title": "Best Forex Pips VIP Signals | Whop",
  "h1": "Best Forex Pips VIP Signals",
  "bullets": [
    "Best Forex Pips VIP Signals | Whop Sign in Unmute Unmute Unmute Unmute Unmute Unmute Unmute Unmute Unmute Unmute Unmute Unmute BP Best Forex Pips VIP Signals Real-Time Forex Signals: US30, NAS100, Gold + Daily Profits &amp; Trade Alerts 4.7 ( 29 ) Trading Join Best Forex Pips VIP Live Trade Alerts and gain access to the same high-probability setups professional traders use every day. Our signals are designed to give you confidence, precision, and consistent profits in the markets. Whether you’re trading Forex pairs, Gold, or indices like US30 and NAS100, our team provides step-by-step guidance so you never have to guess. ✅ Trades Called in Real-Time – US30, NAS100, XAUUSD &amp; Forex Pairs ✅ Exact Entry, Stop Loss &amp; Take Profit Levels – no confusion, just clarity ✅ Works With Any Broker or Prop Firm – FTMO, MFF, and more approved ✅ Global Coverage – trades sent in New York, London, Tokyo &amp; Sydney sessions ✅ Proven 3:1 Risk-to-Reward Ratio – maximize wins while minimizing losses ✅ 3–4 High-Probability Forex Signals Daily – consistent opportunities every session ✅ Fundamental Analysis – know how news &amp; economic events move the markets ✅ Technical Analysis – chart breakdowns, market structure, and sniper entries ✅ High-Impact News Updates – stay ahead of NFP, CPI, FOMC &amp; other big moves ✅ Multi-Platform Delivery – receive every trade instantly via Discord, Telegram, Whop app &amp; email With Best Forex Pips VIP, you’ll get more than just signals—you’ll learn strategy, discipline, and professional risk management. Our mission is to help you win more trades, build confidence, and scale your trading account faster than ever. $99.00 / month Pay Join Features 4 to 5 Signals sent a day for us30, nas100, xauusd, USDJPY, Gbpjpy, gbpusd",
    "Live Trading Sessions Daily included with VIP access",
    "VIP trades are sent to discord, telegram, whop app, &amp; email",
    "24 Hour Customer support, Help with risk management , Help passing prop firms",
    "Every trade includes stop loss, take profit, entry price and order type",
    "EA Edward Abbey 24 days ago Best ever Written 1 year after purchase",
    "MM MILOUDI MEL 2 months ago Amazing Written 5 months after purchase",
    "J jeffforex 9 months ago Outstanding Results! Global Trader Empire VIP helped me pass The Funded Trader Phase 1 in just 5 days with their US30 and NAS100 trades. Now I’m funded with a $100K account! Their strategies are accurate and effective. Highly recommend for anyone serious about prop firm challenges! Written 3 days after purchase",
    "A annatrades 9 months ago Global Trade Empire VIP signals are unmatched! I grew my account from $100 to $1,300 in just one week. Their accuracy and consistency are top-notch. Hands down the best signal provider out there! Highly recommend! Written 3 days after purchase"
  ],
  "paras": [
    "Sign in Unmute Unmute Unmute Unmute Unmute Unmute Unmute Unmute Unmute Unmute Unmute Unmute BP Best Forex Pips VIP Signals Real-Time Forex Signals: US30, NAS100, Gold + Daily Profits &amp; Trade Alerts 4.7 ( 29 ) Trading Join Best Forex Pips VIP Live Trade Alerts and gain access to the same high-probability setups professional traders use every day. Our signals are designed to give you confidence, precision, and consistent profits in the markets. Whether you’re trading Forex pairs, Gold, or indices like US30 and NAS100, our team provides step-by-step guidance so you never have to guess.",
    "✅ Trades Called in Real-Time – US30, NAS100, XAUUSD &amp; Forex Pairs ✅ Exact Entry, Stop Loss &amp; Take Profit Levels – no confusion, just clarity ✅ Works With Any Broker or Prop Firm – FTMO, MFF, and more approved ✅ Global Coverage – trades sent in New York, London, Tokyo &amp; Sydney sessions ✅ Proven 3:1 Risk-to-Reward Ratio – maximize wins while minimizing losses ✅ 3–4 High-Probability Forex Signals Daily – consistent opportunities every session ✅ Fundamental Analysis – know how news &amp; economic events move the markets ✅ Technical Analysis – chart breakdowns, market structure, and sniper entries ✅ High-Impact News Updates – stay ahead of NFP, CPI, FOMC &amp; other big moves ✅ Multi-Platform Delivery – receive every trade instantly via Discord, Telegram, Whop app &amp; email",
    "With Best Forex Pips VIP, you’ll get more than just signals—you’ll learn strategy, discipline, and professional risk management. Our mission is to help you win more trades, build confidence, and scale your trading account faster than ever.",
    "$99.00 / month Pay Join Features 4 to 5 Signals sent a day for us30, nas100, xauusd, USDJPY, Gbpjpy, gbpusd Live Trading Sessions Daily included with VIP access VIP trades are sent to discord, telegram, whop app, &amp; email 24 Hour Customer support, Help with risk management , Help passing prop firms Every trade includes stop loss, take profit, entry price and order type Reviews 4.72 out of 5 29 total reviews 5 stars 4 stars 3 stars 2 stars 1 star EA Edward Abbey 24 days ago Best ever",
    "2 months ago Amazing",
    "9 months ago Outstanding Results! Global Trader Empire VIP helped me pass The Funded Trader Phase 1 in just 5 days with their US30 and NAS100 trades. Now I’m funded with a $100K account! Their strategies are accurate and effective. Highly recommend for anyone serious about prop firm challenges!",
    "9 months ago Global Trade Empire VIP signals are unmatched! I grew my account from $100 to $1,300 in just one week. Their accuracy and consistency are top-notch. Hands down the best signal provider out there! Highly recommend!",
    "About the creator B View profile Brian @ bestforexpips • Joined Feb 2024 Discover Best Forex Pips: Your hub for forex signals, live trading sessions, market insights, and strategies designed to elevate your trading journey and maximize success. FAQs How many trades are sent a day? Risk to Reward Ratio What broker do the signals work with? When are the trades sent out? What assets do the signals cover? Affiliates BP Become an affiliate Best Forex Pips 1% reward Earn money by bringing customers to Best Forex Pips. Every time a customer purchases using your link, you&#x27;ll earn a commission."
  ],
  "priceTokens": [
    "$99.00",
    "$100",
    "$100",
    "$1,300",
    "$99.00",
    "$99.00",
    "$1",
    "$1",
    "$1",
    "$23",
    "$1",
    "$1",
    "$1",
    "$1",
    "$1",
    "$2",
    "$1",
    "$2",
    "$2",
    "$2"
  ],
  "faq": [],
  "textSample": "Best Forex Pips VIP Signals | Whop Sign in Unmute Unmute Unmute Unmute Unmute Unmute Unmute Unmute Unmute Unmute Unmute Unmute BP Best Forex Pips VIP Signals Real-Time Forex Signals: US30, NAS100, Gold + Daily Profits &amp; Trade Alerts 4.7 ( 29 ) Trading Join Best Forex Pips VIP Live Trade Alerts and gain access to the same high-probability setups professional traders use every day. Our signals are designed to give you confidence, precision, and consistent profits in the markets. Whether you’re trading Forex pairs, Gold, or indices like US30 and NAS100, our team provides step-by-step guidance so you never have to guess. ✅ Trades Called in Real-Time – US30, NAS100, XAUUSD &amp; Forex Pairs ✅ Exact Entry, Stop Loss &amp; Take Profit Levels – no confusion, just clarity ✅ Works With Any Broker or Prop Firm – FTMO, MFF, and more approved ✅ Global Coverage – trades sent in New York, London, Tokyo &amp; Sydney sessions ✅ Proven 3:1 Risk-to-Reward Ratio – maximize wins while minimizing losses ✅ 3–4 High-Probability Forex Signals Daily – consistent opportunities every session ✅ Fundamental Analysis – know how news &amp; economic events move the markets ✅ Technical Analysis – chart breakdowns, market structure, and sniper entries ✅ High-Impact News Updates – stay ahead of NFP, CPI, FOMC &amp; other big moves ✅ Multi-Platform Delivery – receive every trade instantly via Discord, Telegram, Whop app &amp; email With Best Forex Pips VIP, you’ll get more than just signals—you’ll learn strategy, discipline, and professional risk management. Our mission is to help you win more trades, build confidence, and scale your trading account faster than ever. $99.00 / month Pay Join Features 4 to 5 Signals sent a day for us30, nas100, xauusd, USDJPY, Gbpjpy, gbpusd Live Trading Sessions Daily included with VIP access VIP trades are sent to discord, telegram, whop app, &amp; email 24 Hour Customer support, Help with risk management , Help passing prop firms Every trade includes stop loss, take profit, entry price and order type Reviews 4.72 out of 5 29 total reviews 5 stars 4 stars 3 stars 2 stars 1 star EA Edward Abbey 24 days ago Best ever Written 1 year after purchase MM MILOUDI MEL 2 months ago Amazing Written 5 months after purchase J jeffforex 9 months ago Outstanding Results! Global Trader Empire VIP helped me pass The Funded Trader Phase 1 in just 5 days with their US30 and NAS100 trades. Now I’m funded with a $100K account! Their strategies are accurate and effective. Highly recommend for anyone serious about prop firm challenges! Written 3 days after purchase A annatrades 9 months ago Global Trade Empire VIP signals are unmatched! I grew my account from $100 to $1,300 in just one week. Their accuracy and consistency are top-notch. Hands down the best signal provider out there! Highly recommend! Written 3 days after purchase See all reviews About the creator B View profile Brian @ bestforexpips • Joined Feb 2024 Discover Best Forex Pips: Your hub for forex signals, live trading sessions, market insights, and strategies designed to elevate your trading journey and maximize success. FAQs How many trades are sent a day? Risk to Reward Ratio What broker do the signals work with? When are the trades sent out? What assets do the signals cover? Affiliates BP Become an affiliate Best Forex Pips 1% reward Earn money by bringing customers to Best Forex Pips. Every time a customer purchases using your link, you&#x27;ll earn a commission. Best Forex Pips VIP Signals $99.00 / month +3 options Join $99.00 / month 3 options Pay Join Pay Join",
  "finalUrl": "https://whop.com/best-forex-pips-vip/global-trade-empire-vip-forex-signals/",
  "fetchedAt": "2025-11-05T09:17:35.065Z",
  "textHash": "fca41e954db232a87a74cfd50d19be78de692990a8a732e9e7f1022f30c37169",
  "drilled": false
}