{
  "baseUrl": "https://whop.com/gold-signals-xauuse/?a=alexburnett21",
  "title": "FxPremiere.com | Whop",
  "h1": "FxPremiere.com",
  "bullets": [
    "Powered by F FxPremiere.com Daily Telegram Signals by FxPremiere 3.7 ( 7 ) Contact seller Products Unmute $49.00 / month Daily Forex Signals for Busy Swing Traders Seeking Steady Gains Global FX Signals Hub 5.0 ( 1 ) Free Daily Telegram Signals from FxPremiere FREE TRIAL Telegram 4.5 ( 2 ) $27.00 Learn to Master Forex in 14 days! Forex Trading A - Z PDF Guide 5.0 ( 1 ) $199.00 / month XAUUSD Signals: Precision Trades GOLD Signals XAUUSD VIP New $399.00 / month Telegram MEME Signals from FxPremiere FxPremiere MEME Coin Signals New $49.00 / month Daily Crypto Signals via Telegram Crypto Signals New $1,800.00 5 Year Access - FX + Crypto + Gold + Indices Ultimate Package 1.0 ( 1 ) SPECIAL OFFER 15% OFF USE COUPON CODE - salenow15% FX SIGNALS VIP 5.0 ( 1 ) FxPremiere.com - Telegram VIP GOLD XAUUSD SIGNALS GOLD XAUUSD VIP New Contact seller Reviews SC Sarah Caldon • FREE TRIAL Telegram 10 months ago Absolutely Amazing - I can see over 1000 Articles on how to trade and its blown my mind on how good the content is. thankyou fxpremiere Written 4 days after purchase",
    "SC Sarah Caldon • Forex Trading A - Z PDF Guide 10 months ago Absolutely Amazing - I can see over 1000 Articles on how to trade and its blown my mind on how good the content is. thankyou fxpremiere Written 4 days after purchase",
    "SC Sarah Caldon • Global FX Signals Hub 1 year ago Absolutely great signals and a professional team good to see after 10 years they are now on whop Written 5 days after purchase",
    "BF Baptiste Ferry • FX SIGNALS VIP 11 days ago Written 16 days after purchase"
  ],
  "paras": [
    "F FxPremiere.com Daily Telegram Signals by FxPremiere 3.7 ( 7 ) Contact seller Products Unmute $49.00 / month Daily Forex Signals for Busy Swing Traders Seeking Steady Gains Global FX Signals Hub 5.0 ( 1 ) Free Daily Telegram Signals from FxPremiere FREE TRIAL Telegram 4.5 ( 2 ) $27.00 Learn to Master Forex in 14 days! Forex Trading A - Z PDF Guide 5.0 ( 1 ) $199.00 / month XAUUSD Signals: Precision Trades GOLD Signals XAUUSD VIP New $399.00 / month Telegram MEME Signals from FxPremiere FxPremiere MEME Coin Signals New $49.00 / month Daily Crypto Signals via Telegram Crypto Signals New $1,800.00 5 Year Access - FX + Crypto + Gold + Indices Ultimate Package 1.0 ( 1 ) SPECIAL OFFER 15% OFF USE COUPON CODE - salenow15% FX SIGNALS VIP 5.0 ( 1 ) FxPremiere.com - Telegram VIP GOLD XAUUSD SIGNALS GOLD XAUUSD VIP New Contact seller Reviews SC Sarah Caldon • FREE TRIAL Telegram 10 months ago Absolutely Amazing - I can see over 1000 Articles on how to trade and its blown my mind on how good the content is. thankyou fxpremiere",
    "10 months ago Absolutely Amazing - I can see over 1000 Articles on how to trade and its blown my mind on how good the content is. thankyou fxpremiere",
    "1 year ago Absolutely great signals and a professional team good to see after 10 years they are now on whop",
    "11 days ago"
  ],
  "priceTokens": [
    "$49.00",
    "$27.00",
    "$199.00",
    "$399.00",
    "$49.00",
    "$1,800.00",
    "$1",
    "$1",
    "$1",
    "$21",
    "$1",
    "$1",
    "$1",
    "$1",
    "$28",
    "$1",
    "$28",
    "$28",
    "$28",
    "$28"
  ],
  "faq": [],
  "textSample": "Powered by F FxPremiere.com Daily Telegram Signals by FxPremiere 3.7 ( 7 ) Contact seller Products Unmute $49.00 / month Daily Forex Signals for Busy Swing Traders Seeking Steady Gains Global FX Signals Hub 5.0 ( 1 ) Free Daily Telegram Signals from FxPremiere FREE TRIAL Telegram 4.5 ( 2 ) $27.00 Learn to Master Forex in 14 days! Forex Trading A - Z PDF Guide 5.0 ( 1 ) $199.00 / month XAUUSD Signals: Precision Trades GOLD Signals XAUUSD VIP New $399.00 / month Telegram MEME Signals from FxPremiere FxPremiere MEME Coin Signals New $49.00 / month Daily Crypto Signals via Telegram Crypto Signals New $1,800.00 5 Year Access - FX + Crypto + Gold + Indices Ultimate Package 1.0 ( 1 ) SPECIAL OFFER 15% OFF USE COUPON CODE - salenow15% FX SIGNALS VIP 5.0 ( 1 ) FxPremiere.com - Telegram VIP GOLD XAUUSD SIGNALS GOLD XAUUSD VIP New Contact seller Reviews SC Sarah Caldon • FREE TRIAL Telegram 10 months ago Absolutely Amazing - I can see over 1000 Articles on how to trade and its blown my mind on how good the content is. thankyou fxpremiere Written 4 days after purchase SC Sarah Caldon • Forex Trading A - Z PDF Guide 10 months ago Absolutely Amazing - I can see over 1000 Articles on how to trade and its blown my mind on how good the content is. thankyou fxpremiere Written 4 days after purchase SC Sarah Caldon • Global FX Signals Hub 1 year ago Absolutely great signals and a professional team good to see after 10 years they are now on whop Written 5 days after purchase BF Baptiste Ferry • FX SIGNALS VIP 11 days ago Written 16 days after purchase See all reviews FxPremiere.com | Whop",
  "finalUrl": "https://whop.com/gold-signals-xauuse/?a=alexburnett21",
  "fetchedAt": "2025-11-05T09:55:21.371Z",
  "textHash": "857b75a320f24c080ecb1d460e53e21b52254cef41132d6f30f11b5b7512c8ed",
  "drilled": false
}