{
  "baseUrl": "https://whop.com/greenys-calls/gtg-vip/",
  "title": "GTG VIP | Whop",
  "h1": "GTG VIP",
  "bullets": [
    "Sign in GG GTG VIP 1-on-1 Mentorship. Real growth. Real results. 4.9 ( 72 ) Trading GTG VIP gives traders direct access to Greeny for personalized mentorship, deep-dive sessions and tailored strategy reviews. It’s a hands-on experience focused on refining your process, improving decision-making and developing the mindset needed to trade at a higher level. If you’re ready for focused guidance and real growth: GTG VIP is for you. $500.00 / month 1 left Pay Get access Join 7 members Features Weekly 1-on-1 Mentorship Calls: personalized sessions directly with Greeny.",
    "Advanced Market Breakdown &amp; Strategy Refinement: learn to see what others miss.",
    "Private VIP Chat: Connect with GTG’s top traders and mentors.",
    "Premium Benefits Included: full access to all GTG Premium content and features.",
    "NM Noni McCallum 1 month ago Really enjoying GTG! Great transparency, no hyperbole. Glad to be on board! Written 1 month after purchase",
    "Z Zeta 3 months ago I joined Greeny’s group recently and was immediately struck by the authenticity and transparency here. Unlike so many other trading communities, this one isn’t built around hype or farming followers—it’s built around real people helping each other grow. Greeny leads with integrity, consistency, and ... Show more Written 5 days after purchase",
    "LA Los App 3 months ago This is the only trading group that is needed for Crypto if you want to turn profits. Greeny is down to earth, more than the alpha calls he keeps his group motivated and grounded to not overtrade and keep cashing in the profits. Entries and exits are provided perfectly. If the calls are followed rel... Show more Written 1 year after purchase",
    "M martin_flp. 3 months ago Yep, true value for money. Joined a few weeks now, just a bunch of good people sharing quality information. No promises no BS, just quality TA and good support. Written 8 days after purchase"
  ],
  "paras": [
    "Sign in GG GTG VIP 1-on-1 Mentorship. Real growth. Real results. 4.9 ( 72 ) Trading GTG VIP gives traders direct access to Greeny for personalized mentorship, deep-dive sessions and tailored strategy reviews.",
    "It’s a hands-on experience focused on refining your process, improving decision-making and developing the mindset needed to trade at a higher level.",
    "If you’re ready for focused guidance and real growth: GTG VIP is for you.",
    "$500.00 / month 1 left Pay Get access Join 7 members Features Weekly 1-on-1 Mentorship Calls: personalized sessions directly with Greeny. Advanced Market Breakdown &amp; Strategy Refinement: learn to see what others miss. Private VIP Chat: Connect with GTG’s top traders and mentors. Premium Benefits Included: full access to all GTG Premium content and features. Reviews 4.94 out of 5 72 total reviews 5 stars 4 stars 3 stars 2 stars 1 star NM Noni McCallum 1 month ago Really enjoying GTG! Great transparency, no hyperbole. Glad to be on board!",
    "3 months ago I joined Greeny’s group recently and was immediately struck by the authenticity and transparency here. Unlike so many other trading communities, this one isn’t built around hype or farming followers—it’s built around real people helping each other grow. Greeny leads with integrity, consistency, and ...",
    "Written 5 days after purchase LA Los App 3 months ago This is the only trading group that is needed for Crypto if you want to turn profits. Greeny is down to earth, more than the alpha calls he keeps his group motivated and grounded to not overtrade and keep cashing in the profits. Entries and exits are provided perfectly. If the calls are followed rel...",
    "Written 1 year after purchase M martin_flp. 3 months ago Yep, true value for money. Joined a few weeks now, just a bunch of good people sharing quality information. No promises no BS, just quality TA and good support.",
    "About the creator G View profile Greeny @ greenytrades • Joined Jan 2024 The home for serious players in crypto. Since 2023, GTG has brought together traders, investors and builders who want to understand markets on a deeper level and move with conviction. We blend education, strategy and experience helping our members learn faster, think clearer and execute smarter across every market opportunity. Join GTG and become part of a global community built to win together. FAQs What is GTG VIP? Who is GTG VIP for? How are mentorship calls structured? Does GTG VIP include GTG Premium? How do I join GTG VIP? Affiliates GG Become an affiliate GTG (Greeny&#x27;s Trading Group) 10% reward Earn money by bringing customers to GTG (Greeny&#x27;s Trading Group). Every time a customer purchases using your link, you&#x27;ll earn a commission."
  ],
  "priceTokens": [
    "$500.00",
    "$500.00",
    "$500.00",
    "$1",
    "$1",
    "$1",
    "$22",
    "$1",
    "$1",
    "$1",
    "$1",
    "$1",
    "$2",
    "$1",
    "$2",
    "$2",
    "$2",
    "$2",
    "$3",
    "$3"
  ],
  "faq": [],
  "textSample": "Sign in GG GTG VIP 1-on-1 Mentorship. Real growth. Real results. 4.9 ( 72 ) Trading GTG VIP gives traders direct access to Greeny for personalized mentorship, deep-dive sessions and tailored strategy reviews. It’s a hands-on experience focused on refining your process, improving decision-making and developing the mindset needed to trade at a higher level. If you’re ready for focused guidance and real growth: GTG VIP is for you. $500.00 / month 1 left Pay Get access Join 7 members Features Weekly 1-on-1 Mentorship Calls: personalized sessions directly with Greeny. Advanced Market Breakdown &amp; Strategy Refinement: learn to see what others miss. Private VIP Chat: Connect with GTG’s top traders and mentors. Premium Benefits Included: full access to all GTG Premium content and features. Reviews 4.94 out of 5 72 total reviews 5 stars 4 stars 3 stars 2 stars 1 star NM Noni McCallum 1 month ago Really enjoying GTG! Great transparency, no hyperbole. Glad to be on board! Written 1 month after purchase Z Zeta 3 months ago I joined Greeny’s group recently and was immediately struck by the authenticity and transparency here. Unlike so many other trading communities, this one isn’t built around hype or farming followers—it’s built around real people helping each other grow. Greeny leads with integrity, consistency, and ... Show more Written 5 days after purchase LA Los App 3 months ago This is the only trading group that is needed for Crypto if you want to turn profits. Greeny is down to earth, more than the alpha calls he keeps his group motivated and grounded to not overtrade and keep cashing in the profits. Entries and exits are provided perfectly. If the calls are followed rel... Show more Written 1 year after purchase M martin_flp. 3 months ago Yep, true value for money. Joined a few weeks now, just a bunch of good people sharing quality information. No promises no BS, just quality TA and good support. Written 8 days after purchase See all reviews About the creator G View profile Greeny @ greenytrades • Joined Jan 2024 The home for serious players in crypto. Since 2023, GTG has brought together traders, investors and builders who want to understand markets on a deeper level and move with conviction. We blend education, strategy and experience helping our members learn faster, think clearer and execute smarter across every market opportunity. Join GTG and become part of a global community built to win together. FAQs What is GTG VIP? Who is GTG VIP for? How are mentorship calls structured? Does GTG VIP include GTG Premium? How do I join GTG VIP? Affiliates GG Become an affiliate GTG (Greeny&#x27;s Trading Group) 10% reward Earn money by bringing customers to GTG (Greeny&#x27;s Trading Group). Every time a customer purchases using your link, you&#x27;ll earn a commission. GTG VIP $500.00 / month +2 options Get access $500.00 / month 2 options Pay Get access Pay Get access GTG VIP | Whop",
  "finalUrl": "https://whop.com/greenys-calls/gtg-vip/",
  "fetchedAt": "2025-11-05T10:34:20.537Z",
  "textHash": "6f6816b991b837900902021071794d17779559ce54183e0827753eb474ba9135",
  "drilled": false
}