{
  "baseUrl": "https://whop.com/guaranteed-sweep/?a=alexburnett21",
  "title": "Hammer Investments | Sports Betting | Whop",
  "h1": "Hammer Investments | Sports Betting",
  "bullets": [
    "Hammer Investments | Sports Betting | Whop Powered by HB Hammer Investments | Sports Betting As the creator of Hammer Investments, I&#x27;ve dedicated my career to providing unparalleled sports betting advice. With a 90% win-rate parlay and 100% transparency, I aim to ensure your investment sees s... More 4.9 ( 454 ) Contact seller Products $170.00 / month Join Our Elite Sports Consulting Discord Hammer Investments | Monthly 4.5 ( 17 ) $35.00 / week 94% Verified Win Rate â€“ Guaranteed Results or Refund Hammer Investments | Guarantee 4.6 ( 9 ) $300.00 10x Your Bankroll with Confidence Bankroll Builder 3.5 ( 2 ) Free FREE PLAYS!ðŸ”¥ 36-6 WIN STREAK! Hammer Investments Free Access 5.0 ( 353 ) $29.99 / week Free trial #1 SPORTS BETTOR | 79% WINRATE | 100% TRANSPARENCY Hammer Investments | Weekly 3.4 ( 5 ) Contact seller Reviews KJ Kylie Johnston â€¢ Hammer Investments | Weekly 1 month ago first month made around 2k. the staff worked with me 1 on 1 and i scaled all the way to 7.2k profit this month. best group by far that ive been in. love u AZ. The best Written 7 months after purchase",
    "MO Mike Oscardas â€¢ Hammer Investments | Weekly 1 month ago I've heard alot about this group. I've chilled in the discord and ATE off free picks. I've been apart of the VIP for 4 months and this dude fr the fucking goat. I won't change cappers ever. Written 7 months after purchase",
    "DM David Miller â€¢ Hammer Investments Free Access 8 months ago excited for mlb again. hes the mlb best! Written 7 months after purchase",
    "NM Nikolai Morozov â€¢ Hammer Investments Free Access 8 months ago Amazing Platform Automation Written 3m after purchase"
  ],
  "paras": [
    "HB Hammer Investments | Sports Betting As the creator of Hammer Investments, I&#x27;ve dedicated my career to providing unparalleled sports betting advice. With a 90% win-rate parlay and 100% transparency, I aim to ensure your investment sees s... More 4.9 ( 454 ) Contact seller Products $170.00 / month Join Our Elite Sports Consulting Discord Hammer Investments | Monthly 4.5 ( 17 ) $35.00 / week 94% Verified Win Rate â€“ Guaranteed Results or Refund Hammer Investments | Guarantee 4.6 ( 9 ) $300.00 10x Your Bankroll with Confidence Bankroll Builder 3.5 ( 2 ) Free FREE PLAYS!ðŸ”¥ 36-6 WIN STREAK! Hammer Investments Free Access 5.0 ( 353 ) $29.99 / week Free trial #1 SPORTS BETTOR | 79% WINRATE | 100% TRANSPARENCY Hammer Investments | Weekly 3.4 ( 5 ) Contact seller Reviews KJ Kylie Johnston â€¢ Hammer Investments | Weekly 1 month ago first month made around 2k. the staff worked with me 1 on 1 and i scaled all the way to 7.2k profit this month. best group by far that ive been in. love u AZ. The best",
    "1 month ago I've heard alot about this group. I've chilled in the discord and ATE off free picks. I've been apart of the VIP for 4 months and this dude fr the fucking goat. I won't change cappers ever.",
    "8 months ago excited for mlb again. hes the mlb best!",
    "8 months ago Amazing Platform Automation"
  ],
  "priceTokens": [
    "$170.00",
    "$35.00",
    "$300.00",
    "$29.99",
    "$1",
    "$1",
    "$1",
    "$21",
    "$1",
    "$1",
    "$1",
    "$1",
    "$28",
    "$1",
    "$28",
    "$28",
    "$28",
    "$28",
    "$3",
    "$3"
  ],
  "faq": [],
  "textSample": "Hammer Investments | Sports Betting | Whop Powered by HB Hammer Investments | Sports Betting As the creator of Hammer Investments, I&#x27;ve dedicated my career to providing unparalleled sports betting advice. With a 90% win-rate parlay and 100% transparency, I aim to ensure your investment sees s... More 4.9 ( 454 ) Contact seller Products $170.00 / month Join Our Elite Sports Consulting Discord Hammer Investments | Monthly 4.5 ( 17 ) $35.00 / week 94% Verified Win Rate â€“ Guaranteed Results or Refund Hammer Investments | Guarantee 4.6 ( 9 ) $300.00 10x Your Bankroll with Confidence Bankroll Builder 3.5 ( 2 ) Free FREE PLAYS!ðŸ”¥ 36-6 WIN STREAK! Hammer Investments Free Access 5.0 ( 353 ) $29.99 / week Free trial #1 SPORTS BETTOR | 79% WINRATE | 100% TRANSPARENCY Hammer Investments | Weekly 3.4 ( 5 ) Contact seller Reviews KJ Kylie Johnston â€¢ Hammer Investments | Weekly 1 month ago first month made around 2k. the staff worked with me 1 on 1 and i scaled all the way to 7.2k profit this month. best group by far that ive been in. love u AZ. The best Written 7 months after purchase MO Mike Oscardas â€¢ Hammer Investments | Weekly 1 month ago I've heard alot about this group. I've chilled in the discord and ATE off free picks. I've been apart of the VIP for 4 months and this dude fr the fucking goat. I won't change cappers ever. Written 7 months after purchase DM David Miller â€¢ Hammer Investments Free Access 8 months ago excited for mlb again. hes the mlb best! Written 7 months after purchase NM Nikolai Morozov â€¢ Hammer Investments Free Access 8 months ago Amazing Platform Automation Written 3m after purchase See all reviews",
  "finalUrl": "https://whop.com/guaranteed-sweep/?a=alexburnett21",
  "fetchedAt": "2025-11-05T10:32:00.869Z",
  "textHash": "c26c877f9a11decc3b9416da37e1f17970f290d897d67da5ea7c0dfe7e1ac264",
  "drilled": false
}