{
  "baseUrl": "https://whop.com/immoelite/immo-elite-investor/",
  "title": "Immo Elite | Whop",
  "h1": "Immo Elite",
  "bullets": [
    "Sign in IC Immo Elite Dein Schlüssel zum Immobilienerfolg 5.0 ( 11 ) Real estate Dieses Netzwerk bietet dir Zugang zu einzigartigen Strategien, Insiderwissen und einem Netzwerk von über 2.000 Mitgliedern, darunter bekannte Immobilienexperten. €149.00 one-time purchase Pay Get access Reviews 5 out of 5 11 total reviews 5 stars 4 stars 3 stars 2 stars 1 star L Leo 19 days ago Würde 10 Sterne geben wenn es möglich wäre also wirklich top Written 2 days after purchase",
    "J Jannik 8 months ago 1k Umsatz geknackt, kann den Immo Elite Blueprint weiterempfehlen Written 12 days after purchase",
    "L Luca 8 months ago Kann das Netzwerk weiterempfehlen Written 4 days after purchase",
    "P Phillipp 9 months ago Mir wurden meine Fragen genau erklärt und ich habe persönliche Hilfe von Luis bekommen Written 1 hour after purchase"
  ],
  "paras": [
    "Sign in IC Immo Elite Dein Schlüssel zum Immobilienerfolg 5.0 ( 11 ) Real estate Dieses Netzwerk bietet dir Zugang zu einzigartigen Strategien, Insiderwissen und einem Netzwerk von über 2.000 Mitgliedern, darunter bekannte Immobilienexperten.",
    "5 out of 5 11 total reviews 5 stars 4 stars 3 stars 2 stars 1 star L Leo 19 days ago Würde 10 Sterne geben wenn es möglich wäre also wirklich top",
    "8 months ago 1k Umsatz geknackt, kann den Immo Elite Blueprint weiterempfehlen",
    "8 months ago Kann das Netzwerk weiterempfehlen",
    "9 months ago Mir wurden meine Fragen genau erklärt und ich habe persönliche Hilfe von Luis bekommen",
    "About the creator L View profile Luis @ immoluis • Joined Oct 2024 Ich habe meine Karriere in der Immobilienbranche verbracht, von den ersten Schritten als Investor bis hin zur Gründung dieser exklusiven Community. Mein Ziel ist es, anderen zu helfen, ihre Investitionsziele schneller und intelligenter zu erreichen. Affiliates IC Become an affiliate Immo Elite 1:1 Coaching 50% reward Earn money by bringing customers to Immo Elite 1:1 Coaching. Every time a customer purchases using your link, you&#x27;ll earn a commission."
  ],
  "priceTokens": [
    "€149.00",
    "€149.00",
    "€149.00",
    "$1",
    "$1",
    "$1",
    "$22",
    "$1",
    "$1",
    "$1",
    "$1",
    "$1",
    "$2",
    "$1",
    "$2",
    "$2",
    "$2",
    "$2",
    "$3",
    "$3"
  ],
  "faq": [],
  "textSample": "Sign in IC Immo Elite Dein Schlüssel zum Immobilienerfolg 5.0 ( 11 ) Real estate Dieses Netzwerk bietet dir Zugang zu einzigartigen Strategien, Insiderwissen und einem Netzwerk von über 2.000 Mitgliedern, darunter bekannte Immobilienexperten. €149.00 one-time purchase Pay Get access Reviews 5 out of 5 11 total reviews 5 stars 4 stars 3 stars 2 stars 1 star L Leo 19 days ago Würde 10 Sterne geben wenn es möglich wäre also wirklich top Written 2 days after purchase J Jannik 8 months ago 1k Umsatz geknackt, kann den Immo Elite Blueprint weiterempfehlen Written 12 days after purchase L Luca 8 months ago Kann das Netzwerk weiterempfehlen Written 4 days after purchase P Phillipp 9 months ago Mir wurden meine Fragen genau erklärt und ich habe persönliche Hilfe von Luis bekommen Written 1 hour after purchase See all reviews About the creator L View profile Luis @ immoluis • Joined Oct 2024 Ich habe meine Karriere in der Immobilienbranche verbracht, von den ersten Schritten als Investor bis hin zur Gründung dieser exklusiven Community. Mein Ziel ist es, anderen zu helfen, ihre Investitionsziele schneller und intelligenter zu erreichen. Affiliates IC Become an affiliate Immo Elite 1:1 Coaching 50% reward Earn money by bringing customers to Immo Elite 1:1 Coaching. Every time a customer purchases using your link, you&#x27;ll earn a commission. Immo Elite €149.00 one-time purchase Get access €149.00 one-time purchase Pay Get access Pay Get access Immo Elite | Whop",
  "finalUrl": "https://whop.com/immoelite/immo-elite-investor/",
  "fetchedAt": "2025-11-04T21:42:03.329Z",
  "textHash": "c7274115ee860b700487870236db4528a84d78c7afcf819b8144afbadde1c1a0",
  "drilled": false
}