{
  "baseUrl": "https://whop.com/infra-trade/infra-trade1/",
  "title": "INFRA TRADE TELEGRAM ALERTS | Whop",
  "h1": "INFRA TRADE TELEGRAM ALERTS",
  "bullets": [
    "Sign in IO INFRA TRADE TELEGRAM ALERTS Signal for entry/exist alerts 5.0 ( 72 ) Trading Join Infra telegram for real-time alerts, insights, and a supportive trader community! $59.99 / month Pay Join Join 18 members Features Entry/Exit Alerts",
    "telegram access",
    "AB Albert B 4 days ago Best educator and trader Written 9 months after purchase",
    "C Chris 4 days ago Well worth it. So much knowledge, experience, and profitable approaches shared. Written 8 months after purchase",
    "AM Aditya Mukherjee 20 days ago One of the real groups that dont hide losses. Excellent group for ES futures & SPX 0DTs Written 7 months after purchase",
    "TZ tedik zabangar 23 days ago Best group ever Written 2 months after purchase"
  ],
  "paras": [
    "Sign in IO INFRA TRADE TELEGRAM ALERTS Signal for entry/exist alerts 5.0 ( 72 ) Trading Join Infra telegram for real-time alerts, insights, and a supportive trader community!",
    "Join 18 members Features Entry/Exit Alerts telegram access Reviews 5 out of 5 72 total reviews 5 stars 4 stars 3 stars 2 stars 1 star AB Albert B 4 days ago Best educator and trader",
    "4 days ago Well worth it. So much knowledge, experience, and profitable approaches shared.",
    "20 days ago One of the real groups that dont hide losses. Excellent group for ES futures & SPX 0DTs",
    "23 days ago Best group ever",
    "About the creator IO View profile Infra Trade Options @ singhvinod • Joined Nov 2023 Infra Trade is a rapidly expanding community of Index and Futures Traders, dedicated to empowering traders and investors with timely and actionable trading insights. Our mission is to assist you in making well-informed decisions in the dynamic realm of trading, utilizing our team&#x27;s extensive expertise and state-of-the-art technology. FAQs How do I receive trade alerts? Is there support for beginners? Do you offer real-time trading alerts? Affiliates IO Become an affiliate Infra Trade Options 30% reward Earn money by bringing customers to Infra Trade Options. Every time a customer purchases using your link, you&#x27;ll earn a commission."
  ],
  "priceTokens": [
    "$59.99",
    "$59.99",
    "$59.99",
    "$1",
    "$1",
    "$1",
    "$22",
    "$1",
    "$1",
    "$1",
    "$1",
    "$1",
    "$2",
    "$1",
    "$2",
    "$2",
    "$2",
    "$2",
    "$3",
    "$3"
  ],
  "faq": [],
  "textSample": "Sign in IO INFRA TRADE TELEGRAM ALERTS Signal for entry/exist alerts 5.0 ( 72 ) Trading Join Infra telegram for real-time alerts, insights, and a supportive trader community! $59.99 / month Pay Join Join 18 members Features Entry/Exit Alerts telegram access Reviews 5 out of 5 72 total reviews 5 stars 4 stars 3 stars 2 stars 1 star AB Albert B 4 days ago Best educator and trader Written 9 months after purchase C Chris 4 days ago Well worth it. So much knowledge, experience, and profitable approaches shared. Written 8 months after purchase AM Aditya Mukherjee 20 days ago One of the real groups that dont hide losses. Excellent group for ES futures & SPX 0DTs Written 7 months after purchase TZ tedik zabangar 23 days ago Best group ever Written 2 months after purchase See all reviews About the creator IO View profile Infra Trade Options @ singhvinod • Joined Nov 2023 Infra Trade is a rapidly expanding community of Index and Futures Traders, dedicated to empowering traders and investors with timely and actionable trading insights. Our mission is to assist you in making well-informed decisions in the dynamic realm of trading, utilizing our team&#x27;s extensive expertise and state-of-the-art technology. FAQs How do I receive trade alerts? Is there support for beginners? Do you offer real-time trading alerts? Affiliates IO Become an affiliate Infra Trade Options 30% reward Earn money by bringing customers to Infra Trade Options. Every time a customer purchases using your link, you&#x27;ll earn a commission. INFRA TRADE TELEGRAM ALERTS $59.99 / month Join $59.99 / month Pay Join Pay Join INFRA TRADE TELEGRAM ALERTS | Whop",
  "finalUrl": "https://whop.com/infra-trade/infra-trade1/",
  "fetchedAt": "2025-11-04T20:11:06.105Z",
  "textHash": "149f281b48eac0616f45d45a3f7806344ec53a239ddd35b2795529888d928f28",
  "drilled": false
}