{
  "baseUrl": "https://whop.com/internetmoneytrading-mt5/internet-money-trading-2/",
  "title": "Internet Money Trading | Whop",
  "h1": "Internet Money Trading",
  "bullets": [
    "Internet Money Trading | Whop Sign in IT Internet Money Trading Boost Your Profits with a Powerful Trading Indicator. 5.0 ( 3 ) Other Optimize trading with a fully automated indicator designed for Forex, indices, and commodities, plus 12-hour support, indicators, and weekly training sessions. $89.00 / month Pay Join Join 1 member Features 100% Fully Automated Trading",
    "Weekly Zoom Class Sessions",
    "Access to a supportive Telegram Group",
    "12-hour dedicated support team",
    "Includes 3 FREE trading indicators",
    "MM Mary Jane Morales 1 year ago This is such a Powerful Robot, i have not seen anything like this and you won't regret getting this amazing Robot! Written 18 days after purchase",
    "MM Manyane Motjoka 1 year ago the most beautiful robot in the world Written 1 month after purchase",
    "FN Falakhe Ngoza 1 year ago I am writing to express my sincere gratitude and appreciation for the exceptional trading robot you have developed. It has been an invaluable tool in our trading journey, consistently delivering impressive results and making our trading experience much more efficient and successful. Your commitment... Show more Written 7 days after purchase"
  ],
  "paras": [
    "Sign in IT Internet Money Trading Boost Your Profits with a Powerful Trading Indicator. 5.0 ( 3 ) Other Optimize trading with a fully automated indicator designed for Forex, indices, and commodities, plus 12-hour support, indicators, and weekly training sessions.",
    "Join 1 member Features 100% Fully Automated Trading Weekly Zoom Class Sessions Access to a supportive Telegram Group 12-hour dedicated support team Includes 3 FREE trading indicators Reviews 5 out of 5 3 total reviews 5 stars 4 stars 3 stars 2 stars 1 star MM Mary Jane Morales 1 year ago This is such a Powerful Robot, i have not seen anything like this and you won't regret getting this amazing Robot!",
    "1 year ago the most beautiful robot in the world",
    "1 year ago I am writing to express my sincere gratitude and appreciation for the exceptional trading robot you have developed. It has been an invaluable tool in our trading journey, consistently delivering impressive results and making our trading experience much more efficient and successful. Your commitment...",
    "Written 7 days after purchase About the creator IT View profile Internet Money Trading @ internetmoneyea • Joined Jun 2024 We are a qualified group of traders with experience over 8 years of trading and profitability. We decided to share our strategy with the world to help the beginner trader. FAQs Can I install it on my mobile phone? Can I use any broker? Affiliates IT Become an affiliate Internet Money Trading 30% reward Earn money by bringing customers to Internet Money Trading. Every time a customer purchases using your link, you&#x27;ll earn a commission."
  ],
  "priceTokens": [
    "$89.00",
    "$89.00",
    "$89.00",
    "$1",
    "$1",
    "$1",
    "$23",
    "$1",
    "$1",
    "$1",
    "$1",
    "$1",
    "$2",
    "$1",
    "$2",
    "$2",
    "$2",
    "$2",
    "$3",
    "$3"
  ],
  "faq": [],
  "textSample": "Internet Money Trading | Whop Sign in IT Internet Money Trading Boost Your Profits with a Powerful Trading Indicator. 5.0 ( 3 ) Other Optimize trading with a fully automated indicator designed for Forex, indices, and commodities, plus 12-hour support, indicators, and weekly training sessions. $89.00 / month Pay Join Join 1 member Features 100% Fully Automated Trading Weekly Zoom Class Sessions Access to a supportive Telegram Group 12-hour dedicated support team Includes 3 FREE trading indicators Reviews 5 out of 5 3 total reviews 5 stars 4 stars 3 stars 2 stars 1 star MM Mary Jane Morales 1 year ago This is such a Powerful Robot, i have not seen anything like this and you won't regret getting this amazing Robot! Written 18 days after purchase MM Manyane Motjoka 1 year ago the most beautiful robot in the world Written 1 month after purchase FN Falakhe Ngoza 1 year ago I am writing to express my sincere gratitude and appreciation for the exceptional trading robot you have developed. It has been an invaluable tool in our trading journey, consistently delivering impressive results and making our trading experience much more efficient and successful. Your commitment... Show more Written 7 days after purchase About the creator IT View profile Internet Money Trading @ internetmoneyea • Joined Jun 2024 We are a qualified group of traders with experience over 8 years of trading and profitability. We decided to share our strategy with the world to help the beginner trader. FAQs Can I install it on my mobile phone? Can I use any broker? Affiliates IT Become an affiliate Internet Money Trading 30% reward Earn money by bringing customers to Internet Money Trading. Every time a customer purchases using your link, you&#x27;ll earn a commission. Internet Money Trading $89.00 / month Join $89.00 / month Pay Join Pay Join",
  "finalUrl": "https://whop.com/internetmoneytrading-mt5/internet-money-trading-2/",
  "fetchedAt": "2025-11-04T21:44:58.554Z",
  "textHash": "68b4078c3a1b9e863efe0c43dd1747140494b800d3536443b3240f236f781ab9",
  "drilled": false
}