{
  "baseUrl": "https://whop.com/kennytradespremiumplan/kenny-trades-mentorship/?a=alexburnett21",
  "title": "Kenny Trades Mentorship | Whop",
  "h1": "Kenny Trades Mentorship",
  "bullets": [
    "Sign in KT Kenny Trades Mentorship Live Stock Trades with Proven Accuracy Other Join live stock trading with Kenny Trades and follow high win rate setups in real-time. Learn, trade, and win together. $500.00 / 3 months Pay Join waitlist Features âœ… Get all the benefits of the premium plan",
    "ðŸŽ“ Access live mentorship for real-time guidance",
    "ðŸ§° Hands on 1 on 1 Mentorship tailored to each Trader"
  ],
  "paras": [
    "Sign in KT Kenny Trades Mentorship Live Stock Trades with Proven Accuracy Other Join live stock trading with Kenny Trades and follow high win rate setups in real-time. Learn, trade, and win together.",
    "âœ… Get all the benefits of the premium plan ðŸŽ“ Access live mentorship for real-time guidance ðŸ§° Hands on 1 on 1 Mentorship tailored to each Trader About the creator K View profile KennyTrades @ kennytradesoptions â€¢ Joined Jun 2024 I started trading with little experience, just a strong drive to learn and improve. Over time, through discipline and consistency, I developed a strategy that works. Now, I trade successfully with a high win rate and help others do the same through Kenny Trades. Whether you&#x27;re new or experienced, my goal is to help you trade smarter and more confidently. FAQs What is Kenny Trades? Who is this for? What is Kenny Trades? Can I cancel anytime? Affiliates KT Become an affiliate Kenny Trades 30% reward Earn money by bringing customers to Kenny Trades. Every time a customer purchases using your link, you&#x27;ll earn a commission."
  ],
  "priceTokens": [
    "$500.00",
    "$500.00",
    "$500.00",
    "$1",
    "$1",
    "$1",
    "$23",
    "$1",
    "$1",
    "$1",
    "$1",
    "$1",
    "$2",
    "$1",
    "$2",
    "$2",
    "$2",
    "$2",
    "$3",
    "$3"
  ],
  "faq": [],
  "textSample": "Sign in KT Kenny Trades Mentorship Live Stock Trades with Proven Accuracy Other Join live stock trading with Kenny Trades and follow high win rate setups in real-time. Learn, trade, and win together. $500.00 / 3 months Pay Join waitlist Features âœ… Get all the benefits of the premium plan ðŸŽ“ Access live mentorship for real-time guidance ðŸ§° Hands on 1 on 1 Mentorship tailored to each Trader About the creator K View profile KennyTrades @ kennytradesoptions â€¢ Joined Jun 2024 I started trading with little experience, just a strong drive to learn and improve. Over time, through discipline and consistency, I developed a strategy that works. Now, I trade successfully with a high win rate and help others do the same through Kenny Trades. Whether you&#x27;re new or experienced, my goal is to help you trade smarter and more confidently. FAQs What is Kenny Trades? Who is this for? What is Kenny Trades? Can I cancel anytime? Affiliates KT Become an affiliate Kenny Trades 30% reward Earn money by bringing customers to Kenny Trades. Every time a customer purchases using your link, you&#x27;ll earn a commission. Kenny Trades Mentorship $500.00 / 3 months Get access $500.00 / 3 months Pay Join waitlist Pay Join waitlist Kenny Trades Mentorship | Whop",
  "finalUrl": "https://whop.com/kennytradespremiumplan/kenny-trades-mentorship/?a=alexburnett21",
  "fetchedAt": "2025-11-05T10:10:27.839Z",
  "textHash": "9ffd7460144f26dcf593278b666a38f019b446f951398c33b376ec076960d7bf",
  "drilled": true
}