{
  "baseUrl": "https://whop.com/stockvip/lifetime-vip-7d-6674/",
  "title": "Lifetime VIP | Whop",
  "h1": "Lifetime VIP",
  "bullets": [
    "Sign in Unmute Unmute SV Lifetime VIP #1 Ranked Discord - 250,000+ Member Paid Trading Community 5.0 ( 111 ) Trading Become a Lifetime VIP in the largest online paid trading community on Discord. Access exclusive perks, updates, courses, and events. One-time Payment for Lifetime Access $899.00 one-time purchase Pay Join Features Lifetime Access to all perks of Prodigy and Prodigy+ Membership Tiers",
    "Lifetime Access to all new Updates, Revamps, Benefits, Events, &amp; More",
    "Lifetime Access to Stock VIP - One-Time Payment (No Monthly Fee)",
    "Exclusive Limited Mentorship with Stock VIP Staff",
    "Exclusive Lifetime VIP Cyan Username Color",
    "C CaseyG6 20 days ago Look the server stocks might not be a option one day but everyone is like a friend in the discordüòÇüíØ‚ÄºÔ∏è Written 3 months after purchase",
    "M MUj 8 months ago Very good server highly recommend anyone who wants to get started trading stocks James is very nice and willing to help his members Written 1 day after purchase",
    "U uso.koch 9 months ago Awesome people , every single person in this discord is striving to become successful. Very knowledgeable traders, and a well respected Owner. 10/10 highly recommended this service! Written 2h after purchase",
    "MW Mr John D Webster 1 year ago Great service! Written 19 days after purchase"
  ],
  "paras": [
    "Sign in Unmute Unmute SV Lifetime VIP #1 Ranked Discord - 250,000+ Member Paid Trading Community 5.0 ( 111 ) Trading Become a Lifetime VIP in the largest online paid trading community on Discord. Access exclusive perks, updates, courses, and events. One-time Payment for Lifetime Access",
    "Lifetime Access to all perks of Prodigy and Prodigy+ Membership Tiers Lifetime Access to all new Updates, Revamps, Benefits, Events, &amp; More Lifetime Access to Stock VIP - One-Time Payment (No Monthly Fee) Exclusive Limited Mentorship with Stock VIP Staff Exclusive Lifetime VIP Cyan Username Color Reviews 5 out of 5 111 total reviews 5 stars 4 stars 3 stars 2 stars 1 star C CaseyG6 20 days ago Look the server stocks might not be a option one day but everyone is like a friend in the discordüòÇüíØ‚ÄºÔ∏è",
    "8 months ago Very good server highly recommend anyone who wants to get started trading stocks James is very nice and willing to help his members",
    "9 months ago Awesome people , every single person in this discord is striving to become successful. Very knowledgeable traders, and a well respected Owner. 10/10 highly recommended this service!",
    "1 year ago Great service!",
    "About the creator SV View profile Stock VIP @ stockvipserver ‚Ä¢ Joined Aug 2023 At Stock VIP, we‚Äôve created one of the largest trading communities on Discord with over 250,000 members. Our mission is to empower traders with real-time alerts, expert education, and exclusive courses. Whether you&#x27;re a beginner or experienced, we provide the tools and support needed to master the markets. Join us and take your trading to the next level. FAQs What is Lifetime VIP? Who is Lifetime VIP for? What do I get with Lifetime VIP? Affiliates SV Become an affiliate Stock VIP 10% reward Earn money by bringing customers to Stock VIP. Every time a customer purchases using your link, you&#x27;ll earn a commission."
  ],
  "priceTokens": [
    "$899.00",
    "$899.00",
    "$899.00",
    "$1",
    "$1",
    "$1",
    "$22",
    "$1",
    "$1",
    "$1",
    "$1",
    "$1",
    "$2",
    "$1",
    "$2",
    "$2",
    "$2",
    "$2",
    "$3",
    "$3"
  ],
  "faq": [],
  "textSample": "Sign in Unmute Unmute SV Lifetime VIP #1 Ranked Discord - 250,000+ Member Paid Trading Community 5.0 ( 111 ) Trading Become a Lifetime VIP in the largest online paid trading community on Discord. Access exclusive perks, updates, courses, and events. One-time Payment for Lifetime Access $899.00 one-time purchase Pay Join Features Lifetime Access to all perks of Prodigy and Prodigy+ Membership Tiers Lifetime Access to all new Updates, Revamps, Benefits, Events, &amp; More Lifetime Access to Stock VIP - One-Time Payment (No Monthly Fee) Exclusive Limited Mentorship with Stock VIP Staff Exclusive Lifetime VIP Cyan Username Color Reviews 5 out of 5 111 total reviews 5 stars 4 stars 3 stars 2 stars 1 star C CaseyG6 20 days ago Look the server stocks might not be a option one day but everyone is like a friend in the discordüòÇüíØ‚ÄºÔ∏è Written 3 months after purchase M MUj 8 months ago Very good server highly recommend anyone who wants to get started trading stocks James is very nice and willing to help his members Written 1 day after purchase U uso.koch 9 months ago Awesome people , every single person in this discord is striving to become successful. Very knowledgeable traders, and a well respected Owner. 10/10 highly recommended this service! Written 2h after purchase MW Mr John D Webster 1 year ago Great service! Written 19 days after purchase See all reviews About the creator SV View profile Stock VIP @ stockvipserver ‚Ä¢ Joined Aug 2023 At Stock VIP, we‚Äôve created one of the largest trading communities on Discord with over 250,000 members. Our mission is to empower traders with real-time alerts, expert education, and exclusive courses. Whether you&#x27;re a beginner or experienced, we provide the tools and support needed to master the markets. Join us and take your trading to the next level. FAQs What is Lifetime VIP? Who is Lifetime VIP for? What do I get with Lifetime VIP? Affiliates SV Become an affiliate Stock VIP 10% reward Earn money by bringing customers to Stock VIP. Every time a customer purchases using your link, you&#x27;ll earn a commission. Lifetime VIP $899.00 one-time purchase Join $899.00 one-time purchase Pay Join Pay Join Lifetime VIP | Whop",
  "finalUrl": "https://whop.com/stockvip/lifetime-vip-7d-6674/",
  "fetchedAt": "2025-11-04T21:41:59.449Z",
  "textHash": "2c49fe316f5bdaf6d35eb351203b7167c72059bd6425e0e9d627e9701df8894b",
  "drilled": false
}