{
  "baseUrl": "https://whop.com/anon-exclusive-play/lotto-parlays-player-props/",
  "title": "Lotto Parlays &amp; Player Props | Whop",
  "h1": "Lotto Parlays &amp; Player Props",
  "bullets": [
    "Sign in AP Lotto Parlays &amp; Player Props Access high value player props &amp; lotto parlays driven by AI. 4.9 ( 404 ) Sports betting Using my revolutionary AI lotto parlays and player props system boasting over 1,500+ UNITS won in 2024. Powered by AI, this tool is hitting at a 81% win rate since being deployed. $9.99 / week Pay Join Join 15 members Features Parlay of the Day &amp; Lotto Player Props Posted Daily",
    "Parlays posted daily in real time in exclusive Telegram private channel.",
    "Get 1 on 1 access and support 24/7 to Anon and his team for anything you need.",
    "MS Matthew Skemer 15 days ago The goat Written 7 months after purchase",
    "E Erik (Eazy) 21 days ago Iâ€™m still new and I honestly can say yo legit I do my own thing as well wit picks and he has a nice thing going keep it up wishing u nothing but the best. ðŸ’¯Eazy410 Written 1 hour after purchase",
    "DL Dante Land 23 days ago Been here for over a year anon is like family and will consistently make you money Written 3 months after purchase",
    "BS Bryan Soske Sr 1 month ago Crushes plays daily! Written 3 months after purchase"
  ],
  "paras": [
    "Sign in AP Lotto Parlays &amp; Player Props Access high value player props &amp; lotto parlays driven by AI. 4.9 ( 404 ) Sports betting Using my revolutionary AI lotto parlays and player props system boasting over 1,500+ UNITS won in 2024. Powered by AI, this tool is hitting at a 81% win rate since being deployed.",
    "$9.99 / week Pay Join Join 15 members Features Parlay of the Day &amp; Lotto Player Props Posted Daily Parlays posted daily in real time in exclusive Telegram private channel. Get 1 on 1 access and support 24/7 to Anon and his team for anything you need. Reviews 4.89 out of 5 404 total reviews 5 stars 4 stars 3 stars 2 stars 1 star MS Matthew Skemer 15 days ago The goat",
    "21 days ago Iâ€™m still new and I honestly can say yo legit I do my own thing as well wit picks and he has a nice thing going keep it up wishing u nothing but the best. ðŸ’¯Eazy410",
    "23 days ago Been here for over a year anon is like family and will consistently make you money",
    "1 month ago Crushes plays daily!",
    "About the creator AC View profile Anon Sports Consulting @ anonsportsconsulting â€¢ Joined Oct 2024 Anon is one of the top sports bettors of this era, known for his record-breaking results. With over 12 years of experience, he now shares his betting system and analysis to help others profit. His expertise has generated consistent returns, and his goal is to help members beat the books and build successful betting careers. FAQs What is Anon&#x27;s sports betting record? How long has Anon been betting sports professionally? Where can I reach out for support? What sports do you offer? Why join Anon Sports Consulting? Affiliates AP Become an affiliate Anon Sports Picks 50% reward Earn money by bringing customers to Anon Sports Picks. Every time a customer purchases using your link, you&#x27;ll earn a commission."
  ],
  "priceTokens": [
    "$9.99",
    "$9.99",
    "$9.99",
    "$1",
    "$1",
    "$1",
    "$23",
    "$1",
    "$1",
    "$1",
    "$1",
    "$1",
    "$2",
    "$1",
    "$2",
    "$2",
    "$2",
    "$2",
    "$3",
    "$3"
  ],
  "faq": [],
  "textSample": "Sign in AP Lotto Parlays &amp; Player Props Access high value player props &amp; lotto parlays driven by AI. 4.9 ( 404 ) Sports betting Using my revolutionary AI lotto parlays and player props system boasting over 1,500+ UNITS won in 2024. Powered by AI, this tool is hitting at a 81% win rate since being deployed. $9.99 / week Pay Join Join 15 members Features Parlay of the Day &amp; Lotto Player Props Posted Daily Parlays posted daily in real time in exclusive Telegram private channel. Get 1 on 1 access and support 24/7 to Anon and his team for anything you need. Reviews 4.89 out of 5 404 total reviews 5 stars 4 stars 3 stars 2 stars 1 star MS Matthew Skemer 15 days ago The goat Written 7 months after purchase E Erik (Eazy) 21 days ago Iâ€™m still new and I honestly can say yo legit I do my own thing as well wit picks and he has a nice thing going keep it up wishing u nothing but the best. ðŸ’¯Eazy410 Written 1 hour after purchase DL Dante Land 23 days ago Been here for over a year anon is like family and will consistently make you money Written 3 months after purchase BS Bryan Soske Sr 1 month ago Crushes plays daily! Written 3 months after purchase See all reviews About the creator AC View profile Anon Sports Consulting @ anonsportsconsulting â€¢ Joined Oct 2024 Anon is one of the top sports bettors of this era, known for his record-breaking results. With over 12 years of experience, he now shares his betting system and analysis to help others profit. His expertise has generated consistent returns, and his goal is to help members beat the books and build successful betting careers. FAQs What is Anon&#x27;s sports betting record? How long has Anon been betting sports professionally? Where can I reach out for support? What sports do you offer? Why join Anon Sports Consulting? Affiliates AP Become an affiliate Anon Sports Picks 50% reward Earn money by bringing customers to Anon Sports Picks. Every time a customer purchases using your link, you&#x27;ll earn a commission. Lotto Parlays &amp; Player Props $9.99 / week +2 options Join $9.99 / week 2 options Pay Join Pay Join Lotto Parlays &amp; Player Props | Whop",
  "finalUrl": "https://whop.com/anon-exclusive-play/lotto-parlays-player-props/",
  "fetchedAt": "2025-11-04T20:11:10.521Z",
  "textHash": "74368483cd43a7b5095c9766546a743267f32176aef637e54027c9170a043ff5",
  "drilled": false
}