{
  "baseUrl": "https://whop.com/marketing-party-central/marketing-party-central/?a=alexburnett21",
  "title": "Marketing Party Central | Whop",
  "h1": "Marketing Party Central",
  "bullets": [
    "Sign in MC Marketing Party Central Market Smarter and Build Bigger 4.5 ( 4 ) Other Get everything you need to build better marketing campaigns, attract new customers, and grow your business without crippling debt and overwhelm—and have fun doing it. $97.00 / month Pay Join Join 19 members Features Access to a Private Podcast filled with even more mindset and tips.",
    "Access to members-only chats, voice channels, and group calls",
    "Supportive, inclusive community ready to help you succeed",
    "A fun place to geek out about the latest marketing trends and information",
    "Comprehensive Guides and Resources for Selling Your Brand",
    "KG Kristie Gonzales 7 hours ago Written 1 year after purchase",
    "SR Stacey Robinson 2 days ago Written 1 year after purchase",
    "TD Tonya Dieterlen 2 months ago Written 8 months after purchase",
    "CT Carol Tilbury 2 months ago Written 2 months after purchase"
  ],
  "paras": [
    "Sign in MC Marketing Party Central Market Smarter and Build Bigger 4.5 ( 4 ) Other Get everything you need to build better marketing campaigns, attract new customers, and grow your business without crippling debt and overwhelm—and have fun doing it.",
    "$97.00 / month Pay Join Join 19 members Features Access to a Private Podcast filled with even more mindset and tips. Access to members-only chats, voice channels, and group calls Supportive, inclusive community ready to help you succeed A fun place to geek out about the latest marketing trends and information Comprehensive Guides and Resources for Selling Your Brand Reviews 4.50 out of 5 4 total reviews 5 stars 4 stars 3 stars 2 stars 1 star KG Kristie Gonzales 7 hours ago",
    "2 days ago",
    "2 months ago",
    "2 months ago",
    "Affiliates MC Become an affiliate Marketing Party Central 30% reward Earn money by bringing customers to Marketing Party Central. Every time a customer purchases using your link, you&#x27;ll earn a commission."
  ],
  "priceTokens": [
    "$97.00",
    "$97.00",
    "$97.00",
    "$1",
    "$1",
    "$1",
    "$23",
    "$1",
    "$1",
    "$1",
    "$1",
    "$1",
    "$2",
    "$1",
    "$2",
    "$2",
    "$2",
    "$2",
    "$3",
    "$3"
  ],
  "faq": [],
  "textSample": "Sign in MC Marketing Party Central Market Smarter and Build Bigger 4.5 ( 4 ) Other Get everything you need to build better marketing campaigns, attract new customers, and grow your business without crippling debt and overwhelm—and have fun doing it. $97.00 / month Pay Join Join 19 members Features Access to a Private Podcast filled with even more mindset and tips. Access to members-only chats, voice channels, and group calls Supportive, inclusive community ready to help you succeed A fun place to geek out about the latest marketing trends and information Comprehensive Guides and Resources for Selling Your Brand Reviews 4.50 out of 5 4 total reviews 5 stars 4 stars 3 stars 2 stars 1 star KG Kristie Gonzales 7 hours ago Written 1 year after purchase SR Stacey Robinson 2 days ago Written 1 year after purchase TD Tonya Dieterlen 2 months ago Written 8 months after purchase CT Carol Tilbury 2 months ago Written 2 months after purchase About the creator NN View profile Naomi D Nakashima @ helpmenaomi • Joined Nov 2024 I&#x27;ve spent years mastering the art of omni-channel marketing, focusing on organic traffic strategies across multiple platforms, so I could help my clients build multi-million $$ brands online. Affiliates MC Become an affiliate Marketing Party Central 30% reward Earn money by bringing customers to Marketing Party Central. Every time a customer purchases using your link, you&#x27;ll earn a commission. Marketing Party Central $97.00 / month +2 options Join $97.00 / month 2 options Pay Join Pay Join Marketing Party Central | Whop",
  "finalUrl": "https://whop.com/marketing-party-central/marketing-party-central/?a=alexburnett21",
  "fetchedAt": "2025-11-04T21:55:53.690Z",
  "textHash": "bfec807bfc2d455d44659eb5fb8e671b957d6b730b098e5f6d0d470be36e9182",
  "drilled": true
}