{
  "baseUrl": "https://whop.com/market-fluidity-uni/market-fluidity-uni/?a=alexburnett21",
  "title": "Market Fluidity University | Whop",
  "h1": "Market Fluidity University",
  "bullets": [
    "Market Fluidity University | Whop Sign in Unmute Unmute Unmute Unmute Unmute Unmute Unmute Unmute MU Market Fluidity University Master Forex Trading, Earn Daily Income. 5.0 ( 203 ) Trading Join Market Fluidity University to master Forex trading concepts and generate income with live sessions, expert guidance, and resources for success in any market conditions. $138.00 / month Pay Join Features Weekly live streams with no lag via Zoom.",
    "Bi-monthly simulation sessions to master strategies.",
    "Monthly Q&amp;A sessions to resolve all trading queries.",
    "Access to an ever-growing video database.",
    "Vibrant Discord community of Forex enthusiasts.",
    "OO Octavian Oswald 9 days ago Best forex education out there! Written 1 month after purchase",
    "SA Saud AL-JUBAYRI 14 days ago thanks Written 3 months after purchase",
    "QA Qais Ali 1 month ago Great work RB Written 10 days after purchase",
    "M Mahesh 1 month ago excellent Written 6 months after purchase"
  ],
  "paras": [
    "Sign in Unmute Unmute Unmute Unmute Unmute Unmute Unmute Unmute MU Market Fluidity University Master Forex Trading, Earn Daily Income. 5.0 ( 203 ) Trading Join Market Fluidity University to master Forex trading concepts and generate income with live sessions, expert guidance, and resources for success in any market conditions.",
    "$138.00 / month Pay Join Features Weekly live streams with no lag via Zoom. Bi-monthly simulation sessions to master strategies. Monthly Q&amp;A sessions to resolve all trading queries. Access to an ever-growing video database. Vibrant Discord community of Forex enthusiasts. Reviews 4.97 out of 5 203 total reviews 5 stars 4 stars 3 stars 2 stars 1 star OO Octavian Oswald 9 days ago Best forex education out there!",
    "14 days ago thanks",
    "1 month ago Great work RB",
    "1 month ago excellent",
    "About the creator R View profile RajaB @ rajabanks • Joined Feb 2024 Market Fluidity was founded in 2017 as a means to teach traders the simple way to trade the markets. I&#x27;m Raja Banks, CEO of Market Fluidity. When I first started trading I realized how complicated currency trading was made to seem. Looking at the charts, I only saw candles. I realized that if we only see candles on the charts, then than means we just have to study candles, and nothing more. FAQs What is your refund policy ? How long will it take me to learn ? Affiliates MU Become an affiliate Market Fluidity University 15% reward Earn money by bringing customers to Market Fluidity University. Every time a customer purchases using your link, you&#x27;ll earn a commission."
  ],
  "priceTokens": [
    "$138.00",
    "$138.00",
    "$138.00",
    "$1",
    "$1",
    "$1",
    "$23",
    "$1",
    "$1",
    "$1",
    "$1",
    "$1",
    "$2",
    "$1",
    "$2",
    "$2",
    "$2",
    "$2",
    "$3",
    "$3"
  ],
  "faq": [],
  "textSample": "Market Fluidity University | Whop Sign in Unmute Unmute Unmute Unmute Unmute Unmute Unmute Unmute MU Market Fluidity University Master Forex Trading, Earn Daily Income. 5.0 ( 203 ) Trading Join Market Fluidity University to master Forex trading concepts and generate income with live sessions, expert guidance, and resources for success in any market conditions. $138.00 / month Pay Join Features Weekly live streams with no lag via Zoom. Bi-monthly simulation sessions to master strategies. Monthly Q&amp;A sessions to resolve all trading queries. Access to an ever-growing video database. Vibrant Discord community of Forex enthusiasts. Reviews 4.97 out of 5 203 total reviews 5 stars 4 stars 3 stars 2 stars 1 star OO Octavian Oswald 9 days ago Best forex education out there! Written 1 month after purchase SA Saud AL-JUBAYRI 14 days ago thanks Written 3 months after purchase QA Qais Ali 1 month ago Great work RB Written 10 days after purchase M Mahesh 1 month ago excellent Written 6 months after purchase See all reviews About the creator R View profile RajaB @ rajabanks • Joined Feb 2024 Market Fluidity was founded in 2017 as a means to teach traders the simple way to trade the markets. I&#x27;m Raja Banks, CEO of Market Fluidity. When I first started trading I realized how complicated currency trading was made to seem. Looking at the charts, I only saw candles. I realized that if we only see candles on the charts, then than means we just have to study candles, and nothing more. FAQs What is your refund policy ? How long will it take me to learn ? Affiliates MU Become an affiliate Market Fluidity University 15% reward Earn money by bringing customers to Market Fluidity University. Every time a customer purchases using your link, you&#x27;ll earn a commission. Market Fluidity University $138.00 / month +2 options Join $138.00 / month 2 options Pay Join Pay Join",
  "finalUrl": "https://whop.com/market-fluidity-uni/market-fluidity-uni/?a=alexburnett21",
  "fetchedAt": "2025-11-05T09:49:19.012Z",
  "textHash": "c52391c1ecfdb791daf5f1a593e629a6cf379d738f923c50830d8dec055ed4d1",
  "drilled": true
}