{
  "baseUrl": "https://whop.com/market-masters-discord/meme-coin-trading-copy/",
  "title": "Market Masters Trading | Whop",
  "h1": "Market Masters Trading",
  "bullets": [
    "Sign in Unmute Unmute MT Market Masters Trading Live trades. Real results. Zero fluff. All-in learning 5.0 ( 24 ) Trading Join our elite trading group and get daily live sessions, real-time plays, and the tools you need to finally trade profitably. $200.00 / month Pay Join Join 4 members Features ✅ Learn faster than any course with real-time live trading sessions, 5x a week.",
    "✅Unlock the secrets of price action with our Risk to Riches Mentorship on demand",
    "✅ Ultimate beginner&#x27;s guide to kickstart your trading with winning strategies",
    "✅ Built different: Community of proven, profitable traders (not full of newbies)",
    "✅ Exclusive tools &amp; resources—PDFs, playbooks, trade breakdowns, and market insi",
    "BN Brian Nolasco 6 months ago Ngl the free discord is worth paying for! He provides so much information! Been nothing but a great mentor to me! Written 11 days after purchase",
    "DR Diane Ross 9 months ago He offers a lot of valuable information. Written 1 hour after purchase",
    "LM Leon Manuel 9 months ago For a free discord, he provides so much value within a couple of days and just 2 trades I was up over 400%. I first saw his video on Youtube and enjoyed his no-BS approach. and Straight to th e point and heaps of insight. He certainly know's his technical analysis and genuinely cares about his commu... Show more Written 6 days after purchase",
    "T teenagersfrommars 1 year ago This guy is as real as they come! You can tell he realy wants everyone in his community to succeed. He live streams while explaining his thought process in detail and taking trades in real accounts, not on demo like some others. Every stream is interactive, as he answers all the questions from the a... Show more Written 5 months after purchase"
  ],
  "paras": [
    "Sign in Unmute Unmute MT Market Masters Trading Live trades. Real results. Zero fluff. All-in learning 5.0 ( 24 ) Trading Join our elite trading group and get daily live sessions, real-time plays, and the tools you need to finally trade profitably.",
    "Join 4 members Features ✅ Learn faster than any course with real-time live trading sessions, 5x a week. ✅Unlock the secrets of price action with our Risk to Riches Mentorship on demand ✅ Ultimate beginner&#x27;s guide to kickstart your trading with winning strategies ✅ Built different: Community of proven, profitable traders (not full of newbies) ✅ Exclusive tools &amp; resources—PDFs, playbooks, trade breakdowns, and market insi Reviews 5 out of 5 24 total reviews 5 stars 4 stars 3 stars 2 stars 1 star BN Brian Nolasco 6 months ago Ngl the free discord is worth paying for! He provides so much information! Been nothing but a great mentor to me!",
    "9 months ago He offers a lot of valuable information.",
    "9 months ago For a free discord, he provides so much value within a couple of days and just 2 trades I was up over 400%. I first saw his video on Youtube and enjoyed his no-BS approach. and Straight to th e point and heaps of insight. He certainly know's his technical analysis and genuinely cares about his commu...",
    "Written 6 days after purchase T teenagersfrommars 1 year ago This guy is as real as they come! You can tell he realy wants everyone in his community to succeed. He live streams while explaining his thought process in detail and taking trades in real accounts, not on demo like some others. Every stream is interactive, as he answers all the questions from the a...",
    "Written 5 months after purchase See all reviews About the creator JT View profile JKT TRADING @ jkttrading • Joined May 2024 With 5.5 years of trading experience and a year dedicated to mentoring, I know how to help traders succeed. I&#x27;m passionate about teaching and empowering traders to excel. Let’s succeed together! FAQs What is the refund policy? Can I copy-trade you? Will members receive content that cannot be found anywhere else? Affiliates MT Become an affiliate Market Masters Futures Trading 30% reward Earn money by bringing customers to Market Masters Futures Trading. Every time a customer purchases using your link, you&#x27;ll earn a commission."
  ],
  "priceTokens": [
    "$200.00",
    "$200.00",
    "$200.00",
    "$1",
    "$1",
    "$1",
    "$23",
    "$1",
    "$1",
    "$1",
    "$1",
    "$1",
    "$2",
    "$1",
    "$2",
    "$2",
    "$2",
    "$2",
    "$3",
    "$3"
  ],
  "faq": [],
  "textSample": "Sign in Unmute Unmute MT Market Masters Trading Live trades. Real results. Zero fluff. All-in learning 5.0 ( 24 ) Trading Join our elite trading group and get daily live sessions, real-time plays, and the tools you need to finally trade profitably. $200.00 / month Pay Join Join 4 members Features ✅ Learn faster than any course with real-time live trading sessions, 5x a week. ✅Unlock the secrets of price action with our Risk to Riches Mentorship on demand ✅ Ultimate beginner&#x27;s guide to kickstart your trading with winning strategies ✅ Built different: Community of proven, profitable traders (not full of newbies) ✅ Exclusive tools &amp; resources—PDFs, playbooks, trade breakdowns, and market insi Reviews 5 out of 5 24 total reviews 5 stars 4 stars 3 stars 2 stars 1 star BN Brian Nolasco 6 months ago Ngl the free discord is worth paying for! He provides so much information! Been nothing but a great mentor to me! Written 11 days after purchase DR Diane Ross 9 months ago He offers a lot of valuable information. Written 1 hour after purchase LM Leon Manuel 9 months ago For a free discord, he provides so much value within a couple of days and just 2 trades I was up over 400%. I first saw his video on Youtube and enjoyed his no-BS approach. and Straight to th e point and heaps of insight. He certainly know's his technical analysis and genuinely cares about his commu... Show more Written 6 days after purchase T teenagersfrommars 1 year ago This guy is as real as they come! You can tell he realy wants everyone in his community to succeed. He live streams while explaining his thought process in detail and taking trades in real accounts, not on demo like some others. Every stream is interactive, as he answers all the questions from the a... Show more Written 5 months after purchase See all reviews About the creator JT View profile JKT TRADING @ jkttrading • Joined May 2024 With 5.5 years of trading experience and a year dedicated to mentoring, I know how to help traders succeed. I&#x27;m passionate about teaching and empowering traders to excel. Let’s succeed together! FAQs What is the refund policy? Can I copy-trade you? Will members receive content that cannot be found anywhere else? Affiliates MT Become an affiliate Market Masters Futures Trading 30% reward Earn money by bringing customers to Market Masters Futures Trading. Every time a customer purchases using your link, you&#x27;ll earn a commission. Market Masters Trading $200.00 / month Join $200.00 / month Pay Join Pay Join Market Masters Trading | Whop",
  "finalUrl": "https://whop.com/market-masters-discord/meme-coin-trading-copy/",
  "fetchedAt": "2025-11-04T21:43:43.492Z",
  "textHash": "abc77bfc992fd03dbf905c5fcad133d5dfa7f749a4b9f964d1fe3761b7bfdfe5",
  "drilled": false
}