{
  "baseUrl": "https://whop.com/elitevip/master-the-bull/",
  "title": "Master The Bull Seminar | Whop",
  "h1": "Master The Bull Seminar",
  "bullets": [
    "Sign in CS Master The Bull Seminar Dominate the Bull Market with Emotionless Precision 5.0 ( 38 ) Trading Master any bull marketâ€”whether itâ€™s a full-blown cycle or just a rallyâ€”by trading breakouts with precision &amp; managing risk like a pro. $129.00 one-time purchase Pay Join Features ğŸ® Master bullish breakouts with precision &amp; confidence",
    "ğŸ® Learn to take profits before the market takes them back",
    "ğŸ® Build real trading skillâ€”not just rely on bull market luck",
    "ğŸ® Spot high-probability trades with asymmetric upside",
    "ğŸ® Full recording will be available to you forever",
    "U Umatic 6 hours ago If you want to actually make money and eventually KEEP it this is the best group to join and get the skills and guidance to do so .Jomo and CM are professionals and say things as they are they give the bitter truth and not sweet lies ! Best VIP i joined ! Written 4 months after purchase",
    "B Bart 18 days ago Been in the CM community since 2020 and oh boyâ€¦. Didnâ€™t regret my membership. Written 19 minutes after purchase",
    "DB Daryl H Baker 20 days ago JoMo and CM are excellent. These guys are pros with a track record scaling back several years and multiple cycles. They are chart maxiâ€™s. No cultish behavior here. They look to extract as much money from the market as possible. Short or long. They do the heavy lifting. 24/7 market surveillance. Trad... Show more Written 3 months after purchase",
    "H Howard 1 month ago This is my review of jomo's Trade Club. After 3 years i can appreciate the benefit of having a true mentor who understands that i as an amateur only need the high probability trade's. to be fare what stands out the most looking back is how he accelerated my learning by teaching me how to fish for se... Show more Written 2 months after purchase"
  ],
  "paras": [
    "Sign in CS Master The Bull Seminar Dominate the Bull Market with Emotionless Precision 5.0 ( 38 ) Trading Master any bull marketâ€”whether itâ€™s a full-blown cycle or just a rallyâ€”by trading breakouts with precision &amp; managing risk like a pro.",
    "ğŸ® Master bullish breakouts with precision &amp; confidence ğŸ® Learn to take profits before the market takes them back ğŸ® Build real trading skillâ€”not just rely on bull market luck ğŸ® Spot high-probability trades with asymmetric upside ğŸ® Full recording will be available to you forever Reviews 4.95 out of 5 38 total reviews 5 stars 4 stars 3 stars 2 stars 1 star U Umatic 6 hours ago If you want to actually make money and eventually KEEP it this is the best group to join and get the skills and guidance to do so .Jomo and CM are professionals and say things as they are they give the bitter truth and not sweet lies ! Best VIP i joined !",
    "18 days ago Been in the CM community since 2020 and oh boyâ€¦. Didnâ€™t regret my membership.",
    "20 days ago JoMo and CM are excellent. These guys are pros with a track record scaling back several years and multiple cycles. They are chart maxiâ€™s. No cultish behavior here. They look to extract as much money from the market as possible. Short or long. They do the heavy lifting. 24/7 market surveillance. Trad...",
    "Written 3 months after purchase H Howard 1 month ago This is my review of jomo's Trade Club. After 3 years i can appreciate the benefit of having a true mentor who understands that i as an amateur only need the high probability trade's. to be fare what stands out the most looking back is how he accelerated my learning by teaching me how to fish for se...",
    "Written 2 months after purchase See all reviews About the creator CM View profile Crypto Mindset @ cryptomindset00 â€¢ Joined Jan 2025 Affiliates CS Become an affiliate Crypto Mindset VIP Service 30% reward Earn money by bringing customers to Crypto Mindset VIP Service. Every time a customer purchases using your link, you&#x27;ll earn a commission."
  ],
  "priceTokens": [
    "$129.00",
    "$129.00",
    "$129.00",
    "$1",
    "$1",
    "$1",
    "$22",
    "$1",
    "$1",
    "$1",
    "$1",
    "$1",
    "$2",
    "$1",
    "$2",
    "$2",
    "$2",
    "$2",
    "$3",
    "$3"
  ],
  "faq": [],
  "textSample": "Sign in CS Master The Bull Seminar Dominate the Bull Market with Emotionless Precision 5.0 ( 38 ) Trading Master any bull marketâ€”whether itâ€™s a full-blown cycle or just a rallyâ€”by trading breakouts with precision &amp; managing risk like a pro. $129.00 one-time purchase Pay Join Features ğŸ® Master bullish breakouts with precision &amp; confidence ğŸ® Learn to take profits before the market takes them back ğŸ® Build real trading skillâ€”not just rely on bull market luck ğŸ® Spot high-probability trades with asymmetric upside ğŸ® Full recording will be available to you forever Reviews 4.95 out of 5 38 total reviews 5 stars 4 stars 3 stars 2 stars 1 star U Umatic 6 hours ago If you want to actually make money and eventually KEEP it this is the best group to join and get the skills and guidance to do so .Jomo and CM are professionals and say things as they are they give the bitter truth and not sweet lies ! Best VIP i joined ! Written 4 months after purchase B Bart 18 days ago Been in the CM community since 2020 and oh boyâ€¦. Didnâ€™t regret my membership. Written 19 minutes after purchase DB Daryl H Baker 20 days ago JoMo and CM are excellent. These guys are pros with a track record scaling back several years and multiple cycles. They are chart maxiâ€™s. No cultish behavior here. They look to extract as much money from the market as possible. Short or long. They do the heavy lifting. 24/7 market surveillance. Trad... Show more Written 3 months after purchase H Howard 1 month ago This is my review of jomo's Trade Club. After 3 years i can appreciate the benefit of having a true mentor who understands that i as an amateur only need the high probability trade's. to be fare what stands out the most looking back is how he accelerated my learning by teaching me how to fish for se... Show more Written 2 months after purchase See all reviews About the creator CM View profile Crypto Mindset @ cryptomindset00 â€¢ Joined Jan 2025 Affiliates CS Become an affiliate Crypto Mindset VIP Service 30% reward Earn money by bringing customers to Crypto Mindset VIP Service. Every time a customer purchases using your link, you&#x27;ll earn a commission. Master The Bull Seminar $129.00 one-time purchase Join $129.00 one-time purchase Pay Join Pay Join Master The Bull Seminar | Whop",
  "finalUrl": "https://whop.com/elitevip/master-the-bull/",
  "fetchedAt": "2025-11-04T20:06:40.018Z",
  "textHash": "32f1148498ac5b1bdee3e33043e4434465f9c78ef729c4421932ee75b30241c7",
  "drilled": false
}