{
  "baseUrl": "https://whop.com/mcsports/?a=alexburnett21",
  "title": "MC Sports Analytics | Whop",
  "h1": "MC Sports Analytics",
  "bullets": [
    "Powered by MA MC Sports Analytics Our Premium Sports Betting Group has delivered consistent profits for over 4 years across every major sport and bet type â€” from straight bets and parlays to props and live action. Every play is backed... More 4.8 ( 811 ) Contact seller Products $19.99 / week ğŸ”¥ Premium Sports Betting Group â€“ Win Smarter, Not Harder ğŸ”¥ MC SPORTS PREMIUM 4.9 ( 618 ) $4.99 / month YOUR INSIDE EDGE TO BEATING THE BOOKS MC SPORTS BASIC 4.0 ( 21 ) Free ğŸš¨ FREE Sports Picks Group â€“ Join Now! ğŸš¨ MC Sports FREE Community 4.6 ( 172 ) Contact seller Reviews TM TONY MAYNE â€¢ MC SPORTS PREMIUM 6 days ago Been tapped in with MC for a couple months now. Best discord with transparency, Wâ€™s daily & your investment back & some. Like everything else some losing days but the bounce backs are real & the array of cappers provides a 5 star menu of EATING GOOD. ğŸ’£ğŸ´â€â˜ ï¸ Written 1 year after purchase",
    "A Armando â€¢ MC SPORTS PREMIUM 7 days ago By far most profitable Iâ€™ve been since joining, not to mention such a great community Written 3 months after purchase",
    "P Pablo â€¢ MC SPORTS PREMIUM 8 days ago Great community filled with people that spend countless hours to make sure you have Written 19 days after purchase",
    "BB Brenda Brannon â€¢ MC SPORTS PREMIUM 8 days ago Love everything about the group and the chat because thereâ€™s a lot of good folks in the group always willing to help. McBets is the best Written 6 months after purchase"
  ],
  "paras": [
    "MA MC Sports Analytics Our Premium Sports Betting Group has delivered consistent profits for over 4 years across every major sport and bet type â€” from straight bets and parlays to props and live action. Every play is backed... More 4.8 ( 811 ) Contact seller Products $19.99 / week ğŸ”¥ Premium Sports Betting Group â€“ Win Smarter, Not Harder ğŸ”¥ MC SPORTS PREMIUM 4.9 ( 618 ) $4.99 / month YOUR INSIDE EDGE TO BEATING THE BOOKS MC SPORTS BASIC 4.0 ( 21 ) Free ğŸš¨ FREE Sports Picks Group â€“ Join Now! ğŸš¨ MC Sports FREE Community 4.6 ( 172 ) Contact seller Reviews TM TONY MAYNE â€¢ MC SPORTS PREMIUM 6 days ago Been tapped in with MC for a couple months now. Best discord with transparency, Wâ€™s daily & your investment back & some. Like everything else some losing days but the bounce backs are real & the array of cappers provides a 5 star menu of EATING GOOD. ğŸ’£ğŸ´â€â˜ ï¸",
    "7 days ago By far most profitable Iâ€™ve been since joining, not to mention such a great community",
    "8 days ago Great community filled with people that spend countless hours to make sure you have",
    "8 days ago Love everything about the group and the chat because thereâ€™s a lot of good folks in the group always willing to help. McBets is the best"
  ],
  "priceTokens": [
    "$19.99",
    "$4.99",
    "$1",
    "$1",
    "$1",
    "$21",
    "$1",
    "$1",
    "$1",
    "$1",
    "$28",
    "$1",
    "$28",
    "$28",
    "$28",
    "$28",
    "$3",
    "$3",
    "$3",
    "$10"
  ],
  "faq": [],
  "textSample": "Powered by MA MC Sports Analytics Our Premium Sports Betting Group has delivered consistent profits for over 4 years across every major sport and bet type â€” from straight bets and parlays to props and live action. Every play is backed... More 4.8 ( 811 ) Contact seller Products $19.99 / week ğŸ”¥ Premium Sports Betting Group â€“ Win Smarter, Not Harder ğŸ”¥ MC SPORTS PREMIUM 4.9 ( 618 ) $4.99 / month YOUR INSIDE EDGE TO BEATING THE BOOKS MC SPORTS BASIC 4.0 ( 21 ) Free ğŸš¨ FREE Sports Picks Group â€“ Join Now! ğŸš¨ MC Sports FREE Community 4.6 ( 172 ) Contact seller Reviews TM TONY MAYNE â€¢ MC SPORTS PREMIUM 6 days ago Been tapped in with MC for a couple months now. Best discord with transparency, Wâ€™s daily & your investment back & some. Like everything else some losing days but the bounce backs are real & the array of cappers provides a 5 star menu of EATING GOOD. ğŸ’£ğŸ´â€â˜ ï¸ Written 1 year after purchase A Armando â€¢ MC SPORTS PREMIUM 7 days ago By far most profitable Iâ€™ve been since joining, not to mention such a great community Written 3 months after purchase P Pablo â€¢ MC SPORTS PREMIUM 8 days ago Great community filled with people that spend countless hours to make sure you have Written 19 days after purchase BB Brenda Brannon â€¢ MC SPORTS PREMIUM 8 days ago Love everything about the group and the chat because thereâ€™s a lot of good folks in the group always willing to help. McBets is the best Written 6 months after purchase See all reviews MC Sports Analytics | Whop",
  "finalUrl": "https://whop.com/mcsports/?a=alexburnett21",
  "fetchedAt": "2025-11-05T09:49:15.821Z",
  "textHash": "d529d0e9739ea7430c1d835bcc15825b2d30d83506c89a1011d5fc858d0a3210",
  "drilled": false
}