{
  "baseUrl": "https://whop.com/media-metas-f4/media-metas-clips/",
  "title": "Media Metas Clips | Whop",
  "h1": "Media Metas Clips",
  "bullets": [
    "Sign in Unmute Unmute MM Media Metas Clips Going Viral Made Easy 4.3 ( 735 ) Social media Unlock the secrets of social media virality with Media Metas Clips. Gain access to algorithmic help, viral content, and professional insights. $496.99 one-time purchase Pay Join Join 1,489 members Features 24/7 algorithmic help to optimize your content strategy.",
    "Daily insights and strategies for creating viral content.",
    "Monthly calls with industry professionals for personalized guidance.",
    "CG Chioce Gamer 14 days ago Good Written 5 months after purchase",
    "A Aenon 22 days ago it takes so long to get paid but still pays Written 1 year after purchase",
    "DP Dhilshith P 1 month ago Good Written 5 months after purchase",
    "AK ASHUTOSH KUMAR 1 month ago Good Written 5 months after purchase"
  ],
  "paras": [
    "Sign in Unmute Unmute MM Media Metas Clips Going Viral Made Easy 4.3 ( 735 ) Social media Unlock the secrets of social media virality with Media Metas Clips. Gain access to algorithmic help, viral content, and professional insights.",
    "Join 1,489 members Features 24/7 algorithmic help to optimize your content strategy. Daily insights and strategies for creating viral content. Monthly calls with industry professionals for personalized guidance. Reviews 4.29 out of 5 735 total reviews 5 stars 4 stars 3 stars 2 stars 1 star CG Chioce Gamer 14 days ago Good",
    "22 days ago it takes so long to get paid but still pays",
    "1 month ago Good",
    "1 month ago Good",
    "About the creator M View profile musa @ mussyy • Joined Aug 2022 I&#x27;ve dedicated my career to mastering social media growth. With Media Metas, I share my expertise and connect you with top professionals to enhance your online presence. FAQs What Is This Group For? How can I start with Media Metas? Affiliates MM Become an affiliate Media Metas 30% reward Earn money by bringing customers to Media Metas. Every time a customer purchases using your link, you&#x27;ll earn a commission."
  ],
  "priceTokens": [
    "$496.99",
    "$496.99",
    "$496.99",
    "$1",
    "$1",
    "$1",
    "$22",
    "$1",
    "$1",
    "$1",
    "$1",
    "$1",
    "$2",
    "$1",
    "$2",
    "$2",
    "$2",
    "$2",
    "$3",
    "$3"
  ],
  "faq": [],
  "textSample": "Sign in Unmute Unmute MM Media Metas Clips Going Viral Made Easy 4.3 ( 735 ) Social media Unlock the secrets of social media virality with Media Metas Clips. Gain access to algorithmic help, viral content, and professional insights. $496.99 one-time purchase Pay Join Join 1,489 members Features 24/7 algorithmic help to optimize your content strategy. Daily insights and strategies for creating viral content. Monthly calls with industry professionals for personalized guidance. Reviews 4.29 out of 5 735 total reviews 5 stars 4 stars 3 stars 2 stars 1 star CG Chioce Gamer 14 days ago Good Written 5 months after purchase A Aenon 22 days ago it takes so long to get paid but still pays Written 1 year after purchase DP Dhilshith P 1 month ago Good Written 5 months after purchase AK ASHUTOSH KUMAR 1 month ago Good Written 5 months after purchase See all reviews About the creator M View profile musa @ mussyy • Joined Aug 2022 I&#x27;ve dedicated my career to mastering social media growth. With Media Metas, I share my expertise and connect you with top professionals to enhance your online presence. FAQs What Is This Group For? How can I start with Media Metas? Affiliates MM Become an affiliate Media Metas 30% reward Earn money by bringing customers to Media Metas. Every time a customer purchases using your link, you&#x27;ll earn a commission. Media Metas Clips $496.99 one-time purchase Join $496.99 one-time purchase Pay Join Pay Join Media Metas Clips | Whop",
  "finalUrl": "https://whop.com/media-metas-f4/media-metas-clips/",
  "fetchedAt": "2025-11-05T10:43:28.741Z",
  "textHash": "4b40e9d548367a2208b5de2ce564fb1dce87d5e84b0a91aaa621f33c49cb5ed5",
  "drilled": false
}