{
  "baseUrl": "https://whop.com/media-metas-f4/?a=alexburnett21",
  "title": "Media Metas | Whop",
  "h1": "Media Metas",
  "bullets": [
    "Powered by MM Media Metas I&#x27;ve dedicated my career to mastering social media growth. With Media Metas, I share my expertise and connect you with top professionals to enhance your online presence. 4.3 ( 735 ) Contact seller Products Unmute $40.00 / month Join the #1 Social Media Growth Hub Media Metas 4.3 ( 614 ) Unmute Free Join Our Community of Likeminded Clippers Media Metas Free Access 4.3 ( 115 ) Unmute $496.99 Going Viral Made Easy Media Metas Clips 4.7 ( 3 ) $400.00 Going Viral Made Easy Media Metas New Contact seller Reviews CG Chioce Gamer • Media Metas Free Access 13 days ago Good Written 5 months after purchase",
    "A Aenon • Media Metas Free Access 22 days ago it takes so long to get paid but still pays Written 1 year after purchase",
    "DP Dhilshith P • Media Metas Free Access 1 month ago Good Written 5 months after purchase",
    "AK ASHUTOSH KUMAR • Media Metas Free Access 1 month ago Good Written 5 months after purchase"
  ],
  "paras": [
    "MM Media Metas I&#x27;ve dedicated my career to mastering social media growth. With Media Metas, I share my expertise and connect you with top professionals to enhance your online presence. 4.3 ( 735 ) Contact seller Products Unmute $40.00 / month Join the #1 Social Media Growth Hub Media Metas 4.3 ( 614 ) Unmute Free Join Our Community of Likeminded Clippers Media Metas Free Access 4.3 ( 115 ) Unmute $496.99 Going Viral Made Easy Media Metas Clips 4.7 ( 3 ) $400.00 Going Viral Made Easy Media Metas New Contact seller Reviews CG Chioce Gamer • Media Metas Free Access 13 days ago Good",
    "22 days ago it takes so long to get paid but still pays",
    "1 month ago Good",
    "1 month ago Good"
  ],
  "priceTokens": [
    "$40.00",
    "$496.99",
    "$400.00",
    "$1",
    "$1",
    "$1",
    "$21",
    "$1",
    "$1",
    "$1",
    "$1",
    "$28",
    "$1",
    "$28",
    "$28",
    "$28",
    "$28",
    "$3",
    "$3",
    "$3"
  ],
  "faq": [],
  "textSample": "Powered by MM Media Metas I&#x27;ve dedicated my career to mastering social media growth. With Media Metas, I share my expertise and connect you with top professionals to enhance your online presence. 4.3 ( 735 ) Contact seller Products Unmute $40.00 / month Join the #1 Social Media Growth Hub Media Metas 4.3 ( 614 ) Unmute Free Join Our Community of Likeminded Clippers Media Metas Free Access 4.3 ( 115 ) Unmute $496.99 Going Viral Made Easy Media Metas Clips 4.7 ( 3 ) $400.00 Going Viral Made Easy Media Metas New Contact seller Reviews CG Chioce Gamer • Media Metas Free Access 13 days ago Good Written 5 months after purchase A Aenon • Media Metas Free Access 22 days ago it takes so long to get paid but still pays Written 1 year after purchase DP Dhilshith P • Media Metas Free Access 1 month ago Good Written 5 months after purchase AK ASHUTOSH KUMAR • Media Metas Free Access 1 month ago Good Written 5 months after purchase See all reviews Media Metas | Whop",
  "finalUrl": "https://whop.com/media-metas-f4/?a=alexburnett21",
  "fetchedAt": "2025-11-05T09:52:30.293Z",
  "textHash": "058bc9d86389a3ce58fcd33cd72910cb029f06ed2dea393c2939d058c924e2e4",
  "drilled": false
}