{
  "baseUrl": "https://whop.com/theparagongroup/the-paragon-membership-crypto/",
  "title": "Membership - Crypto Payments | Whop",
  "h1": "Membership - Crypto Payments",
  "bullets": [
    "Membership - Crypto Payments | Whop Sign in Unmute Unmute TG Membership - Crypto Payments Master Crypto Trading with Experts 5.0 ( 50 ) Trading Join The Paragon Group for premium crypto education, weekly streams, trade plans, market analysis, and exclusive indicators. $180.00 for 1 month Pay Join Features Weekly streams and trade plans from Charlie, Magus &amp; Doc",
    "1000&#x27;s of hours of educational content from basics to advanced.",
    "Access to custom indicators and templates on trading platforms.",
    "Daily market discussions and weekly trade reviews.",
    "News and event trackers for crypto and traditional finance updates.",
    "L Lucifer 13 days ago The host Magus has a bit of a bad body smell but the courses are decent. His wife Charlie makes good spaghetti but is british. Their son doc is alright i guess. i'd recommend them. Somehow. Written 9 months after purchase",
    "HT Heavy Thinker 15 days ago Love these guys and the other members Written 2 months after purchase",
    "M Michael 5 months ago Awesome group, great education, great people, you get a variety of different systems that you can learn between the 3 traders Magus, Charlie and Doc. Can't recommend it enough for education and for learning how to think and trade for yourself. Written 1 year after purchase",
    "F freedomisthevision 8 months ago The education is great! MAgus Doc and Charlie are all very responsive and willing to teach. The only thing I would advise new traders iis: this is all great information and a great place to ask questions, but until you develop a system for yourself it will not be enough. It should, however, make it ... Show more Written 8 months after purchase"
  ],
  "paras": [
    "Sign in Unmute Unmute TG Membership - Crypto Payments Master Crypto Trading with Experts 5.0 ( 50 ) Trading Join The Paragon Group for premium crypto education, weekly streams, trade plans, market analysis, and exclusive indicators.",
    "$180.00 for 1 month Pay Join Features Weekly streams and trade plans from Charlie, Magus &amp; Doc 1000&#x27;s of hours of educational content from basics to advanced. Access to custom indicators and templates on trading platforms. Daily market discussions and weekly trade reviews. News and event trackers for crypto and traditional finance updates. Reviews 5 out of 5 50 total reviews 5 stars 4 stars 3 stars 2 stars 1 star L Lucifer 13 days ago The host Magus has a bit of a bad body smell but the courses are decent. His wife Charlie makes good spaghetti but is british. Their son doc is alright i guess. i'd recommend them. Somehow.",
    "15 days ago Love these guys and the other members",
    "5 months ago Awesome group, great education, great people, you get a variety of different systems that you can learn between the 3 traders Magus, Charlie and Doc. Can't recommend it enough for education and for learning how to think and trade for yourself.",
    "8 months ago The education is great! MAgus Doc and Charlie are all very responsive and willing to teach. The only thing I would advise new traders iis: this is all great information and a great place to ask questions, but until you develop a system for yourself it will not be enough. It should, however, make it ...",
    "Written 8 months after purchase See all reviews About the creator TG View profile The Paragon Group @ btccharlie • Joined Feb 2022 The Paragon Group is a top community for crypto enthusiasts, offering exclusive insights, weekly live streams, strategic trade plans, and a comprehensive educational library. It equips members with essential tools for informed and strategic trading decisions in the crypto space. FAQs What is included in the membership? How often are the trade plans updated? Affiliates TG Become an affiliate The Paragon Group 30% reward Earn money by bringing customers to The Paragon Group. Every time a customer purchases using your link, you&#x27;ll earn a commission."
  ],
  "priceTokens": [
    "$180.00",
    "$180.00",
    "$180.00",
    "$1",
    "$1",
    "$1",
    "$23",
    "$1",
    "$1",
    "$1",
    "$1",
    "$1",
    "$2",
    "$1",
    "$2",
    "$2",
    "$2",
    "$2",
    "$3",
    "$3"
  ],
  "faq": [],
  "textSample": "Membership - Crypto Payments | Whop Sign in Unmute Unmute TG Membership - Crypto Payments Master Crypto Trading with Experts 5.0 ( 50 ) Trading Join The Paragon Group for premium crypto education, weekly streams, trade plans, market analysis, and exclusive indicators. $180.00 for 1 month Pay Join Features Weekly streams and trade plans from Charlie, Magus &amp; Doc 1000&#x27;s of hours of educational content from basics to advanced. Access to custom indicators and templates on trading platforms. Daily market discussions and weekly trade reviews. News and event trackers for crypto and traditional finance updates. Reviews 5 out of 5 50 total reviews 5 stars 4 stars 3 stars 2 stars 1 star L Lucifer 13 days ago The host Magus has a bit of a bad body smell but the courses are decent. His wife Charlie makes good spaghetti but is british. Their son doc is alright i guess. i'd recommend them. Somehow. Written 9 months after purchase HT Heavy Thinker 15 days ago Love these guys and the other members Written 2 months after purchase M Michael 5 months ago Awesome group, great education, great people, you get a variety of different systems that you can learn between the 3 traders Magus, Charlie and Doc. Can't recommend it enough for education and for learning how to think and trade for yourself. Written 1 year after purchase F freedomisthevision 8 months ago The education is great! MAgus Doc and Charlie are all very responsive and willing to teach. The only thing I would advise new traders iis: this is all great information and a great place to ask questions, but until you develop a system for yourself it will not be enough. It should, however, make it ... Show more Written 8 months after purchase See all reviews About the creator TG View profile The Paragon Group @ btccharlie • Joined Feb 2022 The Paragon Group is a top community for crypto enthusiasts, offering exclusive insights, weekly live streams, strategic trade plans, and a comprehensive educational library. It equips members with essential tools for informed and strategic trading decisions in the crypto space. FAQs What is included in the membership? How often are the trade plans updated? Affiliates TG Become an affiliate The Paragon Group 30% reward Earn money by bringing customers to The Paragon Group. Every time a customer purchases using your link, you&#x27;ll earn a commission. Membership - Crypto Payments $180.00 for 1 month +3 options Join $180.00 for 1 month 3 options Join",
  "finalUrl": "https://whop.com/theparagongroup/the-paragon-membership-crypto/",
  "fetchedAt": "2025-11-05T09:54:33.901Z",
  "textHash": "8bebed0ec9d346840ed61d4b9316ac2584c0e818c349eea55b3e2bb0d9daf06b",
  "drilled": false
}