{
  "baseUrl": "https://whop.com/minteddao/minted-yearly-access/",
  "title": "Minted Yearly Access (Crypto) | Whop",
  "h1": "Minted Yearly Access (Crypto)",
  "bullets": [
    "Sign in M Minted Yearly Access (Crypto) Join MintedDAO for Alpha Crypto Insights 4.8 ( 51 ) Other Tight-knit group of skilled traders offering top-notch insights and tools across all blockchains, enhancing your crypto profits. $1,700.00 for 1 year Pay Join Join 40 members Features 24/7 support staff across multiple time zones.",
    "Access to top NFT callers across multiple blockchains.",
    "Exclusive bot partnerships and analytical tools.",
    "Comprehensive NFT, crypto, and forex market updates.",
    "E ETHachi 10 months ago Best group to be a part of. ROI is over 1000% already. Covers everything from NFT's, Crypto, Memecoins etc... Cover most chains as well. Always will renew yearly. Ali and the team are GOAT's Written 8 months after purchase",
    "M Minion 10 months ago I cannot begin to explain how much joining Minted has helped me; learn, make money, and learn how to make money. Top notch community for real and I’m grateful to be a part of it. What’s wild to me, is what’s delivered is more than what’s promised for the membership, and I am frankly excited to see h... Show more Written 1 month after purchase",
    "C Cez 2 years ago Top notch Written 4 months after purchase",
    "C Cheysser 2 years ago I've been in many alpha groups since 2021 but MintedDao just cooks differently. I started January and now it's my third month. Only regret was not joining last year. I've had more wins these past few months than the whole 2023 combined. We always ready to cook! Written 2 months after purchase"
  ],
  "paras": [
    "Sign in M Minted Yearly Access (Crypto) Join MintedDAO for Alpha Crypto Insights 4.8 ( 51 ) Other Tight-knit group of skilled traders offering top-notch insights and tools across all blockchains, enhancing your crypto profits.",
    "Join 40 members Features 24/7 support staff across multiple time zones. Access to top NFT callers across multiple blockchains. Exclusive bot partnerships and analytical tools. Comprehensive NFT, crypto, and forex market updates. Reviews 4.82 out of 5 51 total reviews 5 stars 4 stars 3 stars 2 stars 1 star E ETHachi 10 months ago Best group to be a part of. ROI is over 1000% already. Covers everything from NFT's, Crypto, Memecoins etc... Cover most chains as well. Always will renew yearly. Ali and the team are GOAT's",
    "10 months ago I cannot begin to explain how much joining Minted has helped me; learn, make money, and learn how to make money. Top notch community for real and I’m grateful to be a part of it. What’s wild to me, is what’s delivered is more than what’s promised for the membership, and I am frankly excited to see h...",
    "Written 1 month after purchase C Cez 2 years ago Top notch",
    "2 years ago I've been in many alpha groups since 2021 but MintedDao just cooks differently. I started January and now it's my third month. Only regret was not joining last year. I've had more wins these past few months than the whole 2023 combined. We always ready to cook!",
    "About the creator M View profile MintedDAO @ minteddao • Joined Jan 2023 MintedDAO is a cross chain Alpha Group focusing on Solana &amp; Ethereum. We have an expert team on both the Solana/Ethereum blockchain as well as upcoming emerging blockchains (Canto, NEAR and Aptos) and most importantly; we prioritize making money for our users. FAQs What is MintedDAO? Why did you go the Renewal System route? What is your main goal with MintedDAO? Affiliates M Become an affiliate Minted 30% reward Earn money by bringing customers to Minted. Every time a customer purchases using your link, you&#x27;ll earn a commission."
  ],
  "priceTokens": [
    "$1,700.00",
    "$1,700.00",
    "$1,700.00",
    "$1",
    "$1",
    "$1",
    "$22",
    "$1",
    "$1",
    "$1",
    "$1",
    "$1",
    "$2",
    "$1",
    "$2",
    "$2",
    "$2",
    "$2",
    "$3",
    "$3"
  ],
  "faq": [],
  "textSample": "Sign in M Minted Yearly Access (Crypto) Join MintedDAO for Alpha Crypto Insights 4.8 ( 51 ) Other Tight-knit group of skilled traders offering top-notch insights and tools across all blockchains, enhancing your crypto profits. $1,700.00 for 1 year Pay Join Join 40 members Features 24/7 support staff across multiple time zones. Access to top NFT callers across multiple blockchains. Exclusive bot partnerships and analytical tools. Comprehensive NFT, crypto, and forex market updates. Reviews 4.82 out of 5 51 total reviews 5 stars 4 stars 3 stars 2 stars 1 star E ETHachi 10 months ago Best group to be a part of. ROI is over 1000% already. Covers everything from NFT's, Crypto, Memecoins etc... Cover most chains as well. Always will renew yearly. Ali and the team are GOAT's Written 8 months after purchase M Minion 10 months ago I cannot begin to explain how much joining Minted has helped me; learn, make money, and learn how to make money. Top notch community for real and I’m grateful to be a part of it. What’s wild to me, is what’s delivered is more than what’s promised for the membership, and I am frankly excited to see h... Show more Written 1 month after purchase C Cez 2 years ago Top notch Written 4 months after purchase C Cheysser 2 years ago I've been in many alpha groups since 2021 but MintedDao just cooks differently. I started January and now it's my third month. Only regret was not joining last year. I've had more wins these past few months than the whole 2023 combined. We always ready to cook! Written 2 months after purchase See all reviews About the creator M View profile MintedDAO @ minteddao • Joined Jan 2023 MintedDAO is a cross chain Alpha Group focusing on Solana &amp; Ethereum. We have an expert team on both the Solana/Ethereum blockchain as well as upcoming emerging blockchains (Canto, NEAR and Aptos) and most importantly; we prioritize making money for our users. FAQs What is MintedDAO? Why did you go the Renewal System route? What is your main goal with MintedDAO? Affiliates M Become an affiliate Minted 30% reward Earn money by bringing customers to Minted. Every time a customer purchases using your link, you&#x27;ll earn a commission. Minted Yearly Access (Crypto) $1,700.00 for 1 year Join $1,700.00 for 1 year Join Minted Yearly Access (Crypto) | Whop",
  "finalUrl": "https://whop.com/minteddao/minted-yearly-access/",
  "fetchedAt": "2025-11-05T10:31:59.408Z",
  "textHash": "9280dec93428fd4257eea0156bcc9a301fc1065ea35db9ce152c7cca3b07574f",
  "drilled": false
}