{
  "baseUrl": "https://whop.com/mikestrading/mirror-trading-lifetime-included/",
  "title": "MIRROR TRADING/LIFETIME | Whop",
  "h1": "MIRROR TRADING/LIFETIME",
  "bullets": [
    "MIRROR TRADING/LIFETIME | Whop Sign in MT MIRROR TRADING/LIFETIME FOR ALL INVESTORS FROM BEGINNER TO PRO 4.7 ( 129 ) Trading MIRROR MEMBERSHIP GIVES ACCESS TO ALL BENEFITS + ROTH IRA/LONG TERM PICKS, DAILY INDIVIDUAL STOCK ALERTS, SMALL GROUP ACCESS, LEAPS/SWINGS, MY FULL TRADING STRATEGY TO ACHIEVE A 95%+ ACCURACY, DAILY PRE MARKET CHART ANALYSIS, DEFINED ENTRY/EXITS &amp; MORE! $1,995.00 one-time purchase Pay Join Join 1,080 members Features LIFETIME ACCESS TO PREMIUM ALERTS THAT INCLUDE ENTRY, EXIT, &amp; STOP-LOSS üîÆ",
    "30+ HOURS OF EDUCATIONAL CONTENT AS WELL AS MY OWN PERSONAL TRADING STRATEGIES",
    "DAILY CHART ANALYSIS, WATCHLISTS, OPTION FLOW, MARKET OVERVIEWS, DD THREADS üå™Ô∏è",
    "PERSONAL 1:1 MENTORSHIP, LONG TERM/ROTH-IRA PICKS, SMALL GROUP ACCESS üî•",
    "GAMEPLANS AND OVERVIEWS FOR EVERY TRADE, PRIVATE CHAT ACCESS, MIRROR ANALYSIS üîî",
    "PG purshotam singh garcha 11 minutes ago Real deal Written 2 months after purchase",
    "ED Eugene Dugger /Pete 5 days ago Good stuff Written 3 months after purchase",
    "AS Amadou Sow 6 days ago Great Himan Written 15 days after purchase",
    "SS sajid sajid 10 days ago 5 Stars ‚Äì Mike‚Äôs Alerts Deliver! Mike‚Äôs trading alert service is outstanding. Precise entries, clear reasoning, and smart risk management have boosted my win rate. Support is fast, results are real. Highly recommend! üöÄ Written 13 days after purchase"
  ],
  "paras": [
    "Sign in MT MIRROR TRADING/LIFETIME FOR ALL INVESTORS FROM BEGINNER TO PRO 4.7 ( 129 ) Trading MIRROR MEMBERSHIP GIVES ACCESS TO ALL BENEFITS + ROTH IRA/LONG TERM PICKS, DAILY INDIVIDUAL STOCK ALERTS, SMALL GROUP ACCESS, LEAPS/SWINGS, MY FULL TRADING STRATEGY TO ACHIEVE A 95%+ ACCURACY, DAILY PRE MARKET CHART ANALYSIS, DEFINED ENTRY/EXITS &amp; MORE!",
    "Join 1,080 members Features LIFETIME ACCESS TO PREMIUM ALERTS THAT INCLUDE ENTRY, EXIT, &amp; STOP-LOSS üîÆ 30+ HOURS OF EDUCATIONAL CONTENT AS WELL AS MY OWN PERSONAL TRADING STRATEGIES DAILY CHART ANALYSIS, WATCHLISTS, OPTION FLOW, MARKET OVERVIEWS, DD THREADS üå™Ô∏è PERSONAL 1:1 MENTORSHIP, LONG TERM/ROTH-IRA PICKS, SMALL GROUP ACCESS üî• GAMEPLANS AND OVERVIEWS FOR EVERY TRADE, PRIVATE CHAT ACCESS, MIRROR ANALYSIS üîî Reviews 4.71 out of 5 129 total reviews 5 stars 4 stars 3 stars 2 stars 1 star PG purshotam singh garcha 11 minutes ago Real deal",
    "5 days ago Good stuff",
    "6 days ago Great Himan",
    "10 days ago 5 Stars ‚Äì Mike‚Äôs Alerts Deliver! Mike‚Äôs trading alert service is outstanding. Precise entries, clear reasoning, and smart risk management have boosted my win rate. Support is fast, results are real. Highly recommend! üöÄ",
    "About the creator MI View profile Mike Investing @ mikeinvesting ‚Ä¢ Joined Jul 2023 I&#x27;VE BEEN TRADING FULL TIME NOW EVERY DAY FOR OVER 12 YEARS AND SPENT THE YEARS MASTERING THE TRADING WORLD AND UNDERSTANDING TO THE DOT EVERY ASPECT OF IT. WITH MIKES TRADING, I OFFER PERSONAL MENTORSHIP, DALY ALERTS, ACCOUNT CHALLENGES, WATCHLISTS AND SO MUCH MORE TO HELP MAXIMIZE YOUR FULL TRADING POTENTIAL FAQs CAN I STILL JOIN MIRROR TRADING EVEN IF IM A BEGINNER? HOW MUCH RETURNS CAN I EXPECT? WHAT IS INCLUDED IN THE MIRROR/LIFETIME TIER? HOW MANY ALERTS ARE THERE PER DAY AND WHAT IS YOUR ACCURACY? DOES MIRROR INCLUDE LIFETIME MEMBERSHIP? Affiliates MT Become an affiliate MIKES TRADING 30% reward Earn money by bringing customers to MIKES TRADING. Every time a customer purchases using your link, you&#x27;ll earn a commission."
  ],
  "priceTokens": [
    "$1,995.00",
    "$1,995.00",
    "$1,995.00",
    "$1",
    "$1",
    "$1",
    "$23",
    "$1",
    "$1",
    "$1",
    "$1",
    "$1",
    "$2",
    "$1",
    "$2",
    "$2",
    "$2",
    "$2",
    "$3",
    "$3"
  ],
  "faq": [],
  "textSample": "MIRROR TRADING/LIFETIME | Whop Sign in MT MIRROR TRADING/LIFETIME FOR ALL INVESTORS FROM BEGINNER TO PRO 4.7 ( 129 ) Trading MIRROR MEMBERSHIP GIVES ACCESS TO ALL BENEFITS + ROTH IRA/LONG TERM PICKS, DAILY INDIVIDUAL STOCK ALERTS, SMALL GROUP ACCESS, LEAPS/SWINGS, MY FULL TRADING STRATEGY TO ACHIEVE A 95%+ ACCURACY, DAILY PRE MARKET CHART ANALYSIS, DEFINED ENTRY/EXITS &amp; MORE! $1,995.00 one-time purchase Pay Join Join 1,080 members Features LIFETIME ACCESS TO PREMIUM ALERTS THAT INCLUDE ENTRY, EXIT, &amp; STOP-LOSS üîÆ 30+ HOURS OF EDUCATIONAL CONTENT AS WELL AS MY OWN PERSONAL TRADING STRATEGIES DAILY CHART ANALYSIS, WATCHLISTS, OPTION FLOW, MARKET OVERVIEWS, DD THREADS üå™Ô∏è PERSONAL 1:1 MENTORSHIP, LONG TERM/ROTH-IRA PICKS, SMALL GROUP ACCESS üî• GAMEPLANS AND OVERVIEWS FOR EVERY TRADE, PRIVATE CHAT ACCESS, MIRROR ANALYSIS üîî Reviews 4.71 out of 5 129 total reviews 5 stars 4 stars 3 stars 2 stars 1 star PG purshotam singh garcha 11 minutes ago Real deal Written 2 months after purchase ED Eugene Dugger /Pete 5 days ago Good stuff Written 3 months after purchase AS Amadou Sow 6 days ago Great Himan Written 15 days after purchase SS sajid sajid 10 days ago 5 Stars ‚Äì Mike‚Äôs Alerts Deliver! Mike‚Äôs trading alert service is outstanding. Precise entries, clear reasoning, and smart risk management have boosted my win rate. Support is fast, results are real. Highly recommend! üöÄ Written 13 days after purchase See all reviews About the creator MI View profile Mike Investing @ mikeinvesting ‚Ä¢ Joined Jul 2023 I&#x27;VE BEEN TRADING FULL TIME NOW EVERY DAY FOR OVER 12 YEARS AND SPENT THE YEARS MASTERING THE TRADING WORLD AND UNDERSTANDING TO THE DOT EVERY ASPECT OF IT. WITH MIKES TRADING, I OFFER PERSONAL MENTORSHIP, DALY ALERTS, ACCOUNT CHALLENGES, WATCHLISTS AND SO MUCH MORE TO HELP MAXIMIZE YOUR FULL TRADING POTENTIAL FAQs CAN I STILL JOIN MIRROR TRADING EVEN IF IM A BEGINNER? HOW MUCH RETURNS CAN I EXPECT? WHAT IS INCLUDED IN THE MIRROR/LIFETIME TIER? HOW MANY ALERTS ARE THERE PER DAY AND WHAT IS YOUR ACCURACY? DOES MIRROR INCLUDE LIFETIME MEMBERSHIP? Affiliates MT Become an affiliate MIKES TRADING 30% reward Earn money by bringing customers to MIKES TRADING. Every time a customer purchases using your link, you&#x27;ll earn a commission. MIRROR TRADING/LIFETIME $1,995.00 one-time purchase Join $1,995.00 one-time purchase Pay Join Pay Join",
  "finalUrl": "https://whop.com/mikestrading/mirror-trading-lifetime-included/",
  "fetchedAt": "2025-11-05T17:25:40.020Z",
  "textHash": "3b412e663ba14540402034aedf9087dd51f6fab4b11914adb87512c6c492e4de",
  "drilled": false
}