{
  "baseUrl": "https://whop.com/yearly-itm/nbsglobals/",
  "title": "Monthly Elites (+ ITM) | Whop",
  "h1": "Monthly Elites (+ ITM)",
  "bullets": [
    "Sign in NG Monthly Elites (+ ITM) Embrace the Charm of Monthly Elites &amp; Enjoy Free ITM Access! 5.0 ( 18 ) Other Join NBS Monthly for exclusive benefits! Get free Inner Circle, ITM Access, and elite perks to elevate your trading mentorship and connect with top achievers. $14.90 / month Pay Join Join 10 members Features Exclusive Inner Circle Access: Gain entry to a private community of top traders.",
    "Complimentary ITM Access: Enjoy advanced tools and insights to boost your tradin",
    "Premium Educational Content: Access in-depth posts and market analysis.",
    "Personalized Mentorship: Receive tailored guidance to elevate your trading skill",
    "Insider Networking: Connect with like-minded professionals and leaders.",
    "M mobeenmajeed1989 1 year ago This is the best platform i had came across for digital currency. Their methods of teaching are exceptional.NBS believes in financial independence for everyone and provide their knowledge and services without any cost. Hats off to NBS and their team. Written 21 days after purchase",
    "DA Dynysh Ali 1 year ago I've been using [Nbs platform] for the past year, and I'm thoroughly impressed with its performance. As a seasoned trader, I've tried various platforms, but this one stands out for its: User-friendly interface,Comprehensive market analysis,Reliable customer support and much more support from sir soh... Show more Written 3 months after purchase",
    "DA Dynysh Ali 1 year ago I've been using [Nbs platform] for the past year, and I'm thoroughly impressed with its performance. As a seasoned trader, I've tried various platforms, but this one stands out for its: User-friendly interface,Comprehensive market analysis,Reliable customer support and much more Written 1 month after purchase",
    "MA Muhammad Arbab 1 year ago Great Platform dont miss out to such a discount opportunity .. Modreator are very exprience tooo & copreative & Sohail bhai expreience every one know level to level trading .. must join NBS Written 4 days after purchase"
  ],
  "paras": [
    "Sign in NG Monthly Elites (+ ITM) Embrace the Charm of Monthly Elites &amp; Enjoy Free ITM Access! 5.0 ( 18 ) Other Join NBS Monthly for exclusive benefits! Get free Inner Circle, ITM Access, and elite perks to elevate your trading mentorship and connect with top achievers.",
    "Join 10 members Features Exclusive Inner Circle Access: Gain entry to a private community of top traders. Complimentary ITM Access: Enjoy advanced tools and insights to boost your tradin Premium Educational Content: Access in-depth posts and market analysis. Personalized Mentorship: Receive tailored guidance to elevate your trading skill Insider Networking: Connect with like-minded professionals and leaders. Reviews 5 out of 5 18 total reviews 5 stars 4 stars 3 stars 2 stars 1 star M mobeenmajeed1989 1 year ago This is the best platform i had came across for digital currency. Their methods of teaching are exceptional.NBS believes in financial independence for everyone and provide their knowledge and services without any cost. Hats off to NBS and their team.",
    "1 year ago I've been using [Nbs platform] for the past year, and I'm thoroughly impressed with its performance. As a seasoned trader, I've tried various platforms, but this one stands out for its: User-friendly interface,Comprehensive market analysis,Reliable customer support and much more support from sir soh...",
    "Written 3 months after purchase DA Dynysh Ali 1 year ago I've been using [Nbs platform] for the past year, and I'm thoroughly impressed with its performance. As a seasoned trader, I've tried various platforms, but this one stands out for its: User-friendly interface,Comprehensive market analysis,Reliable customer support and much more",
    "1 year ago Great Platform dont miss out to such a discount opportunity .. Modreator are very exprience tooo & copreative & Sohail bhai expreience every one know level to level trading .. must join NBS",
    "About the creator N View profile nbsglobals @ nbsglobals • Joined Jun 2024 I&#x27;ve dedicated my career to empowering traders by providing them with the tools and insights needed to succeed in the Forex and Crypto markets. With NBS Globals, I aim to create a community where traders can thrive and achieve their financial goals. FAQs What social media platforms I can use to connect with NBS? How to contact NBS? Affiliates NG Become an affiliate NBS Globals 15% reward Earn money by bringing customers to NBS Globals. Every time a customer purchases using your link, you&#x27;ll earn a commission."
  ],
  "priceTokens": [
    "$14.90",
    "$14.90",
    "$14.90",
    "$1",
    "$1",
    "$1",
    "$22",
    "$1",
    "$1",
    "$1",
    "$1",
    "$1",
    "$2",
    "$1",
    "$2",
    "$2",
    "$2",
    "$2",
    "$3",
    "$3"
  ],
  "faq": [],
  "textSample": "Sign in NG Monthly Elites (+ ITM) Embrace the Charm of Monthly Elites &amp; Enjoy Free ITM Access! 5.0 ( 18 ) Other Join NBS Monthly for exclusive benefits! Get free Inner Circle, ITM Access, and elite perks to elevate your trading mentorship and connect with top achievers. $14.90 / month Pay Join Join 10 members Features Exclusive Inner Circle Access: Gain entry to a private community of top traders. Complimentary ITM Access: Enjoy advanced tools and insights to boost your tradin Premium Educational Content: Access in-depth posts and market analysis. Personalized Mentorship: Receive tailored guidance to elevate your trading skill Insider Networking: Connect with like-minded professionals and leaders. Reviews 5 out of 5 18 total reviews 5 stars 4 stars 3 stars 2 stars 1 star M mobeenmajeed1989 1 year ago This is the best platform i had came across for digital currency. Their methods of teaching are exceptional.NBS believes in financial independence for everyone and provide their knowledge and services without any cost. Hats off to NBS and their team. Written 21 days after purchase DA Dynysh Ali 1 year ago I've been using [Nbs platform] for the past year, and I'm thoroughly impressed with its performance. As a seasoned trader, I've tried various platforms, but this one stands out for its: User-friendly interface,Comprehensive market analysis,Reliable customer support and much more support from sir soh... Show more Written 3 months after purchase DA Dynysh Ali 1 year ago I've been using [Nbs platform] for the past year, and I'm thoroughly impressed with its performance. As a seasoned trader, I've tried various platforms, but this one stands out for its: User-friendly interface,Comprehensive market analysis,Reliable customer support and much more Written 1 month after purchase MA Muhammad Arbab 1 year ago Great Platform dont miss out to such a discount opportunity .. Modreator are very exprience tooo & copreative & Sohail bhai expreience every one know level to level trading .. must join NBS Written 4 days after purchase See all reviews About the creator N View profile nbsglobals @ nbsglobals • Joined Jun 2024 I&#x27;ve dedicated my career to empowering traders by providing them with the tools and insights needed to succeed in the Forex and Crypto markets. With NBS Globals, I aim to create a community where traders can thrive and achieve their financial goals. FAQs What social media platforms I can use to connect with NBS? How to contact NBS? Affiliates NG Become an affiliate NBS Globals 15% reward Earn money by bringing customers to NBS Globals. Every time a customer purchases using your link, you&#x27;ll earn a commission. Monthly Elites (+ ITM) $14.90 / month Join $14.90 / month Pay Join Pay Join Monthly Elites (+ ITM) | Whop",
  "finalUrl": "https://whop.com/yearly-itm/nbsglobals/",
  "fetchedAt": "2025-11-05T17:36:06.656Z",
  "textHash": "adfe3ff2eda5bcc394a7fe42be23fd137f72ef2929d9a5259a7cc0c95748acb5",
  "drilled": false
}