{
  "baseUrl": "https://whop.com/moontrades/yearly-access-b3/",
  "title": "Vip LIFETIME | Whop",
  "h1": "Vip LIFETIME",
  "bullets": [
    "Sign in MT Vip LIFETIME VIP LIFETIME 5.0 ( 220 ) Trading *ONE TIME CHARGE, says yearly but is one time fee don&#x27;t worry ğŸ™‚ğŸ¦ $499.00 / year Pay Join Features FULL ACCESS ğŸš¨ğŸŒ™",
    "LJ luis pereira jr 21 days ago Awesome ass community, dropped $40 on the cord and made double on the day- it's not js calls from moon but from other traders as well Written 3 hours after purchase",
    "SS Sebastian Santamaria 21 days ago Really good, Everything organized and professional, making money Written 6 minutes after purchase",
    "BA Ben Apelbaum 23 days ago Already made my money back and more Written 2 days after purchase",
    "IA Issa Abuayyash 23 days ago Best decision of my life ngl Written 2 days after purchase"
  ],
  "paras": [
    "Sign in MT Vip LIFETIME VIP LIFETIME 5.0 ( 220 ) Trading *ONE TIME CHARGE, says yearly but is one time fee don&#x27;t worry ğŸ™‚ğŸ¦",
    "FULL ACCESS ğŸš¨ğŸŒ™ Reviews 4.96 out of 5 220 total reviews 5 stars 4 stars 3 stars 2 stars 1 star LJ luis pereira jr 21 days ago Awesome ass community, dropped $40 on the cord and made double on the day- it's not js calls from moon but from other traders as well",
    "21 days ago Really good, Everything organized and professional, making money",
    "23 days ago Already made my money back and more",
    "23 days ago Best decision of my life ngl",
    "About the creator MT View profile Moon Trades @ moontrades7 â€¢ Joined Jul 2023 Teaching you how to become a profitable trader; $1k to $10k months. Affiliates MT Become an affiliate Moon Trades ğŸŒ™ 30% reward Earn money by bringing customers to Moon Trades ğŸŒ™. Every time a customer purchases using your link, you&#x27;ll earn a commission."
  ],
  "priceTokens": [
    "$499.00",
    "$40",
    "$1",
    "$10",
    "$499.00",
    "$499.00",
    "$1",
    "$1",
    "$1",
    "$22",
    "$1",
    "$1",
    "$1",
    "$1",
    "$1",
    "$2",
    "$1",
    "$2",
    "$2",
    "$2"
  ],
  "faq": [],
  "textSample": "Sign in MT Vip LIFETIME VIP LIFETIME 5.0 ( 220 ) Trading *ONE TIME CHARGE, says yearly but is one time fee don&#x27;t worry ğŸ™‚ğŸ¦ $499.00 / year Pay Join Features FULL ACCESS ğŸš¨ğŸŒ™ Reviews 4.96 out of 5 220 total reviews 5 stars 4 stars 3 stars 2 stars 1 star LJ luis pereira jr 21 days ago Awesome ass community, dropped $40 on the cord and made double on the day- it's not js calls from moon but from other traders as well Written 3 hours after purchase SS Sebastian Santamaria 21 days ago Really good, Everything organized and professional, making money Written 6 minutes after purchase BA Ben Apelbaum 23 days ago Already made my money back and more Written 2 days after purchase IA Issa Abuayyash 23 days ago Best decision of my life ngl Written 2 days after purchase See all reviews About the creator MT View profile Moon Trades @ moontrades7 â€¢ Joined Jul 2023 Teaching you how to become a profitable trader; $1k to $10k months. Affiliates MT Become an affiliate Moon Trades ğŸŒ™ 30% reward Earn money by bringing customers to Moon Trades ğŸŒ™. Every time a customer purchases using your link, you&#x27;ll earn a commission. Vip LIFETIME $499.00 / year Join $499.00 / year Pay Join Pay Join Vip LIFETIME | Whop",
  "finalUrl": "https://whop.com/moontrades/yearly-access-b3/",
  "fetchedAt": "2025-11-04T21:45:01.121Z",
  "textHash": "97e65e9c00fcbdb2e425f24e0597cb014b807392e990d53c269bcf54226dcb36",
  "drilled": false
}