{
  "baseUrl": "https://whop.com/novaselectanalytics/?a=alexburnett21",
  "title": "Nova Select Analytics | Whop",
  "h1": "Nova Select Analytics",
  "bullets": [
    "Powered by NA Nova Select Analytics Welcome to Nova Select Analytics, your trusted source for 100% transparent sports picks. Join our $1,000 to $100,000 Bankroll Challenge with FREE picks &amp; analysis posted daily. 5.0 ( 377 ) Contact seller Products Free Free $1,000 to $100,000 Challenge Join to Receive Free Picks Nova Free Plays (80000+ Users) 5.0 ( 311 ) $1,699.99 $1,000 to $100,000 Bankroll Challenge $1k to $100k Challenge Package 4.8 ( 11 ) $24.99 / week REAL $1,000 - $100,000 BET SLIPS WITH DAILY SPORTS PICKS Nova Select Analytics+ 4.7 ( 3 ) $849.00 Join the $1k to $100k Challenge Waitlist $100k Challenge Waitlist 5.0 ( 8 ) Contact seller Reviews T Tim • Nova Free Plays (80000+ Users) 1 month ago Hoo yeah Written 2 days after purchase",
    "RM Robinhood madman • Nova Free Plays (80000+ Users) 3 months ago Truly a game changer Written 5 days after purchase",
    "CG Caroline Guillory • Nova Free Plays (80000+ Users) 7 months ago I finally feel like I’m betting with an edge instead of guessing. Written 1 day after purchase",
    "JT Jose Tate • Nova Free Plays (80000+ Users) 7 months ago The 100k challenge showed me what’s possible when you stay disciplined. Written 1 day after purchase"
  ],
  "paras": [
    "NA Nova Select Analytics Welcome to Nova Select Analytics, your trusted source for 100% transparent sports picks. Join our $1,000 to $100,000 Bankroll Challenge with FREE picks &amp; analysis posted daily. 5.0 ( 377 ) Contact seller Products Free Free $1,000 to $100,000 Challenge Join to Receive Free Picks Nova Free Plays (80000+ Users) 5.0 ( 311 ) $1,699.99 $1,000 to $100,000 Bankroll Challenge $1k to $100k Challenge Package 4.8 ( 11 ) $24.99 / week REAL $1,000 - $100,000 BET SLIPS WITH DAILY SPORTS PICKS Nova Select Analytics+ 4.7 ( 3 ) $849.00 Join the $1k to $100k Challenge Waitlist $100k Challenge Waitlist 5.0 ( 8 ) Contact seller Reviews T Tim • Nova Free Plays (80000+ Users) 1 month ago Hoo yeah",
    "3 months ago Truly a game changer",
    "7 months ago I finally feel like I’m betting with an edge instead of guessing.",
    "7 months ago The 100k challenge showed me what’s possible when you stay disciplined."
  ],
  "priceTokens": [
    "$1,000",
    "$100,000",
    "$1,000",
    "$100,000",
    "$1,699.99",
    "$1,000",
    "$100,000",
    "$1",
    "$100",
    "$24.99",
    "$1,000",
    "$100,000",
    "$849.00",
    "$1",
    "$100",
    "$100",
    "$1",
    "$1",
    "$1",
    "$21"
  ],
  "faq": [],
  "textSample": "Powered by NA Nova Select Analytics Welcome to Nova Select Analytics, your trusted source for 100% transparent sports picks. Join our $1,000 to $100,000 Bankroll Challenge with FREE picks &amp; analysis posted daily. 5.0 ( 377 ) Contact seller Products Free Free $1,000 to $100,000 Challenge Join to Receive Free Picks Nova Free Plays (80000+ Users) 5.0 ( 311 ) $1,699.99 $1,000 to $100,000 Bankroll Challenge $1k to $100k Challenge Package 4.8 ( 11 ) $24.99 / week REAL $1,000 - $100,000 BET SLIPS WITH DAILY SPORTS PICKS Nova Select Analytics+ 4.7 ( 3 ) $849.00 Join the $1k to $100k Challenge Waitlist $100k Challenge Waitlist 5.0 ( 8 ) Contact seller Reviews T Tim • Nova Free Plays (80000+ Users) 1 month ago Hoo yeah Written 2 days after purchase RM Robinhood madman • Nova Free Plays (80000+ Users) 3 months ago Truly a game changer Written 5 days after purchase CG Caroline Guillory • Nova Free Plays (80000+ Users) 7 months ago I finally feel like I’m betting with an edge instead of guessing. Written 1 day after purchase JT Jose Tate • Nova Free Plays (80000+ Users) 7 months ago The 100k challenge showed me what’s possible when you stay disciplined. Written 1 day after purchase See all reviews Nova Select Analytics | Whop",
  "finalUrl": "https://whop.com/novaselectanalytics/?a=alexburnett21",
  "fetchedAt": "2025-11-05T09:20:30.679Z",
  "textHash": "a7227c96a7e5841a32dda2fb88fcecc656e8134c584661dddd02954caeeac7cf",
  "drilled": false
}