{
  "baseUrl": "https://whop.com/btz/marketplace-vip-vip-marketplace-only/",
  "title": "OFM Empire VIP Marketplace | Whop",
  "h1": "OFM Empire VIP Marketplace",
  "bullets": [
    "Sign in OV OFM Empire VIP Marketplace Access BTZ&#x27;s VIP Model Contract Marketplace 5.0 ( 95 ) Social media Join the exclusive VIP Marketplace to access high-quality model contracts for your OFM agency at half the price. $49.00 / month Pay Join Join 13 members Features Access to Premium Contract listings, before they get listed on the public MP.",
    "Exclusive high quality contracts",
    "This plan ONLY gives you access to the VIP marketplace",
    "SP sora pieron 7 months ago just joined after the call with tim regarding his twitter strategies, pure melody to hear these kind of people explaining their way of working Written 1 month after purchase",
    "AB Ariel Ben-zvy 1 year ago I have been doing OFM for a year and a half now, and never succeeded until now. Failure after failure after failure. I attribute most of my success now to this group. It's almost impossible to navigate OFM without running into bad actors, terrible and outdated strategies, etc. BTZ and DNK have done ... Show more Written 1 year after purchase",
    "DB daniel butterick 1 year ago Amazing group/course it is jamb packed with information. Written 14 days after purchase",
    "AC Adam Csizmar 1 year ago Worth it, solid group! Written 19 days after purchase"
  ],
  "paras": [
    "Sign in OV OFM Empire VIP Marketplace Access BTZ&#x27;s VIP Model Contract Marketplace 5.0 ( 95 ) Social media Join the exclusive VIP Marketplace to access high-quality model contracts for your OFM agency at half the price.",
    "$49.00 / month Pay Join Join 13 members Features Access to Premium Contract listings, before they get listed on the public MP. Exclusive high quality contracts This plan ONLY gives you access to the VIP marketplace Reviews 4.99 out of 5 95 total reviews 5 stars 4 stars 3 stars 2 stars 1 star SP sora pieron 7 months ago just joined after the call with tim regarding his twitter strategies, pure melody to hear these kind of people explaining their way of working",
    "1 year ago I have been doing OFM for a year and a half now, and never succeeded until now. Failure after failure after failure. I attribute most of my success now to this group. It's almost impossible to navigate OFM without running into bad actors, terrible and outdated strategies, etc. BTZ and DNK have done ...",
    "Written 1 year after purchase DB daniel butterick 1 year ago Amazing group/course it is jamb packed with information.",
    "1 year ago Worth it, solid group!",
    "About the creator B View profile BTZ @ btz • Joined Jun 2023 As the owner of a multi seven-figure OFM agency, I’ve built OFM Empire VIP to support serious agency owners looking to grow. Starting in the OFM space 3 years ago, I&#x27;ve grown to be the largest and most well known OFM group owner on Telegram. I created OFMEVIP to offer a mature, scam-free environment where members can learn, grow, and network along side me and other serious high earning agencies. FAQs Is there any more information on the 1 on 1 coaching? Will there be updates to the program? What&#x27;s the maximum number of members you plan to have in the VIP group? What is your refund &amp; cancellation policy? How does the auto billing work? Can I still join if I was previously banned or muted? Affiliates OV Become an affiliate OFM Empire VIP 30% reward Earn money by bringing customers to OFM Empire VIP. Every time a customer purchases using your link, you&#x27;ll earn a commission."
  ],
  "priceTokens": [
    "$49.00",
    "$49.00",
    "$49.00",
    "$1",
    "$1",
    "$1",
    "$22",
    "$1",
    "$1",
    "$1",
    "$1",
    "$1",
    "$2",
    "$1",
    "$2",
    "$2",
    "$2",
    "$2",
    "$3",
    "$3"
  ],
  "faq": [],
  "textSample": "Sign in OV OFM Empire VIP Marketplace Access BTZ&#x27;s VIP Model Contract Marketplace 5.0 ( 95 ) Social media Join the exclusive VIP Marketplace to access high-quality model contracts for your OFM agency at half the price. $49.00 / month Pay Join Join 13 members Features Access to Premium Contract listings, before they get listed on the public MP. Exclusive high quality contracts This plan ONLY gives you access to the VIP marketplace Reviews 4.99 out of 5 95 total reviews 5 stars 4 stars 3 stars 2 stars 1 star SP sora pieron 7 months ago just joined after the call with tim regarding his twitter strategies, pure melody to hear these kind of people explaining their way of working Written 1 month after purchase AB Ariel Ben-zvy 1 year ago I have been doing OFM for a year and a half now, and never succeeded until now. Failure after failure after failure. I attribute most of my success now to this group. It's almost impossible to navigate OFM without running into bad actors, terrible and outdated strategies, etc. BTZ and DNK have done ... Show more Written 1 year after purchase DB daniel butterick 1 year ago Amazing group/course it is jamb packed with information. Written 14 days after purchase AC Adam Csizmar 1 year ago Worth it, solid group! Written 19 days after purchase See all reviews About the creator B View profile BTZ @ btz • Joined Jun 2023 As the owner of a multi seven-figure OFM agency, I’ve built OFM Empire VIP to support serious agency owners looking to grow. Starting in the OFM space 3 years ago, I&#x27;ve grown to be the largest and most well known OFM group owner on Telegram. I created OFMEVIP to offer a mature, scam-free environment where members can learn, grow, and network along side me and other serious high earning agencies. FAQs Is there any more information on the 1 on 1 coaching? Will there be updates to the program? What&#x27;s the maximum number of members you plan to have in the VIP group? What is your refund &amp; cancellation policy? How does the auto billing work? Can I still join if I was previously banned or muted? Affiliates OV Become an affiliate OFM Empire VIP 30% reward Earn money by bringing customers to OFM Empire VIP. Every time a customer purchases using your link, you&#x27;ll earn a commission. OFM Empire VIP Marketplace $49.00 / month +2 options Join $49.00 / month 2 options Pay Join Pay Join OFM Empire VIP Marketplace | Whop",
  "finalUrl": "https://whop.com/btz/marketplace-vip-vip-marketplace-only/",
  "fetchedAt": "2025-11-04T21:46:09.925Z",
  "textHash": "7836a894dcafe1739a69ddd0303779e898119f947a2ca3b576622c102eddbc0e",
  "drilled": false
}