{
  "baseUrl": "https://whop.com/btz/ofmempire/",
  "title": "OFM Empire VIP Full Access | Whop",
  "h1": "OFM Empire VIP Full Access",
  "bullets": [
    "OFM Empire VIP Full Access | Whop Sign in OV OFM Empire VIP Full Access Join the Pinnacle of OFM Communities 5.0 ( 95 ) Social media The highest class community for serious OFM agencies. Join us to network, learn, and scale your agency. Gain exclusive insights and support. $99.00 / month Pay Join Join 512 members Features VIP group chat for professional, scam-free discussions",
    "Access to the A-Z OFM Launchpad Course covering all aspects of agency growth",
    "40 Daily Viral Trends for content replication on all platforms IG+TT+X+Threads",
    "VIP premium OF Marketplace with high-quality OF Creator Contracts",
    "$50 in vouchers for Reddit upvotes + Access to Premium Spoofer &amp; Downloader Bot",
    "SP sora pieron 7 months ago just joined after the call with tim regarding his twitter strategies, pure melody to hear these kind of people explaining their way of working Written 1 month after purchase",
    "AB Ariel Ben-zvy 1 year ago I have been doing OFM for a year and a half now, and never succeeded until now. Failure after failure after failure. I attribute most of my success now to this group. It's almost impossible to navigate OFM without running into bad actors, terrible and outdated strategies, etc. BTZ and DNK have done ... Show more Written 1 year after purchase",
    "DB daniel butterick 1 year ago Amazing group/course it is jamb packed with information. Written 14 days after purchase",
    "AC Adam Csizmar 1 year ago Worth it, solid group! Written 19 days after purchase"
  ],
  "paras": [
    "Sign in OV OFM Empire VIP Full Access Join the Pinnacle of OFM Communities 5.0 ( 95 ) Social media The highest class community for serious OFM agencies. Join us to network, learn, and scale your agency. Gain exclusive insights and support.",
    "$99.00 / month Pay Join Join 512 members Features VIP group chat for professional, scam-free discussions Access to the A-Z OFM Launchpad Course covering all aspects of agency growth 40 Daily Viral Trends for content replication on all platforms IG+TT+X+Threads VIP premium OF Marketplace with high-quality OF Creator Contracts $50 in vouchers for Reddit upvotes + Access to Premium Spoofer &amp; Downloader Bot Reviews 4.99 out of 5 95 total reviews 5 stars 4 stars 3 stars 2 stars 1 star SP sora pieron 7 months ago just joined after the call with tim regarding his twitter strategies, pure melody to hear these kind of people explaining their way of working",
    "1 year ago I have been doing OFM for a year and a half now, and never succeeded until now. Failure after failure after failure. I attribute most of my success now to this group. It's almost impossible to navigate OFM without running into bad actors, terrible and outdated strategies, etc. BTZ and DNK have done ...",
    "Written 1 year after purchase DB daniel butterick 1 year ago Amazing group/course it is jamb packed with information.",
    "1 year ago Worth it, solid group!",
    "About the creator B View profile BTZ @ btz • Joined Jun 2023 As the owner of a multi seven-figure OFM agency, I’ve built OFM Empire VIP to support serious agency owners looking to grow. Starting in the OFM space 3 years ago, I&#x27;ve grown to be the largest and most well known OFM group owner on Telegram. I created OFMEVIP to offer a mature, scam-free environment where members can learn, grow, and network along side me and other serious high earning agencies. FAQs Is there any more information on the 1 on 1 coaching? Will there be updates to the program? What&#x27;s the maximum number of members you plan to have in the VIP group? What is your refund &amp; cancellation policy? How does the auto billing work? Can I still join if I was previously banned or muted? Affiliates OV Become an affiliate OFM Empire VIP 30% reward Earn money by bringing customers to OFM Empire VIP. Every time a customer purchases using your link, you&#x27;ll earn a commission."
  ],
  "priceTokens": [
    "$99.00",
    "$50",
    "$99.00",
    "$99.00",
    "$1",
    "$1",
    "$1",
    "$22",
    "$1",
    "$1",
    "$1",
    "$1",
    "$1",
    "$2",
    "$1",
    "$2",
    "$2",
    "$2",
    "$2",
    "$3"
  ],
  "faq": [],
  "textSample": "OFM Empire VIP Full Access | Whop Sign in OV OFM Empire VIP Full Access Join the Pinnacle of OFM Communities 5.0 ( 95 ) Social media The highest class community for serious OFM agencies. Join us to network, learn, and scale your agency. Gain exclusive insights and support. $99.00 / month Pay Join Join 512 members Features VIP group chat for professional, scam-free discussions Access to the A-Z OFM Launchpad Course covering all aspects of agency growth 40 Daily Viral Trends for content replication on all platforms IG+TT+X+Threads VIP premium OF Marketplace with high-quality OF Creator Contracts $50 in vouchers for Reddit upvotes + Access to Premium Spoofer &amp; Downloader Bot Reviews 4.99 out of 5 95 total reviews 5 stars 4 stars 3 stars 2 stars 1 star SP sora pieron 7 months ago just joined after the call with tim regarding his twitter strategies, pure melody to hear these kind of people explaining their way of working Written 1 month after purchase AB Ariel Ben-zvy 1 year ago I have been doing OFM for a year and a half now, and never succeeded until now. Failure after failure after failure. I attribute most of my success now to this group. It's almost impossible to navigate OFM without running into bad actors, terrible and outdated strategies, etc. BTZ and DNK have done ... Show more Written 1 year after purchase DB daniel butterick 1 year ago Amazing group/course it is jamb packed with information. Written 14 days after purchase AC Adam Csizmar 1 year ago Worth it, solid group! Written 19 days after purchase See all reviews About the creator B View profile BTZ @ btz • Joined Jun 2023 As the owner of a multi seven-figure OFM agency, I’ve built OFM Empire VIP to support serious agency owners looking to grow. Starting in the OFM space 3 years ago, I&#x27;ve grown to be the largest and most well known OFM group owner on Telegram. I created OFMEVIP to offer a mature, scam-free environment where members can learn, grow, and network along side me and other serious high earning agencies. FAQs Is there any more information on the 1 on 1 coaching? Will there be updates to the program? What&#x27;s the maximum number of members you plan to have in the VIP group? What is your refund &amp; cancellation policy? How does the auto billing work? Can I still join if I was previously banned or muted? Affiliates OV Become an affiliate OFM Empire VIP 30% reward Earn money by bringing customers to OFM Empire VIP. Every time a customer purchases using your link, you&#x27;ll earn a commission. OFM Empire VIP Full Access $99.00 / month +1 option Join $99.00 / month 1 option Pay Join Pay Join",
  "finalUrl": "https://whop.com/btz/ofmempire/",
  "fetchedAt": "2025-11-05T17:25:41.375Z",
  "textHash": "3c9d575754c211dc89902b62a8b7b1af1898dc3e36758c499590a13d29c8eb1e",
  "drilled": false
}