{
  "baseUrl": "https://whop.com/owls-options-traders/owlstwitter/",
  "title": "Owls Options Traders - Twitter | Whop",
  "h1": "Owls Options Traders - Twitter",
  "bullets": [
    "Owls Options Traders - Twitter | Whop Sign in Unmute Unmute OT Owls Options Traders - Twitter Transform Your Trading Journey Now - Twitter 4.9 ( 953 ) Personal finance Join a vibrant Discord community with real-time trade ideas, AI-driven bots, and expert analysis. Perfect for all experience levels. $59.99 / 4 weeks Pay Join Join 466 members Reviews 4.92 out of 5 953 total reviews 5 stars 4 stars 3 stars 2 stars 1 star MM Michael Marticek 8 hours ago Awesome discord Written 15 days after purchase",
    "Z Zanny 6 days ago nothing but wins Written 15 days after purchase",
    "J Jeevs 9 days ago just be winning here Written 6 months after purchase",
    "TT Tyler Trant 15 days ago Great team!! Written 9 months after purchase"
  ],
  "paras": [
    "Sign in Unmute Unmute OT Owls Options Traders - Twitter Transform Your Trading Journey Now - Twitter 4.9 ( 953 ) Personal finance Join a vibrant Discord community with real-time trade ideas, AI-driven bots, and expert analysis. Perfect for all experience levels.",
    "$59.99 / 4 weeks Pay Join Join 466 members Reviews 4.92 out of 5 953 total reviews 5 stars 4 stars 3 stars 2 stars 1 star MM Michael Marticek 8 hours ago Awesome discord",
    "6 days ago nothing but wins",
    "9 days ago just be winning here",
    "15 days ago Great team!!",
    "About the creator A View profile $OWLS Admins @ owlsadmins • Joined May 2023 Owls Options Traders to help traders of all levels improve their skills and make informed decisions. Our community offers real-time trade alerts, market insights, and interactive discussions. Whether you&#x27;re new to trading or a seasoned pro, our group is a place to learn, grow, and profit together. FAQs What kind of support can I expect in the Discord community? Affiliates OT Become an affiliate Owls Options Traders 15% reward Earn money by bringing customers to Owls Options Traders. Every time a customer purchases using your link, you&#x27;ll earn a commission."
  ],
  "priceTokens": [
    "$59.99",
    "$59.99",
    "$59.99",
    "$1",
    "$1",
    "$1",
    "$22",
    "$1",
    "$1",
    "$1",
    "$1",
    "$1",
    "$2",
    "$1",
    "$2",
    "$2",
    "$2",
    "$2",
    "$3",
    "$3"
  ],
  "faq": [],
  "textSample": "Owls Options Traders - Twitter | Whop Sign in Unmute Unmute OT Owls Options Traders - Twitter Transform Your Trading Journey Now - Twitter 4.9 ( 953 ) Personal finance Join a vibrant Discord community with real-time trade ideas, AI-driven bots, and expert analysis. Perfect for all experience levels. $59.99 / 4 weeks Pay Join Join 466 members Reviews 4.92 out of 5 953 total reviews 5 stars 4 stars 3 stars 2 stars 1 star MM Michael Marticek 8 hours ago Awesome discord Written 15 days after purchase Z Zanny 6 days ago nothing but wins Written 15 days after purchase J Jeevs 9 days ago just be winning here Written 6 months after purchase TT Tyler Trant 15 days ago Great team!! Written 9 months after purchase See all reviews About the creator A View profile $OWLS Admins @ owlsadmins • Joined May 2023 Owls Options Traders to help traders of all levels improve their skills and make informed decisions. Our community offers real-time trade alerts, market insights, and interactive discussions. Whether you&#x27;re new to trading or a seasoned pro, our group is a place to learn, grow, and profit together. FAQs What kind of support can I expect in the Discord community? Affiliates OT Become an affiliate Owls Options Traders 15% reward Earn money by bringing customers to Owls Options Traders. Every time a customer purchases using your link, you&#x27;ll earn a commission. Owls Options Traders - Twitter $59.99 / 4 weeks +3 options Join $59.99 / 4 weeks 3 options Pay Join Pay Join",
  "finalUrl": "https://whop.com/owls-options-traders/owlstwitter/",
  "fetchedAt": "2025-11-05T17:27:32.329Z",
  "textHash": "858d19356af6fb74aa30a40bba4e362fcb6644728eedaa1db0c78e729145b530",
  "drilled": false
}