{
  "baseUrl": "https://whop.com/papa-tier/papapickz/",
  "title": "PapaPickz Money Making | Whop",
  "h1": "PapaPickz Money Making",
  "bullets": [
    "PapaPickz Money Making | Whop Sign in P PapaPickz Money Making Daily Sports Picks &amp; Insights 5.0 ( 22 ) Sports betting Join the 5-star rated premium sports picks service that serious bettors trust. Whether you’re betting on the NBA, NFL, or college sports, PapaPickz delivers nothing but the best $35.00 / month Pay Join Join 20 members Features Daily sports picks for all major leagues.",
    "Automatic group access after purchase.",
    "Comprehensive bankroll management guidance.",
    "MT Michael Taylor 10 months ago Kind hearted sports picker who's actually interested in maintaining a healthy community. 0 toxicity from this guy, a hard find in the sports picking world. Oh and the picks are good too! Written 3 months after purchase",
    "J joebocas 10 months ago He really knows his stuff love playing his pics has made me alot of $$ Written 3 months after purchase",
    "JE James Escamilla 1 year ago Great community,great atmosphere, well thought out picks with a high success rate. Cant recommend enough Written 12 days after purchase",
    "RP Romio Perez 1 year ago #1 PROP PICKS I’VE EVER SUBSCRIBED TO. W PAPA Written 13 days after purchase"
  ],
  "paras": [
    "Sign in P PapaPickz Money Making Daily Sports Picks &amp; Insights 5.0 ( 22 ) Sports betting Join the 5-star rated premium sports picks service that serious bettors trust. Whether you’re betting on the NBA, NFL, or college sports, PapaPickz delivers nothing but the best",
    "Join 20 members Features Daily sports picks for all major leagues. Automatic group access after purchase. Comprehensive bankroll management guidance. Reviews 5 out of 5 22 total reviews 5 stars 4 stars 3 stars 2 stars 1 star MT Michael Taylor 10 months ago Kind hearted sports picker who's actually interested in maintaining a healthy community. 0 toxicity from this guy, a hard find in the sports picking world. Oh and the picks are good too!",
    "10 months ago He really knows his stuff love playing his pics has made me alot of $$",
    "1 year ago Great community,great atmosphere, well thought out picks with a high success rate. Cant recommend enough",
    "1 year ago #1 PROP PICKS I’VE EVER SUBSCRIBED TO. W PAPA",
    "About the creator P View profile PapaPickz @ papapickz • Joined May 2024 I&#x27;ve dedicated my career to sports analysis, ensuring accuracy and transparency. My passion is delivering top picks and helping bettors succeed responsibly. FAQs How do you ensure the accuracy and reliability of your sports picks? How can I manage my bankroll effectively when engaging in sports gambling? What sets your sports gambling business apart from others in the industry? Affiliates P Become an affiliate PapaPickz 30% reward Earn money by bringing customers to PapaPickz. Every time a customer purchases using your link, you&#x27;ll earn a commission."
  ],
  "priceTokens": [
    "$35.00",
    "$35.00",
    "$35.00",
    "$1",
    "$1",
    "$1",
    "$22",
    "$1",
    "$1",
    "$1",
    "$1",
    "$1",
    "$2",
    "$1",
    "$2",
    "$2",
    "$2",
    "$2",
    "$3",
    "$3"
  ],
  "faq": [],
  "textSample": "PapaPickz Money Making | Whop Sign in P PapaPickz Money Making Daily Sports Picks &amp; Insights 5.0 ( 22 ) Sports betting Join the 5-star rated premium sports picks service that serious bettors trust. Whether you’re betting on the NBA, NFL, or college sports, PapaPickz delivers nothing but the best $35.00 / month Pay Join Join 20 members Features Daily sports picks for all major leagues. Automatic group access after purchase. Comprehensive bankroll management guidance. Reviews 5 out of 5 22 total reviews 5 stars 4 stars 3 stars 2 stars 1 star MT Michael Taylor 10 months ago Kind hearted sports picker who's actually interested in maintaining a healthy community. 0 toxicity from this guy, a hard find in the sports picking world. Oh and the picks are good too! Written 3 months after purchase J joebocas 10 months ago He really knows his stuff love playing his pics has made me alot of $$ Written 3 months after purchase JE James Escamilla 1 year ago Great community,great atmosphere, well thought out picks with a high success rate. Cant recommend enough Written 12 days after purchase RP Romio Perez 1 year ago #1 PROP PICKS I’VE EVER SUBSCRIBED TO. W PAPA Written 13 days after purchase See all reviews About the creator P View profile PapaPickz @ papapickz • Joined May 2024 I&#x27;ve dedicated my career to sports analysis, ensuring accuracy and transparency. My passion is delivering top picks and helping bettors succeed responsibly. FAQs How do you ensure the accuracy and reliability of your sports picks? How can I manage my bankroll effectively when engaging in sports gambling? What sets your sports gambling business apart from others in the industry? Affiliates P Become an affiliate PapaPickz 30% reward Earn money by bringing customers to PapaPickz. Every time a customer purchases using your link, you&#x27;ll earn a commission. PapaPickz Money Making $35.00 / month Join $35.00 / month Pay Join Pay Join",
  "finalUrl": "https://whop.com/papa-tier/papapickz/",
  "fetchedAt": "2025-11-05T17:37:22.488Z",
  "textHash": "b9981405d9a8dceeb88ef017c585c8fed861886587d9ad67fdd0c20b16de32d8",
  "drilled": false
}