{
  "baseUrl": "https://whop.com/parlayminds/?a=alexburnett21",
  "title": "Parlay Minds | Whop",
  "h1": "Parlay Minds",
  "bullets": [
    "Powered by PM Parlay Minds Incoming 5.0 ( 30 ) Contact seller Products $10.00 / 3 days Premium Plays: PrizePicks, FanDuel, Moneylines, &amp; More! Parlay Minds Premium 5.0 ( 22 ) Premium Plays: PrizePicks, FanDuel, Moneylines, &amp; More! 2 Week Premium Discord Access 5.0 ( 8 ) Contact seller Reviews AB Angel Baez â€¢ Parlay Minds Premium 4 hours ago Best discord ! Always with the best Plays !ðŸ”¥ Written 2 hours after purchase",
    "1LuhDal__ â€¢ 2 Week Premium Discord Access 1 day ago Tap innn Written 5 minutes after purchase",
    "RD Rodney Duran â€¢ Parlay Minds Premium 5 days ago After 1 week of being a member i have been able to stay in the green. Written 2 days after purchase",
    "KP Kevin Penaloza â€¢ Parlay Minds Premium 5 days ago Discords is fire Written 2 days after purchase"
  ],
  "paras": [
    "PM Parlay Minds Incoming 5.0 ( 30 ) Contact seller Products $10.00 / 3 days Premium Plays: PrizePicks, FanDuel, Moneylines, &amp; More! Parlay Minds Premium 5.0 ( 22 ) Premium Plays: PrizePicks, FanDuel, Moneylines, &amp; More! 2 Week Premium Discord Access 5.0 ( 8 ) Contact seller Reviews AB Angel Baez â€¢ Parlay Minds Premium 4 hours ago Best discord ! Always with the best Plays !ðŸ”¥",
    "1 day ago Tap innn",
    "5 days ago After 1 week of being a member i have been able to stay in the green.",
    "5 days ago Discords is fire"
  ],
  "priceTokens": [
    "$10.00",
    "$1",
    "$1",
    "$1",
    "$21",
    "$1",
    "$1",
    "$1",
    "$1",
    "$28",
    "$1",
    "$28",
    "$28",
    "$28",
    "$28",
    "$3",
    "$3",
    "$3",
    "$10",
    "$100,000"
  ],
  "faq": [],
  "textSample": "Powered by PM Parlay Minds Incoming 5.0 ( 30 ) Contact seller Products $10.00 / 3 days Premium Plays: PrizePicks, FanDuel, Moneylines, &amp; More! Parlay Minds Premium 5.0 ( 22 ) Premium Plays: PrizePicks, FanDuel, Moneylines, &amp; More! 2 Week Premium Discord Access 5.0 ( 8 ) Contact seller Reviews AB Angel Baez â€¢ Parlay Minds Premium 4 hours ago Best discord ! Always with the best Plays !ðŸ”¥ Written 2 hours after purchase 1LuhDal__ â€¢ 2 Week Premium Discord Access 1 day ago Tap innn Written 5 minutes after purchase RD Rodney Duran â€¢ Parlay Minds Premium 5 days ago After 1 week of being a member i have been able to stay in the green. Written 2 days after purchase KP Kevin Penaloza â€¢ Parlay Minds Premium 5 days ago Discords is fire Written 2 days after purchase See all reviews Parlay Minds | Whop",
  "finalUrl": "https://whop.com/parlayminds/?a=alexburnett21",
  "fetchedAt": "2025-11-05T10:33:24.986Z",
  "textHash": "94b57c6479617bff5f817f40b01a50d98b5df1cc9a28c44a214d9aa569ab27b2",
  "drilled": false
}