{
  "baseUrl": "https://whop.com/peloswing/?a=alexburnett21",
  "title": "PeloSwing | Whop",
  "h1": "PeloSwing",
  "bullets": [
    "Powered by P PeloSwing We created PeloSwing to help stock market traders stay ahead of the curve with timely alerts and expert analysis. With years of experience in market analysis and stock trading, I wanted to build a pla... More 4.9 ( 298 ) Contact seller Products Unmute $44.99 / month Free trial Bringing Wall Street to Main Street Premium Access (Alerts) 4.9 ( 169 ) $49.99 / month Free trial AI Trading Tools &amp; Options Flow Bots PeloSwing Smart Money 5.0 ( 8 ) $84.99 / month Premium Access + Smart Money for One Great Price! BUNDLE DEAL - ALERTS + BOTS 4.3 ( 11 ) $50.00 Learn the Basics of Trading! PeloSchool New Contact seller Reviews CD Christian Diaz • Premium Access (Alerts) 4 days ago Great group that provides expertise and guidance day in and day out Written 1 year after purchase",
    "ZJ Zachary Johanson • Premium Access (Alerts) 11 days ago The best Discord community I’ve ever been a part of! Pelo’s alerts are amazing and it’s nearly Written 7 months after purchase",
    "KC Kevin Croley • Premium Access (Alerts) 20 days ago The best discord out there for trading!! Pelo and crew will change your life as it has mine!! Not only will you become profitable instantly, you’ll learn important skills necessary to become an option trader. Written 4 months after purchase",
    "CC César Miguel Canha Rabi da Costa Rabi da Costa • Premium Access (Alerts) 1 month ago Too good to be real, but it is! Thanks Pelo! Written 3 months after purchase"
  ],
  "paras": [
    "P PeloSwing We created PeloSwing to help stock market traders stay ahead of the curve with timely alerts and expert analysis. With years of experience in market analysis and stock trading, I wanted to build a pla... More 4.9 ( 298 ) Contact seller Products Unmute $44.99 / month Free trial Bringing Wall Street to Main Street Premium Access (Alerts) 4.9 ( 169 ) $49.99 / month Free trial AI Trading Tools &amp; Options Flow Bots PeloSwing Smart Money 5.0 ( 8 ) $84.99 / month Premium Access + Smart Money for One Great Price! BUNDLE DEAL - ALERTS + BOTS 4.3 ( 11 ) $50.00 Learn the Basics of Trading! PeloSchool New Contact seller Reviews CD Christian Diaz • Premium Access (Alerts) 4 days ago Great group that provides expertise and guidance day in and day out",
    "11 days ago The best Discord community I’ve ever been a part of! Pelo’s alerts are amazing and it’s nearly",
    "20 days ago The best discord out there for trading!! Pelo and crew will change your life as it has mine!! Not only will you become profitable instantly, you’ll learn important skills necessary to become an option trader.",
    "1 month ago Too good to be real, but it is! Thanks Pelo!"
  ],
  "priceTokens": [
    "$44.99",
    "$49.99",
    "$84.99",
    "$50.00",
    "$1",
    "$1",
    "$1",
    "$21",
    "$1",
    "$1",
    "$1",
    "$1",
    "$28",
    "$1",
    "$28",
    "$28",
    "$28",
    "$28",
    "$3",
    "$3"
  ],
  "faq": [],
  "textSample": "Powered by P PeloSwing We created PeloSwing to help stock market traders stay ahead of the curve with timely alerts and expert analysis. With years of experience in market analysis and stock trading, I wanted to build a pla... More 4.9 ( 298 ) Contact seller Products Unmute $44.99 / month Free trial Bringing Wall Street to Main Street Premium Access (Alerts) 4.9 ( 169 ) $49.99 / month Free trial AI Trading Tools &amp; Options Flow Bots PeloSwing Smart Money 5.0 ( 8 ) $84.99 / month Premium Access + Smart Money for One Great Price! BUNDLE DEAL - ALERTS + BOTS 4.3 ( 11 ) $50.00 Learn the Basics of Trading! PeloSchool New Contact seller Reviews CD Christian Diaz • Premium Access (Alerts) 4 days ago Great group that provides expertise and guidance day in and day out Written 1 year after purchase ZJ Zachary Johanson • Premium Access (Alerts) 11 days ago The best Discord community I’ve ever been a part of! Pelo’s alerts are amazing and it’s nearly Written 7 months after purchase KC Kevin Croley • Premium Access (Alerts) 20 days ago The best discord out there for trading!! Pelo and crew will change your life as it has mine!! Not only will you become profitable instantly, you’ll learn important skills necessary to become an option trader. Written 4 months after purchase CC César Miguel Canha Rabi da Costa Rabi da Costa • Premium Access (Alerts) 1 month ago Too good to be real, but it is! Thanks Pelo! Written 3 months after purchase See all reviews PeloSwing | Whop",
  "finalUrl": "https://whop.com/peloswing/?a=alexburnett21",
  "fetchedAt": "2025-11-05T09:11:56.787Z",
  "textHash": "2a8fb3b34390cde06388c9d0bf06a9547f06a3c4e4c1035ebdbf99b1a6e6c6d5",
  "drilled": false
}