{
  "baseUrl": "https://whop.com/ptmtrading/phantomtrading/",
  "title": "All Access | Whop",
  "h1": "All Access",
  "bullets": [
    "All Access | Whop Sign in Unmute Unmute Unmute Unmute Unmute Unmute Unmute Unmute Unmute Unmute Unmute Unmute Unmute Unmute Unmute Unmute PT All Access Clarity in process. Confidence in execution. 5.0 ( 25 ) Trading Master momentum trading with clarity. Phantom Trading teaches a structured, repeatable process using supply &amp; demand, market structure, and liquidity to build precision, confidence, and consistency in every trade. $100.00 / month Pay Join Features Follow a systemized process built for precision, confidence, and consistency.",
    "Master momentum trading through structure, order flow, and liquidity.",
    "Refine execution with real trade breakdowns, reviews, and live guidance.",
    "Stay sharp with daily outlooks, live sessions, and actionable market insights.",
    "Join a global community of traders mastering process over emotion.",
    "AT Andrej Trunek 17 days ago Game-changing information :) Written 2 days after purchase",
    "HA Harry Axe 1 month ago The best trading community! Written 4 months after purchase",
    "T TradeGuru 1 month ago phantom is the best Written 1 year after purchase",
    "BF Ben Forrester 2 months ago Best value for money course you will get, been in here 2 years, passed my first funded challenge after 5 months. If you are serious about learning you have to put the work in but Phantom will definitely help you get over the finish line. Written 3 days after purchase"
  ],
  "paras": [
    "Sign in Unmute Unmute Unmute Unmute Unmute Unmute Unmute Unmute Unmute Unmute Unmute Unmute Unmute Unmute Unmute Unmute PT All Access Clarity in process. Confidence in execution. 5.0 ( 25 ) Trading Master momentum trading with clarity. Phantom Trading teaches a structured, repeatable process using supply &amp; demand, market structure, and liquidity to build precision, confidence, and consistency in every trade.",
    "$100.00 / month Pay Join Features Follow a systemized process built for precision, confidence, and consistency. Master momentum trading through structure, order flow, and liquidity. Refine execution with real trade breakdowns, reviews, and live guidance. Stay sharp with daily outlooks, live sessions, and actionable market insights. Join a global community of traders mastering process over emotion. Reviews 5 out of 5 25 total reviews 5 stars 4 stars 3 stars 2 stars 1 star AT Andrej Trunek 17 days ago Game-changing information :)",
    "1 month ago The best trading community!",
    "1 month ago phantom is the best",
    "2 months ago Best value for money course you will get, been in here 2 years, passed my first funded challenge after 5 months. If you are serious about learning you have to put the work in but Phantom will definitely help you get over the finish line.",
    "About the creator BW View profile Brad Wyse @ bradwyse • Joined Oct 2024 Clarity in process. Confidence in execution. Master momentum trading with clarity. Phantom Trading teaches a structured, repeatable process using supply &amp; demand, market structure, and liquidity to build precision, confidence, and consistency in every trade. FAQs How can Phantom Trading help me become a consistent trader? What’s included in the Phantom Trading membership? Is Phantom Trading suitable for beginners? How does Phantom Trading support funded traders? How does the community support my growth as a trader? Affiliates PT Become an affiliate Phantom Trading 30% reward Earn money by bringing customers to Phantom Trading. Every time a customer purchases using your link, you&#x27;ll earn a commission."
  ],
  "priceTokens": [
    "$100.00",
    "$100.00",
    "$100.00",
    "$1",
    "$1",
    "$1",
    "$22",
    "$1",
    "$1",
    "$1",
    "$1",
    "$1",
    "$2",
    "$1",
    "$2",
    "$2",
    "$2",
    "$2",
    "$3",
    "$3"
  ],
  "faq": [],
  "textSample": "All Access | Whop Sign in Unmute Unmute Unmute Unmute Unmute Unmute Unmute Unmute Unmute Unmute Unmute Unmute Unmute Unmute Unmute Unmute PT All Access Clarity in process. Confidence in execution. 5.0 ( 25 ) Trading Master momentum trading with clarity. Phantom Trading teaches a structured, repeatable process using supply &amp; demand, market structure, and liquidity to build precision, confidence, and consistency in every trade. $100.00 / month Pay Join Features Follow a systemized process built for precision, confidence, and consistency. Master momentum trading through structure, order flow, and liquidity. Refine execution with real trade breakdowns, reviews, and live guidance. Stay sharp with daily outlooks, live sessions, and actionable market insights. Join a global community of traders mastering process over emotion. Reviews 5 out of 5 25 total reviews 5 stars 4 stars 3 stars 2 stars 1 star AT Andrej Trunek 17 days ago Game-changing information :) Written 2 days after purchase HA Harry Axe 1 month ago The best trading community! Written 4 months after purchase T TradeGuru 1 month ago phantom is the best Written 1 year after purchase BF Ben Forrester 2 months ago Best value for money course you will get, been in here 2 years, passed my first funded challenge after 5 months. If you are serious about learning you have to put the work in but Phantom will definitely help you get over the finish line. Written 3 days after purchase See all reviews About the creator BW View profile Brad Wyse @ bradwyse • Joined Oct 2024 Clarity in process. Confidence in execution. Master momentum trading with clarity. Phantom Trading teaches a structured, repeatable process using supply &amp; demand, market structure, and liquidity to build precision, confidence, and consistency in every trade. FAQs How can Phantom Trading help me become a consistent trader? What’s included in the Phantom Trading membership? Is Phantom Trading suitable for beginners? How does Phantom Trading support funded traders? How does the community support my growth as a trader? Affiliates PT Become an affiliate Phantom Trading 30% reward Earn money by bringing customers to Phantom Trading. Every time a customer purchases using your link, you&#x27;ll earn a commission. All Access $100.00 / month +5 options Join $100.00 / month 5 options Pay Join Pay Join",
  "finalUrl": "https://whop.com/ptmtrading/phantomtrading/",
  "fetchedAt": "2025-11-04T21:36:19.180Z",
  "textHash": "afaff29bb06ae8507ea136525bc225aed81ee7932912a182ab495974d0c891d3",
  "drilled": false
}