{
  "baseUrl": "https://whop.com/pickcity/?a=alexburnett21",
  "title": "Pick City | Whop",
  "h1": "Pick City",
  "bullets": [
    "Powered by PC Pick City There&#x27;s a reason why members leave other groups to join us... because we actually show proof of wins, testimonials, full transparency of numbers, and we have the funniest chat ever WHILE profiting. En... More 4.8 ( 172 ) Contact seller Products Unmute $39.99 / month The #1 Most Profitable Sports Betting Group Pick City Monthly 4.7 ( 51 ) Unmute $19.99 / week The #1 Most Profitable Sports Betting Group Pick City Weekly 4.3 ( 15 ) Contact seller Reviews ME Marsha V Escalera ‚Ä¢ Pick City Weekly 19 days ago Up 1k in a week‚úÖ Written 8 months after purchase",
    "J jordan ‚Ä¢ Pick City Monthly 22 days ago been here a month & up 1kü§ùthe goat üêê Written 1 month after purchase",
    "W whoops ‚Ä¢ Pick City Weekly 2 months ago Great! Written 5 days after purchase",
    "T Ty ‚Ä¢ Pick City Weekly 4 months ago literally just made my money back this is no joke bro is the real deal. Written 2 months after purchase"
  ],
  "paras": [
    "PC Pick City There&#x27;s a reason why members leave other groups to join us... because we actually show proof of wins, testimonials, full transparency of numbers, and we have the funniest chat ever WHILE profiting. En... More 4.8 ( 172 ) Contact seller Products Unmute $39.99 / month The #1 Most Profitable Sports Betting Group Pick City Monthly 4.7 ( 51 ) Unmute $19.99 / week The #1 Most Profitable Sports Betting Group Pick City Weekly 4.3 ( 15 ) Contact seller Reviews ME Marsha V Escalera ‚Ä¢ Pick City Weekly 19 days ago Up 1k in a week‚úÖ",
    "22 days ago been here a month & up 1kü§ùthe goat üêê",
    "2 months ago Great!",
    "4 months ago literally just made my money back this is no joke bro is the real deal."
  ],
  "priceTokens": [
    "$39.99",
    "$19.99",
    "$1",
    "$1",
    "$1",
    "$21",
    "$1",
    "$1",
    "$1",
    "$1",
    "$28",
    "$1",
    "$28",
    "$28",
    "$28",
    "$28",
    "$3",
    "$3",
    "$3",
    "$10"
  ],
  "faq": [],
  "textSample": "Powered by PC Pick City There&#x27;s a reason why members leave other groups to join us... because we actually show proof of wins, testimonials, full transparency of numbers, and we have the funniest chat ever WHILE profiting. En... More 4.8 ( 172 ) Contact seller Products Unmute $39.99 / month The #1 Most Profitable Sports Betting Group Pick City Monthly 4.7 ( 51 ) Unmute $19.99 / week The #1 Most Profitable Sports Betting Group Pick City Weekly 4.3 ( 15 ) Contact seller Reviews ME Marsha V Escalera ‚Ä¢ Pick City Weekly 19 days ago Up 1k in a week‚úÖ Written 8 months after purchase J jordan ‚Ä¢ Pick City Monthly 22 days ago been here a month & up 1kü§ùthe goat üêê Written 1 month after purchase W whoops ‚Ä¢ Pick City Weekly 2 months ago Great! Written 5 days after purchase T Ty ‚Ä¢ Pick City Weekly 4 months ago literally just made my money back this is no joke bro is the real deal. Written 2 months after purchase See all reviews Pick City | Whop",
  "finalUrl": "https://whop.com/pickcity/?a=alexburnett21",
  "fetchedAt": "2025-11-04T21:35:12.085Z",
  "textHash": "6023447606a9c5dc48eabe34207678f1b4c94d992e1512f5b99dde39c77f3c22",
  "drilled": false
}