{
  "baseUrl": "https://whop.com/snewj-props/?a=alexburnett21",
  "title": "SnewJ Props | Whop",
  "h1": "SnewJ Props",
  "bullets": [
    "Powered by SP SnewJ Props With over a decade of experience. SnewJ Props shares Players Prop Picks that are highly researched by Elite Expert(s)-with immense knowledge about the game. All picks have high chances of success. 4.5 ( 637 ) Contact seller Products Unmute $9.99 / 2 days BIGGEST SPORTS COMMUNITY IN THE WORLD - 130,000+ CLIENTS Player Props (VIP) 4.4 ( 275 ) Unmute $49.95 / month BIGGEST SPORTS COMMUNITY IN THE WORLD - 130,000+ CLIENTS Straight Plays (ELITE) 4.4 ( 64 ) Unmute $99.00 / week Free trial BIGGEST SPORTS COMMUNITY IN THE WORLD - 130,000+ CLIENTS *DIAMOND (Bankroll Management) 4.9 ( 14 ) Unmute $150.00 BIGGEST SPORTS COMMUNITY IN THE WORLD - 130,000+ CLIENTS Max Play Of The Day 5.0 ( 1 ) Unmute Free BIGGEST SPORTS COMMUNITY IN THE WORLD - 130,000+ CLIENTS Free Access 4.6 ( 278 ) Contact seller Reviews M motionman • Player Props (VIP) 12 hours ago Ngl Written 1 day after purchase",
    "AD Ace daGoon • Player Props (VIP) 2 days ago Bro ion care what nobody say I be hitting bro the goat Fs !!! You jus gotta realize iss hit or miss n you but I’ve profited way more than I’ve lost Written 5 days after purchase",
    "DB DA BO$$ • Straight Plays (ELITE) 3 days ago SUPERDOPE MY BOI !!!!! YEEEEEEE!!!! Written 1 day after purchase",
    "BH Breyon HEATH • Free Access 4 days ago l lol Written 1 year after purchase"
  ],
  "paras": [
    "SP SnewJ Props With over a decade of experience. SnewJ Props shares Players Prop Picks that are highly researched by Elite Expert(s)-with immense knowledge about the game. All picks have high chances of success. 4.5 ( 637 ) Contact seller Products Unmute $9.99 / 2 days BIGGEST SPORTS COMMUNITY IN THE WORLD - 130,000+ CLIENTS Player Props (VIP) 4.4 ( 275 ) Unmute $49.95 / month BIGGEST SPORTS COMMUNITY IN THE WORLD - 130,000+ CLIENTS Straight Plays (ELITE) 4.4 ( 64 ) Unmute $99.00 / week Free trial BIGGEST SPORTS COMMUNITY IN THE WORLD - 130,000+ CLIENTS *DIAMOND (Bankroll Management) 4.9 ( 14 ) Unmute $150.00 BIGGEST SPORTS COMMUNITY IN THE WORLD - 130,000+ CLIENTS Max Play Of The Day 5.0 ( 1 ) Unmute Free BIGGEST SPORTS COMMUNITY IN THE WORLD - 130,000+ CLIENTS Free Access 4.6 ( 278 ) Contact seller Reviews M motionman • Player Props (VIP) 12 hours ago Ngl",
    "2 days ago Bro ion care what nobody say I be hitting bro the goat Fs !!! You jus gotta realize iss hit or miss n you but I’ve profited way more than I’ve lost",
    "3 days ago SUPERDOPE MY BOI !!!!! YEEEEEEE!!!!",
    "4 days ago l lol"
  ],
  "priceTokens": [
    "$9.99",
    "$49.95",
    "$99.00",
    "$150.00",
    "$1",
    "$1",
    "$1",
    "$21",
    "$1",
    "$1",
    "$1",
    "$1",
    "$28",
    "$1",
    "$28",
    "$28",
    "$28",
    "$28",
    "$3",
    "$3"
  ],
  "faq": [],
  "textSample": "Powered by SP SnewJ Props With over a decade of experience. SnewJ Props shares Players Prop Picks that are highly researched by Elite Expert(s)-with immense knowledge about the game. All picks have high chances of success. 4.5 ( 637 ) Contact seller Products Unmute $9.99 / 2 days BIGGEST SPORTS COMMUNITY IN THE WORLD - 130,000+ CLIENTS Player Props (VIP) 4.4 ( 275 ) Unmute $49.95 / month BIGGEST SPORTS COMMUNITY IN THE WORLD - 130,000+ CLIENTS Straight Plays (ELITE) 4.4 ( 64 ) Unmute $99.00 / week Free trial BIGGEST SPORTS COMMUNITY IN THE WORLD - 130,000+ CLIENTS *DIAMOND (Bankroll Management) 4.9 ( 14 ) Unmute $150.00 BIGGEST SPORTS COMMUNITY IN THE WORLD - 130,000+ CLIENTS Max Play Of The Day 5.0 ( 1 ) Unmute Free BIGGEST SPORTS COMMUNITY IN THE WORLD - 130,000+ CLIENTS Free Access 4.6 ( 278 ) Contact seller Reviews M motionman • Player Props (VIP) 12 hours ago Ngl Written 1 day after purchase AD Ace daGoon • Player Props (VIP) 2 days ago Bro ion care what nobody say I be hitting bro the goat Fs !!! You jus gotta realize iss hit or miss n you but I’ve profited way more than I’ve lost Written 5 days after purchase DB DA BO$$ • Straight Plays (ELITE) 3 days ago SUPERDOPE MY BOI !!!!! YEEEEEEE!!!! Written 1 day after purchase BH Breyon HEATH • Free Access 4 days ago l lol Written 1 year after purchase See all reviews SnewJ Props | Whop",
  "finalUrl": "https://whop.com/snewj-props/?a=alexburnett21",
  "fetchedAt": "2025-11-05T17:25:38.765Z",
  "textHash": "b14961829f733c70670a55fad226d722bd5f62aa6ce079f84fb0b9b8627e87a5",
  "drilled": false
}