{
  "baseUrl": "https://whop.com/pluginn/weekly-access-54/",
  "title": "Plugged Inn Weekly Access | Whop",
  "h1": "Plugged Inn Weekly Access",
  "bullets": [
    "Sign in P Plugged Inn Weekly Access Join Plugged Inn to take more W&#x27;s! 4.9 ( 199 ) Reselling Plugged Inn is the top hub for Pokemon, Sneakers, networking, sports picks, and exclusive intel. Join our community and get ahead! $15.00 / week Pay Join Join 1 member Features Daily Sports Picks for a winning streak with premier prize insights.",
    "Advanced Analytical Data for informed betting decisions.",
    "Exclusive Early Sneaker Intel for timely opportunities.",
    "Premium Networking to connect with entrepreneurs.",
    "Auto Checkout to secure profitable items effortlessly.",
    "I IR.Collectibles98 16 days ago Let me just say I came into this dsicord group blind folded. Didnâ€™t know a thing about Pokemon or how things work. The community here is extremely helpful to say the least, you often find support or help by other members, free of judgement. The amount of time and money invested surely paid off. Written 1 month after purchase",
    "PE Peter elizalde 16 days ago Pluggedinn has been ðŸ”¥ðŸ”¥ after I signed up and joined up, cause before Pluggedinn I also strikeout on online release. But after joining now I finally have been able to cop the online drops for PokÃ©mon cards thanks to the quick links str8 to the drop sites thanks to Stins and the Pluggedinn group ðŸ™Œï¿½... Show more Written 3 months after purchase",
    "JD Jovanny Duran 16 days ago Kinda confusing at first but gets easier, they got a great system to show you how to cop many items withought even having to try.They get you the assistance you need when trying to buy something and the price is well worth it. Best Cook group especially for tcg. Written 19 days after purchase",
    "K Krazo_Kid 16 days ago PluggedInn Premium is where all the action is at! Cop hype product like a pro alongside a community of like-minded people. Take the first step and join, you wont be disappointed!! Written 1 month after purchase"
  ],
  "paras": [
    "Sign in P Plugged Inn Weekly Access Join Plugged Inn to take more W&#x27;s! 4.9 ( 199 ) Reselling Plugged Inn is the top hub for Pokemon, Sneakers, networking, sports picks, and exclusive intel. Join our community and get ahead!",
    "Join 1 member Features Daily Sports Picks for a winning streak with premier prize insights. Advanced Analytical Data for informed betting decisions. Exclusive Early Sneaker Intel for timely opportunities. Premium Networking to connect with entrepreneurs. Auto Checkout to secure profitable items effortlessly. Reviews 4.94 out of 5 199 total reviews 5 stars 4 stars 3 stars 2 stars 1 star I IR.Collectibles98 16 days ago Let me just say I came into this dsicord group blind folded. Didnâ€™t know a thing about Pokemon or how things work. The community here is extremely helpful to say the least, you often find support or help by other members, free of judgement. The amount of time and money invested surely paid off.",
    "16 days ago Pluggedinn has been ðŸ”¥ðŸ”¥ after I signed up and joined up, cause before Pluggedinn I also strikeout on online release. But after joining now I finally have been able to cop the online drops for PokÃ©mon cards thanks to the quick links str8 to the drop sites thanks to Stins and the Pluggedinn group ðŸ™Œï¿½...",
    "Written 3 months after purchase JD Jovanny Duran 16 days ago Kinda confusing at first but gets easier, they got a great system to show you how to cop many items withought even having to try.They get you the assistance you need when trying to buy something and the price is well worth it. Best Cook group especially for tcg.",
    "16 days ago PluggedInn Premium is where all the action is at! Cop hype product like a pro alongside a community of like-minded people. Take the first step and join, you wont be disappointed!!",
    "About the creator PI View profile Plugged Inn @ stinszn â€¢ Joined Dec 2022 Plugged Inn is the #1 destination for collectors and resellers. For over eight years, weâ€™ve redefined what it means to stay plugged in â€” delivering real-time alerts, early links, and powerful tools that help our members secure the most coveted drops across sneakers, PokÃ©mon, and collectibles. Backed by a community built on trust, speed, and results, Plugged Inn turns every release into an opportun FAQs Why choose us? Do I need bots or extra software? How much can I expect to cop in a month? How fast can I see results? What kind of drops do you cover? Affiliates P Become an affiliate PluggedInn 30% reward Earn money by bringing customers to PluggedInn. Every time a customer purchases using your link, you&#x27;ll earn a commission."
  ],
  "priceTokens": [
    "$15.00",
    "$15.00",
    "$15.00",
    "$1",
    "$1",
    "$1",
    "$22",
    "$1",
    "$1",
    "$1",
    "$1",
    "$1",
    "$2",
    "$1",
    "$2",
    "$2",
    "$2",
    "$2",
    "$3",
    "$3"
  ],
  "faq": [],
  "textSample": "Sign in P Plugged Inn Weekly Access Join Plugged Inn to take more W&#x27;s! 4.9 ( 199 ) Reselling Plugged Inn is the top hub for Pokemon, Sneakers, networking, sports picks, and exclusive intel. Join our community and get ahead! $15.00 / week Pay Join Join 1 member Features Daily Sports Picks for a winning streak with premier prize insights. Advanced Analytical Data for informed betting decisions. Exclusive Early Sneaker Intel for timely opportunities. Premium Networking to connect with entrepreneurs. Auto Checkout to secure profitable items effortlessly. Reviews 4.94 out of 5 199 total reviews 5 stars 4 stars 3 stars 2 stars 1 star I IR.Collectibles98 16 days ago Let me just say I came into this dsicord group blind folded. Didnâ€™t know a thing about Pokemon or how things work. The community here is extremely helpful to say the least, you often find support or help by other members, free of judgement. The amount of time and money invested surely paid off. Written 1 month after purchase PE Peter elizalde 16 days ago Pluggedinn has been ðŸ”¥ðŸ”¥ after I signed up and joined up, cause before Pluggedinn I also strikeout on online release. But after joining now I finally have been able to cop the online drops for PokÃ©mon cards thanks to the quick links str8 to the drop sites thanks to Stins and the Pluggedinn group ðŸ™Œï¿½... Show more Written 3 months after purchase JD Jovanny Duran 16 days ago Kinda confusing at first but gets easier, they got a great system to show you how to cop many items withought even having to try.They get you the assistance you need when trying to buy something and the price is well worth it. Best Cook group especially for tcg. Written 19 days after purchase K Krazo_Kid 16 days ago PluggedInn Premium is where all the action is at! Cop hype product like a pro alongside a community of like-minded people. Take the first step and join, you wont be disappointed!! Written 1 month after purchase See all reviews About the creator PI View profile Plugged Inn @ stinszn â€¢ Joined Dec 2022 Plugged Inn is the #1 destination for collectors and resellers. For over eight years, weâ€™ve redefined what it means to stay plugged in â€” delivering real-time alerts, early links, and powerful tools that help our members secure the most coveted drops across sneakers, PokÃ©mon, and collectibles. Backed by a community built on trust, speed, and results, Plugged Inn turns every release into an opportun FAQs Why choose us? Do I need bots or extra software? How much can I expect to cop in a month? How fast can I see results? What kind of drops do you cover? Affiliates P Become an affiliate PluggedInn 30% reward Earn money by bringing customers to PluggedInn. Every time a customer purchases using your link, you&#x27;ll earn a commission. Plugged Inn Weekly Access $15.00 / week Join $15.00 / week Pay Join Pay Join Plugged Inn Weekly Access | Whop",
  "finalUrl": "https://whop.com/pluginn/weekly-access-54/",
  "fetchedAt": "2025-11-05T10:53:03.574Z",
  "textHash": "c9004cbc0003725861e238d6d8fe74addc6ac56807815e3c54fba442b65e60fe",
  "drilled": false
}