{
  "baseUrl": "https://whop.com/polarchefs/?a=alexburnett21",
  "title": "Polar Chefs | Whop",
  "h1": "Polar Chefs",
  "bullets": [
    "Powered by PC Polar Chefs Polar Chefs simplifies making money both online and in-store. Our exclusive Discord community offers daily income opportunities for sneaker enthusiasts, streetwear collectors, pop culture fans, spor... More 5.0 ( 579 ) Contact seller Products Unmute $70.00 / month Make $1000+ Weekly with Pokemon, Popmart, Sneakers, + MORE Polar Chefs Premium 5.0 ( 577 ) Contact seller Reviews M MGJR720 8 days ago Made my money back in literally a day. Canâ€™t recommend enough Written 3 days after purchase",
    "H Hasi 11 days ago bard this shee tuff Written 1 month after purchase",
    "B Bryan 12 days ago Solid group ğŸ™ğŸ½ Written 15 days after purchase",
    "J Jack_trade 14 days ago The best out there Written 2 months after purchase"
  ],
  "paras": [
    "PC Polar Chefs Polar Chefs simplifies making money both online and in-store. Our exclusive Discord community offers daily income opportunities for sneaker enthusiasts, streetwear collectors, pop culture fans, spor... More 5.0 ( 579 ) Contact seller Products Unmute $70.00 / month Make $1000+ Weekly with Pokemon, Popmart, Sneakers, + MORE Polar Chefs Premium 5.0 ( 577 ) Contact seller Reviews M MGJR720 8 days ago Made my money back in literally a day. Canâ€™t recommend enough",
    "11 days ago bard this shee tuff",
    "12 days ago Solid group ğŸ™ğŸ½",
    "14 days ago The best out there"
  ],
  "priceTokens": [
    "$70.00",
    "$100",
    "$1",
    "$1",
    "$1",
    "$21",
    "$1",
    "$1",
    "$1",
    "$1",
    "$28",
    "$1",
    "$28",
    "$28",
    "$28",
    "$28",
    "$3",
    "$3",
    "$3",
    "$10"
  ],
  "faq": [],
  "textSample": "Powered by PC Polar Chefs Polar Chefs simplifies making money both online and in-store. Our exclusive Discord community offers daily income opportunities for sneaker enthusiasts, streetwear collectors, pop culture fans, spor... More 5.0 ( 579 ) Contact seller Products Unmute $70.00 / month Make $1000+ Weekly with Pokemon, Popmart, Sneakers, + MORE Polar Chefs Premium 5.0 ( 577 ) Contact seller Reviews M MGJR720 8 days ago Made my money back in literally a day. Canâ€™t recommend enough Written 3 days after purchase H Hasi 11 days ago bard this shee tuff Written 1 month after purchase B Bryan 12 days ago Solid group ğŸ™ğŸ½ Written 15 days after purchase J Jack_trade 14 days ago The best out there Written 2 months after purchase See all reviews Polar Chefs | Whop",
  "finalUrl": "https://whop.com/polarchefs/?a=alexburnett21",
  "fetchedAt": "2025-11-05T09:52:31.155Z",
  "textHash": "2b4ba87c9fc7d1b67054c52d82e77e8797492d84b72c6185c9d9a5533f049e71",
  "drilled": false
}