{
  "baseUrl": "https://whop.com/potion-alpha/potion-access-monthly-crypto/",
  "title": "Potion Discord Access (Crypto) | Whop",
  "h1": "Potion Discord Access (Crypto)",
  "bullets": [
    "Potion Discord Access (Crypto) | Whop Sign in Unmute Unmute PA Potion Discord Access (Crypto) The One Stop Shop For Memecoins 4.8 ( 325 ) Other The #1 Trading Community offering Top of the Line Software and Tools designed by our team. Get insights into specific Coins, helping you make Smarter and Profitable Decisions $150.00 for 1 month Pay Get access Join 42 members Features Learn crypto trading live, regardless of your experience level.",
    "Access exclusive live streams to spot real-time memecoin opportunities.",
    "Analyze social media use, top holders, and more with custom bots.",
    "Stay ahead by tracking influencers on Crypto Twitter and their insights.",
    "Follow top traders&#x27; blockchain activities with lightning-speed updates.",
    "VI Victor Ianiu 23 days ago The platform is often described as easy to use, especially for managing digital products, subscriptions, and memberships. Written 9 months after purchase",
    "EA Engr. Angela 1 month ago Mod team are very helpful, fastest support i have experienced. I learned most during Stages which is very beginner friendly! Written 10 months after purchase",
    "J Jordan 5 months ago One of the best Whops out there, 100% recommended. This helped me cook hella money on memecoins, W Orangie. Written 1 month after purchase",
    "J Jonathan 7 months ago All payments are done and really good whop Written 20 days after purchase"
  ],
  "paras": [
    "Sign in Unmute Unmute PA Potion Discord Access (Crypto) The One Stop Shop For Memecoins 4.8 ( 325 ) Other The #1 Trading Community offering Top of the Line Software and Tools designed by our team. Get insights into specific Coins, helping you make Smarter and Profitable Decisions",
    "Join 42 members Features Learn crypto trading live, regardless of your experience level. Access exclusive live streams to spot real-time memecoin opportunities. Analyze social media use, top holders, and more with custom bots. Stay ahead by tracking influencers on Crypto Twitter and their insights. Follow top traders&#x27; blockchain activities with lightning-speed updates. Reviews 4.80 out of 5 325 total reviews 5 stars 4 stars 3 stars 2 stars 1 star VI Victor Ianiu 23 days ago The platform is often described as easy to use, especially for managing digital products, subscriptions, and memberships.",
    "1 month ago Mod team are very helpful, fastest support i have experienced. I learned most during Stages which is very beginner friendly!",
    "5 months ago One of the best Whops out there, 100% recommended. This helped me cook hella money on memecoins, W Orangie.",
    "7 months ago All payments are done and really good whop",
    "About the creator O View profile Orangie @ orangie • Joined Sep 2023 I’m Orangie, the founder of Potion Alpha, the #1 online crypto platform where over 100,000 members collaborate to master blockchain trading. Whether you&#x27;re a beginner or an experienced trader, our entire team at Potion Alpha is focused on helping you win with real-time tools, memecoin scanning, and exclusive bots. Join us, and let’s grow together! FAQs Is Potion Alpha suitable for beginners? Do you provide live trading signals? What is Potion Alpha? How can I benefit from joining? Affiliates PA Become an affiliate Potion Alpha 30% reward Earn money by bringing customers to Potion Alpha. Every time a customer purchases using your link, you&#x27;ll earn a commission."
  ],
  "priceTokens": [
    "$150.00",
    "$150.00",
    "$150.00",
    "$1",
    "$1",
    "$1",
    "$22",
    "$1",
    "$1",
    "$1",
    "$1",
    "$1",
    "$2",
    "$1",
    "$2",
    "$2",
    "$2",
    "$2",
    "$3",
    "$3"
  ],
  "faq": [],
  "textSample": "Potion Discord Access (Crypto) | Whop Sign in Unmute Unmute PA Potion Discord Access (Crypto) The One Stop Shop For Memecoins 4.8 ( 325 ) Other The #1 Trading Community offering Top of the Line Software and Tools designed by our team. Get insights into specific Coins, helping you make Smarter and Profitable Decisions $150.00 for 1 month Pay Get access Join 42 members Features Learn crypto trading live, regardless of your experience level. Access exclusive live streams to spot real-time memecoin opportunities. Analyze social media use, top holders, and more with custom bots. Stay ahead by tracking influencers on Crypto Twitter and their insights. Follow top traders&#x27; blockchain activities with lightning-speed updates. Reviews 4.80 out of 5 325 total reviews 5 stars 4 stars 3 stars 2 stars 1 star VI Victor Ianiu 23 days ago The platform is often described as easy to use, especially for managing digital products, subscriptions, and memberships. Written 9 months after purchase EA Engr. Angela 1 month ago Mod team are very helpful, fastest support i have experienced. I learned most during Stages which is very beginner friendly! Written 10 months after purchase J Jordan 5 months ago One of the best Whops out there, 100% recommended. This helped me cook hella money on memecoins, W Orangie. Written 1 month after purchase J Jonathan 7 months ago All payments are done and really good whop Written 20 days after purchase See all reviews About the creator O View profile Orangie @ orangie • Joined Sep 2023 I’m Orangie, the founder of Potion Alpha, the #1 online crypto platform where over 100,000 members collaborate to master blockchain trading. Whether you&#x27;re a beginner or an experienced trader, our entire team at Potion Alpha is focused on helping you win with real-time tools, memecoin scanning, and exclusive bots. Join us, and let’s grow together! FAQs Is Potion Alpha suitable for beginners? Do you provide live trading signals? What is Potion Alpha? How can I benefit from joining? Affiliates PA Become an affiliate Potion Alpha 30% reward Earn money by bringing customers to Potion Alpha. Every time a customer purchases using your link, you&#x27;ll earn a commission. Potion Discord Access (Crypto) $150.00 for 1 month Get access $150.00 for 1 month Pay Get access Pay Get access",
  "finalUrl": "https://whop.com/potion-alpha/potion-access-monthly-crypto/",
  "fetchedAt": "2025-11-05T09:54:03.854Z",
  "textHash": "4b3360f9ea20148a7075f94ab7c8896f146fca29d4af5fcec1e9eda01b6a4c3a",
  "drilled": false
}