{
  "baseUrl": "https://whop.com/allinanalytics/premium-access-monthly-a6/",
  "title": "Premium Access | Monthly | Whop",
  "h1": "Premium Access | Monthly",
  "bullets": [
    "Sign in Unmute Unmute Unmute Unmute Unmute Unmute AA Premium Access | Monthly Go ALL-IN with the best of sports betters! 4.7 ( 58 ) Sports betting Get 5-10+ expert picks daily, exclusive tips, and join a thriving betting community. $49.99 / month Pay Get access Features 5-10+ expert picks daily for strategic betting",
    "Exclusive tips and advanced strategies from seasoned bettors",
    "Access to real-time live discussions during games",
    "Insights on Stocks, Crypto, Finance &amp; More",
    "Stay informed with the latest news, stats, and betting lines",
    "L Lazloshi 22 days ago all real reviews shi one of the best gc u can get into✅ Written 1 month after purchase",
    "KL KING LUNIC 1 month ago Well worth it. You make your monthly payment within that first week Written 2 months after purchase",
    "V Vercetti 2 months ago Definitely worth it , made 3x the money i spent on premium back in the same day Written 2 days after purchase",
    "A anthony 2 months ago definitely worth joining been making more ever since Written 3 days after purchase"
  ],
  "paras": [
    "Sign in Unmute Unmute Unmute Unmute Unmute Unmute AA Premium Access | Monthly Go ALL-IN with the best of sports betters! 4.7 ( 58 ) Sports betting Get 5-10+ expert picks daily, exclusive tips, and join a thriving betting community.",
    "5-10+ expert picks daily for strategic betting Exclusive tips and advanced strategies from seasoned bettors Access to real-time live discussions during games Insights on Stocks, Crypto, Finance &amp; More Stay informed with the latest news, stats, and betting lines Reviews 4.74 out of 5 58 total reviews 5 stars 4 stars 3 stars 2 stars 1 star L Lazloshi 22 days ago all real reviews shi one of the best gc u can get into✅",
    "1 month ago Well worth it. You make your monthly payment within that first week",
    "2 months ago Definitely worth it , made 3x the money i spent on premium back in the same day",
    "2 months ago definitely worth joining been making more ever since",
    "About the creator DR View profile Daiveon Richardson @ daiveonr • Joined Jun 2024 Go ALL IN with the best of sports bettors, Join a community of 7,000+ members are starting hitting slips consistently to start making $10k+ a month! FAQs How often are tips and predictions posted? Can I contribute my own tips and predictions? What types of sports do you cover? Affiliates AA Become an affiliate All-In Analytics 30% reward Earn money by bringing customers to All-In Analytics. Every time a customer purchases using your link, you&#x27;ll earn a commission."
  ],
  "priceTokens": [
    "$49.99",
    "$10",
    "$49.99",
    "$49.99",
    "$1",
    "$1",
    "$1",
    "$22",
    "$1",
    "$1",
    "$1",
    "$1",
    "$1",
    "$2",
    "$1",
    "$2",
    "$2",
    "$2",
    "$2",
    "$3"
  ],
  "faq": [],
  "textSample": "Sign in Unmute Unmute Unmute Unmute Unmute Unmute AA Premium Access | Monthly Go ALL-IN with the best of sports betters! 4.7 ( 58 ) Sports betting Get 5-10+ expert picks daily, exclusive tips, and join a thriving betting community. $49.99 / month Pay Get access Features 5-10+ expert picks daily for strategic betting Exclusive tips and advanced strategies from seasoned bettors Access to real-time live discussions during games Insights on Stocks, Crypto, Finance &amp; More Stay informed with the latest news, stats, and betting lines Reviews 4.74 out of 5 58 total reviews 5 stars 4 stars 3 stars 2 stars 1 star L Lazloshi 22 days ago all real reviews shi one of the best gc u can get into✅ Written 1 month after purchase KL KING LUNIC 1 month ago Well worth it. You make your monthly payment within that first week Written 2 months after purchase V Vercetti 2 months ago Definitely worth it , made 3x the money i spent on premium back in the same day Written 2 days after purchase A anthony 2 months ago definitely worth joining been making more ever since Written 3 days after purchase See all reviews About the creator DR View profile Daiveon Richardson @ daiveonr • Joined Jun 2024 Go ALL IN with the best of sports bettors, Join a community of 7,000+ members are starting hitting slips consistently to start making $10k+ a month! FAQs How often are tips and predictions posted? Can I contribute my own tips and predictions? What types of sports do you cover? Affiliates AA Become an affiliate All-In Analytics 30% reward Earn money by bringing customers to All-In Analytics. Every time a customer purchases using your link, you&#x27;ll earn a commission. Premium Access | Monthly $49.99 / month Get access $49.99 / month Pay Get access Pay Get access Premium Access | Monthly | Whop",
  "finalUrl": "https://whop.com/allinanalytics/premium-access-monthly-a6/",
  "fetchedAt": "2025-11-04T19:41:53.652Z",
  "textHash": "218b42296556606c75f33cb9e8c57c959131ccbb50cf7dfb845ed075d8f40793",
  "drilled": false
}