{
  "baseUrl": "https://whop.com/premium-subscription-52/?a=alexburnett21",
  "title": "The Wholesale Atlas | Whop",
  "h1": "The Wholesale Atlas",
  "bullets": [
    "Powered by TA The Wholesale Atlas Our goal is to bring every real-estate path under one roof. Choose the pods you care about, join live sessions and Q&amp;A, and tap templates, checklists, and community insights when you need them. Helpfu... More 4.8 ( 30 ) Contact seller Products $19.99 / month The All-in-One Real Estate Community Atlas Real Estate Community New $74.99 / month Real Estate Wholesaling Simplified Premium Subscription 5.0 ( 7 ) $149.99 / month Real Estate Wholesaling Simplified Atlas Mode New Contact seller Reviews DJ Denise Jameson • Premium Subscription 8 months ago By far the most amazing community I have ever been part of! It’s more like a family! There is always someone there that’s willing to help. Vidush is an incredible leader who truly cares about you and your success. He is always bringing new and exciting opportunities to help you reach your goals. The... Show more Written 4 months after purchase",
    "BW Ben Wirtz • Premium Subscription 8 months ago Atlas is the best. Makes underwriting very quick and you get more offers out faster. The Lead gen features are top notch! Written 1 month after purchase",
    "TG Terry Giancaterino 8 months ago Great app! I use it religiously every day! Great number cruncher! Written 3 months after purchase",
    "MG Matthew Guzman • Premium Subscription 9 months ago Great community, learn a lot, and people are always willing to help! Written 7 days after purchase"
  ],
  "paras": [
    "TA The Wholesale Atlas Our goal is to bring every real-estate path under one roof. Choose the pods you care about, join live sessions and Q&amp;A, and tap templates, checklists, and community insights when you need them. Helpfu... More 4.8 ( 30 ) Contact seller Products $19.99 / month The All-in-One Real Estate Community Atlas Real Estate Community New $74.99 / month Real Estate Wholesaling Simplified Premium Subscription 5.0 ( 7 ) $149.99 / month Real Estate Wholesaling Simplified Atlas Mode New Contact seller Reviews DJ Denise Jameson • Premium Subscription 8 months ago By far the most amazing community I have ever been part of! It’s more like a family! There is always someone there that’s willing to help. Vidush is an incredible leader who truly cares about you and your success. He is always bringing new and exciting opportunities to help you reach your goals. The...",
    "Written 4 months after purchase BW Ben Wirtz • Premium Subscription 8 months ago Atlas is the best. Makes underwriting very quick and you get more offers out faster. The Lead gen features are top notch!",
    "8 months ago Great app! I use it religiously every day! Great number cruncher!",
    "9 months ago Great community, learn a lot, and people are always willing to help!"
  ],
  "priceTokens": [
    "$19.99",
    "$74.99",
    "$149.99",
    "$1",
    "$1",
    "$1",
    "$21",
    "$1",
    "$1",
    "$1",
    "$1",
    "$28",
    "$1",
    "$28",
    "$28",
    "$28",
    "$28",
    "$3",
    "$3",
    "$3"
  ],
  "faq": [],
  "textSample": "Powered by TA The Wholesale Atlas Our goal is to bring every real-estate path under one roof. Choose the pods you care about, join live sessions and Q&amp;A, and tap templates, checklists, and community insights when you need them. Helpfu... More 4.8 ( 30 ) Contact seller Products $19.99 / month The All-in-One Real Estate Community Atlas Real Estate Community New $74.99 / month Real Estate Wholesaling Simplified Premium Subscription 5.0 ( 7 ) $149.99 / month Real Estate Wholesaling Simplified Atlas Mode New Contact seller Reviews DJ Denise Jameson • Premium Subscription 8 months ago By far the most amazing community I have ever been part of! It’s more like a family! There is always someone there that’s willing to help. Vidush is an incredible leader who truly cares about you and your success. He is always bringing new and exciting opportunities to help you reach your goals. The... Show more Written 4 months after purchase BW Ben Wirtz • Premium Subscription 8 months ago Atlas is the best. Makes underwriting very quick and you get more offers out faster. The Lead gen features are top notch! Written 1 month after purchase TG Terry Giancaterino 8 months ago Great app! I use it religiously every day! Great number cruncher! Written 3 months after purchase MG Matthew Guzman • Premium Subscription 9 months ago Great community, learn a lot, and people are always willing to help! Written 7 days after purchase See all reviews The Wholesale Atlas | Whop",
  "finalUrl": "https://whop.com/premium-subscription-52/?a=alexburnett21",
  "fetchedAt": "2025-11-04T19:59:16.262Z",
  "textHash": "0b9bd2e351a58cd9cc1f9cb827a932128398134642d3922f8141a9ecc765286a",
  "drilled": false
}