{
  "baseUrl": "https://whop.com/war-room-ac/?a=alexburnett21",
  "title": "Secret Money Trading | Whop",
  "h1": "Secret Money Trading",
  "bullets": [
    "Powered by ST Secret Money Trading I have dedicated my career to mastering the art of trading. With Secret Money, I offer you the resources and insights I wish I had when I started. Join me to elevate your trading journey. 4.8 ( 14 ) Contact seller Products $80.00 / month Unlock the Ultimate Trading Experience Prestige New $20.00 / 2 weeks Join the Ultimate Crypto Futures Community Secret Money Premium New $800.00 Join the Crypto Futures Community Secret Money Lifetime New Contact seller Reviews T TP.1 2 years ago It is a great place to learn, discuss, and earn money. I highly recommend this group. Written 1 month after purchase",
    "LT Long Tran 2 years ago This might probably be the best deal you could get anywhere. The content is very deep and well organized. Their calls have a very high rate of winning. There’s no premium member in this group who is not making money out of those insane calls. Incredibly good learning material too, as well as frequen... Show more Written 1 month after purchase",
    "AC andrew chua 2 years ago Great for beginners. Detailed and easily digestible lessons to give you a step by step guide on how to do well trading the markets. Written 15 days after purchase",
    "GL Giovanni Lopez 2 years ago Best server out there. The guys will teach you everything you need to know Written 5 days after purchase"
  ],
  "paras": [
    "ST Secret Money Trading I have dedicated my career to mastering the art of trading. With Secret Money, I offer you the resources and insights I wish I had when I started. Join me to elevate your trading journey. 4.8 ( 14 ) Contact seller Products $80.00 / month Unlock the Ultimate Trading Experience Prestige New $20.00 / 2 weeks Join the Ultimate Crypto Futures Community Secret Money Premium New $800.00 Join the Crypto Futures Community Secret Money Lifetime New Contact seller Reviews T TP.1 2 years ago It is a great place to learn, discuss, and earn money. I highly recommend this group.",
    "2 years ago This might probably be the best deal you could get anywhere. The content is very deep and well organized. Their calls have a very high rate of winning. There’s no premium member in this group who is not making money out of those insane calls. Incredibly good learning material too, as well as frequen...",
    "Written 1 month after purchase AC andrew chua 2 years ago Great for beginners. Detailed and easily digestible lessons to give you a step by step guide on how to do well trading the markets.",
    "2 years ago Best server out there. The guys will teach you everything you need to know"
  ],
  "priceTokens": [
    "$80.00",
    "$20.00",
    "$800.00",
    "$1",
    "$1",
    "$1",
    "$21",
    "$1",
    "$1",
    "$1",
    "$1",
    "$28",
    "$1",
    "$28",
    "$28",
    "$28",
    "$28",
    "$3",
    "$3",
    "$3"
  ],
  "faq": [],
  "textSample": "Powered by ST Secret Money Trading I have dedicated my career to mastering the art of trading. With Secret Money, I offer you the resources and insights I wish I had when I started. Join me to elevate your trading journey. 4.8 ( 14 ) Contact seller Products $80.00 / month Unlock the Ultimate Trading Experience Prestige New $20.00 / 2 weeks Join the Ultimate Crypto Futures Community Secret Money Premium New $800.00 Join the Crypto Futures Community Secret Money Lifetime New Contact seller Reviews T TP.1 2 years ago It is a great place to learn, discuss, and earn money. I highly recommend this group. Written 1 month after purchase LT Long Tran 2 years ago This might probably be the best deal you could get anywhere. The content is very deep and well organized. Their calls have a very high rate of winning. There’s no premium member in this group who is not making money out of those insane calls. Incredibly good learning material too, as well as frequen... Show more Written 1 month after purchase AC andrew chua 2 years ago Great for beginners. Detailed and easily digestible lessons to give you a step by step guide on how to do well trading the markets. Written 15 days after purchase GL Giovanni Lopez 2 years ago Best server out there. The guys will teach you everything you need to know Written 5 days after purchase See all reviews Secret Money Trading | Whop",
  "finalUrl": "https://whop.com/war-room-ac/?a=alexburnett21",
  "fetchedAt": "2025-11-05T09:31:57.560Z",
  "textHash": "7b2d1b1b89e5e617aba19fb0ac55bc815313cfcee8ed8cedaeb9efb752bd0878",
  "drilled": false
}