{
  "baseUrl": "https://whop.com/tiktok-shop-course-discord/alex-sedlak/",
  "title": "Print Money W TikTok | Whop",
  "h1": "Print Money W TikTok",
  "bullets": [
    "Print Money W TikTok | Whop Sign in AS Print Money W TikTok Achieve $10K+ Profits on TikTok with Expert Guidance 4.5 ( 270 ) Other Learn to make your first $10,000 profit online with zero risk. Full access to top community, courses, and trusted marketplace. $20.00 / month Pay Join Join 6 members Features Proven Method: Learn everything you need to start passively making income o",
    "Access an exclusive community where you can strategize with like-minded people",
    "Weekly videos and lessons uploaded",
    "24/7 access to a student success coach within the discord",
    "Weekly calls with experts and members in the community sharing ideas.",
    "Y Yun 8 months ago So much great value Written 9 months after purchase",
    "RR Ryan Roesch 9 months ago Great community by Alex he is the man Written 1 minute after purchase",
    "R roeschmarketingsolutions 9 months ago A free community is as good as it gets!!!! So much great value Written 2 hours after purchase",
    "DR Dakota Roberts 10 months ago Alex & Ethan are both great guys and they have helped so many people make money online. Definitely recommend joining. Written 1 month after purchase"
  ],
  "paras": [
    "Sign in AS Print Money W TikTok Achieve $10K+ Profits on TikTok with Expert Guidance 4.5 ( 270 ) Other Learn to make your first $10,000 profit online with zero risk. Full access to top community, courses, and trusted marketplace.",
    "Join 6 members Features Proven Method: Learn everything you need to start passively making income o Access an exclusive community where you can strategize with like-minded people Weekly videos and lessons uploaded 24/7 access to a student success coach within the discord Weekly calls with experts and members in the community sharing ideas. Reviews 4.45 out of 5 270 total reviews 5 stars 4 stars 3 stars 2 stars 1 star Y Yun 8 months ago So much great value",
    "9 months ago Great community by Alex he is the man",
    "9 months ago A free community is as good as it gets!!!! So much great value",
    "10 months ago Alex & Ethan are both great guys and they have helped so many people make money online. Definitely recommend joining.",
    "About the creator AS View profile Alex P Sedlak @ apsedlak • Joined May 2023 FAQs What&#x27;s the refund policy? What is included in the weekly calls? Affiliates AS Become an affiliate Alex Sedlak 30% reward Earn money by bringing customers to Alex Sedlak. Every time a customer purchases using your link, you&#x27;ll earn a commission."
  ],
  "priceTokens": [
    "$10,000",
    "$10,000",
    "$10,000",
    "$10",
    "$10,000",
    "$20.00",
    "$20.00",
    "$20.00",
    "$10,000",
    "$1",
    "$1",
    "$1",
    "$22",
    "$1",
    "$1",
    "$1",
    "$1",
    "$1",
    "$2",
    "$1"
  ],
  "faq": [],
  "textSample": "Print Money W TikTok | Whop Sign in AS Print Money W TikTok Achieve $10K+ Profits on TikTok with Expert Guidance 4.5 ( 270 ) Other Learn to make your first $10,000 profit online with zero risk. Full access to top community, courses, and trusted marketplace. $20.00 / month Pay Join Join 6 members Features Proven Method: Learn everything you need to start passively making income o Access an exclusive community where you can strategize with like-minded people Weekly videos and lessons uploaded 24/7 access to a student success coach within the discord Weekly calls with experts and members in the community sharing ideas. Reviews 4.45 out of 5 270 total reviews 5 stars 4 stars 3 stars 2 stars 1 star Y Yun 8 months ago So much great value Written 9 months after purchase RR Ryan Roesch 9 months ago Great community by Alex he is the man Written 1 minute after purchase R roeschmarketingsolutions 9 months ago A free community is as good as it gets!!!! So much great value Written 2 hours after purchase DR Dakota Roberts 10 months ago Alex & Ethan are both great guys and they have helped so many people make money online. Definitely recommend joining. Written 1 month after purchase See all reviews About the creator AS View profile Alex P Sedlak @ apsedlak • Joined May 2023 FAQs What&#x27;s the refund policy? What is included in the weekly calls? Affiliates AS Become an affiliate Alex Sedlak 30% reward Earn money by bringing customers to Alex Sedlak. Every time a customer purchases using your link, you&#x27;ll earn a commission. Print Money W TikTok $20.00 / month Join $20.00 / month Pay Join Pay Join",
  "finalUrl": "https://whop.com/tiktok-shop-course-discord/alex-sedlak/",
  "fetchedAt": "2025-11-04T21:54:22.112Z",
  "textHash": "bf359596a7bc104fbdf0118d3f142dbb17f8b79bdc1f41a6d846a59ba7809251",
  "drilled": false
}