{
  "baseUrl": "https://whop.com/tiktok-shop-course-discord/?a=alexburnett21",
  "title": "Alex Sedlak | Whop",
  "h1": "Alex Sedlak",
  "bullets": [
    "Alex Sedlak | Whop Powered by AS Alex Sedlak 4.5 ( 270 ) Contact seller Products $60.00 / month Unlock the Secrets of Monetizing TikTok Print Money W TikTok Course 4.6 ( 216 ) Free Unlock Free Access Tips and Transform Your Tiktok Success Print Money W TikTok Free 4.1 ( 30 ) $20.00 / month Achieve $10K+ Profits on TikTok with Expert Guidance Print Money W TikTok 1.0 ( 1 ) Contact seller Reviews Y Yun • Print Money W TikTok Free 8 months ago So much great value Written 9 months after purchase",
    "RR Ryan Roesch • Print Money W TikTok Free 9 months ago Great community by Alex he is the man Written 1 minute after purchase",
    "R roeschmarketingsolutions • Print Money W TikTok Free 9 months ago A free community is as good as it gets!!!! So much great value Written 2 hours after purchase",
    "DR Dakota Roberts 10 months ago Alex & Ethan are both great guys and they have helped so many people make money online. Definitely recommend joining. Written 1 month after purchase"
  ],
  "paras": [
    "AS Alex Sedlak 4.5 ( 270 ) Contact seller Products $60.00 / month Unlock the Secrets of Monetizing TikTok Print Money W TikTok Course 4.6 ( 216 ) Free Unlock Free Access Tips and Transform Your Tiktok Success Print Money W TikTok Free 4.1 ( 30 ) $20.00 / month Achieve $10K+ Profits on TikTok with Expert Guidance Print Money W TikTok 1.0 ( 1 ) Contact seller Reviews Y Yun • Print Money W TikTok Free 8 months ago So much great value",
    "9 months ago Great community by Alex he is the man",
    "9 months ago A free community is as good as it gets!!!! So much great value",
    "10 months ago Alex & Ethan are both great guys and they have helped so many people make money online. Definitely recommend joining."
  ],
  "priceTokens": [
    "$60.00",
    "$20.00",
    "$10",
    "$1",
    "$1",
    "$1",
    "$21",
    "$1",
    "$1",
    "$1",
    "$1",
    "$28",
    "$1",
    "$28",
    "$28",
    "$28",
    "$28",
    "$3",
    "$3",
    "$3"
  ],
  "faq": [],
  "textSample": "Alex Sedlak | Whop Powered by AS Alex Sedlak 4.5 ( 270 ) Contact seller Products $60.00 / month Unlock the Secrets of Monetizing TikTok Print Money W TikTok Course 4.6 ( 216 ) Free Unlock Free Access Tips and Transform Your Tiktok Success Print Money W TikTok Free 4.1 ( 30 ) $20.00 / month Achieve $10K+ Profits on TikTok with Expert Guidance Print Money W TikTok 1.0 ( 1 ) Contact seller Reviews Y Yun • Print Money W TikTok Free 8 months ago So much great value Written 9 months after purchase RR Ryan Roesch • Print Money W TikTok Free 9 months ago Great community by Alex he is the man Written 1 minute after purchase R roeschmarketingsolutions • Print Money W TikTok Free 9 months ago A free community is as good as it gets!!!! So much great value Written 2 hours after purchase DR Dakota Roberts 10 months ago Alex & Ethan are both great guys and they have helped so many people make money online. Definitely recommend joining. Written 1 month after purchase See all reviews",
  "finalUrl": "https://whop.com/tiktok-shop-course-discord/?a=alexburnett21",
  "fetchedAt": "2025-11-04T19:59:18.371Z",
  "textHash": "3bdc6978d0cfd9b6bd4bfa3fa600f2e6ab90f9af8691831f91cce0291bcf1db7",
  "drilled": false
}