{
  "baseUrl": "https://whop.com/stockvip/?a=alexburnett21",
  "title": "Stock VIP | Whop",
  "h1": "Stock VIP",
  "bullets": [
    "Powered by SV Stock VIP At Stock VIP, we‚Äôve created one of the largest trading communities on Discord with over 250,000 members. Our mission is to empower traders with real-time alerts, expert education, and exclusive course... More 5.0 ( 111 ) Contact seller Products $20.00 / week #1 Ranked Discord - 250,000+ Member Paid Trading Community Prodigy 5.0 ( 85 ) $30.00 / week #1 Ranked Discord - 250,000+ Member Paid Trading Community Prodigy+ 5.0 ( 14 ) $899.00 #1 Ranked Discord - 250,000+ Member Paid Trading Community Lifetime VIP 5.0 ( 9 ) $199.00 / month Your All-in-One Trading Signal System ‚Äì Built for Every Market Signal Pro 5.0 ( 1 ) Contact seller Reviews C CaseyG6 ‚Ä¢ Prodigy 20 days ago Look the server stocks might not be a option one day but everyone is like a friend in the discordüòÇüíØ‚ÄºÔ∏è Written 3 months after purchase",
    "M MUj ‚Ä¢ Prodigy 8 months ago Very good server highly recommend anyone who wants to get started trading stocks James is very nice and willing to help his members Written 1 day after purchase",
    "U uso.koch ‚Ä¢ Lifetime VIP 9 months ago Awesome people , every single person in this discord is striving to become successful. Very knowledgeable traders, and a well respected Owner. 10/10 highly recommended this service! Written 2 hours after purchase",
    "MW Mr John D Webster ‚Ä¢ Prodigy 1 year ago Great service! Written 19 days after purchase"
  ],
  "paras": [
    "SV Stock VIP At Stock VIP, we‚Äôve created one of the largest trading communities on Discord with over 250,000 members. Our mission is to empower traders with real-time alerts, expert education, and exclusive course... More 5.0 ( 111 ) Contact seller Products $20.00 / week #1 Ranked Discord - 250,000+ Member Paid Trading Community Prodigy 5.0 ( 85 ) $30.00 / week #1 Ranked Discord - 250,000+ Member Paid Trading Community Prodigy+ 5.0 ( 14 ) $899.00 #1 Ranked Discord - 250,000+ Member Paid Trading Community Lifetime VIP 5.0 ( 9 ) $199.00 / month Your All-in-One Trading Signal System ‚Äì Built for Every Market Signal Pro 5.0 ( 1 ) Contact seller Reviews C CaseyG6 ‚Ä¢ Prodigy 20 days ago Look the server stocks might not be a option one day but everyone is like a friend in the discordüòÇüíØ‚ÄºÔ∏è",
    "8 months ago Very good server highly recommend anyone who wants to get started trading stocks James is very nice and willing to help his members",
    "9 months ago Awesome people , every single person in this discord is striving to become successful. Very knowledgeable traders, and a well respected Owner. 10/10 highly recommended this service!",
    "1 year ago Great service!"
  ],
  "priceTokens": [
    "$20.00",
    "$30.00",
    "$899.00",
    "$199.00",
    "$1",
    "$1",
    "$1",
    "$21",
    "$1",
    "$1",
    "$1",
    "$1",
    "$28",
    "$1",
    "$28",
    "$28",
    "$28",
    "$28",
    "$3",
    "$3"
  ],
  "faq": [],
  "textSample": "Powered by SV Stock VIP At Stock VIP, we‚Äôve created one of the largest trading communities on Discord with over 250,000 members. Our mission is to empower traders with real-time alerts, expert education, and exclusive course... More 5.0 ( 111 ) Contact seller Products $20.00 / week #1 Ranked Discord - 250,000+ Member Paid Trading Community Prodigy 5.0 ( 85 ) $30.00 / week #1 Ranked Discord - 250,000+ Member Paid Trading Community Prodigy+ 5.0 ( 14 ) $899.00 #1 Ranked Discord - 250,000+ Member Paid Trading Community Lifetime VIP 5.0 ( 9 ) $199.00 / month Your All-in-One Trading Signal System ‚Äì Built for Every Market Signal Pro 5.0 ( 1 ) Contact seller Reviews C CaseyG6 ‚Ä¢ Prodigy 20 days ago Look the server stocks might not be a option one day but everyone is like a friend in the discordüòÇüíØ‚ÄºÔ∏è Written 3 months after purchase M MUj ‚Ä¢ Prodigy 8 months ago Very good server highly recommend anyone who wants to get started trading stocks James is very nice and willing to help his members Written 1 day after purchase U uso.koch ‚Ä¢ Lifetime VIP 9 months ago Awesome people , every single person in this discord is striving to become successful. Very knowledgeable traders, and a well respected Owner. 10/10 highly recommended this service! Written 2 hours after purchase MW Mr John D Webster ‚Ä¢ Prodigy 1 year ago Great service! Written 19 days after purchase See all reviews Stock VIP | Whop",
  "finalUrl": "https://whop.com/stockvip/?a=alexburnett21",
  "fetchedAt": "2025-11-04T21:36:16.317Z",
  "textHash": "c1fb24dcebe0db1add97dfab6961ddfee77f310b323d76172e2b109c62d4bab4",
  "drilled": false
}