{
  "baseUrl": "https://whop.com/prodigy-pick/prodigy-pick/?a=alexburnett21",
  "title": "Prodigy Picks Access | Whop",
  "h1": "Prodigy Picks Access",
  "bullets": [
    "Sign in PP Prodigy Picks Access Full Access To Our System! Place Winning Bets Like A Pro! 2.4 ( 7 ) Sports betting Access Sports Knowledge From Some Of The Best In The Industry Who Have Been Quietly Beating The Books For Years...Get Daily Winning Bets Sent Straight To Your Phone. $39.95 / week Pay Get access Features DAILY MAX BETS (HIGH CONFIDENCE PLAYS)",
    "2-4+ DAILY VIP PLAYS",
    "HIGH VALUE PARLAYS",
    "1 ON 1 GUIDANCE TO STAY PROFITABLE",
    "RH Raymond Harrell 1 month ago Written 5 months after purchase",
    "DG David George 2 months ago Written 2 months after purchase"
  ],
  "paras": [
    "Sign in PP Prodigy Picks Access Full Access To Our System! Place Winning Bets Like A Pro! 2.4 ( 7 ) Sports betting Access Sports Knowledge From Some Of The Best In The Industry Who Have Been Quietly Beating The Books For Years...Get Daily Winning Bets Sent Straight To Your Phone.",
    "$39.95 / week Pay Get access Features DAILY MAX BETS (HIGH CONFIDENCE PLAYS) 2-4+ DAILY VIP PLAYS HIGH VALUE PARLAYS 1 ON 1 GUIDANCE TO STAY PROFITABLE Reviews 2.43 out of 5 7 total reviews 5 stars 4 stars 3 stars 2 stars 1 star RH Raymond Harrell 1 month ago",
    "2 months ago",
    "About the creator TN View profile The Source - Insider Sports Network @ prodigypick • Joined May 2023 Affiliates PP Become an affiliate Prodigy Picks 30% reward Earn money by bringing customers to Prodigy Picks . Every time a customer purchases using your link, you&#x27;ll earn a commission."
  ],
  "priceTokens": [
    "$39.95",
    "$39.95",
    "$39.95",
    "$1",
    "$1",
    "$1",
    "$23",
    "$1",
    "$1",
    "$1",
    "$1",
    "$1",
    "$2",
    "$1",
    "$2",
    "$2",
    "$2",
    "$2",
    "$3",
    "$3"
  ],
  "faq": [],
  "textSample": "Sign in PP Prodigy Picks Access Full Access To Our System! Place Winning Bets Like A Pro! 2.4 ( 7 ) Sports betting Access Sports Knowledge From Some Of The Best In The Industry Who Have Been Quietly Beating The Books For Years...Get Daily Winning Bets Sent Straight To Your Phone. $39.95 / week Pay Get access Features DAILY MAX BETS (HIGH CONFIDENCE PLAYS) 2-4+ DAILY VIP PLAYS HIGH VALUE PARLAYS 1 ON 1 GUIDANCE TO STAY PROFITABLE Reviews 2.43 out of 5 7 total reviews 5 stars 4 stars 3 stars 2 stars 1 star RH Raymond Harrell 1 month ago Written 5 months after purchase DG David George 2 months ago Written 2 months after purchase See all reviews About the creator TN View profile The Source - Insider Sports Network @ prodigypick • Joined May 2023 Affiliates PP Become an affiliate Prodigy Picks 30% reward Earn money by bringing customers to Prodigy Picks . Every time a customer purchases using your link, you&#x27;ll earn a commission. Prodigy Picks Access $39.95 / week +3 options Get access $39.95 / week 3 options Pay Get access Pay Get access Prodigy Picks Access | Whop",
  "finalUrl": "https://whop.com/prodigy-pick/prodigy-pick/?a=alexburnett21",
  "fetchedAt": "2025-11-04T20:02:00.920Z",
  "textHash": "b0f210608b5d7d12fc5ce1802d7b6b5fb1ae8d8d572ef63defb8f583c66cf1c7",
  "drilled": true
}