{
  "baseUrl": "https://whop.com/rb-picks/?a=alexburnett21",
  "title": "Ryan | Whop",
  "h1": "Ryan",
  "bullets": [
    "Powered by R Ryan I&#x27;ve been sports betting for over 6 years, and now as an official capper, I offer the most transparent and profitable picks in the game! Come win with me. 3.9 ( 90 ) Contact seller Products Unmute $50.00 / week The Most Transparent Handicapper! Premium 3.9 ( 88 ) Unmute $15.00 The Most Transparent Handicapper! Premium POD New Community and Growth Community and Growth New Contact seller Reviews AB Adrian Bingham • Premium 1 year ago Overall was a good experience. Hes active in chat and helpful. Has good writeups and data to support the picks. Only reason im giving 4 stars is i didnt profit on my first month but not complaining as he refunds your first month if you dont profit. Hes overall profitable but we hit a rough patch as ... Show more Written 2 months after purchase",
    "K KW • Premium 1 year ago Just awesome. I’ve had a great 1st week. My $15 and $25 bets have made me a few hundred. I’ll keep it short and just agree with everyone else! Written 11 days after purchase",
    "JP Joshua Phan • Premium 1 year ago I tailed RB's free picks for a while and after winning more than I have by tailing anyone else, I decided to subscribe to his premium. It was the best betting decision I have made. You will make your subscription money back in no time and more. You just have to be willing to be disciplined and follo... Show more Written 1 month after purchase",
    "TG Trevor Gremaux • Premium 1 year ago Been following betters for over a year now and managed to turn $5000 bankroll into $20,000. A year into the journey I can say RB is the best person I’ve followed. His picks have had amazing returns, he holds weekly q&a, he responds to dms/chat messages. Can’t recommend subscribing enough. Written 3 months after purchase"
  ],
  "paras": [
    "R Ryan I&#x27;ve been sports betting for over 6 years, and now as an official capper, I offer the most transparent and profitable picks in the game! Come win with me. 3.9 ( 90 ) Contact seller Products Unmute $50.00 / week The Most Transparent Handicapper! Premium 3.9 ( 88 ) Unmute $15.00 The Most Transparent Handicapper! Premium POD New Community and Growth Community and Growth New Contact seller Reviews AB Adrian Bingham • Premium 1 year ago Overall was a good experience. Hes active in chat and helpful. Has good writeups and data to support the picks. Only reason im giving 4 stars is i didnt profit on my first month but not complaining as he refunds your first month if you dont profit. Hes overall profitable but we hit a rough patch as ...",
    "Written 2 months after purchase K KW • Premium 1 year ago Just awesome. I’ve had a great 1st week. My $15 and $25 bets have made me a few hundred. I’ll keep it short and just agree with everyone else!",
    "1 year ago I tailed RB's free picks for a while and after winning more than I have by tailing anyone else, I decided to subscribe to his premium. It was the best betting decision I have made. You will make your subscription money back in no time and more. You just have to be willing to be disciplined and follo...",
    "Written 1 month after purchase TG Trevor Gremaux • Premium 1 year ago Been following betters for over a year now and managed to turn $5000 bankroll into $20,000. A year into the journey I can say RB is the best person I’ve followed. His picks have had amazing returns, he holds weekly q&a, he responds to dms/chat messages. Can’t recommend subscribing enough."
  ],
  "priceTokens": [
    "$50.00",
    "$15.00",
    "$15",
    "$25",
    "$500",
    "$20,000",
    "$1",
    "$1",
    "$1",
    "$21",
    "$1",
    "$1",
    "$1",
    "$1",
    "$28",
    "$1",
    "$28",
    "$28",
    "$28",
    "$28"
  ],
  "faq": [],
  "textSample": "Powered by R Ryan I&#x27;ve been sports betting for over 6 years, and now as an official capper, I offer the most transparent and profitable picks in the game! Come win with me. 3.9 ( 90 ) Contact seller Products Unmute $50.00 / week The Most Transparent Handicapper! Premium 3.9 ( 88 ) Unmute $15.00 The Most Transparent Handicapper! Premium POD New Community and Growth Community and Growth New Contact seller Reviews AB Adrian Bingham • Premium 1 year ago Overall was a good experience. Hes active in chat and helpful. Has good writeups and data to support the picks. Only reason im giving 4 stars is i didnt profit on my first month but not complaining as he refunds your first month if you dont profit. Hes overall profitable but we hit a rough patch as ... Show more Written 2 months after purchase K KW • Premium 1 year ago Just awesome. I’ve had a great 1st week. My $15 and $25 bets have made me a few hundred. I’ll keep it short and just agree with everyone else! Written 11 days after purchase JP Joshua Phan • Premium 1 year ago I tailed RB's free picks for a while and after winning more than I have by tailing anyone else, I decided to subscribe to his premium. It was the best betting decision I have made. You will make your subscription money back in no time and more. You just have to be willing to be disciplined and follo... Show more Written 1 month after purchase TG Trevor Gremaux • Premium 1 year ago Been following betters for over a year now and managed to turn $5000 bankroll into $20,000. A year into the journey I can say RB is the best person I’ve followed. His picks have had amazing returns, he holds weekly q&a, he responds to dms/chat messages. Can’t recommend subscribing enough. Written 3 months after purchase See all reviews Ryan | Whop",
  "finalUrl": "https://whop.com/rb-picks/?a=alexburnett21",
  "fetchedAt": "2025-11-04T20:02:03.287Z",
  "textHash": "dec16118cf48820d7badc5324efd33dc3e45d44c7ce2264567aca47e47141117",
  "drilled": false
}