{
  "baseUrl": "https://whop.com/resellers-paradise-6/?a=alexburnett21",
  "title": "Resellers Paradise | Whop",
  "h1": "Resellers Paradise",
  "bullets": [
    "Powered by RP Resellers Paradise Resellers Paradise is the ultimate resource for resellers, designed with deep industry knowledge and a commitment to your success. With years of experience understanding the unique challenges of resel... More 4.9 ( 336 ) Contact seller Products £24.99 / month Unlock Full Potential in Reselling Resellers Paradise Premium 4.9 ( 310 ) Contact seller Reviews 1 day ago The best cook group to be in. Made thousands with this group ❤️ Written 1 year after purchase",
    "LP Lauren Peters 1 day ago such a good server, literally so easy to make profit and everyone is so friendly, such a great community!! Written 1 year after purchase",
    "C Criiiss 1 day ago Very good server with lots of flips and great support. There are lots of opportunities to make money in here, highly recommend. Written 1 month after purchase",
    "SS Sunil Sondhi 1 day ago Great server and the team are super helpful. I was about to make £150+ profit in my first month with minimal effort. The more time you invest the better the outcome Written 2 months after purchase"
  ],
  "paras": [
    "RP Resellers Paradise Resellers Paradise is the ultimate resource for resellers, designed with deep industry knowledge and a commitment to your success. With years of experience understanding the unique challenges of resel... More 4.9 ( 336 ) Contact seller Products £24.99 / month Unlock Full Potential in Reselling Resellers Paradise Premium 4.9 ( 310 ) Contact seller Reviews 1 day ago The best cook group to be in. Made thousands with this group ❤️",
    "1 day ago such a good server, literally so easy to make profit and everyone is so friendly, such a great community!!",
    "1 day ago Very good server with lots of flips and great support. There are lots of opportunities to make money in here, highly recommend.",
    "1 day ago Great server and the team are super helpful. I was about to make £150+ profit in my first month with minimal effort. The more time you invest the better the outcome"
  ],
  "priceTokens": [
    "£24.99",
    "£150",
    "$1",
    "$1",
    "$1",
    "$21",
    "$1",
    "$1",
    "$1",
    "$1",
    "$28",
    "$1",
    "$28",
    "$28",
    "$28",
    "$28",
    "$3",
    "$3",
    "$3",
    "$10"
  ],
  "faq": [],
  "textSample": "Powered by RP Resellers Paradise Resellers Paradise is the ultimate resource for resellers, designed with deep industry knowledge and a commitment to your success. With years of experience understanding the unique challenges of resel... More 4.9 ( 336 ) Contact seller Products £24.99 / month Unlock Full Potential in Reselling Resellers Paradise Premium 4.9 ( 310 ) Contact seller Reviews 1 day ago The best cook group to be in. Made thousands with this group ❤️ Written 1 year after purchase LP Lauren Peters 1 day ago such a good server, literally so easy to make profit and everyone is so friendly, such a great community!! Written 1 year after purchase C Criiiss 1 day ago Very good server with lots of flips and great support. There are lots of opportunities to make money in here, highly recommend. Written 1 month after purchase SS Sunil Sondhi 1 day ago Great server and the team are super helpful. I was about to make £150+ profit in my first month with minimal effort. The more time you invest the better the outcome Written 2 months after purchase See all reviews Resellers Paradise | Whop",
  "finalUrl": "https://whop.com/resellers-paradise-6/?a=alexburnett21",
  "fetchedAt": "2025-11-05T09:49:17.559Z",
  "textHash": "3fd47458d1d4fd344c7e116ed44aa05aa9dfae72ead242f5785e4f8887159f61",
  "drilled": false
}