{
  "baseUrl": "https://whop.com/richforeverbets/exclusive-vip-package/",
  "title": "ğŸš¨RFB POD + VIP PACKAGE ğŸš¨ | Whop",
  "h1": "ğŸš¨RFB POD + VIP PACKAGE ğŸš¨",
  "bullets": [
    "ğŸš¨RFB POD + VIP PACKAGE ğŸš¨ | Whop Sign in RB ğŸš¨RFB POD + VIP PACKAGE ğŸš¨ ğŸ’° DAILY VIP PLAYS &amp; Play of the Day + ALL PREMIUM BENEFITS ğŸ’° 4.4 ( 313 ) Sports betting ğŸš¨ GET ALL THE EXCLUSIVE PLAYS â˜‘ï¸ DAILY WITHOUT PAYWALL + Premium benefits $25.00 for 1 day Pay Get access Join 16 members Features ALL OF OUR VIP PLAYS and POD",
    "SJ Shannon johnson 20 hours ago This is a great community and Iâ€™m definitely going to stay locked in Written 5 hours after purchase",
    "JA John Appleseed 1 day ago Canâ€™t lie I been hitting a lot since joining. Yes thereâ€™s days u lose but itâ€™s gambling everyone doesnâ€™t have a 100% rate . Written 2 days after purchase",
    "DW David Winkfield 2 days ago The hit rate speakers for itself! Written 8 days after purchase",
    "RA Reggie Anderson 5 days ago Ill give these guys a 5 star a million times thereâ€™s no better sport predicts then this crew there so challenging & risky it doesnâ€™t make no sense Written 8 hours after purchase"
  ],
  "paras": [
    "Sign in RB ğŸš¨RFB POD + VIP PACKAGE ğŸš¨ ğŸ’° DAILY VIP PLAYS &amp; Play of the Day + ALL PREMIUM BENEFITS ğŸ’° 4.4 ( 313 ) Sports betting ğŸš¨ GET ALL THE EXCLUSIVE PLAYS â˜‘ï¸ DAILY WITHOUT PAYWALL + Premium benefits",
    "$25.00 for 1 day Pay Get access Join 16 members Features ALL OF OUR VIP PLAYS and POD Reviews 4.42 out of 5 313 total reviews 5 stars 4 stars 3 stars 2 stars 1 star SJ Shannon johnson 20 hours ago This is a great community and Iâ€™m definitely going to stay locked in",
    "1 day ago Canâ€™t lie I been hitting a lot since joining. Yes thereâ€™s days u lose but itâ€™s gambling everyone doesnâ€™t have a 100% rate .",
    "2 days ago The hit rate speakers for itself!",
    "5 days ago Ill give these guys a 5 star a million times thereâ€™s no better sport predicts then this crew there so challenging & risky it doesnâ€™t make no sense",
    "About the creator R View profile Rich @ richforeverbets â€¢ Joined Sep 2024 ğŸ¯Sports betting changed Nathanielâ€™s life. In 2021, he took a calculated risk on a game ğŸ² , a decision that set him on a path that transformed everything. That journey earned him VIP status with FanDuel in NJ ğŸ† and gave him the freedom to fully pursue his passion ğŸ”¥. Today, even in his absence, the legacy continues. His proven system lives on, guiding the team to deliver the same winning plays. FAQs What is your winning rate? How does Pick Insurance work? What makes Richforeverbets different? Can beginners join Richforeverbets? Will I make a profit? Affiliates RB Become an affiliate RichForeverBets (#1 Sports Bettor) 30% reward Earn money by bringing customers to RichForeverBets (#1 Sports Bettor). Every time a customer purchases using your link, you&#x27;ll earn a commission."
  ],
  "priceTokens": [
    "$25.00",
    "$25.00",
    "$25.00",
    "$1",
    "$1",
    "$1",
    "$22",
    "$1",
    "$1",
    "$1",
    "$1",
    "$1",
    "$2",
    "$1",
    "$2",
    "$2",
    "$2",
    "$2",
    "$3",
    "$3"
  ],
  "faq": [],
  "textSample": "ğŸš¨RFB POD + VIP PACKAGE ğŸš¨ | Whop Sign in RB ğŸš¨RFB POD + VIP PACKAGE ğŸš¨ ğŸ’° DAILY VIP PLAYS &amp; Play of the Day + ALL PREMIUM BENEFITS ğŸ’° 4.4 ( 313 ) Sports betting ğŸš¨ GET ALL THE EXCLUSIVE PLAYS â˜‘ï¸ DAILY WITHOUT PAYWALL + Premium benefits $25.00 for 1 day Pay Get access Join 16 members Features ALL OF OUR VIP PLAYS and POD Reviews 4.42 out of 5 313 total reviews 5 stars 4 stars 3 stars 2 stars 1 star SJ Shannon johnson 20 hours ago This is a great community and Iâ€™m definitely going to stay locked in Written 5 hours after purchase JA John Appleseed 1 day ago Canâ€™t lie I been hitting a lot since joining. Yes thereâ€™s days u lose but itâ€™s gambling everyone doesnâ€™t have a 100% rate . Written 2 days after purchase DW David Winkfield 2 days ago The hit rate speakers for itself! Written 8 days after purchase RA Reggie Anderson 5 days ago Ill give these guys a 5 star a million times thereâ€™s no better sport predicts then this crew there so challenging & risky it doesnâ€™t make no sense Written 8 hours after purchase See all reviews About the creator R View profile Rich @ richforeverbets â€¢ Joined Sep 2024 ğŸ¯Sports betting changed Nathanielâ€™s life. In 2021, he took a calculated risk on a game ğŸ² , a decision that set him on a path that transformed everything. That journey earned him VIP status with FanDuel in NJ ğŸ† and gave him the freedom to fully pursue his passion ğŸ”¥. Today, even in his absence, the legacy continues. His proven system lives on, guiding the team to deliver the same winning plays. FAQs What is your winning rate? How does Pick Insurance work? What makes Richforeverbets different? Can beginners join Richforeverbets? Will I make a profit? Affiliates RB Become an affiliate RichForeverBets (#1 Sports Bettor) 30% reward Earn money by bringing customers to RichForeverBets (#1 Sports Bettor). Every time a customer purchases using your link, you&#x27;ll earn a commission. ğŸš¨RFB POD + VIP PACKAGE ğŸš¨ $25.00 for 1 day +2 options Get access $25.00 for 1 day 2 options Pay Get access Pay Get access",
  "finalUrl": "https://whop.com/richforeverbets/exclusive-vip-package/",
  "fetchedAt": "2025-11-05T17:34:44.096Z",
  "textHash": "27a12cb00072c6f883160cbc39503e873403e498efd24e974ca63a1527d2a051",
  "drilled": false
}