{
  "baseUrl": "https://whop.com/richoffrisk/?a=alexburnett21",
  "title": "Rich Off Risk | Whop",
  "h1": "Rich Off Risk",
  "bullets": [
    "Powered by RR Rich Off Risk Dedicated sports bettor with a proven track record of finding the best picks. Combining research, strategy, and experience, I help others maximize their wins. 4.8 ( 103 ) Contact seller Products $24.99 / week No Risk No Story. Rich Off Risk 4.9 ( 92 ) Free Free Sports Betting Signals Rich Off Risk Free 4.3 ( 11 ) Contact seller Reviews P py99kcgn79 â€¢ Rich Off Risk Free 1 month ago Great Written 2 days after purchase",
    "AR Alberto Isaac Duarte Rodriguez â€¢ Rich Off Risk 1 month ago 1000% recommendations RichOffRisk nothing but the best ğŸ’ªğŸ½ğŸ’ªğŸ½ Written 2 days after purchase",
    "R RoDawg509 â€¢ Rich Off Risk Free 1 month ago I 100% recommend RichOffRisk!ğŸ“ˆâœ…âœ…âœ… Written 1 month after purchase",
    "MU Marco Alan Ulloa â€¢ Rich Off Risk 1 month ago Very profitable discord out, made $350 in my first day, very solid picks %100 recommend Written 15 days after purchase"
  ],
  "paras": [
    "RR Rich Off Risk Dedicated sports bettor with a proven track record of finding the best picks. Combining research, strategy, and experience, I help others maximize their wins. 4.8 ( 103 ) Contact seller Products $24.99 / week No Risk No Story. Rich Off Risk 4.9 ( 92 ) Free Free Sports Betting Signals Rich Off Risk Free 4.3 ( 11 ) Contact seller Reviews P py99kcgn79 â€¢ Rich Off Risk Free 1 month ago Great",
    "1 month ago 1000% recommendations RichOffRisk nothing but the best ğŸ’ªğŸ½ğŸ’ªğŸ½",
    "1 month ago I 100% recommend RichOffRisk!ğŸ“ˆâœ…âœ…âœ…",
    "1 month ago Very profitable discord out, made $350 in my first day, very solid picks %100 recommend"
  ],
  "priceTokens": [
    "$24.99",
    "$350",
    "$1",
    "$1",
    "$1",
    "$21",
    "$1",
    "$1",
    "$1",
    "$1",
    "$28",
    "$1",
    "$28",
    "$28",
    "$28",
    "$28",
    "$3",
    "$3",
    "$3",
    "$10"
  ],
  "faq": [],
  "textSample": "Powered by RR Rich Off Risk Dedicated sports bettor with a proven track record of finding the best picks. Combining research, strategy, and experience, I help others maximize their wins. 4.8 ( 103 ) Contact seller Products $24.99 / week No Risk No Story. Rich Off Risk 4.9 ( 92 ) Free Free Sports Betting Signals Rich Off Risk Free 4.3 ( 11 ) Contact seller Reviews P py99kcgn79 â€¢ Rich Off Risk Free 1 month ago Great Written 2 days after purchase AR Alberto Isaac Duarte Rodriguez â€¢ Rich Off Risk 1 month ago 1000% recommendations RichOffRisk nothing but the best ğŸ’ªğŸ½ğŸ’ªğŸ½ Written 2 days after purchase R RoDawg509 â€¢ Rich Off Risk Free 1 month ago I 100% recommend RichOffRisk!ğŸ“ˆâœ…âœ…âœ… Written 1 month after purchase MU Marco Alan Ulloa â€¢ Rich Off Risk 1 month ago Very profitable discord out, made $350 in my first day, very solid picks %100 recommend Written 15 days after purchase See all reviews Rich Off Risk | Whop",
  "finalUrl": "https://whop.com/richoffrisk/?a=alexburnett21",
  "fetchedAt": "2025-11-05T09:16:14.949Z",
  "textHash": "1a5f1d245854bb89d565aef326ebdabfd713ae85c299f84b58d92af4b083ffdf",
  "drilled": false
}