{
  "baseUrl": "https://whop.com/remote-rebellion/rja-accelerator/",
  "title": "RJA Accelerator EUR | Whop",
  "h1": "RJA Accelerator EUR",
  "bullets": [
    "Sign in Unmute Unmute RR RJA Accelerator EUR Get Remote Work, Easier &amp; faster! 5.0 ( 1 ) Personal development Discover: Where to find REAL remote jobs",
    "How to apply so you get invited to interviews for jobs you want!",
    "What to do to get introductions and referrals to land your dream job",
    "1 hour coaching calls twice a week for 16 weeks (Max 10 in group call)",
    "16 weeks of hand picked remote jobs according to the jobs you want to see!",
    "Comprehensive Programme with 50+ step by step video tutorials and action guides",
    "Your CV shared with our network of over 16,000 global recruiters",
    "Lifetime access to our supportive community of remote workers and job seekers",
    "GS Gareth Smith 12 days ago Written 6 months after purchase"
  ],
  "paras": [
    "Sign in Unmute Unmute RR RJA Accelerator EUR Get Remote Work, Easier &amp; faster! 5.0 ( 1 ) Personal development Discover:",
    "€666.00 / month 4 payments Pay Join Features 1 hour coaching calls twice a week for 16 weeks (Max 10 in group call) 16 weeks of hand picked remote jobs according to the jobs you want to see! Comprehensive Programme with 50+ step by step video tutorials and action guides Your CV shared with our network of over 16,000 global recruiters Lifetime access to our supportive community of remote workers and job seekers Reviews 5 out of 5 1 review 5 stars 4 stars 3 stars 2 stars 1 star GS Gareth Smith 12 days ago",
    "FAQs What kinds of jobs can I get? How long does the program take to complete? Can I expect faster job placement with this programme? Affiliates RR Become an affiliate Remote Rebellion 30% reward Earn money by bringing customers to Remote Rebellion. Every time a customer purchases using your link, you&#x27;ll earn a commission."
  ],
  "priceTokens": [
    "€666.00",
    "€666.00",
    "€666.00",
    "$1",
    "$1",
    "$1",
    "$22",
    "$1",
    "$1",
    "$1",
    "$1",
    "$1",
    "$2",
    "$1",
    "$2",
    "$2",
    "$2",
    "$2",
    "$3",
    "$3"
  ],
  "faq": [],
  "textSample": "Sign in Unmute Unmute RR RJA Accelerator EUR Get Remote Work, Easier &amp; faster! 5.0 ( 1 ) Personal development Discover: Where to find REAL remote jobs How to apply so you get invited to interviews for jobs you want! What to do to get introductions and referrals to land your dream job €666.00 / month 4 payments Pay Join Features 1 hour coaching calls twice a week for 16 weeks (Max 10 in group call) 16 weeks of hand picked remote jobs according to the jobs you want to see! Comprehensive Programme with 50+ step by step video tutorials and action guides Your CV shared with our network of over 16,000 global recruiters Lifetime access to our supportive community of remote workers and job seekers Reviews 5 out of 5 1 review 5 stars 4 stars 3 stars 2 stars 1 star GS Gareth Smith 12 days ago Written 6 months after purchase About the creator MC View profile Michelle Coulson @ remoterebellion • Joined Nov 2024 Founded by Michelle Coulson, a seasoned recruiter with international experience, Remote Rebellion is dedicated to helping individuals embrace remote work. Motivated by the post-pandemic shift towards office work, Michelle leverages her deep understanding of remote-first company needs to equip job seekers with the skills to secure fulfilling remote roles that support lifestyle freedom and values. FAQs What kinds of jobs can I get? How long does the program take to complete? Can I expect faster job placement with this programme? Affiliates RR Become an affiliate Remote Rebellion 30% reward Earn money by bringing customers to Remote Rebellion. Every time a customer purchases using your link, you&#x27;ll earn a commission. RJA Accelerator EUR €666.00 / month +1 option Join €666.00 / month 1 option Pay Join Pay Join RJA Accelerator EUR | Whop",
  "finalUrl": "https://whop.com/remote-rebellion/rja-accelerator/",
  "fetchedAt": "2025-11-05T10:35:47.599Z",
  "textHash": "c5cec4ce7c25c528730699f3386663f9764d41f4ad66763e5ea043d6ccc1fba9",
  "drilled": false
}