{
  "baseUrl": "https://whop.com/sharpshooters-s-whop/?a=alexburnett21",
  "title": "SharpShooter&#x27;s Sports | Whop",
  "h1": "SharpShooter&#x27;s Sports",
  "bullets": [
    "Powered by SS SharpShooter&#x27;s Sports I&#x27;ve mastered the art of sports betting, having been banned/limited from every sports book for my success. Now, I&#x27;m here to share my winning strategies with you, ensuring you profit long-term. 4.7 ( 263 ) Contact seller Products $25.00 / month $1,000 GIVEAWAY SUNDAY! The Best Sports Betting Community! Sharpshooter&#x27;s Sports Picks 4.7 ( 256 ) $25.00 / month Guaranteed winning sports picks! Sharpshooters picks 5.0 ( 1 ) Free Guaranteed long-term win rate! Sharpshooter&#x27;s Sports Free 4.8 ( 6 ) Contact seller Reviews J Josh â€¢ Sharpshooter&#x27;s Sports Picks 9 months ago Great group and cappers are top notch and do wonders. Written 1 month after purchase",
    "AJ Aiden Jones â€¢ Sharpshooter&#x27;s Sports Picks 9 months ago made me win a lot of money while being only 25$ highly recommended Written 24 days after purchase",
    "BT Borja Torres â€¢ Sharpshooter&#x27;s Sports Picks 9 months ago I've been subscribed for only 4 days and I'm already making profits. He's the best tipster I've ever seen! Written 6 days after purchase",
    "CB Cameron Bolton â€¢ Sharpshooter&#x27;s Sports Picks 9 months ago The first group I joined & I learned the game quick! Understanding units, straights & lottos while taking home ðŸ’° Written 11 days after purchase"
  ],
  "paras": [
    "SS SharpShooter&#x27;s Sports I&#x27;ve mastered the art of sports betting, having been banned/limited from every sports book for my success. Now, I&#x27;m here to share my winning strategies with you, ensuring you profit long-term. 4.7 ( 263 ) Contact seller Products $25.00 / month $1,000 GIVEAWAY SUNDAY! The Best Sports Betting Community! Sharpshooter&#x27;s Sports Picks 4.7 ( 256 ) $25.00 / month Guaranteed winning sports picks! Sharpshooters picks 5.0 ( 1 ) Free Guaranteed long-term win rate! Sharpshooter&#x27;s Sports Free 4.8 ( 6 ) Contact seller Reviews J Josh â€¢ Sharpshooter&#x27;s Sports Picks 9 months ago Great group and cappers are top notch and do wonders.",
    "9 months ago made me win a lot of money while being only 25$ highly recommended",
    "9 months ago I've been subscribed for only 4 days and I'm already making profits. He's the best tipster I've ever seen!",
    "9 months ago The first group I joined & I learned the game quick! Understanding units, straights & lottos while taking home ðŸ’°"
  ],
  "priceTokens": [
    "$25.00",
    "$1,000",
    "$25.00",
    "$1",
    "$1",
    "$1",
    "$21",
    "$1",
    "$1",
    "$1",
    "$1",
    "$28",
    "$1",
    "$28",
    "$28",
    "$28",
    "$28",
    "$3",
    "$3",
    "$3"
  ],
  "faq": [],
  "textSample": "Powered by SS SharpShooter&#x27;s Sports I&#x27;ve mastered the art of sports betting, having been banned/limited from every sports book for my success. Now, I&#x27;m here to share my winning strategies with you, ensuring you profit long-term. 4.7 ( 263 ) Contact seller Products $25.00 / month $1,000 GIVEAWAY SUNDAY! The Best Sports Betting Community! Sharpshooter&#x27;s Sports Picks 4.7 ( 256 ) $25.00 / month Guaranteed winning sports picks! Sharpshooters picks 5.0 ( 1 ) Free Guaranteed long-term win rate! Sharpshooter&#x27;s Sports Free 4.8 ( 6 ) Contact seller Reviews J Josh â€¢ Sharpshooter&#x27;s Sports Picks 9 months ago Great group and cappers are top notch and do wonders. Written 1 month after purchase AJ Aiden Jones â€¢ Sharpshooter&#x27;s Sports Picks 9 months ago made me win a lot of money while being only 25$ highly recommended Written 24 days after purchase BT Borja Torres â€¢ Sharpshooter&#x27;s Sports Picks 9 months ago I've been subscribed for only 4 days and I'm already making profits. He's the best tipster I've ever seen! Written 6 days after purchase CB Cameron Bolton â€¢ Sharpshooter&#x27;s Sports Picks 9 months ago The first group I joined & I learned the game quick! Understanding units, straights & lottos while taking home ðŸ’° Written 11 days after purchase See all reviews SharpShooter&#x27;s Sports | Whop",
  "finalUrl": "https://whop.com/sharpshooters-s-whop/?a=alexburnett21",
  "fetchedAt": "2025-11-05T17:27:31.285Z",
  "textHash": "1277740a866b466cc7c0d54909df58049f4c9e43a0e9e863b93d212a7890fcf5",
  "drilled": false
}