{
  "baseUrl": "https://whop.com/shocked/shocked-membership-crypto-2c/",
  "title": "Shocked (Crypto Payments) | Whop",
  "h1": "Shocked (Crypto Payments)",
  "bullets": [
    "Shocked (Crypto Payments) | Whop Sign in S Shocked (Crypto Payments) Exclusive trading community defying the laws of traditional money-making. 4.9 ( 845 ) Trading We specialize in Reselling and Trading, helping out members generate over $200M in profits with proven strategies, tools, and resources. Join a thriving community of entrepreneurs and start making money online today! $150.00 for 1 month Pay Join Join 82 members Features 24/7 deals, freebies &amp; price errors from major retailers.",
    "Daily crypto &amp; NFT calls from experienced traders.",
    "Access to beginner friendly video guides &amp; tutorials",
    "Professional trading support for stocks &amp; options.",
    "Exclusive one-on-one customer support available 24/7.",
    "N Nico 8 days ago The best Group out there for that Price, really is worth it Written 6 days after purchase",
    "F Fernando 13 days ago hands down the best group Written 21 days after purchase",
    "S S 14 days ago Best group Written 1 month after purchase",
    "T tru 14 days ago shocked is by far the best group i've ever been apart of for crypto. thank you for everything Written 1 year after purchase"
  ],
  "paras": [
    "Sign in S Shocked (Crypto Payments) Exclusive trading community defying the laws of traditional money-making. 4.9 ( 845 ) Trading We specialize in Reselling and Trading, helping out members generate over $200M in profits with proven strategies, tools, and resources.",
    "Join a thriving community of entrepreneurs and start making money online today!",
    "$150.00 for 1 month Pay Join Join 82 members Features 24/7 deals, freebies &amp; price errors from major retailers. Daily crypto &amp; NFT calls from experienced traders. Access to beginner friendly video guides &amp; tutorials Professional trading support for stocks &amp; options. Exclusive one-on-one customer support available 24/7. Reviews 4.90 out of 5 845 total reviews 5 stars 4 stars 3 stars 2 stars 1 star N Nico 8 days ago The best Group out there for that Price, really is worth it",
    "13 days ago hands down the best group",
    "14 days ago Best group",
    "14 days ago shocked is by far the best group i've ever been apart of for crypto. thank you for everything",
    "About the creator J View profile JS @ shockedjs • Joined Mar 2022 Since 2020, Shocked has been the ultimate entrepreneurship community, leveraging our expertise in crypto, stocks, and retail arbitrage. Our team of specialists brings unparalleled knowledge and support, ensuring every member can maximize their potential and profits. FAQs Are there two different memberships? What separates Shocked from other groups? How often is new content posted in the group? Can you guys guarantee that I will make my membership back? What regions does Shocked support? Affiliates S Become an affiliate Shocked 25% reward Earn money by bringing customers to Shocked. Every time a customer purchases using your link, you&#x27;ll earn a commission."
  ],
  "priceTokens": [
    "$200",
    "$200",
    "$200",
    "$200",
    "$150.00",
    "$150.00",
    "$150.00",
    "$200",
    "$1",
    "$1",
    "$1",
    "$22",
    "$1",
    "$1",
    "$1",
    "$1",
    "$1",
    "$2",
    "$1",
    "$2"
  ],
  "faq": [],
  "textSample": "Shocked (Crypto Payments) | Whop Sign in S Shocked (Crypto Payments) Exclusive trading community defying the laws of traditional money-making. 4.9 ( 845 ) Trading We specialize in Reselling and Trading, helping out members generate over $200M in profits with proven strategies, tools, and resources. Join a thriving community of entrepreneurs and start making money online today! $150.00 for 1 month Pay Join Join 82 members Features 24/7 deals, freebies &amp; price errors from major retailers. Daily crypto &amp; NFT calls from experienced traders. Access to beginner friendly video guides &amp; tutorials Professional trading support for stocks &amp; options. Exclusive one-on-one customer support available 24/7. Reviews 4.90 out of 5 845 total reviews 5 stars 4 stars 3 stars 2 stars 1 star N Nico 8 days ago The best Group out there for that Price, really is worth it Written 6 days after purchase F Fernando 13 days ago hands down the best group Written 21 days after purchase S S 14 days ago Best group Written 1 month after purchase T tru 14 days ago shocked is by far the best group i've ever been apart of for crypto. thank you for everything Written 1 year after purchase See all reviews About the creator J View profile JS @ shockedjs • Joined Mar 2022 Since 2020, Shocked has been the ultimate entrepreneurship community, leveraging our expertise in crypto, stocks, and retail arbitrage. Our team of specialists brings unparalleled knowledge and support, ensuring every member can maximize their potential and profits. FAQs Are there two different memberships? What separates Shocked from other groups? How often is new content posted in the group? Can you guys guarantee that I will make my membership back? What regions does Shocked support? Affiliates S Become an affiliate Shocked 25% reward Earn money by bringing customers to Shocked. Every time a customer purchases using your link, you&#x27;ll earn a commission. Shocked (Crypto Payments) $150.00 for 1 month +1 option Join $150.00 for 1 month 1 option Join",
  "finalUrl": "https://whop.com/shocked/shocked-membership-crypto-2c/",
  "fetchedAt": "2025-11-04T19:58:21.062Z",
  "textHash": "4976e04a2a17accac5a9da21ec630453ed7be9c3c9df9dfc575a05bce6e46a76",
  "drilled": false
}