{
  "baseUrl": "https://whop.com/shortkingbets/shortkingbets/?a=alexburnett21",
  "title": "Shortkingbets VIP | Whop",
  "h1": "Shortkingbets VIP",
  "bullets": [
    "Sign in S Shortkingbets VIP Stay short lets cash Sports betting Full access to all plays including NFL, CBB, CFB, MLB, NBA. Full VIP discord access included. $10.00 / week Pay Join Join 19 members Features VIP ALL ACCESS",
    "Full Access to the SKB VIP DISCORD",
    "24/7 Q/A support to answer all your betting questions.",
    "Exclusive bankroll management tips to maximize your profits."
  ],
  "paras": [
    "Sign in S Shortkingbets VIP Stay short lets cash Sports betting Full access to all plays including NFL, CBB, CFB, MLB, NBA. Full VIP discord access included.",
    "$10.00 / week Pay Join Join 19 members Features VIP ALL ACCESS Full Access to the SKB VIP DISCORD 24/7 Q/A support to answer all your betting questions. Exclusive bankroll management tips to maximize your profits. About the creator SK View profile Short King @ shortkingbets • Joined Aug 2022 I&#x27;ve spent years analyzing NFL games and developing strategies that consistently outperform the market. My passion is helping others succeed in sports betting by sharing my insights and tips. FAQs What is included in the NFL Package? How can I access the private chat? Affiliates S Become an affiliate ShortKingBets 30% reward Earn money by bringing customers to ShortKingBets. Every time a customer purchases using your link, you&#x27;ll earn a commission."
  ],
  "priceTokens": [
    "$10.00",
    "$10.00",
    "$10.00",
    "$1",
    "$1",
    "$1",
    "$23",
    "$1",
    "$1",
    "$1",
    "$1",
    "$1",
    "$2",
    "$1",
    "$2",
    "$2",
    "$2",
    "$2",
    "$3",
    "$3"
  ],
  "faq": [],
  "textSample": "Sign in S Shortkingbets VIP Stay short lets cash Sports betting Full access to all plays including NFL, CBB, CFB, MLB, NBA. Full VIP discord access included. $10.00 / week Pay Join Join 19 members Features VIP ALL ACCESS Full Access to the SKB VIP DISCORD 24/7 Q/A support to answer all your betting questions. Exclusive bankroll management tips to maximize your profits. About the creator SK View profile Short King @ shortkingbets • Joined Aug 2022 I&#x27;ve spent years analyzing NFL games and developing strategies that consistently outperform the market. My passion is helping others succeed in sports betting by sharing my insights and tips. FAQs What is included in the NFL Package? How can I access the private chat? Affiliates S Become an affiliate ShortKingBets 30% reward Earn money by bringing customers to ShortKingBets. Every time a customer purchases using your link, you&#x27;ll earn a commission. Shortkingbets VIP $10.00 / week +3 options Join $10.00 / week 3 options Pay Join Pay Join Shortkingbets VIP | Whop",
  "finalUrl": "https://whop.com/shortkingbets/shortkingbets/?a=alexburnett21",
  "fetchedAt": "2025-11-05T10:46:58.938Z",
  "textHash": "2813d6a4ab7992071bc4f92258dcc430a5dcb3bcad60a27352f38d0744cfc8fa",
  "drilled": true
}