{
  "baseUrl": "https://whop.com/skyline-alpha/?a=alexburnett21",
  "title": "Skyline Alpha | Whop",
  "h1": "Skyline Alpha",
  "bullets": [
    "Powered by SA Skyline Alpha 5.0 ( 171 ) Contact seller Products Unmute $7.00 / week Free trial Your One-Stop Shop for All Things Memecoins. Skyline Plus â›ï¸ 5.0 ( 5 ) Unmute $25.00 / month Free trial Skyline Pro ğŸ Skyline Pro ğŸ 5.0 ( 3 ) Unmute $39.99 / month Free trial Your One-Stop Shop for All Things Memecoins. Skyline Deluxe ğŸ’ 5.0 ( 160 ) Contact seller Reviews A Alexander â€¢ Skyline Deluxe ğŸ’ 2 months ago This community is awesome, I see new people all the time, constant calls are being made, people are helping each other learn. All around a great place with great people. Written 2 months after purchase",
    "JF James Folsom â€¢ Skyline Plus â›ï¸ 2 months ago great price and great community. Have learned hella compared to all the other discord groups ive been in it. 2nd month in here only regret it not joining sooner tbh Written 1 month after purchase",
    "NA Nawaf alenei â€¢ Skyline Pro ğŸ 2 months ago Great community with very helpful callouts Written 8 days after purchase",
    "JD James Darmody â€¢ Skyline Plus â›ï¸ 2 months ago Amazing community, very helpful iin every way and lots of people who want to see everyone win Written 9 days after purchase"
  ],
  "paras": [
    "SA Skyline Alpha 5.0 ( 171 ) Contact seller Products Unmute $7.00 / week Free trial Your One-Stop Shop for All Things Memecoins. Skyline Plus â›ï¸ 5.0 ( 5 ) Unmute $25.00 / month Free trial Skyline Pro ğŸ Skyline Pro ğŸ 5.0 ( 3 ) Unmute $39.99 / month Free trial Your One-Stop Shop for All Things Memecoins. Skyline Deluxe ğŸ’ 5.0 ( 160 ) Contact seller Reviews A Alexander â€¢ Skyline Deluxe ğŸ’ 2 months ago This community is awesome, I see new people all the time, constant calls are being made, people are helping each other learn. All around a great place with great people.",
    "2 months ago great price and great community. Have learned hella compared to all the other discord groups ive been in it. 2nd month in here only regret it not joining sooner tbh",
    "2 months ago Great community with very helpful callouts",
    "2 months ago Amazing community, very helpful iin every way and lots of people who want to see everyone win"
  ],
  "priceTokens": [
    "$7.00",
    "$25.00",
    "$39.99",
    "$1",
    "$1",
    "$1",
    "$21",
    "$1",
    "$1",
    "$1",
    "$1",
    "$28",
    "$1",
    "$28",
    "$28",
    "$28",
    "$28",
    "$3",
    "$3",
    "$3"
  ],
  "faq": [],
  "textSample": "Powered by SA Skyline Alpha 5.0 ( 171 ) Contact seller Products Unmute $7.00 / week Free trial Your One-Stop Shop for All Things Memecoins. Skyline Plus â›ï¸ 5.0 ( 5 ) Unmute $25.00 / month Free trial Skyline Pro ğŸ Skyline Pro ğŸ 5.0 ( 3 ) Unmute $39.99 / month Free trial Your One-Stop Shop for All Things Memecoins. Skyline Deluxe ğŸ’ 5.0 ( 160 ) Contact seller Reviews A Alexander â€¢ Skyline Deluxe ğŸ’ 2 months ago This community is awesome, I see new people all the time, constant calls are being made, people are helping each other learn. All around a great place with great people. Written 2 months after purchase JF James Folsom â€¢ Skyline Plus â›ï¸ 2 months ago great price and great community. Have learned hella compared to all the other discord groups ive been in it. 2nd month in here only regret it not joining sooner tbh Written 1 month after purchase NA Nawaf alenei â€¢ Skyline Pro ğŸ 2 months ago Great community with very helpful callouts Written 8 days after purchase JD James Darmody â€¢ Skyline Plus â›ï¸ 2 months ago Amazing community, very helpful iin every way and lots of people who want to see everyone win Written 9 days after purchase See all reviews Skyline Alpha | Whop",
  "finalUrl": "https://whop.com/skyline-alpha/?a=alexburnett21",
  "fetchedAt": "2025-11-05T10:29:56.016Z",
  "textHash": "1c1d4b27cbaf2dfe1f084efe7f7beec22106a39c9f8e8b51c6c8399d2f9c44be",
  "drilled": false
}