{
  "baseUrl": "https://whop.com/snttrades/snttrades-bootcamp/",
  "title": "SNTTRADES NUR VIDEOKURS | Whop",
  "h1": "SNTTRADES NUR VIDEOKURS",
  "bullets": [
    "Sign in Unmute Unmute Unmute Unmute S SNTTRADES NUR VIDEOKURS üì∫ Exklusiver Zugang zum SEITENNULL Videokurs 5.0 ( 9 ) Other Erlerne erfolgreiches Trading mit √ºber 80+ Videos ‚Äì von Grundlagen bis zu fortgeschrittenen Strategien. Inklusive exklusiver Zoom-Recaps f√ºr detaillierte Einblicke! üöÄüìà ‚Ç¨247.00 one-time purchase Pay Join Join 8 members Features +80 Videos rund um Trading und unserer Trading Strategie!",
    "Lebenslanger Zugriff: Einmal kaufen, f√ºr immer lernen!",
    "Flexibles Lernen: Greife jederzeit und von √ºberall auf die Videos zu!",
    "Exklusive Insights: Erhalte Einblicke in professionelle Trading-Ans√§tze!",
    "G gayretbalat 8 months ago Einzig wahre Entscheidung es sind so viele Scammer da drau√üen aber die beiden jungs sind nicht nur extrem fair sonder auch noch sehr gut in dem was sie machen ich habe sehr viel gelernt und lerne immer noch danke f√ºr alles was ihr macht und f√ºr die mega Cummiunity werde demn√§chst meine Challange ge... Show more Written 6 days after purchase",
    "D Dominik 8 months ago Sehr empfehlenswert Written 5 months after purchase",
    "TB Thomas Brandt 8 months ago Beste Entscheidung ‚Äì 1:1 Coaching auf einem neuen Level! Ich hatte ein 1:1 Coaching und kann nur sagen: absolut top! Endlich mal jemand, der Trading ohne Stock im Arsch erkl√§rt ‚Äì locker, verst√§ndlich und auf den Punkt. Kein unn√∂tiges Fachgelaber, sondern direkt umsetzbare Strategien. Ich habe wirkl... Show more Written 9 months after purchase",
    "S suad086 8 months ago Ich bin absolut begeistert von SNTTrades! Das Mentorship ist unglaublich! Man lernt hier nicht nur theoretisch, sondern erh√§lt auch praxisnahen Support, der einem wirklich weiterhilft. Besonders beeindruckend sind die Live Trading Sessions mit den Mentoren, bei denen man in Echtzeit von deren Erfahr... Show more Written 9 months after purchase"
  ],
  "paras": [
    "Sign in Unmute Unmute Unmute Unmute S SNTTRADES NUR VIDEOKURS üì∫ Exklusiver Zugang zum SEITENNULL Videokurs 5.0 ( 9 ) Other Erlerne erfolgreiches Trading mit √ºber 80+ Videos ‚Äì von Grundlagen bis zu fortgeschrittenen Strategien. Inklusive exklusiver Zoom-Recaps f√ºr detaillierte Einblicke! üöÄüìà",
    "Join 8 members Features +80 Videos rund um Trading und unserer Trading Strategie! Lebenslanger Zugriff: Einmal kaufen, f√ºr immer lernen! Flexibles Lernen: Greife jederzeit und von √ºberall auf die Videos zu! Exklusive Insights: Erhalte Einblicke in professionelle Trading-Ans√§tze! Reviews 5 out of 5 9 total reviews 5 stars 4 stars 3 stars 2 stars 1 star G gayretbalat 8 months ago Einzig wahre Entscheidung es sind so viele Scammer da drau√üen aber die beiden jungs sind nicht nur extrem fair sonder auch noch sehr gut in dem was sie machen ich habe sehr viel gelernt und lerne immer noch danke f√ºr alles was ihr macht und f√ºr die mega Cummiunity werde demn√§chst meine Challange ge...",
    "Written 6 days after purchase D Dominik 8 months ago Sehr empfehlenswert",
    "8 months ago Beste Entscheidung ‚Äì 1:1 Coaching auf einem neuen Level! Ich hatte ein 1:1 Coaching und kann nur sagen: absolut top! Endlich mal jemand, der Trading ohne Stock im Arsch erkl√§rt ‚Äì locker, verst√§ndlich und auf den Punkt. Kein unn√∂tiges Fachgelaber, sondern direkt umsetzbare Strategien. Ich habe wirkl...",
    "Written 9 months after purchase S suad086 8 months ago Ich bin absolut begeistert von SNTTrades! Das Mentorship ist unglaublich! Man lernt hier nicht nur theoretisch, sondern erh√§lt auch praxisnahen Support, der einem wirklich weiterhilft. Besonders beeindruckend sind die Live Trading Sessions mit den Mentoren, bei denen man in Echtzeit von deren Erfahr...",
    "Written 9 months after purchase See all reviews About the creator E View profile emrexsnt @ emrexsnt ‚Ä¢ Joined Sep 2023 Wir haben √ºber 3 Jahre Trading-Erfahrung und bin leidenschaftlich daran interessiert, mein Wissen zu teilen. Bei SNTTRADES bauen wir eine unterst√ºtzende Community auf, die den Markt gemeinsam erobern. FAQs Brauch ich Startkapital? Brauch ich vorerfahrung? Warum SNTTRADES Wie lange Tradet ihr schon? Kann ich das Abo jederzeit k√ºndigen? Affiliates S Become an affiliate SNTTRADES 30% reward Earn money by bringing customers to SNTTRADES. Every time a customer purchases using your link, you&#x27;ll earn a commission."
  ],
  "priceTokens": [
    "‚Ç¨247.00",
    "‚Ç¨247.00",
    "‚Ç¨247.00",
    "$1",
    "$1",
    "$1",
    "$22",
    "$1",
    "$1",
    "$1",
    "$1",
    "$1",
    "$2",
    "$1",
    "$2",
    "$2",
    "$2",
    "$2",
    "$3",
    "$3"
  ],
  "faq": [],
  "textSample": "Sign in Unmute Unmute Unmute Unmute S SNTTRADES NUR VIDEOKURS üì∫ Exklusiver Zugang zum SEITENNULL Videokurs 5.0 ( 9 ) Other Erlerne erfolgreiches Trading mit √ºber 80+ Videos ‚Äì von Grundlagen bis zu fortgeschrittenen Strategien. Inklusive exklusiver Zoom-Recaps f√ºr detaillierte Einblicke! üöÄüìà ‚Ç¨247.00 one-time purchase Pay Join Join 8 members Features +80 Videos rund um Trading und unserer Trading Strategie! Lebenslanger Zugriff: Einmal kaufen, f√ºr immer lernen! Flexibles Lernen: Greife jederzeit und von √ºberall auf die Videos zu! Exklusive Insights: Erhalte Einblicke in professionelle Trading-Ans√§tze! Reviews 5 out of 5 9 total reviews 5 stars 4 stars 3 stars 2 stars 1 star G gayretbalat 8 months ago Einzig wahre Entscheidung es sind so viele Scammer da drau√üen aber die beiden jungs sind nicht nur extrem fair sonder auch noch sehr gut in dem was sie machen ich habe sehr viel gelernt und lerne immer noch danke f√ºr alles was ihr macht und f√ºr die mega Cummiunity werde demn√§chst meine Challange ge... Show more Written 6 days after purchase D Dominik 8 months ago Sehr empfehlenswert Written 5 months after purchase TB Thomas Brandt 8 months ago Beste Entscheidung ‚Äì 1:1 Coaching auf einem neuen Level! Ich hatte ein 1:1 Coaching und kann nur sagen: absolut top! Endlich mal jemand, der Trading ohne Stock im Arsch erkl√§rt ‚Äì locker, verst√§ndlich und auf den Punkt. Kein unn√∂tiges Fachgelaber, sondern direkt umsetzbare Strategien. Ich habe wirkl... Show more Written 9 months after purchase S suad086 8 months ago Ich bin absolut begeistert von SNTTrades! Das Mentorship ist unglaublich! Man lernt hier nicht nur theoretisch, sondern erh√§lt auch praxisnahen Support, der einem wirklich weiterhilft. Besonders beeindruckend sind die Live Trading Sessions mit den Mentoren, bei denen man in Echtzeit von deren Erfahr... Show more Written 9 months after purchase See all reviews About the creator E View profile emrexsnt @ emrexsnt ‚Ä¢ Joined Sep 2023 Wir haben √ºber 3 Jahre Trading-Erfahrung und bin leidenschaftlich daran interessiert, mein Wissen zu teilen. Bei SNTTRADES bauen wir eine unterst√ºtzende Community auf, die den Markt gemeinsam erobern. FAQs Brauch ich Startkapital? Brauch ich vorerfahrung? Warum SNTTRADES Wie lange Tradet ihr schon? Kann ich das Abo jederzeit k√ºndigen? Affiliates S Become an affiliate SNTTRADES 30% reward Earn money by bringing customers to SNTTRADES. Every time a customer purchases using your link, you&#x27;ll earn a commission. SNTTRADES NUR VIDEOKURS ‚Ç¨247.00 one-time purchase Join ‚Ç¨247.00 one-time purchase Pay Join Pay Join SNTTRADES NUR VIDEOKURS | Whop",
  "finalUrl": "https://whop.com/snttrades/snttrades-bootcamp/",
  "fetchedAt": "2025-11-04T21:57:35.519Z",
  "textHash": "6f6d3cc8017e4a058b967a4632ca46fc33d8bcf06864ad1840eefac7f0341963",
  "drilled": false
}