{
  "baseUrl": "https://whop.com/sourcedbetting/betbots/",
  "title": "Bots | Whop",
  "h1": "Bots",
  "bullets": [
    "Sign in SB Bots Maximize your mispriced lines profit 4.8 ( 70 ) Sports betting Get access to +EV bets on all major sports from our bots before anyone else. Includes bot results with expected value, closing line expected value, and actual ROI. $24.99 / month 3 day trial Pay Join Features Access to Sourced Betting&#x27;s EV Bots for all major sports",
    "Join a community of bettors for discussions and sharing insights",
    "Tracked bot plays with expected value vs actual ROI comparisons",
    "Monthly access for just $24.99 per month",
    "HB Hugh Barnett 2 months ago Consistent and constant posts - they don't miss a bet which is great Written 1 month after purchase",
    "B bloxom80 8 months ago If you wanna money this is the place for you. I love it and you will too! Written 6 months after purchase",
    "CA Cristian Amores 1 year ago Contributors are very helpful and consistently put out good plays. Written 1 year after purchase",
    "CO Christopher O’Toole 1 year ago You'd be crazy not to join. If you like money, sign up. If not, stay broke. Written 16 days after purchase"
  ],
  "paras": [
    "Sign in SB Bots Maximize your mispriced lines profit 4.8 ( 70 ) Sports betting Get access to +EV bets on all major sports from our bots before anyone else. Includes bot results with expected value, closing line expected value, and actual ROI.",
    "$24.99 / month 3 day trial Pay Join Features Access to Sourced Betting&#x27;s EV Bots for all major sports Join a community of bettors for discussions and sharing insights Tracked bot plays with expected value vs actual ROI comparisons Monthly access for just $24.99 per month Reviews 4.80 out of 5 70 total reviews 5 stars 4 stars 3 stars 2 stars 1 star HB Hugh Barnett 2 months ago Consistent and constant posts - they don't miss a bet which is great",
    "8 months ago If you wanna money this is the place for you. I love it and you will too!",
    "1 year ago Contributors are very helpful and consistently put out good plays.",
    "1 year ago You'd be crazy not to join. If you like money, sign up. If not, stay broke.",
    "About the creator SB View profile Sourced Betting @ plusboosts • Joined Jun 2023 We&#x27;ve spent years mastering the art of sports betting, focusing on maximizing bankroll growth with accurate, high-volume strategies. Join us in this marathon, where we continuously improve and strive for long-term success. FAQs How do I join the Sourced Betting community? What can I expect from the betting algorithms? Affiliates SB Become an affiliate Sourced Betting 30% reward Earn money by bringing customers to Sourced Betting. Every time a customer purchases using your link, you&#x27;ll earn a commission."
  ],
  "priceTokens": [
    "$24.99",
    "$24.99",
    "$24.99",
    "$24.99",
    "$1",
    "$1",
    "$1",
    "$22",
    "$1",
    "$1",
    "$1",
    "$1",
    "$1",
    "$2",
    "$1",
    "$2",
    "$2",
    "$2",
    "$2",
    "$3"
  ],
  "faq": [],
  "textSample": "Sign in SB Bots Maximize your mispriced lines profit 4.8 ( 70 ) Sports betting Get access to +EV bets on all major sports from our bots before anyone else. Includes bot results with expected value, closing line expected value, and actual ROI. $24.99 / month 3 day trial Pay Join Features Access to Sourced Betting&#x27;s EV Bots for all major sports Join a community of bettors for discussions and sharing insights Tracked bot plays with expected value vs actual ROI comparisons Monthly access for just $24.99 per month Reviews 4.80 out of 5 70 total reviews 5 stars 4 stars 3 stars 2 stars 1 star HB Hugh Barnett 2 months ago Consistent and constant posts - they don't miss a bet which is great Written 1 month after purchase B bloxom80 8 months ago If you wanna money this is the place for you. I love it and you will too! Written 6 months after purchase CA Cristian Amores 1 year ago Contributors are very helpful and consistently put out good plays. Written 1 year after purchase CO Christopher O’Toole 1 year ago You'd be crazy not to join. If you like money, sign up. If not, stay broke. Written 16 days after purchase See all reviews About the creator SB View profile Sourced Betting @ plusboosts • Joined Jun 2023 We&#x27;ve spent years mastering the art of sports betting, focusing on maximizing bankroll growth with accurate, high-volume strategies. Join us in this marathon, where we continuously improve and strive for long-term success. FAQs How do I join the Sourced Betting community? What can I expect from the betting algorithms? Affiliates SB Become an affiliate Sourced Betting 30% reward Earn money by bringing customers to Sourced Betting. Every time a customer purchases using your link, you&#x27;ll earn a commission. Bots $24.99 / month +1 option Join $24.99 / month 1 option Pay Join Pay Join Bots | Whop",
  "finalUrl": "https://whop.com/sourcedbetting/betbots/",
  "fetchedAt": "2025-11-04T22:02:14.645Z",
  "textHash": "5927eea80e319d5d836c69bbfec476cf750ecd3fa5d27aa69b0f836f4bcefd86",
  "drilled": false
}