{
  "baseUrl": "https://whop.com/cartoon-money-printers-memberships/?a=alexburnett21",
  "title": "Cartoon Money Printers | Whop",
  "h1": "Cartoon Money Printers",
  "bullets": [
    "Powered by CP Cartoon Money Printers Trading has always fascinated me. With Cartoon Money Printers, I aim to democratize trading knowledge, offering tools and community support to break into the market effectively. 5.0 ( 3 ) Contact seller Products $25.00 / month Free trial Break The Chains, Stop the Grind Subscription with Card 5.0 ( 2 ) $25.00 Break Free and Learn to Trade Pay with Crypto New $250.00 / 6 months Break The Chains, Stop the Grind Lifetime Installments New $1,500.00 Break The Chains, Stop the Grind Lifetime One Time Payment New Contact seller Reviews TS Tim Spyrnal • Subscription with Card 1 year ago Best TA I've seen anywhere by \"Moist\". Has taught me a lot. Great group, doing things the right way. So glad I found them! I finally have a Crypto home :) Written 1 month after purchase",
    "A amytodd1996 1 year ago CMP has been great! I love joining into the weekly streams. it's a friendly knowledgeable community. Written 6 days after purchase",
    "R RedDragon • Subscription with Card 1 month ago Written 10 months after purchase"
  ],
  "paras": [
    "CP Cartoon Money Printers Trading has always fascinated me. With Cartoon Money Printers, I aim to democratize trading knowledge, offering tools and community support to break into the market effectively. 5.0 ( 3 ) Contact seller Products $25.00 / month Free trial Break The Chains, Stop the Grind Subscription with Card 5.0 ( 2 ) $25.00 Break Free and Learn to Trade Pay with Crypto New $250.00 / 6 months Break The Chains, Stop the Grind Lifetime Installments New $1,500.00 Break The Chains, Stop the Grind Lifetime One Time Payment New Contact seller Reviews TS Tim Spyrnal • Subscription with Card 1 year ago Best TA I've seen anywhere by \"Moist\". Has taught me a lot. Great group, doing things the right way. So glad I found them! I finally have a Crypto home :)",
    "1 year ago CMP has been great! I love joining into the weekly streams. it's a friendly knowledgeable community.",
    "1 month ago"
  ],
  "priceTokens": [
    "$25.00",
    "$25.00",
    "$250.00",
    "$1,500.00",
    "$1",
    "$1",
    "$1",
    "$22",
    "$1",
    "$1",
    "$1",
    "$1",
    "$29",
    "$1",
    "$29",
    "$29",
    "$29",
    "$29",
    "$3",
    "$3"
  ],
  "faq": [],
  "textSample": "Powered by CP Cartoon Money Printers Trading has always fascinated me. With Cartoon Money Printers, I aim to democratize trading knowledge, offering tools and community support to break into the market effectively. 5.0 ( 3 ) Contact seller Products $25.00 / month Free trial Break The Chains, Stop the Grind Subscription with Card 5.0 ( 2 ) $25.00 Break Free and Learn to Trade Pay with Crypto New $250.00 / 6 months Break The Chains, Stop the Grind Lifetime Installments New $1,500.00 Break The Chains, Stop the Grind Lifetime One Time Payment New Contact seller Reviews TS Tim Spyrnal • Subscription with Card 1 year ago Best TA I've seen anywhere by \"Moist\". Has taught me a lot. Great group, doing things the right way. So glad I found them! I finally have a Crypto home :) Written 1 month after purchase A amytodd1996 1 year ago CMP has been great! I love joining into the weekly streams. it's a friendly knowledgeable community. Written 6 days after purchase R RedDragon • Subscription with Card 1 month ago Written 10 months after purchase Cartoon Money Printers | Whop",
  "finalUrl": "https://whop.com/cartoon-money-printers-memberships/?a=alexburnett21",
  "fetchedAt": "2025-11-05T17:38:46.203Z",
  "textHash": "c087cb9550afa47d5abbefd647a09ca8a903eaa4fc1d735f50c29f5b53a96dd8",
  "drilled": false
}