{
  "baseUrl": "https://whop.com/supply-drop-monitors/supply-drop-monitors/?a=alexburnett21",
  "title": "Supply Drop Monitors - Premium | Whop",
  "h1": "Supply Drop Monitors - Premium",
  "bullets": [
    "Sign in SM Supply Drop Monitors - Premium Supply Drop Monitors - Try 3 Days Free 5.0 ( 2 ) Other Join our discord community and never miss out on the hottest Sports &amp; TCG releases/restocks! Stay ahead with real-time stock alerts, insider tips and a strong community of hunters! $5.00 / month Pay Join Join 7 members Features Premium In-Stock TCG Monitors",
    "Premium In-Stock Sports Monitors",
    "Community Chats to talk, ask questions, and gain knowledge of the hobby.",
    "S shank311 6 months ago Worth every penny! Admin is super helpful and genuinely wants you to score cards at retail prices! Written 7 days after purchase",
    "J Jim 7 months ago amazing service! and the admin its the greatest guy ever! 100% worth it! Written 11 days after purchase"
  ],
  "paras": [
    "Sign in SM Supply Drop Monitors - Premium Supply Drop Monitors - Try 3 Days Free 5.0 ( 2 ) Other Join our discord community and never miss out on the hottest Sports &amp; TCG releases/restocks! Stay ahead with real-time stock alerts, insider tips and a strong community of hunters!",
    "Join 7 members Features Premium In-Stock TCG Monitors Premium In-Stock Sports Monitors Community Chats to talk, ask questions, and gain knowledge of the hobby. Reviews 5 out of 5 2 total reviews 5 stars 4 stars 3 stars 2 stars 1 star S shank311 6 months ago Worth every penny! Admin is super helpful and genuinely wants you to score cards at retail prices!",
    "7 months ago amazing service! and the admin its the greatest guy ever! 100% worth it!",
    "Affiliates SM Become an affiliate Supply Drop Monitors 5% reward Earn money by bringing customers to Supply Drop Monitors. Every time a customer purchases using your link, you&#x27;ll earn a commission."
  ],
  "priceTokens": [
    "$5.00",
    "$5.00",
    "$5.00",
    "$1",
    "$1",
    "$1",
    "$23",
    "$1",
    "$1",
    "$1",
    "$1",
    "$1",
    "$2",
    "$1",
    "$2",
    "$2",
    "$2",
    "$2",
    "$3",
    "$3"
  ],
  "faq": [],
  "textSample": "Sign in SM Supply Drop Monitors - Premium Supply Drop Monitors - Try 3 Days Free 5.0 ( 2 ) Other Join our discord community and never miss out on the hottest Sports &amp; TCG releases/restocks! Stay ahead with real-time stock alerts, insider tips and a strong community of hunters! $5.00 / month Pay Join Join 7 members Features Premium In-Stock TCG Monitors Premium In-Stock Sports Monitors Community Chats to talk, ask questions, and gain knowledge of the hobby. Reviews 5 out of 5 2 total reviews 5 stars 4 stars 3 stars 2 stars 1 star S shank311 6 months ago Worth every penny! Admin is super helpful and genuinely wants you to score cards at retail prices! Written 7 days after purchase J Jim 7 months ago amazing service! and the admin its the greatest guy ever! 100% worth it! Written 11 days after purchase About the creator L View profile Limitt @ limittog â€¢ Joined Jun 2024 TCG and Sports Cards enthusiasts that buy, sell, and trade! Affiliates SM Become an affiliate Supply Drop Monitors 5% reward Earn money by bringing customers to Supply Drop Monitors. Every time a customer purchases using your link, you&#x27;ll earn a commission. Supply Drop Monitors - Premium $5.00 / month Join $5.00 / month Pay Join Pay Join Supply Drop Monitors - Premium | Whop",
  "finalUrl": "https://whop.com/supply-drop-monitors/supply-drop-monitors/?a=alexburnett21",
  "fetchedAt": "2025-11-04T21:59:18.682Z",
  "textHash": "03dd16676346a589e1e26ea4ab1d535253771763b1db60be1a58a8eddaae70ab",
  "drilled": true
}