{
  "baseUrl": "https://whop.com/masterheart-circle/taxes-are-voluntary/",
  "title": "ðŸ’°&quot;Taxes Are Voluntary&quot; w/ Oto | Whop",
  "h1": "ðŸ’°&quot;Taxes Are Voluntary&quot; w/ Oto",
  "bullets": [
    "ðŸ’°&quot;Taxes Are Voluntary&quot; w/ Oto | Whop Sign in Unmute Unmute Unmute Unmute Unmute Unmute Unmute Unmute FA ðŸ’°&quot;Taxes Are Voluntary&quot; w/ Oto Learn Tax Avoidance Loopholes Using LAW &amp; Blockchain! 5.0 ( 4 ) Business 4-Hour Journey through 7 Mapped Quests in an Interactive Map on breaking FREE from tax obligations utilizing blockchain, Contract &amp; Trust LAW, &amp; recreating you relationship to $$ $133.00 one-time purchase Pay Join Join 93 members Features 7 Modules @ 20-30Min Each",
    "50+ Templates, Samples, for Private Structuring &amp; Tax Avoidance",
    "90 Min Monthly Q&amp;A W/ Oto",
    "Use Trust &amp; Contract Law In The Private Sector",
    "Utilize Blockchain To Avoid A Taxaxable Event",
    "OA Oto Test Account 14 days ago Loving the community so much! Written 4 months after purchase",
    "JA Joe Anderson 11 days ago Written 8 days after purchase",
    "J janski 1 month ago Written 2 days after purchase",
    "AB Ali Brown 1 month ago Written 2 months after purchase"
  ],
  "paras": [
    "Sign in Unmute Unmute Unmute Unmute Unmute Unmute Unmute Unmute FA ðŸ’°&quot;Taxes Are Voluntary&quot; w/ Oto Learn Tax Avoidance Loopholes Using LAW &amp; Blockchain! 5.0 ( 4 ) Business 4-Hour Journey through 7 Mapped Quests in an Interactive Map on breaking FREE from tax obligations utilizing blockchain, Contract &amp; Trust LAW, &amp; recreating you relationship to $$",
    "Join 93 members Features 7 Modules @ 20-30Min Each 50+ Templates, Samples, for Private Structuring &amp; Tax Avoidance 90 Min Monthly Q&amp;A W/ Oto Use Trust &amp; Contract Law In The Private Sector Utilize Blockchain To Avoid A Taxaxable Event Reviews 5 out of 5 4 total reviews 5 stars 4 stars 3 stars 2 stars 1 star OA Oto Test Account 14 days ago Loving the community so much!",
    "11 days ago",
    "1 month ago",
    "1 month ago",
    "Affiliates FA Become an affiliate FREEDOM ACADEMY 10% reward Earn money by bringing customers to FREEDOM ACADEMY . Every time a customer purchases using your link, you&#x27;ll earn a commission."
  ],
  "priceTokens": [
    "$133.00",
    "$133.00",
    "$133.00",
    "$1",
    "$1",
    "$1",
    "$22",
    "$1",
    "$1",
    "$1",
    "$1",
    "$1",
    "$2",
    "$1",
    "$2",
    "$2",
    "$2",
    "$2",
    "$3",
    "$3"
  ],
  "faq": [],
  "textSample": "ðŸ’°&quot;Taxes Are Voluntary&quot; w/ Oto | Whop Sign in Unmute Unmute Unmute Unmute Unmute Unmute Unmute Unmute FA ðŸ’°&quot;Taxes Are Voluntary&quot; w/ Oto Learn Tax Avoidance Loopholes Using LAW &amp; Blockchain! 5.0 ( 4 ) Business 4-Hour Journey through 7 Mapped Quests in an Interactive Map on breaking FREE from tax obligations utilizing blockchain, Contract &amp; Trust LAW, &amp; recreating you relationship to $$ $133.00 one-time purchase Pay Join Join 93 members Features 7 Modules @ 20-30Min Each 50+ Templates, Samples, for Private Structuring &amp; Tax Avoidance 90 Min Monthly Q&amp;A W/ Oto Use Trust &amp; Contract Law In The Private Sector Utilize Blockchain To Avoid A Taxaxable Event Reviews 5 out of 5 4 total reviews 5 stars 4 stars 3 stars 2 stars 1 star OA Oto Test Account 14 days ago Loving the community so much! Written 4 months after purchase JA Joe Anderson 11 days ago Written 8 days after purchase J janski 1 month ago Written 2 days after purchase AB Ali Brown 1 month ago Written 2 months after purchase About the creator OG View profile Oto Gomes @ otogomes â€¢ Joined Mar 2025 Paths to INNERstanding Your Relationship to Money, Utilizing Blockchain, in the Private Sector to Build Generational Wealth ðŸ’° Affiliates FA Become an affiliate FREEDOM ACADEMY 10% reward Earn money by bringing customers to FREEDOM ACADEMY . Every time a customer purchases using your link, you&#x27;ll earn a commission. ðŸ’°&quot;Taxes Are Voluntary&quot; w/ Oto $133.00 one-time purchase Join $133.00 one-time purchase Pay Join Pay Join",
  "finalUrl": "https://whop.com/masterheart-circle/taxes-are-voluntary/",
  "fetchedAt": "2025-11-05T09:28:22.931Z",
  "textHash": "168debbdef6f73a1d3fcee921168fb33611affc5d7c6aa11c4fdb2c3ac926cd2",
  "drilled": false
}