{
  "baseUrl": "https://whop.com/monthly-membership-42/th-picks/",
  "title": "TH Picks | Whop",
  "h1": "TH Picks",
  "bullets": [
    "Sign in Unmute Unmute TP TH Picks TH Picks- Expert AI Sports Betting Model for Consistent Wins 4.7 ( 36 ) Other With years of experience in sports betting, I specialize in analyzing data, trends, and strategies to maximize winning potential. I trained an AI to generate only winning props. $15.00 / week Pay Join Features Access to all of my slips and the best tips to become a profitable sports bettor",
    "KD Kinzell Downing 1 year ago Super excited for joining … Bank roll is growing… Football I will be at 10K goal with this Money Discord Team … Written 24 days after purchase",
    "WJ Wyatt Jensen 1 year ago This discord cashes out everyday. He really legit. Written 6 days after purchase",
    "AB Austin Brittain 1 year ago This guy is really legit and his picks do really well. Written 18 days after purchase",
    "AB Austin Brittain 1 year ago This guy is really legit and his slips been making good bank, should def join. Written 14 days after purchase"
  ],
  "paras": [
    "Sign in Unmute Unmute TP TH Picks TH Picks- Expert AI Sports Betting Model for Consistent Wins 4.7 ( 36 ) Other With years of experience in sports betting, I specialize in analyzing data, trends, and strategies to maximize winning potential. I trained an AI to generate only winning props.",
    "$15.00 / week Pay Join Features Access to all of my slips and the best tips to become a profitable sports bettor Reviews 4.67 out of 5 36 total reviews 5 stars 4 stars 3 stars 2 stars 1 star KD Kinzell Downing 1 year ago Super excited for joining … Bank roll is growing… Football I will be at 10K goal with this Money Discord Team …",
    "1 year ago This discord cashes out everyday. He really legit.",
    "1 year ago This guy is really legit and his picks do really well.",
    "1 year ago This guy is really legit and his slips been making good bank, should def join.",
    "About the creator TW View profile TH Picks - Expert Sports Betting Tips For Consistent Wins @ thpicks • Joined Nov 2023 I&#x27;ve dedicated my career to mastering the art of sports betting. With TH Picks, I aim to share my expertise and help others bet like pros. Our community is all about smart betting and maximizing profits. FAQs What&#x27;s your refund policy? How many slips do you post a day? How come I can&#x27;t see Premium? Where are the bets posted? Affiliates TP Become an affiliate TH Picks 30% reward Earn money by bringing customers to TH Picks. Every time a customer purchases using your link, you&#x27;ll earn a commission."
  ],
  "priceTokens": [
    "$15.00",
    "$15.00",
    "$15.00",
    "$1",
    "$1",
    "$1",
    "$22",
    "$1",
    "$1",
    "$1",
    "$1",
    "$1",
    "$2",
    "$1",
    "$2",
    "$2",
    "$2",
    "$2",
    "$3",
    "$3"
  ],
  "faq": [],
  "textSample": "Sign in Unmute Unmute TP TH Picks TH Picks- Expert AI Sports Betting Model for Consistent Wins 4.7 ( 36 ) Other With years of experience in sports betting, I specialize in analyzing data, trends, and strategies to maximize winning potential. I trained an AI to generate only winning props. $15.00 / week Pay Join Features Access to all of my slips and the best tips to become a profitable sports bettor Reviews 4.67 out of 5 36 total reviews 5 stars 4 stars 3 stars 2 stars 1 star KD Kinzell Downing 1 year ago Super excited for joining … Bank roll is growing… Football I will be at 10K goal with this Money Discord Team … Written 24 days after purchase WJ Wyatt Jensen 1 year ago This discord cashes out everyday. He really legit. Written 6 days after purchase AB Austin Brittain 1 year ago This guy is really legit and his picks do really well. Written 18 days after purchase AB Austin Brittain 1 year ago This guy is really legit and his slips been making good bank, should def join. Written 14 days after purchase See all reviews About the creator TW View profile TH Picks - Expert Sports Betting Tips For Consistent Wins @ thpicks • Joined Nov 2023 I&#x27;ve dedicated my career to mastering the art of sports betting. With TH Picks, I aim to share my expertise and help others bet like pros. Our community is all about smart betting and maximizing profits. FAQs What&#x27;s your refund policy? How many slips do you post a day? How come I can&#x27;t see Premium? Where are the bets posted? Affiliates TP Become an affiliate TH Picks 30% reward Earn money by bringing customers to TH Picks. Every time a customer purchases using your link, you&#x27;ll earn a commission. TH Picks $15.00 / week +2 options Join $15.00 / week 2 options Pay Join Pay Join TH Picks | Whop",
  "finalUrl": "https://whop.com/monthly-membership-42/th-picks/",
  "fetchedAt": "2025-11-05T09:34:10.975Z",
  "textHash": "b13aa2ab07129bbf312c427b019d0328bcd3dbc65c6b92c631a0fa7ac2053429",
  "drilled": false
}