{
  "baseUrl": "https://whop.com/tlt-long-term-access/?a=alexburnett21",
  "title": "The Lock Talk | Whop",
  "h1": "The Lock Talk",
  "bullets": [
    "Powered by TT The Lock Talk With years of experience in sports betting, I combine Wall Street tactics with proprietary algorithms to deliver top-tier picks. My passion for data-driven decisions and customer satisfaction fuels Th... More 5.0 ( 7 ) Contact seller Products $85.00 / 3 days Bet Smart, Win Big with TLT The Lock Talk Long-Term 5.0 ( 5 ) Free Bet Smart with Free Plays &amp; Updates The Lock Talk Free Channel 5.0 ( 2 ) $35.00 Bet Smart, Win Big with Wall Street Tactics The Lock Talk Daily Card New Contact seller Reviews RR Rob Reardon â€¢ The Lock Talk Long-Term 1 year ago Locks analytical research and breakdown of each play is 2nd to none. Ive bought plenty of plays before and the level of confidence I have with lock talk is by far the highest. Great guy too. Extended me an extra 2 days on my subscription when we didnâ€™t profit 1 day. Written 10 days after purchase",
    "CG Cameron Gamez â€¢ The Lock Talk Long-Term 1 year ago Lock provides one of the fastest responding support teams. Written 1 month after purchase",
    "AC Arlis Castro â€¢ The Lock Talk Long-Term 2 years ago Learned a lot and earned lots of money with the team. Very supportive Written 19 days after purchase",
    "DM Devon Mcdaniels â€¢ The Lock Talk Long-Term 2 years ago Got the locks ðŸ”’ for sure great pick come win money ðŸ’µðŸ’° Written 11 hours after purchase"
  ],
  "paras": [
    "TT The Lock Talk With years of experience in sports betting, I combine Wall Street tactics with proprietary algorithms to deliver top-tier picks. My passion for data-driven decisions and customer satisfaction fuels Th... More 5.0 ( 7 ) Contact seller Products $85.00 / 3 days Bet Smart, Win Big with TLT The Lock Talk Long-Term 5.0 ( 5 ) Free Bet Smart with Free Plays &amp; Updates The Lock Talk Free Channel 5.0 ( 2 ) $35.00 Bet Smart, Win Big with Wall Street Tactics The Lock Talk Daily Card New Contact seller Reviews RR Rob Reardon â€¢ The Lock Talk Long-Term 1 year ago Locks analytical research and breakdown of each play is 2nd to none. Ive bought plenty of plays before and the level of confidence I have with lock talk is by far the highest. Great guy too. Extended me an extra 2 days on my subscription when we didnâ€™t profit 1 day.",
    "1 year ago Lock provides one of the fastest responding support teams.",
    "2 years ago Learned a lot and earned lots of money with the team. Very supportive",
    "2 years ago Got the locks ðŸ”’ for sure great pick come win money ðŸ’µðŸ’°"
  ],
  "priceTokens": [
    "$85.00",
    "$35.00",
    "$1",
    "$1",
    "$1",
    "$21",
    "$1",
    "$1",
    "$1",
    "$1",
    "$28",
    "$1",
    "$28",
    "$28",
    "$28",
    "$28",
    "$3",
    "$3",
    "$3",
    "$10"
  ],
  "faq": [],
  "textSample": "Powered by TT The Lock Talk With years of experience in sports betting, I combine Wall Street tactics with proprietary algorithms to deliver top-tier picks. My passion for data-driven decisions and customer satisfaction fuels Th... More 5.0 ( 7 ) Contact seller Products $85.00 / 3 days Bet Smart, Win Big with TLT The Lock Talk Long-Term 5.0 ( 5 ) Free Bet Smart with Free Plays &amp; Updates The Lock Talk Free Channel 5.0 ( 2 ) $35.00 Bet Smart, Win Big with Wall Street Tactics The Lock Talk Daily Card New Contact seller Reviews RR Rob Reardon â€¢ The Lock Talk Long-Term 1 year ago Locks analytical research and breakdown of each play is 2nd to none. Ive bought plenty of plays before and the level of confidence I have with lock talk is by far the highest. Great guy too. Extended me an extra 2 days on my subscription when we didnâ€™t profit 1 day. Written 10 days after purchase CG Cameron Gamez â€¢ The Lock Talk Long-Term 1 year ago Lock provides one of the fastest responding support teams. Written 1 month after purchase AC Arlis Castro â€¢ The Lock Talk Long-Term 2 years ago Learned a lot and earned lots of money with the team. Very supportive Written 19 days after purchase DM Devon Mcdaniels â€¢ The Lock Talk Long-Term 2 years ago Got the locks ðŸ”’ for sure great pick come win money ðŸ’µðŸ’° Written 11 hours after purchase See all reviews The Lock Talk | Whop",
  "finalUrl": "https://whop.com/tlt-long-term-access/?a=alexburnett21",
  "fetchedAt": "2025-11-04T21:43:46.948Z",
  "textHash": "ba148e69482e67c5b4b44aeeaa53bfeae9f5d0fe5d097d7ef536de76120efbb7",
  "drilled": false
}