{
  "baseUrl": "https://whop.com/v-i-p-outlet-secret-to-sports-betting-guide/premium-outlet-secret-to-sports-betting-guide/",
  "title": "The Outlet Premium | Whop",
  "h1": "The Outlet Premium",
  "bullets": [
    "Sign in TO The Outlet Premium Your Smart Sports Betting Connection 4.7 ( 156 ) Sports betting Enhance your sports betting with expert picks, in-depth analytics, and exclusive content for a smarter, winning strategy. $35.99 / week Pay Join Features Access to high-probability picks and expert analysis from top betting apps.",
    "In-depth analytics offering detailed statistics, trends, and predictions.",
    "Exclusive content with betting guides, tutorials, and articles.",
    "Fantasy sports picks from popular sportsbooks to boost your game.",
    "Daily value-based picks for major sports to maximize winnings.",
    "P paletorpedo 8 months ago VIP is a different level. The AI finds edges that most people miss, and the results are unreal. Written 7 hours after purchase",
    "P paletorpedo 8 months ago The AI makes VIP a complete sports betting experience. The winning percentages are unlike anything I’ve seen. Written 7 hours after purchase",
    "P paletorpedo 8 months ago Upgraded to VIP, and I’ll never go back. The AI’s hit rate on spreads and player props is unreal. Written 7 hours after purchase",
    "P paletorpedo 8 months ago Premium is exactly what I needed. More in-depth analysis and extra picks give me way more options to bet smart. Written 7 hours after purchase"
  ],
  "paras": [
    "Sign in TO The Outlet Premium Your Smart Sports Betting Connection 4.7 ( 156 ) Sports betting Enhance your sports betting with expert picks, in-depth analytics, and exclusive content for a smarter, winning strategy.",
    "$35.99 / week Pay Join Features Access to high-probability picks and expert analysis from top betting apps. In-depth analytics offering detailed statistics, trends, and predictions. Exclusive content with betting guides, tutorials, and articles. Fantasy sports picks from popular sportsbooks to boost your game. Daily value-based picks for major sports to maximize winnings. Reviews 4.72 out of 5 156 total reviews 5 stars 4 stars 3 stars 2 stars 1 star P paletorpedo 8 months ago VIP is a different level. The AI finds edges that most people miss, and the results are unreal.",
    "8 months ago The AI makes VIP a complete sports betting experience. The winning percentages are unlike anything I’ve seen.",
    "8 months ago Upgraded to VIP, and I’ll never go back. The AI’s hit rate on spreads and player props is unreal.",
    "8 months ago Premium is exactly what I needed. More in-depth analysis and extra picks give me way more options to bet smart.",
    "About the creator TO View profile The Outlet @ mangaboi223 • Joined Jul 2024 Complete statistical sports betting and analytic information provided to you by the best team of analysts. Our community offers in-depth analytical data on all picks with high chances of success for you to easily cash out. We are not giving finacial advice nor do we guarantee any finacial profit. FAQs Q:Howcome I paid but wasn’t added to discord? Q:Howcome I just paid and didn’t get the discord or anything? Q: Do you have E-Sports as well? Affiliates TO Become an affiliate The Outlet 25% reward Earn money by bringing customers to The Outlet. Every time a customer purchases using your link, you&#x27;ll earn a commission."
  ],
  "priceTokens": [
    "$35.99",
    "$35.99",
    "$35.99",
    "$1",
    "$1",
    "$1",
    "$23",
    "$1",
    "$1",
    "$1",
    "$1",
    "$1",
    "$2",
    "$1",
    "$2",
    "$2",
    "$2",
    "$2",
    "$3",
    "$3"
  ],
  "faq": [],
  "textSample": "Sign in TO The Outlet Premium Your Smart Sports Betting Connection 4.7 ( 156 ) Sports betting Enhance your sports betting with expert picks, in-depth analytics, and exclusive content for a smarter, winning strategy. $35.99 / week Pay Join Features Access to high-probability picks and expert analysis from top betting apps. In-depth analytics offering detailed statistics, trends, and predictions. Exclusive content with betting guides, tutorials, and articles. Fantasy sports picks from popular sportsbooks to boost your game. Daily value-based picks for major sports to maximize winnings. Reviews 4.72 out of 5 156 total reviews 5 stars 4 stars 3 stars 2 stars 1 star P paletorpedo 8 months ago VIP is a different level. The AI finds edges that most people miss, and the results are unreal. Written 7 hours after purchase P paletorpedo 8 months ago The AI makes VIP a complete sports betting experience. The winning percentages are unlike anything I’ve seen. Written 7 hours after purchase P paletorpedo 8 months ago Upgraded to VIP, and I’ll never go back. The AI’s hit rate on spreads and player props is unreal. Written 7 hours after purchase P paletorpedo 8 months ago Premium is exactly what I needed. More in-depth analysis and extra picks give me way more options to bet smart. Written 7 hours after purchase See all reviews About the creator TO View profile The Outlet @ mangaboi223 • Joined Jul 2024 Complete statistical sports betting and analytic information provided to you by the best team of analysts. Our community offers in-depth analytical data on all picks with high chances of success for you to easily cash out. We are not giving finacial advice nor do we guarantee any finacial profit. FAQs Q:Howcome I paid but wasn’t added to discord? Q:Howcome I just paid and didn’t get the discord or anything? Q: Do you have E-Sports as well? Affiliates TO Become an affiliate The Outlet 25% reward Earn money by bringing customers to The Outlet. Every time a customer purchases using your link, you&#x27;ll earn a commission. The Outlet Premium $35.99 / week +3 options Join $35.99 / week 3 options Pay Join Pay Join The Outlet Premium | Whop",
  "finalUrl": "https://whop.com/v-i-p-outlet-secret-to-sports-betting-guide/premium-outlet-secret-to-sports-betting-guide/",
  "fetchedAt": "2025-11-05T10:33:23.746Z",
  "textHash": "9339ce0db6cd082b6eb0332bd64c5f442668219b2ba3abcd9f9563b816d31c0f",
  "drilled": false
}