{
  "baseUrl": "https://whop.com/the-art-of-financing/?a=alexburnett21",
  "title": "The Art of Financing | Whop",
  "h1": "The Art of Financing",
  "bullets": [
    "Powered by TF The Art of Financing I funded my startup with $250k of 0% interest financing from the bank and helped countless others do the same. 5.0 ( 35 ) Contact seller Products $998.99 Learn How To Get $100K of 0% APR Money From The Bank The Art of Financing 5.0 ( 35 ) Contact seller Reviews SK Scott Kelly 9 months ago Absolute sauce in here! Gave me clarity and action steps to secure a what was needed Written 17 days after purchase",
    "N nutritionaldiversityworld 9 months ago Everyone should know how to become a ready applicant for financing, the ins and outs so that they can utilize the powerful resources out in the world. This course is comprehensive, very well-put-together and also precise and to the point. Great learning, and layout - would do it again, have recomme... Show more Written 21 days after purchase",
    "CB Chris Burke 9 months ago Material is thorough, well structured, and gets to the point. No BS type of work with simple instruction. Written 20 days after purchase",
    "J jaylanmillers 9 months ago Great information, I've learned a lot from these courses and recommend to anyone wanting to obtain capital for there new business! Written 1 month after purchase"
  ],
  "paras": [
    "TF The Art of Financing I funded my startup with $250k of 0% interest financing from the bank and helped countless others do the same. 5.0 ( 35 ) Contact seller Products $998.99 Learn How To Get $100K of 0% APR Money From The Bank The Art of Financing 5.0 ( 35 ) Contact seller Reviews SK Scott Kelly 9 months ago Absolute sauce in here! Gave me clarity and action steps to secure a what was needed",
    "9 months ago Everyone should know how to become a ready applicant for financing, the ins and outs so that they can utilize the powerful resources out in the world. This course is comprehensive, very well-put-together and also precise and to the point. Great learning, and layout - would do it again, have recomme...",
    "Written 21 days after purchase CB Chris Burke 9 months ago Material is thorough, well structured, and gets to the point. No BS type of work with simple instruction.",
    "9 months ago Great information, I've learned a lot from these courses and recommend to anyone wanting to obtain capital for there new business!"
  ],
  "priceTokens": [
    "$250",
    "$998.99",
    "$100",
    "$1",
    "$1",
    "$1",
    "$21",
    "$1",
    "$1",
    "$1",
    "$1",
    "$28",
    "$1",
    "$28",
    "$28",
    "$28",
    "$28",
    "$3",
    "$3",
    "$3"
  ],
  "faq": [],
  "textSample": "Powered by TF The Art of Financing I funded my startup with $250k of 0% interest financing from the bank and helped countless others do the same. 5.0 ( 35 ) Contact seller Products $998.99 Learn How To Get $100K of 0% APR Money From The Bank The Art of Financing 5.0 ( 35 ) Contact seller Reviews SK Scott Kelly 9 months ago Absolute sauce in here! Gave me clarity and action steps to secure a what was needed Written 17 days after purchase N nutritionaldiversityworld 9 months ago Everyone should know how to become a ready applicant for financing, the ins and outs so that they can utilize the powerful resources out in the world. This course is comprehensive, very well-put-together and also precise and to the point. Great learning, and layout - would do it again, have recomme... Show more Written 21 days after purchase CB Chris Burke 9 months ago Material is thorough, well structured, and gets to the point. No BS type of work with simple instruction. Written 20 days after purchase J jaylanmillers 9 months ago Great information, I've learned a lot from these courses and recommend to anyone wanting to obtain capital for there new business! Written 1 month after purchase See all reviews The Art of Financing | Whop",
  "finalUrl": "https://whop.com/the-art-of-financing/?a=alexburnett21",
  "fetchedAt": "2025-11-05T10:41:38.554Z",
  "textHash": "ee1d909c88b6783a1ab09ae608a3c78288f0fe260983463fa1789ae9436a8a66",
  "drilled": false
}