{
  "baseUrl": "https://whop.com/ambassador-academy/shein-brand-ambassador-program-rqiawmndkha01yj/",
  "title": "The SHEIN Ambassador Program | Whop",
  "h1": "The SHEIN Ambassador Program",
  "bullets": [
    "The SHEIN Ambassador Program | Whop Sign in Unmute Unmute AA The SHEIN Ambassador Program Become a SHEIN Ambassador Within 7 Days Guaranteed 4.3 ( 97 ) Careers Learn how to get paid to review hauls as a SHEIN Ambassador after completing our 7 day training program! $29.00 / 8 days 1 day trial + $7.99 initial fee Pay Join Join 371 members Features Make Up To $40/Hr",
    "Review Hauls And Keep Whatever You Like",
    "$750 Welcome Voucher",
    "1-Year Ambassador Certificate",
    "Free Monthly Hauls",
    "TA Tocarra Anderson 4 months ago I’m not happy with service I received Written 2 months after purchase",
    "CS Cassandra Simmons 8 months ago I love it Written 7 minutes after purchase",
    "PA Pamela Alston 9 months ago I have also been waiting on my certificate, what's going on? Written 1 month after purchase",
    "OD Olga Delacruz 9 months ago I can't wait... Just very curious and excited about learning the tricks and trades of the retail online business.... Meeting people all around the world...it's going to open so many doors... Written 21 hours after purchase"
  ],
  "paras": [
    "Sign in Unmute Unmute AA The SHEIN Ambassador Program Become a SHEIN Ambassador Within 7 Days Guaranteed 4.3 ( 97 ) Careers Learn how to get paid to review hauls as a SHEIN Ambassador after completing our 7 day training program!",
    "1 day trial + $7.99 initial fee Pay Join Join 371 members Features Make Up To $40/Hr Review Hauls And Keep Whatever You Like $750 Welcome Voucher 1-Year Ambassador Certificate Free Monthly Hauls Reviews 4.29 out of 5 97 total reviews 5 stars 4 stars 3 stars 2 stars 1 star TA Tocarra Anderson 4 months ago I’m not happy with service I received",
    "8 months ago I love it",
    "9 months ago I have also been waiting on my certificate, what's going on?",
    "9 months ago I can't wait... Just very curious and excited about learning the tricks and trades of the retail online business.... Meeting people all around the world...it's going to open so many doors...",
    "About the creator TA View profile The Academy @ ambassadoracademy • Joined Jan 2025 Learn how to get paid by your favorite brands for reviewing products! We&#x27;re partnered with over 100 major fashion brands to help bridge the gap between brand and creator. FAQs How does this work? How many hauls will I get? What is The Ambassador Academy? Affiliates AA Become an affiliate Ambassador Academy 25% reward Earn money by bringing customers to Ambassador Academy. Every time a customer purchases using your link, you&#x27;ll earn a commission."
  ],
  "priceTokens": [
    "$29.00",
    "$7.99",
    "$40",
    "$750",
    "$29.00",
    "$29.00",
    "$1",
    "$1",
    "$1",
    "$23",
    "$1",
    "$1",
    "$1",
    "$1",
    "$1",
    "$2",
    "$1",
    "$2",
    "$2",
    "$2"
  ],
  "faq": [],
  "textSample": "The SHEIN Ambassador Program | Whop Sign in Unmute Unmute AA The SHEIN Ambassador Program Become a SHEIN Ambassador Within 7 Days Guaranteed 4.3 ( 97 ) Careers Learn how to get paid to review hauls as a SHEIN Ambassador after completing our 7 day training program! $29.00 / 8 days 1 day trial + $7.99 initial fee Pay Join Join 371 members Features Make Up To $40/Hr Review Hauls And Keep Whatever You Like $750 Welcome Voucher 1-Year Ambassador Certificate Free Monthly Hauls Reviews 4.29 out of 5 97 total reviews 5 stars 4 stars 3 stars 2 stars 1 star TA Tocarra Anderson 4 months ago I’m not happy with service I received Written 2 months after purchase CS Cassandra Simmons 8 months ago I love it Written 7 minutes after purchase PA Pamela Alston 9 months ago I have also been waiting on my certificate, what's going on? Written 1 month after purchase OD Olga Delacruz 9 months ago I can't wait... Just very curious and excited about learning the tricks and trades of the retail online business.... Meeting people all around the world...it's going to open so many doors... Written 21 hours after purchase See all reviews About the creator TA View profile The Academy @ ambassadoracademy • Joined Jan 2025 Learn how to get paid by your favorite brands for reviewing products! We&#x27;re partnered with over 100 major fashion brands to help bridge the gap between brand and creator. FAQs How does this work? How many hauls will I get? What is The Ambassador Academy? Affiliates AA Become an affiliate Ambassador Academy 25% reward Earn money by bringing customers to Ambassador Academy. Every time a customer purchases using your link, you&#x27;ll earn a commission. The SHEIN Ambassador Program $29.00 / 8 days Join $29.00 / 8 days Pay Join Pay Join",
  "finalUrl": "https://whop.com/ambassador-academy/shein-brand-ambassador-program-rqiawmndkha01yj/",
  "fetchedAt": "2025-11-05T17:25:39.306Z",
  "textHash": "1487001665396d0980a8b2f13c9d16b830cffae8159c952e35f6c75fce3e81c3",
  "drilled": false
}