{
  "baseUrl": "https://whop.com/premium-4f/the-financial-cloud/",
  "title": "The Financial Cloud Combo | Whop",
  "h1": "The Financial Cloud Combo",
  "bullets": [
    "Sign in TC The Financial Cloud Combo Achieve Financial Freedom with Expert Trading with TFC 4.5 ( 2 ) Trading Live Trading With Experts (Daily) Trade Ideas, &amp; Alerts Private Discord Voice &amp; Direct Message Alerts Educational Lessons Industry leading indicators $75.00 / month Pay Join Features Daily live trading sessions with expert traders",
    "Access to 100s of hours of educational content",
    "Private Discord community with 24/7 support",
    "Custom indicators and advanced trading tools",
    "Weekly newsletter with trade ideas and market insights",
    "C Calvin 3 months ago Great support. Great knowledge base, only wish if they can do bit more frequent maintenance on indicators. Fixing bugs or refine some settings. But great value here Written 20 days after purchase",
    "I izzeholic 2 months ago Written 3 months after purchase"
  ],
  "paras": [
    "Sign in TC The Financial Cloud Combo Achieve Financial Freedom with Expert Trading with TFC 4.5 ( 2 ) Trading Live Trading With Experts (Daily)",
    "Trade Ideas, &amp; Alerts",
    "Private Discord",
    "Voice &amp; Direct Message Alerts",
    "Educational Lessons",
    "Industry leading indicators",
    "Daily live trading sessions with expert traders Access to 100s of hours of educational content Private Discord community with 24/7 support Custom indicators and advanced trading tools Weekly newsletter with trade ideas and market insights Reviews 4.50 out of 5 2 total reviews 5 stars 4 stars 3 stars 2 stars 1 star C Calvin 3 months ago Great support. Great knowledge base, only wish if they can do bit more frequent maintenance on indicators. Fixing bugs or refine some settings. But great value here",
    "2 months ago",
    "FAQs How often do you have live trading sessions? Why would I subscribe? Affiliates TC Become an affiliate The Financial Cloud 10% reward Earn money by bringing customers to The Financial Cloud. Every time a customer purchases using your link, you&#x27;ll earn a commission."
  ],
  "priceTokens": [
    "$75.00",
    "$75.00",
    "$75.00",
    "$1",
    "$1",
    "$1",
    "$22",
    "$1",
    "$1",
    "$1",
    "$1",
    "$1",
    "$2",
    "$1",
    "$2",
    "$2",
    "$2",
    "$2",
    "$3",
    "$3"
  ],
  "faq": [],
  "textSample": "Sign in TC The Financial Cloud Combo Achieve Financial Freedom with Expert Trading with TFC 4.5 ( 2 ) Trading Live Trading With Experts (Daily) Trade Ideas, &amp; Alerts Private Discord Voice &amp; Direct Message Alerts Educational Lessons Industry leading indicators $75.00 / month Pay Join Features Daily live trading sessions with expert traders Access to 100s of hours of educational content Private Discord community with 24/7 support Custom indicators and advanced trading tools Weekly newsletter with trade ideas and market insights Reviews 4.50 out of 5 2 total reviews 5 stars 4 stars 3 stars 2 stars 1 star C Calvin 3 months ago Great support. Great knowledge base, only wish if they can do bit more frequent maintenance on indicators. Fixing bugs or refine some settings. But great value here Written 20 days after purchase I izzeholic 2 months ago Written 3 months after purchase About the creator TC View profile The Financial Cloud @ thefinancialcloud â€¢ Joined Jun 2024 I&#x27;ve dedicated my career to simplifying trading for everyone. I have gathered the strongest team I could find to bring you trading education, a vibrant community, and high-quality trades at the best price around. FAQs How often do you have live trading sessions? Why would I subscribe? Affiliates TC Become an affiliate The Financial Cloud 10% reward Earn money by bringing customers to The Financial Cloud. Every time a customer purchases using your link, you&#x27;ll earn a commission. The Financial Cloud Combo $75.00 / month Join $75.00 / month Pay Join Pay Join The Financial Cloud Combo | Whop",
  "finalUrl": "https://whop.com/premium-4f/the-financial-cloud/",
  "fetchedAt": "2025-11-04T21:45:01.439Z",
  "textHash": "dae1b9564f973a42be4fc853d312cfb5581425a57fb8da93a09545a4977573fe",
  "drilled": false
}