{
  "baseUrl": "https://whop.com/premium-4f/tfc-indicators/",
  "title": "The Financial Cloud Indicators | Whop",
  "h1": "The Financial Cloud Indicators",
  "bullets": [
    "Sign in TC The Financial Cloud Indicators Make Trading Easy, Fast &amp; Accurate with TFC 4.5 ( 2 ) Trading Important Daily Levels Market Internals Tick Chart Opening Range Breakouts ADR Zones Quad Momentum Trend Detection Anchored VWAP EMAs FVG Zones VCI Zones $29.00 / month 7 day trial Pay Join Features Daily live trading sessions with expert traders.",
    "Access to 100s of hours of educational content.",
    "Join a 24/7 private trading community.",
    "Receive a weekly newsletter with trade ideas.",
    "Utilize institutional-grade trading tools.",
    "C Calvin 3 months ago Great support. Great knowledge base, only wish if they can do bit more frequent maintenance on indicators. Fixing bugs or refine some settings. But great value here Written 20 days after purchase",
    "I izzeholic 2 months ago Written 3 months after purchase"
  ],
  "paras": [
    "Sign in TC The Financial Cloud Indicators Make Trading Easy, Fast &amp; Accurate with TFC 4.5 ( 2 ) Trading Important Daily Levels",
    "Market Internals",
    "Tick Chart",
    "Opening Range Breakouts",
    "ADR Zones",
    "Quad Momentum Trend Detection",
    "Anchored VWAP",
    "EMAs",
    "FVG Zones",
    "VCI Zones",
    "$29.00 / month 7 day trial Pay Join Features Daily live trading sessions with expert traders. Access to 100s of hours of educational content. Join a 24/7 private trading community. Receive a weekly newsletter with trade ideas. Utilize institutional-grade trading tools. Reviews 4.50 out of 5 2 total reviews 5 stars 4 stars 3 stars 2 stars 1 star C Calvin 3 months ago Great support. Great knowledge base, only wish if they can do bit more frequent maintenance on indicators. Fixing bugs or refine some settings. But great value here",
    "2 months ago",
    "FAQs How often do you have live trading sessions? Why would I subscribe? Affiliates TC Become an affiliate The Financial Cloud 30% reward Earn money by bringing customers to The Financial Cloud. Every time a customer purchases using your link, you&#x27;ll earn a commission."
  ],
  "priceTokens": [
    "$29.00",
    "$29.00",
    "$29.00",
    "$1",
    "$1",
    "$1",
    "$22",
    "$1",
    "$1",
    "$1",
    "$1",
    "$1",
    "$2",
    "$1",
    "$2",
    "$2",
    "$2",
    "$2",
    "$3",
    "$3"
  ],
  "faq": [],
  "textSample": "Sign in TC The Financial Cloud Indicators Make Trading Easy, Fast &amp; Accurate with TFC 4.5 ( 2 ) Trading Important Daily Levels Market Internals Tick Chart Opening Range Breakouts ADR Zones Quad Momentum Trend Detection Anchored VWAP EMAs FVG Zones VCI Zones $29.00 / month 7 day trial Pay Join Features Daily live trading sessions with expert traders. Access to 100s of hours of educational content. Join a 24/7 private trading community. Receive a weekly newsletter with trade ideas. Utilize institutional-grade trading tools. Reviews 4.50 out of 5 2 total reviews 5 stars 4 stars 3 stars 2 stars 1 star C Calvin 3 months ago Great support. Great knowledge base, only wish if they can do bit more frequent maintenance on indicators. Fixing bugs or refine some settings. But great value here Written 20 days after purchase I izzeholic 2 months ago Written 3 months after purchase About the creator TC View profile The Financial Cloud @ thefinancialcloud â€¢ Joined Jun 2024 I&#x27;ve dedicated my career to simplifying trading for everyone. I have gathered the strongest team I could find to bring you trading education, a vibrant community, and high-quality trades at the best price around. FAQs How often do you have live trading sessions? Why would I subscribe? Affiliates TC Become an affiliate The Financial Cloud 30% reward Earn money by bringing customers to The Financial Cloud. Every time a customer purchases using your link, you&#x27;ll earn a commission. The Financial Cloud Indicators $29.00 / month +1 option Join $29.00 / month 1 option Pay Join Pay Join The Financial Cloud Indicators | Whop",
  "finalUrl": "https://whop.com/premium-4f/tfc-indicators/",
  "fetchedAt": "2025-11-05T09:56:38.181Z",
  "textHash": "5ad7ff6efb7260fe8d423d7b1cc89f3155a66b387915014f47921db393ba62ad",
  "drilled": false
}