{
  "baseUrl": "https://whop.com/thinkorswim-trading-premium/thinkorswim-trading/",
  "title": "ThinkorSwim Blessing | Whop",
  "h1": "ThinkorSwim Blessing",
  "bullets": [
    "Sign in Unmute Unmute TT ThinkorSwim Blessing Boost Your Trading with Expert Indicators 4.9 ( 16 ) Trading Unlock the potential of your trading strategies with our expert-designed ThinkorSwim Blessing Indicator. Enhance your decision-making and maximize profits. $99.95 one-time purchase Pay Join Join 613 members Features One Custom Indicator",
    "Video Tutorial",
    ".",
    ".",
    ".",
    "P Pops 10 months ago love RFG and all he does Written 6 months after purchase",
    "H Happy 1 year ago Best trading community ever! Joining this community has been the best decision in my trading journey. Other than having consecutive green weeks since joining, I have gained lots of valuable insights and the indicators are what every beginner and experienced trader should have. The Blessing indicator... Show more Written 1 month after purchase",
    "H Happy 1 year ago Best trading community ever! Joining this community has been the best decision in my trading journey. Other than having consecutive green weeks since joining, I have gained lots of valuable insights and the indicators are what every beginner and experienced trader should have. The Blessing indicator... Show more Written 2 months after purchase",
    "JR JUSTIN LEE RIFE 2 years ago This investment is definitely worth considering. I spent a month day trading, utilizing the provided indicators and attending the live stream sessions each morning. To my satisfaction, my p&l for the month surpassed my usual performance... that's no coincidence. If you're on the fence about subscri... Show more Written 25 days after purchase"
  ],
  "paras": [
    "Sign in Unmute Unmute TT ThinkorSwim Blessing Boost Your Trading with Expert Indicators 4.9 ( 16 ) Trading Unlock the potential of your trading strategies with our expert-designed ThinkorSwim Blessing Indicator. Enhance your decision-making and maximize profits.",
    "Join 613 members Features One Custom Indicator Video Tutorial . . . Reviews 4.88 out of 5 16 total reviews 5 stars 4 stars 3 stars 2 stars 1 star P Pops 10 months ago love RFG and all he does",
    "1 year ago Best trading community ever! Joining this community has been the best decision in my trading journey. Other than having consecutive green weeks since joining, I have gained lots of valuable insights and the indicators are what every beginner and experienced trader should have. The Blessing indicator...",
    "Written 1 month after purchase H Happy 1 year ago Best trading community ever! Joining this community has been the best decision in my trading journey. Other than having consecutive green weeks since joining, I have gained lots of valuable insights and the indicators are what every beginner and experienced trader should have. The Blessing indicator...",
    "Written 2 months after purchase JR JUSTIN LEE RIFE 2 years ago This investment is definitely worth considering. I spent a month day trading, utilizing the provided indicators and attending the live stream sessions each morning. To my satisfaction, my p&l for the month surpassed my usual performance... that's no coincidence. If you're on the fence about subscri...",
    "Written 25 days after purchase See all reviews About the creator RG View profile Ricky Gaspard @ uptwobucks • Joined Feb 2024 FAQs What custom tools are included? Do I get live support? Affiliates TT Become an affiliate ThinkorSwim Trading 30% reward Earn money by bringing customers to ThinkorSwim Trading. Every time a customer purchases using your link, you&#x27;ll earn a commission."
  ],
  "priceTokens": [
    "$99.95",
    "$99.95",
    "$99.95",
    "$1",
    "$1",
    "$1",
    "$23",
    "$1",
    "$1",
    "$1",
    "$1",
    "$1",
    "$2",
    "$1",
    "$2",
    "$2",
    "$2",
    "$2",
    "$3",
    "$3"
  ],
  "faq": [],
  "textSample": "Sign in Unmute Unmute TT ThinkorSwim Blessing Boost Your Trading with Expert Indicators 4.9 ( 16 ) Trading Unlock the potential of your trading strategies with our expert-designed ThinkorSwim Blessing Indicator. Enhance your decision-making and maximize profits. $99.95 one-time purchase Pay Join Join 613 members Features One Custom Indicator Video Tutorial . . . Reviews 4.88 out of 5 16 total reviews 5 stars 4 stars 3 stars 2 stars 1 star P Pops 10 months ago love RFG and all he does Written 6 months after purchase H Happy 1 year ago Best trading community ever! Joining this community has been the best decision in my trading journey. Other than having consecutive green weeks since joining, I have gained lots of valuable insights and the indicators are what every beginner and experienced trader should have. The Blessing indicator... Show more Written 1 month after purchase H Happy 1 year ago Best trading community ever! Joining this community has been the best decision in my trading journey. Other than having consecutive green weeks since joining, I have gained lots of valuable insights and the indicators are what every beginner and experienced trader should have. The Blessing indicator... Show more Written 2 months after purchase JR JUSTIN LEE RIFE 2 years ago This investment is definitely worth considering. I spent a month day trading, utilizing the provided indicators and attending the live stream sessions each morning. To my satisfaction, my p&l for the month surpassed my usual performance... that's no coincidence. If you're on the fence about subscri... Show more Written 25 days after purchase See all reviews About the creator RG View profile Ricky Gaspard @ uptwobucks • Joined Feb 2024 FAQs What custom tools are included? Do I get live support? Affiliates TT Become an affiliate ThinkorSwim Trading 30% reward Earn money by bringing customers to ThinkorSwim Trading. Every time a customer purchases using your link, you&#x27;ll earn a commission. ThinkorSwim Blessing $99.95 one-time purchase Join $99.95 one-time purchase Pay Join Pay Join ThinkorSwim Blessing | Whop",
  "finalUrl": "https://whop.com/thinkorswim-trading-premium/thinkorswim-trading/",
  "fetchedAt": "2025-11-04T20:08:58.365Z",
  "textHash": "b05d4d11206f6c5476e387e989f7dd6434617c8179a78c5ae2e20673bae4f5af",
  "drilled": false
}