{
  "baseUrl": "https://whop.com/thoothpings/?a=alexburnett21",
  "title": "Thooth Pings | Whop",
  "h1": "Thooth Pings",
  "bullets": [
    "Powered by TP Thooth Pings Thooth Pings is an exclusive sports betting group built by industry experts with years of experience. With highly-researched picks powered by advanced AI &amp; critical analysis. We&#x27;re designed to maximiz... More 5.0 ( 1,522 ) Contact seller Products Unmute $14.99 / week Unlock Sports Betting Success with AI-Powered Tools &amp; Picks! CODE: NFL26 25%OFF! Thooth Pings 4.9 ( 1.5K ) Unmute Free Clip and Create Thooth Pings Content $1 per 1,000 Views! Thooth Clips 5.0 ( 56 ) Contact seller Reviews P Polli • Thooth Clips 3 days ago amazing community and people. making great money here! Written 4 months after purchase",
    "P plugwalk • Thooth Pings 3 days ago great money :) Written 9 days after purchase",
    "T trellotrello • Thooth Pings 4 days ago Thooth don't play. If you're looking for consistent long term results, these are your guys. Written 8 days after purchase",
    "G gluppor • Thooth Pings 4 days ago Only been here a week, but damn!! 8 wins with only one loss yesterday.. We up!!! Keep it up boys!! Written 8 days after purchase"
  ],
  "paras": [
    "TP Thooth Pings Thooth Pings is an exclusive sports betting group built by industry experts with years of experience. With highly-researched picks powered by advanced AI &amp; critical analysis. We&#x27;re designed to maximiz... More 5.0 ( 1,522 ) Contact seller Products Unmute $14.99 / week Unlock Sports Betting Success with AI-Powered Tools &amp; Picks! CODE: NFL26 25%OFF! Thooth Pings 4.9 ( 1.5K ) Unmute Free Clip and Create Thooth Pings Content $1 per 1,000 Views! Thooth Clips 5.0 ( 56 ) Contact seller Reviews P Polli • Thooth Clips 3 days ago amazing community and people. making great money here!",
    "3 days ago great money :)",
    "4 days ago Thooth don't play. If you're looking for consistent long term results, these are your guys.",
    "4 days ago Only been here a week, but damn!! 8 wins with only one loss yesterday.. We up!!! Keep it up boys!!"
  ],
  "priceTokens": [
    "$14.99",
    "$1",
    "$1",
    "$1",
    "$1",
    "$21",
    "$1",
    "$1",
    "$1",
    "$1",
    "$28",
    "$1",
    "$28",
    "$28",
    "$28",
    "$28",
    "$3",
    "$3",
    "$3",
    "$10"
  ],
  "faq": [],
  "textSample": "Powered by TP Thooth Pings Thooth Pings is an exclusive sports betting group built by industry experts with years of experience. With highly-researched picks powered by advanced AI &amp; critical analysis. We&#x27;re designed to maximiz... More 5.0 ( 1,522 ) Contact seller Products Unmute $14.99 / week Unlock Sports Betting Success with AI-Powered Tools &amp; Picks! CODE: NFL26 25%OFF! Thooth Pings 4.9 ( 1.5K ) Unmute Free Clip and Create Thooth Pings Content $1 per 1,000 Views! Thooth Clips 5.0 ( 56 ) Contact seller Reviews P Polli • Thooth Clips 3 days ago amazing community and people. making great money here! Written 4 months after purchase P plugwalk • Thooth Pings 3 days ago great money :) Written 9 days after purchase T trellotrello • Thooth Pings 4 days ago Thooth don't play. If you're looking for consistent long term results, these are your guys. Written 8 days after purchase G gluppor • Thooth Pings 4 days ago Only been here a week, but damn!! 8 wins with only one loss yesterday.. We up!!! Keep it up boys!! Written 8 days after purchase See all reviews Thooth Pings | Whop",
  "finalUrl": "https://whop.com/thoothpings/?a=alexburnett21",
  "fetchedAt": "2025-11-05T10:34:19.297Z",
  "textHash": "9515771c095516ca80f4601a0086a0c5a5fa95552b4e482a5fc066671f751234",
  "drilled": false
}