{
  "baseUrl": "https://whop.com/tradingwithkam/tier-2-team-member/",
  "title": "Tier 2 | Whop",
  "h1": "Tier 2",
  "bullets": [
    "Sign in Unmute Unmute TK Tier 2 Daytrades &amp; Daily Market Analysis 5.0 ( 8 ) Trading üî•Get high quality daytrade and swing trade alerts ‚ö°Ô∏èReal-time watchlist with the hottest stocks that are moving $47.00 / month Pay Join Join 9 members Features Get Day Trade &amp; Swing Trade Alerts",
    "Exclusive Insight From Me",
    "Learn High Probability Trading Strategies",
    "Community Of Traders To Grow With",
    "Watchlist Updates For Hot Stocks",
    "LH Luke Heyward 6 months ago Best crew in the industry! Written 4 months after purchase",
    "LE LaCandice Early 9 months ago I would recommend anyone to join the discord & take his courses. He is very approachable and wants to see us to learn & be successful. Written 19 days after purchase",
    "DR Damian Riley 9 months ago Hey I just wanna say this was n is one the best one stop shop discords I‚Äôve been in. Members help each other n kam himself send üî•signals everyday but he also teach yu how to fish for yourself. I‚Äôve been in other discords before n after this one but I returned n here to stay the grass not greener on... Show more Written 4 days after purchase",
    "M Moonmay17 9 months ago Joining Kam's discord has been the best decision. I have joined many discords and Kam's trading style and teachings are easy to understand and apply and he doesn't over complicate it. He truly cares about helping and teaching the members in his community. He is always engaging with us and providin... Show more Written 17 days after purchase"
  ],
  "paras": [
    "Sign in Unmute Unmute TK Tier 2 Daytrades &amp; Daily Market Analysis 5.0 ( 8 ) Trading üî•Get high quality daytrade and swing trade alerts",
    "‚ö°Ô∏èReal-time watchlist with the hottest stocks that are moving",
    "Join 9 members Features Get Day Trade &amp; Swing Trade Alerts Exclusive Insight From Me Learn High Probability Trading Strategies Community Of Traders To Grow With Watchlist Updates For Hot Stocks Reviews 5 out of 5 8 total reviews 5 stars 4 stars 3 stars 2 stars 1 star LH Luke Heyward 6 months ago Best crew in the industry!",
    "9 months ago I would recommend anyone to join the discord & take his courses. He is very approachable and wants to see us to learn & be successful.",
    "9 months ago Hey I just wanna say this was n is one the best one stop shop discords I‚Äôve been in. Members help each other n kam himself send üî•signals everyday but he also teach yu how to fish for yourself. I‚Äôve been in other discords before n after this one but I returned n here to stay the grass not greener on...",
    "Written 4 days after purchase M Moonmay17 9 months ago Joining Kam's discord has been the best decision. I have joined many discords and Kam's trading style and teachings are easy to understand and apply and he doesn't over complicate it. He truly cares about helping and teaching the members in his community. He is always engaging with us and providin...",
    "Written 17 days after purchase See all reviews About the creator KG View profile Kameron George @ tradingwithkam ‚Ä¢ Joined Dec 2024 8 years of trading experience. Focused on option trading and teaching basic and advanced technical analysis strategies I designed a modern community where I provide trade alerts and help new and experienced traders align with profitable habits to improve trader performance FAQs Do you teach your strategies? Affiliates TK Become an affiliate Trading With Kam 30% reward Earn money by bringing customers to Trading With Kam. Every time a customer purchases using your link, you&#x27;ll earn a commission."
  ],
  "priceTokens": [
    "$47.00",
    "$47.00",
    "$47.00",
    "$1",
    "$1",
    "$1",
    "$22",
    "$1",
    "$1",
    "$1",
    "$1",
    "$1",
    "$2",
    "$1",
    "$2",
    "$2",
    "$2",
    "$2",
    "$3",
    "$3"
  ],
  "faq": [],
  "textSample": "Sign in Unmute Unmute TK Tier 2 Daytrades &amp; Daily Market Analysis 5.0 ( 8 ) Trading üî•Get high quality daytrade and swing trade alerts ‚ö°Ô∏èReal-time watchlist with the hottest stocks that are moving $47.00 / month Pay Join Join 9 members Features Get Day Trade &amp; Swing Trade Alerts Exclusive Insight From Me Learn High Probability Trading Strategies Community Of Traders To Grow With Watchlist Updates For Hot Stocks Reviews 5 out of 5 8 total reviews 5 stars 4 stars 3 stars 2 stars 1 star LH Luke Heyward 6 months ago Best crew in the industry! Written 4 months after purchase LE LaCandice Early 9 months ago I would recommend anyone to join the discord & take his courses. He is very approachable and wants to see us to learn & be successful. Written 19 days after purchase DR Damian Riley 9 months ago Hey I just wanna say this was n is one the best one stop shop discords I‚Äôve been in. Members help each other n kam himself send üî•signals everyday but he also teach yu how to fish for yourself. I‚Äôve been in other discords before n after this one but I returned n here to stay the grass not greener on... Show more Written 4 days after purchase M Moonmay17 9 months ago Joining Kam's discord has been the best decision. I have joined many discords and Kam's trading style and teachings are easy to understand and apply and he doesn't over complicate it. He truly cares about helping and teaching the members in his community. He is always engaging with us and providin... Show more Written 17 days after purchase See all reviews About the creator KG View profile Kameron George @ tradingwithkam ‚Ä¢ Joined Dec 2024 8 years of trading experience. Focused on option trading and teaching basic and advanced technical analysis strategies I designed a modern community where I provide trade alerts and help new and experienced traders align with profitable habits to improve trader performance FAQs Do you teach your strategies? Affiliates TK Become an affiliate Trading With Kam 30% reward Earn money by bringing customers to Trading With Kam. Every time a customer purchases using your link, you&#x27;ll earn a commission. Tier 2 $47.00 / month Join $47.00 / month Pay Join Pay Join Tier 2 | Whop",
  "finalUrl": "https://whop.com/tradingwithkam/tier-2-team-member/",
  "fetchedAt": "2025-11-05T09:56:41.085Z",
  "textHash": "61eb9b49e6f7136944a7f61151faec0b1af0f5445a0831d7df51eb30cb3f5bc1",
  "drilled": false
}