{
  "baseUrl": "https://whop.com/inner-circle-fc/tiktok-whiz-premium-members-only/",
  "title": "TIKTOK WIZ PREMIUM PRODUCT | Whop",
  "h1": "TIKTOK WIZ PREMIUM PRODUCT",
  "bullets": [
    "Sign in TP TIKTOK WIZ PREMIUM PRODUCT Learn HOW to actually take advantage of the TikTok GOLDRUSH! 4.4 ( 41 ) Ecommerce Join our Premium community and Premium comprehensive course. This is the entire blueprint to take advantage of the TikTok GOLDRUSH for aspiring TikTok Shop owners. $1,000.00 one-time purchase Pay Join Join 183 members Features Learn how to actually succeed with TikTokshop and avoid all the mistakes.",
    "Learn how to easily find your niche and crack the TikTok code.",
    "We constantly update our guides and resources to fit Tiktok&#x27;s platform changes.",
    "Stay up to date with our weekly calls hosted by Admins.",
    "Connect with likeminded individuals.",
    "KK Kiko Khounvichith 2 days ago Hello this is my first time using the app Written 16 days after purchase",
    "SW Sophia Willis 2 days ago This is my first time using this app and so far so üëç Written 6 days after purchase",
    "HG Hannah K Gattanella 6 days ago Love it! Written 12 days after purchase",
    "WW Wesley Wood 14 days ago Good job my friend! Written 1 day after purchase"
  ],
  "paras": [
    "Sign in TP TIKTOK WIZ PREMIUM PRODUCT Learn HOW to actually take advantage of the TikTok GOLDRUSH! 4.4 ( 41 ) Ecommerce Join our Premium community and Premium comprehensive course. This is the entire blueprint to take advantage of the TikTok GOLDRUSH for aspiring TikTok Shop owners.",
    "Join 183 members Features Learn how to actually succeed with TikTokshop and avoid all the mistakes. Learn how to easily find your niche and crack the TikTok code. We constantly update our guides and resources to fit Tiktok&#x27;s platform changes. Stay up to date with our weekly calls hosted by Admins. Connect with likeminded individuals. Reviews 4.39 out of 5 41 total reviews 5 stars 4 stars 3 stars 2 stars 1 star KK Kiko Khounvichith 2 days ago Hello this is my first time using the app",
    "2 days ago This is my first time using this app and so far so üëç",
    "6 days ago Love it!",
    "14 days ago Good job my friend!",
    "About the creator T View profile TikTokWiz @ edwardmanuelsourcing ‚Ä¢ Joined Mar 2024 Teaching people how to achieve their dream life through selling on Tiktok ShopüöÄ Affiliates TP Become an affiliate TIKTOK WIZ-MONEY PRINTER 30% reward Earn money by bringing customers to TIKTOK WIZ-MONEY PRINTER. Every time a customer purchases using your link, you&#x27;ll earn a commission."
  ],
  "priceTokens": [
    "$1,000.00",
    "$1,000.00",
    "$1,000.00",
    "$1",
    "$1",
    "$1",
    "$23",
    "$1",
    "$1",
    "$1",
    "$1",
    "$1",
    "$2",
    "$1",
    "$2",
    "$2",
    "$2",
    "$2",
    "$3",
    "$3"
  ],
  "faq": [],
  "textSample": "Sign in TP TIKTOK WIZ PREMIUM PRODUCT Learn HOW to actually take advantage of the TikTok GOLDRUSH! 4.4 ( 41 ) Ecommerce Join our Premium community and Premium comprehensive course. This is the entire blueprint to take advantage of the TikTok GOLDRUSH for aspiring TikTok Shop owners. $1,000.00 one-time purchase Pay Join Join 183 members Features Learn how to actually succeed with TikTokshop and avoid all the mistakes. Learn how to easily find your niche and crack the TikTok code. We constantly update our guides and resources to fit Tiktok&#x27;s platform changes. Stay up to date with our weekly calls hosted by Admins. Connect with likeminded individuals. Reviews 4.39 out of 5 41 total reviews 5 stars 4 stars 3 stars 2 stars 1 star KK Kiko Khounvichith 2 days ago Hello this is my first time using the app Written 16 days after purchase SW Sophia Willis 2 days ago This is my first time using this app and so far so üëç Written 6 days after purchase HG Hannah K Gattanella 6 days ago Love it! Written 12 days after purchase WW Wesley Wood 14 days ago Good job my friend! Written 1 day after purchase See all reviews About the creator T View profile TikTokWiz @ edwardmanuelsourcing ‚Ä¢ Joined Mar 2024 Teaching people how to achieve their dream life through selling on Tiktok ShopüöÄ Affiliates TP Become an affiliate TIKTOK WIZ-MONEY PRINTER 30% reward Earn money by bringing customers to TIKTOK WIZ-MONEY PRINTER. Every time a customer purchases using your link, you&#x27;ll earn a commission. TIKTOK WIZ PREMIUM PRODUCT $1,000.00 one-time purchase Join $1,000.00 one-time purchase Pay Join Pay Join TIKTOK WIZ PREMIUM PRODUCT | Whop",
  "finalUrl": "https://whop.com/inner-circle-fc/tiktok-whiz-premium-members-only/",
  "fetchedAt": "2025-11-04T20:05:04.656Z",
  "textHash": "0b4cc183eb74a8a2a34ef99d423a4d26c000a438404c4d053444f3d53682caa5",
  "drilled": false
}