{
  "baseUrl": "https://whop.com/tmmb-premium/?a=alexburnett21",
  "title": "TikTok Money Maker Blueprint | Whop",
  "h1": "TikTok Money Maker Blueprint",
  "bullets": [
    "Powered by TB TikTok Money Maker Blueprint I&#x27;ve mastered the art of making money on TikTok, earning thousands daily. Now, I&#x27;m here to share my secrets with you through my blueprint, ensuring your success. 5.0 ( 149 ) Contact seller Products Unmute £49.99 / month The Number 1 UK TikTok Shop Community TMMB Premium 5.0 ( 113 ) Free TMMB Free Community TMMB Free 4.9 ( 26 ) Contact seller Reviews AB Ashley bottomley 15 days ago Buying it for the training is good but that’s not the main reason to join. Written 2 months after purchase",
    "BR Bing Robertson 1 month ago Spoiler alert - I've just made my first £10k! ... If it wasn't for the inner circle I wouldn't be writing this - I joined TMMB a year ago in September 2024. After my first month Tom opened the first slots for inner circle. Fast forward 3 months and about 3 months I'd only made £30, I was strugglin... Show more Written 1 year after purchase",
    "LP Lush Pro 50 • TMMB Premium 2 months ago top training A++++ Written 23 days after purchase",
    "A Alex • TMMB Free 2 months ago Top tips to get started Written 1 day after purchase"
  ],
  "paras": [
    "TB TikTok Money Maker Blueprint I&#x27;ve mastered the art of making money on TikTok, earning thousands daily. Now, I&#x27;m here to share my secrets with you through my blueprint, ensuring your success. 5.0 ( 149 ) Contact seller Products Unmute £49.99 / month The Number 1 UK TikTok Shop Community TMMB Premium 5.0 ( 113 ) Free TMMB Free Community TMMB Free 4.9 ( 26 ) Contact seller Reviews AB Ashley bottomley 15 days ago Buying it for the training is good but that’s not the main reason to join.",
    "1 month ago Spoiler alert - I've just made my first £10k! ... If it wasn't for the inner circle I wouldn't be writing this - I joined TMMB a year ago in September 2024. After my first month Tom opened the first slots for inner circle. Fast forward 3 months and about 3 months I'd only made £30, I was strugglin...",
    "Written 1 year after purchase LP Lush Pro 50 • TMMB Premium 2 months ago top training A++++",
    "2 months ago Top tips to get started"
  ],
  "priceTokens": [
    "£49.99",
    "£10",
    "£30",
    "$1",
    "$1",
    "$1",
    "$21",
    "$1",
    "$1",
    "$1",
    "$1",
    "$28",
    "$1",
    "$28",
    "$28",
    "$28",
    "$28",
    "$3",
    "$3",
    "$3"
  ],
  "faq": [],
  "textSample": "Powered by TB TikTok Money Maker Blueprint I&#x27;ve mastered the art of making money on TikTok, earning thousands daily. Now, I&#x27;m here to share my secrets with you through my blueprint, ensuring your success. 5.0 ( 149 ) Contact seller Products Unmute £49.99 / month The Number 1 UK TikTok Shop Community TMMB Premium 5.0 ( 113 ) Free TMMB Free Community TMMB Free 4.9 ( 26 ) Contact seller Reviews AB Ashley bottomley 15 days ago Buying it for the training is good but that’s not the main reason to join. Written 2 months after purchase BR Bing Robertson 1 month ago Spoiler alert - I've just made my first £10k! ... If it wasn't for the inner circle I wouldn't be writing this - I joined TMMB a year ago in September 2024. After my first month Tom opened the first slots for inner circle. Fast forward 3 months and about 3 months I'd only made £30, I was strugglin... Show more Written 1 year after purchase LP Lush Pro 50 • TMMB Premium 2 months ago top training A++++ Written 23 days after purchase A Alex • TMMB Free 2 months ago Top tips to get started Written 1 day after purchase See all reviews TikTok Money Maker Blueprint | Whop",
  "finalUrl": "https://whop.com/tmmb-premium/?a=alexburnett21",
  "fetchedAt": "2025-11-04T19:58:17.598Z",
  "textHash": "fd1d66eba31c9652fb438fa5bd2f0e8a8e014ee9f6c50437a231d9599367dca1",
  "drilled": false
}