{
  "baseUrl": "https://whop.com/advanced-go-pro-tweaks/ultimate-tweaks/",
  "title": "Ultimate Tweaks | Whop",
  "h1": "Ultimate Tweaks",
  "bullets": [
    "Sign in UT Ultimate Tweaks Fully Optimize your PC with one click ðŸš€ 4.8 ( 39 ) Video games Enhance your gaming performance with optimized GPU, CPU, and system settings for smoother gameplay and lower ping. $12.99 / month Pay Purchase Join 30 members Features Fully Optimize your PC with ONE click!",
    "FPS Boost + 0 Delay + Lower Ping",
    "24/7 support for the best experince.",
    "Works on both desktop computers and laptops.",
    "Optimizes your Windows, Bios, GPU, CPU, Ram, KBM etc...",
    "PS preston sarnadsky 8 months ago really good should buy i got 10 ping when i normally sit on 60 Written 27 minutes after purchase",
    "UH Umar harvey 9 months ago really good 0 delay just need to fix my ping Written 1 day after purchase",
    "RO Raymonde Ochron 1 year ago really good but a little long for the advanced pro Written 8 days after purchase",
    "N nouri0784 1 year ago 10/10 deffenitly worth it, gave insane fps boost and lower ping on laptop Written 1 month after purchase"
  ],
  "paras": [
    "Sign in UT Ultimate Tweaks Fully Optimize your PC with one click ðŸš€ 4.8 ( 39 ) Video games Enhance your gaming performance with optimized GPU, CPU, and system settings for smoother gameplay and lower ping.",
    "Join 30 members Features Fully Optimize your PC with ONE click! FPS Boost + 0 Delay + Lower Ping 24/7 support for the best experince. Works on both desktop computers and laptops. Optimizes your Windows, Bios, GPU, CPU, Ram, KBM etc... Reviews 4.77 out of 5 39 total reviews 5 stars 4 stars 3 stars 2 stars 1 star PS preston sarnadsky 8 months ago really good should buy i got 10 ping when i normally sit on 60",
    "9 months ago really good 0 delay just need to fix my ping",
    "1 year ago really good but a little long for the advanced pro",
    "1 year ago 10/10 deffenitly worth it, gave insane fps boost and lower ping on laptop",
    "About the creator UT View profile Ultimate Tweaks @ ultimatetweaks â€¢ Joined Aug 2023 I&#x27;ve dedicated years to mastering PC performance optimization. By applying advanced tweaks to your system, I ensure you get the best gaming experience with higher FPS, lower ping, and seamless gameplay. FAQs Is your service compatible with both desktops and laptops? What services do you offer? Do you offer refund if it doesn&#x27;t work? Affiliates UT Become an affiliate ULTIMATE TWEAKS 30% reward Earn money by bringing customers to ULTIMATE TWEAKS. Every time a customer purchases using your link, you&#x27;ll earn a commission."
  ],
  "priceTokens": [
    "$12.99",
    "$12.99",
    "$12.99",
    "$1",
    "$1",
    "$1",
    "$22",
    "$1",
    "$1",
    "$1",
    "$1",
    "$1",
    "$2",
    "$1",
    "$2",
    "$2",
    "$2",
    "$2",
    "$3",
    "$3"
  ],
  "faq": [],
  "textSample": "Sign in UT Ultimate Tweaks Fully Optimize your PC with one click ðŸš€ 4.8 ( 39 ) Video games Enhance your gaming performance with optimized GPU, CPU, and system settings for smoother gameplay and lower ping. $12.99 / month Pay Purchase Join 30 members Features Fully Optimize your PC with ONE click! FPS Boost + 0 Delay + Lower Ping 24/7 support for the best experince. Works on both desktop computers and laptops. Optimizes your Windows, Bios, GPU, CPU, Ram, KBM etc... Reviews 4.77 out of 5 39 total reviews 5 stars 4 stars 3 stars 2 stars 1 star PS preston sarnadsky 8 months ago really good should buy i got 10 ping when i normally sit on 60 Written 27 minutes after purchase UH Umar harvey 9 months ago really good 0 delay just need to fix my ping Written 1 day after purchase RO Raymonde Ochron 1 year ago really good but a little long for the advanced pro Written 8 days after purchase N nouri0784 1 year ago 10/10 deffenitly worth it, gave insane fps boost and lower ping on laptop Written 1 month after purchase See all reviews About the creator UT View profile Ultimate Tweaks @ ultimatetweaks â€¢ Joined Aug 2023 I&#x27;ve dedicated years to mastering PC performance optimization. By applying advanced tweaks to your system, I ensure you get the best gaming experience with higher FPS, lower ping, and seamless gameplay. FAQs Is your service compatible with both desktops and laptops? What services do you offer? Do you offer refund if it doesn&#x27;t work? Affiliates UT Become an affiliate ULTIMATE TWEAKS 30% reward Earn money by bringing customers to ULTIMATE TWEAKS. Every time a customer purchases using your link, you&#x27;ll earn a commission. Ultimate Tweaks $12.99 / month Purchase $12.99 / month Pay Purchase Pay Purchase Ultimate Tweaks | Whop",
  "finalUrl": "https://whop.com/advanced-go-pro-tweaks/ultimate-tweaks/",
  "fetchedAt": "2025-11-05T09:24:21.209Z",
  "textHash": "4c7fda8b38bdfc7143549d163b440321ac543eb5cafd09e983872941e33e71ba",
  "drilled": false
}