{
  "baseUrl": "https://whop.com/blw-forex-room-signals-group/blw-us-30-indicator/",
  "title": "US30 Indicator | Whop",
  "h1": "US30 Indicator",
  "bullets": [
    "Sign in BP US30 Indicator It will tell people when to trade 4.7 ( 3 ) Trading Basically, it is an MT4 indicator that tells people when to trade US30 in 15 Min and 30 Min charts. It is extremely accurate and powerful. NO GUARANTEES ARE MADE! Trading is risky $297.00 one-time purchase Pay Get access Join 6 members Features 100% Automated Signals",
    "Powerful and Accurate US30 Signals",
    "Easy to Install",
    "Lifetime Access",
    "EXCLUSIVE Telegram Channel with Live Alerts",
    "AA alaa anqawi 9 days ago Written 3 days after purchase",
    "W Wael 1 month ago Written 5 months after purchase",
    "DJ David valentin jr. 1 month ago Written 3 months after purchase"
  ],
  "paras": [
    "Sign in BP US30 Indicator It will tell people when to trade 4.7 ( 3 ) Trading Basically, it is an MT4 indicator that tells people when to trade US30 in 15 Min and 30 Min charts. It is extremely accurate and powerful. NO GUARANTEES ARE MADE! Trading is risky",
    "Join 6 members Features 100% Automated Signals Powerful and Accurate US30 Signals Easy to Install Lifetime Access EXCLUSIVE Telegram Channel with Live Alerts Reviews 4.67 out of 5 3 total reviews 5 stars 4 stars 3 stars 2 stars 1 star AA alaa anqawi 9 days ago",
    "1 month ago",
    "1 month ago",
    "FAQs Do I need any experience? Where are the Live Sessions? What times are the sessions? Affiliates BP Become an affiliate BLW Trading Products 30% reward Earn money by bringing customers to BLW Trading Products. Every time a customer purchases using your link, you&#x27;ll earn a commission."
  ],
  "priceTokens": [
    "$297.00",
    "$297.00",
    "$297.00",
    "$1",
    "$1",
    "$1",
    "$23",
    "$1",
    "$1",
    "$1",
    "$1",
    "$1",
    "$2",
    "$1",
    "$2",
    "$2",
    "$2",
    "$2",
    "$3",
    "$3"
  ],
  "faq": [],
  "textSample": "Sign in BP US30 Indicator It will tell people when to trade 4.7 ( 3 ) Trading Basically, it is an MT4 indicator that tells people when to trade US30 in 15 Min and 30 Min charts. It is extremely accurate and powerful. NO GUARANTEES ARE MADE! Trading is risky $297.00 one-time purchase Pay Get access Join 6 members Features 100% Automated Signals Powerful and Accurate US30 Signals Easy to Install Lifetime Access EXCLUSIVE Telegram Channel with Live Alerts Reviews 4.67 out of 5 3 total reviews 5 stars 4 stars 3 stars 2 stars 1 star AA alaa anqawi 9 days ago Written 3 days after purchase W Wael 1 month ago Written 5 months after purchase DJ David valentin jr. 1 month ago Written 3 months after purchase About the creator CA View profile cristian argueta @ cristianblwofficial â€¢ Joined Sep 2024 FAQs Do I need any experience? Where are the Live Sessions? What times are the sessions? Affiliates BP Become an affiliate BLW Trading Products 30% reward Earn money by bringing customers to BLW Trading Products. Every time a customer purchases using your link, you&#x27;ll earn a commission. US30 Indicator $297.00 one-time purchase Get access $297.00 one-time purchase Pay Get access Pay Get access US30 Indicator | Whop",
  "finalUrl": "https://whop.com/blw-forex-room-signals-group/blw-us-30-indicator/",
  "fetchedAt": "2025-11-05T10:35:50.107Z",
  "textHash": "9b7e2ba9620aa4e4feaf9e2fadcfe686301759e00d6fa1483ca7ddb89613f67b",
  "drilled": false
}