{
  "baseUrl": "https://whop.com/dreanzvintage/vintagesnipebot/",
  "title": "Vinted Snipe Bot | Whop",
  "h1": "Vinted Snipe Bot",
  "bullets": [
    "Vinted Snipe Bot | Whop Sign in DS Vinted Snipe Bot Deine Chance g√ºnstige Artikel auf Vinted zu snipen 4.8 ( 197 ) Reselling Es werden t√§glich Millionen ‚Ç¨ auf Vinted umgesetzt. Unser Snipe Bot erm√∂glicht es dir, mit 1x Knopfdruck Artikel auf Vinted zu kaufen, die dir unser Monitor anzeigt. ‚Ç¨29.90 / month + ‚Ç¨69.90 initial fee Pay Get access Features Autobuy + Offer Funktion",
    "Private Monitore &amp; eigene Filter",
    "Automatische Filterung f√ºr die besten Kategorien",
    "Tausche dich mit anderen Resellern aus",
    "Jederzeit k√ºndbar!",
    "NG Noah Gro√ü 20 days ago Super Written 1 month after purchase",
    "M Marcello 20 days ago Sehr krasse Seite sehr gut im sich zu verkn√ºpfen auch als kompletter Anf√§nger Written 1 day after purchase",
    "G Gabriel 1 month ago Sehr gut, da er preiswert ist, der Gr√ºnder sehr korrekt ist und man mit dem Snipe Bot, dem Kurs und dem Supplier Network man viel bekommt üëç Written 2 days after purchase",
    "N Noa6h 1 month ago krass f√ºr anf√§nger Written 25 days after purchase"
  ],
  "paras": [
    "Sign in DS Vinted Snipe Bot Deine Chance g√ºnstige Artikel auf Vinted zu snipen 4.8 ( 197 ) Reselling Es werden t√§glich Millionen ‚Ç¨ auf Vinted umgesetzt.",
    "Unser Snipe Bot erm√∂glicht es dir, mit 1x Knopfdruck Artikel auf Vinted zu kaufen, die dir unser Monitor anzeigt.",
    "‚Ç¨29.90 / month + ‚Ç¨69.90 initial fee Pay Get access Features Autobuy + Offer Funktion Private Monitore &amp; eigene Filter Automatische Filterung f√ºr die besten Kategorien Tausche dich mit anderen Resellern aus Jederzeit k√ºndbar! Reviews 4.77 out of 5 197 total reviews 5 stars 4 stars 3 stars 2 stars 1 star NG Noah Gro√ü 20 days ago Super",
    "20 days ago Sehr krasse Seite sehr gut im sich zu verkn√ºpfen auch als kompletter Anf√§nger",
    "1 month ago Sehr gut, da er preiswert ist, der Gr√ºnder sehr korrekt ist und man mit dem Snipe Bot, dem Kurs und dem Supplier Network man viel bekommt üëç",
    "1 month ago krass f√ºr anf√§nger",
    "About the creator D View profile DREANZ @ dreanzvintage ‚Ä¢ Joined Aug 2024 Mit meiner 2-j√§hrigen Erfahrung im Vintage-Reselling habe ich dieses Netzwerk ins Leben gerufen, um angehenden und erfahrenen Resellern den Zugang zu Lieferanten weltweit, Wissen, L√∂sungen und einer unterst√ºtzenden Community zu bieten. Ich selber, habe organisch eine 7-stellige &amp; eine der gr√∂√üten Vintage Marken weltweit aus meinem Kinderzimmer gegr√ºndet, besser bekannt als &#x27;KikiVintage&#x27;. FAQs Kann jeder Geld verdienen? Wer ist der Gr√ºnder? Was erwartet mich als Member? Kann ich k√ºndigen? Affiliates DS Become an affiliate DREANZ - VINTAGE RESELLING &amp; SUPPLIERS 30% reward Earn money by bringing customers to DREANZ - VINTAGE RESELLING &amp; SUPPLIERS. Every time a customer purchases using your link, you&#x27;ll earn a commission."
  ],
  "priceTokens": [
    "‚Ç¨29.90",
    "‚Ç¨69.90",
    "‚Ç¨29.90",
    "‚Ç¨29.90",
    "$1",
    "$1",
    "$1",
    "$22",
    "$1",
    "$1",
    "$1",
    "$1",
    "$1",
    "$2",
    "$1",
    "$2",
    "$2",
    "$2",
    "$2",
    "$3"
  ],
  "faq": [],
  "textSample": "Vinted Snipe Bot | Whop Sign in DS Vinted Snipe Bot Deine Chance g√ºnstige Artikel auf Vinted zu snipen 4.8 ( 197 ) Reselling Es werden t√§glich Millionen ‚Ç¨ auf Vinted umgesetzt. Unser Snipe Bot erm√∂glicht es dir, mit 1x Knopfdruck Artikel auf Vinted zu kaufen, die dir unser Monitor anzeigt. ‚Ç¨29.90 / month + ‚Ç¨69.90 initial fee Pay Get access Features Autobuy + Offer Funktion Private Monitore &amp; eigene Filter Automatische Filterung f√ºr die besten Kategorien Tausche dich mit anderen Resellern aus Jederzeit k√ºndbar! Reviews 4.77 out of 5 197 total reviews 5 stars 4 stars 3 stars 2 stars 1 star NG Noah Gro√ü 20 days ago Super Written 1 month after purchase M Marcello 20 days ago Sehr krasse Seite sehr gut im sich zu verkn√ºpfen auch als kompletter Anf√§nger Written 1 day after purchase G Gabriel 1 month ago Sehr gut, da er preiswert ist, der Gr√ºnder sehr korrekt ist und man mit dem Snipe Bot, dem Kurs und dem Supplier Network man viel bekommt üëç Written 2 days after purchase N Noa6h 1 month ago krass f√ºr anf√§nger Written 25 days after purchase See all reviews About the creator D View profile DREANZ @ dreanzvintage ‚Ä¢ Joined Aug 2024 Mit meiner 2-j√§hrigen Erfahrung im Vintage-Reselling habe ich dieses Netzwerk ins Leben gerufen, um angehenden und erfahrenen Resellern den Zugang zu Lieferanten weltweit, Wissen, L√∂sungen und einer unterst√ºtzenden Community zu bieten. Ich selber, habe organisch eine 7-stellige &amp; eine der gr√∂√üten Vintage Marken weltweit aus meinem Kinderzimmer gegr√ºndet, besser bekannt als &#x27;KikiVintage&#x27;. FAQs Kann jeder Geld verdienen? Wer ist der Gr√ºnder? Was erwartet mich als Member? Kann ich k√ºndigen? Affiliates DS Become an affiliate DREANZ - VINTAGE RESELLING &amp; SUPPLIERS 30% reward Earn money by bringing customers to DREANZ - VINTAGE RESELLING &amp; SUPPLIERS. Every time a customer purchases using your link, you&#x27;ll earn a commission. Vinted Snipe Bot ‚Ç¨29.90 / month +1 option Get access ‚Ç¨29.90 / month 1 option Pay Get access Pay Get access",
  "finalUrl": "https://whop.com/dreanzvintage/vintagesnipebot/",
  "fetchedAt": "2025-11-05T09:11:58.640Z",
  "textHash": "3e3b09f30bbcb342356b17baebaa5d97e331ab7871b9264d5902c3374b819849",
  "drilled": false
}