{
  "baseUrl": "https://whop.com/vinted-plug/abonnement-goat/",
  "title": "VINTED PLUG ABONNEMENT GOAT | Whop",
  "h1": "VINTED PLUG ABONNEMENT GOAT",
  "bullets": [
    "Sign in VP VINTED PLUG ABONNEMENT GOAT Deviens un expert du resell avec nous 4.4 ( 43 ) Reselling Accède au meilleur bot Vinted 0 délai, guides d&#x27;estimation, et IA pour gérer ton compte. Idéal pour dépasser 4 chiffres/mois en revente. €49.99 / month Pay Join Join 4 members Features Accès à notre bot Vinted 0 délai avec autobuy.",
    "Personnalisation illimitée de votre propre bot Vinted.",
    "Guides d&#x27;estimations et d&#x27;authentification inclus.",
    "Accès à notre intelligence artificielle 24/24.",
    "Notifications de restock pour les meilleurs ballots.",
    "M Maxime 19 days ago Très bien Written 5 days after purchase",
    "MK Morgane Kerhuel 1 month ago JE recommande je fais 300 euros par mois Written 3 days after purchase",
    "CA Coustaury Abel 1 month ago Je recommande vivement le bénéfice à faire est énorme !! Written 16 days after purchase",
    "D DELEMOTTE 1 month ago Je recommande énormément je tourne à 3k par mois Written 11 days after purchase"
  ],
  "paras": [
    "Sign in VP VINTED PLUG ABONNEMENT GOAT Deviens un expert du resell avec nous 4.4 ( 43 ) Reselling Accède au meilleur bot Vinted 0 délai, guides d&#x27;estimation, et IA pour gérer ton compte. Idéal pour dépasser 4 chiffres/mois en revente.",
    "€49.99 / month Pay Join Join 4 members Features Accès à notre bot Vinted 0 délai avec autobuy. Personnalisation illimitée de votre propre bot Vinted. Guides d&#x27;estimations et d&#x27;authentification inclus. Accès à notre intelligence artificielle 24/24. Notifications de restock pour les meilleurs ballots. Reviews 4.40 out of 5 43 total reviews 5 stars 4 stars 3 stars 2 stars 1 star M Maxime 19 days ago Très bien",
    "1 month ago JE recommande je fais 300 euros par mois",
    "1 month ago Je recommande vivement le bénéfice à faire est énorme !!",
    "1 month ago Je recommande énormément je tourne à 3k par mois",
    "About the creator NV View profile Nathan vialle @ nathanviall3 • Joined Oct 2022 J&#x27;ai créé Vinted Plug pour aider les débutants à se lancer dans l&#x27;achat revente avec les meilleurs outils. Avec notre bot Vinted, guides et tableur, tu auras tout ce qu&#x27;il te faut pour réussir. FAQs Une fois l&#x27;abonnement payé, comment j&#x27;aurais l&#x27;accès au serveur discord ? Je peux annuler l&#x27;abonnement quand je le veux ? Affiliates VP Become an affiliate VINTED PLUG 30% reward Earn money by bringing customers to VINTED PLUG. Every time a customer purchases using your link, you&#x27;ll earn a commission."
  ],
  "priceTokens": [
    "€49.99",
    "€49.99",
    "€49.99",
    "$1",
    "$1",
    "$1",
    "$22",
    "$1",
    "$1",
    "$1",
    "$1",
    "$1",
    "$2",
    "$1",
    "$2",
    "$2",
    "$2",
    "$2",
    "$3",
    "$3"
  ],
  "faq": [],
  "textSample": "Sign in VP VINTED PLUG ABONNEMENT GOAT Deviens un expert du resell avec nous 4.4 ( 43 ) Reselling Accède au meilleur bot Vinted 0 délai, guides d&#x27;estimation, et IA pour gérer ton compte. Idéal pour dépasser 4 chiffres/mois en revente. €49.99 / month Pay Join Join 4 members Features Accès à notre bot Vinted 0 délai avec autobuy. Personnalisation illimitée de votre propre bot Vinted. Guides d&#x27;estimations et d&#x27;authentification inclus. Accès à notre intelligence artificielle 24/24. Notifications de restock pour les meilleurs ballots. Reviews 4.40 out of 5 43 total reviews 5 stars 4 stars 3 stars 2 stars 1 star M Maxime 19 days ago Très bien Written 5 days after purchase MK Morgane Kerhuel 1 month ago JE recommande je fais 300 euros par mois Written 3 days after purchase CA Coustaury Abel 1 month ago Je recommande vivement le bénéfice à faire est énorme !! Written 16 days after purchase D DELEMOTTE 1 month ago Je recommande énormément je tourne à 3k par mois Written 11 days after purchase See all reviews About the creator NV View profile Nathan vialle @ nathanviall3 • Joined Oct 2022 J&#x27;ai créé Vinted Plug pour aider les débutants à se lancer dans l&#x27;achat revente avec les meilleurs outils. Avec notre bot Vinted, guides et tableur, tu auras tout ce qu&#x27;il te faut pour réussir. FAQs Une fois l&#x27;abonnement payé, comment j&#x27;aurais l&#x27;accès au serveur discord ? Je peux annuler l&#x27;abonnement quand je le veux ? Affiliates VP Become an affiliate VINTED PLUG 30% reward Earn money by bringing customers to VINTED PLUG. Every time a customer purchases using your link, you&#x27;ll earn a commission. VINTED PLUG ABONNEMENT GOAT €49.99 / month +1 option Join €49.99 / month 1 option Pay Join Pay Join VINTED PLUG ABONNEMENT GOAT | Whop",
  "finalUrl": "https://whop.com/vinted-plug/abonnement-goat/",
  "fetchedAt": "2025-11-05T09:26:51.943Z",
  "textHash": "033a4b74efe0760caae9e0f98b1512eb0ed074141d55900bf8ddf8c24e6c6185",
  "drilled": false
}