{
  "baseUrl": "https://whop.com/game-changers-sports-betting/?a=alexburnett21",
  "title": "Game Changers Sports Betting | Whop",
  "h1": "Game Changers Sports Betting",
  "bullets": [
    "Powered by GB Game Changers Sports Betting I&#x27;ve dedicated my life to mastering sports betting, developing strategies that consistently yield profits. With Game Changers, I aim to share my expertise and help others achieve betting success. 5.0 ( 4 ) Contact seller Products CA$20.00 / month GET ACCESS TO THE GREATEST SPORTS BETTING GROUP ðŸ”¥ VIP 1 MONTH 5.0 ( 3 ) CA$120.00 / year Join The Top 1% of Sports Betters VIP 1 YEAR 5.0 ( 1 ) CA$45.00 / 3 months GET ACCESS TO THE GREATEST SPORTS BETTING GROUP ðŸ”¥ VIP 3 MONTHS New CA$10.00 / week Get 1 week of VIP access. 1 Week New Contact seller Reviews N Nikolas â€¢ VIP 1 MONTH 7 months ago HonnÃªtement câ€™est le meilleur gars que jâ€™ai eu pour le BETTING Et oui je me suis fait avoir par quelques un des quebecois qui disais Ãªtre des machines etc avec 15 ans dâ€™expÃ©rience !! Mais pour vrai ce groupe est honnÃªte transparent et il nous fait faire de lâ€™argent !!! Je mettrais 100 Ã©toiles surto... Show more Written 4m after purchase",
    "YP Yoshan Perera â€¢ VIP 1 YEAR 7 months ago Wow what a run..keep it up.. thanks for your excellent insight into sports betting. Written 5 months after purchase",
    "AB Andre-Luc Bellemare â€¢ VIP 1 MONTH 7 months ago The best capper i've seen in a while, great system and proof for a long time. 100% ðŸ”¥ Written 22 days after purchase",
    "ZB Zone bet â€¢ VIP 1 MONTH 7 months ago This groups makes good decisions and is one of the best that Iâ€™ve known Written 7 days after purchase"
  ],
  "paras": [
    "GB Game Changers Sports Betting I&#x27;ve dedicated my life to mastering sports betting, developing strategies that consistently yield profits. With Game Changers, I aim to share my expertise and help others achieve betting success. 5.0 ( 4 ) Contact seller Products CA$20.00 / month GET ACCESS TO THE GREATEST SPORTS BETTING GROUP ðŸ”¥ VIP 1 MONTH 5.0 ( 3 ) CA$120.00 / year Join The Top 1% of Sports Betters VIP 1 YEAR 5.0 ( 1 ) CA$45.00 / 3 months GET ACCESS TO THE GREATEST SPORTS BETTING GROUP ðŸ”¥ VIP 3 MONTHS New CA$10.00 / week Get 1 week of VIP access. 1 Week New Contact seller Reviews N Nikolas â€¢ VIP 1 MONTH 7 months ago HonnÃªtement câ€™est le meilleur gars que jâ€™ai eu pour le BETTING Et oui je me suis fait avoir par quelques un des quebecois qui disais Ãªtre des machines etc avec 15 ans dâ€™expÃ©rience !! Mais pour vrai ce groupe est honnÃªte transparent et il nous fait faire de lâ€™argent !!! Je mettrais 100 Ã©toiles surto...",
    "Written 4m after purchase YP Yoshan Perera â€¢ VIP 1 YEAR 7 months ago Wow what a run..keep it up.. thanks for your excellent insight into sports betting.",
    "7 months ago The best capper i've seen in a while, great system and proof for a long time. 100% ðŸ”¥",
    "7 months ago This groups makes good decisions and is one of the best that Iâ€™ve known"
  ],
  "priceTokens": [
    "$20.00",
    "$120.00",
    "$45.00",
    "$10.00",
    "$1",
    "$1",
    "$1",
    "$21",
    "$1",
    "$1",
    "$1",
    "$1",
    "$28",
    "$1",
    "$28",
    "$28",
    "$28",
    "$28",
    "$3",
    "$3"
  ],
  "faq": [],
  "textSample": "Powered by GB Game Changers Sports Betting I&#x27;ve dedicated my life to mastering sports betting, developing strategies that consistently yield profits. With Game Changers, I aim to share my expertise and help others achieve betting success. 5.0 ( 4 ) Contact seller Products CA$20.00 / month GET ACCESS TO THE GREATEST SPORTS BETTING GROUP ðŸ”¥ VIP 1 MONTH 5.0 ( 3 ) CA$120.00 / year Join The Top 1% of Sports Betters VIP 1 YEAR 5.0 ( 1 ) CA$45.00 / 3 months GET ACCESS TO THE GREATEST SPORTS BETTING GROUP ðŸ”¥ VIP 3 MONTHS New CA$10.00 / week Get 1 week of VIP access. 1 Week New Contact seller Reviews N Nikolas â€¢ VIP 1 MONTH 7 months ago HonnÃªtement câ€™est le meilleur gars que jâ€™ai eu pour le BETTING Et oui je me suis fait avoir par quelques un des quebecois qui disais Ãªtre des machines etc avec 15 ans dâ€™expÃ©rience !! Mais pour vrai ce groupe est honnÃªte transparent et il nous fait faire de lâ€™argent !!! Je mettrais 100 Ã©toiles surto... Show more Written 4m after purchase YP Yoshan Perera â€¢ VIP 1 YEAR 7 months ago Wow what a run..keep it up.. thanks for your excellent insight into sports betting. Written 5 months after purchase AB Andre-Luc Bellemare â€¢ VIP 1 MONTH 7 months ago The best capper i've seen in a while, great system and proof for a long time. 100% ðŸ”¥ Written 22 days after purchase ZB Zone bet â€¢ VIP 1 MONTH 7 months ago This groups makes good decisions and is one of the best that Iâ€™ve known Written 7 days after purchase Game Changers Sports Betting | Whop",
  "finalUrl": "https://whop.com/game-changers-sports-betting/?a=alexburnett21",
  "fetchedAt": "2025-11-04T22:02:16.762Z",
  "textHash": "07e82d8b15461dd5a050cb016074566b210fa15d047802d5263c6612760e390d",
  "drilled": false
}