{
  "baseUrl": "https://whop.com/snatcherbets/?a=alexburnett21",
  "title": "SnatcherBets | Whop",
  "h1": "SnatcherBets",
  "bullets": [
    "Powered by S SnatcherBets 4.9 ( 78 ) Contact seller Products $50.00 Gain access to VIP Picks VIP/Parlay King 4.9 ( 63 ) $150.00 / week Gain access to VIP Picks and Make EASY MONEY 7-Day Access VIP/Parlay King 5.0 ( 4 ) $300.00 / month Gain access to VIP Picks and Make EASY MONEY 1-Month Access VIP/Parlay King 4.5 ( 11 ) Best 1 on 1 Snatcher bets 1 on 1 Snatcher Picks New Contact seller Reviews YK Yosef Kidane • VIP/Parlay King 4 months ago Good guy that wants to see you win appreciate you brother Written 14h after purchase",
    "K Kun • VIP/Parlay King 4 months ago So far the best in the game Written 9h after purchase",
    "X Xklusiv • VIP/Parlay King 4 months ago Trust the process and you won’t regret it Written 3 months after purchase",
    "JO Jake Oneill • 1-Month Access VIP/Parlay King 4 months ago Great low risk high reward bets! First time joining and already on day 2 a decent slip hit. Just make sure to pay close attention to those notifications lol Written 1 day after purchase"
  ],
  "paras": [
    "S SnatcherBets 4.9 ( 78 ) Contact seller Products $50.00 Gain access to VIP Picks VIP/Parlay King 4.9 ( 63 ) $150.00 / week Gain access to VIP Picks and Make EASY MONEY 7-Day Access VIP/Parlay King 5.0 ( 4 ) $300.00 / month Gain access to VIP Picks and Make EASY MONEY 1-Month Access VIP/Parlay King 4.5 ( 11 ) Best 1 on 1 Snatcher bets 1 on 1 Snatcher Picks New Contact seller Reviews YK Yosef Kidane • VIP/Parlay King 4 months ago Good guy that wants to see you win appreciate you brother",
    "4 months ago So far the best in the game",
    "4 months ago Trust the process and you won’t regret it",
    "4 months ago Great low risk high reward bets! First time joining and already on day 2 a decent slip hit. Just make sure to pay close attention to those notifications lol"
  ],
  "priceTokens": [
    "$50.00",
    "$150.00",
    "$300.00",
    "$1",
    "$1",
    "$1",
    "$21",
    "$1",
    "$1",
    "$1",
    "$1",
    "$28",
    "$1",
    "$28",
    "$28",
    "$28",
    "$28",
    "$3",
    "$3",
    "$3"
  ],
  "faq": [],
  "textSample": "Powered by S SnatcherBets 4.9 ( 78 ) Contact seller Products $50.00 Gain access to VIP Picks VIP/Parlay King 4.9 ( 63 ) $150.00 / week Gain access to VIP Picks and Make EASY MONEY 7-Day Access VIP/Parlay King 5.0 ( 4 ) $300.00 / month Gain access to VIP Picks and Make EASY MONEY 1-Month Access VIP/Parlay King 4.5 ( 11 ) Best 1 on 1 Snatcher bets 1 on 1 Snatcher Picks New Contact seller Reviews YK Yosef Kidane • VIP/Parlay King 4 months ago Good guy that wants to see you win appreciate you brother Written 14h after purchase K Kun • VIP/Parlay King 4 months ago So far the best in the game Written 9h after purchase X Xklusiv • VIP/Parlay King 4 months ago Trust the process and you won’t regret it Written 3 months after purchase JO Jake Oneill • 1-Month Access VIP/Parlay King 4 months ago Great low risk high reward bets! First time joining and already on day 2 a decent slip hit. Just make sure to pay close attention to those notifications lol Written 1 day after purchase See all reviews SnatcherBets | Whop",
  "finalUrl": "https://whop.com/snatcherbets/?a=alexburnett21",
  "fetchedAt": "2025-11-05T09:54:33.625Z",
  "textHash": "afdc9a59bab3716f85b10c9c299c9fce60aadb3468ba03491cc219d22e3d84d4",
  "drilled": false
}