{
  "baseUrl": "https://whop.com/vitofoundations/vito-commerci/",
  "title": "Vito Commerci&#x27;s Free Community | Whop",
  "h1": "Vito Commerci&#x27;s Free Community",
  "bullets": [
    "Vito Commerci&#x27;s Free Community | Whop Sign in Unmute Unmute VC Vito Commerci&#x27;s Free Community Learn From a +100k/Month Trader 4.9 ( 154 ) Trading Join the Free Discord to see the hundreds of people winning before you commit anything. Also get Vito&#x27;s FREE course showing how he turned $240 into over a million at 19 years old. Free one-time purchase Pay Get access Join 10,987 members Features See the hundreds of members making thousands of dollars EVERY DAY",
    "See Vito is legit before commiting",
    "Watch Vito&#x27;s Free Course showing how he turned $240 into a million at 19",
    "J joe 7 days ago lwk chill asf god bless Written 19 days after purchase",
    "MC Michael Caggiano 19 days ago Great mentorship. Christ is King. Written 2 months after purchase",
    "IG Ishvar Ganesh 20 days ago best trader ever best mentorship ever actually reviews trades. Other mentorships seem like shit compared to this on god, I promise you. Written 2 months after purchase",
    "AD Adonis Daniel 1 month ago i've never improved faster Written 4 months after purchase"
  ],
  "paras": [
    "Sign in Unmute Unmute VC Vito Commerci&#x27;s Free Community Learn From a +100k/Month Trader 4.9 ( 154 ) Trading Join the Free Discord to see the hundreds of people winning before you commit anything. Also get Vito&#x27;s FREE course showing how he turned $240 into over a million at 19 years old.",
    "Join 10,987 members Features See the hundreds of members making thousands of dollars EVERY DAY See Vito is legit before commiting Watch Vito&#x27;s Free Course showing how he turned $240 into a million at 19 Reviews 4.86 out of 5 154 total reviews 5 stars 4 stars 3 stars 2 stars 1 star J joe 7 days ago lwk chill asf god bless",
    "19 days ago Great mentorship. Christ is King.",
    "20 days ago best trader ever best mentorship ever actually reviews trades. Other mentorships seem like shit compared to this on god, I promise you.",
    "1 month ago i've never improved faster",
    "About the creator VC View profile Vito Commerci @ vito33 • Joined Sep 2023 Affiliates VC Become an affiliate Vito Commerci 20% reward Earn money by bringing customers to Vito Commerci. Every time a customer purchases using your link, you&#x27;ll earn a commission."
  ],
  "priceTokens": [
    "$240",
    "$240",
    "$240",
    "$240",
    "$240",
    "$1",
    "$1",
    "$1",
    "$22",
    "$1",
    "$1",
    "$1",
    "$1",
    "$1",
    "$2",
    "$1",
    "$2",
    "$2",
    "$2",
    "$2"
  ],
  "faq": [],
  "textSample": "Vito Commerci&#x27;s Free Community | Whop Sign in Unmute Unmute VC Vito Commerci&#x27;s Free Community Learn From a +100k/Month Trader 4.9 ( 154 ) Trading Join the Free Discord to see the hundreds of people winning before you commit anything. Also get Vito&#x27;s FREE course showing how he turned $240 into over a million at 19 years old. Free one-time purchase Pay Get access Join 10,987 members Features See the hundreds of members making thousands of dollars EVERY DAY See Vito is legit before commiting Watch Vito&#x27;s Free Course showing how he turned $240 into a million at 19 Reviews 4.86 out of 5 154 total reviews 5 stars 4 stars 3 stars 2 stars 1 star J joe 7 days ago lwk chill asf god bless Written 19 days after purchase MC Michael Caggiano 19 days ago Great mentorship. Christ is King. Written 2 months after purchase IG Ishvar Ganesh 20 days ago best trader ever best mentorship ever actually reviews trades. Other mentorships seem like shit compared to this on god, I promise you. Written 2 months after purchase AD Adonis Daniel 1 month ago i've never improved faster Written 4 months after purchase See all reviews About the creator VC View profile Vito Commerci @ vito33 • Joined Sep 2023 Affiliates VC Become an affiliate Vito Commerci 20% reward Earn money by bringing customers to Vito Commerci. Every time a customer purchases using your link, you&#x27;ll earn a commission. Vito Commerci&#x27;s Free Community Free one-time purchase Get access Free one-time purchase Get access",
  "finalUrl": "https://whop.com/vitofoundations/vito-commerci/",
  "fetchedAt": "2025-11-04T21:55:50.102Z",
  "textHash": "789d55cd9c475199cf33d95332ca60d3f2d566e1964af007b83610af7211308d",
  "drilled": false
}