{
  "baseUrl": "https://whop.com/pivotpoints/?a=alexburnett21",
  "title": "Plan To Profit | Whop",
  "h1": "Plan To Profit",
  "bullets": [
    "Powered by PP Plan To Profit I&#x27;ve developed Wayne&#x27;s Pivots Pro to stand out as the most customizable and best selling premium Pivot Point indicator on TradingView. With dozens of well known and custom Pivot Point strategy feature... More 5.0 ( 3 ) Contact seller Products $60.00 Wayne&#x27;s Pivots Pro Wayne&#x27;s Pivots Pro 5.0 ( 1 ) $100.00 / month Free trial Baus Trading Group +Indicators Baus Trading Group +Indicators 5.0 ( 1 ) Free Plan To Profit Community Plan To Profit Community 5.0 ( 1 ) Free Pine Script Mentorship Pine Script Mentorship New Contact seller Reviews AV Aristotle Dio Vasilakos • Plan To Profit Community 8 months ago Joe is a serious professional that he will provide you with the right tools & knowledge not only for trading but also for many other different things ! Extremely tech savy and knowledgeable ! Written 1 day after purchase",
    "WH William Hogg • Wayne&#x27;s Pivots Pro 2 years ago Excellent indicator! Written 4 days after purchase",
    "AC Ariel Cohen • Baus Trading Group +Indicators 12 days ago Written 2 years after purchase"
  ],
  "paras": [
    "PP Plan To Profit I&#x27;ve developed Wayne&#x27;s Pivots Pro to stand out as the most customizable and best selling premium Pivot Point indicator on TradingView. With dozens of well known and custom Pivot Point strategy feature... More 5.0 ( 3 ) Contact seller Products $60.00 Wayne&#x27;s Pivots Pro Wayne&#x27;s Pivots Pro 5.0 ( 1 ) $100.00 / month Free trial Baus Trading Group +Indicators Baus Trading Group +Indicators 5.0 ( 1 ) Free Plan To Profit Community Plan To Profit Community 5.0 ( 1 ) Free Pine Script Mentorship Pine Script Mentorship New Contact seller Reviews AV Aristotle Dio Vasilakos • Plan To Profit Community 8 months ago Joe is a serious professional that he will provide you with the right tools & knowledge not only for trading but also for many other different things ! Extremely tech savy and knowledgeable !",
    "2 years ago Excellent indicator!",
    "12 days ago"
  ],
  "priceTokens": [
    "$60.00",
    "$100.00",
    "$1",
    "$1",
    "$1",
    "$21",
    "$1",
    "$1",
    "$1",
    "$1",
    "$28",
    "$1",
    "$28",
    "$28",
    "$28",
    "$28",
    "$3",
    "$3",
    "$3",
    "$10"
  ],
  "faq": [],
  "textSample": "Powered by PP Plan To Profit I&#x27;ve developed Wayne&#x27;s Pivots Pro to stand out as the most customizable and best selling premium Pivot Point indicator on TradingView. With dozens of well known and custom Pivot Point strategy feature... More 5.0 ( 3 ) Contact seller Products $60.00 Wayne&#x27;s Pivots Pro Wayne&#x27;s Pivots Pro 5.0 ( 1 ) $100.00 / month Free trial Baus Trading Group +Indicators Baus Trading Group +Indicators 5.0 ( 1 ) Free Plan To Profit Community Plan To Profit Community 5.0 ( 1 ) Free Pine Script Mentorship Pine Script Mentorship New Contact seller Reviews AV Aristotle Dio Vasilakos • Plan To Profit Community 8 months ago Joe is a serious professional that he will provide you with the right tools & knowledge not only for trading but also for many other different things ! Extremely tech savy and knowledgeable ! Written 1 day after purchase WH William Hogg • Wayne&#x27;s Pivots Pro 2 years ago Excellent indicator! Written 4 days after purchase AC Ariel Cohen • Baus Trading Group +Indicators 12 days ago Written 2 years after purchase Plan To Profit | Whop",
  "finalUrl": "https://whop.com/pivotpoints/?a=alexburnett21",
  "fetchedAt": "2025-11-05T17:41:29.800Z",
  "textHash": "f2fafd7b843cc9170313f27bcac2219964d6e34956c688258d0455607988a79b",
  "drilled": false
}