{
  "baseUrl": "https://whop.com/webtrend/webtrend-indicators-discord/",
  "title": "WebTrend + (Most Popular) | Whop",
  "h1": "WebTrend + (Most Popular)",
  "bullets": [
    "Sign in Unmute Unmute W WebTrend + (Most Popular) Quick Access 5.0 ( 5 ) Trading WebTrend is a company that specializes in market speculation, technical analysis tools, and community. $29.99 / month Pay Get access Features Access to our 15 TradingView indicators and ALL new indicators we release!",
    "Join our exclusive WebTrend Discord community for new and experienced traders.",
    "Watch all our exclusive video tutorials that go more into our tools strategies.",
    "Daily access to WebTrend analysts",
    "KV Kylian castells de la vega 9 months ago I'm so happy and grateful to have found this community, its just my first week and im feeling really good but the most important thing its that im feeling that there's always someone there to ask and help, the discord its a plus, so many professionals in there helping people and honestly im a rookie... Show more Written 1 day after purchase",
    "P pagingdr.t 1 year ago I've been in this community for a few weeks now and I've learned more in the past few weeks than I have in my entire crypto journey. I value the live sessions and the constant access to the creators of the group. Also, the indicators provided are second to none. So grateful to have found this commun... Show more Written 16 days after purchase",
    "B bathingap3z 1 year ago Webtrend is much more than just a trading suite of technical analysis tools—it's a game changer for anyone serious about trading. The platform provides clear indicators that highlight potential big market movements, especially when you combine a few of their indicators together. One of the best perk... Show more Written 16 days after purchase",
    "BT Brandon Tejada 2 years ago This product is amazing for anybody looking to study charts. Instead of normal green and red candles, this indicator package visualizes things in a way that helps you better understand trend. study the past using this indicator package and you will see how it helps you better understand what's going... Show more Written 1 month after purchase"
  ],
  "paras": [
    "Sign in Unmute Unmute W WebTrend + (Most Popular) Quick Access 5.0 ( 5 ) Trading WebTrend is a company that specializes in market speculation, technical analysis tools, and community.",
    "Access to our 15 TradingView indicators and ALL new indicators we release! Join our exclusive WebTrend Discord community for new and experienced traders. Watch all our exclusive video tutorials that go more into our tools strategies. Daily access to WebTrend analysts Reviews 5 out of 5 5 total reviews 5 stars 4 stars 3 stars 2 stars 1 star KV Kylian castells de la vega 9 months ago I'm so happy and grateful to have found this community, its just my first week and im feeling really good but the most important thing its that im feeling that there's always someone there to ask and help, the discord its a plus, so many professionals in there helping people and honestly im a rookie...",
    "Written 1 day after purchase P pagingdr.t 1 year ago I've been in this community for a few weeks now and I've learned more in the past few weeks than I have in my entire crypto journey. I value the live sessions and the constant access to the creators of the group. Also, the indicators provided are second to none. So grateful to have found this commun...",
    "Written 16 days after purchase B bathingap3z 1 year ago Webtrend is much more than just a trading suite of technical analysis tools—it's a game changer for anyone serious about trading. The platform provides clear indicators that highlight potential big market movements, especially when you combine a few of their indicators together. One of the best perk...",
    "Written 16 days after purchase BT Brandon Tejada 2 years ago This product is amazing for anybody looking to study charts. Instead of normal green and red candles, this indicator package visualizes things in a way that helps you better understand trend. study the past using this indicator package and you will see how it helps you better understand what's going...",
    "Written 1 month after purchase See all reviews About the creator W View profile WebTrend @ webtrend • Joined Apr 2023 We are dedicated to empowering traders across the world. At WebTrend, we offer exclusive access to indicators, video content, and a vibrant community to help you grow. FAQs Market Realist Pledge (Anti-Guarantee) What is the best thing about WebTrend? How many Indicators do I get for free? Affiliates W Become an affiliate WebTrend 50% reward Earn money by bringing customers to WebTrend. Every time a customer purchases using your link, you&#x27;ll earn a commission."
  ],
  "priceTokens": [
    "$29.99",
    "$29.99",
    "$29.99",
    "$1",
    "$1",
    "$1",
    "$22",
    "$1",
    "$1",
    "$1",
    "$1",
    "$1",
    "$2",
    "$1",
    "$2",
    "$2",
    "$2",
    "$2",
    "$3",
    "$3"
  ],
  "faq": [],
  "textSample": "Sign in Unmute Unmute W WebTrend + (Most Popular) Quick Access 5.0 ( 5 ) Trading WebTrend is a company that specializes in market speculation, technical analysis tools, and community. $29.99 / month Pay Get access Features Access to our 15 TradingView indicators and ALL new indicators we release! Join our exclusive WebTrend Discord community for new and experienced traders. Watch all our exclusive video tutorials that go more into our tools strategies. Daily access to WebTrend analysts Reviews 5 out of 5 5 total reviews 5 stars 4 stars 3 stars 2 stars 1 star KV Kylian castells de la vega 9 months ago I'm so happy and grateful to have found this community, its just my first week and im feeling really good but the most important thing its that im feeling that there's always someone there to ask and help, the discord its a plus, so many professionals in there helping people and honestly im a rookie... Show more Written 1 day after purchase P pagingdr.t 1 year ago I've been in this community for a few weeks now and I've learned more in the past few weeks than I have in my entire crypto journey. I value the live sessions and the constant access to the creators of the group. Also, the indicators provided are second to none. So grateful to have found this commun... Show more Written 16 days after purchase B bathingap3z 1 year ago Webtrend is much more than just a trading suite of technical analysis tools—it's a game changer for anyone serious about trading. The platform provides clear indicators that highlight potential big market movements, especially when you combine a few of their indicators together. One of the best perk... Show more Written 16 days after purchase BT Brandon Tejada 2 years ago This product is amazing for anybody looking to study charts. Instead of normal green and red candles, this indicator package visualizes things in a way that helps you better understand trend. study the past using this indicator package and you will see how it helps you better understand what's going... Show more Written 1 month after purchase See all reviews About the creator W View profile WebTrend @ webtrend • Joined Apr 2023 We are dedicated to empowering traders across the world. At WebTrend, we offer exclusive access to indicators, video content, and a vibrant community to help you grow. FAQs Market Realist Pledge (Anti-Guarantee) What is the best thing about WebTrend? How many Indicators do I get for free? Affiliates W Become an affiliate WebTrend 50% reward Earn money by bringing customers to WebTrend. Every time a customer purchases using your link, you&#x27;ll earn a commission. WebTrend + (Most Popular) $29.99 / month Get access $29.99 / month Pay Get access Pay Get access WebTrend + (Most Popular) | Whop",
  "finalUrl": "https://whop.com/webtrend/webtrend-indicators-discord/",
  "fetchedAt": "2025-11-05T10:09:05.626Z",
  "textHash": "6759832b416ee368a26769b356377371d7172a0979bda5de8c93a97f764b5a0b",
  "drilled": false
}