{
  "baseUrl": "https://whop.com/xauusdsignals/z12-xauusd-specialist-signals/",
  "title": "XAUUSD Signals Monthly | Whop",
  "h1": "XAUUSD Signals Monthly",
  "bullets": [
    "Sign in X XAUUSD Signals Monthly XAUUSD Signals Monthly 4.5 ( 42 ) Other Specialized XAUUSD Signals by trading leader Goldguy. Get daily insights, video breakdowns, and proven strategies from an expert with 8+ years of success. $39.90 / month Pay Join Join 14 members Features Access to real-time XAUUSD signals from seasoned trader &#x27;Goldguy&#x27;.",
    "Join a community of traders and engage in discussions for shared growth.",
    "Receive video breakdowns and exclusive market insights.",
    "Unlock exclusive content and early access to new developments.",
    "Get 1-5 specialized signals per day, plus occasional Forex gems.",
    "A archgreen12 10 months ago Been using this knowledge for a good month or two and when goldguy says this strategy, with proper risk and good psychology is game over, he wasnâ€™t lying. This strategy has turned me profitable already Written 25 days after purchase",
    "NV Nicolas Venanzi 1 year ago At the moment Iâ€™m in the free group and also here received nice setup! Written 3 months after purchase",
    "A Alfie 1 year ago One of the only legit signal providers, 90% of trades are incredible with high rr. Im excited to continue my trading with z12ðŸ’ª Written 5 months after purchase",
    "MN Mirelle Nascimento 1 year ago Itâ€™s the most consistent of the market. Itâ€™s incredible how he predicts the market movements. Written 5 months after purchase"
  ],
  "paras": [
    "Sign in X XAUUSD Signals Monthly XAUUSD Signals Monthly 4.5 ( 42 ) Other Specialized XAUUSD Signals by trading leader Goldguy. Get daily insights, video breakdowns, and proven strategies from an expert with 8+ years of success.",
    "Join 14 members Features Access to real-time XAUUSD signals from seasoned trader &#x27;Goldguy&#x27;. Join a community of traders and engage in discussions for shared growth. Receive video breakdowns and exclusive market insights. Unlock exclusive content and early access to new developments. Get 1-5 specialized signals per day, plus occasional Forex gems. Reviews 4.52 out of 5 42 total reviews 5 stars 4 stars 3 stars 2 stars 1 star A archgreen12 10 months ago Been using this knowledge for a good month or two and when goldguy says this strategy, with proper risk and good psychology is game over, he wasnâ€™t lying. This strategy has turned me profitable already",
    "1 year ago At the moment Iâ€™m in the free group and also here received nice setup!",
    "1 year ago One of the only legit signal providers, 90% of trades are incredible with high rr. Im excited to continue my trading with z12ðŸ’ª",
    "1 year ago Itâ€™s the most consistent of the market. Itâ€™s incredible how he predicts the market movements.",
    "About the creator G View profile Goldguy @ goldguy â€¢ Joined Feb 2024 With over 8 years of experience trading XAUUSD, I&#x27;ve honed my skills to perfection. My passion for the market drives me to share my insights and strategies with others, ensuring they benefit from my expertise. Join me as I guide you through the intricacies of XAUUSD trading, helping you achieve consistent profits and understand market dynamics. FAQs How do I receive and implement the XAUUSD trading signals from your company, and what role does &#x27;Goldguy&#x27; play in generating these signals? What makes your XAUUSD trading signals, particularly those generated by &#x27;Goldguy,&#x27; unique and reliable compared to other signal providers? How can I assess the performance of your XAUUSD trading signals, especially those attributed to &#x27;Goldguy,&#x27; and what kind of results can I expect based on his track record? Affiliates X Become an affiliate XAUUSD.co.uk 30% reward Earn money by bringing customers to XAUUSD.co.uk. Every time a customer purchases using your link, you&#x27;ll earn a commission."
  ],
  "priceTokens": [
    "$39.90",
    "$39.90",
    "$39.90",
    "$1",
    "$1",
    "$1",
    "$22",
    "$1",
    "$1",
    "$1",
    "$1",
    "$1",
    "$2",
    "$1",
    "$2",
    "$2",
    "$2",
    "$2",
    "$3",
    "$3"
  ],
  "faq": [],
  "textSample": "Sign in X XAUUSD Signals Monthly XAUUSD Signals Monthly 4.5 ( 42 ) Other Specialized XAUUSD Signals by trading leader Goldguy. Get daily insights, video breakdowns, and proven strategies from an expert with 8+ years of success. $39.90 / month Pay Join Join 14 members Features Access to real-time XAUUSD signals from seasoned trader &#x27;Goldguy&#x27;. Join a community of traders and engage in discussions for shared growth. Receive video breakdowns and exclusive market insights. Unlock exclusive content and early access to new developments. Get 1-5 specialized signals per day, plus occasional Forex gems. Reviews 4.52 out of 5 42 total reviews 5 stars 4 stars 3 stars 2 stars 1 star A archgreen12 10 months ago Been using this knowledge for a good month or two and when goldguy says this strategy, with proper risk and good psychology is game over, he wasnâ€™t lying. This strategy has turned me profitable already Written 25 days after purchase NV Nicolas Venanzi 1 year ago At the moment Iâ€™m in the free group and also here received nice setup! Written 3 months after purchase A Alfie 1 year ago One of the only legit signal providers, 90% of trades are incredible with high rr. Im excited to continue my trading with z12ðŸ’ª Written 5 months after purchase MN Mirelle Nascimento 1 year ago Itâ€™s the most consistent of the market. Itâ€™s incredible how he predicts the market movements. Written 5 months after purchase See all reviews About the creator G View profile Goldguy @ goldguy â€¢ Joined Feb 2024 With over 8 years of experience trading XAUUSD, I&#x27;ve honed my skills to perfection. My passion for the market drives me to share my insights and strategies with others, ensuring they benefit from my expertise. Join me as I guide you through the intricacies of XAUUSD trading, helping you achieve consistent profits and understand market dynamics. FAQs How do I receive and implement the XAUUSD trading signals from your company, and what role does &#x27;Goldguy&#x27; play in generating these signals? What makes your XAUUSD trading signals, particularly those generated by &#x27;Goldguy,&#x27; unique and reliable compared to other signal providers? How can I assess the performance of your XAUUSD trading signals, especially those attributed to &#x27;Goldguy,&#x27; and what kind of results can I expect based on his track record? Affiliates X Become an affiliate XAUUSD.co.uk 30% reward Earn money by bringing customers to XAUUSD.co.uk. Every time a customer purchases using your link, you&#x27;ll earn a commission. XAUUSD Signals Monthly $39.90 / month Join $39.90 / month Pay Join Pay Join XAUUSD Signals Monthly | Whop",
  "finalUrl": "https://whop.com/xauusdsignals/z12-xauusd-specialist-signals/",
  "fetchedAt": "2025-11-05T09:26:54.522Z",
  "textHash": "603b259d8fc4d3858d713dc9f1c83f383da4f745748a70f9ff7af3c6b20ea584",
  "drilled": false
}