{
  "baseUrl": "https://whop.com/trading-signals-discord/all-inclusive-access/",
  "title": "Zeiierman All Inclusive | Whop",
  "h1": "Zeiierman All Inclusive",
  "bullets": [
    "Sign in ZT Zeiierman All Inclusive Unlock Premium Trading Tools &amp; Support 4.9 ( 14 ) Other Boost your trades with Zeiierman Trading! Access top strategies, indicators, bots, signals, and 24/7 support directly on TradingView. $95.20 / month Pay Join Features Premium indicator suite on TradingView",
    "Access to 2 Automated Bots on TradingView",
    "Weekly shared user strategies and setups",
    "Crypto and liquidity signals for informed trading",
    "24/7 support with active product updates",
    "V V.P 2 years ago I have known Zeiirman for few years now. I started using his indicators initially on a monthly basis and it didn’t take me long to become a lifetime subscriber. That is how good his indicatos are. Whether you are an experienced trader or a beginner, his indicators works like magic and can add a conf... Show more Written 10 minutes after purchase",
    "RG Rabie Georgey 2 years ago They offer excellent indicators. I am very happy with the quality of thier indicators. Thier discord channel and thier customer service is outstanding. I am very happy I signed up for the lifetime membership. Written 3 hours after purchase",
    "R randolattik 2 years ago absolute best (NR1) Written a few seconds after purchase",
    "M muratguner 2 years ago He is best Written 2 minutes after purchase"
  ],
  "paras": [
    "Sign in ZT Zeiierman All Inclusive Unlock Premium Trading Tools &amp; Support 4.9 ( 14 ) Other Boost your trades with Zeiierman Trading! Access top strategies, indicators, bots, signals, and 24/7 support directly on TradingView.",
    "$95.20 / month Pay Join Features Premium indicator suite on TradingView Access to 2 Automated Bots on TradingView Weekly shared user strategies and setups Crypto and liquidity signals for informed trading 24/7 support with active product updates Reviews 4.86 out of 5 14 total reviews 5 stars 4 stars 3 stars 2 stars 1 star V V.P 2 years ago I have known Zeiirman for few years now. I started using his indicators initially on a monthly basis and it didn’t take me long to become a lifetime subscriber. That is how good his indicatos are. Whether you are an experienced trader or a beginner, his indicators works like magic and can add a conf...",
    "Written 10 minutes after purchase RG Rabie Georgey 2 years ago They offer excellent indicators. I am very happy with the quality of thier indicators. Thier discord channel and thier customer service is outstanding. I am very happy I signed up for the lifetime membership.",
    "2 years ago absolute best (NR1)",
    "2 years ago He is best",
    "About the creator ZT View profile Zeiierman Trading @ zeiiermantrading • Joined Nov 2023 I’ve been immersed in trading for years, transforming from a novice to a 7-figure trader. My passion lies in sharing expert signals and strategies that empower others to succeed in the trading world. With Zeiierman Trading, I aim to make trading accessible and profitable for everyone, whether you&#x27;re just starting or a seasoned pro. FAQs Is this friendly for beginners? What&#x27;s your refund policy? Do I need Discord to become a member? What is Zeiierman Trading? Affiliates ZT Become an affiliate Zeiierman Trading 30% reward Earn money by bringing customers to Zeiierman Trading. Every time a customer purchases using your link, you&#x27;ll earn a commission."
  ],
  "priceTokens": [
    "$95.20",
    "$95.20",
    "$95.20",
    "$1",
    "$1",
    "$1",
    "$22",
    "$1",
    "$1",
    "$1",
    "$1",
    "$1",
    "$2",
    "$1",
    "$2",
    "$2",
    "$2",
    "$2",
    "$3",
    "$3"
  ],
  "faq": [],
  "textSample": "Sign in ZT Zeiierman All Inclusive Unlock Premium Trading Tools &amp; Support 4.9 ( 14 ) Other Boost your trades with Zeiierman Trading! Access top strategies, indicators, bots, signals, and 24/7 support directly on TradingView. $95.20 / month Pay Join Features Premium indicator suite on TradingView Access to 2 Automated Bots on TradingView Weekly shared user strategies and setups Crypto and liquidity signals for informed trading 24/7 support with active product updates Reviews 4.86 out of 5 14 total reviews 5 stars 4 stars 3 stars 2 stars 1 star V V.P 2 years ago I have known Zeiirman for few years now. I started using his indicators initially on a monthly basis and it didn’t take me long to become a lifetime subscriber. That is how good his indicatos are. Whether you are an experienced trader or a beginner, his indicators works like magic and can add a conf... Show more Written 10 minutes after purchase RG Rabie Georgey 2 years ago They offer excellent indicators. I am very happy with the quality of thier indicators. Thier discord channel and thier customer service is outstanding. I am very happy I signed up for the lifetime membership. Written 3 hours after purchase R randolattik 2 years ago absolute best (NR1) Written a few seconds after purchase M muratguner 2 years ago He is best Written 2 minutes after purchase See all reviews About the creator ZT View profile Zeiierman Trading @ zeiiermantrading • Joined Nov 2023 I’ve been immersed in trading for years, transforming from a novice to a 7-figure trader. My passion lies in sharing expert signals and strategies that empower others to succeed in the trading world. With Zeiierman Trading, I aim to make trading accessible and profitable for everyone, whether you&#x27;re just starting or a seasoned pro. FAQs Is this friendly for beginners? What&#x27;s your refund policy? Do I need Discord to become a member? What is Zeiierman Trading? Affiliates ZT Become an affiliate Zeiierman Trading 30% reward Earn money by bringing customers to Zeiierman Trading. Every time a customer purchases using your link, you&#x27;ll earn a commission. Zeiierman All Inclusive $95.20 / month +2 options Join $95.20 / month 2 options Pay Join Pay Join Zeiierman All Inclusive | Whop",
  "finalUrl": "https://whop.com/trading-signals-discord/all-inclusive-access/",
  "fetchedAt": "2025-11-05T10:43:26.016Z",
  "textHash": "b2e34dea677059520c52ff0bcdd5ccf86a1a1c1a05b78d929a6d5074fa5d8e81",
  "drilled": false
}