{
  "baseUrl": "https://whop.com/trading-signals-discord/?a=alexburnett21",
  "title": "Zeiierman Trading | Whop",
  "h1": "Zeiierman Trading",
  "bullets": [
    "Powered by ZT Zeiierman Trading I’ve been immersed in trading for years, transforming from a novice to a 7-figure trader. My passion lies in sharing expert signals and strategies that empower others to succeed in the trading world. ... More 4.9 ( 14 ) Contact seller Products $95.20 / month Unlock Premium Trading Tools &amp; Support Zeiierman All Inclusive 5.0 ( 9 ) $1,999.00 All-Inclusive Access to Trading Success Zeiierman Trading Lifetime 5.0 ( 2 ) $149.00 Achieve 7-Figure Trading Success! Zeiierman Trading Signals New Free Connect with Traders on Discord Free Zeiierman Trading Free Access 3.0 ( 1 ) Free Unlock Free TradingView Indicators Now! Zeiierman Free Indicators New $49.00 Master Smart Money with Zeiierman! Zeiierman SMC Course New Contact seller Reviews V V.P • Zeiierman All Inclusive 2 years ago I have known Zeiirman for few years now. I started using his indicators initially on a monthly basis and it didn’t take me long to become a lifetime subscriber. That is how good his indicatos are. Whether you are an experienced trader or a beginner, his indicators works like magic and can add a conf... Show more Written 10 minutes after purchase",
    "RG Rabie Georgey • Zeiierman Trading Lifetime 2 years ago They offer excellent indicators. I am very happy with the quality of thier indicators. Thier discord channel and thier customer service is outstanding. I am very happy I signed up for the lifetime membership. Written 3 hours after purchase",
    "R randolattik 2 years ago absolute best (NR1) Written a few seconds after purchase",
    "M muratguner 2 years ago He is best Written 2 minutes after purchase"
  ],
  "paras": [
    "ZT Zeiierman Trading I’ve been immersed in trading for years, transforming from a novice to a 7-figure trader. My passion lies in sharing expert signals and strategies that empower others to succeed in the trading world. ... More 4.9 ( 14 ) Contact seller Products $95.20 / month Unlock Premium Trading Tools &amp; Support Zeiierman All Inclusive 5.0 ( 9 ) $1,999.00 All-Inclusive Access to Trading Success Zeiierman Trading Lifetime 5.0 ( 2 ) $149.00 Achieve 7-Figure Trading Success! Zeiierman Trading Signals New Free Connect with Traders on Discord Free Zeiierman Trading Free Access 3.0 ( 1 ) Free Unlock Free TradingView Indicators Now! Zeiierman Free Indicators New $49.00 Master Smart Money with Zeiierman! Zeiierman SMC Course New Contact seller Reviews V V.P • Zeiierman All Inclusive 2 years ago I have known Zeiirman for few years now. I started using his indicators initially on a monthly basis and it didn’t take me long to become a lifetime subscriber. That is how good his indicatos are. Whether you are an experienced trader or a beginner, his indicators works like magic and can add a conf...",
    "Written 10 minutes after purchase RG Rabie Georgey • Zeiierman Trading Lifetime 2 years ago They offer excellent indicators. I am very happy with the quality of thier indicators. Thier discord channel and thier customer service is outstanding. I am very happy I signed up for the lifetime membership.",
    "2 years ago absolute best (NR1)",
    "2 years ago He is best"
  ],
  "priceTokens": [
    "$95.20",
    "$1,999.00",
    "$149.00",
    "$49.00",
    "$1",
    "$1",
    "$1",
    "$21",
    "$1",
    "$1",
    "$1",
    "$1",
    "$28",
    "$1",
    "$28",
    "$28",
    "$28",
    "$28",
    "$3",
    "$3"
  ],
  "faq": [],
  "textSample": "Powered by ZT Zeiierman Trading I’ve been immersed in trading for years, transforming from a novice to a 7-figure trader. My passion lies in sharing expert signals and strategies that empower others to succeed in the trading world. ... More 4.9 ( 14 ) Contact seller Products $95.20 / month Unlock Premium Trading Tools &amp; Support Zeiierman All Inclusive 5.0 ( 9 ) $1,999.00 All-Inclusive Access to Trading Success Zeiierman Trading Lifetime 5.0 ( 2 ) $149.00 Achieve 7-Figure Trading Success! Zeiierman Trading Signals New Free Connect with Traders on Discord Free Zeiierman Trading Free Access 3.0 ( 1 ) Free Unlock Free TradingView Indicators Now! Zeiierman Free Indicators New $49.00 Master Smart Money with Zeiierman! Zeiierman SMC Course New Contact seller Reviews V V.P • Zeiierman All Inclusive 2 years ago I have known Zeiirman for few years now. I started using his indicators initially on a monthly basis and it didn’t take me long to become a lifetime subscriber. That is how good his indicatos are. Whether you are an experienced trader or a beginner, his indicators works like magic and can add a conf... Show more Written 10 minutes after purchase RG Rabie Georgey • Zeiierman Trading Lifetime 2 years ago They offer excellent indicators. I am very happy with the quality of thier indicators. Thier discord channel and thier customer service is outstanding. I am very happy I signed up for the lifetime membership. Written 3 hours after purchase R randolattik 2 years ago absolute best (NR1) Written a few seconds after purchase M muratguner 2 years ago He is best Written 2 minutes after purchase See all reviews Zeiierman Trading | Whop",
  "finalUrl": "https://whop.com/trading-signals-discord/?a=alexburnett21",
  "fetchedAt": "2025-11-05T09:26:54.072Z",
  "textHash": "1720e1dcfc39e4a9d2f1f16606f4b9745a6642b4dbcd82d9273a81d636635610",
  "drilled": false
}