{
  "baseUrl": "https://whop.com/ts-basic-access/ts-basic-access/?a=alexburnett21",
  "title": "ğŸ’¼ Basic Access | Whop",
  "h1": "ğŸ’¼ Basic Access",
  "bullets": [
    "Sign in T ğŸ’¼ Basic Access Start Your Trading Journey with Essential Tools 5.0 ( 1 ) Trading Access DOTs Trading Spy Chart to kickstart your trading with powerful, real-time insights. $99.00 / month 14 day trial + $9.00 initial fee Pay Join Join 7 members Features ğŸ“ˆ Access to DOTs Trading Spy Chart for key market trend analysis.",
    "ğŸ’¡ Beginner-friendly tools to help you start trading confidently.",
    "ğŸ·ï¸ Affordable pricing for those on a budget or new to trading.",
    "â±ï¸ Quick and easy setup to start trading right away.",
    "ğŸ“Š Gain clarity on market trends with minimal complexity.",
    "OA Olu Ade 2 months ago Best Discord group hands down. Written 8 months after purchase"
  ],
  "paras": [
    "Sign in T ğŸ’¼ Basic Access Start Your Trading Journey with Essential Tools 5.0 ( 1 ) Trading Access DOTs Trading Spy Chart to kickstart your trading with powerful, real-time insights.",
    "$99.00 / month 14 day trial + $9.00 initial fee Pay Join Join 7 members Features ğŸ“ˆ Access to DOTs Trading Spy Chart for key market trend analysis. ğŸ’¡ Beginner-friendly tools to help you start trading confidently. ğŸ·ï¸ Affordable pricing for those on a budget or new to trading. â±ï¸ Quick and easy setup to start trading right away. ğŸ“Š Gain clarity on market trends with minimal complexity. Reviews 5 out of 5 1 review 5 stars 4 stars 3 stars 2 stars 1 star OA Olu Ade 2 months ago Best Discord group hands down.",
    "FAQs Whatâ€™s the difference between the Basic and Premium subscriptions? Can I upgrade to the Premium or Ultra subscription later? Affiliates T Become an affiliate TrendScalper 30% reward Earn money by bringing customers to TrendScalper. Every time a customer purchases using your link, you&#x27;ll earn a commission."
  ],
  "priceTokens": [
    "$99.00",
    "$9.00",
    "$99.00",
    "$99.00",
    "$1",
    "$1",
    "$1",
    "$22",
    "$1",
    "$1",
    "$1",
    "$1",
    "$1",
    "$2",
    "$1",
    "$2",
    "$2",
    "$2",
    "$2",
    "$3"
  ],
  "faq": [],
  "textSample": "Sign in T ğŸ’¼ Basic Access Start Your Trading Journey with Essential Tools 5.0 ( 1 ) Trading Access DOTs Trading Spy Chart to kickstart your trading with powerful, real-time insights. $99.00 / month 14 day trial + $9.00 initial fee Pay Join Join 7 members Features ğŸ“ˆ Access to DOTs Trading Spy Chart for key market trend analysis. ğŸ’¡ Beginner-friendly tools to help you start trading confidently. ğŸ·ï¸ Affordable pricing for those on a budget or new to trading. â±ï¸ Quick and easy setup to start trading right away. ğŸ“Š Gain clarity on market trends with minimal complexity. Reviews 5 out of 5 1 review 5 stars 4 stars 3 stars 2 stars 1 star OA Olu Ade 2 months ago Best Discord group hands down. Written 8 months after purchase About the creator T View profile trendscalper @ trendscalper â€¢ Joined Nov 2024 FAQs Whatâ€™s the difference between the Basic and Premium subscriptions? Can I upgrade to the Premium or Ultra subscription later? Affiliates T Become an affiliate TrendScalper 30% reward Earn money by bringing customers to TrendScalper. Every time a customer purchases using your link, you&#x27;ll earn a commission. ğŸ’¼ Basic Access $99.00 / month +1 option Join $99.00 / month 1 option Pay Join Pay Join ğŸ’¼ Basic Access | Whop",
  "finalUrl": "https://whop.com/ts-basic-access/ts-basic-access/?a=alexburnett21",
  "fetchedAt": "2025-11-06T11:36:52.296Z",
  "textHash": "f85d540579d59f9290b4c02bb6688234f8d8bef08f0030433af7bd70de523eab",
  "drilled": true
}