{
  "baseUrl": "https://whop.com/snatcherbets/1-month-access-vip-parlay-king/",
  "title": "1-Month Access VIP/Parlay King | Whop",
  "h1": "1-Month Access VIP/Parlay King",
  "bullets": [
    "Sign in S 1-Month Access VIP/Parlay King Gain access to VIP Picks and Make EASY MONEY 4.9 ( 78 ) Sports betting Fast growing community geared toward making you the most money possible! $300.00 / month Pay Join Features VIP Access to our Telegram",
    "YK Yosef Kidane 4 months ago Good guy that wants to see you win appreciate you brother Written 14 hours after purchase",
    "K Kun 4 months ago So far the best in the game Written 9 hours after purchase",
    "X Xklusiv 4 months ago Trust the process and you won’t regret it Written 3 months after purchase",
    "JO Jake Oneill 4 months ago Great low risk high reward bets! First time joining and already on day 2 a decent slip hit. Just make sure to pay close attention to those notifications lol Written 1 day after purchase"
  ],
  "paras": [
    "Sign in S 1-Month Access VIP/Parlay King Gain access to VIP Picks and Make EASY MONEY 4.9 ( 78 ) Sports betting Fast growing community geared toward making you the most money possible!",
    "VIP Access to our Telegram Reviews 4.88 out of 5 78 total reviews 5 stars 4 stars 3 stars 2 stars 1 star YK Yosef Kidane 4 months ago Good guy that wants to see you win appreciate you brother",
    "4 months ago So far the best in the game",
    "4 months ago Trust the process and you won’t regret it",
    "4 months ago Great low risk high reward bets! First time joining and already on day 2 a decent slip hit. Just make sure to pay close attention to those notifications lol",
    "About the creator S View profile Snatcher @ snatcherbets • Joined Jun 2023 Affiliates S Become an affiliate SnatcherBets 30% reward Earn money by bringing customers to SnatcherBets. Every time a customer purchases using your link, you&#x27;ll earn a commission."
  ],
  "priceTokens": [
    "$300.00",
    "$300.00",
    "$300.00",
    "$1",
    "$1",
    "$1",
    "$22",
    "$1",
    "$1",
    "$1",
    "$1",
    "$1",
    "$2",
    "$1",
    "$2",
    "$2",
    "$2",
    "$2",
    "$3",
    "$3"
  ],
  "faq": [],
  "textSample": "Sign in S 1-Month Access VIP/Parlay King Gain access to VIP Picks and Make EASY MONEY 4.9 ( 78 ) Sports betting Fast growing community geared toward making you the most money possible! $300.00 / month Pay Join Features VIP Access to our Telegram Reviews 4.88 out of 5 78 total reviews 5 stars 4 stars 3 stars 2 stars 1 star YK Yosef Kidane 4 months ago Good guy that wants to see you win appreciate you brother Written 14 hours after purchase K Kun 4 months ago So far the best in the game Written 9 hours after purchase X Xklusiv 4 months ago Trust the process and you won’t regret it Written 3 months after purchase JO Jake Oneill 4 months ago Great low risk high reward bets! First time joining and already on day 2 a decent slip hit. Just make sure to pay close attention to those notifications lol Written 1 day after purchase See all reviews About the creator S View profile Snatcher @ snatcherbets • Joined Jun 2023 Affiliates S Become an affiliate SnatcherBets 30% reward Earn money by bringing customers to SnatcherBets. Every time a customer purchases using your link, you&#x27;ll earn a commission. 1-Month Access VIP/Parlay King $300.00 / month Join $300.00 / month Pay Join Pay Join 1-Month Access VIP/Parlay King | Whop",
  "finalUrl": "https://whop.com/snatcherbets/1-month-access-vip-parlay-king/",
  "fetchedAt": "2025-11-04T18:06:50.183Z",
  "textHash": "8c4265dca8ddc1cf4cf209319e6a8969132306616063420d3203694c94f7e4e2",
  "drilled": false
}