{
  "baseUrl": "https://whop.com/lifetime-34-28c4/1-month-0e/",
  "title": "1 month | Whop",
  "h1": "1 month",
  "bullets": [
    "Sign in CL 1 month Elevate Your Trading with Expert Signals 5.0 ( 2 ) Trading Access real-time crypto signals, expert training, and live chat support. Join competitions to enhance your skills and make profitable decisions quickly. €210.00 for 1 month Pay Join Join 23 members Features Real-time crypto signals for timely decision-making",
    "Advanced training materials to boost trading skills",
    "Instant access to expert guidance via live chat",
    "Exclusive member competitions to test skills",
    "Join a community to share insights and strategies",
    "V Valdas 1 month ago Written 2 months after purchase",
    "R Rokenzo 1 month ago Written 14 days after purchase"
  ],
  "paras": [
    "Sign in CL 1 month Elevate Your Trading with Expert Signals 5.0 ( 2 ) Trading Access real-time crypto signals, expert training, and live chat support. Join competitions to enhance your skills and make profitable decisions quickly.",
    "Join 23 members Features Real-time crypto signals for timely decision-making Advanced training materials to boost trading skills Instant access to expert guidance via live chat Exclusive member competitions to test skills Join a community to share insights and strategies Reviews 5 out of 5 2 total reviews 5 stars 4 stars 3 stars 2 stars 1 star V Valdas 1 month ago",
    "1 month ago",
    "FAQs What makes Crypto Lietuva different from other signal providers? How often are the trading signals updated? Affiliates CL Become an affiliate Crypto Lietuva 30% reward Earn money by bringing customers to Crypto Lietuva. Every time a customer purchases using your link, you&#x27;ll earn a commission."
  ],
  "priceTokens": [
    "€210.00",
    "€210.00",
    "€210.00",
    "$1",
    "$1",
    "$1",
    "$22",
    "$1",
    "$1",
    "$1",
    "$1",
    "$1",
    "$2",
    "$1",
    "$2",
    "$2",
    "$2",
    "$2",
    "$3",
    "$3"
  ],
  "faq": [],
  "textSample": "Sign in CL 1 month Elevate Your Trading with Expert Signals 5.0 ( 2 ) Trading Access real-time crypto signals, expert training, and live chat support. Join competitions to enhance your skills and make profitable decisions quickly. €210.00 for 1 month Pay Join Join 23 members Features Real-time crypto signals for timely decision-making Advanced training materials to boost trading skills Instant access to expert guidance via live chat Exclusive member competitions to test skills Join a community to share insights and strategies Reviews 5 out of 5 2 total reviews 5 stars 4 stars 3 stars 2 stars 1 star V Valdas 1 month ago Written 2 months after purchase R Rokenzo 1 month ago Written 14 days after purchase About the creator CL View profile Crypto Lietuva @ cryptolietuva42 • Joined Sep 2024 As a passionate cryptocurrency enthusiast, I&#x27;ve helped transform Crypto Lietuva from a small community into a leading provider of crypto news and signals in Lithuania. With a focus on quality and accuracy, we empower traders with timely information and strategies for success. FAQs What makes Crypto Lietuva different from other signal providers? How often are the trading signals updated? Affiliates CL Become an affiliate Crypto Lietuva 30% reward Earn money by bringing customers to Crypto Lietuva. Every time a customer purchases using your link, you&#x27;ll earn a commission. 1 month €210.00 for 1 month Join €210.00 for 1 month Pay Join Pay Join 1 month | Whop",
  "finalUrl": "https://whop.com/lifetime-34-28c4/1-month-0e/",
  "fetchedAt": "2025-11-05T19:41:26.704Z",
  "textHash": "f4281440b83c0d6b4c2981a681729f1d2133d6e224c92a24a4b13aba0ce22bbf",
  "drilled": false
}