{
  "baseUrl": "https://whop.com/cocoa-picks/1-month-pass-bb/",
  "title": "1 Month Pass | Whop",
  "h1": "1 Month Pass",
  "bullets": [
    "Sign in CP 1 Month Pass Access to our Sports-Picks and Bankroll Management - 1 Month 5.0 ( 2 ) Sports betting Full access to our expert-crafted sports picks for a month, delivered directly to your inbox. Plus, we provide a proven bankroll management system to help you maximize your wins $350.00 for 1 month Pay Join Features Full access to all plays and parlays for one month.",
    "Daily picks delivered straight to your email.",
    "24/7 support for all your sports betting queries.",
    "Value-based picks to maximize your betting advantages.",
    "Expertly crafted parlays to boost your potential winnings.",
    "MG Malik Griffith 2 years ago Definitely the goat when it comes to these bets. Plug in with a real sports better Written 3 days after purchase",
    "GD Graison Dale 2 years ago Really helpful with advice on bankroll, great selection of picks to use. Written 3 days after purchase"
  ],
  "paras": [
    "Sign in CP 1 Month Pass Access to our Sports-Picks and Bankroll Management - 1 Month 5.0 ( 2 ) Sports betting Full access to our expert-crafted sports picks for a month, delivered directly to your inbox. Plus, we provide a proven bankroll management system to help you maximize your wins",
    "Full access to all plays and parlays for one month. Daily picks delivered straight to your email. 24/7 support for all your sports betting queries. Value-based picks to maximize your betting advantages. Expertly crafted parlays to boost your potential winnings. Reviews 5 out of 5 2 total reviews 5 stars 4 stars 3 stars 2 stars 1 star MG Malik Griffith 2 years ago Definitely the goat when it comes to these bets. Plug in with a real sports better",
    "2 years ago Really helpful with advice on bankroll, great selection of picks to use.",
    "FAQs Where are the plays sent? Affiliates CP Become an affiliate Cocoa Picks 30% reward Earn money by bringing customers to Cocoa Picks. Every time a customer purchases using your link, you&#x27;ll earn a commission."
  ],
  "priceTokens": [
    "$350.00",
    "$350.00",
    "$350.00",
    "$1",
    "$1",
    "$1",
    "$22",
    "$1",
    "$1",
    "$1",
    "$1",
    "$1",
    "$2",
    "$1",
    "$2",
    "$2",
    "$2",
    "$2",
    "$3",
    "$3"
  ],
  "faq": [],
  "textSample": "Sign in CP 1 Month Pass Access to our Sports-Picks and Bankroll Management - 1 Month 5.0 ( 2 ) Sports betting Full access to our expert-crafted sports picks for a month, delivered directly to your inbox. Plus, we provide a proven bankroll management system to help you maximize your wins $350.00 for 1 month Pay Join Features Full access to all plays and parlays for one month. Daily picks delivered straight to your email. 24/7 support for all your sports betting queries. Value-based picks to maximize your betting advantages. Expertly crafted parlays to boost your potential winnings. Reviews 5 out of 5 2 total reviews 5 stars 4 stars 3 stars 2 stars 1 star MG Malik Griffith 2 years ago Definitely the goat when it comes to these bets. Plug in with a real sports better Written 3 days after purchase GD Graison Dale 2 years ago Really helpful with advice on bankroll, great selection of picks to use. Written 3 days after purchase About the creator CP View profile Cocoa Picks @ cocoapicks â€¢ Joined Dec 2023 I&#x27;ve spent over 5 years in the sports advisory industry, helping clients make informed decisions. My passion lies in analyzing games and finding value-based picks to maximize returns. FAQs Where are the plays sent? Affiliates CP Become an affiliate Cocoa Picks 30% reward Earn money by bringing customers to Cocoa Picks. Every time a customer purchases using your link, you&#x27;ll earn a commission. 1 Month Pass $350.00 for 1 month Join $350.00 for 1 month Pay Join Pay Join 1 Month Pass | Whop",
  "finalUrl": "https://whop.com/cocoa-picks/1-month-pass-bb/",
  "fetchedAt": "2025-11-05T19:39:53.069Z",
  "textHash": "60c0bdd7f005a649317237f4f9317e0ffc9da2ca3e7bae92c268bee373cb5067",
  "drilled": false
}