{
  "baseUrl": "https://whop.com/zamcocapital-store/1-on-1-session-aa/",
  "title": "1 on 1 session | Whop",
  "h1": "1 on 1 session",
  "bullets": [
    "Sign in Z 1 on 1 session Elevate Your Trading Skills with Expert Guidance 4.8 ( 18 ) Trading Join a 1-hour Discord call to ask questions, explore trades, and create a custom trading plan. Gain insights from a 6-year trading veteran. £500.00 one-time purchase Pay Join Join 2 members Features 1-hour personalized Discord call with screen sharing",
    "Custom trading plan tailored to your needs",
    "In-depth trading psychology insights",
    "A Ant 13 days ago Good stuff Written 3 days after purchase",
    "EB Enoch Kyei Boateng 19 days ago very insightful Written 1 day after purchase",
    "F F2R 19 days ago Good content for free JazakAllah Written 4 months after purchase",
    "S sadlysadf 2 months ago perfect Written 2 hours after purchase"
  ],
  "paras": [
    "Sign in Z 1 on 1 session Elevate Your Trading Skills with Expert Guidance 4.8 ( 18 ) Trading Join a 1-hour Discord call to ask questions, explore trades, and create a custom trading plan. Gain insights from a 6-year trading veteran.",
    "Join 2 members Features 1-hour personalized Discord call with screen sharing Custom trading plan tailored to your needs In-depth trading psychology insights Reviews 4.78 out of 5 18 total reviews 5 stars 4 stars 3 stars 2 stars 1 star A Ant 13 days ago Good stuff",
    "19 days ago very insightful",
    "19 days ago Good content for free JazakAllah",
    "2 months ago perfect",
    "About the creator Z View profile ZamcoCapital @ zamcocapital • Joined May 2024 I&#x27;ve spent years navigating the trading world, learning not just strategies but the essential psychology behind them. Now, I share these core fundamentals to help traders succeed, just as I have. FAQs Do I need prior trading experience? Will this make me profitable? Affiliates Z Become an affiliate ZamcoCapital 30% reward Earn money by bringing customers to ZamcoCapital. Every time a customer purchases using your link, you&#x27;ll earn a commission."
  ],
  "priceTokens": [
    "£500.00",
    "£500.00",
    "£500.00",
    "$1",
    "$1",
    "$1",
    "$22",
    "$1",
    "$1",
    "$1",
    "$1",
    "$1",
    "$2",
    "$1",
    "$2",
    "$2",
    "$2",
    "$2",
    "$3",
    "$3"
  ],
  "faq": [],
  "textSample": "Sign in Z 1 on 1 session Elevate Your Trading Skills with Expert Guidance 4.8 ( 18 ) Trading Join a 1-hour Discord call to ask questions, explore trades, and create a custom trading plan. Gain insights from a 6-year trading veteran. £500.00 one-time purchase Pay Join Join 2 members Features 1-hour personalized Discord call with screen sharing Custom trading plan tailored to your needs In-depth trading psychology insights Reviews 4.78 out of 5 18 total reviews 5 stars 4 stars 3 stars 2 stars 1 star A Ant 13 days ago Good stuff Written 3 days after purchase EB Enoch Kyei Boateng 19 days ago very insightful Written 1 day after purchase F F2R 19 days ago Good content for free JazakAllah Written 4 months after purchase S sadlysadf 2 months ago perfect Written 2 hours after purchase See all reviews About the creator Z View profile ZamcoCapital @ zamcocapital • Joined May 2024 I&#x27;ve spent years navigating the trading world, learning not just strategies but the essential psychology behind them. Now, I share these core fundamentals to help traders succeed, just as I have. FAQs Do I need prior trading experience? Will this make me profitable? Affiliates Z Become an affiliate ZamcoCapital 30% reward Earn money by bringing customers to ZamcoCapital. Every time a customer purchases using your link, you&#x27;ll earn a commission. 1 on 1 session £500.00 one-time purchase Join £500.00 one-time purchase Pay Join Pay Join 1 on 1 session | Whop",
  "finalUrl": "https://whop.com/zamcocapital-store/1-on-1-session-aa/",
  "fetchedAt": "2025-11-05T19:42:32.216Z",
  "textHash": "44db8a29b37b9cccef1a33d97d2cf0e641861ba83031cde8b7ef5280f74018b5",
  "drilled": false
}