{
  "baseUrl": "https://whop.com/enzotrades/1-on-1-mentorship-e9/",
  "title": "1 on 1 mentorship | Whop",
  "h1": "1 on 1 mentorship",
  "bullets": [
    "Sign in E 1 on 1 mentorship Master trading with Enzo&#x27;s guidance 4.7 ( 22 ) Trading A-Z education for traders, from basics to funded. Enzo ensures you reach your trading goals with personalized mentorship. $4,999.00 one-time purchase Pay Join Join 7 members Features 24/7 access to Enzo via SMS, call, and Discord",
    "2x Weekly 1:1 Phone calls for 1 hour.",
    "Custom educational documents and strategy",
    "Live trading sessions at NYSE open",
    "In-depth risk management and charting lessons",
    "DS Dakota Schulenberg 2 months ago absolutely phenomenal discord. don’t have to second guess thinking you’re donating to some guru. I was a little skeptical after get scammed by ivan trades, but still went for it and it was the best decision ever. If you are disciplined with your trades and don’t over trade.. you will be passing eval... Show more Written 20 days after purchase",
    "PC Philip Choi 5 months ago You can think of Enzo's indicator as hacks for the markets. Best indicator I have seen that works as advertised and demonstrated. His results and his communities results are more than enough proof. Written 3 hours after purchase",
    "KJ Keandrian Qynzel Jones 5 months ago amazing trading, amazing community. helped me on my trading journey a huge amount. Written 1 year after purchase",
    "SJ Sebastian Jungeborg 5 months ago Enzo is a very honest mentor to be honest and that’s not so normal, when he loses he’s honest about it and don’t have any ego about it, he’s a great trader that can make 14rr and up on a normal day! Recommend it Written 1 month after purchase"
  ],
  "paras": [
    "Sign in E 1 on 1 mentorship Master trading with Enzo&#x27;s guidance 4.7 ( 22 ) Trading A-Z education for traders, from basics to funded. Enzo ensures you reach your trading goals with personalized mentorship.",
    "Join 7 members Features 24/7 access to Enzo via SMS, call, and Discord 2x Weekly 1:1 Phone calls for 1 hour. Custom educational documents and strategy Live trading sessions at NYSE open In-depth risk management and charting lessons Reviews 4.68 out of 5 22 total reviews 5 stars 4 stars 3 stars 2 stars 1 star DS Dakota Schulenberg 2 months ago absolutely phenomenal discord. don’t have to second guess thinking you’re donating to some guru. I was a little skeptical after get scammed by ivan trades, but still went for it and it was the best decision ever. If you are disciplined with your trades and don’t over trade.. you will be passing eval...",
    "Written 20 days after purchase PC Philip Choi 5 months ago You can think of Enzo's indicator as hacks for the markets. Best indicator I have seen that works as advertised and demonstrated. His results and his communities results are more than enough proof.",
    "5 months ago amazing trading, amazing community. helped me on my trading journey a huge amount.",
    "5 months ago Enzo is a very honest mentor to be honest and that’s not so normal, when he loses he’s honest about it and don’t have any ego about it, he’s a great trader that can make 14rr and up on a normal day! Recommend it",
    "About the creator E View profile EnzoTrades @ enzobard • Joined May 2023 I&#x27;ve transformed my trading journey from 5 figure losses to 7-figure gains annually. Now, I help others achieve the same through education, mentorship, and proven strategies. FAQs Refund Policy Of all the trading servers why you? How often is there live trading? Affiliates E Become an affiliate EnzoTrades 30% reward Earn money by bringing customers to EnzoTrades. Every time a customer purchases using your link, you&#x27;ll earn a commission."
  ],
  "priceTokens": [
    "$4,999.00",
    "$4,999.00",
    "$4,999.00",
    "$1",
    "$1",
    "$1",
    "$22",
    "$1",
    "$1",
    "$1",
    "$1",
    "$1",
    "$2",
    "$1",
    "$2",
    "$2",
    "$2",
    "$2",
    "$3",
    "$3"
  ],
  "faq": [],
  "textSample": "Sign in E 1 on 1 mentorship Master trading with Enzo&#x27;s guidance 4.7 ( 22 ) Trading A-Z education for traders, from basics to funded. Enzo ensures you reach your trading goals with personalized mentorship. $4,999.00 one-time purchase Pay Join Join 7 members Features 24/7 access to Enzo via SMS, call, and Discord 2x Weekly 1:1 Phone calls for 1 hour. Custom educational documents and strategy Live trading sessions at NYSE open In-depth risk management and charting lessons Reviews 4.68 out of 5 22 total reviews 5 stars 4 stars 3 stars 2 stars 1 star DS Dakota Schulenberg 2 months ago absolutely phenomenal discord. don’t have to second guess thinking you’re donating to some guru. I was a little skeptical after get scammed by ivan trades, but still went for it and it was the best decision ever. If you are disciplined with your trades and don’t over trade.. you will be passing eval... Show more Written 20 days after purchase PC Philip Choi 5 months ago You can think of Enzo's indicator as hacks for the markets. Best indicator I have seen that works as advertised and demonstrated. His results and his communities results are more than enough proof. Written 3 hours after purchase KJ Keandrian Qynzel Jones 5 months ago amazing trading, amazing community. helped me on my trading journey a huge amount. Written 1 year after purchase SJ Sebastian Jungeborg 5 months ago Enzo is a very honest mentor to be honest and that’s not so normal, when he loses he’s honest about it and don’t have any ego about it, he’s a great trader that can make 14rr and up on a normal day! Recommend it Written 1 month after purchase See all reviews About the creator E View profile EnzoTrades @ enzobard • Joined May 2023 I&#x27;ve transformed my trading journey from 5 figure losses to 7-figure gains annually. Now, I help others achieve the same through education, mentorship, and proven strategies. FAQs Refund Policy Of all the trading servers why you? How often is there live trading? Affiliates E Become an affiliate EnzoTrades 30% reward Earn money by bringing customers to EnzoTrades. Every time a customer purchases using your link, you&#x27;ll earn a commission. 1 on 1 mentorship $4,999.00 one-time purchase Join $4,999.00 one-time purchase Pay Join Pay Join 1 on 1 mentorship | Whop",
  "finalUrl": "https://whop.com/enzotrades/1-on-1-mentorship-e9/",
  "fetchedAt": "2025-11-05T19:35:12.967Z",
  "textHash": "abaa41dd6429be54f5ac861a92cde2b15b9783ea5aaf5e92115ab00e372ed516",
  "drilled": false
}