{
  "baseUrl": "https://whop.com/seanperrywins/seanperrywinsmentorship/",
  "title": "1 on 1 Elite Mentorship | Whop",
  "h1": "1 on 1 Elite Mentorship",
  "bullets": [
    "Sign in SW 1 on 1 Elite Mentorship $100,000 Mentorship Program 4.6 ( 416 ) Sports betting Personally work 1-1 with me where I help you legally hustle casinos, teach you how to get massive limits, and win fucktons of money. I hold your hand and mentor you every step. This product doesn&#x27;t have any visible pricing options DM the creator to notify them Features Exclusive Access ‚Äì Get a full year of VIP + Supermax Plays and much more.",
    "1-on-1 Mentorship ‚Äì I mentor you every step of the way to ensure success.",
    "Maximize Limits &amp; Profits ‚Äì Learn how to secure massive betting limits and win",
    "A Abdulmajeed 3 days ago Nice ‚Ä¶ platform of any ‚Ä¶ new to me Written 7 days after purchase",
    "K Kc14bets 8 days ago üëçüëç Written 3 days after purchase",
    "DM Demontre Meeks 2 months ago Heyyyy Written 2 hours after purchase",
    "MS Mark Smolow 2 months ago Enjoy watching Written 16 minutes after purchase"
  ],
  "paras": [
    "Sign in SW 1 on 1 Elite Mentorship $100,000 Mentorship Program 4.6 ( 416 ) Sports betting Personally work 1-1 with me where I help you legally hustle casinos, teach you how to get massive limits, and win fucktons of money. I hold your hand and mentor you every step.",
    "Exclusive Access ‚Äì Get a full year of VIP + Supermax Plays and much more. 1-on-1 Mentorship ‚Äì I mentor you every step of the way to ensure success. Maximize Limits &amp; Profits ‚Äì Learn how to secure massive betting limits and win Reviews 4.62 out of 5 416 total reviews 5 stars 4 stars 3 stars 2 stars 1 star A Abdulmajeed 3 days ago Nice ‚Ä¶ platform of any ‚Ä¶ new to me",
    "8 days ago üëçüëç",
    "2 months ago Heyyyy",
    "2 months ago Enjoy watching",
    "About the creator SW View profile Sean Perry Wins @ seanperrywins ‚Ä¢ Joined Jan 2024 FAQs What time does the lock of day come out each day? What time do you send your picks out? What is your refund policy? Affiliates SW Become an affiliate SEAN PERRY WINS 30% reward Earn money by bringing customers to SEAN PERRY WINS. Every time a customer purchases using your link, you&#x27;ll earn a commission."
  ],
  "priceTokens": [
    "$100,000",
    "$1",
    "$1",
    "$1",
    "$22",
    "$1",
    "$1",
    "$1",
    "$1",
    "$1",
    "$2",
    "$1",
    "$2",
    "$2",
    "$2",
    "$2",
    "$3",
    "$3",
    "$3",
    "$10"
  ],
  "faq": [],
  "textSample": "Sign in SW 1 on 1 Elite Mentorship $100,000 Mentorship Program 4.6 ( 416 ) Sports betting Personally work 1-1 with me where I help you legally hustle casinos, teach you how to get massive limits, and win fucktons of money. I hold your hand and mentor you every step. This product doesn&#x27;t have any visible pricing options DM the creator to notify them Features Exclusive Access ‚Äì Get a full year of VIP + Supermax Plays and much more. 1-on-1 Mentorship ‚Äì I mentor you every step of the way to ensure success. Maximize Limits &amp; Profits ‚Äì Learn how to secure massive betting limits and win Reviews 4.62 out of 5 416 total reviews 5 stars 4 stars 3 stars 2 stars 1 star A Abdulmajeed 3 days ago Nice ‚Ä¶ platform of any ‚Ä¶ new to me Written 7 days after purchase K Kc14bets 8 days ago üëçüëç Written 3 days after purchase DM Demontre Meeks 2 months ago Heyyyy Written 2 hours after purchase MS Mark Smolow 2 months ago Enjoy watching Written 16 minutes after purchase See all reviews About the creator SW View profile Sean Perry Wins @ seanperrywins ‚Ä¢ Joined Jan 2024 FAQs What time does the lock of day come out each day? What time do you send your picks out? What is your refund policy? Affiliates SW Become an affiliate SEAN PERRY WINS 30% reward Earn money by bringing customers to SEAN PERRY WINS. Every time a customer purchases using your link, you&#x27;ll earn a commission. 1 on 1 Elite Mentorship No available pricing options Contact us No available pricing options Contact us 1 on 1 Elite Mentorship | Whop",
  "finalUrl": "https://whop.com/seanperrywins/seanperrywinsmentorship/",
  "fetchedAt": "2025-11-05T19:30:36.141Z",
  "textHash": "447af0cb3abb0ffaf1862c03f8901a15cd996a21f782ce77ff50224362f014e1",
  "drilled": false
}