{
  "baseUrl": "https://whop.com/p2pcourse/1-on-1-coaching-session-2c/",
  "title": "1 on 1 Coaching Session | Whop",
  "h1": "1 on 1 Coaching Session",
  "bullets": [
    "Sign in P 1 on 1 Coaching Session 60 minutes with P2P 5.0 ( 127 ) Trading Learn how to find true precision on the charts and master the art of patience and persistence. I’m here to guide you and answer all your trading questions. $750.00 one-time purchase Pay Get access Features Get one step closer to becoming profitable after a simple 60 minute call.",
    "Mastering of art of patience and persistence.",
    "Come learn how to find true precision on the charts.",
    "Here to answer any questions you have about the charts.",
    "GB Getuard Berisha 15 hours ago Lama is the GOAT! I’ve been Lama’s student since August, and for me, it’s been the best way to become profitable. It’s not just about the course videos — the premarket sessions where he explains the market in real time are where I’ve learned the most. I truly believe that theory alone doesn’t make t... Show more Written 3 months after purchase",
    "K kapo 6 days ago Lama the goat. This course is literally all you need to become profitable.The way he breaks it down and explains and walks thru each step is unexplainable. Best money I've ever spent and made the s*** back almost immediately. You can apply these teachings the very ne3xt day after watching and it's e... Show more Written 2 months after purchase",
    "MT Mario Torres 13 days ago the chubby guy can teach, was easy to understand Written 2 months after purchase",
    "K KunckleDust 18 days ago Excellent resources packed with easy to understand lessons, instruction and direction. to become a consistently profitable trader. Written 4 months after purchase"
  ],
  "paras": [
    "Sign in P 1 on 1 Coaching Session 60 minutes with P2P 5.0 ( 127 ) Trading Learn how to find true precision on the charts and master the art of patience and persistence. I’m here to guide you and answer all your trading questions.",
    "Get one step closer to becoming profitable after a simple 60 minute call. Mastering of art of patience and persistence. Come learn how to find true precision on the charts. Here to answer any questions you have about the charts. Reviews 5 out of 5 127 total reviews 5 stars 4 stars 3 stars 2 stars 1 star GB Getuard Berisha 15 hours ago Lama is the GOAT! I’ve been Lama’s student since August, and for me, it’s been the best way to become profitable. It’s not just about the course videos — the premarket sessions where he explains the market in real time are where I’ve learned the most. I truly believe that theory alone doesn’t make t...",
    "Written 3 months after purchase K kapo 6 days ago Lama the goat. This course is literally all you need to become profitable.The way he breaks it down and explains and walks thru each step is unexplainable. Best money I've ever spent and made the s*** back almost immediately. You can apply these teachings the very ne3xt day after watching and it's e...",
    "Written 2 months after purchase MT Mario Torres 13 days ago the chubby guy can teach, was easy to understand",
    "18 days ago Excellent resources packed with easy to understand lessons, instruction and direction. to become a consistently profitable trader.",
    "About the creator AL View profile Antonio lama @ soberpay2play • Joined Feb 2024 I&#x27;ve dedicated my career to mastering trading and sharing my knowledge. At Pay2PlayUniversity, I aim to empower traders with the skills and insights needed to succeed in the dynamic world of trading. FAQs Do you only trade Forex? How often do you go live? Do you accept people with 0 trading experience? Can I cancel whenever I want ? Affiliates P Become an affiliate Pay2PlayUniversity 10% reward Earn money by bringing customers to Pay2PlayUniversity. Every time a customer purchases using your link, you&#x27;ll earn a commission."
  ],
  "priceTokens": [
    "$750.00",
    "$750.00",
    "$750.00",
    "$1",
    "$1",
    "$1",
    "$22",
    "$1",
    "$1",
    "$1",
    "$1",
    "$1",
    "$2",
    "$1",
    "$2",
    "$2",
    "$2",
    "$2",
    "$3",
    "$3"
  ],
  "faq": [],
  "textSample": "Sign in P 1 on 1 Coaching Session 60 minutes with P2P 5.0 ( 127 ) Trading Learn how to find true precision on the charts and master the art of patience and persistence. I’m here to guide you and answer all your trading questions. $750.00 one-time purchase Pay Get access Features Get one step closer to becoming profitable after a simple 60 minute call. Mastering of art of patience and persistence. Come learn how to find true precision on the charts. Here to answer any questions you have about the charts. Reviews 5 out of 5 127 total reviews 5 stars 4 stars 3 stars 2 stars 1 star GB Getuard Berisha 15 hours ago Lama is the GOAT! I’ve been Lama’s student since August, and for me, it’s been the best way to become profitable. It’s not just about the course videos — the premarket sessions where he explains the market in real time are where I’ve learned the most. I truly believe that theory alone doesn’t make t... Show more Written 3 months after purchase K kapo 6 days ago Lama the goat. This course is literally all you need to become profitable.The way he breaks it down and explains and walks thru each step is unexplainable. Best money I've ever spent and made the s*** back almost immediately. You can apply these teachings the very ne3xt day after watching and it's e... Show more Written 2 months after purchase MT Mario Torres 13 days ago the chubby guy can teach, was easy to understand Written 2 months after purchase K KunckleDust 18 days ago Excellent resources packed with easy to understand lessons, instruction and direction. to become a consistently profitable trader. Written 4 months after purchase See all reviews About the creator AL View profile Antonio lama @ soberpay2play • Joined Feb 2024 I&#x27;ve dedicated my career to mastering trading and sharing my knowledge. At Pay2PlayUniversity, I aim to empower traders with the skills and insights needed to succeed in the dynamic world of trading. FAQs Do you only trade Forex? How often do you go live? Do you accept people with 0 trading experience? Can I cancel whenever I want ? Affiliates P Become an affiliate Pay2PlayUniversity 10% reward Earn money by bringing customers to Pay2PlayUniversity. Every time a customer purchases using your link, you&#x27;ll earn a commission. 1 on 1 Coaching Session $750.00 one-time purchase Get access $750.00 one-time purchase Pay Get access Pay Get access 1 on 1 Coaching Session | Whop",
  "finalUrl": "https://whop.com/p2pcourse/1-on-1-coaching-session-2c/",
  "fetchedAt": "2025-11-05T19:38:22.401Z",
  "textHash": "38d5dc81cc80a137e8e462fe3b29762d3391fe3093320896b985c1ed03268622",
  "drilled": false
}