{
  "baseUrl": "https://whop.com/rapture-trading/1-week-trial-6f/",
  "title": "1 week trial | Whop",
  "h1": "1 week trial",
  "bullets": [
    "Sign in RT 1 week trial 1 WEEK TRIAL 4.9 ( 29 ) Trading COME JOIN THE WINNING TEAM $30.00 / week Pay Join Join 16 members Reviews 4.86 out of 5 29 total reviews 5 stars 4 stars 3 stars 2 stars 1 star JB Jeffery barcia 7 months ago Amazing really life changing only been 1 month and I have made incredible profits from just following Written 1 month after purchase",
    "LH Lathen Howard 9 months ago Educate yourself. Learn the way of the top 1% of people in this group. Many opportunities in this community to grow. Highly recommend Written 1 month after purchase",
    "WS William Schwander 9 months ago If you're looking for a way out of your 9-5 job an making ends meet, this is the place that will change your lifestyle, your future, and your outlook on life. truly life changing!!! Written 4 months after purchase",
    "FS Floyd Strickland 9 months ago Learned a lot in the few days I’ve been in the group Written 5 days after purchase"
  ],
  "paras": [
    "Sign in RT 1 week trial 1 WEEK TRIAL 4.9 ( 29 ) Trading COME JOIN THE WINNING TEAM",
    "Join 16 members Reviews 4.86 out of 5 29 total reviews 5 stars 4 stars 3 stars 2 stars 1 star JB Jeffery barcia 7 months ago Amazing really life changing only been 1 month and I have made incredible profits from just following",
    "9 months ago Educate yourself. Learn the way of the top 1% of people in this group. Many opportunities in this community to grow. Highly recommend",
    "9 months ago If you're looking for a way out of your 9-5 job an making ends meet, this is the place that will change your lifestyle, your future, and your outlook on life. truly life changing!!!",
    "9 months ago Learned a lot in the few days I’ve been in the group",
    "About the creator CR View profile Colten Rios @ user0b092413862 • Joined Dec 2023 Affiliates RT Become an affiliate Rapture Trading 1% reward Earn money by bringing customers to Rapture Trading . Every time a customer purchases using your link, you&#x27;ll earn a commission."
  ],
  "priceTokens": [
    "$30.00",
    "$30.00",
    "$30.00",
    "$1",
    "$1",
    "$1",
    "$22",
    "$1",
    "$1",
    "$1",
    "$1",
    "$1",
    "$2",
    "$1",
    "$2",
    "$2",
    "$2",
    "$2",
    "$3",
    "$3"
  ],
  "faq": [],
  "textSample": "Sign in RT 1 week trial 1 WEEK TRIAL 4.9 ( 29 ) Trading COME JOIN THE WINNING TEAM $30.00 / week Pay Join Join 16 members Reviews 4.86 out of 5 29 total reviews 5 stars 4 stars 3 stars 2 stars 1 star JB Jeffery barcia 7 months ago Amazing really life changing only been 1 month and I have made incredible profits from just following Written 1 month after purchase LH Lathen Howard 9 months ago Educate yourself. Learn the way of the top 1% of people in this group. Many opportunities in this community to grow. Highly recommend Written 1 month after purchase WS William Schwander 9 months ago If you're looking for a way out of your 9-5 job an making ends meet, this is the place that will change your lifestyle, your future, and your outlook on life. truly life changing!!! Written 4 months after purchase FS Floyd Strickland 9 months ago Learned a lot in the few days I’ve been in the group Written 5 days after purchase See all reviews About the creator CR View profile Colten Rios @ user0b092413862 • Joined Dec 2023 Affiliates RT Become an affiliate Rapture Trading 1% reward Earn money by bringing customers to Rapture Trading . Every time a customer purchases using your link, you&#x27;ll earn a commission. 1 week trial $30.00 / week Join $30.00 / week Pay Join Pay Join 1 week trial | Whop",
  "finalUrl": "https://whop.com/rapture-trading/1-week-trial-6f/",
  "fetchedAt": "2025-11-05T19:36:33.556Z",
  "textHash": "5b178a7b7af895dfeedc5877ddee0401777f907580e90258021524d638a9b7e5",
  "drilled": false
}