{
  "baseUrl": "https://whop.com/bullishspreads/bullishspread/",
  "title": "VIP PLAYS | Whop",
  "h1": "VIP PLAYS",
  "bullets": [
    "Sign in BS VIP PLAYS BEST SPORTS BETTORS ALIVE 5.0 ( 3 ) Sports betting Averaging 84% win rate these past 6 months. The VIP Circle is the best place to steadily build your bankroll. If you want to CONSISTENTLY WIN over the long run and manage your bankroll this is the best package for you üõ©Ô∏è üìà $65.00 / 2 days Pay Join Features 2-4 plays every single day",
    "Parlays and straight plays",
    "80% win rate last 6 months",
    "+$3,400,000 in client profits",
    "D Dyson 2 months ago This guy literally changed my life, been tailing his play for 2 months now and just bought a brand new BMW all from profits. By far the best investment I have ever made. Written 9 hours after purchase",
    "CM Chris Moltani 2 months ago This guy literally changed my life, been tailing his play for 2 months now and just bought a brand new BMW all from profits. By far the best investment I have ever made. Written 7 hours after purchase",
    "BW Bruce Wang 2 months ago Never thought I could make this much money through sports, I am now making more from these picks and parlays then my main job. I don't know how he hit‚Äôs so consistently but I‚Äôm not complaining. Written 1 hour after purchase"
  ],
  "paras": [
    "Sign in BS VIP PLAYS BEST SPORTS BETTORS ALIVE 5.0 ( 3 ) Sports betting Averaging 84% win rate these past 6 months. The VIP Circle is the best place to steadily build your bankroll. If you want to CONSISTENTLY WIN over the long run and manage your bankroll this is the best package for you üõ©Ô∏è üìà",
    "$65.00 / 2 days Pay Join Features 2-4 plays every single day Parlays and straight plays 80% win rate last 6 months +$3,400,000 in client profits Reviews 5 out of 5 3 total reviews 5 stars 4 stars 3 stars 2 stars 1 star D Dyson 2 months ago This guy literally changed my life, been tailing his play for 2 months now and just bought a brand new BMW all from profits. By far the best investment I have ever made.",
    "2 months ago This guy literally changed my life, been tailing his play for 2 months now and just bought a brand new BMW all from profits. By far the best investment I have ever made.",
    "2 months ago Never thought I could make this much money through sports, I am now making more from these picks and parlays then my main job. I don't know how he hit‚Äôs so consistently but I‚Äôm not complaining.",
    "FAQs How much can I make? Where can I see the plays? What sports do you offer? Affiliates BS Become an affiliate Bullish Spread 30% reward Earn money by bringing customers to Bullish Spread. Every time a customer purchases using your link, you&#x27;ll earn a commission."
  ],
  "priceTokens": [
    "$65.00",
    "$3,400,000",
    "$65.00",
    "$65.00",
    "$1",
    "$1",
    "$1",
    "$22",
    "$1",
    "$1",
    "$1",
    "$1",
    "$1",
    "$2",
    "$1",
    "$2",
    "$2",
    "$2",
    "$2",
    "$3"
  ],
  "faq": [],
  "textSample": "Sign in BS VIP PLAYS BEST SPORTS BETTORS ALIVE 5.0 ( 3 ) Sports betting Averaging 84% win rate these past 6 months. The VIP Circle is the best place to steadily build your bankroll. If you want to CONSISTENTLY WIN over the long run and manage your bankroll this is the best package for you üõ©Ô∏è üìà $65.00 / 2 days Pay Join Features 2-4 plays every single day Parlays and straight plays 80% win rate last 6 months +$3,400,000 in client profits Reviews 5 out of 5 3 total reviews 5 stars 4 stars 3 stars 2 stars 1 star D Dyson 2 months ago This guy literally changed my life, been tailing his play for 2 months now and just bought a brand new BMW all from profits. By far the best investment I have ever made. Written 9 hours after purchase CM Chris Moltani 2 months ago This guy literally changed my life, been tailing his play for 2 months now and just bought a brand new BMW all from profits. By far the best investment I have ever made. Written 7 hours after purchase BW Bruce Wang 2 months ago Never thought I could make this much money through sports, I am now making more from these picks and parlays then my main job. I don't know how he hit‚Äôs so consistently but I‚Äôm not complaining. Written 1 hour after purchase About the creator B View profile BullishSpread @ bullishspreads ‚Ä¢ Joined Aug 2024 I raise hell on vegas üî•üé∞ Sportsbooks hate me, but the community loves me. Everybody Eats! Pro-Sports Consultant. FAQs How much can I make? Where can I see the plays? What sports do you offer? Affiliates BS Become an affiliate Bullish Spread 30% reward Earn money by bringing customers to Bullish Spread. Every time a customer purchases using your link, you&#x27;ll earn a commission. VIP PLAYS $65.00 / 2 days +2 options Join $65.00 / 2 days 2 options Pay Join Pay Join VIP PLAYS | Whop",
  "finalUrl": "https://whop.com/bullishspreads/bullishspread/",
  "fetchedAt": "2025-11-05T19:41:25.615Z",
  "textHash": "a4b6a660b404a5b350954d950d32d2cf21e672aa9f8bc7728296b62eec305948",
  "drilled": false
}