{
  "baseUrl": "https://whop.com/phantom-checker/?a=alexburnett21",
  "title": "Phantom Checker | Whop",
  "h1": "Phantom Checker",
  "bullets": [
    "Powered by PC Phantom Checker 5.0 ( 89 ) Contact seller Products $175.00 / month Phantom Checker 100 Events 5.0 ( 30 ) $250.00 / month Ultimate monitoring tool for Tickets 200 Events 5.0 ( 12 ) $600.00 / month Ultimate monitoring tool for Tickets 500 Events 5.0 ( 8 ) $900.00 / month Ultimate monitoring tool for Tickets 750 Events 5.0 ( 1 ) $1,200.00 / month Phantom Checker 1000 Events 5.0 ( 7 ) Free Free access to our Discord and guides to master the product! FREE ACCESS New Contact seller Reviews UH Ulrick Highsmith • 100 Events 2 years ago Great product and team. Website is robust and user friendly, and the team is dedicated to the product. They’re very responsive and helpful. Switching to Phantom from my other provider. Written 6 days after purchase",
    "J Jackk • 100 Events 2 years ago This monitor is really easy to use. Written 2 days after purchase",
    "T Terry 2 years ago Mi gusta Written 5 months after purchase",
    "S shynepo3 • 100 Events 2 years ago Awesome product, faster than any restock tool ive tried! Fair price too when you factor in the money you make....not hard to make the monthly many times over with minimal effort. Written 4 days after purchase"
  ],
  "paras": [
    "PC Phantom Checker 5.0 ( 89 ) Contact seller Products $175.00 / month Phantom Checker 100 Events 5.0 ( 30 ) $250.00 / month Ultimate monitoring tool for Tickets 200 Events 5.0 ( 12 ) $600.00 / month Ultimate monitoring tool for Tickets 500 Events 5.0 ( 8 ) $900.00 / month Ultimate monitoring tool for Tickets 750 Events 5.0 ( 1 ) $1,200.00 / month Phantom Checker 1000 Events 5.0 ( 7 ) Free Free access to our Discord and guides to master the product! FREE ACCESS New Contact seller Reviews UH Ulrick Highsmith • 100 Events 2 years ago Great product and team. Website is robust and user friendly, and the team is dedicated to the product. They’re very responsive and helpful. Switching to Phantom from my other provider.",
    "2 years ago This monitor is really easy to use.",
    "2 years ago Mi gusta",
    "2 years ago Awesome product, faster than any restock tool ive tried! Fair price too when you factor in the money you make....not hard to make the monthly many times over with minimal effort."
  ],
  "priceTokens": [
    "$175.00",
    "$250.00",
    "$600.00",
    "$900.00",
    "$1,200.00",
    "$1",
    "$1",
    "$1",
    "$21",
    "$1",
    "$1",
    "$1",
    "$1",
    "$28",
    "$1",
    "$28",
    "$28",
    "$28",
    "$28",
    "$3"
  ],
  "faq": [],
  "textSample": "Powered by PC Phantom Checker 5.0 ( 89 ) Contact seller Products $175.00 / month Phantom Checker 100 Events 5.0 ( 30 ) $250.00 / month Ultimate monitoring tool for Tickets 200 Events 5.0 ( 12 ) $600.00 / month Ultimate monitoring tool for Tickets 500 Events 5.0 ( 8 ) $900.00 / month Ultimate monitoring tool for Tickets 750 Events 5.0 ( 1 ) $1,200.00 / month Phantom Checker 1000 Events 5.0 ( 7 ) Free Free access to our Discord and guides to master the product! FREE ACCESS New Contact seller Reviews UH Ulrick Highsmith • 100 Events 2 years ago Great product and team. Website is robust and user friendly, and the team is dedicated to the product. They’re very responsive and helpful. Switching to Phantom from my other provider. Written 6 days after purchase J Jackk • 100 Events 2 years ago This monitor is really easy to use. Written 2 days after purchase T Terry 2 years ago Mi gusta Written 5 months after purchase S shynepo3 • 100 Events 2 years ago Awesome product, faster than any restock tool ive tried! Fair price too when you factor in the money you make....not hard to make the monthly many times over with minimal effort. Written 4 days after purchase See all reviews Phantom Checker | Whop",
  "finalUrl": "https://whop.com/phantom-checker/?a=alexburnett21",
  "fetchedAt": "2025-11-05T19:32:06.083Z",
  "textHash": "ddcf4855dab383ed7bde86083b7046bf05603933ea8716b4777aa8891cadea9c",
  "drilled": false
}