{
  "baseUrl": "https://whop.com/front-end-coding-school-elite/1000-ae/",
  "title": "1000 | Whop",
  "h1": "1000",
  "bullets": [
    "Sign in FN 1000 Launch Your Front End Career Today Software Helping students learn tech and start their front end developer career with essential resources and community support. $1,000.00 one-time purchase Pay Join Join 2 members Features Access to Sales Mastery Resources to refine your techniques.",
    "Participate in live calls for real-time insights and expert engagement.",
    "Engage in a community for meaningful conversations and peer support.",
    "Explore job opportunities with our industry-specific job board.",
    "Join a Q&amp;A forum to get answers and insights from experts."
  ],
  "paras": [
    "Sign in FN 1000 Launch Your Front End Career Today Software Helping students learn tech and start their front end developer career with essential resources and community support.",
    "Join 2 members Features Access to Sales Mastery Resources to refine your techniques. Participate in live calls for real-time insights and expert engagement. Engage in a community for meaningful conversations and peer support. Explore job opportunities with our industry-specific job board. Join a Q&amp;A forum to get answers and insights from experts. About the creator S View profile Sam @ samd304 • Joined Sep 2024 I&#x27;ve dedicated my career to empowering aspiring developers. With Front End Now Elite, I provide the tools and support needed to excel in front end development. FAQs Where is this community hosted? Where can I manage my subscription? Affiliates FN Become an affiliate Front End Now 30% reward Earn money by bringing customers to Front End Now. Every time a customer purchases using your link, you&#x27;ll earn a commission."
  ],
  "priceTokens": [
    "$1,000.00",
    "$1,000.00",
    "$1,000.00",
    "$1",
    "$1",
    "$1",
    "$22",
    "$1",
    "$1",
    "$1",
    "$1",
    "$1",
    "$2",
    "$1",
    "$2",
    "$2",
    "$2",
    "$2",
    "$3",
    "$3"
  ],
  "faq": [],
  "textSample": "Sign in FN 1000 Launch Your Front End Career Today Software Helping students learn tech and start their front end developer career with essential resources and community support. $1,000.00 one-time purchase Pay Join Join 2 members Features Access to Sales Mastery Resources to refine your techniques. Participate in live calls for real-time insights and expert engagement. Engage in a community for meaningful conversations and peer support. Explore job opportunities with our industry-specific job board. Join a Q&amp;A forum to get answers and insights from experts. About the creator S View profile Sam @ samd304 • Joined Sep 2024 I&#x27;ve dedicated my career to empowering aspiring developers. With Front End Now Elite, I provide the tools and support needed to excel in front end development. FAQs Where is this community hosted? Where can I manage my subscription? Affiliates FN Become an affiliate Front End Now 30% reward Earn money by bringing customers to Front End Now. Every time a customer purchases using your link, you&#x27;ll earn a commission. 1000 $1,000.00 one-time purchase Join $1,000.00 one-time purchase Pay Join Pay Join 1000 | Whop",
  "finalUrl": "https://whop.com/front-end-coding-school-elite/1000-ae/",
  "fetchedAt": "2025-11-05T19:41:24.990Z",
  "textHash": "1967d315f390f084443315fe8eb71a57a8c739919dc01c03f1fcbfc325e537ce",
  "drilled": false
}