{
  "baseUrl": "https://whop.com/phantom-checker/phantom-checker-1000/",
  "title": "1000 Events | Whop",
  "h1": "1000 Events",
  "bullets": [
    "1000 Events | Whop Sign in PC 1000 Events Phantom Checker 5.0 ( 89 ) Other Ultimate monitoring tool for Ticketmaster, AXS, SeatGeek, MLB, &amp; StubHub, Paciolan. Outsmart bots, secure tickets fast, and enjoy unmatched speed, precision, and privacy. $1,200.00 / month Pay Subscribe Features 4 usres $1,200 / month",
    "5 usres $1,250 / month",
    "6 usres $1,300 / month",
    "UH Ulrick Highsmith 2 years ago Great product and team. Website is robust and user friendly, and the team is dedicated to the product. They’re very responsive and helpful. Switching to Phantom from my other provider. Written 6 days after purchase",
    "J Jackk 2 years ago This monitor is really easy to use. Written 2 days after purchase",
    "T Terry 2 years ago Mi gusta Written 5 months after purchase",
    "S shynepo3 2 years ago Awesome product, faster than any restock tool ive tried! Fair price too when you factor in the money you make....not hard to make the monthly many times over with minimal effort. Written 4 days after purchase"
  ],
  "paras": [
    "Sign in PC 1000 Events Phantom Checker 5.0 ( 89 ) Other Ultimate monitoring tool for Ticketmaster, AXS, SeatGeek, MLB, &amp; StubHub, Paciolan. Outsmart bots, secure tickets fast, and enjoy unmatched speed, precision, and privacy.",
    "$1,200.00 / month Pay Subscribe Features 4 usres $1,200 / month 5 usres $1,250 / month 6 usres $1,300 / month Reviews 5 out of 5 89 total reviews 5 stars 4 stars 3 stars 2 stars 1 star UH Ulrick Highsmith 2 years ago Great product and team. Website is robust and user friendly, and the team is dedicated to the product. They’re very responsive and helpful. Switching to Phantom from my other provider.",
    "2 years ago This monitor is really easy to use.",
    "2 years ago Mi gusta",
    "2 years ago Awesome product, faster than any restock tool ive tried! Fair price too when you factor in the money you make....not hard to make the monthly many times over with minimal effort.",
    "About the creator P View profile Phantom @ phantommdc • Joined Jul 2023 FAQs What does the $1,200 plan include? Can I add more than 10 users? Affiliates PC Become an affiliate Phantom Checker 30% reward Earn money by bringing customers to Phantom Checker. Every time a customer purchases using your link, you&#x27;ll earn a commission."
  ],
  "priceTokens": [
    "$1,200.00",
    "$1,200",
    "$1,250",
    "$1,300",
    "$1,200",
    "$1,200.00",
    "$1,200.00",
    "$1",
    "$1",
    "$1",
    "$22",
    "$1",
    "$1",
    "$1",
    "$1",
    "$1",
    "$2",
    "$1",
    "$2",
    "$2"
  ],
  "faq": [],
  "textSample": "1000 Events | Whop Sign in PC 1000 Events Phantom Checker 5.0 ( 89 ) Other Ultimate monitoring tool for Ticketmaster, AXS, SeatGeek, MLB, &amp; StubHub, Paciolan. Outsmart bots, secure tickets fast, and enjoy unmatched speed, precision, and privacy. $1,200.00 / month Pay Subscribe Features 4 usres $1,200 / month 5 usres $1,250 / month 6 usres $1,300 / month Reviews 5 out of 5 89 total reviews 5 stars 4 stars 3 stars 2 stars 1 star UH Ulrick Highsmith 2 years ago Great product and team. Website is robust and user friendly, and the team is dedicated to the product. They’re very responsive and helpful. Switching to Phantom from my other provider. Written 6 days after purchase J Jackk 2 years ago This monitor is really easy to use. Written 2 days after purchase T Terry 2 years ago Mi gusta Written 5 months after purchase S shynepo3 2 years ago Awesome product, faster than any restock tool ive tried! Fair price too when you factor in the money you make....not hard to make the monthly many times over with minimal effort. Written 4 days after purchase See all reviews About the creator P View profile Phantom @ phantommdc • Joined Jul 2023 FAQs What does the $1,200 plan include? Can I add more than 10 users? Affiliates PC Become an affiliate Phantom Checker 30% reward Earn money by bringing customers to Phantom Checker. Every time a customer purchases using your link, you&#x27;ll earn a commission. 1000 Events $1,200.00 / month +5 options Subscribe $1,200.00 / month 5 options Pay Subscribe Pay Subscribe",
  "finalUrl": "https://whop.com/phantom-checker/phantom-checker-1000/",
  "fetchedAt": "2025-11-05T19:30:39.736Z",
  "textHash": "ef7d123ac184d18420f616b28fab781f2cfdfef04333458f5eb051796210eae1",
  "drilled": false
}