{
  "baseUrl": "https://whop.com/10xbnb-us/10xbnb-partnership-program-us/",
  "title": "10XBNB Partnership Program | Whop",
  "h1": "10XBNB Partnership Program",
  "bullets": [
    "Sign in Unmute Unmute Unmute Unmute U 10XBNB Partnership Program Get highly profitable, agency-provided Airbnb deals. 5.0 ( 2 ) Real estate Earn $10k+ monthly without experience or owning property. With 10XBNB as your partner, we secure profitable Airbnb deals for you and guide you to success with our proven system. $300.00 / month Pay Join Join 3 members Features Let 10XBNB land profitable Airbnb deals for you.",
    "Earn $10k+ monthly without owning or renting any property.",
    "Automate 95% of tasks for hands-off, semi-passive income.",
    "Close deals fast with proven scripts, templates, and tools.",
    "Access step-by-step coaching to scale income streams quickly.",
    "SY Sarah El Yaman 14 days ago Written 6 months after purchase",
    "W Willy30 16 days ago Written 1 month after purchase"
  ],
  "paras": [
    "Sign in Unmute Unmute Unmute Unmute U 10XBNB Partnership Program Get highly profitable, agency-provided Airbnb deals. 5.0 ( 2 ) Real estate Earn $10k+ monthly without experience or owning property. With 10XBNB as your partner, we secure profitable Airbnb deals for you and guide you to success with our proven system.",
    "$300.00 / month Pay Join Join 3 members Features Let 10XBNB land profitable Airbnb deals for you. Earn $10k+ monthly without owning or renting any property. Automate 95% of tasks for hands-off, semi-passive income. Close deals fast with proven scripts, templates, and tools. Access step-by-step coaching to scale income streams quickly. Reviews 5 out of 5 2 total reviews 5 stars 4 stars 3 stars 2 stars 1 star SY Sarah El Yaman 14 days ago",
    "16 days ago",
    "FAQs Do I need prior experience in real estate or Airbnb? How quickly can I start making money? What if I don’t have time to manage properties? Affiliates U Become an affiliate 10xBNB - US 30% reward Earn money by bringing customers to 10xBNB - US . Every time a customer purchases using your link, you&#x27;ll earn a commission."
  ],
  "priceTokens": [
    "$10",
    "$300.00",
    "$10",
    "$100",
    "$65",
    "$5",
    "$300.00",
    "$300.00",
    "$1",
    "$1",
    "$1",
    "$22",
    "$1",
    "$1",
    "$1",
    "$1",
    "$1",
    "$2",
    "$1",
    "$2"
  ],
  "faq": [],
  "textSample": "Sign in Unmute Unmute Unmute Unmute U 10XBNB Partnership Program Get highly profitable, agency-provided Airbnb deals. 5.0 ( 2 ) Real estate Earn $10k+ monthly without experience or owning property. With 10XBNB as your partner, we secure profitable Airbnb deals for you and guide you to success with our proven system. $300.00 / month Pay Join Join 3 members Features Let 10XBNB land profitable Airbnb deals for you. Earn $10k+ monthly without owning or renting any property. Automate 95% of tasks for hands-off, semi-passive income. Close deals fast with proven scripts, templates, and tools. Access step-by-step coaching to scale income streams quickly. Reviews 5 out of 5 2 total reviews 5 stars 4 stars 3 stars 2 stars 1 star SY Sarah El Yaman 14 days ago Written 6 months after purchase W Willy30 16 days ago Written 1 month after purchase About the creator A View profile Admin 10x @ admin233b • Joined Sep 2024 We’re Shaun Ghavami and Ari Rahmanian, Airbnb coaches and founders of a $100M+ short-term rental portfolio. Starting with $65/night in a spare bedroom, we developed a risk-free co-listing strategy that’s helped us generate $5M+ in bookings and serve 3,000+ guests. Today, it is our mission to teach ambitious individuals how to replicate our success and achieve financial freedom through Airbnb. FAQs Do I need prior experience in real estate or Airbnb? How quickly can I start making money? What if I don’t have time to manage properties? Affiliates U Become an affiliate 10xBNB - US 30% reward Earn money by bringing customers to 10xBNB - US . Every time a customer purchases using your link, you&#x27;ll earn a commission. 10XBNB Partnership Program $300.00 / month +2 options Join $300.00 / month 2 options Pay Join Pay Join 10XBNB Partnership Program | Whop",
  "finalUrl": "https://whop.com/10xbnb-us/10xbnb-partnership-program-us/",
  "fetchedAt": "2025-11-05T19:42:33.351Z",
  "textHash": "7882b58162cf07adcce434e41f435bced079f811aa8d4bfe51f68503aff33193",
  "drilled": false
}