{
  "baseUrl": "https://whop.com/10xbnb-us/?a=alexburnett21",
  "title": "10xBNB - US | Whop",
  "h1": "10xBNB - US",
  "bullets": [
    "Powered by U 10xBNB - US We’re Shaun Ghavami and Ari Rahmanian, Airbnb coaches and founders of a $100M+ short-term rental portfolio. Starting with $65/night in a spare bedroom, we developed a risk-free co-listing strategy tha... More 5.0 ( 2 ) Contact seller Products Unmute Learn how to generate 6-7 figures on Airbnb from anywhere. 10XBNB Starter 5.0 ( 1 ) Unmute Build a 6-figure semi-passive income with Airbnb in 90 days. 10XBNB VIP Bootcamp New Unmute $300.00 / month Get highly profitable, agency-provided Airbnb deals. 10XBNB Partnership Program New $2,000.00 2000 2000 New $2,000.00 2000 2000 New $500.00 / month 10xBNB Starter 10xBNB Starter New $1,800.00 1800 1800 New $500.00 / month Scale your Airbnb arbitrage to 6-figures with proven systems 10xBNB Master Mind New $500.00 / month Scale Your Airbnb Portfolio with Proven US Market Strategies 10xBNB Master Mind New $500.00 / month Scale your US short-term rental biz with proven high-ROI systems 10xBNB Master Mind New Contact seller Reviews SY Sarah El Yaman 14 days ago Written 6 months after purchase",
    "W Willy30 • 10XBNB Starter 16 days ago Written 1 month after purchase"
  ],
  "paras": [
    "U 10xBNB - US We’re Shaun Ghavami and Ari Rahmanian, Airbnb coaches and founders of a $100M+ short-term rental portfolio. Starting with $65/night in a spare bedroom, we developed a risk-free co-listing strategy tha... More 5.0 ( 2 ) Contact seller Products Unmute Learn how to generate 6-7 figures on Airbnb from anywhere. 10XBNB Starter 5.0 ( 1 ) Unmute Build a 6-figure semi-passive income with Airbnb in 90 days. 10XBNB VIP Bootcamp New Unmute $300.00 / month Get highly profitable, agency-provided Airbnb deals. 10XBNB Partnership Program New $2,000.00 2000 2000 New $2,000.00 2000 2000 New $500.00 / month 10xBNB Starter 10xBNB Starter New $1,800.00 1800 1800 New $500.00 / month Scale your Airbnb arbitrage to 6-figures with proven systems 10xBNB Master Mind New $500.00 / month Scale Your Airbnb Portfolio with Proven US Market Strategies 10xBNB Master Mind New $500.00 / month Scale your US short-term rental biz with proven high-ROI systems 10xBNB Master Mind New Contact seller Reviews SY Sarah El Yaman 14 days ago",
    "16 days ago"
  ],
  "priceTokens": [
    "$100",
    "$65",
    "$300.00",
    "$2,000.00",
    "$2,000.00",
    "$500.00",
    "$1,800.00",
    "$500.00",
    "$500.00",
    "$500.00",
    "$1",
    "$1",
    "$1",
    "$21",
    "$1",
    "$1",
    "$1",
    "$1",
    "$28",
    "$1"
  ],
  "faq": [],
  "textSample": "Powered by U 10xBNB - US We’re Shaun Ghavami and Ari Rahmanian, Airbnb coaches and founders of a $100M+ short-term rental portfolio. Starting with $65/night in a spare bedroom, we developed a risk-free co-listing strategy tha... More 5.0 ( 2 ) Contact seller Products Unmute Learn how to generate 6-7 figures on Airbnb from anywhere. 10XBNB Starter 5.0 ( 1 ) Unmute Build a 6-figure semi-passive income with Airbnb in 90 days. 10XBNB VIP Bootcamp New Unmute $300.00 / month Get highly profitable, agency-provided Airbnb deals. 10XBNB Partnership Program New $2,000.00 2000 2000 New $2,000.00 2000 2000 New $500.00 / month 10xBNB Starter 10xBNB Starter New $1,800.00 1800 1800 New $500.00 / month Scale your Airbnb arbitrage to 6-figures with proven systems 10xBNB Master Mind New $500.00 / month Scale Your Airbnb Portfolio with Proven US Market Strategies 10xBNB Master Mind New $500.00 / month Scale your US short-term rental biz with proven high-ROI systems 10xBNB Master Mind New Contact seller Reviews SY Sarah El Yaman 14 days ago Written 6 months after purchase W Willy30 • 10XBNB Starter 16 days ago Written 1 month after purchase 10xBNB - US | Whop",
  "finalUrl": "https://whop.com/10xbnb-us/?a=alexburnett21",
  "fetchedAt": "2025-11-05T19:33:31.165Z",
  "textHash": "ef2b4c0ee382a0590f4ad19ad13d9cd307fd2ee64b2c17bfb847bbb19b9145bd",
  "drilled": false
}