{
  "baseUrl": "https://whop.com/tradingacademy/orb/",
  "title": "1+1 TradingView Strategy + BOT | Whop",
  "h1": "1+1 TradingView Strategy + BOT",
  "bullets": [
    "Sign in MO 1+1 TradingView Strategy + BOT Identifica breakout giornalieri con precisione Automatica 5.0 ( 52 ) Trading Scopri ORB E HL, 2 indicatori backtestabili su TradingView, ideali per trading manuale e automatizzato con BOT su MT5/Ctrader. Precisione e versatilità in un unico strumento!&quot; €39.00 / month Pay Get access Join 26 members Features Punti di Buy &amp; Sell chiari sul grafico",
    "Personalizzazione su qualsiasi timeframe o asset",
    "Backtest integrato per ottimizzazione storica",
    "Alert automatici per notifiche di trading",
    "Collegamento a MT5 e Ctrader",
    "FC fabio leonardo catturini 1 month ago Ho conosciuto Michele circa 2 anni e mezzo fa, da quando sono entrato in academy il mio trading ha cominciato ad essere profittevole, le sue spiegazioni sono semplici ma precise, seguendolo nelle live a mercato aperto vedi come opera un vero trader. Inoltre ti educa sugli investimenti a medio e lun... Show more Written 1 year after purchase",
    "TA Tommasi Alessandro 1 month ago Seguo l'accademy di Michele da un anno e mezzo ormai, è preparatissimo, uno dei migliori trader in Italia. Consigliato a chi vuole fare trading seriamente. Written 5 months after purchase",
    "M Marco 1 month ago Persona eccezionale, molto preparata e sempre super disponibile ad aiutare! Ogni giorno imparo qualcosa di nuovo ed è una crescita continua grazie a Michele e alla comunity che ha creato Written 1 month after purchase",
    "DN Daniele Novello 1 month ago Corso incredibile, ottimo anche per chi parte dalle prime basi. Il corso offre un'ottima infarinatura generale fino ad addentrarsi nello specifico della strategia ORB. Lo consiglierei a chiunque voglia addentrarsi in tutto ciò. Come sempre grande Michele Written 8 months after purchase"
  ],
  "paras": [
    "Sign in MO 1+1 TradingView Strategy + BOT Identifica breakout giornalieri con precisione Automatica 5.0 ( 52 ) Trading Scopri ORB E HL, 2 indicatori backtestabili su TradingView, ideali per trading manuale e automatizzato con BOT su MT5/Ctrader. Precisione e versatilità in un unico strumento!&quot;",
    "Join 26 members Features Punti di Buy &amp; Sell chiari sul grafico Personalizzazione su qualsiasi timeframe o asset Backtest integrato per ottimizzazione storica Alert automatici per notifiche di trading Collegamento a MT5 e Ctrader Reviews 4.98 out of 5 52 total reviews 5 stars 4 stars 3 stars 2 stars 1 star FC fabio leonardo catturini 1 month ago Ho conosciuto Michele circa 2 anni e mezzo fa, da quando sono entrato in academy il mio trading ha cominciato ad essere profittevole, le sue spiegazioni sono semplici ma precise, seguendolo nelle live a mercato aperto vedi come opera un vero trader. Inoltre ti educa sugli investimenti a medio e lun...",
    "Written 1 year after purchase TA Tommasi Alessandro 1 month ago Seguo l'accademy di Michele da un anno e mezzo ormai, è preparatissimo, uno dei migliori trader in Italia. Consigliato a chi vuole fare trading seriamente.",
    "1 month ago Persona eccezionale, molto preparata e sempre super disponibile ad aiutare! Ogni giorno imparo qualcosa di nuovo ed è una crescita continua grazie a Michele e alla comunity che ha creato",
    "1 month ago Corso incredibile, ottimo anche per chi parte dalle prime basi. Il corso offre un'ottima infarinatura generale fino ad addentrarsi nello specifico della strategia ORB. Lo consiglierei a chiunque voglia addentrarsi in tutto ciò. Come sempre grande Michele",
    "About the creator MR View profile Michele Rossi @ michelerossiofficial • Joined Jan 2024 Sono Michele Rossi, un trader professionista con anni di esperienza. Ho creato questa Academy per condividere le mie conoscenze e aiutarti a crescere nel mondo del trading. FAQs Quali sono i prerequisiti per partecipare al corso di trading gratuito? Quanto tempo dura il corso e come posso accedere ai materiali? Il corso di trading copre sia analisi tecnica che fondamentale? Ci sono costi nascosti o il corso è completamente gratuito? Offrite supporto dopo la fine del corso? Affiliates MO Become an affiliate Michele Rossi Official 30% reward Earn money by bringing customers to Michele Rossi Official. Every time a customer purchases using your link, you&#x27;ll earn a commission."
  ],
  "priceTokens": [
    "€39.00",
    "€39.00",
    "€39.00",
    "$1",
    "$1",
    "$1",
    "$22",
    "$1",
    "$1",
    "$1",
    "$1",
    "$1",
    "$2",
    "$1",
    "$2",
    "$2",
    "$2",
    "$2",
    "$3",
    "$3"
  ],
  "faq": [],
  "textSample": "Sign in MO 1+1 TradingView Strategy + BOT Identifica breakout giornalieri con precisione Automatica 5.0 ( 52 ) Trading Scopri ORB E HL, 2 indicatori backtestabili su TradingView, ideali per trading manuale e automatizzato con BOT su MT5/Ctrader. Precisione e versatilità in un unico strumento!&quot; €39.00 / month Pay Get access Join 26 members Features Punti di Buy &amp; Sell chiari sul grafico Personalizzazione su qualsiasi timeframe o asset Backtest integrato per ottimizzazione storica Alert automatici per notifiche di trading Collegamento a MT5 e Ctrader Reviews 4.98 out of 5 52 total reviews 5 stars 4 stars 3 stars 2 stars 1 star FC fabio leonardo catturini 1 month ago Ho conosciuto Michele circa 2 anni e mezzo fa, da quando sono entrato in academy il mio trading ha cominciato ad essere profittevole, le sue spiegazioni sono semplici ma precise, seguendolo nelle live a mercato aperto vedi come opera un vero trader. Inoltre ti educa sugli investimenti a medio e lun... Show more Written 1 year after purchase TA Tommasi Alessandro 1 month ago Seguo l'accademy di Michele da un anno e mezzo ormai, è preparatissimo, uno dei migliori trader in Italia. Consigliato a chi vuole fare trading seriamente. Written 5 months after purchase M Marco 1 month ago Persona eccezionale, molto preparata e sempre super disponibile ad aiutare! Ogni giorno imparo qualcosa di nuovo ed è una crescita continua grazie a Michele e alla comunity che ha creato Written 1 month after purchase DN Daniele Novello 1 month ago Corso incredibile, ottimo anche per chi parte dalle prime basi. Il corso offre un'ottima infarinatura generale fino ad addentrarsi nello specifico della strategia ORB. Lo consiglierei a chiunque voglia addentrarsi in tutto ciò. Come sempre grande Michele Written 8 months after purchase See all reviews About the creator MR View profile Michele Rossi @ michelerossiofficial • Joined Jan 2024 Sono Michele Rossi, un trader professionista con anni di esperienza. Ho creato questa Academy per condividere le mie conoscenze e aiutarti a crescere nel mondo del trading. FAQs Quali sono i prerequisiti per partecipare al corso di trading gratuito? Quanto tempo dura il corso e come posso accedere ai materiali? Il corso di trading copre sia analisi tecnica che fondamentale? Ci sono costi nascosti o il corso è completamente gratuito? Offrite supporto dopo la fine del corso? Affiliates MO Become an affiliate Michele Rossi Official 30% reward Earn money by bringing customers to Michele Rossi Official. Every time a customer purchases using your link, you&#x27;ll earn a commission. 1+1 TradingView Strategy + BOT €39.00 / month Get access €39.00 / month Pay Get access Pay Get access 1+1 TradingView Strategy + BOT | Whop",
  "finalUrl": "https://whop.com/tradingacademy/orb/",
  "fetchedAt": "2025-11-05T19:39:52.299Z",
  "textHash": "85aa7aec5ad7540f275a11e25d6007a977f52e421c54575ceb37951193de5a54",
  "drilled": false
}