{
  "baseUrl": "https://whop.com/trapp1on1/12-months-trapp-membership/",
  "title": "12 months Trapp membership | Whop",
  "h1": "12 months Trapp membership",
  "bullets": [
    "Sign in T 12 months Trapp membership Profit plays. Trade reviews. Market prep. Letâ€™s print. 5.0 ( 1 ) Other The Money Room This ainâ€™t just a chat â€” itâ€™s a profit hub for future traders. $1,178.00 for 1 year Pay Join Features market prep weekly",
    "half price promo (20 people)",
    "break down of successful plays",
    "1 on 1 x 1 to build your plan with Trapp $250 value included in sub",
    "J jeremiah.mov 6 months ago Trapp is for the people, helped changed my life years ago ðŸ’ŽðŸ«¡ Written 4 minutes after purchase"
  ],
  "paras": [
    "Sign in T 12 months Trapp membership Profit plays. Trade reviews. Market prep. Letâ€™s print. 5.0 ( 1 ) Other The Money Room This ainâ€™t just a chat â€” itâ€™s a profit hub for future traders.",
    "market prep weekly half price promo (20 people) break down of successful plays 1 on 1 x 1 to build your plan with Trapp $250 value included in sub Reviews 5 out of 5 1 review 5 stars 4 stars 3 stars 2 stars 1 star J jeremiah.mov 6 months ago Trapp is for the people, helped changed my life years ago ðŸ’ŽðŸ«¡",
    "FAQs 1. What can I expect during a consultation? 2. Who is this consultation for? 3. Do I need any experience to book a session? 4. Will you give me a full blueprint to follow? 5. Why should I trust you as a mentor? Affiliates T Become an affiliate Trapperversity 10% reward Earn money by bringing customers to Trapperversity . Every time a customer purchases using your link, you&#x27;ll earn a commission."
  ],
  "priceTokens": [
    "$1,178.00",
    "$250",
    "$1,178.00",
    "$1,178.00",
    "$1",
    "$1",
    "$1",
    "$22",
    "$1",
    "$1",
    "$1",
    "$1",
    "$1",
    "$2",
    "$1",
    "$2",
    "$2",
    "$2",
    "$2",
    "$3"
  ],
  "faq": [],
  "textSample": "Sign in T 12 months Trapp membership Profit plays. Trade reviews. Market prep. Letâ€™s print. 5.0 ( 1 ) Other The Money Room This ainâ€™t just a chat â€” itâ€™s a profit hub for future traders. $1,178.00 for 1 year Pay Join Features market prep weekly half price promo (20 people) break down of successful plays 1 on 1 x 1 to build your plan with Trapp $250 value included in sub Reviews 5 out of 5 1 review 5 stars 4 stars 3 stars 2 stars 1 star J jeremiah.mov 6 months ago Trapp is for the people, helped changed my life years ago ðŸ’ŽðŸ«¡ Written 4 minutes after purchase About the creator T View profile Trapperversity @ trappdinero â€¢ Joined Apr 2025 FAQs 1. What can I expect during a consultation? 2. Who is this consultation for? 3. Do I need any experience to book a session? 4. Will you give me a full blueprint to follow? 5. Why should I trust you as a mentor? Affiliates T Become an affiliate Trapperversity 10% reward Earn money by bringing customers to Trapperversity . Every time a customer purchases using your link, you&#x27;ll earn a commission. 12 months Trapp membership $1,178.00 for 1 year Join $1,178.00 for 1 year Pay Join Pay Join 12 months Trapp membership | Whop",
  "finalUrl": "https://whop.com/trapp1on1/12-months-trapp-membership/",
  "fetchedAt": "2025-11-05T19:35:11.755Z",
  "textHash": "5c2aeb4baf22b08c6e839b5a8d16ee4c30f819d6e047f90f5ea7da3cd2433dca",
  "drilled": false
}