{
  "baseUrl": "https://whop.com/watsonfit-business-coaching/12-weeks-to-beast-bc/",
  "title": "12 WEEKS TO BEAST | Whop",
  "h1": "12 WEEKS TO BEAST",
  "bullets": [
    "Sign in Unmute Unmute TF 12 WEEKS TO BEAST Achieve Peak Fitness with Personalized Coaching 5.0 ( 2 ) Other Transform your life in 12 weeks with personal coaching, custom nutrition plans, and a supportive community to help you push limits and achieve greatness. $750.00 / 3 months Pay Join Join 52 members Features 12 weeks of one-on-one guidance from Wes Watson",
    "Personalized meal plans and cheat sheets specific to your body",
    "Structured workout schedules with video-guided sessions",
    "Two live check-in calls each week to keep you on track",
    "Connect with others on the same journey of growth and get 24/7 support",
    "JA John appleseed 14 days ago Written 3 days after purchase",
    "JM Jamal Marshall 2 months ago Written 3 months after purchase"
  ],
  "paras": [
    "Sign in Unmute Unmute TF 12 WEEKS TO BEAST Achieve Peak Fitness with Personalized Coaching 5.0 ( 2 ) Other Transform your life in 12 weeks with personal coaching, custom nutrition plans, and a supportive community to help you push limits and achieve greatness.",
    "Join 52 members Features 12 weeks of one-on-one guidance from Wes Watson Personalized meal plans and cheat sheets specific to your body Structured workout schedules with video-guided sessions Two live check-in calls each week to keep you on track Connect with others on the same journey of growth and get 24/7 support Reviews 5 out of 5 2 total reviews 5 stars 4 stars 3 stars 2 stars 1 star JA John appleseed 14 days ago",
    "2 months ago",
    "Affiliates TF Become an affiliate Team Watson Fit 30% reward Earn money by bringing customers to Team Watson Fit. Every time a customer purchases using your link, you&#x27;ll earn a commission."
  ],
  "priceTokens": [
    "$750.00",
    "$750.00",
    "$750.00",
    "$1",
    "$1",
    "$1",
    "$23",
    "$1",
    "$1",
    "$1",
    "$1",
    "$1",
    "$2",
    "$1",
    "$2",
    "$2",
    "$2",
    "$2",
    "$3",
    "$3"
  ],
  "faq": [],
  "textSample": "Sign in Unmute Unmute TF 12 WEEKS TO BEAST Achieve Peak Fitness with Personalized Coaching 5.0 ( 2 ) Other Transform your life in 12 weeks with personal coaching, custom nutrition plans, and a supportive community to help you push limits and achieve greatness. $750.00 / 3 months Pay Join Join 52 members Features 12 weeks of one-on-one guidance from Wes Watson Personalized meal plans and cheat sheets specific to your body Structured workout schedules with video-guided sessions Two live check-in calls each week to keep you on track Connect with others on the same journey of growth and get 24/7 support Reviews 5 out of 5 2 total reviews 5 stars 4 stars 3 stars 2 stars 1 star JA John appleseed 14 days ago Written 3 days after purchase JM Jamal Marshall 2 months ago Written 3 months after purchase About the creator WW View profile Wes Watson @ watsonfit760 â€¢ Joined Oct 2024 Affiliates TF Become an affiliate Team Watson Fit 30% reward Earn money by bringing customers to Team Watson Fit. Every time a customer purchases using your link, you&#x27;ll earn a commission. 12 WEEKS TO BEAST $750.00 / 3 months Join $750.00 / 3 months Pay Join Pay Join 12 WEEKS TO BEAST | Whop",
  "finalUrl": "https://whop.com/watsonfit-business-coaching/12-weeks-to-beast-bc/",
  "fetchedAt": "2025-11-05T19:33:28.499Z",
  "textHash": "84d9271db73d20ce09b0b86f18b63754bc0be520dfe93227bf53234cd2072cff",
  "drilled": false
}