{
  "baseUrl": "https://whop.com/tribe-capital-premium/14-days-trial-for-1-dollar/",
  "title": "14 Day Trial For $1 | Whop",
  "h1": "14 Day Trial For $1",
  "bullets": [
    "Sign in TC 14 Day Trial For $1 Try Premium For Only $1 5.0 ( 56 ) Trading Trade signals, educational content and more! $59.95 / month 14 day trial + $1.00 initial fee Pay Get offer Join 53 members Features Cancel anytime you want during the trial to avoid further charges.",
    "14 days of premium access for only $1.",
    "Enjoy all premium benefits for two weeks.",
    "C chumchum 6 days ago Joining Tribe Capital was one of the best decisions I’ve made, and I’m genuinely grateful I did. Live streams and chart breakdowns lay out a clear plan with entries, invalidations, and management, with risk management and execution as the priority. Over time it becomes discipline and consistency y... Show more Written 4 months after purchase",
    "HK Hugo Krijgsman 9 days ago Recently joined Tribe Capital Premium and I’m genuinely impressed. The daily livestreams keep me engaged and on track, and Jip lays out a clear, well-structured plan for looking at the markets each session no fluff just process. The streams are easy to follow, trade ideas come with reasoning, and th... Show more Written 24 days after purchase",
    "R Rogerboger 19 days ago The server is very friendly and helpful. Even though I haven't been too active sharing my own trades yet, I still follow what is being said and the traders in the server really encourage and push eachother to become a better trader. It's very nice to learn something new with the QPA strategy. I thin... Show more Written 1 month after purchase",
    "KA Kelechi Aguocha 1 month ago Yo, The Tribe Capital is honestly one of the best trading servers I’ve been in. I joined kinda skeptical at first, but the vibe here is different. Super chill, super welcoming—people actually care and wanna see you win. It’s not just signals or hype plays. You learn how to think like a real trader.... Show more Written 3 months after purchase"
  ],
  "paras": [
    "Sign in TC 14 Day Trial For $1 Try Premium For Only $1 5.0 ( 56 ) Trading Trade signals, educational content and more!",
    "14 day trial + $1.00 initial fee Pay Get offer Join 53 members Features Cancel anytime you want during the trial to avoid further charges. 14 days of premium access for only $1. Enjoy all premium benefits for two weeks. Reviews 5 out of 5 56 total reviews 5 stars 4 stars 3 stars 2 stars 1 star C chumchum 6 days ago Joining Tribe Capital was one of the best decisions I’ve made, and I’m genuinely grateful I did. Live streams and chart breakdowns lay out a clear plan with entries, invalidations, and management, with risk management and execution as the priority. Over time it becomes discipline and consistency y...",
    "Written 4 months after purchase HK Hugo Krijgsman 9 days ago Recently joined Tribe Capital Premium and I’m genuinely impressed. The daily livestreams keep me engaged and on track, and Jip lays out a clear, well-structured plan for looking at the markets each session no fluff just process. The streams are easy to follow, trade ideas come with reasoning, and th...",
    "Written 24 days after purchase R Rogerboger 19 days ago The server is very friendly and helpful. Even though I haven't been too active sharing my own trades yet, I still follow what is being said and the traders in the server really encourage and push eachother to become a better trader. It's very nice to learn something new with the QPA strategy. I thin...",
    "Written 1 month after purchase KA Kelechi Aguocha 1 month ago Yo, The Tribe Capital is honestly one of the best trading servers I’ve been in. I joined kinda skeptical at first, but the vibe here is different. Super chill, super welcoming—people actually care and wanna see you win. It’s not just signals or hype plays. You learn how to think like a real trader....",
    "Written 3 months after purchase See all reviews About the creator TC View profile Tribe Capital @ tribecapital • Joined Apr 2024 With years of experience in financial markets, I&#x27;ve built Tribe Capital to empower traders through precise signals and a vibrant community. My mission is to guide both novices and veterans towards successful trading journeys. FAQs Is Tribe Capital suitable for beginners in cryptocurrency trading? What kind of educational resources does Tribe Capital offer? Does Tribe Capital offer personalized support or mentorship? What is Tribe Capital? Affiliates TC Become an affiliate Tribe Capital 25% reward Earn money by bringing customers to Tribe Capital. Every time a customer purchases using your link, you&#x27;ll earn a commission."
  ],
  "priceTokens": [
    "$1",
    "$1",
    "$59.95",
    "$1.00",
    "$1",
    "$1",
    "$59.95",
    "$59.95",
    "$1",
    "$1",
    "$1",
    "$23",
    "$1",
    "$1",
    "$1",
    "$1",
    "$1",
    "$2",
    "$1",
    "$2"
  ],
  "faq": [],
  "textSample": "Sign in TC 14 Day Trial For $1 Try Premium For Only $1 5.0 ( 56 ) Trading Trade signals, educational content and more! $59.95 / month 14 day trial + $1.00 initial fee Pay Get offer Join 53 members Features Cancel anytime you want during the trial to avoid further charges. 14 days of premium access for only $1. Enjoy all premium benefits for two weeks. Reviews 5 out of 5 56 total reviews 5 stars 4 stars 3 stars 2 stars 1 star C chumchum 6 days ago Joining Tribe Capital was one of the best decisions I’ve made, and I’m genuinely grateful I did. Live streams and chart breakdowns lay out a clear plan with entries, invalidations, and management, with risk management and execution as the priority. Over time it becomes discipline and consistency y... Show more Written 4 months after purchase HK Hugo Krijgsman 9 days ago Recently joined Tribe Capital Premium and I’m genuinely impressed. The daily livestreams keep me engaged and on track, and Jip lays out a clear, well-structured plan for looking at the markets each session no fluff just process. The streams are easy to follow, trade ideas come with reasoning, and th... Show more Written 24 days after purchase R Rogerboger 19 days ago The server is very friendly and helpful. Even though I haven't been too active sharing my own trades yet, I still follow what is being said and the traders in the server really encourage and push eachother to become a better trader. It's very nice to learn something new with the QPA strategy. I thin... Show more Written 1 month after purchase KA Kelechi Aguocha 1 month ago Yo, The Tribe Capital is honestly one of the best trading servers I’ve been in. I joined kinda skeptical at first, but the vibe here is different. Super chill, super welcoming—people actually care and wanna see you win. It’s not just signals or hype plays. You learn how to think like a real trader.... Show more Written 3 months after purchase See all reviews About the creator TC View profile Tribe Capital @ tribecapital • Joined Apr 2024 With years of experience in financial markets, I&#x27;ve built Tribe Capital to empower traders through precise signals and a vibrant community. My mission is to guide both novices and veterans towards successful trading journeys. FAQs Is Tribe Capital suitable for beginners in cryptocurrency trading? What kind of educational resources does Tribe Capital offer? Does Tribe Capital offer personalized support or mentorship? What is Tribe Capital? Affiliates TC Become an affiliate Tribe Capital 25% reward Earn money by bringing customers to Tribe Capital. Every time a customer purchases using your link, you&#x27;ll earn a commission. 14 Day Trial For $1 $59.95 / month Get offer $59.95 / month Pay Get offer Pay Get offer 14 Day Trial For $1 | Whop",
  "finalUrl": "https://whop.com/tribe-capital-premium/14-days-trial-for-1-dollar/",
  "fetchedAt": "2025-11-05T19:42:31.367Z",
  "textHash": "4dfb47fa179fdae4eb4a01cdeb6955c54e1a9a594fc69e43f9c14761371a8efa",
  "drilled": false
}