{
  "baseUrl": "https://whop.com/access-57-df24/?a=alexburnett21",
  "title": "TVE Financial Freedom | Whop",
  "h1": "TVE Financial Freedom",
  "bullets": [
    "Powered by TF TVE Financial Freedom “This is for educational purposes only and is not financial or investment advice. I am not a licensed financial advisor. Always do your own research before making investment decisions, I&#x27;m simply shar... More 4.7 ( 92 ) Contact seller Products $7.00 / week Change Your Life for $1/Day! $1/day Crypto Group 4.7 ( 89 ) Contact seller Reviews IS Isa Shearer 22 days ago Good shii Written 21 days after purchase",
    "MW Max Wallace 1 month ago Bro is a G. Overall great experience. Helps you see everything before it happens. Written 21 days after purchase",
    "B BreakGIMak 1 month ago Very good, he actually posts coins before they blow up, you gotta be active and if you take it seriously you can make money Written 1 month after purchase",
    "KV Kristjan Vinko 2 months ago I don’t even get a refund Written 4 days after purchase"
  ],
  "paras": [
    "TF TVE Financial Freedom “This is for educational purposes only and is not financial or investment advice. I am not a licensed financial advisor. Always do your own research before making investment decisions, I&#x27;m simply shar... More 4.7 ( 92 ) Contact seller Products $7.00 / week Change Your Life for $1/Day! $1/day Crypto Group 4.7 ( 89 ) Contact seller Reviews IS Isa Shearer 22 days ago Good shii",
    "1 month ago Bro is a G. Overall great experience. Helps you see everything before it happens.",
    "1 month ago Very good, he actually posts coins before they blow up, you gotta be active and if you take it seriously you can make money",
    "2 months ago I don’t even get a refund"
  ],
  "priceTokens": [
    "$7.00",
    "$1",
    "$1",
    "$1",
    "$1",
    "$1",
    "$21",
    "$1",
    "$1",
    "$1",
    "$1",
    "$28",
    "$1",
    "$28",
    "$28",
    "$28",
    "$28",
    "$3",
    "$3",
    "$3"
  ],
  "faq": [],
  "textSample": "Powered by TF TVE Financial Freedom “This is for educational purposes only and is not financial or investment advice. I am not a licensed financial advisor. Always do your own research before making investment decisions, I&#x27;m simply shar... More 4.7 ( 92 ) Contact seller Products $7.00 / week Change Your Life for $1/Day! $1/day Crypto Group 4.7 ( 89 ) Contact seller Reviews IS Isa Shearer 22 days ago Good shii Written 21 days after purchase MW Max Wallace 1 month ago Bro is a G. Overall great experience. Helps you see everything before it happens. Written 21 days after purchase B BreakGIMak 1 month ago Very good, he actually posts coins before they blow up, you gotta be active and if you take it seriously you can make money Written 1 month after purchase KV Kristjan Vinko 2 months ago I don’t even get a refund Written 4 days after purchase See all reviews TVE Financial Freedom | Whop",
  "finalUrl": "https://whop.com/access-57-df24/?a=alexburnett21",
  "fetchedAt": "2025-11-05T19:30:36.601Z",
  "textHash": "48a4313c9bebf17f531ef2899178eccb8cb0b2444fe95cc2f5482f049ad02ec2",
  "drilled": false
}