{
  "baseUrl": "https://whop.com/richforeverbets/1-k-to-10-k-challenge/",
  "title": "1Kto10K ğŸªœ CHALLENGE | Whop",
  "h1": "1Kto10K ğŸªœ CHALLENGE",
  "bullets": [
    "Sign in RB 1Kto10K ğŸªœ CHALLENGE Turn 1k into 10k in 10 Days! START MAY 1ST 4.4 ( 314 ) Sports betting Ready to turn $1,000 into $10,000? Join my Exclusive 10-Day Sports Betting Challenge where discipline, sharp picks, and elite bankroll management meet massive upside. $499.00 for 40 days Pay Join Join 6 members Reviews 4.42 out of 5 314 total reviews 5 stars 4 stars 3 stars 2 stars 1 star SJ Shannon johnson 1 day ago This is a great community and Iâ€™m definitely going to stay locked in Written 5 hours after purchase",
    "JA John Appleseed 1 day ago Canâ€™t lie I been hitting a lot since joining. Yes thereâ€™s days u lose but itâ€™s gambling everyone doesnâ€™t have a 100% rate . Written 2 days after purchase",
    "DW David Winkfield 2 days ago The hit rate speakers for itself! Written 8 days after purchase",
    "RA Reggie Anderson 5 days ago Ill give these guys a 5 star a million times thereâ€™s no better sport predicts then this crew there so challenging & risky it doesnâ€™t make no sense Written 8 hours after purchase"
  ],
  "paras": [
    "Sign in RB 1Kto10K ğŸªœ CHALLENGE Turn 1k into 10k in 10 Days! START MAY 1ST 4.4 ( 314 ) Sports betting Ready to turn $1,000 into $10,000? Join my Exclusive 10-Day Sports Betting Challenge where discipline, sharp picks, and elite bankroll management meet massive upside.",
    "Join 6 members Reviews 4.42 out of 5 314 total reviews 5 stars 4 stars 3 stars 2 stars 1 star SJ Shannon johnson 1 day ago This is a great community and Iâ€™m definitely going to stay locked in",
    "1 day ago Canâ€™t lie I been hitting a lot since joining. Yes thereâ€™s days u lose but itâ€™s gambling everyone doesnâ€™t have a 100% rate .",
    "2 days ago The hit rate speakers for itself!",
    "5 days ago Ill give these guys a 5 star a million times thereâ€™s no better sport predicts then this crew there so challenging & risky it doesnâ€™t make no sense",
    "About the creator R View profile Rich @ richforeverbets â€¢ Joined Sep 2024 ğŸ¯Sports betting changed Nathanielâ€™s life. In 2021, he took a calculated risk on a game ğŸ² , a decision that set him on a path that transformed everything. That journey earned him VIP status with FanDuel in NJ ğŸ† and gave him the freedom to fully pursue his passion ğŸ”¥. Today, even in his absence, the legacy continues. His proven system lives on, guiding the team to deliver the same winning plays. FAQs What is your winning rate? How does Pick Insurance work? What makes Richforeverbets different? Can beginners join Richforeverbets? Will I make a profit? Affiliates RB Become an affiliate RichForeverBets (#1 Sports Bettor) 30% reward Earn money by bringing customers to RichForeverBets (#1 Sports Bettor). Every time a customer purchases using your link, you&#x27;ll earn a commission."
  ],
  "priceTokens": [
    "$1,000",
    "$10,000",
    "$499.00",
    "$499.00",
    "$499.00",
    "$1",
    "$1",
    "$1",
    "$22",
    "$1",
    "$1",
    "$1",
    "$1",
    "$1",
    "$2",
    "$1",
    "$2",
    "$2",
    "$2",
    "$2"
  ],
  "faq": [],
  "textSample": "Sign in RB 1Kto10K ğŸªœ CHALLENGE Turn 1k into 10k in 10 Days! START MAY 1ST 4.4 ( 314 ) Sports betting Ready to turn $1,000 into $10,000? Join my Exclusive 10-Day Sports Betting Challenge where discipline, sharp picks, and elite bankroll management meet massive upside. $499.00 for 40 days Pay Join Join 6 members Reviews 4.42 out of 5 314 total reviews 5 stars 4 stars 3 stars 2 stars 1 star SJ Shannon johnson 1 day ago This is a great community and Iâ€™m definitely going to stay locked in Written 5 hours after purchase JA John Appleseed 1 day ago Canâ€™t lie I been hitting a lot since joining. Yes thereâ€™s days u lose but itâ€™s gambling everyone doesnâ€™t have a 100% rate . Written 2 days after purchase DW David Winkfield 2 days ago The hit rate speakers for itself! Written 8 days after purchase RA Reggie Anderson 5 days ago Ill give these guys a 5 star a million times thereâ€™s no better sport predicts then this crew there so challenging & risky it doesnâ€™t make no sense Written 8 hours after purchase See all reviews About the creator R View profile Rich @ richforeverbets â€¢ Joined Sep 2024 ğŸ¯Sports betting changed Nathanielâ€™s life. In 2021, he took a calculated risk on a game ğŸ² , a decision that set him on a path that transformed everything. That journey earned him VIP status with FanDuel in NJ ğŸ† and gave him the freedom to fully pursue his passion ğŸ”¥. Today, even in his absence, the legacy continues. His proven system lives on, guiding the team to deliver the same winning plays. FAQs What is your winning rate? How does Pick Insurance work? What makes Richforeverbets different? Can beginners join Richforeverbets? Will I make a profit? Affiliates RB Become an affiliate RichForeverBets (#1 Sports Bettor) 30% reward Earn money by bringing customers to RichForeverBets (#1 Sports Bettor). Every time a customer purchases using your link, you&#x27;ll earn a commission. 1Kto10K ğŸªœ CHALLENGE $499.00 for 40 days Join $499.00 for 40 days Pay Join Pay Join 1Kto10K ğŸªœ CHALLENGE | Whop",
  "finalUrl": "https://whop.com/richforeverbets/1-k-to-10-k-challenge/",
  "fetchedAt": "2025-11-05T19:36:31.269Z",
  "textHash": "5c76115fb3ae89764147438e050cb69fdd28555382d502a6a320daf81594586a",
  "drilled": false
}