{
  "baseUrl": "https://whop.com/mallpickz/day-premium-package/",
  "title": "ðŸ’Ž Elite MoneyLine Access | Whop",
  "h1": "ðŸ’Ž Elite MoneyLine Access",
  "bullets": [
    "Sign in Unmute Unmute M ðŸ’Ž Elite MoneyLine Access Todayâ€™s Guaranteed Money Line Picks 4.5 ( 213 ) Sports betting Hand-picked, guaranteed money line bets. No spreadsâ€”just proven, high-confidence winners to help you cash today. $75.00 / 2 days Pay Join Features âœ… My highest-confidence straight money line picks",
    "âœ… Research-backed selections for reliable cash-outs",
    "âœ… Pure money lines for simple, stress-free betting",
    "âœ… Ideal for growing reliable profit streams outside PrizePicks-only betting",
    "ðŸŸ  Best for: Anyone who wants direct, winning money line bets today.",
    "LT Luke Thomas 6 days ago Best guy on this app by far. Everyone cashingðŸ”¥ðŸ”¥ Written 1 hour after purchase",
    "BD Billy Don 7 days ago Amazing Written 2 months after purchase",
    "RC Ricardo Charleston 12 days ago This app is so amazing ðŸ¤© Written 10 months after purchase",
    "AZ Angela Zayas 12 days ago Im ready Written 9 days after purchase"
  ],
  "paras": [
    "Sign in Unmute Unmute M ðŸ’Ž Elite MoneyLine Access Todayâ€™s Guaranteed Money Line Picks 4.5 ( 213 ) Sports betting Hand-picked, guaranteed money line bets. No spreadsâ€”just proven, high-confidence winners to help you cash today.",
    "âœ… My highest-confidence straight money line picks âœ… Research-backed selections for reliable cash-outs âœ… Pure money lines for simple, stress-free betting âœ… Ideal for growing reliable profit streams outside PrizePicks-only betting ðŸŸ  Best for: Anyone who wants direct, winning money line bets today. Reviews 4.52 out of 5 213 total reviews 5 stars 4 stars 3 stars 2 stars 1 star LT Luke Thomas 6 days ago Best guy on this app by far. Everyone cashingðŸ”¥ðŸ”¥",
    "7 days ago Amazing",
    "12 days ago This app is so amazing ðŸ¤©",
    "12 days ago Im ready",
    "About the creator M View profile MallPicks @ mallpicks â€¢ Joined Nov 2023 I&#x27;ve spent years analyzing player prop bets and perfecting strategies to highlight top picks with the greatest potential. My passion is in-depth analysis and providing insights that empower well-informed betting decisions, helping you maximize your wins. Remember, these insights are not financial advice but a tool to enhance your strategy. FAQs What is included in the Max Cash Player Props? Affiliates M Become an affiliate mallpickz 30% reward Earn money by bringing customers to mallpickz . Every time a customer purchases using your link, you&#x27;ll earn a commission."
  ],
  "priceTokens": [
    "$75.00",
    "$75.00",
    "$75.00",
    "$1",
    "$1",
    "$1",
    "$22",
    "$1",
    "$1",
    "$1",
    "$1",
    "$1",
    "$2",
    "$1",
    "$2",
    "$2",
    "$2",
    "$2",
    "$3",
    "$3"
  ],
  "faq": [],
  "textSample": "Sign in Unmute Unmute M ðŸ’Ž Elite MoneyLine Access Todayâ€™s Guaranteed Money Line Picks 4.5 ( 213 ) Sports betting Hand-picked, guaranteed money line bets. No spreadsâ€”just proven, high-confidence winners to help you cash today. $75.00 / 2 days Pay Join Features âœ… My highest-confidence straight money line picks âœ… Research-backed selections for reliable cash-outs âœ… Pure money lines for simple, stress-free betting âœ… Ideal for growing reliable profit streams outside PrizePicks-only betting ðŸŸ  Best for: Anyone who wants direct, winning money line bets today. Reviews 4.52 out of 5 213 total reviews 5 stars 4 stars 3 stars 2 stars 1 star LT Luke Thomas 6 days ago Best guy on this app by far. Everyone cashingðŸ”¥ðŸ”¥ Written 1 hour after purchase BD Billy Don 7 days ago Amazing Written 2 months after purchase RC Ricardo Charleston 12 days ago This app is so amazing ðŸ¤© Written 10 months after purchase AZ Angela Zayas 12 days ago Im ready Written 9 days after purchase See all reviews About the creator M View profile MallPicks @ mallpicks â€¢ Joined Nov 2023 I&#x27;ve spent years analyzing player prop bets and perfecting strategies to highlight top picks with the greatest potential. My passion is in-depth analysis and providing insights that empower well-informed betting decisions, helping you maximize your wins. Remember, these insights are not financial advice but a tool to enhance your strategy. FAQs What is included in the Max Cash Player Props? Affiliates M Become an affiliate mallpickz 30% reward Earn money by bringing customers to mallpickz . Every time a customer purchases using your link, you&#x27;ll earn a commission. ðŸ’Ž Elite MoneyLine Access $75.00 / 2 days Join $75.00 / 2 days Pay Join Pay Join ðŸ’Ž Elite MoneyLine Access | Whop",
  "finalUrl": "https://whop.com/mallpickz/day-premium-package/",
  "fetchedAt": "2025-11-05T19:38:21.773Z",
  "textHash": "0850cba02c7b283fb675ebc2f24153ec56f84f9c9b59164637394a5cceb95642",
  "drilled": false
}