{
  "baseUrl": "https://whop.com/front-end-coding-school-elite/2000-29/",
  "title": "$2000 | Whop",
  "h1": "$2000",
  "bullets": [
    "Sign in FN $2000 Launch Your Front End Career Today Software Join us to master front end development and kickstart your tech career with expert resources, community support, and job opportunities. $2,000.00 one-time purchase Pay Join Join 1 member Features Access to Sales Mastery Resources to refine your techniques.",
    "Engage in a Q&amp;A Forum for expert insights and answers.",
    "Participate in Live Calls for real-time learning and interaction.",
    "Explore job opportunities on our exclusive Job Board.",
    "Join a vibrant Community for meaningful conversations and support."
  ],
  "paras": [
    "Sign in FN $2000 Launch Your Front End Career Today Software Join us to master front end development and kickstart your tech career with expert resources, community support, and job opportunities.",
    "Join 1 member Features Access to Sales Mastery Resources to refine your techniques. Engage in a Q&amp;A Forum for expert insights and answers. Participate in Live Calls for real-time learning and interaction. Explore job opportunities on our exclusive Job Board. Join a vibrant Community for meaningful conversations and support. About the creator S View profile Sam @ samd304 • Joined Sep 2024 I&#x27;ve dedicated my career to empowering aspiring developers. With Front End Now Elite, I provide the tools and support needed to excel in front end development. FAQs Where is this community hosted? Where can I manage my subscription? Affiliates FN Become an affiliate Front End Now 30% reward Earn money by bringing customers to Front End Now. Every time a customer purchases using your link, you&#x27;ll earn a commission."
  ],
  "priceTokens": [
    "$200",
    "$2,000.00",
    "$200",
    "$2,000.00",
    "$2,000.00",
    "$1",
    "$1",
    "$1",
    "$22",
    "$1",
    "$1",
    "$1",
    "$1",
    "$1",
    "$2",
    "$1",
    "$2",
    "$2",
    "$2",
    "$2"
  ],
  "faq": [],
  "textSample": "Sign in FN $2000 Launch Your Front End Career Today Software Join us to master front end development and kickstart your tech career with expert resources, community support, and job opportunities. $2,000.00 one-time purchase Pay Join Join 1 member Features Access to Sales Mastery Resources to refine your techniques. Engage in a Q&amp;A Forum for expert insights and answers. Participate in Live Calls for real-time learning and interaction. Explore job opportunities on our exclusive Job Board. Join a vibrant Community for meaningful conversations and support. About the creator S View profile Sam @ samd304 • Joined Sep 2024 I&#x27;ve dedicated my career to empowering aspiring developers. With Front End Now Elite, I provide the tools and support needed to excel in front end development. FAQs Where is this community hosted? Where can I manage my subscription? Affiliates FN Become an affiliate Front End Now 30% reward Earn money by bringing customers to Front End Now. Every time a customer purchases using your link, you&#x27;ll earn a commission. $2000 $2,000.00 one-time purchase Join $2,000.00 one-time purchase Pay Join Pay Join $2000 | Whop",
  "finalUrl": "https://whop.com/front-end-coding-school-elite/2000-29/",
  "fetchedAt": "2025-11-05T19:38:23.651Z",
  "textHash": "d9264f72a50d68f8ebac8160d97b5a5d0740f78428168ac0660e6852bef192be",
  "drilled": false
}