{
  "baseUrl": "https://whop.com/lifetime-membership-f2/everest-trading/",
  "title": "2025 Mentorship | Whop",
  "h1": "2025 Mentorship",
  "bullets": [
    "2025 Mentorship | Whop Sign in ET 2025 Mentorship Master Options Trading with Simple Strategies and Insights 4.1 ( 156 ) Trading Unlock your full potential with real-time market insights, live trading sessions, proven strategies, and a supportive community designed to maximize your success. $50.00 / week 7 day trial Pay Join Join 62 members Features My Full Trading System (Step-by-Step)",
    "Exclusive Video Library &amp; Live Trade Breakdowns",
    "Daily Live Trading &amp; Watchlist Access",
    "Exclusive Access To Account Challenges",
    "Real-Time Entry &amp; Exits",
    "J Jon? 7 months ago Great call outs and alerts, premium membership give you faster calls and alerts and more learning resources. Great Course. Written 1 year after purchase",
    "JC john castillo 7 months ago Where do i even start Everest trading has been incredible for me over the last 3 months. I started trading 6 months ago and was -$1500 and over the last 3 months i have made $5000 at the age of 16 years old not only are the alerts amazing in the morning but the Edu in the whop has taught me so much ... Show more Written 1 month after purchase",
    "SR Sergio Ramirez 1 year ago I have the lifetime access and his callouts are legit. He also teaches you his strategy and psychology. Im proud to say ive been able to make a lot of money at just 18 years old with this course. Written 5 months after purchase",
    "AR andrew rusinas 1 year ago Great call outs by OptionsBuffett, excellent breakout strategy, lots on money to be made my friends! Written 6 months after purchase"
  ],
  "paras": [
    "Sign in ET 2025 Mentorship Master Options Trading with Simple Strategies and Insights 4.1 ( 156 ) Trading Unlock your full potential with real-time market insights, live trading sessions, proven strategies, and a supportive community designed to maximize your success.",
    "$50.00 / week 7 day trial Pay Join Join 62 members Features My Full Trading System (Step-by-Step) Exclusive Video Library &amp; Live Trade Breakdowns Daily Live Trading &amp; Watchlist Access Exclusive Access To Account Challenges Real-Time Entry &amp; Exits Reviews 4.13 out of 5 156 total reviews 5 stars 4 stars 3 stars 2 stars 1 star J Jon? 7 months ago Great call outs and alerts, premium membership give you faster calls and alerts and more learning resources. Great Course.",
    "7 months ago Where do i even start Everest trading has been incredible for me over the last 3 months. I started trading 6 months ago and was -$1500 and over the last 3 months i have made $5000 at the age of 16 years old not only are the alerts amazing in the morning but the Edu in the whop has taught me so much ...",
    "Written 1 month after purchase SR Sergio Ramirez 1 year ago I have the lifetime access and his callouts are legit. He also teaches you his strategy and psychology. Im proud to say ive been able to make a lot of money at just 18 years old with this course.",
    "1 year ago Great call outs by OptionsBuffett, excellent breakout strategy, lots on money to be made my friends!",
    "About the creator ET View profile Everest Trading @ indicativewretch6fe1 • Joined Aug 2022 At Everest Trading, We Prioritize our members by doing exclusive account challenges to help grow small accounts... I (Everest Founder) post Recaps of high-quality trades and videos showing my strategy. You will also be able to see exactly when I ENTER and EXIT a trade in real-time. You will also be able to see exactly what long-term holdings I have and receive updates on when I sell them. FAQs What is included in the Lifetime Membership? How can I get support if I have questions? Affiliates ET Become an affiliate Everest Trading 30% reward Earn money by bringing customers to Everest Trading. Every time a customer purchases using your link, you&#x27;ll earn a commission."
  ],
  "priceTokens": [
    "$50.00",
    "$150",
    "$500",
    "$50.00",
    "$50.00",
    "$1",
    "$1",
    "$1",
    "$22",
    "$1",
    "$1",
    "$1",
    "$1",
    "$1",
    "$2",
    "$1",
    "$2",
    "$2",
    "$2",
    "$2"
  ],
  "faq": [],
  "textSample": "2025 Mentorship | Whop Sign in ET 2025 Mentorship Master Options Trading with Simple Strategies and Insights 4.1 ( 156 ) Trading Unlock your full potential with real-time market insights, live trading sessions, proven strategies, and a supportive community designed to maximize your success. $50.00 / week 7 day trial Pay Join Join 62 members Features My Full Trading System (Step-by-Step) Exclusive Video Library &amp; Live Trade Breakdowns Daily Live Trading &amp; Watchlist Access Exclusive Access To Account Challenges Real-Time Entry &amp; Exits Reviews 4.13 out of 5 156 total reviews 5 stars 4 stars 3 stars 2 stars 1 star J Jon? 7 months ago Great call outs and alerts, premium membership give you faster calls and alerts and more learning resources. Great Course. Written 1 year after purchase JC john castillo 7 months ago Where do i even start Everest trading has been incredible for me over the last 3 months. I started trading 6 months ago and was -$1500 and over the last 3 months i have made $5000 at the age of 16 years old not only are the alerts amazing in the morning but the Edu in the whop has taught me so much ... Show more Written 1 month after purchase SR Sergio Ramirez 1 year ago I have the lifetime access and his callouts are legit. He also teaches you his strategy and psychology. Im proud to say ive been able to make a lot of money at just 18 years old with this course. Written 5 months after purchase AR andrew rusinas 1 year ago Great call outs by OptionsBuffett, excellent breakout strategy, lots on money to be made my friends! Written 6 months after purchase See all reviews About the creator ET View profile Everest Trading @ indicativewretch6fe1 • Joined Aug 2022 At Everest Trading, We Prioritize our members by doing exclusive account challenges to help grow small accounts... I (Everest Founder) post Recaps of high-quality trades and videos showing my strategy. You will also be able to see exactly when I ENTER and EXIT a trade in real-time. You will also be able to see exactly what long-term holdings I have and receive updates on when I sell them. FAQs What is included in the Lifetime Membership? How can I get support if I have questions? Affiliates ET Become an affiliate Everest Trading 30% reward Earn money by bringing customers to Everest Trading. Every time a customer purchases using your link, you&#x27;ll earn a commission. 2025 Mentorship $50.00 / week +3 options Join $50.00 / week 3 options Pay Join Pay Join",
  "finalUrl": "https://whop.com/lifetime-membership-f2/everest-trading/",
  "fetchedAt": "2025-11-05T19:35:11.479Z",
  "textHash": "d860fddb277ab6f32650d685e537aa87742db7b7dc800f675dbfc910818d9335",
  "drilled": false
}