{
  "baseUrl": "https://whop.com/28club/28clubsignals/",
  "title": "28 Club Signals | Whop",
  "h1": "28 Club Signals",
  "bullets": [
    "Sign in CR 28 Club Signals GET READY TO RUN IT UP WITH THE 28 CLUB! 4.2 ( 15 ) Trading Join the 28 Club Signals Group: Your All-Access Pass to Weekly Winning Trades, Insider Education, and the Confidence to Dominate the Markets! - ALL SALES FINAL $980.00 / 45 days Pay Join Features 2-3 Quality Signals Weekly: Easily actionable, profitable trade ideas",
    "Prop Firm Mastery: Learn how to pass, fund, and scale with others&#x27; capital.",
    "LIVE TRADING WITH RUNITUP",
    "Signals only. No Market Codes or Letterology course. All sales final.",
    "O OX333 10 days ago Worth every penny, change your life Written 8 days after purchase",
    "FM Finn McKay 2 months ago I started in the signals group for a few months and made great profits with my funded accounts. A couple weeks ago I also got the full 28 Club membership and the value there is amazing as well. Both memberships tiers are incredible. üëç Written 17 days after purchase",
    "B Brianna 5 months ago I highly recommend this subscription. To put things in perspective I have 0 background in trading. All I figured out was how to put in the signals and the FIRST week I made the initial investment back and then some. *this is for the newbies in trading I only put in 1,500 to start out I would recomme... Show more Written 1 month after purchase",
    "üêÖ 9 months ago Great introduction and explanation of what to expect from the Club28 Written 1 day after purchase"
  ],
  "paras": [
    "Sign in CR 28 Club Signals GET READY TO RUN IT UP WITH THE 28 CLUB! 4.2 ( 15 ) Trading Join the 28 Club Signals Group: Your All-Access Pass to Weekly Winning Trades, Insider Education, and the Confidence to Dominate the Markets! - ALL SALES FINAL",
    "2-3 Quality Signals Weekly: Easily actionable, profitable trade ideas Prop Firm Mastery: Learn how to pass, fund, and scale with others&#x27; capital. LIVE TRADING WITH RUNITUP Signals only. No Market Codes or Letterology course. All sales final. Reviews 4.20 out of 5 15 total reviews 5 stars 4 stars 3 stars 2 stars 1 star O OX333 10 days ago Worth every penny, change your life",
    "2 months ago I started in the signals group for a few months and made great profits with my funded accounts. A couple weeks ago I also got the full 28 Club membership and the value there is amazing as well. Both memberships tiers are incredible. üëç",
    "5 months ago I highly recommend this subscription. To put things in perspective I have 0 background in trading. All I figured out was how to put in the signals and the FIRST week I made the initial investment back and then some. *this is for the newbies in trading I only put in 1,500 to start out I would recomme...",
    "Written 1 month after purchase üêÖ 9 months ago Great introduction and explanation of what to expect from the Club28",
    "About the creator N View profile Noble @ nobleave ‚Ä¢ Joined May 2023 I‚Äôm Noble, the mind behind 28 Club, dedicated to helping traders master the markets with precision. My signals and strategies are built for serious traders who want to scale, pass prop firm challenges, and make consistent profits. With expert analysis and live trading, I provide the tools needed to trade with confidence and success. FAQs Why the 28 Club? Can anyone trade the codes? Is an NDA required? Affiliates CR Become an affiliate 28 Club with Runitup 8% reward Earn money by bringing customers to 28 Club with Runitup. Every time a customer purchases using your link, you&#x27;ll earn a commission."
  ],
  "priceTokens": [
    "$980.00",
    "$980.00",
    "$980.00",
    "$1",
    "$1",
    "$1",
    "$22",
    "$1",
    "$1",
    "$1",
    "$1",
    "$1",
    "$2",
    "$1",
    "$2",
    "$2",
    "$2",
    "$2",
    "$3",
    "$3"
  ],
  "faq": [],
  "textSample": "Sign in CR 28 Club Signals GET READY TO RUN IT UP WITH THE 28 CLUB! 4.2 ( 15 ) Trading Join the 28 Club Signals Group: Your All-Access Pass to Weekly Winning Trades, Insider Education, and the Confidence to Dominate the Markets! - ALL SALES FINAL $980.00 / 45 days Pay Join Features 2-3 Quality Signals Weekly: Easily actionable, profitable trade ideas Prop Firm Mastery: Learn how to pass, fund, and scale with others&#x27; capital. LIVE TRADING WITH RUNITUP Signals only. No Market Codes or Letterology course. All sales final. Reviews 4.20 out of 5 15 total reviews 5 stars 4 stars 3 stars 2 stars 1 star O OX333 10 days ago Worth every penny, change your life Written 8 days after purchase FM Finn McKay 2 months ago I started in the signals group for a few months and made great profits with my funded accounts. A couple weeks ago I also got the full 28 Club membership and the value there is amazing as well. Both memberships tiers are incredible. üëç Written 17 days after purchase B Brianna 5 months ago I highly recommend this subscription. To put things in perspective I have 0 background in trading. All I figured out was how to put in the signals and the FIRST week I made the initial investment back and then some. *this is for the newbies in trading I only put in 1,500 to start out I would recomme... Show more Written 1 month after purchase üêÖ 9 months ago Great introduction and explanation of what to expect from the Club28 Written 1 day after purchase See all reviews About the creator N View profile Noble @ nobleave ‚Ä¢ Joined May 2023 I‚Äôm Noble, the mind behind 28 Club, dedicated to helping traders master the markets with precision. My signals and strategies are built for serious traders who want to scale, pass prop firm challenges, and make consistent profits. With expert analysis and live trading, I provide the tools needed to trade with confidence and success. FAQs Why the 28 Club? Can anyone trade the codes? Is an NDA required? Affiliates CR Become an affiliate 28 Club with Runitup 8% reward Earn money by bringing customers to 28 Club with Runitup. Every time a customer purchases using your link, you&#x27;ll earn a commission. 28 Club Signals $980.00 / 45 days Join $980.00 / 45 days Pay Join Pay Join 28 Club Signals | Whop",
  "finalUrl": "https://whop.com/28club/28clubsignals/",
  "fetchedAt": "2025-11-05T19:30:39.127Z",
  "textHash": "55e6afdf9fff5d76837f15a8858bdba3c48cc103120671b77c5cc52501e4d2ff",
  "drilled": false
}