{
  "baseUrl": "https://whop.com/rospicks/weekly-premium-access-cb/",
  "title": "3 Days - Premium Access | Whop",
  "h1": "3 Days - Premium Access",
  "bullets": [
    "Sign in R 3 Days - Premium Access Join the Best Sports Betting Community 4.8 ( 79 ) Sports betting Join RosPicks for expert sports betting tips, daily slips, and a thriving community. Huge Profit monthly with NBA, NHL, NFL, MLB, MLS, and E-Sports insights. $10.00 / 3 days Pay Join Join 4 members Features 5-10 daily slips with in-depth analysis and explanations.",
    "Access to NBA, NHL, NFL, MLB, MLS, and E-Sports insights.",
    "24/7 community chat with expert cappers and fellow bettors.",
    "Bankroll management tips for long-term profitability.",
    "Early access to plays and strategic betting advice.",
    "TA Tj Ashford 1 month ago great Written 2 years after purchase",
    "C carlgonda 8 months ago No doubt @Ridpicks does his homework, can‚Äôt go wrong with his picks ü§ù Written 11 days after purchase",
    "EG Erick Galdamez 8 months ago Went 5-0 last night using 4/5 of RidPicks Plays. On the 5 man I did I combined 3/5 players were his picks and I added two players I thought were good lines using pickfinder and every single damn play hit. Last night was my first time ever using the premium üî•. What‚Äôs a little monthly subscription wh... Show more Written 1 day after purchase",
    "MM Michael Mejorada 8 months ago Just joined last night and placed the first best today and already made my money back in the same day a little then what I invested I highly recommend @Ridpicks for the win üèÜüçÄüí∞ Written 1 day after purchase"
  ],
  "paras": [
    "Sign in R 3 Days - Premium Access Join the Best Sports Betting Community 4.8 ( 79 ) Sports betting Join RosPicks for expert sports betting tips, daily slips, and a thriving community. Huge Profit monthly with NBA, NHL, NFL, MLB, MLS, and E-Sports insights.",
    "Join 4 members Features 5-10 daily slips with in-depth analysis and explanations. Access to NBA, NHL, NFL, MLB, MLS, and E-Sports insights. 24/7 community chat with expert cappers and fellow bettors. Bankroll management tips for long-term profitability. Early access to plays and strategic betting advice. Reviews 4.85 out of 5 79 total reviews 5 stars 4 stars 3 stars 2 stars 1 star TA Tj Ashford 1 month ago great",
    "8 months ago No doubt @Ridpicks does his homework, can‚Äôt go wrong with his picks ü§ù",
    "8 months ago Went 5-0 last night using 4/5 of RidPicks Plays. On the 5 man I did I combined 3/5 players were his picks and I added two players I thought were good lines using pickfinder and every single damn play hit. Last night was my first time ever using the premium üî•. What‚Äôs a little monthly subscription wh...",
    "Written 1 day after purchase MM Michael Mejorada 8 months ago Just joined last night and placed the first best today and already made my money back in the same day a little then what I invested I highly recommend @Ridpicks for the win üèÜüçÄüí∞",
    "About the creator K View profile kingros_ @ kingros ‚Ä¢ Joined Nov 2023 I&#x27;ve dedicated my life to mastering sports betting, focusing on quality picks and community engagement. My goal is to help members profit consistently while enjoying the process. FAQs How Many Slips Do I Post Daily? How Do I Gain Access To The Server? Affiliates R Become an affiliate RosPicks 30% reward Earn money by bringing customers to RosPicks. Every time a customer purchases using your link, you&#x27;ll earn a commission."
  ],
  "priceTokens": [
    "$10.00",
    "$10.00",
    "$10.00",
    "$1",
    "$1",
    "$1",
    "$22",
    "$1",
    "$1",
    "$1",
    "$1",
    "$1",
    "$2",
    "$1",
    "$2",
    "$2",
    "$2",
    "$2",
    "$3",
    "$3"
  ],
  "faq": [],
  "textSample": "Sign in R 3 Days - Premium Access Join the Best Sports Betting Community 4.8 ( 79 ) Sports betting Join RosPicks for expert sports betting tips, daily slips, and a thriving community. Huge Profit monthly with NBA, NHL, NFL, MLB, MLS, and E-Sports insights. $10.00 / 3 days Pay Join Join 4 members Features 5-10 daily slips with in-depth analysis and explanations. Access to NBA, NHL, NFL, MLB, MLS, and E-Sports insights. 24/7 community chat with expert cappers and fellow bettors. Bankroll management tips for long-term profitability. Early access to plays and strategic betting advice. Reviews 4.85 out of 5 79 total reviews 5 stars 4 stars 3 stars 2 stars 1 star TA Tj Ashford 1 month ago great Written 2 years after purchase C carlgonda 8 months ago No doubt @Ridpicks does his homework, can‚Äôt go wrong with his picks ü§ù Written 11 days after purchase EG Erick Galdamez 8 months ago Went 5-0 last night using 4/5 of RidPicks Plays. On the 5 man I did I combined 3/5 players were his picks and I added two players I thought were good lines using pickfinder and every single damn play hit. Last night was my first time ever using the premium üî•. What‚Äôs a little monthly subscription wh... Show more Written 1 day after purchase MM Michael Mejorada 8 months ago Just joined last night and placed the first best today and already made my money back in the same day a little then what I invested I highly recommend @Ridpicks for the win üèÜüçÄüí∞ Written 1 day after purchase See all reviews About the creator K View profile kingros_ @ kingros ‚Ä¢ Joined Nov 2023 I&#x27;ve dedicated my life to mastering sports betting, focusing on quality picks and community engagement. My goal is to help members profit consistently while enjoying the process. FAQs How Many Slips Do I Post Daily? How Do I Gain Access To The Server? Affiliates R Become an affiliate RosPicks 30% reward Earn money by bringing customers to RosPicks. Every time a customer purchases using your link, you&#x27;ll earn a commission. 3 Days - Premium Access $10.00 / 3 days Join $10.00 / 3 days Pay Join Pay Join 3 Days - Premium Access | Whop",
  "finalUrl": "https://whop.com/rospicks/weekly-premium-access-cb/",
  "fetchedAt": "2025-11-05T19:39:55.117Z",
  "textHash": "9d69b21bc0b6ac6a1654ac149a84ce9dfbf674e0db12f3b559f6030599ebb8d3",
  "drilled": false
}