{
  "baseUrl": "https://whop.com/codycoverspreads/3-day-vip-all-access/",
  "title": "3 DAY VIP ALL ACCESS | Whop",
  "h1": "3 DAY VIP ALL ACCESS",
  "bullets": [
    "Sign in C 3 DAY VIP ALL ACCESS Win more bets through Cody&#x27;s exclusive plays and analysis 4.4 ( 531 ) Other Tail the GOAT of sports betting today! $199.99 / 3 days Pay Join Features ALL STRAIGHT BETS DAILY ðŸ”¥",
    "ALL WHALE BETS DAILYðŸ”¥",
    "ALL PARLAYS DAILY ðŸ”¥",
    "NBA / NCAAB / NFL / NCAAF / NHL &amp; MLBðŸ”¥",
    "1 on 1 customer supportðŸ”¥",
    "C Cmedz 10 days ago Havenâ€™t wonâ€™t yet but keeping good faith one will hit Written 1 day after purchase",
    "D Derek 11 days ago I need my refund it just got taken out of my account out of nowhere Written 2 days after purchase",
    "19 days ago Too the moon ðŸŒ– Written 6 months after purchase",
    "M Matt 24 days ago Great app. 5 stars across the board Written 16 days after purchase"
  ],
  "paras": [
    "Sign in C 3 DAY VIP ALL ACCESS Win more bets through Cody&#x27;s exclusive plays and analysis 4.4 ( 531 ) Other Tail the GOAT of sports betting today!",
    "ALL STRAIGHT BETS DAILY ðŸ”¥ ALL WHALE BETS DAILYðŸ”¥ ALL PARLAYS DAILY ðŸ”¥ NBA / NCAAB / NFL / NCAAF / NHL &amp; MLBðŸ”¥ 1 on 1 customer supportðŸ”¥ Reviews 4.36 out of 5 531 total reviews 5 stars 4 stars 3 stars 2 stars 1 star C Cmedz 10 days ago Havenâ€™t wonâ€™t yet but keeping good faith one will hit",
    "11 days ago I need my refund it just got taken out of my account out of nowhere",
    "19 days ago Too the moon ðŸŒ–",
    "24 days ago Great app. 5 stars across the board",
    "About the creator C View profile Codycoversspreads @ coversznpayments â€¢ Joined Jan 2024 I&#x27;ve been betting professionally for over 5 years, developing a 76% win rate and a 220% ROI on parlays. My passion is to help others succeed in sports betting through my exclusive plays and analysis. FAQs How long has Cody been betting professionally for? If this is my first time tailing Cody, which package should I check out? If I have general questions or need help, where can I reach out? Affiliates C Become an affiliate Codycoverspreads 30% reward Earn money by bringing customers to Codycoverspreads. Every time a customer purchases using your link, you&#x27;ll earn a commission."
  ],
  "priceTokens": [
    "$199.99",
    "$199.99",
    "$199.99",
    "$1",
    "$1",
    "$1",
    "$22",
    "$1",
    "$1",
    "$1",
    "$1",
    "$1",
    "$2",
    "$1",
    "$2",
    "$2",
    "$2",
    "$2",
    "$3",
    "$3"
  ],
  "faq": [],
  "textSample": "Sign in C 3 DAY VIP ALL ACCESS Win more bets through Cody&#x27;s exclusive plays and analysis 4.4 ( 531 ) Other Tail the GOAT of sports betting today! $199.99 / 3 days Pay Join Features ALL STRAIGHT BETS DAILY ðŸ”¥ ALL WHALE BETS DAILYðŸ”¥ ALL PARLAYS DAILY ðŸ”¥ NBA / NCAAB / NFL / NCAAF / NHL &amp; MLBðŸ”¥ 1 on 1 customer supportðŸ”¥ Reviews 4.36 out of 5 531 total reviews 5 stars 4 stars 3 stars 2 stars 1 star C Cmedz 10 days ago Havenâ€™t wonâ€™t yet but keeping good faith one will hit Written 1 day after purchase D Derek 11 days ago I need my refund it just got taken out of my account out of nowhere Written 2 days after purchase 19 days ago Too the moon ðŸŒ– Written 6 months after purchase M Matt 24 days ago Great app. 5 stars across the board Written 16 days after purchase See all reviews About the creator C View profile Codycoversspreads @ coversznpayments â€¢ Joined Jan 2024 I&#x27;ve been betting professionally for over 5 years, developing a 76% win rate and a 220% ROI on parlays. My passion is to help others succeed in sports betting through my exclusive plays and analysis. FAQs How long has Cody been betting professionally for? If this is my first time tailing Cody, which package should I check out? If I have general questions or need help, where can I reach out? Affiliates C Become an affiliate Codycoverspreads 30% reward Earn money by bringing customers to Codycoverspreads. Every time a customer purchases using your link, you&#x27;ll earn a commission. 3 DAY VIP ALL ACCESS $199.99 / 3 days Join $199.99 / 3 days Pay Join Pay Join 3 DAY VIP ALL ACCESS | Whop",
  "finalUrl": "https://whop.com/codycoverspreads/3-day-vip-all-access/",
  "fetchedAt": "2025-11-05T19:42:33.452Z",
  "textHash": "4b830f00e92d8c26e8b72162d2d53dfa1abc481caf5b5f68732ca28f3dd248fb",
  "drilled": false
}