{
  "baseUrl": "https://whop.com/monthly-ae-e7fc/3-day-free-trial-27/",
  "title": "3 Day Free Trial | Whop",
  "h1": "3 Day Free Trial",
  "bullets": [
    "Sign in Unmute Unmute FI 3 Day Free Trial Learn to trade from the best 5.0 ( 2 ) Other Trade and go live with the team for 3 days. Automatic recurring payments will start afterwards $147.00 / month 3 day trial Pay Join Join 2 members Features Live Trading Daily",
    "Live nightly review with Fit and K5",
    "Sunday Stocks &amp; Coffee",
    "EH Emin hamzic 1 year ago Amazing group of individuals, sharing teaching and supporting the community every single day. Written 5 months after purchase",
    "B BruceP 22 days ago Written 2 months after purchase"
  ],
  "paras": [
    "Sign in Unmute Unmute FI 3 Day Free Trial Learn to trade from the best 5.0 ( 2 ) Other Trade and go live with the team for 3 days. Automatic recurring payments will start afterwards",
    "3 day trial Pay Join Join 2 members Features Live Trading Daily Live nightly review with Fit and K5 Sunday Stocks &amp; Coffee Reviews 5 out of 5 2 total reviews 5 stars 4 stars 3 stars 2 stars 1 star EH Emin hamzic 1 year ago Amazing group of individuals, sharing teaching and supporting the community every single day.",
    "22 days ago",
    "FAQs What is included in the Stocks &amp; Options Course? How often are the live sessions held? Affiliates FI Become an affiliate First Team Investing 30% reward Earn money by bringing customers to First Team Investing. Every time a customer purchases using your link, you&#x27;ll earn a commission."
  ],
  "priceTokens": [
    "$147.00",
    "$147.00",
    "$147.00",
    "$1",
    "$1",
    "$1",
    "$22",
    "$1",
    "$1",
    "$1",
    "$1",
    "$1",
    "$2",
    "$1",
    "$2",
    "$2",
    "$2",
    "$2",
    "$3",
    "$3"
  ],
  "faq": [],
  "textSample": "Sign in Unmute Unmute FI 3 Day Free Trial Learn to trade from the best 5.0 ( 2 ) Other Trade and go live with the team for 3 days. Automatic recurring payments will start afterwards $147.00 / month 3 day trial Pay Join Join 2 members Features Live Trading Daily Live nightly review with Fit and K5 Sunday Stocks &amp; Coffee Reviews 5 out of 5 2 total reviews 5 stars 4 stars 3 stars 2 stars 1 star EH Emin hamzic 1 year ago Amazing group of individuals, sharing teaching and supporting the community every single day. Written 5 months after purchase B BruceP 22 days ago Written 2 months after purchase About the creator FI View profile First Team Investing @ firstteaminvesting â€¢ Joined Apr 2024 I&#x27;ve dedicated my career to mastering the art of investing and trading. With First Team Investing, I aim to share my knowledge and experiences to help others unlock their financial potential and achieve abundance. FAQs What is included in the Stocks &amp; Options Course? How often are the live sessions held? Affiliates FI Become an affiliate First Team Investing 30% reward Earn money by bringing customers to First Team Investing. Every time a customer purchases using your link, you&#x27;ll earn a commission. 3 Day Free Trial $147.00 / month Join $147.00 / month Pay Join Pay Join 3 Day Free Trial | Whop",
  "finalUrl": "https://whop.com/monthly-ae-e7fc/3-day-free-trial-27/",
  "fetchedAt": "2025-11-05T19:41:23.359Z",
  "textHash": "c2193859f72192ec2e8616b595ba96849761672e5e0da21de5b56e97daba3a89",
  "drilled": false
}