{
  "baseUrl": "https://whop.com/everyday-live-stream/3-model-workshop/",
  "title": "3 model workshop | Whop",
  "h1": "3 model workshop",
  "bullets": [
    "Sign in LH 3 model workshop Learn Hydra&#x27;s Basic to Advance model 4.8 ( 371 ) Trading in this workshop you will get 11+ hours of content from basic to advance. Learn in details how I trade with &quot;MACRO&quot; &amp; my 3 models : Breaker, Inversion &amp; turtle Soup. $150.00 one-time purchase Pay Join Features learn all about Macro from basic to advance",
    "learn all about Breaker, Inversion &amp; Turtle soup from basic to advance",
    "11+ hours of content with LIVE backtesting session",
    "EK Ephraim Kahanu 1 month ago Not disappointed at all,Hydra is a great mentor Written 6 months after purchase",
    "JR Jorge Cristián Riquelme 1 month ago Excelente mentor Written 1 year after purchase",
    "MA Marcello Assis 2 months ago Great mentor. Thanks Sir Written 4 months after purchase",
    "TA Thameem Ansari 2 months ago Allahumma barik Hydra !! I actually get to know to remive the noises on the charts and i can only focus on your teachings andthe bias part and the stream trades. Eventually i started growing as well kn psychology and risk management. Hoping to stay with you till last Hydra bro ! Written 19 days after purchase"
  ],
  "paras": [
    "Sign in LH 3 model workshop Learn Hydra&#x27;s Basic to Advance model 4.8 ( 371 ) Trading in this workshop you will get 11+ hours of content from basic to advance. Learn in details how I trade with &quot;MACRO&quot; &amp; my 3 models : Breaker, Inversion &amp; turtle Soup.",
    "learn all about Macro from basic to advance learn all about Breaker, Inversion &amp; Turtle soup from basic to advance 11+ hours of content with LIVE backtesting session Reviews 4.81 out of 5 371 total reviews 5 stars 4 stars 3 stars 2 stars 1 star EK Ephraim Kahanu 1 month ago Not disappointed at all,Hydra is a great mentor",
    "1 month ago Excelente mentor",
    "2 months ago Great mentor. Thanks Sir",
    "2 months ago Allahumma barik Hydra !! I actually get to know to remive the noises on the charts and i can only focus on your teachings andthe bias part and the stream trades. Eventually i started growing as well kn psychology and risk management. Hoping to stay with you till last Hydra bro !",
    "About the creator TA View profile Thahmid Hasan Anas @ user5f602858762 • Joined Feb 2024 Hi, I&#x27;m Hydra, ICT trader with over 4 years of experience using ICT concepts. For the past 2 years, I’ve been live-streaming my trades and consistently achieving a win rate of 60-80%. Join me &amp; 1000+ members every morning as I teach you to master patience &amp; risk management using my top models, &quot;Inversion&quot; &amp; &quot;Breaker.&quot; See you soon! FAQs Whats the stream schadule ? On which pair you offer signals? whats your winrate ? Whats the refund policy? Affiliates LH Become an affiliate Livestream Everyday with HYDRA 30% reward Earn money by bringing customers to Livestream Everyday with HYDRA. Every time a customer purchases using your link, you&#x27;ll earn a commission."
  ],
  "priceTokens": [
    "$150.00",
    "$150.00",
    "$150.00",
    "$1",
    "$1",
    "$1",
    "$22",
    "$1",
    "$1",
    "$1",
    "$1",
    "$1",
    "$2",
    "$1",
    "$2",
    "$2",
    "$2",
    "$2",
    "$3",
    "$3"
  ],
  "faq": [],
  "textSample": "Sign in LH 3 model workshop Learn Hydra&#x27;s Basic to Advance model 4.8 ( 371 ) Trading in this workshop you will get 11+ hours of content from basic to advance. Learn in details how I trade with &quot;MACRO&quot; &amp; my 3 models : Breaker, Inversion &amp; turtle Soup. $150.00 one-time purchase Pay Join Features learn all about Macro from basic to advance learn all about Breaker, Inversion &amp; Turtle soup from basic to advance 11+ hours of content with LIVE backtesting session Reviews 4.81 out of 5 371 total reviews 5 stars 4 stars 3 stars 2 stars 1 star EK Ephraim Kahanu 1 month ago Not disappointed at all,Hydra is a great mentor Written 6 months after purchase JR Jorge Cristián Riquelme 1 month ago Excelente mentor Written 1 year after purchase MA Marcello Assis 2 months ago Great mentor. Thanks Sir Written 4 months after purchase TA Thameem Ansari 2 months ago Allahumma barik Hydra !! I actually get to know to remive the noises on the charts and i can only focus on your teachings andthe bias part and the stream trades. Eventually i started growing as well kn psychology and risk management. Hoping to stay with you till last Hydra bro ! Written 19 days after purchase See all reviews About the creator TA View profile Thahmid Hasan Anas @ user5f602858762 • Joined Feb 2024 Hi, I&#x27;m Hydra, ICT trader with over 4 years of experience using ICT concepts. For the past 2 years, I’ve been live-streaming my trades and consistently achieving a win rate of 60-80%. Join me &amp; 1000+ members every morning as I teach you to master patience &amp; risk management using my top models, &quot;Inversion&quot; &amp; &quot;Breaker.&quot; See you soon! FAQs Whats the stream schadule ? On which pair you offer signals? whats your winrate ? Whats the refund policy? Affiliates LH Become an affiliate Livestream Everyday with HYDRA 30% reward Earn money by bringing customers to Livestream Everyday with HYDRA. Every time a customer purchases using your link, you&#x27;ll earn a commission. 3 model workshop $150.00 one-time purchase Join $150.00 one-time purchase Pay Join Pay Join 3 model workshop | Whop",
  "finalUrl": "https://whop.com/everyday-live-stream/3-model-workshop/",
  "fetchedAt": "2025-11-05T19:36:28.868Z",
  "textHash": "ee52b4d13b0ae6bd83b83a535a981bb7857522bb03e2dc85cff2200f067c3638",
  "drilled": false
}