{
  "baseUrl": "https://whop.com/4-leaf-clovers/?a=alexburnett21",
  "title": "Clover Trading | Whop",
  "h1": "Clover Trading",
  "bullets": [
    "Powered by CT Clover Trading We are Clover Trading. What sets us apart is that all of our educators, Kyle (middle), Dom(Left), and Huddie(Right), are seven-figure traders with third-party verified track records. At Clover Trading... More 4.7 ( 19 ) Contact seller Products Unmute $250.00 / month Exclusive Trade Alerts, Live Trading, And Watch Lists 4 Leaf Clover 4.9 ( 7 ) Unmute $125.00 / month Unlock Premium Alerts And Watch List 3 Leaf Clover 5.0 ( 2 ) Unmute $100.00 Unlock Different Courses Clover Courses New Unmute $6,500.00 / year Transform Your Trading with Black Clover Black Clover New Contact seller Reviews DA Daniel Abernathy 14 days ago The best trading decision I've made was joining the 4 leaf. The captains are great, as well as the community in the Discord. Written 25 days after purchase",
    "GZ Giordan Zeas 8 months ago Worth it! great for beginners for sure! Written 2 hours after purchase",
    "JD Jordan Dodds • 4 Leaf Clover 9 months ago (4 leaf subscriber) Great community/discord, a lot of value here with the automated custom alerts as well as the daily watchlist and frequent updates from the team. The content itself is endless (in a good way) and packed with value + the competency of the guys in what they do, the passion they hav... Show more Written 1 day after purchase",
    "AH Anders Heier 9 months ago Great for beginners Written 17 hours after purchase"
  ],
  "paras": [
    "CT Clover Trading We are Clover Trading. What sets us apart is that all of our educators, Kyle (middle), Dom(Left), and Huddie(Right), are seven-figure traders with third-party verified track records. At Clover Trading... More 4.7 ( 19 ) Contact seller Products Unmute $250.00 / month Exclusive Trade Alerts, Live Trading, And Watch Lists 4 Leaf Clover 4.9 ( 7 ) Unmute $125.00 / month Unlock Premium Alerts And Watch List 3 Leaf Clover 5.0 ( 2 ) Unmute $100.00 Unlock Different Courses Clover Courses New Unmute $6,500.00 / year Transform Your Trading with Black Clover Black Clover New Contact seller Reviews DA Daniel Abernathy 14 days ago The best trading decision I've made was joining the 4 leaf. The captains are great, as well as the community in the Discord.",
    "8 months ago Worth it! great for beginners for sure!",
    "9 months ago (4 leaf subscriber) Great community/discord, a lot of value here with the automated custom alerts as well as the daily watchlist and frequent updates from the team. The content itself is endless (in a good way) and packed with value + the competency of the guys in what they do, the passion they hav...",
    "Written 1 day after purchase AH Anders Heier 9 months ago Great for beginners"
  ],
  "priceTokens": [
    "$250.00",
    "$125.00",
    "$100.00",
    "$6,500.00",
    "$1",
    "$1",
    "$1",
    "$21",
    "$1",
    "$1",
    "$1",
    "$1",
    "$28",
    "$1",
    "$28",
    "$28",
    "$28",
    "$28",
    "$3",
    "$3"
  ],
  "faq": [],
  "textSample": "Powered by CT Clover Trading We are Clover Trading. What sets us apart is that all of our educators, Kyle (middle), Dom(Left), and Huddie(Right), are seven-figure traders with third-party verified track records. At Clover Trading... More 4.7 ( 19 ) Contact seller Products Unmute $250.00 / month Exclusive Trade Alerts, Live Trading, And Watch Lists 4 Leaf Clover 4.9 ( 7 ) Unmute $125.00 / month Unlock Premium Alerts And Watch List 3 Leaf Clover 5.0 ( 2 ) Unmute $100.00 Unlock Different Courses Clover Courses New Unmute $6,500.00 / year Transform Your Trading with Black Clover Black Clover New Contact seller Reviews DA Daniel Abernathy 14 days ago The best trading decision I've made was joining the 4 leaf. The captains are great, as well as the community in the Discord. Written 25 days after purchase GZ Giordan Zeas 8 months ago Worth it! great for beginners for sure! Written 2 hours after purchase JD Jordan Dodds • 4 Leaf Clover 9 months ago (4 leaf subscriber) Great community/discord, a lot of value here with the automated custom alerts as well as the daily watchlist and frequent updates from the team. The content itself is endless (in a good way) and packed with value + the competency of the guys in what they do, the passion they hav... Show more Written 1 day after purchase AH Anders Heier 9 months ago Great for beginners Written 17 hours after purchase See all reviews Clover Trading | Whop",
  "finalUrl": "https://whop.com/4-leaf-clovers/?a=alexburnett21",
  "fetchedAt": "2025-11-04T21:41:04.184Z",
  "textHash": "46d7a0c4e5f2f5a284e5d909567d4049bf44bd3aceaac5f1c30b0cf4c08e44ac",
  "drilled": false
}