{
  "baseUrl": "https://whop.com/60-day-ab-strength-for-golfers/60-day-ab-strength-for-golfers/?a=alexburnett21",
  "title": "60-Day Ab Strength for Golfers | Whop",
  "h1": "60-Day Ab Strength for Golfers",
  "bullets": [
    "Sign in AG 60-Day Ab Strength for Golfers Build a strong core to keep your back healthy on the course! 5.0 ( 2 ) Other Follow a structured 60-day plan to build core strength and prevent back pain. Start with an assessment, build a foundation, progress steadily, and play your round pain free. $99.00 for 1 year Pay Purchase Features Stronger Core",
    "Less Back Pain",
    "Better Golf Form",
    "Easy Routine",
    "CS Calvin Somers 6 months ago Honestly looking through the program it is laid a great and appears to be very informative. Looking forward to eliminate my back pain! Written 6 minutes after purchase",
    "J Jake 6 months ago Great product. Definitely helped my back and my swing. Can’t be more appreciative. Would definitely recommend! Written 1 day after purchase"
  ],
  "paras": [
    "Sign in AG 60-Day Ab Strength for Golfers Build a strong core to keep your back healthy on the course! 5.0 ( 2 ) Other Follow a structured 60-day plan to build core strength and prevent back pain. Start with an assessment, build a foundation, progress steadily, and play your round pain free.",
    "Stronger Core Less Back Pain Better Golf Form Easy Routine Reviews 5 out of 5 2 total reviews 5 stars 4 stars 3 stars 2 stars 1 star CS Calvin Somers 6 months ago Honestly looking through the program it is laid a great and appears to be very informative. Looking forward to eliminate my back pain!",
    "6 months ago Great product. Definitely helped my back and my swing. Can’t be more appreciative. Would definitely recommend!",
    "FAQs Who is this plan for? Do I need special equipment? How long is the plan? Will this improve my golf game? Affiliates AG Become an affiliate 60-Day Ab Strength for Golfers 30% reward Earn money by bringing customers to 60-Day Ab Strength for Golfers. Every time a customer purchases using your link, you&#x27;ll earn a commission."
  ],
  "priceTokens": [
    "$99.00",
    "$99.00",
    "$99.00",
    "$1",
    "$1",
    "$1",
    "$23",
    "$1",
    "$1",
    "$1",
    "$1",
    "$1",
    "$2",
    "$1",
    "$2",
    "$2",
    "$2",
    "$2",
    "$3",
    "$3"
  ],
  "faq": [],
  "textSample": "Sign in AG 60-Day Ab Strength for Golfers Build a strong core to keep your back healthy on the course! 5.0 ( 2 ) Other Follow a structured 60-day plan to build core strength and prevent back pain. Start with an assessment, build a foundation, progress steadily, and play your round pain free. $99.00 for 1 year Pay Purchase Features Stronger Core Less Back Pain Better Golf Form Easy Routine Reviews 5 out of 5 2 total reviews 5 stars 4 stars 3 stars 2 stars 1 star CS Calvin Somers 6 months ago Honestly looking through the program it is laid a great and appears to be very informative. Looking forward to eliminate my back pain! Written 6 minutes after purchase J Jake 6 months ago Great product. Definitely helped my back and my swing. Can’t be more appreciative. Would definitely recommend! Written 1 day after purchase About the creator CS View profile Calvin Somers @ calsomers • Joined Apr 2025 A golfer who struggled with back pain for many years... Looking to help others eliminate back pain and avoid pills when playing the sport they love in golf. FAQs Who is this plan for? Do I need special equipment? How long is the plan? Will this improve my golf game? Affiliates AG Become an affiliate 60-Day Ab Strength for Golfers 30% reward Earn money by bringing customers to 60-Day Ab Strength for Golfers. Every time a customer purchases using your link, you&#x27;ll earn a commission. 60-Day Ab Strength for Golfers $99.00 for 1 year Purchase $99.00 for 1 year Pay Purchase Pay Purchase 60-Day Ab Strength for Golfers | Whop",
  "finalUrl": "https://whop.com/60-day-ab-strength-for-golfers/60-day-ab-strength-for-golfers/?a=alexburnett21",
  "fetchedAt": "2025-11-04T21:59:20.333Z",
  "textHash": "46221fbe950a9052a94c38819ee446d1d8d4c409a044c2f6c8434e20ffddb51b",
  "drilled": true
}