{
  "baseUrl": "https://whop.com/adt/gold-complete-package/",
  "title": "VIP GOLD COMPLETE | Whop",
  "h1": "VIP GOLD COMPLETE",
  "bullets": [
    "Sign in Unmute Unmute Unmute Unmute AL VIP GOLD COMPLETE VIP GOLD COMPLETE MEMBERSHIP 5.0 ( 442 ) Trading Stocks &amp; Options, VIP, Gold, Premium Lounge, Gold Break Out Rooms, Weekend Training, VIP Zoom Access 4am ET - 4pm ET, VIP Training Videos, Videos on Demand,, Hot Stock Picks, IPO Center, Earnings, Workshop Classes, Mastermind Classes, Trading View Indicators. All access with be delivered thru Discord $600.00 / month Pay Purchase Join 15 members Features Everything thats included in Premium, VIP plus more",
    "Access to exclusive workshop and training",
    "Thousands of hours of lessons for profitable trading",
    "Cutting-edge TradingView Indicators for a trading edge (Trading View Fees Exc)",
    "VIP Gold Lounge and Helpdesk support for premium members",
    "MK Mike Kaye 11 days ago Only twelve days in and have learned so much from Coach and the team. I have the Diamond membership and it's the best deal ever, you get access to everything. I'm not much on reading so Coach having so many very informative videos help me so much. I have been trading for two and a half years followi... Show more Written 15 days after purchase",
    "K Kyle 18 days ago I have progressively upgraded my membership as I go along and the diamond is by far the way to go. So much content and learning material to review. The mentorship classes are that much more personal, and the people teaching the class have a long background of trading in the stock market to deliver t... Show more Written 14 days after purchase",
    "JM Jeff Monroe 19 days ago Wow!!!!!! Written 14 days after purchase",
    "R RockinUSA 23 days ago Only been trading 5 months. This education is a great step forward in stock trading. Everyone here is so helpful in your trading journey. Written 5 months after purchase"
  ],
  "paras": [
    "Sign in Unmute Unmute Unmute Unmute AL VIP GOLD COMPLETE VIP GOLD COMPLETE MEMBERSHIP 5.0 ( 442 ) Trading Stocks &amp; Options, VIP, Gold, Premium Lounge, Gold Break Out Rooms, Weekend Training, VIP Zoom Access 4am ET - 4pm ET, VIP Training Videos, Videos on Demand,, Hot Stock Picks, IPO Center, Earnings, Workshop Classes, Mastermind Classes, Trading View Indicators. All access with be delivered thru Discord",
    "$600.00 / month Pay Purchase Join 15 members Features Everything thats included in Premium, VIP plus more Access to exclusive workshop and training Thousands of hours of lessons for profitable trading Cutting-edge TradingView Indicators for a trading edge (Trading View Fees Exc) VIP Gold Lounge and Helpdesk support for premium members Reviews 4.95 out of 5 442 total reviews 5 stars 4 stars 3 stars 2 stars 1 star MK Mike Kaye 11 days ago Only twelve days in and have learned so much from Coach and the team. I have the Diamond membership and it's the best deal ever, you get access to everything. I'm not much on reading so Coach having so many very informative videos help me so much. I have been trading for two and a half years followi...",
    "Written 15 days after purchase K Kyle 18 days ago I have progressively upgraded my membership as I go along and the diamond is by far the way to go. So much content and learning material to review. The mentorship classes are that much more personal, and the people teaching the class have a long background of trading in the stock market to deliver t...",
    "Written 14 days after purchase JM Jeff Monroe 19 days ago Wow!!!!!!",
    "23 days ago Only been trading 5 months. This education is a great step forward in stock trading. Everyone here is so helpful in your trading journey.",
    "About the creator CC View profile Chad Christian @ coachcwc • Joined Sep 2023 American Dream Trading is a leading stock market education platform with over 6,000 Discord and 11,000 WHOP members. Offering 12-hour daily live Zoom training, expert-led discussions, and curated stock picks, we empower traders with real-time insights and a vibrant community. Backed by 33 years of expertise and collaborative forums help members achieve financial success. Results may vary. Affiliates AL Become an affiliate American Dream Trading LLC 30% reward Earn money by bringing customers to American Dream Trading LLC. Every time a customer purchases using your link, you&#x27;ll earn a commission."
  ],
  "priceTokens": [
    "$600.00",
    "$600.00",
    "$600.00",
    "$1",
    "$1",
    "$1",
    "$22",
    "$1",
    "$1",
    "$1",
    "$1",
    "$1",
    "$2",
    "$1",
    "$2",
    "$2",
    "$2",
    "$2",
    "$3",
    "$3"
  ],
  "faq": [],
  "textSample": "Sign in Unmute Unmute Unmute Unmute AL VIP GOLD COMPLETE VIP GOLD COMPLETE MEMBERSHIP 5.0 ( 442 ) Trading Stocks &amp; Options, VIP, Gold, Premium Lounge, Gold Break Out Rooms, Weekend Training, VIP Zoom Access 4am ET - 4pm ET, VIP Training Videos, Videos on Demand,, Hot Stock Picks, IPO Center, Earnings, Workshop Classes, Mastermind Classes, Trading View Indicators. All access with be delivered thru Discord $600.00 / month Pay Purchase Join 15 members Features Everything thats included in Premium, VIP plus more Access to exclusive workshop and training Thousands of hours of lessons for profitable trading Cutting-edge TradingView Indicators for a trading edge (Trading View Fees Exc) VIP Gold Lounge and Helpdesk support for premium members Reviews 4.95 out of 5 442 total reviews 5 stars 4 stars 3 stars 2 stars 1 star MK Mike Kaye 11 days ago Only twelve days in and have learned so much from Coach and the team. I have the Diamond membership and it's the best deal ever, you get access to everything. I'm not much on reading so Coach having so many very informative videos help me so much. I have been trading for two and a half years followi... Show more Written 15 days after purchase K Kyle 18 days ago I have progressively upgraded my membership as I go along and the diamond is by far the way to go. So much content and learning material to review. The mentorship classes are that much more personal, and the people teaching the class have a long background of trading in the stock market to deliver t... Show more Written 14 days after purchase JM Jeff Monroe 19 days ago Wow!!!!!! Written 14 days after purchase R RockinUSA 23 days ago Only been trading 5 months. This education is a great step forward in stock trading. Everyone here is so helpful in your trading journey. Written 5 months after purchase See all reviews About the creator CC View profile Chad Christian @ coachcwc • Joined Sep 2023 American Dream Trading is a leading stock market education platform with over 6,000 Discord and 11,000 WHOP members. Offering 12-hour daily live Zoom training, expert-led discussions, and curated stock picks, we empower traders with real-time insights and a vibrant community. Backed by 33 years of expertise and collaborative forums help members achieve financial success. Results may vary. Affiliates AL Become an affiliate American Dream Trading LLC 30% reward Earn money by bringing customers to American Dream Trading LLC. Every time a customer purchases using your link, you&#x27;ll earn a commission. VIP GOLD COMPLETE $600.00 / month +5 options Purchase $600.00 / month 5 options Pay Purchase Pay Purchase VIP GOLD COMPLETE | Whop",
  "finalUrl": "https://whop.com/adt/gold-complete-package/",
  "fetchedAt": "2025-11-05T09:56:37.995Z",
  "textHash": "bc8d48a97883ed4ec94d37301f627f181b213f07268686e547961cb0c1bea0bc",
  "drilled": false
}