{
  "baseUrl": "https://whop.com/agency-domain/?a=alexburnett21",
  "title": "Agency Domain | Whop",
  "h1": "Agency Domain",
  "bullets": [
    "Powered by AD Agency Domain The right information and the right network have the power to transform any business... After generating over a billion dollars online, Eddie Maalouf, Zach Schubert, and Ashton Shanks came together to... More 5.0 ( 118 ) Contact seller Products Unmute $97.00 / month Free trial Join The Community Today - Try Free For 7 Days Agency Domain 5.0 ( 118 ) Invite Only $50k MRR Club New Unmute $990.00 2 years of hand written letters all compiled into one place Eddie&#x27;s Agency Secret Letters New Unmute $197.00 / month Each step my agency took to go from 50k to $2M a month AD Plus+ New Contact seller Reviews A Aslan • Agency Domain 4 months ago Very valuable group to be part of, especially for the price point it is at. Personally, I had bottlenecks around my fb ads and sales calls, which Ive received great feedback on. Their 80hr+ course filled with top industry leaders, is absolute gold. Written 16 days after purchase",
    "JD Josh Drylie • Agency Domain 8 months ago Super blown away by what agency domain has to offer. Each call comes with so much value, the hosts of each call over deliver to the max. The only reason somebody wouldn’t join is if they hate making money Written 14 days after purchase",
    "IR Iñaki Arteaga Ruiz • Agency Domain 8 months ago Just starting but enjoying so much the content of the course ♥️ Thank you guys. Written 11 days after purchase",
    "MD Mohamed Darwish • Agency Domain 8 months ago Just renewed my second month, I guess I will be here learning for at least the rest of this year. I couldn't find practical info elsewhere, there is no chance for comparison with any other community. Thank You Guys Written 1 month after purchase"
  ],
  "paras": [
    "AD Agency Domain The right information and the right network have the power to transform any business... After generating over a billion dollars online, Eddie Maalouf, Zach Schubert, and Ashton Shanks came together to... More 5.0 ( 118 ) Contact seller Products Unmute $97.00 / month Free trial Join The Community Today - Try Free For 7 Days Agency Domain 5.0 ( 118 ) Invite Only $50k MRR Club New Unmute $990.00 2 years of hand written letters all compiled into one place Eddie&#x27;s Agency Secret Letters New Unmute $197.00 / month Each step my agency took to go from 50k to $2M a month AD Plus+ New Contact seller Reviews A Aslan • Agency Domain 4 months ago Very valuable group to be part of, especially for the price point it is at. Personally, I had bottlenecks around my fb ads and sales calls, which Ive received great feedback on. Their 80hr+ course filled with top industry leaders, is absolute gold.",
    "8 months ago Super blown away by what agency domain has to offer. Each call comes with so much value, the hosts of each call over deliver to the max. The only reason somebody wouldn’t join is if they hate making money",
    "8 months ago Just starting but enjoying so much the content of the course ♥️ Thank you guys.",
    "8 months ago Just renewed my second month, I guess I will be here learning for at least the rest of this year. I couldn't find practical info elsewhere, there is no chance for comparison with any other community. Thank You Guys"
  ],
  "priceTokens": [
    "$97.00",
    "$50",
    "$990.00",
    "$197.00",
    "$2",
    "$1",
    "$1",
    "$1",
    "$21",
    "$1",
    "$1",
    "$1",
    "$1",
    "$28",
    "$1",
    "$28",
    "$28",
    "$28",
    "$28",
    "$3"
  ],
  "faq": [],
  "textSample": "Powered by AD Agency Domain The right information and the right network have the power to transform any business... After generating over a billion dollars online, Eddie Maalouf, Zach Schubert, and Ashton Shanks came together to... More 5.0 ( 118 ) Contact seller Products Unmute $97.00 / month Free trial Join The Community Today - Try Free For 7 Days Agency Domain 5.0 ( 118 ) Invite Only $50k MRR Club New Unmute $990.00 2 years of hand written letters all compiled into one place Eddie&#x27;s Agency Secret Letters New Unmute $197.00 / month Each step my agency took to go from 50k to $2M a month AD Plus+ New Contact seller Reviews A Aslan • Agency Domain 4 months ago Very valuable group to be part of, especially for the price point it is at. Personally, I had bottlenecks around my fb ads and sales calls, which Ive received great feedback on. Their 80hr+ course filled with top industry leaders, is absolute gold. Written 16 days after purchase JD Josh Drylie • Agency Domain 8 months ago Super blown away by what agency domain has to offer. Each call comes with so much value, the hosts of each call over deliver to the max. The only reason somebody wouldn’t join is if they hate making money Written 14 days after purchase IR Iñaki Arteaga Ruiz • Agency Domain 8 months ago Just starting but enjoying so much the content of the course ♥️ Thank you guys. Written 11 days after purchase MD Mohamed Darwish • Agency Domain 8 months ago Just renewed my second month, I guess I will be here learning for at least the rest of this year. I couldn't find practical info elsewhere, there is no chance for comparison with any other community. Thank You Guys Written 1 month after purchase See all reviews Agency Domain | Whop",
  "finalUrl": "https://whop.com/agency-domain/?a=alexburnett21",
  "fetchedAt": "2025-11-05T09:14:52.720Z",
  "textHash": "ca838d5ff40a33a748e26a23ffa22afb0f878174b2e25dd1ae990cfa947e9668",
  "drilled": false
}