{
  "baseUrl": "https://whop.com/adt/premium-adt/",
  "title": "PREMIUM | Whop",
  "h1": "PREMIUM",
  "bullets": [
    "Sign in Unmute Unmute Unmute Unmute AL PREMIUM Hundreds of Millions earned reported by members. Our vision: 1 BILLION 5.0 ( 442 ) Trading Stocks &amp; Options, Premium Lounge, Zoom Call 8:45am ET to 4pm ET, Videos on-Demand, IPO Center, Earnings, Hot Stock Picks, and Daily Trading Ideas. All access with be delivered thru Discord $125.00 / month 7 day trial Pay Purchase Join 74 members Features Access to the Discord paid members area for community interaction",
    "Daily real-time coaching, trading, and analysis with experts",
    "Thousands of hours of engaging educational content available",
    "Hot stock Picks and Market Trading Ideas",
    "IPOs &amp; Earnings Channel",
    "MK Mike Kaye 10 days ago Only twelve days in and have learned so much from Coach and the team. I have the Diamond membership and it's the best deal ever, you get access to everything. I'm not much on reading so Coach having so many very informative videos help me so much. I have been trading for two and a half years followi... Show more Written 15 days after purchase",
    "K Kyle 17 days ago I have progressively upgraded my membership as I go along and the diamond is by far the way to go. So much content and learning material to review. The mentorship classes are that much more personal, and the people teaching the class have a long background of trading in the stock market to deliver t... Show more Written 14 days after purchase",
    "JM Jeff Monroe 19 days ago Wow!!!!!! Written 14 days after purchase",
    "R RockinUSA 22 days ago Only been trading 5 months. This education is a great step forward in stock trading. Everyone here is so helpful in your trading journey. Written 5 months after purchase"
  ],
  "paras": [
    "Sign in Unmute Unmute Unmute Unmute AL PREMIUM Hundreds of Millions earned reported by members. Our vision: 1 BILLION 5.0 ( 442 ) Trading Stocks &amp; Options, Premium Lounge, Zoom Call 8:45am ET to 4pm ET, Videos on-Demand, IPO Center, Earnings, Hot Stock Picks, and Daily Trading Ideas. All access with be delivered thru Discord",
    "$125.00 / month 7 day trial Pay Purchase Join 74 members Features Access to the Discord paid members area for community interaction Daily real-time coaching, trading, and analysis with experts Thousands of hours of engaging educational content available Hot stock Picks and Market Trading Ideas IPOs &amp; Earnings Channel Reviews 4.95 out of 5 442 total reviews 5 stars 4 stars 3 stars 2 stars 1 star MK Mike Kaye 10 days ago Only twelve days in and have learned so much from Coach and the team. I have the Diamond membership and it's the best deal ever, you get access to everything. I'm not much on reading so Coach having so many very informative videos help me so much. I have been trading for two and a half years followi...",
    "Written 15 days after purchase K Kyle 17 days ago I have progressively upgraded my membership as I go along and the diamond is by far the way to go. So much content and learning material to review. The mentorship classes are that much more personal, and the people teaching the class have a long background of trading in the stock market to deliver t...",
    "Written 14 days after purchase JM Jeff Monroe 19 days ago Wow!!!!!!",
    "22 days ago Only been trading 5 months. This education is a great step forward in stock trading. Everyone here is so helpful in your trading journey."
  ],
  "priceTokens": [
    "$125.00",
    "$125.00",
    "$125.00",
    "$1",
    "$1",
    "$1",
    "$22",
    "$1",
    "$1",
    "$1",
    "$1",
    "$1",
    "$2",
    "$1",
    "$2",
    "$2",
    "$2",
    "$2",
    "$3",
    "$3"
  ],
  "faq": [],
  "textSample": "Sign in Unmute Unmute Unmute Unmute AL PREMIUM Hundreds of Millions earned reported by members. Our vision: 1 BILLION 5.0 ( 442 ) Trading Stocks &amp; Options, Premium Lounge, Zoom Call 8:45am ET to 4pm ET, Videos on-Demand, IPO Center, Earnings, Hot Stock Picks, and Daily Trading Ideas. All access with be delivered thru Discord $125.00 / month 7 day trial Pay Purchase Join 74 members Features Access to the Discord paid members area for community interaction Daily real-time coaching, trading, and analysis with experts Thousands of hours of engaging educational content available Hot stock Picks and Market Trading Ideas IPOs &amp; Earnings Channel Reviews 4.95 out of 5 442 total reviews 5 stars 4 stars 3 stars 2 stars 1 star MK Mike Kaye 10 days ago Only twelve days in and have learned so much from Coach and the team. I have the Diamond membership and it's the best deal ever, you get access to everything. I'm not much on reading so Coach having so many very informative videos help me so much. I have been trading for two and a half years followi... Show more Written 15 days after purchase K Kyle 17 days ago I have progressively upgraded my membership as I go along and the diamond is by far the way to go. So much content and learning material to review. The mentorship classes are that much more personal, and the people teaching the class have a long background of trading in the stock market to deliver t... Show more Written 14 days after purchase JM Jeff Monroe 19 days ago Wow!!!!!! Written 14 days after purchase R RockinUSA 22 days ago Only been trading 5 months. This education is a great step forward in stock trading. Everyone here is so helpful in your trading journey. Written 5 months after purchase See all reviews About the creator CC View profile Chad Christian @ coachcwc â€¢ Joined Sep 2023 American Dream Trading is a leading stock market education platform with over 6,000 Discord and 11,000 WHOP members. Offering 12-hour daily live Zoom training, expert-led discussions, and curated stock picks, we empower traders with real-time insights and a vibrant community. Backed by 33 years of expertise and collaborative forums help members achieve financial success. Results may vary. PREMIUM $125.00 / month +2 options Purchase $125.00 / month 2 options Pay Purchase Pay Purchase PREMIUM | Whop",
  "finalUrl": "https://whop.com/adt/premium-adt/",
  "fetchedAt": "2025-11-04T19:58:18.589Z",
  "textHash": "e64d9417a108888939b09762b3907ae61128bf064bff296dab84cf94a5022b6d",
  "drilled": false
}