{
  "baseUrl": "https://whop.com/angelo-props/pplocks/",
  "title": "Angelo Props Bread Winners | Whop",
  "h1": "Angelo Props Bread Winners",
  "bullets": [
    "Angelo Props Bread Winners | Whop Sign in AP Angelo Props Bread Winners Join Bread Winners for Winning Picks 4.8 ( 42 ) Sports betting Join Bread Winners for top-tier sports betting picks and insider knowledge. Enjoy a 70% hit rate and expert advice to maximize your earnings. prizepickslockschannel@gmail.com $9.99 / week Pay Join Features Access to daily picks and strategies from AngeloProps.",
    "24/7 community support from over 21k members for prop research.",
    "Real-time updates and instant alerts on high-probability picks.",
    "Exclusive access to private chats with Angelo and expert cappers.",
    "Comprehensive performance stats for informed decision-making.",
    "JP Josh Rodas pineda 8 months ago One of the best out here constant hit rate, with low risk high reward. Written 1 month after purchase",
    "RO Ramses Owens 9 months ago He is so consistent on his plays. Good reads and low risk plays. Great way to bet!! Written 3 months after purchase",
    "K kaor_1 9 months ago Above average consistency, many channels together for many picks, even at times when I'm doubting the props, this man's just knows what to bet on and leave me surprised ðŸ˜‚ worth tbh Written 2 months after purchase",
    "PR PJ Ross 9 months ago This man has helped me so much when joining. I advise everyone to actually become apart of this. Heâ€™s straight CASH!! I appreciate you bro. Written 3 days after purchase"
  ],
  "paras": [
    "Sign in AP Angelo Props Bread Winners Join Bread Winners for Winning Picks 4.8 ( 42 ) Sports betting Join Bread Winners for top-tier sports betting picks and insider knowledge. Enjoy a 70% hit rate and expert advice to maximize your earnings. prizepickslockschannel@gmail.com",
    "$9.99 / week Pay Join Features Access to daily picks and strategies from AngeloProps. 24/7 community support from over 21k members for prop research. Real-time updates and instant alerts on high-probability picks. Exclusive access to private chats with Angelo and expert cappers. Comprehensive performance stats for informed decision-making. Reviews 4.83 out of 5 42 total reviews 5 stars 4 stars 3 stars 2 stars 1 star JP Josh Rodas pineda 8 months ago One of the best out here constant hit rate, with low risk high reward.",
    "9 months ago He is so consistent on his plays. Good reads and low risk plays. Great way to bet!!",
    "9 months ago Above average consistency, many channels together for many picks, even at times when I'm doubting the props, this man's just knows what to bet on and leave me surprised ðŸ˜‚ worth tbh",
    "9 months ago This man has helped me so much when joining. I advise everyone to actually become apart of this. Heâ€™s straight CASH!! I appreciate you bro.",
    "About the creator A View profile Angelo @ angelo24 â€¢ Joined Mar 2023 I&#x27;ve dedicated my career to mastering sports betting, leveraging analytics and insider knowledge to deliver high-probability picks. Join me at Bread Winners for a winning edge. FAQs What sports are covered by Bread Winners? Is there a refund policy for Bread Winners? Affiliates AP Become an affiliate Angelo Props 50% reward Earn money by bringing customers to Angelo Props. Every time a customer purchases using your link, you&#x27;ll earn a commission."
  ],
  "priceTokens": [
    "$9.99",
    "$9.99",
    "$9.99",
    "$1",
    "$1",
    "$1",
    "$22",
    "$1",
    "$1",
    "$1",
    "$1",
    "$1",
    "$2",
    "$1",
    "$2",
    "$2",
    "$2",
    "$2",
    "$3",
    "$3"
  ],
  "faq": [],
  "textSample": "Angelo Props Bread Winners | Whop Sign in AP Angelo Props Bread Winners Join Bread Winners for Winning Picks 4.8 ( 42 ) Sports betting Join Bread Winners for top-tier sports betting picks and insider knowledge. Enjoy a 70% hit rate and expert advice to maximize your earnings. prizepickslockschannel@gmail.com $9.99 / week Pay Join Features Access to daily picks and strategies from AngeloProps. 24/7 community support from over 21k members for prop research. Real-time updates and instant alerts on high-probability picks. Exclusive access to private chats with Angelo and expert cappers. Comprehensive performance stats for informed decision-making. Reviews 4.83 out of 5 42 total reviews 5 stars 4 stars 3 stars 2 stars 1 star JP Josh Rodas pineda 8 months ago One of the best out here constant hit rate, with low risk high reward. Written 1 month after purchase RO Ramses Owens 9 months ago He is so consistent on his plays. Good reads and low risk plays. Great way to bet!! Written 3 months after purchase K kaor_1 9 months ago Above average consistency, many channels together for many picks, even at times when I'm doubting the props, this man's just knows what to bet on and leave me surprised ðŸ˜‚ worth tbh Written 2 months after purchase PR PJ Ross 9 months ago This man has helped me so much when joining. I advise everyone to actually become apart of this. Heâ€™s straight CASH!! I appreciate you bro. Written 3 days after purchase See all reviews About the creator A View profile Angelo @ angelo24 â€¢ Joined Mar 2023 I&#x27;ve dedicated my career to mastering sports betting, leveraging analytics and insider knowledge to deliver high-probability picks. Join me at Bread Winners for a winning edge. FAQs What sports are covered by Bread Winners? Is there a refund policy for Bread Winners? Affiliates AP Become an affiliate Angelo Props 50% reward Earn money by bringing customers to Angelo Props. Every time a customer purchases using your link, you&#x27;ll earn a commission. Angelo Props Bread Winners $9.99 / week +2 options Join $9.99 / week 2 options Pay Join Pay Join",
  "finalUrl": "https://whop.com/angelo-props/pplocks/",
  "fetchedAt": "2025-11-04T21:41:04.039Z",
  "textHash": "01e8f2330dbad8f9e99cc25ea2b1101c51fe5f75cbe21e3037fe467ecd26a0f7",
  "drilled": false
}