{
  "baseUrl": "https://whop.com/atm-picksplays/atm-pick/",
  "title": "ATM PICKS PASS BALLER PACKAGE | Whop",
  "h1": "ATM PICKS PASS BALLER PACKAGE",
  "bullets": [
    "ATM PICKS PASS BALLER PACKAGE | Whop Sign in Unmute Unmute Unmute Unmute AP ATM PICKS PASS BALLER PACKAGE Daily Expert Picks for Serious Bettors 4.9 ( 32 ) Sports betting 6 figures in client wins! Gain access to premium sports betting picks with ATM PICKS. Enjoy expert guidance from experienced handicappers and participate in tournaments for rewards. $40.00 / week Pay Subscribe Features Access to all premium picks with expert analysis",
    "24/7 support for all wagering and membership queries",
    "âœ… 2â€“3 plays per day",
    "P packman60 10 days ago Between the cheat sheets and the low price locks itâ€™s no reason for you not to invest ! Heâ€™s been consistent af ðŸ’¯I was spending double to get the same consistency he puts out x3 . Adding onto that any rare losing days he helps you get back right w free days just overall a great investment . Written 1 month after purchase",
    "B BookieHatesMe 10 days ago Real profits with a amazing system always hitting at a high clip, loosing days he will always add free days which most other cappers wonâ€™t Written 16 days after purchase",
    "SS Sky Sinclair 18 days ago The best mentorship there is. No gatekeeping and consistency. Written 6 months after purchase",
    "W WAE 25 days ago Real Profits ðŸ’°, the best mentor for real-life success. Teach you how to actually make money with this game. Written 3 months after purchase"
  ],
  "paras": [
    "Sign in Unmute Unmute Unmute Unmute AP ATM PICKS PASS BALLER PACKAGE Daily Expert Picks for Serious Bettors 4.9 ( 32 ) Sports betting 6 figures in client wins!",
    "Gain access to premium sports betting picks with ATM PICKS. Enjoy expert guidance from experienced handicappers and participate in tournaments for rewards.",
    "$40.00 / week Pay Subscribe Features Access to all premium picks with expert analysis 24/7 support for all wagering and membership queries âœ… 2â€“3 plays per day Reviews 4.94 out of 5 32 total reviews 5 stars 4 stars 3 stars 2 stars 1 star P packman60 10 days ago Between the cheat sheets and the low price locks itâ€™s no reason for you not to invest ! Heâ€™s been consistent af ðŸ’¯I was spending double to get the same consistency he puts out x3 . Adding onto that any rare losing days he helps you get back right w free days just overall a great investment .",
    "10 days ago Real profits with a amazing system always hitting at a high clip, loosing days he will always add free days which most other cappers wonâ€™t",
    "18 days ago The best mentorship there is. No gatekeeping and consistency.",
    "25 days ago Real Profits ðŸ’°, the best mentor for real-life success. Teach you how to actually make money with this game.",
    "About the creator A View profile ATM @ atm â€¢ Joined Nov 2022 I&#x27;ve dedicated my expertise to sports betting, mastering data-driven strategies. In this mentorship, I share in-depth analysis and personalized guidance to help you excel. My goal is to empower you with the skills and confidence needed for consistent success in your betting journey. FAQs How do we make up for losses? Whats ATM PICKS? Affiliates AP Become an affiliate ATM PICKS 30% reward Earn money by bringing customers to ATM PICKS. Every time a customer purchases using your link, you&#x27;ll earn a commission."
  ],
  "priceTokens": [
    "$40.00",
    "$40.00",
    "$40.00",
    "$1",
    "$1",
    "$1",
    "$22",
    "$1",
    "$1",
    "$1",
    "$1",
    "$1",
    "$2",
    "$1",
    "$2",
    "$2",
    "$2",
    "$2",
    "$3",
    "$3"
  ],
  "faq": [],
  "textSample": "ATM PICKS PASS BALLER PACKAGE | Whop Sign in Unmute Unmute Unmute Unmute AP ATM PICKS PASS BALLER PACKAGE Daily Expert Picks for Serious Bettors 4.9 ( 32 ) Sports betting 6 figures in client wins! Gain access to premium sports betting picks with ATM PICKS. Enjoy expert guidance from experienced handicappers and participate in tournaments for rewards. $40.00 / week Pay Subscribe Features Access to all premium picks with expert analysis 24/7 support for all wagering and membership queries âœ… 2â€“3 plays per day Reviews 4.94 out of 5 32 total reviews 5 stars 4 stars 3 stars 2 stars 1 star P packman60 10 days ago Between the cheat sheets and the low price locks itâ€™s no reason for you not to invest ! Heâ€™s been consistent af ðŸ’¯I was spending double to get the same consistency he puts out x3 . Adding onto that any rare losing days he helps you get back right w free days just overall a great investment . Written 1 month after purchase B BookieHatesMe 10 days ago Real profits with a amazing system always hitting at a high clip, loosing days he will always add free days which most other cappers wonâ€™t Written 16 days after purchase SS Sky Sinclair 18 days ago The best mentorship there is. No gatekeeping and consistency. Written 6 months after purchase W WAE 25 days ago Real Profits ðŸ’°, the best mentor for real-life success. Teach you how to actually make money with this game. Written 3 months after purchase See all reviews About the creator A View profile ATM @ atm â€¢ Joined Nov 2022 I&#x27;ve dedicated my expertise to sports betting, mastering data-driven strategies. In this mentorship, I share in-depth analysis and personalized guidance to help you excel. My goal is to empower you with the skills and confidence needed for consistent success in your betting journey. FAQs How do we make up for losses? Whats ATM PICKS? Affiliates AP Become an affiliate ATM PICKS 30% reward Earn money by bringing customers to ATM PICKS. Every time a customer purchases using your link, you&#x27;ll earn a commission. ATM PICKS PASS BALLER PACKAGE $40.00 / week +2 options Subscribe $40.00 / week 2 options Pay Subscribe Pay Subscribe",
  "finalUrl": "https://whop.com/atm-picksplays/atm-pick/",
  "fetchedAt": "2025-11-04T21:47:19.769Z",
  "textHash": "b5603416f8d723462653c9cddeeebb1e9a974b7afdb308a1784a78742fae13a1",
  "drilled": false
}