{
  "baseUrl": "https://whop.com/vnkumartrades/vnkumartradesbasic/",
  "title": "Basic Plan | Whop",
  "h1": "Basic Plan",
  "bullets": [
    "Sign in V Basic Plan Master Stocks and Options with VNKumarTrades! 3.9 ( 58 ) Trading $75.00 / month Pay Join Features Real-time entry and exit notifications for precise trades.",
    "Exclusive alerts and insights delivered directly.",
    "Charts and daily commentary to support informed decision-making.",
    "Cancel anytime, with no contractual obligations.",
    "Access to Private telegram Alerts group",
    "CC Chirag Chaudhari 1 month ago Very good at trading Written 4 months after purchase",
    "SC Saravanan Chinniah 9 months ago Kumar is an amazing trader with good return rate on his strangles! Appreciate and keep it up. Written 21 days after purchase",
    "NU Nageswara R Uppuluri 9 months ago King of Strangle player, always play on safe bet. Written 1 year after purchase",
    "S SKK 9 months ago Great Strangle player.. Safe calls!! Written 22 days after purchase"
  ],
  "paras": [
    "Sign in V Basic Plan Master Stocks and Options with VNKumarTrades! 3.9 ( 58 ) Trading $75.00 / month Pay Join Features Real-time entry and exit notifications for precise trades. Exclusive alerts and insights delivered directly. Charts and daily commentary to support informed decision-making. Cancel anytime, with no contractual obligations. Access to Private telegram Alerts group Reviews 3.91 out of 5 58 total reviews 5 stars 4 stars 3 stars 2 stars 1 star CC Chirag Chaudhari 1 month ago Very good at trading",
    "9 months ago Kumar is an amazing trader with good return rate on his strangles! Appreciate and keep it up.",
    "9 months ago King of Strangle player, always play on safe bet.",
    "9 months ago Great Strangle player.. Safe calls!!",
    "About the creator VT View profile vnkumar trades @ vnkumartrades • Joined Feb 2023 Affiliates V Become an affiliate vnkumartrades 20% reward Earn money by bringing customers to vnkumartrades. Every time a customer purchases using your link, you&#x27;ll earn a commission."
  ],
  "priceTokens": [
    "$75.00",
    "$75.00",
    "$75.00",
    "$1",
    "$1",
    "$1",
    "$22",
    "$1",
    "$1",
    "$1",
    "$1",
    "$1",
    "$2",
    "$1",
    "$2",
    "$2",
    "$2",
    "$2",
    "$3",
    "$3"
  ],
  "faq": [],
  "textSample": "Sign in V Basic Plan Master Stocks and Options with VNKumarTrades! 3.9 ( 58 ) Trading $75.00 / month Pay Join Features Real-time entry and exit notifications for precise trades. Exclusive alerts and insights delivered directly. Charts and daily commentary to support informed decision-making. Cancel anytime, with no contractual obligations. Access to Private telegram Alerts group Reviews 3.91 out of 5 58 total reviews 5 stars 4 stars 3 stars 2 stars 1 star CC Chirag Chaudhari 1 month ago Very good at trading Written 4 months after purchase SC Saravanan Chinniah 9 months ago Kumar is an amazing trader with good return rate on his strangles! Appreciate and keep it up. Written 21 days after purchase NU Nageswara R Uppuluri 9 months ago King of Strangle player, always play on safe bet. Written 1 year after purchase S SKK 9 months ago Great Strangle player.. Safe calls!! Written 22 days after purchase See all reviews About the creator VT View profile vnkumar trades @ vnkumartrades • Joined Feb 2023 Affiliates V Become an affiliate vnkumartrades 20% reward Earn money by bringing customers to vnkumartrades. Every time a customer purchases using your link, you&#x27;ll earn a commission. Basic Plan $75.00 / month +1 option Join $75.00 / month 1 option Pay Join Pay Join Basic Plan | Whop",
  "finalUrl": "https://whop.com/vnkumartrades/vnkumartradesbasic/",
  "fetchedAt": "2025-11-05T09:19:10.631Z",
  "textHash": "e8621fda85240927f655dcc578fcb332160519d6f6296673e2c14fd540b025f6",
  "drilled": false
}