{
  "baseUrl": "https://whop.com/monthly-e2/weekly-cd/",
  "title": "Bet Bettor Weekly | Whop",
  "h1": "Bet Bettor Weekly",
  "bullets": [
    "Bet Bettor Weekly | Whop Sign in BB Bet Bettor Weekly Betting Smarter, Winning Better. 4.9 ( 288 ) Sports betting Join BetBettor for daily sports picks and expert insights. Elevate your betting with data-driven strategies and enjoy multi-sport excellence. $15.00 / week Pay Join Join 75 members Features Daily sports picks and analysis for NBA, NHL, NFL, MLB, and CFB.",
    "Over 15 Analysts Giving Expert Analysis Daily",
    "Sharp Betting Strategies while Prioritizing Bankroll Management",
    "Daily Fantasy, Sports Betting, E Sports, we have something for everyone",
    "DC David Carmona 1 month ago These guys are great. I actually made some money with them highly recommend Written 7 months after purchase",
    "EV Esperdion Viernes 1 month ago Best server for picks. Have cashed me out multiple times and made my profit in just under a day! Definitely worth checking them out!!! Written 8 months after purchase",
    "JF joshua flores 1 month ago guys very knowledgeable with his picks does a variety of different sports has sick gives ways and always making profit ! Written 2 days after purchase",
    "K Kevon 2 months ago Been sports betting for about 4 years and by far my most profit as been with this one, ALWAYS GIVEWAYS AND THEY ACTUALLY CARE ABOUT THEIR COMMUNITY, best server OAT Written 9 months after purchase"
  ],
  "paras": [
    "Sign in BB Bet Bettor Weekly Betting Smarter, Winning Better. 4.9 ( 288 ) Sports betting Join BetBettor for daily sports picks and expert insights. Elevate your betting with data-driven strategies and enjoy multi-sport excellence.",
    "Join 75 members Features Daily sports picks and analysis for NBA, NHL, NFL, MLB, and CFB. Over 15 Analysts Giving Expert Analysis Daily Sharp Betting Strategies while Prioritizing Bankroll Management Daily Fantasy, Sports Betting, E Sports, we have something for everyone Reviews 4.90 out of 5 288 total reviews 5 stars 4 stars 3 stars 2 stars 1 star DC David Carmona 1 month ago These guys are great. I actually made some money with them highly recommend",
    "1 month ago Best server for picks. Have cashed me out multiple times and made my profit in just under a day! Definitely worth checking them out!!!",
    "1 month ago guys very knowledgeable with his picks does a variety of different sports has sick gives ways and always making profit !",
    "2 months ago Been sports betting for about 4 years and by far my most profit as been with this one, ALWAYS GIVEWAYS AND THEY ACTUALLY CARE ABOUT THEIR COMMUNITY, best server OAT",
    "About the creator BB View profile Bet Bettor @ zachleff • Joined Sep 2023 I&#x27;ve always been passionate about sports and betting. With BetBettor, I wanted to create a platform that combines daily sports picks, expert insights, and smart betting strategies. Our team of seasoned professionals helps you make informed bets, manage your bankroll, and ultimately, win more consistently. FAQs What is the purpose of the discord server you&#x27;re selling? How does your service improve my betting outcomes? Affiliates BB Become an affiliate Bet Bettor 30% reward Earn money by bringing customers to Bet Bettor. Every time a customer purchases using your link, you&#x27;ll earn a commission."
  ],
  "priceTokens": [
    "$15.00",
    "$15.00",
    "$15.00",
    "$1",
    "$1",
    "$1",
    "$22",
    "$1",
    "$1",
    "$1",
    "$1",
    "$1",
    "$2",
    "$1",
    "$2",
    "$2",
    "$2",
    "$2",
    "$3",
    "$3"
  ],
  "faq": [],
  "textSample": "Bet Bettor Weekly | Whop Sign in BB Bet Bettor Weekly Betting Smarter, Winning Better. 4.9 ( 288 ) Sports betting Join BetBettor for daily sports picks and expert insights. Elevate your betting with data-driven strategies and enjoy multi-sport excellence. $15.00 / week Pay Join Join 75 members Features Daily sports picks and analysis for NBA, NHL, NFL, MLB, and CFB. Over 15 Analysts Giving Expert Analysis Daily Sharp Betting Strategies while Prioritizing Bankroll Management Daily Fantasy, Sports Betting, E Sports, we have something for everyone Reviews 4.90 out of 5 288 total reviews 5 stars 4 stars 3 stars 2 stars 1 star DC David Carmona 1 month ago These guys are great. I actually made some money with them highly recommend Written 7 months after purchase EV Esperdion Viernes 1 month ago Best server for picks. Have cashed me out multiple times and made my profit in just under a day! Definitely worth checking them out!!! Written 8 months after purchase JF joshua flores 1 month ago guys very knowledgeable with his picks does a variety of different sports has sick gives ways and always making profit ! Written 2 days after purchase K Kevon 2 months ago Been sports betting for about 4 years and by far my most profit as been with this one, ALWAYS GIVEWAYS AND THEY ACTUALLY CARE ABOUT THEIR COMMUNITY, best server OAT Written 9 months after purchase See all reviews About the creator BB View profile Bet Bettor @ zachleff • Joined Sep 2023 I&#x27;ve always been passionate about sports and betting. With BetBettor, I wanted to create a platform that combines daily sports picks, expert insights, and smart betting strategies. Our team of seasoned professionals helps you make informed bets, manage your bankroll, and ultimately, win more consistently. FAQs What is the purpose of the discord server you&#x27;re selling? How does your service improve my betting outcomes? Affiliates BB Become an affiliate Bet Bettor 30% reward Earn money by bringing customers to Bet Bettor. Every time a customer purchases using your link, you&#x27;ll earn a commission. Bet Bettor Weekly $15.00 / week Join $15.00 / week Pay Join Pay Join",
  "finalUrl": "https://whop.com/monthly-e2/weekly-cd/",
  "fetchedAt": "2025-11-05T09:54:35.913Z",
  "textHash": "c1fdaa3c422afb830f19e963fa552b22512fbc984eb1c72e5843922f52382977",
  "drilled": false
}