{
  "baseUrl": "https://whop.com/bigplaynate-monthly-gl/?a=alexburnett21",
  "title": "BigPlayNate | Whop",
  "h1": "BigPlayNate",
  "bullets": [
    "Powered by B BigPlayNate I&#x27;ve dedicated my career to sports analysis and betting, providing daily expert picks and round-the-clock support. My goal is to help you win and enjoy every moment of the game with confidence. 5.0 ( 4 ) Contact seller Products Free Connect with BigPlayNate Anytime! BigPlayNate 5.0 ( 1 ) $25.00 / week Grab a Week, Get a Free Day! BigPlayNate Weekly 5.0 ( 2 ) $50.00 / month Stay Longer with BigPlayNate Monthly BigPlayNate Monthly GL New $14.99 Excellent mentorship for the next MMA fight UFC Vegas 110 New $999.00 Life-Time access to all sports picks! LifeTime Term New Contact seller Reviews NF Neal Fenster 1 year ago I have had the pleasure of working with Nate for over a year. Not only is he helpful and easy to work with but he he also one of the absolute best handicappers I’ve come across in my many years of Gambling. He is VERY consistent and his “Big Plays” are some of the best I’ve ever seen. This is a v... Show more Written 4 days after purchase",
    "AJ Ayoo Jay 18 • BigPlayNate 9 days ago Written 6 days after purchase",
    "AJ Ayoo Jay 18 • BigPlayNate Weekly 19 days ago Written 3 days after purchase",
    "JC Jacob Carnes • BigPlayNate Weekly 1 month ago Written 10 days after purchase"
  ],
  "paras": [
    "B BigPlayNate I&#x27;ve dedicated my career to sports analysis and betting, providing daily expert picks and round-the-clock support. My goal is to help you win and enjoy every moment of the game with confidence. 5.0 ( 4 ) Contact seller Products Free Connect with BigPlayNate Anytime! BigPlayNate 5.0 ( 1 ) $25.00 / week Grab a Week, Get a Free Day! BigPlayNate Weekly 5.0 ( 2 ) $50.00 / month Stay Longer with BigPlayNate Monthly BigPlayNate Monthly GL New $14.99 Excellent mentorship for the next MMA fight UFC Vegas 110 New $999.00 Life-Time access to all sports picks! LifeTime Term New Contact seller Reviews NF Neal Fenster 1 year ago I have had the pleasure of working with Nate for over a year. Not only is he helpful and easy to work with but he he also one of the absolute best handicappers I’ve come across in my many years of Gambling. He is VERY consistent and his “Big Plays” are some of the best I’ve ever seen. This is a v...",
    "Written 4 days after purchase AJ Ayoo Jay 18 • BigPlayNate 9 days ago",
    "19 days ago",
    "1 month ago"
  ],
  "priceTokens": [
    "$25.00",
    "$50.00",
    "$14.99",
    "$999.00",
    "$1",
    "$1",
    "$1",
    "$21",
    "$1",
    "$1",
    "$1",
    "$1",
    "$28",
    "$1",
    "$28",
    "$28",
    "$28",
    "$28",
    "$3",
    "$3"
  ],
  "faq": [],
  "textSample": "Powered by B BigPlayNate I&#x27;ve dedicated my career to sports analysis and betting, providing daily expert picks and round-the-clock support. My goal is to help you win and enjoy every moment of the game with confidence. 5.0 ( 4 ) Contact seller Products Free Connect with BigPlayNate Anytime! BigPlayNate 5.0 ( 1 ) $25.00 / week Grab a Week, Get a Free Day! BigPlayNate Weekly 5.0 ( 2 ) $50.00 / month Stay Longer with BigPlayNate Monthly BigPlayNate Monthly GL New $14.99 Excellent mentorship for the next MMA fight UFC Vegas 110 New $999.00 Life-Time access to all sports picks! LifeTime Term New Contact seller Reviews NF Neal Fenster 1 year ago I have had the pleasure of working with Nate for over a year. Not only is he helpful and easy to work with but he he also one of the absolute best handicappers I’ve come across in my many years of Gambling. He is VERY consistent and his “Big Plays” are some of the best I’ve ever seen. This is a v... Show more Written 4 days after purchase AJ Ayoo Jay 18 • BigPlayNate 9 days ago Written 6 days after purchase AJ Ayoo Jay 18 • BigPlayNate Weekly 19 days ago Written 3 days after purchase JC Jacob Carnes • BigPlayNate Weekly 1 month ago Written 10 days after purchase BigPlayNate | Whop",
  "finalUrl": "https://whop.com/bigplaynate-monthly-gl/?a=alexburnett21",
  "fetchedAt": "2025-11-04T21:59:19.990Z",
  "textHash": "8abc823c954bdf08d544d189df1dce2182581bcbb70259da52837bf4d4750b86",
  "drilled": false
}