{
  "baseUrl": "https://whop.com/blackwolftrading/blackwolftrading/?a=alexburnett21",
  "title": "BlackWolfTrading | Whop",
  "h1": "BlackWolfTrading",
  "bullets": [
    "Sign in B BlackWolfTrading Forex Mastery: Explode Your Wealth &amp; Profit Instantly! 5.0 ( 1 ) Other Worried about risks? Enjoy $20K protection and refunds on 15%+ losses. Trade securely with zero risk and high reward. Secure your future now on our dime! $150.00 / month + $75.00 initial fee Pay Join Features Automated copy trading.",
    "Email notification on open and close of trades",
    "JG Jonathan Gosney 7 months ago Winrate couldn’t be higher and my bag couldn’t be fuller Written 7 minutes after purchase"
  ],
  "paras": [
    "Sign in B BlackWolfTrading Forex Mastery: Explode Your Wealth &amp; Profit Instantly! 5.0 ( 1 ) Other Worried about risks? Enjoy $20K protection and refunds on 15%+ losses. Trade securely with zero risk and high reward. Secure your future now on our dime!",
    "Automated copy trading. Email notification on open and close of trades Reviews 5 out of 5 1 review 5 stars 4 stars 3 stars 2 stars 1 star JG Jonathan Gosney 7 months ago Winrate couldn’t be higher and my bag couldn’t be fuller",
    "Affiliates B Become an affiliate BlackWolfTrading 25% reward Earn money by bringing customers to BlackWolfTrading. Every time a customer purchases using your link, you&#x27;ll earn a commission."
  ],
  "priceTokens": [
    "$20",
    "$150.00",
    "$75.00",
    "$150.00",
    "$150.00",
    "$1",
    "$1",
    "$1",
    "$23",
    "$1",
    "$1",
    "$1",
    "$1",
    "$1",
    "$2",
    "$1",
    "$2",
    "$2",
    "$2",
    "$2"
  ],
  "faq": [],
  "textSample": "Sign in B BlackWolfTrading Forex Mastery: Explode Your Wealth &amp; Profit Instantly! 5.0 ( 1 ) Other Worried about risks? Enjoy $20K protection and refunds on 15%+ losses. Trade securely with zero risk and high reward. Secure your future now on our dime! $150.00 / month + $75.00 initial fee Pay Join Features Automated copy trading. Email notification on open and close of trades Reviews 5 out of 5 1 review 5 stars 4 stars 3 stars 2 stars 1 star JG Jonathan Gosney 7 months ago Winrate couldn’t be higher and my bag couldn’t be fuller Written 7 minutes after purchase About the creator F View profile FrostedPips @ frostedpips • Joined Feb 2024 With 6 years of hands-on experience in currency trading, I&#x27;m dedicated to demystifying the market for newcomers. My mission is to simplify your learning journey, cut through noise, Affiliates B Become an affiliate BlackWolfTrading 25% reward Earn money by bringing customers to BlackWolfTrading. Every time a customer purchases using your link, you&#x27;ll earn a commission. BlackWolfTrading $150.00 / month Join $150.00 / month Pay Join Pay Join BlackWolfTrading | Whop",
  "finalUrl": "https://whop.com/blackwolftrading/blackwolftrading/?a=alexburnett21",
  "fetchedAt": "2025-11-05T10:51:36.834Z",
  "textHash": "6bdc5ade7498631b8ed8f79b0c611db74461b6a2bb18dd3ee64632c33b5e54e1",
  "drilled": true
}