{
  "baseUrl": "https://whop.com/bobbysbets/?a=alexburnett21",
  "title": "Bobby&#x27;s Bets | Whop",
  "h1": "Bobby&#x27;s Bets",
  "bullets": [
    "Bobby&#x27;s Bets | Whop Powered by BB Bobby&#x27;s Bets Bobby‚Äôs Bets combines a passion for sports with advanced data analytics to help bettors make informed decisions. üèÄ‚öæüèà With years of experience in the NFL, MLB, and NBA, we deliver reliable insights f... More 4.6 ( 14 ) Contact seller Products Unmute $20.00 / month Free trial Powered by Data. Built for Profits. Bobby&#x27;s Bets Sports Analytics 4.6 ( 14 ) $7.00 / week Data-Driven Sports Betting Analysis Bobby&#x27;s Bets (Weekly Plan) New Contact seller Reviews AC Antonio Coronado ‚Ä¢ Bobby&#x27;s Bets Sports Analytics 1 month ago It‚Äôs the best I would have this for a long term nba and NHL NFL are about to start soon Written 10 months after purchase",
    "SM Sean Murphy ‚Ä¢ Bobby&#x27;s Bets Sports Analytics 4 months ago The best discord ever. This guy is the GOAT.. Written 19 days after purchase",
    "AJ Alice Jorden ‚Ä¢ Bobby&#x27;s Bets Sports Analytics 9 months ago The dashboard visuals are top-notch and give you everything you need at a glance. Written 3h after purchase",
    "LS Lura Smith ‚Ä¢ Bobby&#x27;s Bets Sports Analytics 9 months ago Detailed and reliable data that helps me make smarter betting choices. Written 3 days after purchase"
  ],
  "paras": [
    "BB Bobby&#x27;s Bets Bobby‚Äôs Bets combines a passion for sports with advanced data analytics to help bettors make informed decisions. üèÄ‚öæüèà With years of experience in the NFL, MLB, and NBA, we deliver reliable insights f... More 4.6 ( 14 ) Contact seller Products Unmute $20.00 / month Free trial Powered by Data. Built for Profits. Bobby&#x27;s Bets Sports Analytics 4.6 ( 14 ) $7.00 / week Data-Driven Sports Betting Analysis Bobby&#x27;s Bets (Weekly Plan) New Contact seller Reviews AC Antonio Coronado ‚Ä¢ Bobby&#x27;s Bets Sports Analytics 1 month ago It‚Äôs the best I would have this for a long term nba and NHL NFL are about to start soon",
    "4 months ago The best discord ever. This guy is the GOAT..",
    "9 months ago The dashboard visuals are top-notch and give you everything you need at a glance.",
    "9 months ago Detailed and reliable data that helps me make smarter betting choices."
  ],
  "priceTokens": [
    "$20.00",
    "$7.00",
    "$1",
    "$1",
    "$1",
    "$21",
    "$1",
    "$1",
    "$1",
    "$1",
    "$28",
    "$1",
    "$28",
    "$28",
    "$28",
    "$28",
    "$3",
    "$3",
    "$3",
    "$10"
  ],
  "faq": [],
  "textSample": "Bobby&#x27;s Bets | Whop Powered by BB Bobby&#x27;s Bets Bobby‚Äôs Bets combines a passion for sports with advanced data analytics to help bettors make informed decisions. üèÄ‚öæüèà With years of experience in the NFL, MLB, and NBA, we deliver reliable insights f... More 4.6 ( 14 ) Contact seller Products Unmute $20.00 / month Free trial Powered by Data. Built for Profits. Bobby&#x27;s Bets Sports Analytics 4.6 ( 14 ) $7.00 / week Data-Driven Sports Betting Analysis Bobby&#x27;s Bets (Weekly Plan) New Contact seller Reviews AC Antonio Coronado ‚Ä¢ Bobby&#x27;s Bets Sports Analytics 1 month ago It‚Äôs the best I would have this for a long term nba and NHL NFL are about to start soon Written 10 months after purchase SM Sean Murphy ‚Ä¢ Bobby&#x27;s Bets Sports Analytics 4 months ago The best discord ever. This guy is the GOAT.. Written 19 days after purchase AJ Alice Jorden ‚Ä¢ Bobby&#x27;s Bets Sports Analytics 9 months ago The dashboard visuals are top-notch and give you everything you need at a glance. Written 3h after purchase LS Lura Smith ‚Ä¢ Bobby&#x27;s Bets Sports Analytics 9 months ago Detailed and reliable data that helps me make smarter betting choices. Written 3 days after purchase See all reviews",
  "finalUrl": "https://whop.com/bobbysbets/?a=alexburnett21",
  "fetchedAt": "2025-11-04T21:41:06.045Z",
  "textHash": "fd9c1935379c37b3753e4f15046ce8257a04ab55c01a3f62c684f639e9c22d1b",
  "drilled": false
}