{
  "baseUrl": "https://whop.com/amazonfba/brand-partnership-blueprint/",
  "title": "Brand Partnership Blueprint | Whop",
  "h1": "Brand Partnership Blueprint",
  "bullets": [
    "Sign in EP Brand Partnership Blueprint Open Brand Direct Accounts 4.9 ( 14 ) Ecommerce Learn to find, pitch, and close profitable brand direct deals to scale your Amazon business fast even without prior connections. $297.00 / month Pay Get access Join 2 members Features 24/7 chat support to answer all your questions",
    "Discover how to find and pitch brands for profitable brand direct partnerships",
    "Stop competing on listings. Own 100% of the buy box with direct brand accounts.",
    "Access to templates, scripts, and tools to close real brand deals fast.",
    "Step-by-step training to go from beginner to brand-ready Amazon seller.",
    "TG Trina Ginigeme 1 month ago great support Written 3 months after purchase",
    "BH Britt Herring 1 month ago I’ve been in this group for just under a year now, and they consistently overdeliver. They’ve helped guide me through every roadblock along the way. Eric and all of the experienced members in the community are truly amazing. Highly recommend! Written 2 months after purchase",
    "TM TIffany Martin 2 months ago Great course, hands on help and always has solutions. Lovely people too! Written 6 days after purchase",
    "FO Fabian Ortega 5 months ago Amazing support. The course is phenomenal. Everything is well explained and up to date. Written 23 days after purchase"
  ],
  "paras": [
    "Sign in EP Brand Partnership Blueprint Open Brand Direct Accounts 4.9 ( 14 ) Ecommerce Learn to find, pitch, and close profitable brand direct deals to scale your Amazon business fast even without prior connections.",
    "Join 2 members Features 24/7 chat support to answer all your questions Discover how to find and pitch brands for profitable brand direct partnerships Stop competing on listings. Own 100% of the buy box with direct brand accounts. Access to templates, scripts, and tools to close real brand deals fast. Step-by-step training to go from beginner to brand-ready Amazon seller. Reviews 4.93 out of 5 14 total reviews 5 stars 4 stars 3 stars 2 stars 1 star TG Trina Ginigeme 1 month ago great support",
    "1 month ago I’ve been in this group for just under a year now, and they consistently overdeliver. They’ve helped guide me through every roadblock along the way. Eric and all of the experienced members in the community are truly amazing. Highly recommend!",
    "2 months ago Great course, hands on help and always has solutions. Lovely people too!",
    "5 months ago Amazing support. The course is phenomenal. Everything is well explained and up to date.",
    "About the creator E View profile EcomProfitPath @ ecomprofitpath • Joined Nov 2024 FAQs Who is this Program For? What’s Included With My Membership? What is Your Refund Policy Will this help me frind wholesalers and Brands Should I also purchase The Monday Night Coaching Calls Monthly Subscription? Affiliates EP Become an affiliate Ecom Profit Path 15% reward Earn money by bringing customers to Ecom Profit Path. Every time a customer purchases using your link, you&#x27;ll earn a commission."
  ],
  "priceTokens": [
    "$297.00",
    "$297.00",
    "$297.00",
    "$1",
    "$1",
    "$1",
    "$22",
    "$1",
    "$1",
    "$1",
    "$1",
    "$1",
    "$2",
    "$1",
    "$2",
    "$2",
    "$2",
    "$2",
    "$3",
    "$3"
  ],
  "faq": [],
  "textSample": "Sign in EP Brand Partnership Blueprint Open Brand Direct Accounts 4.9 ( 14 ) Ecommerce Learn to find, pitch, and close profitable brand direct deals to scale your Amazon business fast even without prior connections. $297.00 / month Pay Get access Join 2 members Features 24/7 chat support to answer all your questions Discover how to find and pitch brands for profitable brand direct partnerships Stop competing on listings. Own 100% of the buy box with direct brand accounts. Access to templates, scripts, and tools to close real brand deals fast. Step-by-step training to go from beginner to brand-ready Amazon seller. Reviews 4.93 out of 5 14 total reviews 5 stars 4 stars 3 stars 2 stars 1 star TG Trina Ginigeme 1 month ago great support Written 3 months after purchase BH Britt Herring 1 month ago I’ve been in this group for just under a year now, and they consistently overdeliver. They’ve helped guide me through every roadblock along the way. Eric and all of the experienced members in the community are truly amazing. Highly recommend! Written 2 months after purchase TM TIffany Martin 2 months ago Great course, hands on help and always has solutions. Lovely people too! Written 6 days after purchase FO Fabian Ortega 5 months ago Amazing support. The course is phenomenal. Everything is well explained and up to date. Written 23 days after purchase See all reviews About the creator E View profile EcomProfitPath @ ecomprofitpath • Joined Nov 2024 FAQs Who is this Program For? What’s Included With My Membership? What is Your Refund Policy Will this help me frind wholesalers and Brands Should I also purchase The Monday Night Coaching Calls Monthly Subscription? Affiliates EP Become an affiliate Ecom Profit Path 15% reward Earn money by bringing customers to Ecom Profit Path. Every time a customer purchases using your link, you&#x27;ll earn a commission. Brand Partnership Blueprint $297.00 / month Get access $297.00 / month Pay Get access Pay Get access Brand Partnership Blueprint | Whop",
  "finalUrl": "https://whop.com/amazonfba/brand-partnership-blueprint/",
  "fetchedAt": "2025-11-05T10:34:20.556Z",
  "textHash": "73c3c04b853ad4592a2e9f686a33bcf463c42fc52950a7cc5471d2da97351f8f",
  "drilled": false
}