{
  "baseUrl": "https://whop.com/ace-of-financial/aceoffinancial/",
  "title": "Bronze package | Whop",
  "h1": "Bronze package",
  "bullets": [
    "Sign in AL Bronze package Unlock Your Path To Financial Freedom Today Sales Take control of your financial future with our tailored packages. $49.99 / week + $4.99 initial fee Pay Subscribe Features ADVANCED FULL CREDIT SWEEP",
    "REMOVAL OF LATE PAYMENTS, COLLECTIONS",
    "CHARGE OFFS, CHILD SUPPORT, &amp; BANKRUPTCIES",
    "MONTHLY FOLLOW UP",
    "1 ZOOM MEETING ROADMAP CALL."
  ],
  "paras": [
    "Sign in AL Bronze package Unlock Your Path To Financial Freedom Today Sales Take control of your financial future with our tailored packages.",
    "ADVANCED FULL CREDIT SWEEP REMOVAL OF LATE PAYMENTS, COLLECTIONS CHARGE OFFS, CHILD SUPPORT, &amp; BANKRUPTCIES MONTHLY FOLLOW UP 1 ZOOM MEETING ROADMAP CALL. About the creator AS View profile Approved By Shine @ aceoffinancial • Joined Mar 2024 #1 Credit Repair &amp; Business Funding Company FAQs What is credit repair? Is credit repair legal? How Long Will It Take To See Results? What Sets Your Company Apart From Others? Affiliates AL Become an affiliate Ace Of Financial LLC. 10% reward Earn money by bringing customers to Ace Of Financial LLC.. Every time a customer purchases using your link, you&#x27;ll earn a commission."
  ],
  "priceTokens": [
    "$49.99",
    "$4.99",
    "$49.99",
    "$49.99",
    "$1",
    "$1",
    "$1",
    "$22",
    "$1",
    "$1",
    "$1",
    "$1",
    "$1",
    "$2",
    "$1",
    "$2",
    "$2",
    "$2",
    "$2",
    "$3"
  ],
  "faq": [],
  "textSample": "Sign in AL Bronze package Unlock Your Path To Financial Freedom Today Sales Take control of your financial future with our tailored packages. $49.99 / week + $4.99 initial fee Pay Subscribe Features ADVANCED FULL CREDIT SWEEP REMOVAL OF LATE PAYMENTS, COLLECTIONS CHARGE OFFS, CHILD SUPPORT, &amp; BANKRUPTCIES MONTHLY FOLLOW UP 1 ZOOM MEETING ROADMAP CALL. About the creator AS View profile Approved By Shine @ aceoffinancial • Joined Mar 2024 #1 Credit Repair &amp; Business Funding Company FAQs What is credit repair? Is credit repair legal? How Long Will It Take To See Results? What Sets Your Company Apart From Others? Affiliates AL Become an affiliate Ace Of Financial LLC. 10% reward Earn money by bringing customers to Ace Of Financial LLC.. Every time a customer purchases using your link, you&#x27;ll earn a commission. Bronze package $49.99 / week Subscribe $49.99 / week Pay Subscribe Pay Subscribe Bronze package | Whop",
  "finalUrl": "https://whop.com/ace-of-financial/aceoffinancial/",
  "fetchedAt": "2025-11-05T09:59:26.692Z",
  "textHash": "efd8aea352f88d8be9aa63971b8420cb72e67659b9e4b14d96ff8d4517c9bf63",
  "drilled": false
}