{
  "baseUrl": "https://whop.com/calibetz/cali-betz/",
  "title": "Cali Betz | Whop",
  "h1": "Cali Betz",
  "bullets": [
    "Cali Betz | Whop Sign in CB Cali Betz FULL VIP ACCESS 4.7 ( 28 ) Other Providing expert analysis and data-driven insights for all members with a like-minded desire to seek financial freedom through sports betting. $14.99 / week Pay Join Features 25% PROMO FOR NEW MEMBERS!",
    "Tips on research &amp; bankroll management to help you MAXIMIZE YOUR PROFIT",
    "EY Edison Yip 6 months ago Okay, I'm in about four different discords for slips and this server has been hands down, the best one yet and it hasn't even been a week since joining. What are you waiting for? Don't you want to retire your parents? Don't you want to travel the world? This server is top two, and it's not number tw... Show more Written 4 days after purchase",
    "AL Andrei Labay 6 months ago Been here for almost 3 months and its been amazing. I recently cashed a 2.4k slip thanks to cali and mixing and matching the plays posted. You get benefits from just being active and the mods are amazing cashing us out nearly every day absolute best discord in my opinion. It was tough at first but c... Show more Written 2 months after purchase",
    "AN Aaron Ngo 6 months ago I have been in this discord for not even 1 week already 4 units of profit paid for the subscription it self. Cali Betz my goat. Written 4 days after purchase",
    "MM Michael Morales 7 months ago Joined for a month to test the waters, didn’t take long to get my money back and was profiting like crazy thanks to Cali and her mods. Decided to come back for lifetime access and I don’t regret it one bit. If you’re looking for great plays backed by statistical analysis then you’ve come to the righ... Show more Written 2 months after purchase"
  ],
  "paras": [
    "Sign in CB Cali Betz FULL VIP ACCESS 4.7 ( 28 ) Other Providing expert analysis and data-driven insights for all members with a like-minded desire to seek financial freedom through sports betting.",
    "$14.99 / week Pay Join Features 25% PROMO FOR NEW MEMBERS! Tips on research &amp; bankroll management to help you MAXIMIZE YOUR PROFIT Reviews 4.71 out of 5 28 total reviews 5 stars 4 stars 3 stars 2 stars 1 star EY Edison Yip 6 months ago Okay, I'm in about four different discords for slips and this server has been hands down, the best one yet and it hasn't even been a week since joining. What are you waiting for? Don't you want to retire your parents? Don't you want to travel the world? This server is top two, and it's not number tw...",
    "Written 4 days after purchase AL Andrei Labay 6 months ago Been here for almost 3 months and its been amazing. I recently cashed a 2.4k slip thanks to cali and mixing and matching the plays posted. You get benefits from just being active and the mods are amazing cashing us out nearly every day absolute best discord in my opinion. It was tough at first but c...",
    "Written 2 months after purchase AN Aaron Ngo 6 months ago I have been in this discord for not even 1 week already 4 units of profit paid for the subscription it self. Cali Betz my goat.",
    "7 months ago Joined for a month to test the waters, didn’t take long to get my money back and was profiting like crazy thanks to Cali and her mods. Decided to come back for lifetime access and I don’t regret it one bit. If you’re looking for great plays backed by statistical analysis then you’ve come to the righ...",
    "Written 2 months after purchase See all reviews About the creator C View profile Cali @ thechefcali • Joined Dec 2024 I lead a sports betting community focused on helping members make smarter bets through expert analysis, data-driven insights, and proven strategies. My mission is to empower others to increase their chances of winning and achieve consistent profits. FAQs How many picks are posted everyday? What pricing options are available? Where do I see the picks after I’ve signed up? Affiliates CB Become an affiliate CALI BETZ 30% reward Earn money by bringing customers to CALI BETZ. Every time a customer purchases using your link, you&#x27;ll earn a commission."
  ],
  "priceTokens": [
    "$14.99",
    "$14.99",
    "$14.99",
    "$1",
    "$1",
    "$1",
    "$22",
    "$1",
    "$1",
    "$1",
    "$1",
    "$1",
    "$2",
    "$1",
    "$2",
    "$2",
    "$2",
    "$2",
    "$3",
    "$3"
  ],
  "faq": [],
  "textSample": "Cali Betz | Whop Sign in CB Cali Betz FULL VIP ACCESS 4.7 ( 28 ) Other Providing expert analysis and data-driven insights for all members with a like-minded desire to seek financial freedom through sports betting. $14.99 / week Pay Join Features 25% PROMO FOR NEW MEMBERS! Tips on research &amp; bankroll management to help you MAXIMIZE YOUR PROFIT Reviews 4.71 out of 5 28 total reviews 5 stars 4 stars 3 stars 2 stars 1 star EY Edison Yip 6 months ago Okay, I'm in about four different discords for slips and this server has been hands down, the best one yet and it hasn't even been a week since joining. What are you waiting for? Don't you want to retire your parents? Don't you want to travel the world? This server is top two, and it's not number tw... Show more Written 4 days after purchase AL Andrei Labay 6 months ago Been here for almost 3 months and its been amazing. I recently cashed a 2.4k slip thanks to cali and mixing and matching the plays posted. You get benefits from just being active and the mods are amazing cashing us out nearly every day absolute best discord in my opinion. It was tough at first but c... Show more Written 2 months after purchase AN Aaron Ngo 6 months ago I have been in this discord for not even 1 week already 4 units of profit paid for the subscription it self. Cali Betz my goat. Written 4 days after purchase MM Michael Morales 7 months ago Joined for a month to test the waters, didn’t take long to get my money back and was profiting like crazy thanks to Cali and her mods. Decided to come back for lifetime access and I don’t regret it one bit. If you’re looking for great plays backed by statistical analysis then you’ve come to the righ... Show more Written 2 months after purchase See all reviews About the creator C View profile Cali @ thechefcali • Joined Dec 2024 I lead a sports betting community focused on helping members make smarter bets through expert analysis, data-driven insights, and proven strategies. My mission is to empower others to increase their chances of winning and achieve consistent profits. FAQs How many picks are posted everyday? What pricing options are available? Where do I see the picks after I’ve signed up? Affiliates CB Become an affiliate CALI BETZ 30% reward Earn money by bringing customers to CALI BETZ. Every time a customer purchases using your link, you&#x27;ll earn a commission. Cali Betz $14.99 / week +3 options Join $14.99 / week 3 options Pay Join Pay Join",
  "finalUrl": "https://whop.com/calibetz/cali-betz/",
  "fetchedAt": "2025-11-05T09:54:35.383Z",
  "textHash": "b03c7dc48af1ff29085ba3293680508bc9519d2cae8a5eda0445fb140017cb63",
  "drilled": false
}