{
  "baseUrl": "https://whop.com/the-smart-money-circle/ceo-trades-course-vip-lifetime-access/",
  "title": "CEO Trades Lifetime Access | Whop",
  "h1": "CEO Trades Lifetime Access",
  "bullets": [
    "Sign in CT CEO Trades Lifetime Access Transform Into a Profitable Trader 4.7 ( 6 ) Trading Gain lifetime access to VIP setups, daily insights, and a complete trading course. Average monthly gains of 10% with expert guidance. ¬£597.00 one-time purchase Pay Join Features Real-Time Trading Signals With Entry, SL &amp; TP.",
    "Full A To Z Video Course To Make You A Consistently Profitable Trader.",
    "Weekly Market Outlooks / Live Trading Sessions.",
    "Access To Vibrant Community Of Traders.",
    "24/7 Support For All Trading-Related Queries.",
    "TL Thomas Lefebvre 1 year ago Amazing team. I started trading a few years ago but I learnt a lot with his course Written 1 month after purchase",
    "AB Abdelouadoud Bencheikh-lehocine 1 year ago The best decision I have ever made in trading that I bought CEO TRADES LIFETIME MEMBERSHIP FOR JUST ¬£450 and made my first payout $2500 with following his trades thx bro üëç you are the goat Written 1 month after purchase",
    "IA Isha Amin 1 year ago Started off with little knowledge of trading, and now I am able to trade after watching CEO Trades' course which is explained very well and straight to the point! The signals that are sent in the VIP are a bonus to making money. Highly recommended! Written 11 days after purchase",
    "JS Jonas Schuetz 1 year ago If u want to really learn and upgrade your trading overall, hands down its the best place for you Written 5 months after purchase"
  ],
  "paras": [
    "Sign in CT CEO Trades Lifetime Access Transform Into a Profitable Trader 4.7 ( 6 ) Trading Gain lifetime access to VIP setups, daily insights, and a complete trading course. Average monthly gains of 10% with expert guidance.",
    "Real-Time Trading Signals With Entry, SL &amp; TP. Full A To Z Video Course To Make You A Consistently Profitable Trader. Weekly Market Outlooks / Live Trading Sessions. Access To Vibrant Community Of Traders. 24/7 Support For All Trading-Related Queries. Reviews 4.67 out of 5 6 total reviews 5 stars 4 stars 3 stars 2 stars 1 star TL Thomas Lefebvre 1 year ago Amazing team. I started trading a few years ago but I learnt a lot with his course",
    "1 year ago The best decision I have ever made in trading that I bought CEO TRADES LIFETIME MEMBERSHIP FOR JUST ¬£450 and made my first payout $2500 with following his trades thx bro üëç you are the goat",
    "1 year ago Started off with little knowledge of trading, and now I am able to trade after watching CEO Trades' course which is explained very well and straight to the point! The signals that are sent in the VIP are a bonus to making money. Highly recommended!",
    "1 year ago If u want to really learn and upgrade your trading overall, hands down its the best place for you",
    "About the creator DK View profile Dhruv Kapoor @ ceotrades ‚Ä¢ Joined Nov 2023 Affiliates CT Become an affiliate CEO Trades 30% reward Earn money by bringing customers to CEO Trades. Every time a customer purchases using your link, you&#x27;ll earn a commission."
  ],
  "priceTokens": [
    "¬£597.00",
    "¬£450",
    "$250",
    "¬£597.00",
    "¬£597.00",
    "$1",
    "$1",
    "$1",
    "$23",
    "$1",
    "$1",
    "$1",
    "$1",
    "$1",
    "$2",
    "$1",
    "$2",
    "$2",
    "$2",
    "$2"
  ],
  "faq": [],
  "textSample": "Sign in CT CEO Trades Lifetime Access Transform Into a Profitable Trader 4.7 ( 6 ) Trading Gain lifetime access to VIP setups, daily insights, and a complete trading course. Average monthly gains of 10% with expert guidance. ¬£597.00 one-time purchase Pay Join Features Real-Time Trading Signals With Entry, SL &amp; TP. Full A To Z Video Course To Make You A Consistently Profitable Trader. Weekly Market Outlooks / Live Trading Sessions. Access To Vibrant Community Of Traders. 24/7 Support For All Trading-Related Queries. Reviews 4.67 out of 5 6 total reviews 5 stars 4 stars 3 stars 2 stars 1 star TL Thomas Lefebvre 1 year ago Amazing team. I started trading a few years ago but I learnt a lot with his course Written 1 month after purchase AB Abdelouadoud Bencheikh-lehocine 1 year ago The best decision I have ever made in trading that I bought CEO TRADES LIFETIME MEMBERSHIP FOR JUST ¬£450 and made my first payout $2500 with following his trades thx bro üëç you are the goat Written 1 month after purchase IA Isha Amin 1 year ago Started off with little knowledge of trading, and now I am able to trade after watching CEO Trades' course which is explained very well and straight to the point! The signals that are sent in the VIP are a bonus to making money. Highly recommended! Written 11 days after purchase JS Jonas Schuetz 1 year ago If u want to really learn and upgrade your trading overall, hands down its the best place for you Written 5 months after purchase See all reviews About the creator DK View profile Dhruv Kapoor @ ceotrades ‚Ä¢ Joined Nov 2023 Affiliates CT Become an affiliate CEO Trades 30% reward Earn money by bringing customers to CEO Trades. Every time a customer purchases using your link, you&#x27;ll earn a commission. CEO Trades Lifetime Access ¬£597.00 one-time purchase Join ¬£597.00 one-time purchase Pay Join Pay Join CEO Trades Lifetime Access | Whop",
  "finalUrl": "https://whop.com/the-smart-money-circle/ceo-trades-course-vip-lifetime-access/",
  "fetchedAt": "2025-11-05T10:41:41.327Z",
  "textHash": "19282e826e3b50c2a627f7adc5d9e60c2ac0d572919df96af80bf7c39c2be76f",
  "drilled": false
}