{
  "baseUrl": "https://whop.com/cmr-premium-membership/cmr-charts-membership/",
  "title": "CMR Charts &amp; Index Membership | Whop",
  "h1": "CMR Charts &amp; Index Membership",
  "bullets": [
    "Sign in Unmute Unmute CR CMR Charts &amp; Index Membership Don&#x27;t Trade, Fade! 4.9 ( 39 ) Trading Join the CMR community and gain access to: Limited Access to Private CMR Discord Daily Market Recap Videos (Mon - Thu) Weekly Set Ups, Positions, Trades, Weekly CMR COT Charts Weekly CMR COT Index Two Private TradingView Indicators This membership level is for traders who want to focus on their own process and gain the edge of trader positioning by using the best COT charts on the market that cover all the major Futures markets including Stocks, Crypto, Fixed Income, FX, Metals and more... $50.00 / month Pay Join Join 79 members Features Weekly Set Ups, Positions And Trades",
    "Access to CMR TradingView indicators",
    "Weekly CMR Charts",
    "Weekly CMR Proprietary Index",
    "Limited access To Private Discord Server",
    "JH Jessie Huang 1 month ago Really inspiring， lots of great insights, thanks for sharing! Written 1 month after purchase",
    "SS Sumit Sikder 1 month ago What an amazing learning experience! I really enjoyed it and learnt a lot. I have been trading for the last 5 years and this is by far one of the best content I came across. Many thanks for making it happen! Written 1 month after purchase",
    "MD Marius Dobre 1 month ago Great conference! Extremely useful information for beginers and seasoned traders as well. Written 1 month after purchase",
    "O Oliver 1 month ago Great conference! The presenters were excellent and the content was very insightful. I learned a ton and found it incredibly valuable. The team did a fantastic job.\" Written 21 days after purchase"
  ],
  "paras": [
    "Sign in Unmute Unmute CR CMR Charts &amp; Index Membership Don&#x27;t Trade, Fade! 4.9 ( 39 ) Trading Join the CMR community and gain access to: Limited Access to Private CMR Discord Daily Market Recap Videos (Mon - Thu) Weekly Set Ups, Positions, Trades, Weekly CMR COT Charts Weekly CMR COT Index Two Private TradingView Indicators",
    "This membership level is for traders who want to focus on their own process and gain the edge of trader positioning by using the best COT charts on the market that cover all the major Futures markets including Stocks, Crypto, Fixed Income, FX, Metals and more...",
    "$50.00 / month Pay Join Join 79 members Features Weekly Set Ups, Positions And Trades Access to CMR TradingView indicators Weekly CMR Charts Weekly CMR Proprietary Index Limited access To Private Discord Server Reviews 4.87 out of 5 39 total reviews 5 stars 4 stars 3 stars 2 stars 1 star JH Jessie Huang 1 month ago Really inspiring， lots of great insights, thanks for sharing!",
    "1 month ago What an amazing learning experience! I really enjoyed it and learnt a lot. I have been trading for the last 5 years and this is by far one of the best content I came across. Many thanks for making it happen!",
    "1 month ago Great conference! Extremely useful information for beginers and seasoned traders as well.",
    "1 month ago Great conference! The presenters were excellent and the content was very insightful. I learned a ton and found it incredibly valuable. The team did a fantastic job.\"",
    "About the creator CS View profile Crowded Market Report by Jason Shapiro @ crowdedmarketreport • Joined Dec 2023 I&#x27;ve dedicated my career to mastering the art of trading. With years of experience, I&#x27;ve developed strategies that help traders navigate crowded markets. My goal is to empower others with the knowledge and tools needed to succeed. FAQs What is included in the private discord? What is your refund policy? Affiliates CR Become an affiliate Crowded Market Report 20% reward Earn money by bringing customers to Crowded Market Report. Every time a customer purchases using your link, you&#x27;ll earn a commission."
  ],
  "priceTokens": [
    "$50.00",
    "$50.00",
    "$50.00",
    "$1",
    "$1",
    "$1",
    "$22",
    "$1",
    "$1",
    "$1",
    "$1",
    "$1",
    "$2",
    "$1",
    "$2",
    "$2",
    "$2",
    "$2",
    "$3",
    "$3"
  ],
  "faq": [],
  "textSample": "Sign in Unmute Unmute CR CMR Charts &amp; Index Membership Don&#x27;t Trade, Fade! 4.9 ( 39 ) Trading Join the CMR community and gain access to: Limited Access to Private CMR Discord Daily Market Recap Videos (Mon - Thu) Weekly Set Ups, Positions, Trades, Weekly CMR COT Charts Weekly CMR COT Index Two Private TradingView Indicators This membership level is for traders who want to focus on their own process and gain the edge of trader positioning by using the best COT charts on the market that cover all the major Futures markets including Stocks, Crypto, Fixed Income, FX, Metals and more... $50.00 / month Pay Join Join 79 members Features Weekly Set Ups, Positions And Trades Access to CMR TradingView indicators Weekly CMR Charts Weekly CMR Proprietary Index Limited access To Private Discord Server Reviews 4.87 out of 5 39 total reviews 5 stars 4 stars 3 stars 2 stars 1 star JH Jessie Huang 1 month ago Really inspiring， lots of great insights, thanks for sharing! Written 1 month after purchase SS Sumit Sikder 1 month ago What an amazing learning experience! I really enjoyed it and learnt a lot. I have been trading for the last 5 years and this is by far one of the best content I came across. Many thanks for making it happen! Written 1 month after purchase MD Marius Dobre 1 month ago Great conference! Extremely useful information for beginers and seasoned traders as well. Written 1 month after purchase O Oliver 1 month ago Great conference! The presenters were excellent and the content was very insightful. I learned a ton and found it incredibly valuable. The team did a fantastic job.\" Written 21 days after purchase See all reviews About the creator CS View profile Crowded Market Report by Jason Shapiro @ crowdedmarketreport • Joined Dec 2023 I&#x27;ve dedicated my career to mastering the art of trading. With years of experience, I&#x27;ve developed strategies that help traders navigate crowded markets. My goal is to empower others with the knowledge and tools needed to succeed. FAQs What is included in the private discord? What is your refund policy? Affiliates CR Become an affiliate Crowded Market Report 20% reward Earn money by bringing customers to Crowded Market Report. Every time a customer purchases using your link, you&#x27;ll earn a commission. CMR Charts &amp; Index Membership $50.00 / month +2 options Join $50.00 / month 2 options Pay Join Pay Join CMR Charts &amp; Index Membership | Whop",
  "finalUrl": "https://whop.com/cmr-premium-membership/cmr-charts-membership/",
  "fetchedAt": "2025-11-04T21:45:00.222Z",
  "textHash": "2de5dc30f2cf57aa877867e6a762e69062c2edc8102a5d1c6970d393d254bca6",
  "drilled": false
}