{
  "baseUrl": "https://whop.com/elitevip/basic-ta-course/",
  "title": "CM&#x27;s Basic TA Course | Whop",
  "h1": "CM&#x27;s Basic TA Course",
  "bullets": [
    "Sign in CS CM&#x27;s Basic TA Course Best technical analysis course for newbees 5.0 ( 38 ) Trading Best technical analysis course in the crypto market $99.00 one-time purchase Pay Purchase Features Access the best techinical analysis course in the crypto market",
    "No BS - Real knowladge by real traders!",
    "U Umatic 20 hours ago If you want to actually make money and eventually KEEP it this is the best group to join and get the skills and guidance to do so .Jomo and CM are professionals and say things as they are they give the bitter truth and not sweet lies ! Best VIP i joined ! Written 4 months after purchase",
    "B Bart 19 days ago Been in the CM community since 2020 and oh boy…. Didn’t regret my membership. Written 19 minutes after purchase",
    "DB Daryl H Baker 20 days ago JoMo and CM are excellent. These guys are pros with a track record scaling back several years and multiple cycles. They are chart maxi’s. No cultish behavior here. They look to extract as much money from the market as possible. Short or long. They do the heavy lifting. 24/7 market surveillance. Trad... Show more Written 3 months after purchase",
    "H Howard 1 month ago This is my review of jomo's Trade Club. After 3 years i can appreciate the benefit of having a true mentor who understands that i as an amateur only need the high probability trade's. to be fare what stands out the most looking back is how he accelerated my learning by teaching me how to fish for se... Show more Written 2 months after purchase"
  ],
  "paras": [
    "Sign in CS CM&#x27;s Basic TA Course Best technical analysis course for newbees 5.0 ( 38 ) Trading Best technical analysis course in the crypto market",
    "Access the best techinical analysis course in the crypto market No BS - Real knowladge by real traders! Reviews 4.95 out of 5 38 total reviews 5 stars 4 stars 3 stars 2 stars 1 star U Umatic 20 hours ago If you want to actually make money and eventually KEEP it this is the best group to join and get the skills and guidance to do so .Jomo and CM are professionals and say things as they are they give the bitter truth and not sweet lies ! Best VIP i joined !",
    "19 days ago Been in the CM community since 2020 and oh boy…. Didn’t regret my membership.",
    "20 days ago JoMo and CM are excellent. These guys are pros with a track record scaling back several years and multiple cycles. They are chart maxi’s. No cultish behavior here. They look to extract as much money from the market as possible. Short or long. They do the heavy lifting. 24/7 market surveillance. Trad...",
    "Written 3 months after purchase H Howard 1 month ago This is my review of jomo's Trade Club. After 3 years i can appreciate the benefit of having a true mentor who understands that i as an amateur only need the high probability trade's. to be fare what stands out the most looking back is how he accelerated my learning by teaching me how to fish for se...",
    "Written 2 months after purchase See all reviews About the creator CM View profile Crypto Mindset @ cryptomindset00 • Joined Jan 2025 Affiliates CS Become an affiliate Crypto Mindset VIP Service 30% reward Earn money by bringing customers to Crypto Mindset VIP Service. Every time a customer purchases using your link, you&#x27;ll earn a commission."
  ],
  "priceTokens": [
    "$99.00",
    "$99.00",
    "$99.00",
    "$1",
    "$1",
    "$1",
    "$22",
    "$1",
    "$1",
    "$1",
    "$1",
    "$1",
    "$2",
    "$1",
    "$2",
    "$2",
    "$2",
    "$2",
    "$3",
    "$3"
  ],
  "faq": [],
  "textSample": "Sign in CS CM&#x27;s Basic TA Course Best technical analysis course for newbees 5.0 ( 38 ) Trading Best technical analysis course in the crypto market $99.00 one-time purchase Pay Purchase Features Access the best techinical analysis course in the crypto market No BS - Real knowladge by real traders! Reviews 4.95 out of 5 38 total reviews 5 stars 4 stars 3 stars 2 stars 1 star U Umatic 20 hours ago If you want to actually make money and eventually KEEP it this is the best group to join and get the skills and guidance to do so .Jomo and CM are professionals and say things as they are they give the bitter truth and not sweet lies ! Best VIP i joined ! Written 4 months after purchase B Bart 19 days ago Been in the CM community since 2020 and oh boy…. Didn’t regret my membership. Written 19 minutes after purchase DB Daryl H Baker 20 days ago JoMo and CM are excellent. These guys are pros with a track record scaling back several years and multiple cycles. They are chart maxi’s. No cultish behavior here. They look to extract as much money from the market as possible. Short or long. They do the heavy lifting. 24/7 market surveillance. Trad... Show more Written 3 months after purchase H Howard 1 month ago This is my review of jomo's Trade Club. After 3 years i can appreciate the benefit of having a true mentor who understands that i as an amateur only need the high probability trade's. to be fare what stands out the most looking back is how he accelerated my learning by teaching me how to fish for se... Show more Written 2 months after purchase See all reviews About the creator CM View profile Crypto Mindset @ cryptomindset00 • Joined Jan 2025 Affiliates CS Become an affiliate Crypto Mindset VIP Service 30% reward Earn money by bringing customers to Crypto Mindset VIP Service. Every time a customer purchases using your link, you&#x27;ll earn a commission. CM&#x27;s Basic TA Course $99.00 one-time purchase Purchase $99.00 one-time purchase Pay Purchase Pay Purchase CM&#x27;s Basic TA Course | Whop",
  "finalUrl": "https://whop.com/elitevip/basic-ta-course/",
  "fetchedAt": "2025-11-05T10:06:41.761Z",
  "textHash": "487b71a5fe89481cac03413d273b23a1364e6d35e6c7ff092c5e3c3f5e3c5358",
  "drilled": false
}