{
  "baseUrl": "https://whop.com/elitevip/profit-maxis/",
  "title": "CM&#x27;s VIP | Whop",
  "h1": "CM&#x27;s VIP",
  "bullets": [
    "CM&#x27;s VIP | Whop Sign in Unmute Unmute CS CM&#x27;s VIP Become a Professional Crypto Trader With CM 5.0 ( 38 ) Trading Full access to all CM&#x27;s trade alerts . market updates . trading courses . VIP community . general support and more $888.00 / 4 months Pay Join Features Chat support",
    "Includes beginner and advanced course materials",
    "✅ Everything in CM&#x27;s Trades",
    "Lifetime Membership Available",
    "U Umatic 5h ago If you want to actually make money and eventually KEEP it this is the best group to join and get the skills and guidance to do so .Jomo and CM are professionals and say things as they are they give the bitter truth and not sweet lies ! Best VIP i joined ! Written 4 months after purchase",
    "B Bart 18 days ago Been in the CM community since 2020 and oh boy…. Didn’t regret my membership. Written 19m after purchase",
    "DB Daryl H Baker 20 days ago JoMo and CM are excellent. These guys are pros with a track record scaling back several years and multiple cycles. They are chart maxi’s. No cultish behavior here. They look to extract as much money from the market as possible. Short or long. They do the heavy lifting. 24/7 market surveillance. Trad... Show more Written 3 months after purchase",
    "H Howard 1 month ago This is my review of jomo's Trade Club. After 3 years i can appreciate the benefit of having a true mentor who understands that i as an amateur only need the high probability trade's. to be fare what stands out the most looking back is how he accelerated my learning by teaching me how to fish for se... Show more Written 2 months after purchase"
  ],
  "paras": [
    "Sign in Unmute Unmute CS CM&#x27;s VIP Become a Professional Crypto Trader With CM 5.0 ( 38 ) Trading Full access to all CM&#x27;s trade alerts . market updates . trading courses . VIP community . general support and more",
    "$888.00 / 4 months Pay Join Features Chat support Includes beginner and advanced course materials ✅ Everything in CM&#x27;s Trades Lifetime Membership Available Reviews 4.95 out of 5 38 total reviews 5 stars 4 stars 3 stars 2 stars 1 star U Umatic 5h ago If you want to actually make money and eventually KEEP it this is the best group to join and get the skills and guidance to do so .Jomo and CM are professionals and say things as they are they give the bitter truth and not sweet lies ! Best VIP i joined !",
    "18 days ago Been in the CM community since 2020 and oh boy…. Didn’t regret my membership.",
    "20 days ago JoMo and CM are excellent. These guys are pros with a track record scaling back several years and multiple cycles. They are chart maxi’s. No cultish behavior here. They look to extract as much money from the market as possible. Short or long. They do the heavy lifting. 24/7 market surveillance. Trad...",
    "Written 3 months after purchase H Howard 1 month ago This is my review of jomo's Trade Club. After 3 years i can appreciate the benefit of having a true mentor who understands that i as an amateur only need the high probability trade's. to be fare what stands out the most looking back is how he accelerated my learning by teaching me how to fish for se...",
    "Written 2 months after purchase See all reviews About the creator CM View profile Crypto Mindset @ cryptomindset00 • Joined Jan 2025 Affiliates CS Become an affiliate Crypto Mindset VIP Service 25% reward Earn money by bringing customers to Crypto Mindset VIP Service. Every time a customer purchases using your link, you&#x27;ll earn a commission."
  ],
  "priceTokens": [
    "$888.00",
    "$888.00",
    "$888.00",
    "$1",
    "$1",
    "$1",
    "$22",
    "$1",
    "$1",
    "$1",
    "$1",
    "$1",
    "$2",
    "$1",
    "$2",
    "$2",
    "$2",
    "$2",
    "$3",
    "$3"
  ],
  "faq": [],
  "textSample": "CM&#x27;s VIP | Whop Sign in Unmute Unmute CS CM&#x27;s VIP Become a Professional Crypto Trader With CM 5.0 ( 38 ) Trading Full access to all CM&#x27;s trade alerts . market updates . trading courses . VIP community . general support and more $888.00 / 4 months Pay Join Features Chat support Includes beginner and advanced course materials ✅ Everything in CM&#x27;s Trades Lifetime Membership Available Reviews 4.95 out of 5 38 total reviews 5 stars 4 stars 3 stars 2 stars 1 star U Umatic 5h ago If you want to actually make money and eventually KEEP it this is the best group to join and get the skills and guidance to do so .Jomo and CM are professionals and say things as they are they give the bitter truth and not sweet lies ! Best VIP i joined ! Written 4 months after purchase B Bart 18 days ago Been in the CM community since 2020 and oh boy…. Didn’t regret my membership. Written 19m after purchase DB Daryl H Baker 20 days ago JoMo and CM are excellent. These guys are pros with a track record scaling back several years and multiple cycles. They are chart maxi’s. No cultish behavior here. They look to extract as much money from the market as possible. Short or long. They do the heavy lifting. 24/7 market surveillance. Trad... Show more Written 3 months after purchase H Howard 1 month ago This is my review of jomo's Trade Club. After 3 years i can appreciate the benefit of having a true mentor who understands that i as an amateur only need the high probability trade's. to be fare what stands out the most looking back is how he accelerated my learning by teaching me how to fish for se... Show more Written 2 months after purchase See all reviews About the creator CM View profile Crypto Mindset @ cryptomindset00 • Joined Jan 2025 Affiliates CS Become an affiliate Crypto Mindset VIP Service 25% reward Earn money by bringing customers to Crypto Mindset VIP Service. Every time a customer purchases using your link, you&#x27;ll earn a commission. CM&#x27;s VIP $888.00 / 4 months +1 option Join $888.00 / 4 months 1 option Pay Join Pay Join",
  "finalUrl": "https://whop.com/elitevip/profit-maxis/",
  "fetchedAt": "2025-11-04T19:41:52.915Z",
  "textHash": "93a9f5db04214ec97410010d045046d061e89d9d85e0107fc178dce78f2babf8",
  "drilled": false
}