{
  "baseUrl": "https://whop.com/trentknox/starter-package-launch-essentials/",
  "title": "CREATOR | Whop",
  "h1": "CREATOR",
  "bullets": [
    "Sign in TV CREATOR Unleash Your Potential with Expert Digital Transformation! 5.0 ( 5 ) Other A foundational program designed for creators or small businesses ready to begin monetizing their content and building scalable systems. $999.98 / month Pay Join Features ğŸ¬ Generate 20 Clips/Week [Post 5-7 Short Form]",
    "â¬†ï¸ 2 Platforms Managed (choose: TikTok, IG, YT, etc.)",
    "ğŸ”— 1 Funnel Setup (Stan, Whop, Gumroad, etc.)",
    "ğŸ“§ 1 Weekly Email (newsletter or promo)",
    "ğŸ“ 1 Weekly Call (accountability + optimization)",
    "F FireStart 8 months ago ğŸ”¥ Trent Knoxâ€™s Creator Fellowship (Whop) delivers scalable systems for creators/influencers, with tiered plans ($9.99-$79,999.99/mo) offering automation, branding hacks, 1:1 coaching, and a free Discord community for collabs + prizes. Users call Trent a â€œmarketing geniusâ€ for his ROI-focused approa... Show more Written 3 days after purchase",
    "AV Aristotle Dio Vasilakos 8 months ago Trent is an amazing guy and he provides a lot of value and insights in a plethora of different matters and sectors ! Highly recommended to every professional â—ï¸ Written 2 days after purchase",
    "MR Mads P. Rossau 1 year ago Trent is an all-around great guy who has a lot of business acumen. He's always down to have a conversation to help out whenever something pops up Written 1 month after purchase",
    "CG Chris Gregory 1 year ago This guy is 1 of a kind when it come to systemâ€™s, marketing & branding i have yet to Interact with anyone as knowlegable Written 2 months after purchase"
  ],
  "paras": [
    "Sign in TV CREATOR Unleash Your Potential with Expert Digital Transformation! 5.0 ( 5 ) Other A foundational program designed for creators or small businesses ready to begin monetizing their content and building scalable systems.",
    "ğŸ¬ Generate 20 Clips/Week [Post 5-7 Short Form] â¬†ï¸ 2 Platforms Managed (choose: TikTok, IG, YT, etc.) ğŸ”— 1 Funnel Setup (Stan, Whop, Gumroad, etc.) ğŸ“§ 1 Weekly Email (newsletter or promo) ğŸ“ 1 Weekly Call (accountability + optimization) Reviews 5 out of 5 5 total reviews 5 stars 4 stars 3 stars 2 stars 1 star F FireStart 8 months ago ğŸ”¥ Trent Knoxâ€™s Creator Fellowship (Whop) delivers scalable systems for creators/influencers, with tiered plans ($9.99-$79,999.99/mo) offering automation, branding hacks, 1:1 coaching, and a free Discord community for collabs + prizes. Users call Trent a â€œmarketing geniusâ€ for his ROI-focused approa...",
    "Written 3 days after purchase AV Aristotle Dio Vasilakos 8 months ago Trent is an amazing guy and he provides a lot of value and insights in a plethora of different matters and sectors ! Highly recommended to every professional â—ï¸",
    "1 year ago Trent is an all-around great guy who has a lot of business acumen. He's always down to have a conversation to help out whenever something pops up",
    "1 year ago This guy is 1 of a kind when it come to systemâ€™s, marketing & branding i have yet to Interact with anyone as knowlegable",
    "About the creator TK View profile Trent Knox @ trentknox â€¢ Joined Feb 2024 Trent Knox is a Content Monetization Consultant specializing in digital strategy, content production, and automation, helping creators and brands scale in the digital space. Affiliates TV Become an affiliate TRENT KNOX VENTURES 10% reward Earn money by bringing customers to TRENT KNOX VENTURES. Every time a customer purchases using your link, you&#x27;ll earn a commission."
  ],
  "priceTokens": [
    "$999.98",
    "$9.99",
    "$79,999.99",
    "$999.98",
    "$999.98",
    "$1",
    "$1",
    "$1",
    "$22",
    "$1",
    "$1",
    "$1",
    "$1",
    "$1",
    "$2",
    "$1",
    "$2",
    "$2",
    "$2",
    "$2"
  ],
  "faq": [],
  "textSample": "Sign in TV CREATOR Unleash Your Potential with Expert Digital Transformation! 5.0 ( 5 ) Other A foundational program designed for creators or small businesses ready to begin monetizing their content and building scalable systems. $999.98 / month Pay Join Features ğŸ¬ Generate 20 Clips/Week [Post 5-7 Short Form] â¬†ï¸ 2 Platforms Managed (choose: TikTok, IG, YT, etc.) ğŸ”— 1 Funnel Setup (Stan, Whop, Gumroad, etc.) ğŸ“§ 1 Weekly Email (newsletter or promo) ğŸ“ 1 Weekly Call (accountability + optimization) Reviews 5 out of 5 5 total reviews 5 stars 4 stars 3 stars 2 stars 1 star F FireStart 8 months ago ğŸ”¥ Trent Knoxâ€™s Creator Fellowship (Whop) delivers scalable systems for creators/influencers, with tiered plans ($9.99-$79,999.99/mo) offering automation, branding hacks, 1:1 coaching, and a free Discord community for collabs + prizes. Users call Trent a â€œmarketing geniusâ€ for his ROI-focused approa... Show more Written 3 days after purchase AV Aristotle Dio Vasilakos 8 months ago Trent is an amazing guy and he provides a lot of value and insights in a plethora of different matters and sectors ! Highly recommended to every professional â—ï¸ Written 2 days after purchase MR Mads P. Rossau 1 year ago Trent is an all-around great guy who has a lot of business acumen. He's always down to have a conversation to help out whenever something pops up Written 1 month after purchase CG Chris Gregory 1 year ago This guy is 1 of a kind when it come to systemâ€™s, marketing & branding i have yet to Interact with anyone as knowlegable Written 2 months after purchase See all reviews About the creator TK View profile Trent Knox @ trentknox â€¢ Joined Feb 2024 Trent Knox is a Content Monetization Consultant specializing in digital strategy, content production, and automation, helping creators and brands scale in the digital space. Affiliates TV Become an affiliate TRENT KNOX VENTURES 10% reward Earn money by bringing customers to TRENT KNOX VENTURES. Every time a customer purchases using your link, you&#x27;ll earn a commission. CREATOR $999.98 / month Join $999.98 / month Pay Join Pay Join CREATOR | Whop",
  "finalUrl": "https://whop.com/trentknox/starter-package-launch-essentials/",
  "fetchedAt": "2025-11-04T20:11:13.920Z",
  "textHash": "e9ed549d761d30f71e6eb44b73ff6623e43ae27fab935d5c24c50e4311a4ff34",
  "drilled": false
}