{
  "baseUrl": "https://whop.com/creatorblueprintblacklist/content-blueprint/",
  "title": "Creator Blueprint Lite | Whop",
  "h1": "Creator Blueprint Lite",
  "bullets": [
    "Sign in Unmute Unmute CB Creator Blueprint Lite Start Selling Ditial Products With Content 5.0 ( 5 ) Social media Start selling digital products to make your first $10,000 with my 30 day blueprint. $27.00 / month Pay Get access Features Unlock hours of trainings to grow fast and monetize your content",
    "Join 3 weekly meetings for coaching, feedback, and live strategy",
    "Get premium tools, templates, custom AI&#x27;s, and high-level resources",
    "Learn the real systems I used to earn $100K+ by 15 with social media",
    "Network with other creators striving to do the same things as you",
    "D dami 2 months ago Great Platform, still waiting for Money to Roll in soon ðŸ”¥ðŸ”¥ðŸ”¥ Written 5 days after purchase",
    "BE Brad Ekhoff 8 hours ago Written 14 days after purchase",
    "A Adrian 15 days ago Written 3 days after purchase",
    "PM Peyton Mastropietro 1 month ago Written 1 day after purchase"
  ],
  "paras": [
    "Sign in Unmute Unmute CB Creator Blueprint Lite Start Selling Ditial Products With Content 5.0 ( 5 ) Social media Start selling digital products to make your first $10,000 with my 30 day blueprint.",
    "$27.00 / month Pay Get access Features Unlock hours of trainings to grow fast and monetize your content Join 3 weekly meetings for coaching, feedback, and live strategy Get premium tools, templates, custom AI&#x27;s, and high-level resources Learn the real systems I used to earn $100K+ by 15 with social media Network with other creators striving to do the same things as you Reviews 5 out of 5 5 total reviews 5 stars 4 stars 3 stars 2 stars 1 star D dami 2 months ago Great Platform, still waiting for Money to Roll in soon ðŸ”¥ðŸ”¥ðŸ”¥",
    "8 hours ago",
    "15 days ago",
    "1 month ago",
    "About the creator MG View profile Maddox Goforth @ goforthkmaddox â€¢ Joined May 2024 Iâ€™m 15, and Iâ€™ve already made over $100,000â€”all from social media. I didnâ€™t hit some lucky trend or go viral once and disappear. From growing over 400,000 followers to selling digital products and making money off pure attentionâ€”social media changed my life. Thatâ€™s why I built Creator Blueprintâ€”to teach you exactly how to make money with content on DAY ONE. FAQs Do I need prior video editing experience? How do I get paid? What equipment or software do I need? How many hours do I need to work? Is this a full-time job or side hustle? Affiliates CB Become an affiliate Creator Blueprint 50% reward Earn money by bringing customers to Creator Blueprint. Every time a customer purchases using your link, you&#x27;ll earn a commission."
  ],
  "priceTokens": [
    "$10,000",
    "$27.00",
    "$100",
    "$100,000",
    "$27.00",
    "$27.00",
    "$1",
    "$1",
    "$1",
    "$22",
    "$1",
    "$1",
    "$1",
    "$1",
    "$1",
    "$2",
    "$1",
    "$2",
    "$2",
    "$2"
  ],
  "faq": [],
  "textSample": "Sign in Unmute Unmute CB Creator Blueprint Lite Start Selling Ditial Products With Content 5.0 ( 5 ) Social media Start selling digital products to make your first $10,000 with my 30 day blueprint. $27.00 / month Pay Get access Features Unlock hours of trainings to grow fast and monetize your content Join 3 weekly meetings for coaching, feedback, and live strategy Get premium tools, templates, custom AI&#x27;s, and high-level resources Learn the real systems I used to earn $100K+ by 15 with social media Network with other creators striving to do the same things as you Reviews 5 out of 5 5 total reviews 5 stars 4 stars 3 stars 2 stars 1 star D dami 2 months ago Great Platform, still waiting for Money to Roll in soon ðŸ”¥ðŸ”¥ðŸ”¥ Written 5 days after purchase BE Brad Ekhoff 8 hours ago Written 14 days after purchase A Adrian 15 days ago Written 3 days after purchase PM Peyton Mastropietro 1 month ago Written 1 day after purchase See all reviews About the creator MG View profile Maddox Goforth @ goforthkmaddox â€¢ Joined May 2024 Iâ€™m 15, and Iâ€™ve already made over $100,000â€”all from social media. I didnâ€™t hit some lucky trend or go viral once and disappear. From growing over 400,000 followers to selling digital products and making money off pure attentionâ€”social media changed my life. Thatâ€™s why I built Creator Blueprintâ€”to teach you exactly how to make money with content on DAY ONE. FAQs Do I need prior video editing experience? How do I get paid? What equipment or software do I need? How many hours do I need to work? Is this a full-time job or side hustle? Affiliates CB Become an affiliate Creator Blueprint 50% reward Earn money by bringing customers to Creator Blueprint. Every time a customer purchases using your link, you&#x27;ll earn a commission. Creator Blueprint Lite $27.00 / month +1 option Get access $27.00 / month 1 option Pay Get access Pay Get access Creator Blueprint Lite | Whop",
  "finalUrl": "https://whop.com/creatorblueprintblacklist/content-blueprint/",
  "fetchedAt": "2025-11-05T10:49:43.930Z",
  "textHash": "2a33475ecc924cfcbac33e72ee74f12c6552f9d536089934d822d3a387f4127d",
  "drilled": false
}