{
  "baseUrl": "https://whop.com/cryptowolfpack/?a=alexburnett21",
  "title": "Crypto Wolf Pack | Whop",
  "h1": "Crypto Wolf Pack",
  "bullets": [
    "Powered by CP Crypto Wolf Pack I&#x27;m a UK based crypto content creator and trader, you can find me on Tiktok and Youtube where i get around 5 million to 10 million video views every month. 5.0 ( 44 ) Contact seller Products Unmute £24.99 / month Join the Crypto Wolf Pack – Signals, Tools &amp; Community to Level Up Your Trading Crypto Wolf Pack 5.0 ( 29 ) Unmute £39.99 / month Free trial Wolf Pack TradingView Indicator for Crypto Day Traders - 7 DAY FREE TRIAL Howl Trading View Indicator 4.9 ( 7 ) Contact seller Reviews JD Joe downunder • Crypto Wolf Pack 2 days ago Finally found the right community, the support from members in here is second to none. Love getting on the lives...the team offer so much info which gives me confidence in trading crypto. Well done Matty and Team. Written 15 days after purchase",
    "T TRIM • Howl Trading View Indicator 10 days ago Great community Written 14 days after purchase",
    "F Faye 1 month ago Love this community. I had never traded before and they have guided and supported me and many others every step of the way. Written 3 months after purchase",
    "FU Forrest Unfiltered • Crypto Wolf Pack 1 month ago Great community of rockstars Written 4 months after purchase"
  ],
  "paras": [
    "CP Crypto Wolf Pack I&#x27;m a UK based crypto content creator and trader, you can find me on Tiktok and Youtube where i get around 5 million to 10 million video views every month. 5.0 ( 44 ) Contact seller Products Unmute £24.99 / month Join the Crypto Wolf Pack – Signals, Tools &amp; Community to Level Up Your Trading Crypto Wolf Pack 5.0 ( 29 ) Unmute £39.99 / month Free trial Wolf Pack TradingView Indicator for Crypto Day Traders - 7 DAY FREE TRIAL Howl Trading View Indicator 4.9 ( 7 ) Contact seller Reviews JD Joe downunder • Crypto Wolf Pack 2 days ago Finally found the right community, the support from members in here is second to none. Love getting on the lives...the team offer so much info which gives me confidence in trading crypto. Well done Matty and Team.",
    "10 days ago Great community",
    "1 month ago Love this community. I had never traded before and they have guided and supported me and many others every step of the way.",
    "1 month ago Great community of rockstars"
  ],
  "priceTokens": [
    "£24.99",
    "£39.99",
    "$1",
    "$1",
    "$1",
    "$21",
    "$1",
    "$1",
    "$1",
    "$1",
    "$28",
    "$1",
    "$28",
    "$28",
    "$28",
    "$28",
    "$3",
    "$3",
    "$3",
    "$10"
  ],
  "faq": [],
  "textSample": "Powered by CP Crypto Wolf Pack I&#x27;m a UK based crypto content creator and trader, you can find me on Tiktok and Youtube where i get around 5 million to 10 million video views every month. 5.0 ( 44 ) Contact seller Products Unmute £24.99 / month Join the Crypto Wolf Pack – Signals, Tools &amp; Community to Level Up Your Trading Crypto Wolf Pack 5.0 ( 29 ) Unmute £39.99 / month Free trial Wolf Pack TradingView Indicator for Crypto Day Traders - 7 DAY FREE TRIAL Howl Trading View Indicator 4.9 ( 7 ) Contact seller Reviews JD Joe downunder • Crypto Wolf Pack 2 days ago Finally found the right community, the support from members in here is second to none. Love getting on the lives...the team offer so much info which gives me confidence in trading crypto. Well done Matty and Team. Written 15 days after purchase T TRIM • Howl Trading View Indicator 10 days ago Great community Written 14 days after purchase F Faye 1 month ago Love this community. I had never traded before and they have guided and supported me and many others every step of the way. Written 3 months after purchase FU Forrest Unfiltered • Crypto Wolf Pack 1 month ago Great community of rockstars Written 4 months after purchase See all reviews Crypto Wolf Pack | Whop",
  "finalUrl": "https://whop.com/cryptowolfpack/?a=alexburnett21",
  "fetchedAt": "2025-11-04T19:59:19.203Z",
  "textHash": "2863b12ede4074c19e9874652a138098f8645feabb6919579aa67a52891015c1",
  "drilled": false
}