{
  "baseUrl": "https://whop.com/algorithmic-trading-blueprint/daily-pips-trading-premium/",
  "title": "Daily Pips Premium Access | Whop",
  "h1": "Daily Pips Premium Access",
  "bullets": [
    "Sign in Unmute Unmute DT Daily Pips Premium Access Cut The Noise, Become A Profitable Trader 5.0 ( 7 ) Trading Join the Daily Pips Trading community and start trading with structure. → Daily live trading sessions (9:15 - 10:40 AM NY) → High-probability setups shared in real time → Lifetime access to the Picasso FVG Framework (my proven, profitable 3-step trading model) Secure checkout. Cancel anytime. ⚡ Next live session starts in 48 hours. $49.00 / month 7 day trial Pay Join Join 34 members Features Direct access to Ignas - Licensed full-time trader with over 6 years of experience",
    "Get step-by-step trade setups that actually work",
    "4x live trading sessions a week",
    "Weekly outlook every Sunday to stay updated with the market",
    "ICT Study Guide on Y22, Y25, Breaker Block and other mentorship classes",
    "EK Evaldas Kaminskas 6 months ago I met Ignas while on vacation in Bali, just as I was starting my trading journey. I had been studying Smart Money Concepts on my own but felt overwhelmed — there were too many moving parts and I could not get anything right. After talking with Ignas about my struggles, he immediately understood wha... Show more Written 1 year after purchase",
    "R RK 7 months ago One stop shop to learn ins and outs of trading ICT concepts from a highly disciplined and knowledgable founder Ignas and the team. I had experience prior to joining but I was lacking discipline and patience, it's improving daily watching Ignas during Live streams and Live price action. It's priceles... Show more Written 21 minutes after purchase",
    "JM Jonas Milašiūnas 7 months ago Truly worth it to invest your time and energy! Starting from zero trading experience, Daily Pips team helps to guide through the fundamentals and any questions that may rise. No gambling, just a consistent strategy and a helpful community - that's the way to profit and I could not be happier I disco... Show more Written 8 minutes after purchase",
    "W worstspirit 8 months ago Daily Pips changed the game for me. No more second-guessing trades, no more letting emotions take over - just a strategy and a community that actually helps you grow. Before I joined, I was all over the place. Some days I’d win, other days I’d give it all back. But once I started consistently watc... Show more Written 8 minutes after purchase"
  ],
  "paras": [
    "Sign in Unmute Unmute DT Daily Pips Premium Access Cut The Noise, Become A Profitable Trader 5.0 ( 7 ) Trading Join the Daily Pips Trading community and start trading with structure. → Daily live trading sessions (9:15 - 10:40 AM NY) → High-probability setups shared in real time → Lifetime access to the Picasso FVG Framework (my proven, profitable 3-step trading model)",
    "Secure checkout. Cancel anytime. ⚡ Next live session starts in 48 hours.",
    "$49.00 / month 7 day trial Pay Join Join 34 members Features Direct access to Ignas - Licensed full-time trader with over 6 years of experience Get step-by-step trade setups that actually work 4x live trading sessions a week Weekly outlook every Sunday to stay updated with the market ICT Study Guide on Y22, Y25, Breaker Block and other mentorship classes Reviews 5 out of 5 7 total reviews 5 stars 4 stars 3 stars 2 stars 1 star EK Evaldas Kaminskas 6 months ago I met Ignas while on vacation in Bali, just as I was starting my trading journey. I had been studying Smart Money Concepts on my own but felt overwhelmed — there were too many moving parts and I could not get anything right. After talking with Ignas about my struggles, he immediately understood wha...",
    "Written 1 year after purchase R RK 7 months ago One stop shop to learn ins and outs of trading ICT concepts from a highly disciplined and knowledgable founder Ignas and the team. I had experience prior to joining but I was lacking discipline and patience, it's improving daily watching Ignas during Live streams and Live price action. It's priceles...",
    "Written 21 minutes after purchase JM Jonas Milašiūnas 7 months ago Truly worth it to invest your time and energy! Starting from zero trading experience, Daily Pips team helps to guide through the fundamentals and any questions that may rise. No gambling, just a consistent strategy and a helpful community - that's the way to profit and I could not be happier I disco...",
    "Written 8 minutes after purchase W worstspirit 8 months ago Daily Pips changed the game for me. No more second-guessing trades, no more letting emotions take over - just a strategy and a community that actually helps you grow. Before I joined, I was all over the place. Some days I’d win, other days I’d give it all back. But once I started consistently watc...",
    "Written 8 minutes after purchase See all reviews About the creator IT View profile Ignas | Professional Trader @ user6f162583516 • Joined Jan 2024 I’m Ignas - a day trader and mentor helping people master the skill of reading the price and take full control of their time and income. I don’t sell signals or shortcuts. I teach real strategy, market reading, and execution built on experience and precision. If you’re ready to stop guessing and start trading with confidence, I’ll show you how. FAQs Is this community suitable for beginners? What can I do if Discord does not connect? What makes daily pips trading unique? How can I benefit from live trading sessions? Affiliates DT Become an affiliate Daily Pips Trading 30% reward Earn money by bringing customers to Daily Pips Trading. Every time a customer purchases using your link, you&#x27;ll earn a commission."
  ],
  "priceTokens": [
    "$49.00",
    "$49.00",
    "$49.00",
    "$1",
    "$1",
    "$1",
    "$23",
    "$1",
    "$1",
    "$1",
    "$1",
    "$1",
    "$2",
    "$1",
    "$2",
    "$2",
    "$2",
    "$2",
    "$3",
    "$3"
  ],
  "faq": [],
  "textSample": "Sign in Unmute Unmute DT Daily Pips Premium Access Cut The Noise, Become A Profitable Trader 5.0 ( 7 ) Trading Join the Daily Pips Trading community and start trading with structure. → Daily live trading sessions (9:15 - 10:40 AM NY) → High-probability setups shared in real time → Lifetime access to the Picasso FVG Framework (my proven, profitable 3-step trading model) Secure checkout. Cancel anytime. ⚡ Next live session starts in 48 hours. $49.00 / month 7 day trial Pay Join Join 34 members Features Direct access to Ignas - Licensed full-time trader with over 6 years of experience Get step-by-step trade setups that actually work 4x live trading sessions a week Weekly outlook every Sunday to stay updated with the market ICT Study Guide on Y22, Y25, Breaker Block and other mentorship classes Reviews 5 out of 5 7 total reviews 5 stars 4 stars 3 stars 2 stars 1 star EK Evaldas Kaminskas 6 months ago I met Ignas while on vacation in Bali, just as I was starting my trading journey. I had been studying Smart Money Concepts on my own but felt overwhelmed — there were too many moving parts and I could not get anything right. After talking with Ignas about my struggles, he immediately understood wha... Show more Written 1 year after purchase R RK 7 months ago One stop shop to learn ins and outs of trading ICT concepts from a highly disciplined and knowledgable founder Ignas and the team. I had experience prior to joining but I was lacking discipline and patience, it's improving daily watching Ignas during Live streams and Live price action. It's priceles... Show more Written 21 minutes after purchase JM Jonas Milašiūnas 7 months ago Truly worth it to invest your time and energy! Starting from zero trading experience, Daily Pips team helps to guide through the fundamentals and any questions that may rise. No gambling, just a consistent strategy and a helpful community - that's the way to profit and I could not be happier I disco... Show more Written 8 minutes after purchase W worstspirit 8 months ago Daily Pips changed the game for me. No more second-guessing trades, no more letting emotions take over - just a strategy and a community that actually helps you grow. Before I joined, I was all over the place. Some days I’d win, other days I’d give it all back. But once I started consistently watc... Show more Written 8 minutes after purchase See all reviews About the creator IT View profile Ignas | Professional Trader @ user6f162583516 • Joined Jan 2024 I’m Ignas - a day trader and mentor helping people master the skill of reading the price and take full control of their time and income. I don’t sell signals or shortcuts. I teach real strategy, market reading, and execution built on experience and precision. If you’re ready to stop guessing and start trading with confidence, I’ll show you how. FAQs Is this community suitable for beginners? What can I do if Discord does not connect? What makes daily pips trading unique? How can I benefit from live trading sessions? Affiliates DT Become an affiliate Daily Pips Trading 30% reward Earn money by bringing customers to Daily Pips Trading. Every time a customer purchases using your link, you&#x27;ll earn a commission. Daily Pips Premium Access $49.00 / month +1 option Join $49.00 / month 1 option Pay Join Pay Join Daily Pips Premium Access | Whop",
  "finalUrl": "https://whop.com/algorithmic-trading-blueprint/daily-pips-trading-premium/",
  "fetchedAt": "2025-11-05T09:59:22.256Z",
  "textHash": "c6982f06b5bf408e4d32c0f5dadb5d687503804bde00bc797f7c4b68bc742f46",
  "drilled": false
}