{
  "baseUrl": "https://whop.com/dead-longer-than-alive-ea/dead-longer-than-alive-ea/?a=alexburnett21",
  "title": "Dead Longer Than Alive | Whop",
  "h1": "Dead Longer Than Alive",
  "bullets": [
    "Sign in Unmute Unmute DA Dead Longer Than Alive Reach your highest self physically, mentally &amp; financially! 5.0 ( 1 ) Other The road map is simple if you follow it to perfection! My program will get you into the best shape, mindset, and financial outcome of your life! Become your best self! Join Features Elite Life/Mindset Coaching: (60Min) Zoom Weekly (1on1) Me and You",
    "Elite Life/Mindset Coaching: 24/7 Support with my private all access group",
    "Mindset/Training/Nutrition Program: Custom daily workouts with private trainings",
    "Mindset/Training/Nutrition Program: Perfect Meal Plans To Track Daily",
    "Weekly Group Zoom Calls and Access To Dead Longer Than Alive Members",
    "KV Kevin Vichaiyarath 21 days ago Written 2 months after purchase"
  ],
  "paras": [
    "Sign in Unmute Unmute DA Dead Longer Than Alive Reach your highest self physically, mentally &amp; financially! 5.0 ( 1 ) Other The road map is simple if you follow it to perfection!",
    "My program will get you into the best shape, mindset, and financial outcome of your life!",
    "Become your best self!",
    "Elite Life/Mindset Coaching: (60Min) Zoom Weekly (1on1) Me and You Elite Life/Mindset Coaching: 24/7 Support with my private all access group Mindset/Training/Nutrition Program: Custom daily workouts with private trainings Mindset/Training/Nutrition Program: Perfect Meal Plans To Track Daily Weekly Group Zoom Calls and Access To Dead Longer Than Alive Members Reviews 5 out of 5 1 review 5 stars 4 stars 3 stars 2 stars 1 star KV Kevin Vichaiyarath 21 days ago",
    "Affiliates DA Become an affiliate Dead Longer Than Alive 30% reward Earn money by bringing customers to Dead Longer Than Alive. Every time a customer purchases using your link, you&#x27;ll earn a commission."
  ],
  "priceTokens": [
    "$299.00",
    "$299.00",
    "$1",
    "$1",
    "$1",
    "$23",
    "$1",
    "$1",
    "$1",
    "$1",
    "$1",
    "$2",
    "$1",
    "$2",
    "$2",
    "$2",
    "$2",
    "$3",
    "$3",
    "$3"
  ],
  "faq": [],
  "textSample": "Sign in Unmute Unmute DA Dead Longer Than Alive Reach your highest self physically, mentally &amp; financially! 5.0 ( 1 ) Other The road map is simple if you follow it to perfection! My program will get you into the best shape, mindset, and financial outcome of your life! Become your best self! Join Features Elite Life/Mindset Coaching: (60Min) Zoom Weekly (1on1) Me and You Elite Life/Mindset Coaching: 24/7 Support with my private all access group Mindset/Training/Nutrition Program: Custom daily workouts with private trainings Mindset/Training/Nutrition Program: Perfect Meal Plans To Track Daily Weekly Group Zoom Calls and Access To Dead Longer Than Alive Members Reviews 5 out of 5 1 review 5 stars 4 stars 3 stars 2 stars 1 star KV Kevin Vichaiyarath 21 days ago Written 2 months after purchase About the creator JH View profile Josh Hare @ joshharealive â€¢ Joined Apr 2025 From homelessness to a top sales leader, I&#x27;ve mastered life&#x27;s challenges in health, wealth, and relationships. My journey equips me uniquely to guide others in achieving 6-figures. Affiliates DA Become an affiliate Dead Longer Than Alive 30% reward Earn money by bringing customers to Dead Longer Than Alive. Every time a customer purchases using your link, you&#x27;ll earn a commission. Dead Longer Than Alive $299.00 / month +7 options Join $299.00 / month 7 options Join Dead Longer Than Alive | Whop",
  "finalUrl": "https://whop.com/dead-longer-than-alive-ea/dead-longer-than-alive-ea/?a=alexburnett21",
  "fetchedAt": "2025-11-05T09:16:17.303Z",
  "textHash": "0d6b745ffd52e3b84481abd78f65cca29f91b087cebd98a7a5d34b0f11178f90",
  "drilled": true
}