{
  "baseUrl": "https://whop.com/charlie-newnham/?a=alexburnett21",
  "title": "Charlie Newnham | Whop",
  "h1": "Charlie Newnham",
  "bullets": [
    "Powered by CN Charlie Newnham Helping You Make ðŸ’¸ Online The Simplest Way Possible! Â£250k With Digital Products! 5.0 ( 63 ) Contact seller Products Unmute Â£9.99 / week Free trial Create An Income Online The Simple Way (Free Trial) Digital Income Simplified 5.0 ( 1 ) Unmute Â£197.00 Start Selling Digital Products With Live Support Digital Wealth Simplified 5.0 ( 51 ) Unmute Â£27.00 Beginner Friendly Side Hustle Anyone Can Do Digital Products Simplified 4.7 ( 3 ) Contact seller Reviews M Monika â€¢ Digital Income Simplified 18 days ago I started Charlieâ€™s course with zero experience and now Iâ€™ve built my first digital product. The lessons are short, clear, and easy to follow. Charlie keeps it real and makes everything simple. The community is supportive and full of people like me starting from scratch. This course gave me confiden... Show more Written 7 days after purchase",
    "ZP Zack P â€¢ Digital Wealth Simplified 23 days ago Great App and easy to use, Iâ€™m a total beginner at this stuff so itâ€™ll be interesting as to where this takes me. Written 2 days after purchase",
    "DK Dean Kirk â€¢ Digital Wealth Simplified 3 months ago I joined the DWS in June 2025 and working my way through the course, the course is great so much information which is ideal for beginners like myself. Some of the tips are mind blowing cant wait to see where this journey goes. Written 1 month after purchase",
    "E Emma â€¢ Digital Wealth Simplified 4 months ago Iâ€™ve recently joined the DWS, and nearly finished all the modules, which are great and easy to follow and understand as a complete beginner. Iâ€™m looking forward to setting up and my journey to begin. Written 2 months after purchase"
  ],
  "paras": [
    "CN Charlie Newnham Helping You Make ðŸ’¸ Online The Simplest Way Possible! Â£250k With Digital Products! 5.0 ( 63 ) Contact seller Products Unmute Â£9.99 / week Free trial Create An Income Online The Simple Way (Free Trial) Digital Income Simplified 5.0 ( 1 ) Unmute Â£197.00 Start Selling Digital Products With Live Support Digital Wealth Simplified 5.0 ( 51 ) Unmute Â£27.00 Beginner Friendly Side Hustle Anyone Can Do Digital Products Simplified 4.7 ( 3 ) Contact seller Reviews M Monika â€¢ Digital Income Simplified 18 days ago I started Charlieâ€™s course with zero experience and now Iâ€™ve built my first digital product. The lessons are short, clear, and easy to follow. Charlie keeps it real and makes everything simple. The community is supportive and full of people like me starting from scratch. This course gave me confiden...",
    "Written 7 days after purchase ZP Zack P â€¢ Digital Wealth Simplified 23 days ago Great App and easy to use, Iâ€™m a total beginner at this stuff so itâ€™ll be interesting as to where this takes me.",
    "3 months ago I joined the DWS in June 2025 and working my way through the course, the course is great so much information which is ideal for beginners like myself. Some of the tips are mind blowing cant wait to see where this journey goes.",
    "4 months ago Iâ€™ve recently joined the DWS, and nearly finished all the modules, which are great and easy to follow and understand as a complete beginner. Iâ€™m looking forward to setting up and my journey to begin."
  ],
  "priceTokens": [
    "Â£250",
    "Â£9.99",
    "Â£197.00",
    "Â£27.00",
    "$1",
    "$1",
    "$1",
    "$21",
    "$1",
    "$1",
    "$1",
    "$1",
    "$28",
    "$1",
    "$28",
    "$28",
    "$28",
    "$28",
    "$3",
    "$3"
  ],
  "faq": [],
  "textSample": "Powered by CN Charlie Newnham Helping You Make ðŸ’¸ Online The Simplest Way Possible! Â£250k With Digital Products! 5.0 ( 63 ) Contact seller Products Unmute Â£9.99 / week Free trial Create An Income Online The Simple Way (Free Trial) Digital Income Simplified 5.0 ( 1 ) Unmute Â£197.00 Start Selling Digital Products With Live Support Digital Wealth Simplified 5.0 ( 51 ) Unmute Â£27.00 Beginner Friendly Side Hustle Anyone Can Do Digital Products Simplified 4.7 ( 3 ) Contact seller Reviews M Monika â€¢ Digital Income Simplified 18 days ago I started Charlieâ€™s course with zero experience and now Iâ€™ve built my first digital product. The lessons are short, clear, and easy to follow. Charlie keeps it real and makes everything simple. The community is supportive and full of people like me starting from scratch. This course gave me confiden... Show more Written 7 days after purchase ZP Zack P â€¢ Digital Wealth Simplified 23 days ago Great App and easy to use, Iâ€™m a total beginner at this stuff so itâ€™ll be interesting as to where this takes me. Written 2 days after purchase DK Dean Kirk â€¢ Digital Wealth Simplified 3 months ago I joined the DWS in June 2025 and working my way through the course, the course is great so much information which is ideal for beginners like myself. Some of the tips are mind blowing cant wait to see where this journey goes. Written 1 month after purchase E Emma â€¢ Digital Wealth Simplified 4 months ago Iâ€™ve recently joined the DWS, and nearly finished all the modules, which are great and easy to follow and understand as a complete beginner. Iâ€™m looking forward to setting up and my journey to begin. Written 2 months after purchase See all reviews Charlie Newnham | Whop",
  "finalUrl": "https://whop.com/charlie-newnham/?a=alexburnett21",
  "fetchedAt": "2025-11-05T10:37:18.817Z",
  "textHash": "0004fcc9b414249d04efa1a819438cfdf8f0b968a16c1fdb60c475cfa65f9b10",
  "drilled": false
}