{
  "baseUrl": "https://whop.com/bulltradefinder/trading-alerts-education-a9/",
  "title": "Trading Discord &amp; Algo Combo | Whop",
  "h1": "Trading Discord &amp; Algo Combo",
  "bullets": [
    "Trading Discord &amp; Algo Combo | Whop Sign in B Trading Discord &amp; Algo Combo Master Trading with BTF 5.0 ( 66 ) Trading $79.00 / month Pay Join Join 335 members Features Real-Time Signals – Entries, targets &amp; stop losses for high-probability trades",
    "Master trading with expert education, strategies &amp; insights to level up",
    "We trade spreads, options, shares &amp; build long-term wealth with investing",
    "Access to Gnotz Algo &amp; BullTradeFinder Discord—trade smarter, win bigger",
    "Long Term Charts updated daily, 300+ charts a month with requests.",
    "PR Pradeep Raghuwanshi 2 years ago One of the best subscription you can get as a trader, filled with experts who help you become a better trader. Written 8 months after purchase",
    "M martinjcole 2 years ago A large number of thoughtful people engaging together in a meaningful way. I enjoy being a part of this community and look forward to thriving together through our shared futures. Written 2 months after purchase",
    "TK Thad Key 2 years ago Great room! Transparent trades with a winning strategy. BullTradeFinder is one of the few legit discords that utilizes a consistent, winning strategy. Gnotz is always helpful at answering questions and helping everyone. Cannot recommend enough! Written 1 month after purchase",
    "OT Othman Taleb 2 years ago Very friendly discord and very friendly owner. They have a good track record of solid wins. Their credit spreads work, so I recommend it for those who are comfortable with shorting options Written 1 month after purchase"
  ],
  "paras": [
    "Sign in B Trading Discord &amp; Algo Combo Master Trading with BTF 5.0 ( 66 ) Trading $79.00 / month Pay Join Join 335 members Features Real-Time Signals – Entries, targets &amp; stop losses for high-probability trades Master trading with expert education, strategies &amp; insights to level up We trade spreads, options, shares &amp; build long-term wealth with investing Access to Gnotz Algo &amp; BullTradeFinder Discord—trade smarter, win bigger Long Term Charts updated daily, 300+ charts a month with requests. Reviews 5 out of 5 66 total reviews 5 stars 4 stars 3 stars 2 stars 1 star PR Pradeep Raghuwanshi 2 years ago One of the best subscription you can get as a trader, filled with experts who help you become a better trader.",
    "2 years ago A large number of thoughtful people engaging together in a meaningful way. I enjoy being a part of this community and look forward to thriving together through our shared futures.",
    "2 years ago Great room! Transparent trades with a winning strategy. BullTradeFinder is one of the few legit discords that utilizes a consistent, winning strategy. Gnotz is always helpful at answering questions and helping everyone. Cannot recommend enough!",
    "2 years ago Very friendly discord and very friendly owner. They have a good track record of solid wins. Their credit spreads work, so I recommend it for those who are comfortable with shorting options",
    "About the creator G View profile Gnotz @ bulltradefinder • Joined Sep 2022 We are a wealth-building community that teaches you how to earn and keep money through smart investing and financial literacy. Join like-minded individuals committed to financial freedom, access valuable resources/tools and expert insights to make informed investment decisions. The mission of our group is simple: LEARN, EARN, GROW. FAQs Is this community beginner friendly? How do I use the Discord or Algo? How accurate are the Gnotz Algo Signals? How much do I have to pay to join in the live trading sessions? Affiliates B Become an affiliate BullTradeFinder 35% reward Earn money by bringing customers to BullTradeFinder. Every time a customer purchases using your link, you&#x27;ll earn a commission."
  ],
  "priceTokens": [
    "$79.00",
    "$79.00",
    "$79.00",
    "$1",
    "$1",
    "$1",
    "$22",
    "$1",
    "$1",
    "$1",
    "$1",
    "$1",
    "$2",
    "$1",
    "$2",
    "$2",
    "$2",
    "$2",
    "$3",
    "$3"
  ],
  "faq": [],
  "textSample": "Trading Discord &amp; Algo Combo | Whop Sign in B Trading Discord &amp; Algo Combo Master Trading with BTF 5.0 ( 66 ) Trading $79.00 / month Pay Join Join 335 members Features Real-Time Signals – Entries, targets &amp; stop losses for high-probability trades Master trading with expert education, strategies &amp; insights to level up We trade spreads, options, shares &amp; build long-term wealth with investing Access to Gnotz Algo &amp; BullTradeFinder Discord—trade smarter, win bigger Long Term Charts updated daily, 300+ charts a month with requests. Reviews 5 out of 5 66 total reviews 5 stars 4 stars 3 stars 2 stars 1 star PR Pradeep Raghuwanshi 2 years ago One of the best subscription you can get as a trader, filled with experts who help you become a better trader. Written 8 months after purchase M martinjcole 2 years ago A large number of thoughtful people engaging together in a meaningful way. I enjoy being a part of this community and look forward to thriving together through our shared futures. Written 2 months after purchase TK Thad Key 2 years ago Great room! Transparent trades with a winning strategy. BullTradeFinder is one of the few legit discords that utilizes a consistent, winning strategy. Gnotz is always helpful at answering questions and helping everyone. Cannot recommend enough! Written 1 month after purchase OT Othman Taleb 2 years ago Very friendly discord and very friendly owner. They have a good track record of solid wins. Their credit spreads work, so I recommend it for those who are comfortable with shorting options Written 1 month after purchase See all reviews About the creator G View profile Gnotz @ bulltradefinder • Joined Sep 2022 We are a wealth-building community that teaches you how to earn and keep money through smart investing and financial literacy. Join like-minded individuals committed to financial freedom, access valuable resources/tools and expert insights to make informed investment decisions. The mission of our group is simple: LEARN, EARN, GROW. FAQs Is this community beginner friendly? How do I use the Discord or Algo? How accurate are the Gnotz Algo Signals? How much do I have to pay to join in the live trading sessions? Affiliates B Become an affiliate BullTradeFinder 35% reward Earn money by bringing customers to BullTradeFinder. Every time a customer purchases using your link, you&#x27;ll earn a commission. Trading Discord &amp; Algo Combo $79.00 / month +4 options Join $79.00 / month 4 options Pay Join Pay Join",
  "finalUrl": "https://whop.com/bulltradefinder/trading-alerts-education-a9/",
  "fetchedAt": "2025-11-05T09:21:50.793Z",
  "textHash": "67dbce60f61d9b296ffeaf7041902b52c3c09e120e043352e377ab4007f66258",
  "drilled": false
}