{
  "baseUrl": "https://whop.com/dodgys-dungeon/dodgy-s-ultimate-trading-course-ad/",
  "title": "Dodgy&#x27;s Ultimate Course | Whop",
  "h1": "Dodgy&#x27;s Ultimate Course",
  "bullets": [
    "Sign in DD Dodgy&#x27;s Ultimate Course Master ICT Strategies with Live Trading 4.7 ( 366 ) Trading #1 ICT Trader Streams Everyday $239.00 one-time purchase Pay Join Join 390 members Features 200+ educational slides detailing ICT strategies.",
    "Old live stream footage",
    "M majd 7 days ago dodgys system is amazing and he doesn’t feed u entry’s it’s more of learning but with something like that ur left with questions that aren’t answered it’s still a 9/10 experience and i don’t regret paying for it but i’ve learned enough to were i can move on and trade alone Written 5 months after purchase",
    "HO Hunter Overstreet 15 days ago Teaches you to fish, great mentorship. Not a signal service Written 1 month after purchase",
    "AF Axel Funk 16 days ago The discord is tits. Written 4 days after purchase",
    "RT Randall Tynan 22 days ago Indicator is cracked out. I seriously couldn't be happier with it. Must have in my opinion if you trade ifvgs. Written 9 days after purchase"
  ],
  "paras": [
    "Sign in DD Dodgy&#x27;s Ultimate Course Master ICT Strategies with Live Trading 4.7 ( 366 ) Trading #1 ICT Trader Streams Everyday",
    "Join 390 members Features 200+ educational slides detailing ICT strategies. Old live stream footage Reviews 4.70 out of 5 366 total reviews 5 stars 4 stars 3 stars 2 stars 1 star M majd 7 days ago dodgys system is amazing and he doesn’t feed u entry’s it’s more of learning but with something like that ur left with questions that aren’t answered it’s still a 9/10 experience and i don’t regret paying for it but i’ve learned enough to were i can move on and trade alone",
    "15 days ago Teaches you to fish, great mentorship. Not a signal service",
    "16 days ago The discord is tits.",
    "22 days ago Indicator is cracked out. I seriously couldn't be happier with it. Must have in my opinion if you trade ifvgs.",
    "About the creator D View profile Dodgy @ dodgysddoffical • Joined Dec 2024 I&#x27;m Dodgy, a passionate trader who specializes in ICT concepts. I trade live every day, sharing my market insights and helping others master gap and imbalance analysis for better trades. My goal is to make traders self-sufficient using the best strategies in the game. FAQs Do you live stream everyday? What&#x27;s your refund policy? Affiliates DD Become an affiliate Dodgy&#x27;s Dungeon 30% reward Earn money by bringing customers to Dodgy&#x27;s Dungeon. Every time a customer purchases using your link, you&#x27;ll earn a commission."
  ],
  "priceTokens": [
    "$239.00",
    "$239.00",
    "$239.00",
    "$1",
    "$1",
    "$1",
    "$22",
    "$1",
    "$1",
    "$1",
    "$1",
    "$1",
    "$2",
    "$1",
    "$2",
    "$2",
    "$2",
    "$2",
    "$3",
    "$3"
  ],
  "faq": [],
  "textSample": "Sign in DD Dodgy&#x27;s Ultimate Course Master ICT Strategies with Live Trading 4.7 ( 366 ) Trading #1 ICT Trader Streams Everyday $239.00 one-time purchase Pay Join Join 390 members Features 200+ educational slides detailing ICT strategies. Old live stream footage Reviews 4.70 out of 5 366 total reviews 5 stars 4 stars 3 stars 2 stars 1 star M majd 7 days ago dodgys system is amazing and he doesn’t feed u entry’s it’s more of learning but with something like that ur left with questions that aren’t answered it’s still a 9/10 experience and i don’t regret paying for it but i’ve learned enough to were i can move on and trade alone Written 5 months after purchase HO Hunter Overstreet 15 days ago Teaches you to fish, great mentorship. Not a signal service Written 1 month after purchase AF Axel Funk 16 days ago The discord is tits. Written 4 days after purchase RT Randall Tynan 22 days ago Indicator is cracked out. I seriously couldn't be happier with it. Must have in my opinion if you trade ifvgs. Written 9 days after purchase See all reviews About the creator D View profile Dodgy @ dodgysddoffical • Joined Dec 2024 I&#x27;m Dodgy, a passionate trader who specializes in ICT concepts. I trade live every day, sharing my market insights and helping others master gap and imbalance analysis for better trades. My goal is to make traders self-sufficient using the best strategies in the game. FAQs Do you live stream everyday? What&#x27;s your refund policy? Affiliates DD Become an affiliate Dodgy&#x27;s Dungeon 30% reward Earn money by bringing customers to Dodgy&#x27;s Dungeon. Every time a customer purchases using your link, you&#x27;ll earn a commission. Dodgy&#x27;s Ultimate Course $239.00 one-time purchase Join $239.00 one-time purchase Pay Join Pay Join Dodgy&#x27;s Ultimate Course | Whop",
  "finalUrl": "https://whop.com/dodgys-dungeon/dodgy-s-ultimate-trading-course-ad/",
  "fetchedAt": "2025-11-06T13:40:01.973Z",
  "textHash": "f0da253b9f28f31ed23b5dabdef364389a43821f47b4507cb96fda6b06706eaf",
  "drilled": false
}