{
  "baseUrl": "https://whop.com/dres-playbook/?a=alexburnett21",
  "title": "Dre&#x27;s Playbook | Whop",
  "h1": "Dre&#x27;s Playbook",
  "bullets": [
    "Powered by DP Dre&#x27;s Playbook Built Dreâ€™s Playbook to show how real data = real wins. Betting feels rigged? With a Masters Degree in Data Analytics, I keep it transparent â€” and the profits speak for themselves. 4.7 ( 50 ) Contact seller Products $15.00 / week Data-Driven Picks That Actually Win Long-Term Premium VIP Exclusive Picks 4.7 ( 43 ) $65.00 / month For Giveaway Winners ONLYâ€” Claim Your Free VIP Trial FREE Giveaway VIP 5.0 ( 2 ) Free FREE / Basic Access Free / Basic Access 4.6 ( 5 ) Contact seller Reviews AJ Aaron Johnson â€¢ Premium VIP Exclusive Picks 11 days ago Easy cheese great picks Written 10 days after purchase",
    "S Sprix â€¢ Premium VIP Exclusive Picks 21 days ago Easy consistent profit every week. Most definitely worth the price. Been a member for a few months and made hundreds. Highly recommend and he knows ball Written 1 month after purchase",
    "S sqmwnd â€¢ Premium VIP Exclusive Picks 22 days ago For only $15 a month you will be stacking up on bread and wished you joined sooner Written 3 months after purchase",
    "J JCM â€¢ Premium VIP Exclusive Picks 22 days ago 2 weeks in and Iâ€™m new to prize picks but Dre the man!âœ…ðŸ’ª Written 3 days after purchase"
  ],
  "paras": [
    "DP Dre&#x27;s Playbook Built Dreâ€™s Playbook to show how real data = real wins. Betting feels rigged? With a Masters Degree in Data Analytics, I keep it transparent â€” and the profits speak for themselves. 4.7 ( 50 ) Contact seller Products $15.00 / week Data-Driven Picks That Actually Win Long-Term Premium VIP Exclusive Picks 4.7 ( 43 ) $65.00 / month For Giveaway Winners ONLYâ€” Claim Your Free VIP Trial FREE Giveaway VIP 5.0 ( 2 ) Free FREE / Basic Access Free / Basic Access 4.6 ( 5 ) Contact seller Reviews AJ Aaron Johnson â€¢ Premium VIP Exclusive Picks 11 days ago Easy cheese great picks",
    "21 days ago Easy consistent profit every week. Most definitely worth the price. Been a member for a few months and made hundreds. Highly recommend and he knows ball",
    "22 days ago For only $15 a month you will be stacking up on bread and wished you joined sooner",
    "22 days ago 2 weeks in and Iâ€™m new to prize picks but Dre the man!âœ…ðŸ’ª"
  ],
  "priceTokens": [
    "$15.00",
    "$65.00",
    "$15",
    "$1",
    "$1",
    "$1",
    "$21",
    "$1",
    "$1",
    "$1",
    "$1",
    "$28",
    "$1",
    "$28",
    "$28",
    "$28",
    "$28",
    "$3",
    "$3",
    "$3"
  ],
  "faq": [],
  "textSample": "Powered by DP Dre&#x27;s Playbook Built Dreâ€™s Playbook to show how real data = real wins. Betting feels rigged? With a Masters Degree in Data Analytics, I keep it transparent â€” and the profits speak for themselves. 4.7 ( 50 ) Contact seller Products $15.00 / week Data-Driven Picks That Actually Win Long-Term Premium VIP Exclusive Picks 4.7 ( 43 ) $65.00 / month For Giveaway Winners ONLYâ€” Claim Your Free VIP Trial FREE Giveaway VIP 5.0 ( 2 ) Free FREE / Basic Access Free / Basic Access 4.6 ( 5 ) Contact seller Reviews AJ Aaron Johnson â€¢ Premium VIP Exclusive Picks 11 days ago Easy cheese great picks Written 10 days after purchase S Sprix â€¢ Premium VIP Exclusive Picks 21 days ago Easy consistent profit every week. Most definitely worth the price. Been a member for a few months and made hundreds. Highly recommend and he knows ball Written 1 month after purchase S sqmwnd â€¢ Premium VIP Exclusive Picks 22 days ago For only $15 a month you will be stacking up on bread and wished you joined sooner Written 3 months after purchase J JCM â€¢ Premium VIP Exclusive Picks 22 days ago 2 weeks in and Iâ€™m new to prize picks but Dre the man!âœ…ðŸ’ª Written 3 days after purchase See all reviews Dre&#x27;s Playbook | Whop",
  "finalUrl": "https://whop.com/dres-playbook/?a=alexburnett21",
  "fetchedAt": "2025-11-05T09:55:20.821Z",
  "textHash": "e4bf0819982327a8a3e3d6b2b6d99167e95c059a9cb7d4319b2289da53f17a6f",
  "drilled": false
}