{
  "baseUrl": "https://whop.com/drop-o-clock/?a=alexburnett21",
  "title": "Drop o&#x27;Clock | Whop",
  "h1": "Drop o&#x27;Clock",
  "bullets": [
    "Powered by DO Drop o&#x27;Clock With years of experience in the reselling game, I created Drop o&#x27;Clock to empower aspiring resellers with top-tier tools and support. Our community has helped thousands achieve success with exclusive ... More 4.8 ( 31 ) Contact seller Products Join the Premier Reselling Community Drop o&#x27;Clock Lifetime 5.0 ( 1 ) $30.00 / month Turn Reselling into Success Drop o&#x27;Clock Membership 4.8 ( 29 ) $10.00 / month Join Our Premier Sports Betting Community Drop o&#x27;Clock Sports Betting New Contact seller Reviews L LilRapha • Drop o&#x27;Clock Membership 5 months ago Amazing cook group. Helped me in so many way. Been in this group since 2019. Never left. The channels are will put together. The staff and support staff are always on the dot 24/7. This is the group for beginners I highly recommend Written 4 years after purchase",
    "MC max chou • Drop o&#x27;Clock Membership 1 year ago Good cook group, contents are well organized. Reselling clothes and shoes might be kind of slow right now, but I still get other great benefits like free chipotle. Highly recommended! Written 3 years after purchase",
    "U usercfc81503624 • Drop o&#x27;Clock Membership 2 years ago Best server! Written 6 days after purchase",
    "C crislive • Drop o&#x27;Clock Membership 2 years ago Works great and help with drops Written 16 hours after purchase"
  ],
  "paras": [
    "DO Drop o&#x27;Clock With years of experience in the reselling game, I created Drop o&#x27;Clock to empower aspiring resellers with top-tier tools and support. Our community has helped thousands achieve success with exclusive ... More 4.8 ( 31 ) Contact seller Products Join the Premier Reselling Community Drop o&#x27;Clock Lifetime 5.0 ( 1 ) $30.00 / month Turn Reselling into Success Drop o&#x27;Clock Membership 4.8 ( 29 ) $10.00 / month Join Our Premier Sports Betting Community Drop o&#x27;Clock Sports Betting New Contact seller Reviews L LilRapha • Drop o&#x27;Clock Membership 5 months ago Amazing cook group. Helped me in so many way. Been in this group since 2019. Never left. The channels are will put together. The staff and support staff are always on the dot 24/7. This is the group for beginners I highly recommend",
    "1 year ago Good cook group, contents are well organized. Reselling clothes and shoes might be kind of slow right now, but I still get other great benefits like free chipotle. Highly recommended!",
    "2 years ago Best server!",
    "2 years ago Works great and help with drops"
  ],
  "priceTokens": [
    "$30.00",
    "$10.00",
    "$1",
    "$1",
    "$1",
    "$21",
    "$1",
    "$1",
    "$1",
    "$1",
    "$28",
    "$1",
    "$28",
    "$28",
    "$28",
    "$28",
    "$3",
    "$3",
    "$3",
    "$10"
  ],
  "faq": [],
  "textSample": "Powered by DO Drop o&#x27;Clock With years of experience in the reselling game, I created Drop o&#x27;Clock to empower aspiring resellers with top-tier tools and support. Our community has helped thousands achieve success with exclusive ... More 4.8 ( 31 ) Contact seller Products Join the Premier Reselling Community Drop o&#x27;Clock Lifetime 5.0 ( 1 ) $30.00 / month Turn Reselling into Success Drop o&#x27;Clock Membership 4.8 ( 29 ) $10.00 / month Join Our Premier Sports Betting Community Drop o&#x27;Clock Sports Betting New Contact seller Reviews L LilRapha • Drop o&#x27;Clock Membership 5 months ago Amazing cook group. Helped me in so many way. Been in this group since 2019. Never left. The channels are will put together. The staff and support staff are always on the dot 24/7. This is the group for beginners I highly recommend Written 4 years after purchase MC max chou • Drop o&#x27;Clock Membership 1 year ago Good cook group, contents are well organized. Reselling clothes and shoes might be kind of slow right now, but I still get other great benefits like free chipotle. Highly recommended! Written 3 years after purchase U usercfc81503624 • Drop o&#x27;Clock Membership 2 years ago Best server! Written 6 days after purchase C crislive • Drop o&#x27;Clock Membership 2 years ago Works great and help with drops Written 16 hours after purchase See all reviews Drop o&#x27;Clock | Whop",
  "finalUrl": "https://whop.com/drop-o-clock/?a=alexburnett21",
  "fetchedAt": "2025-11-05T10:32:00.760Z",
  "textHash": "67a15b3740b73a58231aabcfd1cade54f2e9cf93cbfccf7e6bdc93fb5b8c9244",
  "drilled": false
}