{
  "baseUrl": "https://whop.com/ecom-tools-pro/?a=alexburnett21",
  "title": "Ecom Tools | Whop",
  "h1": "Ecom Tools",
  "bullets": [
    "Powered by ET Ecom Tools We are a platform that equips you with the secrets professionals use to succeed. Whether you&#x27;re new to E-commerce or a seasoned seller, these tools are tailored to save you time and boost your profits... More 4.9 ( 120 ) Contact seller Products $29.99 / month Stop wasting time, get Ecom Tools! Ecom Tools Pro 4.9 ( 112 ) Free Unlock Winning Products Instantly Ecom Tools Free Access 4.8 ( 6 ) $499.00 Unlock Winning Products Instantly LIFETIME - Ecom Tools Pro New Contact seller Reviews TL The Locks Lair ‚Ä¢ Ecom Tools Pro 7 days ago Dopeeeee üó£Ô∏è copping lifetime you guys are elite with this tool package Written 6 days after purchase",
    "8 ‚Ä¢ Ecom Tools Pro 2 months ago Saves me a lot of time and money, your not getting these all these apps for $30 no where else. Written 1 month after purchase",
    "I Israel ‚Ä¢ Ecom Tools Pro 2 months ago Always up and never had issues Written 1 month after purchase",
    "FG Finn Grohnert ‚Ä¢ Ecom Tools Pro 2 months ago Die (meisten) wichtigen Tools enthalten Written 5 days after purchase"
  ],
  "paras": [
    "ET Ecom Tools We are a platform that equips you with the secrets professionals use to succeed. Whether you&#x27;re new to E-commerce or a seasoned seller, these tools are tailored to save you time and boost your profits... More 4.9 ( 120 ) Contact seller Products $29.99 / month Stop wasting time, get Ecom Tools! Ecom Tools Pro 4.9 ( 112 ) Free Unlock Winning Products Instantly Ecom Tools Free Access 4.8 ( 6 ) $499.00 Unlock Winning Products Instantly LIFETIME - Ecom Tools Pro New Contact seller Reviews TL The Locks Lair ‚Ä¢ Ecom Tools Pro 7 days ago Dopeeeee üó£Ô∏è copping lifetime you guys are elite with this tool package",
    "2 months ago Saves me a lot of time and money, your not getting these all these apps for $30 no where else.",
    "2 months ago Always up and never had issues",
    "2 months ago Die (meisten) wichtigen Tools enthalten"
  ],
  "priceTokens": [
    "$29.99",
    "$499.00",
    "$30",
    "$1",
    "$1",
    "$1",
    "$21",
    "$1",
    "$1",
    "$1",
    "$1",
    "$28",
    "$1",
    "$28",
    "$28",
    "$28",
    "$28",
    "$3",
    "$3",
    "$3"
  ],
  "faq": [],
  "textSample": "Powered by ET Ecom Tools We are a platform that equips you with the secrets professionals use to succeed. Whether you&#x27;re new to E-commerce or a seasoned seller, these tools are tailored to save you time and boost your profits... More 4.9 ( 120 ) Contact seller Products $29.99 / month Stop wasting time, get Ecom Tools! Ecom Tools Pro 4.9 ( 112 ) Free Unlock Winning Products Instantly Ecom Tools Free Access 4.8 ( 6 ) $499.00 Unlock Winning Products Instantly LIFETIME - Ecom Tools Pro New Contact seller Reviews TL The Locks Lair ‚Ä¢ Ecom Tools Pro 7 days ago Dopeeeee üó£Ô∏è copping lifetime you guys are elite with this tool package Written 6 days after purchase 8 ‚Ä¢ Ecom Tools Pro 2 months ago Saves me a lot of time and money, your not getting these all these apps for $30 no where else. Written 1 month after purchase I Israel ‚Ä¢ Ecom Tools Pro 2 months ago Always up and never had issues Written 1 month after purchase FG Finn Grohnert ‚Ä¢ Ecom Tools Pro 2 months ago Die (meisten) wichtigen Tools enthalten Written 5 days after purchase See all reviews Ecom Tools | Whop",
  "finalUrl": "https://whop.com/ecom-tools-pro/?a=alexburnett21",
  "fetchedAt": "2025-11-04T21:35:09.341Z",
  "textHash": "92786a40589b1facfd1cf91f5f09ec9f0eea088d3170eed63e951950beef4067",
  "drilled": false
}