{
  "baseUrl": "https://whop.com/pro-sports-advice/elite-vip-membership/",
  "title": "Elite VIP Membership | Whop",
  "h1": "Elite VIP Membership",
  "bullets": [
    "Elite VIP Membership | Whop Sign in Unmute Unmute PA Elite VIP Membership Elite VIP Membership 4.8 ( 714 ) Sports betting Join Elite for tips with in-depth research and write ups. Note: Platinum tier members will receive the tips first at best odds. €69.00 / month Pay Join Features Daily Tips + Info sent via the Whop App/Email and Extra Tips via Discord",
    "Tips and Stakes revealed before Premium members to get even more value!",
    "Access to Private Discord Community with thousands of Elite and Platinum Members",
    "Full-Time Data Analyst to track and present every Winner and loser!",
    "24/7 support staff on all platforms to help with any questions and issues!",
    "KC Karl Cox 4 days ago Great app Written 1 month after purchase",
    "JM James M 7 days ago Only had a few bets not staking alot but enough to cover month so pleased so far, bet what you can afford Written 14 days after purchase",
    "M M 17 days ago Only been a few days but already in profit for the month Written 2 days after purchase",
    "RM Ross Manly 18 days ago been here for almost a year, well worth. lovely profit every month Written 9 months after purchase"
  ],
  "paras": [
    "Sign in Unmute Unmute PA Elite VIP Membership Elite VIP Membership 4.8 ( 714 ) Sports betting Join Elite for tips with in-depth research and write ups. Note: Platinum tier members will receive the tips first at best odds.",
    "€69.00 / month Pay Join Features Daily Tips + Info sent via the Whop App/Email and Extra Tips via Discord Tips and Stakes revealed before Premium members to get even more value! Access to Private Discord Community with thousands of Elite and Platinum Members Full-Time Data Analyst to track and present every Winner and loser! 24/7 support staff on all platforms to help with any questions and issues! Reviews 4.75 out of 5 714 total reviews 5 stars 4 stars 3 stars 2 stars 1 star KC Karl Cox 4 days ago Great app",
    "7 days ago Only had a few bets not staking alot but enough to cover month so pleased so far, bet what you can afford",
    "17 days ago Only been a few days but already in profit for the month",
    "18 days ago been here for almost a year, well worth. lovely profit every month",
    "About the creator P View profile prosportsadviceltd @ prosportsadviceltd • Joined Oct 2024 As a 10-year professional gambler, I created my Whop to share expert sports insights and exclusive horse racing info. I’ve built a team of top global tipsters who work 24/7 to deliver daily value you won’t find anywhere else. FAQs How do I get involved? What sports do you cover? Where can I find previous results from Pro Sports Advice? Affiliates PA Become an affiliate Pro Sports Advice 30% reward Earn money by bringing customers to Pro Sports Advice . Every time a customer purchases using your link, you&#x27;ll earn a commission."
  ],
  "priceTokens": [
    "€69.00",
    "€69.00",
    "€69.00",
    "$1",
    "$1",
    "$1",
    "$22",
    "$1",
    "$1",
    "$1",
    "$1",
    "$1",
    "$2",
    "$1",
    "$2",
    "$2",
    "$2",
    "$2",
    "$3",
    "$3"
  ],
  "faq": [],
  "textSample": "Elite VIP Membership | Whop Sign in Unmute Unmute PA Elite VIP Membership Elite VIP Membership 4.8 ( 714 ) Sports betting Join Elite for tips with in-depth research and write ups. Note: Platinum tier members will receive the tips first at best odds. €69.00 / month Pay Join Features Daily Tips + Info sent via the Whop App/Email and Extra Tips via Discord Tips and Stakes revealed before Premium members to get even more value! Access to Private Discord Community with thousands of Elite and Platinum Members Full-Time Data Analyst to track and present every Winner and loser! 24/7 support staff on all platforms to help with any questions and issues! Reviews 4.75 out of 5 714 total reviews 5 stars 4 stars 3 stars 2 stars 1 star KC Karl Cox 4 days ago Great app Written 1 month after purchase JM James M 7 days ago Only had a few bets not staking alot but enough to cover month so pleased so far, bet what you can afford Written 14 days after purchase M M 17 days ago Only been a few days but already in profit for the month Written 2 days after purchase RM Ross Manly 18 days ago been here for almost a year, well worth. lovely profit every month Written 9 months after purchase See all reviews About the creator P View profile prosportsadviceltd @ prosportsadviceltd • Joined Oct 2024 As a 10-year professional gambler, I created my Whop to share expert sports insights and exclusive horse racing info. I’ve built a team of top global tipsters who work 24/7 to deliver daily value you won’t find anywhere else. FAQs How do I get involved? What sports do you cover? Where can I find previous results from Pro Sports Advice? Affiliates PA Become an affiliate Pro Sports Advice 30% reward Earn money by bringing customers to Pro Sports Advice . Every time a customer purchases using your link, you&#x27;ll earn a commission. Elite VIP Membership €69.00 / month +1 option Join €69.00 / month 1 option Pay Join Pay Join",
  "finalUrl": "https://whop.com/pro-sports-advice/elite-vip-membership/",
  "fetchedAt": "2025-11-05T09:49:17.038Z",
  "textHash": "8bd5e44d7730e13428b8f28a3140c8b6e1d645167265fa5f18b30614fa0c5f21",
  "drilled": false
}