{
  "baseUrl": "https://whop.com/sports-bets-exclusive/?a=alexburnett21",
  "title": "Sports Bets Exclusive | Whop",
  "h1": "Sports Bets Exclusive",
  "bullets": [
    "Powered by SE Sports Bets Exclusive Providing top tier smart plays &amp; lottos, I&#x27;m committed to helping my members achieve consistent profits by beating sportsbooks! 5.0 ( 6 ) Contact seller Products $21.99 / month Unlock consistent winning! Elite Monthly Premium 5.0 ( 4 ) Unmute $5.99 / week Access Premium Plays for 1 week MVP Weekly Premium New $2.00 / month Receive a small taste of our premium picks &amp; insights. Exclusive Picks Starter New Unmute Free Subscribe for free! Free Picks 5.0 ( 2 ) Contact seller Reviews SG Six Gee â€¢ Free Picks 1 year ago Amazing channel. Picks be on point! That cappers don't miss. you're definitely going to make you some money that helps out fasho! Been apart of this community for some months now and I love it! Come join the winning team!! Written 20 days after purchase",
    "BR Brian Reagan â€¢ Elite Monthly Premium 1 year ago This server is great, good people great picks. I have been a member for over a year. If your looking to increase your betting profits join sports bet exclusive premium! Written 4 months after purchase",
    "H harmonyhaven. â€¢ Free Picks 1 year ago ðŸ”¥ picks I been here for about a year now Written 5 days after purchase",
    "CH Craighton Hale â€¢ Elite Monthly Premium 1 year ago Sports Bets Exclusive has been a game changer for me. They put out great bets on a daily basis. Extremely well thought out parlays that hit at a great clip. Theyâ€™ve got a fan for life in me! Canâ€™t wait for the upcoming football season! Written 1 month after purchase"
  ],
  "paras": [
    "SE Sports Bets Exclusive Providing top tier smart plays &amp; lottos, I&#x27;m committed to helping my members achieve consistent profits by beating sportsbooks! 5.0 ( 6 ) Contact seller Products $21.99 / month Unlock consistent winning! Elite Monthly Premium 5.0 ( 4 ) Unmute $5.99 / week Access Premium Plays for 1 week MVP Weekly Premium New $2.00 / month Receive a small taste of our premium picks &amp; insights. Exclusive Picks Starter New Unmute Free Subscribe for free! Free Picks 5.0 ( 2 ) Contact seller Reviews SG Six Gee â€¢ Free Picks 1 year ago Amazing channel. Picks be on point! That cappers don't miss. you're definitely going to make you some money that helps out fasho! Been apart of this community for some months now and I love it! Come join the winning team!!",
    "1 year ago This server is great, good people great picks. I have been a member for over a year. If your looking to increase your betting profits join sports bet exclusive premium!",
    "1 year ago ðŸ”¥ picks I been here for about a year now",
    "1 year ago Sports Bets Exclusive has been a game changer for me. They put out great bets on a daily basis. Extremely well thought out parlays that hit at a great clip. Theyâ€™ve got a fan for life in me! Canâ€™t wait for the upcoming football season!"
  ],
  "priceTokens": [
    "$21.99",
    "$5.99",
    "$2.00",
    "$1",
    "$1",
    "$1",
    "$21",
    "$1",
    "$1",
    "$1",
    "$1",
    "$28",
    "$1",
    "$28",
    "$28",
    "$28",
    "$28",
    "$3",
    "$3",
    "$3"
  ],
  "faq": [],
  "textSample": "Powered by SE Sports Bets Exclusive Providing top tier smart plays &amp; lottos, I&#x27;m committed to helping my members achieve consistent profits by beating sportsbooks! 5.0 ( 6 ) Contact seller Products $21.99 / month Unlock consistent winning! Elite Monthly Premium 5.0 ( 4 ) Unmute $5.99 / week Access Premium Plays for 1 week MVP Weekly Premium New $2.00 / month Receive a small taste of our premium picks &amp; insights. Exclusive Picks Starter New Unmute Free Subscribe for free! Free Picks 5.0 ( 2 ) Contact seller Reviews SG Six Gee â€¢ Free Picks 1 year ago Amazing channel. Picks be on point! That cappers don't miss. you're definitely going to make you some money that helps out fasho! Been apart of this community for some months now and I love it! Come join the winning team!! Written 20 days after purchase BR Brian Reagan â€¢ Elite Monthly Premium 1 year ago This server is great, good people great picks. I have been a member for over a year. If your looking to increase your betting profits join sports bet exclusive premium! Written 4 months after purchase H harmonyhaven. â€¢ Free Picks 1 year ago ðŸ”¥ picks I been here for about a year now Written 5 days after purchase CH Craighton Hale â€¢ Elite Monthly Premium 1 year ago Sports Bets Exclusive has been a game changer for me. They put out great bets on a daily basis. Extremely well thought out parlays that hit at a great clip. Theyâ€™ve got a fan for life in me! Canâ€™t wait for the upcoming football season! Written 1 month after purchase See all reviews Sports Bets Exclusive | Whop",
  "finalUrl": "https://whop.com/sports-bets-exclusive/?a=alexburnett21",
  "fetchedAt": "2025-11-05T10:51:39.269Z",
  "textHash": "0e0fd46669c8320c7c4f5d823535d193661ee2015356f43421e6177edd0a8251",
  "drilled": false
}