{
  "baseUrl": "https://whop.com/one-of-1-hoops/?a=alexburnett21",
  "title": "One of 1 Hoops | Whop",
  "h1": "One of 1 Hoops",
  "bullets": [
    "Powered by OH One of 1 Hoops As a seasoned basketball coach, I&#x27;ve dedicated my career to empowering fellow coaches. I understand the challenges you face and have crafted this community to provide the tools and insights needed to ... More 5.0 ( 2 ) Contact seller Products $6.50 / week Empower Your Coaching Journey Elite Coaches Community New Where Coaches Grow, Teams Win Free Community 5.0 ( 2 ) $97.00 Where Coaches Grow and Teams Win AAU Coaching Mastery New $30.00 Where Coaches Grow and Teams Win One of 1 Hoops Defense New $11.00 Where Coaches Grow, Teams Win The Power 5 Playbook New $40.00 Where Coaches Grow, Teams Win One of 1 Hoops All Zones New $274.00 Access to ALL One of 1 Hoops Resources ALL ACCESS: One of 1 Hoops New Contact seller Reviews CW Christopher Watson • Free Community 1 month ago Written 4 months after purchase",
    "JR Jarrell Reed • Free Community 1 month ago Written 10 months after purchase"
  ],
  "paras": [
    "OH One of 1 Hoops As a seasoned basketball coach, I&#x27;ve dedicated my career to empowering fellow coaches. I understand the challenges you face and have crafted this community to provide the tools and insights needed to ... More 5.0 ( 2 ) Contact seller Products $6.50 / week Empower Your Coaching Journey Elite Coaches Community New Where Coaches Grow, Teams Win Free Community 5.0 ( 2 ) $97.00 Where Coaches Grow and Teams Win AAU Coaching Mastery New $30.00 Where Coaches Grow and Teams Win One of 1 Hoops Defense New $11.00 Where Coaches Grow, Teams Win The Power 5 Playbook New $40.00 Where Coaches Grow, Teams Win One of 1 Hoops All Zones New $274.00 Access to ALL One of 1 Hoops Resources ALL ACCESS: One of 1 Hoops New Contact seller Reviews CW Christopher Watson • Free Community 1 month ago",
    "1 month ago"
  ],
  "priceTokens": [
    "$6.50",
    "$97.00",
    "$30.00",
    "$11.00",
    "$40.00",
    "$274.00",
    "$1",
    "$1",
    "$1",
    "$21",
    "$1",
    "$1",
    "$1",
    "$1",
    "$28",
    "$1",
    "$28",
    "$28",
    "$28",
    "$28"
  ],
  "faq": [],
  "textSample": "Powered by OH One of 1 Hoops As a seasoned basketball coach, I&#x27;ve dedicated my career to empowering fellow coaches. I understand the challenges you face and have crafted this community to provide the tools and insights needed to ... More 5.0 ( 2 ) Contact seller Products $6.50 / week Empower Your Coaching Journey Elite Coaches Community New Where Coaches Grow, Teams Win Free Community 5.0 ( 2 ) $97.00 Where Coaches Grow and Teams Win AAU Coaching Mastery New $30.00 Where Coaches Grow and Teams Win One of 1 Hoops Defense New $11.00 Where Coaches Grow, Teams Win The Power 5 Playbook New $40.00 Where Coaches Grow, Teams Win One of 1 Hoops All Zones New $274.00 Access to ALL One of 1 Hoops Resources ALL ACCESS: One of 1 Hoops New Contact seller Reviews CW Christopher Watson • Free Community 1 month ago Written 4 months after purchase JR Jarrell Reed • Free Community 1 month ago Written 10 months after purchase One of 1 Hoops | Whop",
  "finalUrl": "https://whop.com/one-of-1-hoops/?a=alexburnett21",
  "fetchedAt": "2025-11-05T10:41:40.068Z",
  "textHash": "9786913341c01e6ce0a6799bacfe9062c865e6f9f125a84d7d5186bb8a09d09f",
  "drilled": false
}