{
  "baseUrl": "https://whop.com/euphorictrading/euphorictradingelite/",
  "title": "Euphoric Trading ELITE | Whop",
  "h1": "Euphoric Trading ELITE",
  "bullets": [
    "Sign in Unmute Unmute ET Euphoric Trading ELITE Master Heikin Ashi Candles and Dominate the Market! 5.0 ( 70 ) Trading Get everything in VIP, plus 24/7 personalized support to master the Heikin Ashi strategy! $29.00 / week Pay Get access Features Personalized support to enhance your trading approach.",
    "Get 24/7 support for any trading-related questions.",
    "Master Heikin Ashi Candles for consistent trading.",
    "VIP benefits with exclusive features and support.",
    "Unlock advanced strategies for elite-level trading success.",
    "AR Alex Rivera 2 months ago Never been in a circle where it changed my trading, never really was profitable then I joined euphorias circle and am become way more profitable then I’ve ever been. I wanna thank him for everything he’s done and things I’ve never been able to complete until joining, teaching me how to actually do g... Show more Written 10 days after purchase",
    "AD Aron Dyb 2 months ago transparent and legit trading community. Written 9 days after purchase",
    "HR Harman Raheja 10 months ago Euphoria has completely transformed my trading journey. After over four years of struggling to find consistent profitability, I finally found success through his strategies and incredible community. Not only has he taught me countless valuable lessons about trading, discipline, and consistency, but ... Show more Written 19 days after purchase",
    "A ax 10 months ago Absolutely amazing community, been in here for about a month and a half now and it’s just been nothing but helpful the value that you get even if you aren’t a paid member is insane and I highly recommend this to anyone who is trying to learn trading or just have a active helpful trading community. Written 1 month after purchase"
  ],
  "paras": [
    "Sign in Unmute Unmute ET Euphoric Trading ELITE Master Heikin Ashi Candles and Dominate the Market! 5.0 ( 70 ) Trading Get everything in VIP, plus 24/7 personalized support to master the Heikin Ashi strategy!",
    "$29.00 / week Pay Get access Features Personalized support to enhance your trading approach. Get 24/7 support for any trading-related questions. Master Heikin Ashi Candles for consistent trading. VIP benefits with exclusive features and support. Unlock advanced strategies for elite-level trading success. Reviews 5 out of 5 70 total reviews 5 stars 4 stars 3 stars 2 stars 1 star AR Alex Rivera 2 months ago Never been in a circle where it changed my trading, never really was profitable then I joined euphorias circle and am become way more profitable then I’ve ever been. I wanna thank him for everything he’s done and things I’ve never been able to complete until joining, teaching me how to actually do g...",
    "Written 10 days after purchase AD Aron Dyb 2 months ago transparent and legit trading community.",
    "10 months ago Euphoria has completely transformed my trading journey. After over four years of struggling to find consistent profitability, I finally found success through his strategies and incredible community. Not only has he taught me countless valuable lessons about trading, discipline, and consistency, but ...",
    "Written 19 days after purchase A ax 10 months ago Absolutely amazing community, been in here for about a month and a half now and it’s just been nothing but helpful the value that you get even if you aren’t a paid member is insane and I highly recommend this to anyone who is trying to learn trading or just have a active helpful trading community.",
    "About the creator E View profile EuPhoRia @ euphorictrading • Joined Jan 2024 Certified Funded Trader with 4+ years of experience and founder of Euphoric Trading Discord. We specialize in Heikin Ashi techniques to simplify trading, making it easy to understand and apply. Our community provides clear strategies, personalized support, and practical insights to help you trade smarter and grow with confidence. Join us today and master the art of simple, effective trading! FAQs What markets do you trade? What’s the difference between Free, VIP, and Elite? Do I need prior trading experience? Do you offer refunds? Will Euphoric Trading help me become consistently profitable? Affiliates ET Become an affiliate Euphoric Trading 60% reward Earn money by bringing customers to Euphoric Trading. Every time a customer purchases using your link, you&#x27;ll earn a commission."
  ],
  "priceTokens": [
    "$29.00",
    "$29.00",
    "$29.00",
    "$1",
    "$1",
    "$1",
    "$22",
    "$1",
    "$1",
    "$1",
    "$1",
    "$1",
    "$2",
    "$1",
    "$2",
    "$2",
    "$2",
    "$2",
    "$3",
    "$3"
  ],
  "faq": [],
  "textSample": "Sign in Unmute Unmute ET Euphoric Trading ELITE Master Heikin Ashi Candles and Dominate the Market! 5.0 ( 70 ) Trading Get everything in VIP, plus 24/7 personalized support to master the Heikin Ashi strategy! $29.00 / week Pay Get access Features Personalized support to enhance your trading approach. Get 24/7 support for any trading-related questions. Master Heikin Ashi Candles for consistent trading. VIP benefits with exclusive features and support. Unlock advanced strategies for elite-level trading success. Reviews 5 out of 5 70 total reviews 5 stars 4 stars 3 stars 2 stars 1 star AR Alex Rivera 2 months ago Never been in a circle where it changed my trading, never really was profitable then I joined euphorias circle and am become way more profitable then I’ve ever been. I wanna thank him for everything he’s done and things I’ve never been able to complete until joining, teaching me how to actually do g... Show more Written 10 days after purchase AD Aron Dyb 2 months ago transparent and legit trading community. Written 9 days after purchase HR Harman Raheja 10 months ago Euphoria has completely transformed my trading journey. After over four years of struggling to find consistent profitability, I finally found success through his strategies and incredible community. Not only has he taught me countless valuable lessons about trading, discipline, and consistency, but ... Show more Written 19 days after purchase A ax 10 months ago Absolutely amazing community, been in here for about a month and a half now and it’s just been nothing but helpful the value that you get even if you aren’t a paid member is insane and I highly recommend this to anyone who is trying to learn trading or just have a active helpful trading community. Written 1 month after purchase See all reviews About the creator E View profile EuPhoRia @ euphorictrading • Joined Jan 2024 Certified Funded Trader with 4+ years of experience and founder of Euphoric Trading Discord. We specialize in Heikin Ashi techniques to simplify trading, making it easy to understand and apply. Our community provides clear strategies, personalized support, and practical insights to help you trade smarter and grow with confidence. Join us today and master the art of simple, effective trading! FAQs What markets do you trade? What’s the difference between Free, VIP, and Elite? Do I need prior trading experience? Do you offer refunds? Will Euphoric Trading help me become consistently profitable? Affiliates ET Become an affiliate Euphoric Trading 60% reward Earn money by bringing customers to Euphoric Trading. Every time a customer purchases using your link, you&#x27;ll earn a commission. Euphoric Trading ELITE $29.00 / week +1 option Get access $29.00 / week 1 option Pay Get access Pay Get access Euphoric Trading ELITE | Whop",
  "finalUrl": "https://whop.com/euphorictrading/euphorictradingelite/",
  "fetchedAt": "2025-11-04T21:57:37.392Z",
  "textHash": "e24c9d168dde52e1e9f5fb9ff3142fe15d4b2585a8d0e74a283d6ed7eb61bce8",
  "drilled": false
}