{
  "baseUrl": "https://whop.com/flipping-to-freedom-1/?a=alexburnett21",
  "title": "Flipping To Freedom | Whop",
  "h1": "Flipping To Freedom",
  "bullets": [
    "Powered by FF Flipping To Freedom I&#x27;ve been entrenched in the reselling world, helping individuals transform their Amazon businesses. With FTF, I&#x27;ve cultivated a community that thrives on collaboration and growth. Our powerful lead sh... More 5.0 ( 54 ) Contact seller Products £44.99 / month Join UK&#x27;s Top Amazon Reselling Group Flipping To Freedom 5.0 ( 41 ) £54.99 / month Exclusive Lego Bot for Resellers Flipping To Freedom Full Offer 5.0 ( 7 ) £9.99 / month Unlock Profits with Lego Investing Flipping To Freedom Lego 5.0 ( 4 ) £89.99 Master the Art of Sourcing for Success Flipping To Freedom Elevate New Contact seller Reviews L Lewisallison • Flipping To Freedom 1 year ago Great owners and staff and members all really helpful and friendly. Never feel like your asking a dumb question 100% worth it. Written 6 months after purchase",
    "GS Grant sharman • Flipping To Freedom Full Offer 1 year ago Great group, always help you with anything Amazon related in a quick time. Lots of valuable info for both beginners and experienced sellers Written 5 months after purchase",
    "M mif • Flipping To Freedom 1 year ago Been a member of FTF for 2 years, easily the best investment to date. This group adds new features on a weekly basis and is a great environment for support with growing your Amazon business Written 1 year after purchase",
    "V Viperzx • Flipping To Freedom Lego 1 year ago Great service, fully recommend if wanting to get started in lego investing Written 6 months after purchase"
  ],
  "paras": [
    "FF Flipping To Freedom I&#x27;ve been entrenched in the reselling world, helping individuals transform their Amazon businesses. With FTF, I&#x27;ve cultivated a community that thrives on collaboration and growth. Our powerful lead sh... More 5.0 ( 54 ) Contact seller Products £44.99 / month Join UK&#x27;s Top Amazon Reselling Group Flipping To Freedom 5.0 ( 41 ) £54.99 / month Exclusive Lego Bot for Resellers Flipping To Freedom Full Offer 5.0 ( 7 ) £9.99 / month Unlock Profits with Lego Investing Flipping To Freedom Lego 5.0 ( 4 ) £89.99 Master the Art of Sourcing for Success Flipping To Freedom Elevate New Contact seller Reviews L Lewisallison • Flipping To Freedom 1 year ago Great owners and staff and members all really helpful and friendly. Never feel like your asking a dumb question 100% worth it.",
    "1 year ago Great group, always help you with anything Amazon related in a quick time. Lots of valuable info for both beginners and experienced sellers",
    "1 year ago Been a member of FTF for 2 years, easily the best investment to date. This group adds new features on a weekly basis and is a great environment for support with growing your Amazon business",
    "1 year ago Great service, fully recommend if wanting to get started in lego investing"
  ],
  "priceTokens": [
    "£44.99",
    "£54.99",
    "£9.99",
    "£89.99",
    "$1",
    "$1",
    "$1",
    "$21",
    "$1",
    "$1",
    "$1",
    "$1",
    "$28",
    "$1",
    "$28",
    "$28",
    "$28",
    "$28",
    "$3",
    "$3"
  ],
  "faq": [],
  "textSample": "Powered by FF Flipping To Freedom I&#x27;ve been entrenched in the reselling world, helping individuals transform their Amazon businesses. With FTF, I&#x27;ve cultivated a community that thrives on collaboration and growth. Our powerful lead sh... More 5.0 ( 54 ) Contact seller Products £44.99 / month Join UK&#x27;s Top Amazon Reselling Group Flipping To Freedom 5.0 ( 41 ) £54.99 / month Exclusive Lego Bot for Resellers Flipping To Freedom Full Offer 5.0 ( 7 ) £9.99 / month Unlock Profits with Lego Investing Flipping To Freedom Lego 5.0 ( 4 ) £89.99 Master the Art of Sourcing for Success Flipping To Freedom Elevate New Contact seller Reviews L Lewisallison • Flipping To Freedom 1 year ago Great owners and staff and members all really helpful and friendly. Never feel like your asking a dumb question 100% worth it. Written 6 months after purchase GS Grant sharman • Flipping To Freedom Full Offer 1 year ago Great group, always help you with anything Amazon related in a quick time. Lots of valuable info for both beginners and experienced sellers Written 5 months after purchase M mif • Flipping To Freedom 1 year ago Been a member of FTF for 2 years, easily the best investment to date. This group adds new features on a weekly basis and is a great environment for support with growing your Amazon business Written 1 year after purchase V Viperzx • Flipping To Freedom Lego 1 year ago Great service, fully recommend if wanting to get started in lego investing Written 6 months after purchase See all reviews Flipping To Freedom | Whop",
  "finalUrl": "https://whop.com/flipping-to-freedom-1/?a=alexburnett21",
  "fetchedAt": "2025-11-05T09:25:36.294Z",
  "textHash": "a2b983570b9727adefe9b0e4b9bacc716622d4fda23e4dec4a1522e014080739",
  "drilled": false
}