{
  "baseUrl": "https://whop.com/flipping-to-freedom-1/ftf-discord-lego-access/",
  "title": "Flipping To Freedom Full Offer | Whop",
  "h1": "Flipping To Freedom Full Offer",
  "bullets": [
    "Flipping To Freedom Full Offer | Whop Sign in FF Flipping To Freedom Full Offer Exclusive Lego Bot for Resellers 5.0 ( 54 ) Amazon FBA Gain access to a unique Lego bot and all reseller essentials in one place, including lead sheets, virtual assistants, and specialists to maximize your profits. £54.99 / month Pay Join Join 8 members Features Access to a state-of-the-art Lego bot for informed buying.",
    "Comprehensive lead sheet with 100+ profitable leads monthly.",
    "FOUR Virtual Assistants providing 200+ extra leads monthly.",
    "Dedicated accountant for personal and group financial queries.",
    "Exclusive partnerships and discounts on essential tools.",
    "L Lewisallison 1 year ago Great owners and staff and members all really helpful and friendly. Never feel like your asking a dumb question 100% worth it. Written 6 months after purchase",
    "GS Grant sharman 1 year ago Great group, always help you with anything Amazon related in a quick time. Lots of valuable info for both beginners and experienced sellers Written 5 months after purchase",
    "M mif 1 year ago Been a member of FTF for 2 years, easily the best investment to date. This group adds new features on a weekly basis and is a great environment for support with growing your Amazon business Written 1 year after purchase",
    "V Viperzx 1 year ago Great service, fully recommend if wanting to get started in lego investing Written 6 months after purchase"
  ],
  "paras": [
    "Sign in FF Flipping To Freedom Full Offer Exclusive Lego Bot for Resellers 5.0 ( 54 ) Amazon FBA Gain access to a unique Lego bot and all reseller essentials in one place, including lead sheets, virtual assistants, and specialists to maximize your profits.",
    "Join 8 members Features Access to a state-of-the-art Lego bot for informed buying. Comprehensive lead sheet with 100+ profitable leads monthly. FOUR Virtual Assistants providing 200+ extra leads monthly. Dedicated accountant for personal and group financial queries. Exclusive partnerships and discounts on essential tools. Reviews 5 out of 5 54 total reviews 5 stars 4 stars 3 stars 2 stars 1 star L Lewisallison 1 year ago Great owners and staff and members all really helpful and friendly. Never feel like your asking a dumb question 100% worth it.",
    "1 year ago Great group, always help you with anything Amazon related in a quick time. Lots of valuable info for both beginners and experienced sellers",
    "1 year ago Been a member of FTF for 2 years, easily the best investment to date. This group adds new features on a weekly basis and is a great environment for support with growing your Amazon business",
    "1 year ago Great service, fully recommend if wanting to get started in lego investing",
    "About the creator F View profile FTF @ flippingtofreedom • Joined Jun 2023 I&#x27;ve been entrenched in the reselling world, helping individuals transform their Amazon businesses. With FTF, I&#x27;ve cultivated a community that thrives on collaboration and growth. Our powerful lead sheets, expert insights, and exclusive partnerships offer unparalleled support to empower every reseller. Join us and transform your passion into profit. FAQs How do I join the FTF Discord server? Why choose FTF? Do I need any prior experience to join? Affiliates FF Become an affiliate Flipping To Freedom 30% reward Earn money by bringing customers to Flipping To Freedom. Every time a customer purchases using your link, you&#x27;ll earn a commission."
  ],
  "priceTokens": [
    "£54.99",
    "£54.99",
    "£54.99",
    "$1",
    "$1",
    "$1",
    "$23",
    "$1",
    "$1",
    "$1",
    "$1",
    "$1",
    "$2",
    "$1",
    "$2",
    "$2",
    "$2",
    "$2",
    "$3",
    "$3"
  ],
  "faq": [],
  "textSample": "Flipping To Freedom Full Offer | Whop Sign in FF Flipping To Freedom Full Offer Exclusive Lego Bot for Resellers 5.0 ( 54 ) Amazon FBA Gain access to a unique Lego bot and all reseller essentials in one place, including lead sheets, virtual assistants, and specialists to maximize your profits. £54.99 / month Pay Join Join 8 members Features Access to a state-of-the-art Lego bot for informed buying. Comprehensive lead sheet with 100+ profitable leads monthly. FOUR Virtual Assistants providing 200+ extra leads monthly. Dedicated accountant for personal and group financial queries. Exclusive partnerships and discounts on essential tools. Reviews 5 out of 5 54 total reviews 5 stars 4 stars 3 stars 2 stars 1 star L Lewisallison 1 year ago Great owners and staff and members all really helpful and friendly. Never feel like your asking a dumb question 100% worth it. Written 6 months after purchase GS Grant sharman 1 year ago Great group, always help you with anything Amazon related in a quick time. Lots of valuable info for both beginners and experienced sellers Written 5 months after purchase M mif 1 year ago Been a member of FTF for 2 years, easily the best investment to date. This group adds new features on a weekly basis and is a great environment for support with growing your Amazon business Written 1 year after purchase V Viperzx 1 year ago Great service, fully recommend if wanting to get started in lego investing Written 6 months after purchase See all reviews About the creator F View profile FTF @ flippingtofreedom • Joined Jun 2023 I&#x27;ve been entrenched in the reselling world, helping individuals transform their Amazon businesses. With FTF, I&#x27;ve cultivated a community that thrives on collaboration and growth. Our powerful lead sheets, expert insights, and exclusive partnerships offer unparalleled support to empower every reseller. Join us and transform your passion into profit. FAQs How do I join the FTF Discord server? Why choose FTF? Do I need any prior experience to join? Affiliates FF Become an affiliate Flipping To Freedom 30% reward Earn money by bringing customers to Flipping To Freedom. Every time a customer purchases using your link, you&#x27;ll earn a commission. Flipping To Freedom Full Offer £54.99 / month Join £54.99 / month Pay Join Pay Join",
  "finalUrl": "https://whop.com/flipping-to-freedom-1/ftf-discord-lego-access/",
  "fetchedAt": "2025-11-05T10:43:25.846Z",
  "textHash": "443e146d4bdcf7185df9b37bd3fe976e9a0441b6eb3140ac6785de635acbc953",
  "drilled": false
}