{
  "baseUrl": "https://whop.com/sneakersync-labs/?a=alexburnett21",
  "title": "SneakersyncLabs.com | Whop",
  "h1": "SneakersyncLabs.com",
  "bullets": [
    "Powered by S SneakersyncLabs.com At Sneakersync Labs, we empower sneaker resellers with exclusive tools and insights. Our Friends &amp; Family membership, limited to 40 members, ensures minimal competition and high profitability. With da... More 4.7 ( 10 ) Contact seller Products Unmute $299.00 / month Get Exclusive Access to Top Sneaker Reselling Leads Friends &amp; Family 4.3 ( 4 ) Unmute $100.00 / month Unlock Daily Sneaker Reselling Leads and Expert Tools Premium 5.0 ( 1 ) Contact seller Reviews W washed© • Friends &amp; Family 1 year ago Amazing group basically a bible for StockX/ Goat great connections and experienced members within the group. Price is solid for all it offers. One solid sale and you make your money back plus more for the month. Always money sitting online on some random site. Mods are 4.2/5 but a solid bonus for th... Show more Written 6 months after purchase",
    "K kevincards • Premium 1 year ago I joined pretty recently and made back my sub price off the first link posted. Already doing better this month than all of September. Absolutely loving this group so far. Great group of guys that are incredibly helpful. Thanks! Written 12 days after purchase",
    "CH Caden Hosfeld • Friends &amp; Family 2 years ago Fastest coverage, teaching me how to self source. Written 3 days after purchase",
    "B bricksaf • Friends &amp; Family 2 years ago Great server. Quickest links and coverage on sales. Would recommend to anyone trying to scale their business. Written 3 months after purchase"
  ],
  "paras": [
    "S SneakersyncLabs.com At Sneakersync Labs, we empower sneaker resellers with exclusive tools and insights. Our Friends &amp; Family membership, limited to 40 members, ensures minimal competition and high profitability. With da... More 4.7 ( 10 ) Contact seller Products Unmute $299.00 / month Get Exclusive Access to Top Sneaker Reselling Leads Friends &amp; Family 4.3 ( 4 ) Unmute $100.00 / month Unlock Daily Sneaker Reselling Leads and Expert Tools Premium 5.0 ( 1 ) Contact seller Reviews W washed© • Friends &amp; Family 1 year ago Amazing group basically a bible for StockX/ Goat great connections and experienced members within the group. Price is solid for all it offers. One solid sale and you make your money back plus more for the month. Always money sitting online on some random site. Mods are 4.2/5 but a solid bonus for th...",
    "Written 6 months after purchase K kevincards • Premium 1 year ago I joined pretty recently and made back my sub price off the first link posted. Already doing better this month than all of September. Absolutely loving this group so far. Great group of guys that are incredibly helpful. Thanks!",
    "2 years ago Fastest coverage, teaching me how to self source.",
    "2 years ago Great server. Quickest links and coverage on sales. Would recommend to anyone trying to scale their business."
  ],
  "priceTokens": [
    "$299.00",
    "$100.00",
    "$1",
    "$1",
    "$1",
    "$21",
    "$1",
    "$1",
    "$1",
    "$1",
    "$28",
    "$1",
    "$28",
    "$28",
    "$28",
    "$28",
    "$3",
    "$3",
    "$3",
    "$10"
  ],
  "faq": [],
  "textSample": "Powered by S SneakersyncLabs.com At Sneakersync Labs, we empower sneaker resellers with exclusive tools and insights. Our Friends &amp; Family membership, limited to 40 members, ensures minimal competition and high profitability. With da... More 4.7 ( 10 ) Contact seller Products Unmute $299.00 / month Get Exclusive Access to Top Sneaker Reselling Leads Friends &amp; Family 4.3 ( 4 ) Unmute $100.00 / month Unlock Daily Sneaker Reselling Leads and Expert Tools Premium 5.0 ( 1 ) Contact seller Reviews W washed© • Friends &amp; Family 1 year ago Amazing group basically a bible for StockX/ Goat great connections and experienced members within the group. Price is solid for all it offers. One solid sale and you make your money back plus more for the month. Always money sitting online on some random site. Mods are 4.2/5 but a solid bonus for th... Show more Written 6 months after purchase K kevincards • Premium 1 year ago I joined pretty recently and made back my sub price off the first link posted. Already doing better this month than all of September. Absolutely loving this group so far. Great group of guys that are incredibly helpful. Thanks! Written 12 days after purchase CH Caden Hosfeld • Friends &amp; Family 2 years ago Fastest coverage, teaching me how to self source. Written 3 days after purchase B bricksaf • Friends &amp; Family 2 years ago Great server. Quickest links and coverage on sales. Would recommend to anyone trying to scale their business. Written 3 months after purchase See all reviews SneakersyncLabs.com | Whop",
  "finalUrl": "https://whop.com/sneakersync-labs/?a=alexburnett21",
  "fetchedAt": "2025-11-05T09:12:00.183Z",
  "textHash": "1f562a8c36303e982de1811f505ea6ae45e41eaf6d6f3d567b230064643b099f",
  "drilled": false
}