{
  "baseUrl": "https://whop.com/poiszn/fte-model/",
  "title": "FTE Model | Whop",
  "h1": "FTE Model",
  "bullets": [
    "Sign in PM FTE Model The Final Evolution Entry Model 5.0 ( 15 ) Trading This is The Final Evolution and Understanding of the CISD Model that I have Introduced to you all in the past. The Only Model you will need to understand to get the best entries. $120.00 one-time purchase Pay Purchase Join 41 members Features Access to the Exclusive FTE Channel Inside My Discord",
    "1 Month Premium Access",
    "Access on Tradingview to the FTE Indicator",
    "WP William Pabon 1 month ago Poiszn as a mentor, has been an incredible source of guidance. His expertise in trading is evident, but what truly stands out is the community's ability to provide advice or feedback. The willingness to help and support each other is top notch. The classes and mentorship was the best decision i cou... Show more Written 15 days after purchase",
    "P Peacock 2 months ago Amazing mentorship and community. High level understanding and many tricks up their sleeves to share. üôèüèº Written 2 months after purchase",
    "NO Nataliia Okhremchuk 5 months ago Buying the course and joining this community was the best decision I‚Äôve made. Everything that‚Äôs happening here is truly amazing. It feels like you‚Äôve actually entered a circle of close, like-minded people where you can share anything. PoisZn gives a very personal approach to everyone. You can get on... Show more Written 1 month after purchase",
    "O Olu 6 months ago Poiszn doesn't promise you the Holy Grail. What you get is logical, and practical approach to the markets where you enter without second guessing yourself. His wealth of knowledge and accessibility was key to me joining this community Written 12 days after purchase"
  ],
  "paras": [
    "Sign in PM FTE Model The Final Evolution Entry Model 5.0 ( 15 ) Trading This is The Final Evolution and Understanding of the CISD Model that I have Introduced to you all in the past.",
    "The Only Model you will need to understand to get the best entries.",
    "Join 41 members Features Access to the Exclusive FTE Channel Inside My Discord 1 Month Premium Access Access on Tradingview to the FTE Indicator Reviews 5 out of 5 15 total reviews 5 stars 4 stars 3 stars 2 stars 1 star WP William Pabon 1 month ago Poiszn as a mentor, has been an incredible source of guidance. His expertise in trading is evident, but what truly stands out is the community's ability to provide advice or feedback. The willingness to help and support each other is top notch. The classes and mentorship was the best decision i cou...",
    "Written 15 days after purchase P Peacock 2 months ago Amazing mentorship and community. High level understanding and many tricks up their sleeves to share. üôèüèº",
    "5 months ago Buying the course and joining this community was the best decision I‚Äôve made. Everything that‚Äôs happening here is truly amazing. It feels like you‚Äôve actually entered a circle of close, like-minded people where you can share anything. PoisZn gives a very personal approach to everyone. You can get on...",
    "Written 1 month after purchase O Olu 6 months ago Poiszn doesn't promise you the Holy Grail. What you get is logical, and practical approach to the markets where you enter without second guessing yourself. His wealth of knowledge and accessibility was key to me joining this community",
    "About the creator P View profile PoiSzn @ poiszn ‚Ä¢ Joined Mar 2024 I&#x27;ve spent years honing my trading skills and now I&#x27;m offering mentorship to help others excel with Price Action Concepts. With expert traders and daily sessions, our community is thriving. Join us for a personalized experience. FAQs What is your Refund Policy? Are there Daily Livestreams? Does your System work on crypto? Are there any 1 on 1 Times with you? Affiliates PM Become an affiliate PoiSzn Trading Mentorship 30% reward Earn money by bringing customers to PoiSzn Trading Mentorship. Every time a customer purchases using your link, you&#x27;ll earn a commission."
  ],
  "priceTokens": [
    "$120.00",
    "$120.00",
    "$120.00",
    "$1",
    "$1",
    "$1",
    "$22",
    "$1",
    "$1",
    "$1",
    "$1",
    "$1",
    "$2",
    "$1",
    "$2",
    "$2",
    "$2",
    "$2",
    "$3",
    "$3"
  ],
  "faq": [],
  "textSample": "Sign in PM FTE Model The Final Evolution Entry Model 5.0 ( 15 ) Trading This is The Final Evolution and Understanding of the CISD Model that I have Introduced to you all in the past. The Only Model you will need to understand to get the best entries. $120.00 one-time purchase Pay Purchase Join 41 members Features Access to the Exclusive FTE Channel Inside My Discord 1 Month Premium Access Access on Tradingview to the FTE Indicator Reviews 5 out of 5 15 total reviews 5 stars 4 stars 3 stars 2 stars 1 star WP William Pabon 1 month ago Poiszn as a mentor, has been an incredible source of guidance. His expertise in trading is evident, but what truly stands out is the community's ability to provide advice or feedback. The willingness to help and support each other is top notch. The classes and mentorship was the best decision i cou... Show more Written 15 days after purchase P Peacock 2 months ago Amazing mentorship and community. High level understanding and many tricks up their sleeves to share. üôèüèº Written 2 months after purchase NO Nataliia Okhremchuk 5 months ago Buying the course and joining this community was the best decision I‚Äôve made. Everything that‚Äôs happening here is truly amazing. It feels like you‚Äôve actually entered a circle of close, like-minded people where you can share anything. PoisZn gives a very personal approach to everyone. You can get on... Show more Written 1 month after purchase O Olu 6 months ago Poiszn doesn't promise you the Holy Grail. What you get is logical, and practical approach to the markets where you enter without second guessing yourself. His wealth of knowledge and accessibility was key to me joining this community Written 12 days after purchase See all reviews About the creator P View profile PoiSzn @ poiszn ‚Ä¢ Joined Mar 2024 I&#x27;ve spent years honing my trading skills and now I&#x27;m offering mentorship to help others excel with Price Action Concepts. With expert traders and daily sessions, our community is thriving. Join us for a personalized experience. FAQs What is your Refund Policy? Are there Daily Livestreams? Does your System work on crypto? Are there any 1 on 1 Times with you? Affiliates PM Become an affiliate PoiSzn Trading Mentorship 30% reward Earn money by bringing customers to PoiSzn Trading Mentorship. Every time a customer purchases using your link, you&#x27;ll earn a commission. FTE Model $120.00 one-time purchase Purchase $120.00 one-time purchase Pay Purchase Pay Purchase FTE Model | Whop",
  "finalUrl": "https://whop.com/poiszn/fte-model/",
  "fetchedAt": "2025-11-05T10:33:25.571Z",
  "textHash": "7bc7e788b8e2aec490115d10e3e6d09a3bec02c06bb9c51f83f4a012322a89e0",
  "drilled": false
}