{
  "baseUrl": "https://whop.com/bgr-full-coaching-community/?a=alexburnett21",
  "title": "BusinessGrowR | Whop",
  "h1": "BusinessGrowR",
  "bullets": [
    "Powered by B BusinessGrowR I’ve helped trading communities generate over $700K on Whop. My expertise is building large audiences and converting them into a steady, 7-figure income through community engagement and strategic mark... More 5.0 ( 4 ) Contact seller Products Unmute Free Unlock success with proven sales funnels! BusinessGrowR Strategy Call New $199.00 / month Build a 7-Figure income from followers! Full Coaching Community New An advanced deep-dive into how to go viral &amp; convert sales BG - Advanced Trading Content 5.0 ( 1 ) BG Product Suite Optimization BG Product Suite Optimization New Contact seller Reviews S Slippage • BG - Advanced Trading Content 14 days ago Written 2 days after purchase",
    "MW Matt Wayne 17 days ago Written 1 month after purchase",
    "HA Hussain A 22 days ago Written 2 months after purchase",
    "BR BWT Randy 2 months ago Written 17 days after purchase"
  ],
  "paras": [
    "B BusinessGrowR I’ve helped trading communities generate over $700K on Whop. My expertise is building large audiences and converting them into a steady, 7-figure income through community engagement and strategic mark... More 5.0 ( 4 ) Contact seller Products Unmute Free Unlock success with proven sales funnels! BusinessGrowR Strategy Call New $199.00 / month Build a 7-Figure income from followers! Full Coaching Community New An advanced deep-dive into how to go viral &amp; convert sales BG - Advanced Trading Content 5.0 ( 1 ) BG Product Suite Optimization BG Product Suite Optimization New Contact seller Reviews S Slippage • BG - Advanced Trading Content 14 days ago",
    "17 days ago",
    "22 days ago",
    "2 months ago"
  ],
  "priceTokens": [
    "$700",
    "$199.00",
    "$1",
    "$1",
    "$1",
    "$21",
    "$1",
    "$1",
    "$1",
    "$1",
    "$28",
    "$1",
    "$28",
    "$28",
    "$28",
    "$28",
    "$3",
    "$3",
    "$3",
    "$10"
  ],
  "faq": [],
  "textSample": "Powered by B BusinessGrowR I’ve helped trading communities generate over $700K on Whop. My expertise is building large audiences and converting them into a steady, 7-figure income through community engagement and strategic mark... More 5.0 ( 4 ) Contact seller Products Unmute Free Unlock success with proven sales funnels! BusinessGrowR Strategy Call New $199.00 / month Build a 7-Figure income from followers! Full Coaching Community New An advanced deep-dive into how to go viral &amp; convert sales BG - Advanced Trading Content 5.0 ( 1 ) BG Product Suite Optimization BG Product Suite Optimization New Contact seller Reviews S Slippage • BG - Advanced Trading Content 14 days ago Written 2 days after purchase MW Matt Wayne 17 days ago Written 1 month after purchase HA Hussain A 22 days ago Written 2 months after purchase BR BWT Randy 2 months ago Written 17 days after purchase BusinessGrowR | Whop",
  "finalUrl": "https://whop.com/bgr-full-coaching-community/?a=alexburnett21",
  "fetchedAt": "2025-11-05T10:39:11.496Z",
  "textHash": "571dd5293c4b4c3f1cb83d0c7a3464679d0ced480f6761c4ee64252a99c6c729",
  "drilled": false
}