{
  "baseUrl": "https://whop.com/cognyto-trial/cognyto/",
  "title": "FVG Mindful Trading Pro | Whop",
  "h1": "FVG Mindful Trading Pro",
  "bullets": [
    "Sign in FT FVG Mindful Trading Pro TradingView Indicator for FVG and MTF Liquidity Assessment 5.0 ( 5 ) Other Price action analysis with Multi-Timeframe Fair Value Gaps and strategic liquidity assessment. Watch to see it in action https://youtu.be/NroAXXlB_aQ $24.00 / month Pay Join Join 6 members Features Streamlined filtering system to present only the closer and most relevant FVGs",
    "Efficient visualization of up to 9 timeframes through proportional lenght",
    "Comprehensive management of mitigated FVGs visualization",
    "Automated alert notifications of new, break away and mitigated FVGs",
    "Management of BISIs and SIBIs configuration adding valuable analytical insights",
    "R rainydue 7 months ago After extensive use with high-frequency trading / scalping, this indicator delivers precise FVG data in real-time with excellent clarity. Written 15 days after purchase",
    "JR Julius Rius 8 months ago Best FVG Multi Timeframe indicator in TradingView. It's Top-Down hierarchy is unmatched. Written 1 month after purchase",
    "CW Crypto Wizard 8 months ago I've tried a ton of FVG indicators, but this one's absolutely killer. No more guesswork. - my unicorns are hitting the mark way better. Written 8 days after purchase",
    "PT Pro Trades 8 months ago Finally a clean indicator that displays FVGs hierarchically across multiple timeframes. Amazing to see how hidden/mitigated FVGs impact price Written 7 days after purchase"
  ],
  "paras": [
    "Sign in FT FVG Mindful Trading Pro TradingView Indicator for FVG and MTF Liquidity Assessment 5.0 ( 5 ) Other Price action analysis with Multi-Timeframe Fair Value Gaps and strategic liquidity assessment. Watch to see it in action https://youtu.be/NroAXXlB_aQ",
    "$24.00 / month Pay Join Join 6 members Features Streamlined filtering system to present only the closer and most relevant FVGs Efficient visualization of up to 9 timeframes through proportional lenght Comprehensive management of mitigated FVGs visualization Automated alert notifications of new, break away and mitigated FVGs Management of BISIs and SIBIs configuration adding valuable analytical insights Reviews 5 out of 5 5 total reviews 5 stars 4 stars 3 stars 2 stars 1 star R rainydue 7 months ago After extensive use with high-frequency trading / scalping, this indicator delivers precise FVG data in real-time with excellent clarity.",
    "8 months ago Best FVG Multi Timeframe indicator in TradingView. It's Top-Down hierarchy is unmatched.",
    "8 months ago I've tried a ton of FVG indicators, but this one's absolutely killer. No more guesswork. - my unicorns are hitting the mark way better.",
    "8 months ago Finally a clean indicator that displays FVGs hierarchically across multiple timeframes. Amazing to see how hidden/mitigated FVGs impact price",
    "About the creator C View profile Cognyto @ cognyto • Joined Sep 2023 Committed to continuously improving trading performance while reducing cognitive load. I firmly believe that less is more. This philosophy of focus and mindfulness guides all my minimalist yet comprehensive and professional grade tools, helping traders concentrate on what truly matters. FAQs Can I test the indicator before I subscribe to it? Can I use the same indicator subscription on multiple devices? What happens if I cancel my subscription? Are updates included in the subscription? Can I modify the indicator&#x27;s source code? Affiliates FT Become an affiliate FVG Mindful Trading 30% reward Earn money by bringing customers to FVG Mindful Trading. Every time a customer purchases using your link, you&#x27;ll earn a commission."
  ],
  "priceTokens": [
    "$24.00",
    "$24.00",
    "$24.00",
    "$1",
    "$1",
    "$1",
    "$22",
    "$1",
    "$1",
    "$1",
    "$1",
    "$1",
    "$2",
    "$1",
    "$2",
    "$2",
    "$2",
    "$2",
    "$3",
    "$3"
  ],
  "faq": [],
  "textSample": "Sign in FT FVG Mindful Trading Pro TradingView Indicator for FVG and MTF Liquidity Assessment 5.0 ( 5 ) Other Price action analysis with Multi-Timeframe Fair Value Gaps and strategic liquidity assessment. Watch to see it in action https://youtu.be/NroAXXlB_aQ $24.00 / month Pay Join Join 6 members Features Streamlined filtering system to present only the closer and most relevant FVGs Efficient visualization of up to 9 timeframes through proportional lenght Comprehensive management of mitigated FVGs visualization Automated alert notifications of new, break away and mitigated FVGs Management of BISIs and SIBIs configuration adding valuable analytical insights Reviews 5 out of 5 5 total reviews 5 stars 4 stars 3 stars 2 stars 1 star R rainydue 7 months ago After extensive use with high-frequency trading / scalping, this indicator delivers precise FVG data in real-time with excellent clarity. Written 15 days after purchase JR Julius Rius 8 months ago Best FVG Multi Timeframe indicator in TradingView. It's Top-Down hierarchy is unmatched. Written 1 month after purchase CW Crypto Wizard 8 months ago I've tried a ton of FVG indicators, but this one's absolutely killer. No more guesswork. - my unicorns are hitting the mark way better. Written 8 days after purchase PT Pro Trades 8 months ago Finally a clean indicator that displays FVGs hierarchically across multiple timeframes. Amazing to see how hidden/mitigated FVGs impact price Written 7 days after purchase See all reviews About the creator C View profile Cognyto @ cognyto • Joined Sep 2023 Committed to continuously improving trading performance while reducing cognitive load. I firmly believe that less is more. This philosophy of focus and mindfulness guides all my minimalist yet comprehensive and professional grade tools, helping traders concentrate on what truly matters. FAQs Can I test the indicator before I subscribe to it? Can I use the same indicator subscription on multiple devices? What happens if I cancel my subscription? Are updates included in the subscription? Can I modify the indicator&#x27;s source code? Affiliates FT Become an affiliate FVG Mindful Trading 30% reward Earn money by bringing customers to FVG Mindful Trading. Every time a customer purchases using your link, you&#x27;ll earn a commission. FVG Mindful Trading Pro $24.00 / month +2 options Join $24.00 / month 2 options Pay Join Pay Join FVG Mindful Trading Pro | Whop",
  "finalUrl": "https://whop.com/cognyto-trial/cognyto/",
  "fetchedAt": "2025-11-05T10:10:26.387Z",
  "textHash": "0c82b8b3a5796cff064e72ec6b8245cf2bb5bfd2e93e1c25fb031023352971c1",
  "drilled": false
}