{
  "baseUrl": "https://whop.com/premium-membership-c5-23c1/?a=alexburnett21",
  "title": "Gala Trades | Whop",
  "h1": "Gala Trades",
  "bullets": [
    "Powered by GT Gala Trades Iâ€™ve spent years perfecting trading strategies that have made me millions. My goal is to share this knowledge with a community of dedicated traders, offering insights, alerts, and a professional envir... More 5.0 ( 68 ) Contact seller Products $129.99 / month Free trial Join Gala Trades for consistent trading Gala Trades Premium 5.0 ( 25 ) $1,999.99 Lifetime Access to Gala Trades Discord Gala Trades Lifetime 5.0 ( 2 ) Free Master 5 Setups That Made $5M+ Gala Trades Free Course 5.0 ( 39 ) Contact seller Reviews Z zhiyenn â€¢ Gala Trades Free Course 9 months ago Kazakh from Wall Street, appreciate your method of teaching ğŸ”¥ğŸ”¥ğŸ”¥ Written 13 days after purchase",
    "N nurlan76nav â€¢ Gala Trades Free Course 10 months ago Thank you Gala for sharing your knowledge ğŸ‘ğŸ»ğŸ™ğŸ»ğŸ‘ğŸ» Written 10 days after purchase",
    "S serkebayeva1189 â€¢ Gala Trades Free Course 10 months ago Nice channel! Hopefully will be profitable soon Written 10 days after purchase",
    "P playstationkadyrov â€¢ Gala Trades Free Course 10 months ago I am amazed with this channel. The amount of new useful information for trading is on another level. I have already learnt many trading functions which I did not know in the past. I will continue to use and recommend it to everyone. Written 10 days after purchase"
  ],
  "paras": [
    "GT Gala Trades Iâ€™ve spent years perfecting trading strategies that have made me millions. My goal is to share this knowledge with a community of dedicated traders, offering insights, alerts, and a professional envir... More 5.0 ( 68 ) Contact seller Products $129.99 / month Free trial Join Gala Trades for consistent trading Gala Trades Premium 5.0 ( 25 ) $1,999.99 Lifetime Access to Gala Trades Discord Gala Trades Lifetime 5.0 ( 2 ) Free Master 5 Setups That Made $5M+ Gala Trades Free Course 5.0 ( 39 ) Contact seller Reviews Z zhiyenn â€¢ Gala Trades Free Course 9 months ago Kazakh from Wall Street, appreciate your method of teaching ğŸ”¥ğŸ”¥ğŸ”¥",
    "10 months ago Thank you Gala for sharing your knowledge ğŸ‘ğŸ»ğŸ™ğŸ»ğŸ‘ğŸ»",
    "10 months ago Nice channel! Hopefully will be profitable soon",
    "10 months ago I am amazed with this channel. The amount of new useful information for trading is on another level. I have already learnt many trading functions which I did not know in the past. I will continue to use and recommend it to everyone."
  ],
  "priceTokens": [
    "$129.99",
    "$1,999.99",
    "$5",
    "$1",
    "$1",
    "$1",
    "$21",
    "$1",
    "$1",
    "$1",
    "$1",
    "$28",
    "$1",
    "$28",
    "$28",
    "$28",
    "$28",
    "$3",
    "$3",
    "$3"
  ],
  "faq": [],
  "textSample": "Powered by GT Gala Trades Iâ€™ve spent years perfecting trading strategies that have made me millions. My goal is to share this knowledge with a community of dedicated traders, offering insights, alerts, and a professional envir... More 5.0 ( 68 ) Contact seller Products $129.99 / month Free trial Join Gala Trades for consistent trading Gala Trades Premium 5.0 ( 25 ) $1,999.99 Lifetime Access to Gala Trades Discord Gala Trades Lifetime 5.0 ( 2 ) Free Master 5 Setups That Made $5M+ Gala Trades Free Course 5.0 ( 39 ) Contact seller Reviews Z zhiyenn â€¢ Gala Trades Free Course 9 months ago Kazakh from Wall Street, appreciate your method of teaching ğŸ”¥ğŸ”¥ğŸ”¥ Written 13 days after purchase N nurlan76nav â€¢ Gala Trades Free Course 10 months ago Thank you Gala for sharing your knowledge ğŸ‘ğŸ»ğŸ™ğŸ»ğŸ‘ğŸ» Written 10 days after purchase S serkebayeva1189 â€¢ Gala Trades Free Course 10 months ago Nice channel! Hopefully will be profitable soon Written 10 days after purchase P playstationkadyrov â€¢ Gala Trades Free Course 10 months ago I am amazed with this channel. The amount of new useful information for trading is on another level. I have already learnt many trading functions which I did not know in the past. I will continue to use and recommend it to everyone. Written 10 days after purchase See all reviews Gala Trades | Whop",
  "finalUrl": "https://whop.com/premium-membership-c5-23c1/?a=alexburnett21",
  "fetchedAt": "2025-11-05T09:20:28.767Z",
  "textHash": "fdbf336793a0f0a85c1d98e5ff2c8126016fdec9e7d4ff6bd23570ec85665ec3",
  "drilled": false
}