{
  "baseUrl": "https://whop.com/gamblers-paradise-prem/?a=alexburnett21",
  "title": "CBN Locks | Whop",
  "h1": "CBN Locks",
  "bullets": [
    "Powered by CL CBN Locks 4.8 ( 21 ) Contact seller Products $7.00 Greatest sports picks ever Gambler&#x27;s Paradise 5.0 ( 18 ) $7.00 / month Free trial Greatest sports picks ever Gamblers Paradise Prem 3.7 ( 3 ) Contact seller Reviews PB Paolo banchero • Gambler&#x27;s Paradise 8 months ago Chill guy great server Written 1 month after purchase",
    "CB Chase Breckel • Gamblers Paradise Prem 8 months ago Super nice guy, with great picks Written 1 month after purchase",
    "LG Logan Guest • Gamblers Paradise Prem 9 months ago High percentage of hitting and very trust worthy Written 4 days after purchase",
    "DR Dominic Resendes • Gambler&#x27;s Paradise 9 months ago this guy has a very high precentage of hitting his 2 man parlays he is very trusted i use his bets everyday Written 4 days after purchase"
  ],
  "paras": [
    "CL CBN Locks 4.8 ( 21 ) Contact seller Products $7.00 Greatest sports picks ever Gambler&#x27;s Paradise 5.0 ( 18 ) $7.00 / month Free trial Greatest sports picks ever Gamblers Paradise Prem 3.7 ( 3 ) Contact seller Reviews PB Paolo banchero • Gambler&#x27;s Paradise 8 months ago Chill guy great server",
    "8 months ago Super nice guy, with great picks",
    "9 months ago High percentage of hitting and very trust worthy",
    "9 months ago this guy has a very high precentage of hitting his 2 man parlays he is very trusted i use his bets everyday"
  ],
  "priceTokens": [
    "$7.00",
    "$7.00",
    "$1",
    "$1",
    "$1",
    "$21",
    "$1",
    "$1",
    "$1",
    "$1",
    "$28",
    "$1",
    "$28",
    "$28",
    "$28",
    "$28",
    "$3",
    "$3",
    "$3",
    "$10"
  ],
  "faq": [],
  "textSample": "Powered by CL CBN Locks 4.8 ( 21 ) Contact seller Products $7.00 Greatest sports picks ever Gambler&#x27;s Paradise 5.0 ( 18 ) $7.00 / month Free trial Greatest sports picks ever Gamblers Paradise Prem 3.7 ( 3 ) Contact seller Reviews PB Paolo banchero • Gambler&#x27;s Paradise 8 months ago Chill guy great server Written 1 month after purchase CB Chase Breckel • Gamblers Paradise Prem 8 months ago Super nice guy, with great picks Written 1 month after purchase LG Logan Guest • Gamblers Paradise Prem 9 months ago High percentage of hitting and very trust worthy Written 4 days after purchase DR Dominic Resendes • Gambler&#x27;s Paradise 9 months ago this guy has a very high precentage of hitting his 2 man parlays he is very trusted i use his bets everyday Written 4 days after purchase See all reviews CBN Locks | Whop",
  "finalUrl": "https://whop.com/gamblers-paradise-prem/?a=alexburnett21",
  "fetchedAt": "2025-11-05T10:48:38.067Z",
  "textHash": "3af641701059ee0cf8b10453b38b8f85cbc1e78563517a039f74679690673c43",
  "drilled": false
}