{
  "baseUrl": "https://whop.com/glo-sports-glo-sports-chat/?a=alexburnett21",
  "title": "GLO Sports | Whop",
  "h1": "GLO Sports",
  "bullets": [
    "Powered by GS GLO Sports I&#x27;m Justin Keith, better known as GloJays. I&#x27;m a Social Media Influencer, Day Trader, Sports Bettor, and Mentor. I created Glo Sports to build a community around my passion for sports betting and help... More 4.6 ( 146 ) Contact seller Products Free Predict and Win with Guess the Score GLO Sports Guess the Score 3.8 ( 4 ) Predict and Win with Guess the Score GLO Sports News 4.5 ( 24 ) $14.99 / 2 weeks Free trial Lotto&#x27;s with GLO GLO Lotto 3.8 ( 4 ) $9.99 How I Made $24,000 in 20 Minutes Sports Betting for DumbA$$es New Contact seller Reviews ZB Zaza Bryant 10 months ago One of the best Written 2 months after purchase",
    "AM Anthony McHenry 1 year ago One of the best and the realest! I appreciate working with you bro Written 11 days after purchase",
    "JC JR SPORTS BET CHAT üí¨ 1 year ago 10,10,10 LEGIT, I‚ÄôVE BEEN PAID AND THIS THE BEST THING I‚ÄôVE FOUND INTEREST IN!!! HIGHLY RECOMMEND!!! SCARED MONEY DON‚ÄôT MAKE NO MONEY!!! ü§ë 5 ‚≠êÔ∏è‚Äôs FOR ME IG: Topshottakingston I‚Äôm a real winner! Kind of excited but frfr it‚Äôs legit Written 4 days after purchase",
    "DD Delray Davis 1 year ago Yall üß¢ I been eating idk what yall on stop hatin it‚Äôs cancerous Written 5 months after purchase"
  ],
  "paras": [
    "GS GLO Sports I&#x27;m Justin Keith, better known as GloJays. I&#x27;m a Social Media Influencer, Day Trader, Sports Bettor, and Mentor. I created Glo Sports to build a community around my passion for sports betting and help... More 4.6 ( 146 ) Contact seller Products Free Predict and Win with Guess the Score GLO Sports Guess the Score 3.8 ( 4 ) Predict and Win with Guess the Score GLO Sports News 4.5 ( 24 ) $14.99 / 2 weeks Free trial Lotto&#x27;s with GLO GLO Lotto 3.8 ( 4 ) $9.99 How I Made $24,000 in 20 Minutes Sports Betting for DumbA$$es New Contact seller Reviews ZB Zaza Bryant 10 months ago One of the best",
    "1 year ago One of the best and the realest! I appreciate working with you bro",
    "1 year ago 10,10,10 LEGIT, I‚ÄôVE BEEN PAID AND THIS THE BEST THING I‚ÄôVE FOUND INTEREST IN!!! HIGHLY RECOMMEND!!! SCARED MONEY DON‚ÄôT MAKE NO MONEY!!! ü§ë 5 ‚≠êÔ∏è‚Äôs FOR ME IG: Topshottakingston I‚Äôm a real winner! Kind of excited but frfr it‚Äôs legit",
    "1 year ago Yall üß¢ I been eating idk what yall on stop hatin it‚Äôs cancerous"
  ],
  "priceTokens": [
    "$14.99",
    "$9.99",
    "$24,000",
    "$1",
    "$1",
    "$1",
    "$21",
    "$1",
    "$1",
    "$1",
    "$1",
    "$28",
    "$1",
    "$28",
    "$28",
    "$28",
    "$28",
    "$3",
    "$3",
    "$3"
  ],
  "faq": [],
  "textSample": "Powered by GS GLO Sports I&#x27;m Justin Keith, better known as GloJays. I&#x27;m a Social Media Influencer, Day Trader, Sports Bettor, and Mentor. I created Glo Sports to build a community around my passion for sports betting and help... More 4.6 ( 146 ) Contact seller Products Free Predict and Win with Guess the Score GLO Sports Guess the Score 3.8 ( 4 ) Predict and Win with Guess the Score GLO Sports News 4.5 ( 24 ) $14.99 / 2 weeks Free trial Lotto&#x27;s with GLO GLO Lotto 3.8 ( 4 ) $9.99 How I Made $24,000 in 20 Minutes Sports Betting for DumbA$$es New Contact seller Reviews ZB Zaza Bryant 10 months ago One of the best Written 2 months after purchase AM Anthony McHenry 1 year ago One of the best and the realest! I appreciate working with you bro Written 11 days after purchase JC JR SPORTS BET CHAT üí¨ 1 year ago 10,10,10 LEGIT, I‚ÄôVE BEEN PAID AND THIS THE BEST THING I‚ÄôVE FOUND INTEREST IN!!! HIGHLY RECOMMEND!!! SCARED MONEY DON‚ÄôT MAKE NO MONEY!!! ü§ë 5 ‚≠êÔ∏è‚Äôs FOR ME IG: Topshottakingston I‚Äôm a real winner! Kind of excited but frfr it‚Äôs legit Written 4 days after purchase DD Delray Davis 1 year ago Yall üß¢ I been eating idk what yall on stop hatin it‚Äôs cancerous Written 5 months after purchase See all reviews GLO Sports | Whop",
  "finalUrl": "https://whop.com/glo-sports-glo-sports-chat/?a=alexburnett21",
  "fetchedAt": "2025-11-04T21:36:17.043Z",
  "textHash": "eb850464264d632c9409a0b4c29a73d5694a0d6b9a544690afc448728329484e",
  "drilled": false
}