{
  "baseUrl": "https://whop.com/goat-vip/?a=alexburnett21",
  "title": "ğŸ¥‡ GOAT PICKS ğŸ¥‡ | Whop",
  "h1": "ğŸ¥‡ GOAT PICKS ğŸ¥‡",
  "bullets": [
    "Powered by GP ğŸ¥‡ GOAT PICKS ğŸ¥‡ I&#x27;ve dedicated my life to sports betting, refining strategies and delivering winning picks. Join me and experience the thrill of making informed bets with our community. 4.8 ( 12 ) Contact seller Products Unmute â‚¬40.00 / week Turn $100 into Thousands with Proven Daily Sports Betting Plays GOAT PICKS: $100 to Thousands 3.5 ( 2 ) Contact seller Reviews K Keroncruz 4 months ago I have followed it for a while and now am contented it's free Written 2 days after purchase",
    "M Mohd2dy4 4 months ago This is the only tipster that will always keep winning all their tips 100%. Please keep it up sir ğŸ™ Written 2 days after purchase",
    "S Sulcut 4 months ago From what Iâ€™m seeing in the group youâ€™re absolutely amazing ğŸ¤© best tipster Iâ€™ve seen so far here on telegram â¤ï¸ Written 1 day after purchase",
    "AR Ainebyoona Rodgers 4 months ago The only tipster who keeps consistency in winningğŸ’ª. Keep it up mate Written 12 minutes after purchase"
  ],
  "paras": [
    "GP ğŸ¥‡ GOAT PICKS ğŸ¥‡ I&#x27;ve dedicated my life to sports betting, refining strategies and delivering winning picks. Join me and experience the thrill of making informed bets with our community. 4.8 ( 12 ) Contact seller Products Unmute â‚¬40.00 / week Turn $100 into Thousands with Proven Daily Sports Betting Plays GOAT PICKS: $100 to Thousands 3.5 ( 2 ) Contact seller Reviews K Keroncruz 4 months ago I have followed it for a while and now am contented it's free",
    "4 months ago This is the only tipster that will always keep winning all their tips 100%. Please keep it up sir ğŸ™",
    "4 months ago From what Iâ€™m seeing in the group youâ€™re absolutely amazing ğŸ¤© best tipster Iâ€™ve seen so far here on telegram â¤ï¸",
    "4 months ago The only tipster who keeps consistency in winningğŸ’ª. Keep it up mate"
  ],
  "priceTokens": [
    "â‚¬40.00",
    "$100",
    "$100",
    "$1",
    "$1",
    "$1",
    "$21",
    "$1",
    "$1",
    "$1",
    "$1",
    "$28",
    "$1",
    "$28",
    "$28",
    "$28",
    "$28",
    "$3",
    "$3",
    "$3"
  ],
  "faq": [],
  "textSample": "Powered by GP ğŸ¥‡ GOAT PICKS ğŸ¥‡ I&#x27;ve dedicated my life to sports betting, refining strategies and delivering winning picks. Join me and experience the thrill of making informed bets with our community. 4.8 ( 12 ) Contact seller Products Unmute â‚¬40.00 / week Turn $100 into Thousands with Proven Daily Sports Betting Plays GOAT PICKS: $100 to Thousands 3.5 ( 2 ) Contact seller Reviews K Keroncruz 4 months ago I have followed it for a while and now am contented it's free Written 2 days after purchase M Mohd2dy4 4 months ago This is the only tipster that will always keep winning all their tips 100%. Please keep it up sir ğŸ™ Written 2 days after purchase S Sulcut 4 months ago From what Iâ€™m seeing in the group youâ€™re absolutely amazing ğŸ¤© best tipster Iâ€™ve seen so far here on telegram â¤ï¸ Written 1 day after purchase AR Ainebyoona Rodgers 4 months ago The only tipster who keeps consistency in winningğŸ’ª. Keep it up mate Written 12 minutes after purchase See all reviews ğŸ¥‡ GOAT PICKS ğŸ¥‡ | Whop",
  "finalUrl": "https://whop.com/goat-vip/?a=alexburnett21",
  "fetchedAt": "2025-11-05T09:20:31.953Z",
  "textHash": "2ea4309619c1afacbaf43c3c7fa26dc412071fe0a53f1e1fd85b7aa01bb5645e",
  "drilled": false
}