{
  "baseUrl": "https://whop.com/goatedkel-picks/goatedkel-picks/?a=alexburnett21",
  "title": "GoatedKel Picks | Whop",
  "h1": "GoatedKel Picks",
  "bullets": [
    "Sign in GP GoatedKel Picks Let’s Win Big 5.0 ( 6 ) Sports betting Unlock profitable sports picks with GoatedKel&#x27;s expert analysis. Perfect for both beginners and seasoned bettors seeking consistent results. $20.00 / month Pay Join Features 50% off your next Subscription",
    "LB Levy Barthellemy 2 months ago This app go hard Written 1 month after purchase",
    "CL Caumarion Lang 18 days ago Written 3 months after purchase",
    "W World 1 month ago Written 5 months after purchase",
    "K Kdot3535 1 month ago Written 3 minutes after purchase"
  ],
  "paras": [
    "Sign in GP GoatedKel Picks Let’s Win Big 5.0 ( 6 ) Sports betting Unlock profitable sports picks with GoatedKel&#x27;s expert analysis. Perfect for both beginners and seasoned bettors seeking consistent results.",
    "$20.00 / month Pay Join Features 50% off your next Subscription Reviews 5 out of 5 6 total reviews 5 stars 4 stars 3 stars 2 stars 1 star LB Levy Barthellemy 2 months ago This app go hard",
    "18 days ago",
    "1 month ago",
    "1 month ago",
    "About the creator KM View profile Kel McCall @ goatedkel • Joined Aug 2023 Kel, a distinguished sports analyst with over a decade of experience, has honed his craft in the world of sports betting. Known for his sharp insights and data-driven analysis, Kel Affiliates GP Become an affiliate GoatedKel Picks 5% reward Earn money by bringing customers to GoatedKel Picks. Every time a customer purchases using your link, you&#x27;ll earn a commission."
  ],
  "priceTokens": [
    "$20.00",
    "$20.00",
    "$20.00",
    "$1",
    "$1",
    "$1",
    "$23",
    "$1",
    "$1",
    "$1",
    "$1",
    "$1",
    "$2",
    "$1",
    "$2",
    "$2",
    "$2",
    "$2",
    "$3",
    "$3"
  ],
  "faq": [],
  "textSample": "Sign in GP GoatedKel Picks Let’s Win Big 5.0 ( 6 ) Sports betting Unlock profitable sports picks with GoatedKel&#x27;s expert analysis. Perfect for both beginners and seasoned bettors seeking consistent results. $20.00 / month Pay Join Features 50% off your next Subscription Reviews 5 out of 5 6 total reviews 5 stars 4 stars 3 stars 2 stars 1 star LB Levy Barthellemy 2 months ago This app go hard Written 1 month after purchase CL Caumarion Lang 18 days ago Written 3 months after purchase W World 1 month ago Written 5 months after purchase K Kdot3535 1 month ago Written 3 minutes after purchase See all reviews About the creator KM View profile Kel McCall @ goatedkel • Joined Aug 2023 Kel, a distinguished sports analyst with over a decade of experience, has honed his craft in the world of sports betting. Known for his sharp insights and data-driven analysis, Kel Affiliates GP Become an affiliate GoatedKel Picks 5% reward Earn money by bringing customers to GoatedKel Picks. Every time a customer purchases using your link, you&#x27;ll earn a commission. GoatedKel Picks $20.00 / month +2 options Join $20.00 / month 2 options Pay Join Pay Join GoatedKel Picks | Whop",
  "finalUrl": "https://whop.com/goatedkel-picks/goatedkel-picks/?a=alexburnett21",
  "fetchedAt": "2025-11-04T21:59:23.872Z",
  "textHash": "6c16ee8d0005b1f40ce001cab5af9da6e53f5183a96fd76e776e1a3e899bb93f",
  "drilled": true
}