{
  "baseUrl": "https://whop.com/guaranteed-sweep/hammerinvestments-vip/",
  "title": "Hammer Investments | Monthly | Whop",
  "h1": "Hammer Investments | Monthly",
  "bullets": [
    "Sign in HB Hammer Investments | Monthly Join Our Elite Sports Consulting Discord 4.9 ( 454 ) Sports betting Experience the #1 sports consulting team with 100% transparency. Benefit from a 79% winrate and 26 months of profit. $170.00 / month Pay Join Features 79% winrate across all sports with consistent monthly profits.",
    "5-7 High-Quality Plays",
    "Exclusive Access To Our Elite 14,000+ Member Community.",
    "95% Winrate | Lock of the Week/Month/Year",
    "100% Transparency",
    "KJ Kylie Johnston 1 month ago first month made around 2k. the staff worked with me 1 on 1 and i scaled all the way to 7.2k profit this month. best group by far that ive been in. love u AZ. The best Written 7 months after purchase",
    "MO Mike Oscardas 1 month ago I've heard alot about this group. I've chilled in the discord and ATE off free picks. I've been apart of the VIP for 4 months and this dude fr the fucking goat. I won't change cappers ever. Written 7 months after purchase",
    "DM David Miller 8 months ago excited for mlb again. hes the mlb best! Written 7 months after purchase",
    "NM Nikolai Morozov 8 months ago Amazing Platform Automation Written 3 minutes after purchase"
  ],
  "paras": [
    "Sign in HB Hammer Investments | Monthly Join Our Elite Sports Consulting Discord 4.9 ( 454 ) Sports betting Experience the #1 sports consulting team with 100% transparency. Benefit from a 79% winrate and 26 months of profit.",
    "$170.00 / month Pay Join Features 79% winrate across all sports with consistent monthly profits. 5-7 High-Quality Plays Exclusive Access To Our Elite 14,000+ Member Community. 95% Winrate | Lock of the Week/Month/Year 100% Transparency Reviews 4.93 out of 5 454 total reviews 5 stars 4 stars 3 stars 2 stars 1 star KJ Kylie Johnston 1 month ago first month made around 2k. the staff worked with me 1 on 1 and i scaled all the way to 7.2k profit this month. best group by far that ive been in. love u AZ. The best",
    "1 month ago I've heard alot about this group. I've chilled in the discord and ATE off free picks. I've been apart of the VIP for 4 months and this dude fr the fucking goat. I won't change cappers ever.",
    "8 months ago excited for mlb again. hes the mlb best!",
    "8 months ago Amazing Platform Automation",
    "About the creator HI View profile Hammer Investments @ hammerinvestments • Joined Feb 2024 As the creator of Hammer Investments, I&#x27;ve dedicated my career to providing unparalleled sports betting advice. With a 90% win-rate parlay and 100% transparency, I aim to ensure your investment sees significant returns. Our exclusive Guaranteed Sweep is designed with dedication, aiming to maximize your betting success. FAQs What&#x27;s your refund policy? How many plays are sent daily? What happens if the Guaranteed Sweep loses? Can I cancel my VIP Access subscription at any time? Affiliates HB Become an affiliate Hammer Investments | Sports Betting 30% reward Earn money by bringing customers to Hammer Investments | Sports Betting. Every time a customer purchases using your link, you&#x27;ll earn a commission."
  ],
  "priceTokens": [
    "$170.00",
    "$170.00",
    "$170.00",
    "$1",
    "$1",
    "$1",
    "$22",
    "$1",
    "$1",
    "$1",
    "$1",
    "$1",
    "$2",
    "$1",
    "$2",
    "$2",
    "$2",
    "$2",
    "$3",
    "$3"
  ],
  "faq": [],
  "textSample": "Sign in HB Hammer Investments | Monthly Join Our Elite Sports Consulting Discord 4.9 ( 454 ) Sports betting Experience the #1 sports consulting team with 100% transparency. Benefit from a 79% winrate and 26 months of profit. $170.00 / month Pay Join Features 79% winrate across all sports with consistent monthly profits. 5-7 High-Quality Plays Exclusive Access To Our Elite 14,000+ Member Community. 95% Winrate | Lock of the Week/Month/Year 100% Transparency Reviews 4.93 out of 5 454 total reviews 5 stars 4 stars 3 stars 2 stars 1 star KJ Kylie Johnston 1 month ago first month made around 2k. the staff worked with me 1 on 1 and i scaled all the way to 7.2k profit this month. best group by far that ive been in. love u AZ. The best Written 7 months after purchase MO Mike Oscardas 1 month ago I've heard alot about this group. I've chilled in the discord and ATE off free picks. I've been apart of the VIP for 4 months and this dude fr the fucking goat. I won't change cappers ever. Written 7 months after purchase DM David Miller 8 months ago excited for mlb again. hes the mlb best! Written 7 months after purchase NM Nikolai Morozov 8 months ago Amazing Platform Automation Written 3 minutes after purchase See all reviews About the creator HI View profile Hammer Investments @ hammerinvestments • Joined Feb 2024 As the creator of Hammer Investments, I&#x27;ve dedicated my career to providing unparalleled sports betting advice. With a 90% win-rate parlay and 100% transparency, I aim to ensure your investment sees significant returns. Our exclusive Guaranteed Sweep is designed with dedication, aiming to maximize your betting success. FAQs What&#x27;s your refund policy? How many plays are sent daily? What happens if the Guaranteed Sweep loses? Can I cancel my VIP Access subscription at any time? Affiliates HB Become an affiliate Hammer Investments | Sports Betting 30% reward Earn money by bringing customers to Hammer Investments | Sports Betting. Every time a customer purchases using your link, you&#x27;ll earn a commission. Hammer Investments | Monthly $170.00 / month +1 option Join $170.00 / month 1 option Pay Join Pay Join Hammer Investments | Monthly | Whop",
  "finalUrl": "https://whop.com/guaranteed-sweep/hammerinvestments-vip/",
  "fetchedAt": "2025-11-04T20:02:00.975Z",
  "textHash": "a6bd586651045bf5fbbaa3682eb8e77ef2679111f7581f276ad69a4a1a370af0",
  "drilled": false
}