{
  "baseUrl": "https://whop.com/innercircle2/hero-pif/",
  "title": "Inner Circle | Whop",
  "h1": "Inner Circle",
  "bullets": [
    "Sign in IM Inner Circle Business Helping Coaches Scale Past $50k - $100k/mo This product doesn&#x27;t have any visible pricing options DM the creator to notify them Features Build coaching offers with various access levels, from one-on-one to community.",
    "Manage up to 30 clients with just 8 hours of coaching per week for high profits.",
    "Use a streamlined funnel to attract new clients and build community relationship",
    "Join a group of like-minded coaches for ongoing support, feedback, and growth.",
    "Create a profitable coaching business that allows you to enjoy life and travel."
  ],
  "paras": [
    "Sign in IM Inner Circle Business Helping Coaches Scale Past $50k - $100k/mo",
    "Build coaching offers with various access levels, from one-on-one to community. Manage up to 30 clients with just 8 hours of coaching per week for high profits. Use a streamlined funnel to attract new clients and build community relationship Join a group of like-minded coaches for ongoing support, feedback, and growth. Create a profitable coaching business that allows you to enjoy life and travel. About the creator GL View profile Grayson Loupas @ graysonloupas • Joined Sep 2024 Affiliates IM Become an affiliate Inner Circle Mastermind 30% reward Earn money by bringing customers to Inner Circle Mastermind. Every time a customer purchases using your link, you&#x27;ll earn a commission."
  ],
  "priceTokens": [
    "$50",
    "$100",
    "$1",
    "$1",
    "$1",
    "$22",
    "$1",
    "$1",
    "$1",
    "$1",
    "$1",
    "$2",
    "$1",
    "$2",
    "$2",
    "$2",
    "$2",
    "$3",
    "$3",
    "$3"
  ],
  "faq": [],
  "textSample": "Sign in IM Inner Circle Business Helping Coaches Scale Past $50k - $100k/mo This product doesn&#x27;t have any visible pricing options DM the creator to notify them Features Build coaching offers with various access levels, from one-on-one to community. Manage up to 30 clients with just 8 hours of coaching per week for high profits. Use a streamlined funnel to attract new clients and build community relationship Join a group of like-minded coaches for ongoing support, feedback, and growth. Create a profitable coaching business that allows you to enjoy life and travel. About the creator GL View profile Grayson Loupas @ graysonloupas • Joined Sep 2024 Affiliates IM Become an affiliate Inner Circle Mastermind 30% reward Earn money by bringing customers to Inner Circle Mastermind. Every time a customer purchases using your link, you&#x27;ll earn a commission. Inner Circle No available pricing options DM the creator to notify them No available pricing options DM the creator to notify them Inner Circle | Whop",
  "finalUrl": "https://whop.com/innercircle2/hero-pif/",
  "fetchedAt": "2025-11-04T20:02:02.774Z",
  "textHash": "f301d5a6bc5aeed467cf543615b17218e7d8338867c9ed193d9b68fc8460ccaa",
  "drilled": false
}