{
  "baseUrl": "https://whop.com/iamtrading/i-am-trading/",
  "title": "I AM Trading Standard | Whop",
  "h1": "I AM Trading Standard",
  "bullets": [
    "Sign in IT I AM Trading Standard Join Our Dynamic Trading Community 4.6 ( 9 ) Trading Connect with traders, trade alongside pros and access daily lessons in our thriving community. $35.00 / month Pay Get offer Features Access to a dynamic Discord community of traders",
    "Daily lessons on price action for continuous learning and growth.",
    "Full access to all future educational content",
    "Live Trading Text Channels",
    "PE Paul Eang 24 days ago I was so frustrated when almost every time I entered a trade, it reverse on me. Until I met Joe and now I know why. No one ever explained to me about Price Action the way Joe does. Everything is explained in the course. Videos are short, straight to the point. It would cut down the learning curve q... Show more Written 9 days after purchase",
    "E estrader5317 1 month ago Iâ€™ve taken a lot of trading courses and this is the first one that actually led to a payout. Clear rules, proven setups, and mindset that sticks. Worth every penny! Written 18 days after purchase",
    "A AlexGold 1 month ago The Masterclass is pure gold â€” clear, structured, and packed with real trading insights. Every minute feels valuable. Huge respect, Joe! ðŸ’ªðŸ”¥ Written 6 days after purchase",
    "JP Jesse Pearson 1 year ago The I AM trading community is the best out there. Joe is by far the best mentor you can get. He is calm, cool, collected and has a degree in teaching so it's second nature to him. I cannot express enough how much my time in his mentorship has meant to me. Written 6 months after purchase"
  ],
  "paras": [
    "Sign in IT I AM Trading Standard Join Our Dynamic Trading Community 4.6 ( 9 ) Trading Connect with traders, trade alongside pros and access daily lessons in our thriving community.",
    "$35.00 / month Pay Get offer Features Access to a dynamic Discord community of traders Daily lessons on price action for continuous learning and growth. Full access to all future educational content Live Trading Text Channels Reviews 4.56 out of 5 9 total reviews 5 stars 4 stars 3 stars 2 stars 1 star PE Paul Eang 24 days ago I was so frustrated when almost every time I entered a trade, it reverse on me. Until I met Joe and now I know why. No one ever explained to me about Price Action the way Joe does. Everything is explained in the course. Videos are short, straight to the point. It would cut down the learning curve q...",
    "Written 9 days after purchase E estrader5317 1 month ago Iâ€™ve taken a lot of trading courses and this is the first one that actually led to a payout. Clear rules, proven setups, and mindset that sticks. Worth every penny!",
    "1 month ago The Masterclass is pure gold â€” clear, structured, and packed with real trading insights. Every minute feels valuable. Huge respect, Joe! ðŸ’ªðŸ”¥",
    "1 year ago The I AM trading community is the best out there. Joe is by far the best mentor you can get. He is calm, cool, collected and has a degree in teaching so it's second nature to him. I cannot express enough how much my time in his mentorship has meant to me.",
    "About the creator TJ View profile Trader Joe @ joe25 â€¢ Joined Mar 2024 I&#x27;ve been a full-time trader for years, committed to helping others achieve their trading goals. With a passion for teaching, I provide personalized mentorship to guide traders through every aspect of their journey, from mindset to strategy. FAQs Do you offer any guarantees? Do you offer trade signals? What is your refund policy? Affiliates IT Become an affiliate I AM Trading 30% reward Earn money by bringing customers to I AM Trading. Every time a customer purchases using your link, you&#x27;ll earn a commission."
  ],
  "priceTokens": [
    "$35.00",
    "$35.00",
    "$35.00",
    "$1",
    "$1",
    "$1",
    "$22",
    "$1",
    "$1",
    "$1",
    "$1",
    "$1",
    "$2",
    "$1",
    "$2",
    "$2",
    "$2",
    "$2",
    "$3",
    "$3"
  ],
  "faq": [],
  "textSample": "Sign in IT I AM Trading Standard Join Our Dynamic Trading Community 4.6 ( 9 ) Trading Connect with traders, trade alongside pros and access daily lessons in our thriving community. $35.00 / month Pay Get offer Features Access to a dynamic Discord community of traders Daily lessons on price action for continuous learning and growth. Full access to all future educational content Live Trading Text Channels Reviews 4.56 out of 5 9 total reviews 5 stars 4 stars 3 stars 2 stars 1 star PE Paul Eang 24 days ago I was so frustrated when almost every time I entered a trade, it reverse on me. Until I met Joe and now I know why. No one ever explained to me about Price Action the way Joe does. Everything is explained in the course. Videos are short, straight to the point. It would cut down the learning curve q... Show more Written 9 days after purchase E estrader5317 1 month ago Iâ€™ve taken a lot of trading courses and this is the first one that actually led to a payout. Clear rules, proven setups, and mindset that sticks. Worth every penny! Written 18 days after purchase A AlexGold 1 month ago The Masterclass is pure gold â€” clear, structured, and packed with real trading insights. Every minute feels valuable. Huge respect, Joe! ðŸ’ªðŸ”¥ Written 6 days after purchase JP Jesse Pearson 1 year ago The I AM trading community is the best out there. Joe is by far the best mentor you can get. He is calm, cool, collected and has a degree in teaching so it's second nature to him. I cannot express enough how much my time in his mentorship has meant to me. Written 6 months after purchase See all reviews About the creator TJ View profile Trader Joe @ joe25 â€¢ Joined Mar 2024 I&#x27;ve been a full-time trader for years, committed to helping others achieve their trading goals. With a passion for teaching, I provide personalized mentorship to guide traders through every aspect of their journey, from mindset to strategy. FAQs Do you offer any guarantees? Do you offer trade signals? What is your refund policy? Affiliates IT Become an affiliate I AM Trading 30% reward Earn money by bringing customers to I AM Trading. Every time a customer purchases using your link, you&#x27;ll earn a commission. I AM Trading Standard $35.00 / month +2 options Get offer $35.00 / month 2 options Pay Get offer Pay Get offer I AM Trading Standard | Whop",
  "finalUrl": "https://whop.com/iamtrading/i-am-trading/",
  "fetchedAt": "2025-11-05T09:29:51.113Z",
  "textHash": "c54164e93521b04376019a4cf386f8fa8e02bef4021e7c6dbbef1204bf51c74f",
  "drilled": false
}