{
  "baseUrl": "https://whop.com/iblvtrading/iblv-live/",
  "title": "IBLV Live | Whop",
  "h1": "IBLV Live",
  "bullets": [
    "Sign in IT IBLV Live Real-time trading with live sessions and updates. 4.9 ( 16 ) Trading For traders focused on real-time action. Includes live trading sessions, daily levels, and news. Does not include courses or educational calls. $50.00 / month Pay Join Features Participate in live trading sessions and pre-market analysis 3 times a week",
    "Get access to our daily levels and biases",
    "Expand your trading education through live educational calls",
    "Stay updated with timely news and fundamental analysis",
    "JM jasmine mcmanus 10 days ago I loved the 15-second strategy and the video breakdown explanations of the entire process from start to actively trading. However, I did get confused about which indicators were being used when confirming entries. I would love to get a bit more information on why you used that specific indicator. O... Show more Written 1 month after purchase",
    "KG Kayla Glover 23 days ago The free course was so perfect for me!!! I'm just getting started and feel confident that I will be a succeful trading because of this community. Can't wait to get started with the advanced program! Written 1 year after purchase",
    "C Cami 1 month ago I love this place come join Written 3 months after purchase",
    "F Figure *8 1 month ago Trinity isThe best mentor I have some across for a solid New York Open NQ scalping strategy. She is profitable and shows consistency, transparent shows her wins and losses, and goes over levels and plans every morning. She is responsive to questions and just all in all a Great community that is he... Show more Written 2 months after purchase"
  ],
  "paras": [
    "Sign in IT IBLV Live Real-time trading with live sessions and updates. 4.9 ( 16 ) Trading For traders focused on real-time action. Includes live trading sessions, daily levels, and news. Does not include courses or educational calls.",
    "$50.00 / month Pay Join Features Participate in live trading sessions and pre-market analysis 3 times a week Get access to our daily levels and biases Expand your trading education through live educational calls Stay updated with timely news and fundamental analysis Reviews 4.94 out of 5 16 total reviews 5 stars 4 stars 3 stars 2 stars 1 star JM jasmine mcmanus 10 days ago I loved the 15-second strategy and the video breakdown explanations of the entire process from start to actively trading. However, I did get confused about which indicators were being used when confirming entries. I would love to get a bit more information on why you used that specific indicator. O...",
    "Written 1 month after purchase KG Kayla Glover 23 days ago The free course was so perfect for me!!! I'm just getting started and feel confident that I will be a succeful trading because of this community. Can't wait to get started with the advanced program!",
    "1 month ago I love this place come join",
    "1 month ago Trinity isThe best mentor I have some across for a solid New York Open NQ scalping strategy. She is profitable and shows consistency, transparent shows her wins and losses, and goes over levels and plans every morning. She is responsive to questions and just all in all a Great community that is he...",
    "Written 2 months after purchase See all reviews About the creator IT View profile IBLV Trading @ iblvtrading • Joined Jun 2024 IBLV Trading is a futures education community founded on skill, faith, and perseverance. Led by Trinity Brinson, we combine expert trading education with a belief that, through hard work and trust in God, success in trading is within reach. We’re here to help you build real skill, real consistency, and reach what others call impossible. FAQs What do I get inside the IBLV Trading Hub? Is this for beginners or experienced traders? Do you offer live trading or signals? Can I join anytime? What markets do you focus on? Affiliates IT Become an affiliate IBLV Trading 15% reward Earn money by bringing customers to IBLV Trading. Every time a customer purchases using your link, you&#x27;ll earn a commission."
  ],
  "priceTokens": [
    "$50.00",
    "$50.00",
    "$50.00",
    "$1",
    "$1",
    "$1",
    "$22",
    "$1",
    "$1",
    "$1",
    "$1",
    "$1",
    "$2",
    "$1",
    "$2",
    "$2",
    "$2",
    "$2",
    "$3",
    "$3"
  ],
  "faq": [],
  "textSample": "Sign in IT IBLV Live Real-time trading with live sessions and updates. 4.9 ( 16 ) Trading For traders focused on real-time action. Includes live trading sessions, daily levels, and news. Does not include courses or educational calls. $50.00 / month Pay Join Features Participate in live trading sessions and pre-market analysis 3 times a week Get access to our daily levels and biases Expand your trading education through live educational calls Stay updated with timely news and fundamental analysis Reviews 4.94 out of 5 16 total reviews 5 stars 4 stars 3 stars 2 stars 1 star JM jasmine mcmanus 10 days ago I loved the 15-second strategy and the video breakdown explanations of the entire process from start to actively trading. However, I did get confused about which indicators were being used when confirming entries. I would love to get a bit more information on why you used that specific indicator. O... Show more Written 1 month after purchase KG Kayla Glover 23 days ago The free course was so perfect for me!!! I'm just getting started and feel confident that I will be a succeful trading because of this community. Can't wait to get started with the advanced program! Written 1 year after purchase C Cami 1 month ago I love this place come join Written 3 months after purchase F Figure *8 1 month ago Trinity isThe best mentor I have some across for a solid New York Open NQ scalping strategy. She is profitable and shows consistency, transparent shows her wins and losses, and goes over levels and plans every morning. She is responsive to questions and just all in all a Great community that is he... Show more Written 2 months after purchase See all reviews About the creator IT View profile IBLV Trading @ iblvtrading • Joined Jun 2024 IBLV Trading is a futures education community founded on skill, faith, and perseverance. Led by Trinity Brinson, we combine expert trading education with a belief that, through hard work and trust in God, success in trading is within reach. We’re here to help you build real skill, real consistency, and reach what others call impossible. FAQs What do I get inside the IBLV Trading Hub? Is this for beginners or experienced traders? Do you offer live trading or signals? Can I join anytime? What markets do you focus on? Affiliates IT Become an affiliate IBLV Trading 15% reward Earn money by bringing customers to IBLV Trading. Every time a customer purchases using your link, you&#x27;ll earn a commission. IBLV Live $50.00 / month +1 option Join $50.00 / month 1 option Pay Join Pay Join IBLV Live | Whop",
  "finalUrl": "https://whop.com/iblvtrading/iblv-live/",
  "fetchedAt": "2025-11-05T17:31:20.340Z",
  "textHash": "f8e50624a713b0d4612617180b88ef04134ca6bc79603d8eaebdca1599264dc7",
  "drilled": false
}