{
  "baseUrl": "https://whop.com/ignited/ignited-tools/",
  "title": "Ignited Apps | Whop",
  "h1": "Ignited Apps",
  "bullets": [
    "Ignited Apps | Whop Sign in I Ignited Apps We Create Whop Apps FAST 5.0 ( 13 ) Other Get A Custom Whop app built out for your community. REALLY fast. We take about 3-7 days to build Whop apps, and you OWN the source code. TYPES OF APPS WE HAVE CREATED Whop Chat Bots Support Related Automations Upsell with auto delivery AND MANY MORE, BOOK A CALL HERE FOR MORE INFO: https://cal.com/ignited/15min We have worked with HUGE creators on Whop including Frugal SZN Sharpline Sports Courtside Locks Freebie Frenzy Frozen Freebies Foodie Back To Basics Icey Isps Cosmic Flips From the same maker of: Lofi Radio | Used By 500+ Whops Forms | Used By 500+ Whops Discord Forwarder | Used By 300+ Whops Flappy Bird | Used By 80+ Whops Money Tycoon | Used By 60+ Whops Flashcards | Used By 150+ Whops Tasks | Used By 60+ Whops Testimonials | Used By 140+ Whops These apps have had 1000s of installs across several Whops and MANY users. WE HAVE BEEN WORKING WITH THE WHOP API SINCE 2022. BOOK A CALL FOR MORE INFO https://cal.com/ignited/15min $997.00 one-time purchase Pay Join Join 46 members Features We provide you the source code so you can host and run your app without relying on us after it&#x27;s built.",
    "Get a Whop App Built in 3-7 days",
    "Learn how to deploy your app",
    "A Andy 17 days ago Amazing developer and awesome flashcard app! Lemos is one of the most genuine and responsive devs I’ve ever talked to. He actually listens to feedback, improves the app fast, and cares about creators using it. The flashcards system is clean, easy to use, and gets better with every update. Huge respe... Show more Written 1 hour after purchase",
    "D Doppy 1 month ago Super helpful for my company Written 2 months after purchase",
    "A AC 2 months ago Great app with great use for collecting all testimonials! Written 1 minute after purchase",
    "D Doppy 3 months ago Super useful for my company Written 18 hours after purchase"
  ],
  "paras": [
    "Sign in I Ignited Apps We Create Whop Apps FAST 5.0 ( 13 ) Other Get A Custom Whop app built out for your community. REALLY fast. We take about 3-7 days to build Whop apps, and you OWN the source code.",
    "TYPES OF APPS WE HAVE CREATED",
    "Whop Chat Bots Support Related Automations Upsell with auto delivery",
    "AND MANY MORE, BOOK A CALL HERE FOR MORE INFO:",
    "https://cal.com/ignited/15min",
    "We have worked with HUGE creators on Whop including",
    "Frugal SZN Sharpline Sports Courtside Locks Freebie Frenzy Frozen Freebies Foodie Back To Basics Icey Isps Cosmic Flips",
    "From the same maker of:",
    "Lofi Radio | Used By 500+ Whops Forms | Used By 500+ Whops Discord Forwarder | Used By 300+ Whops Flappy Bird | Used By 80+ Whops Money Tycoon | Used By 60+ Whops Flashcards | Used By 150+ Whops Tasks | Used By 60+ Whops Testimonials | Used By 140+ Whops",
    "These apps have had 1000s of installs across several Whops and MANY users.",
    "WE HAVE BEEN WORKING WITH THE WHOP API SINCE 2022.",
    "BOOK A CALL FOR MORE INFO",
    "https://cal.com/ignited/15min",
    "Join 46 members Features We provide you the source code so you can host and run your app without relying on us after it&#x27;s built. Get a Whop App Built in 3-7 days Learn how to deploy your app Reviews 5 out of 5 13 total reviews 5 stars 4 stars 3 stars 2 stars 1 star A Andy 17 days ago Amazing developer and awesome flashcard app! Lemos is one of the most genuine and responsive devs I’ve ever talked to. He actually listens to feedback, improves the app fast, and cares about creators using it. The flashcards system is clean, easy to use, and gets better with every update. Huge respe...",
    "Written 1 hour after purchase D Doppy 1 month ago Super helpful for my company",
    "2 months ago Great app with great use for collecting all testimonials!",
    "3 months ago Super useful for my company",
    "About the creator L View profile Lemos @ lemos • Joined Mar 2022 I&#x27;ve dedicated my career to developing tools that empower community leaders. With Ignited Tools, I aim to simplify the management of paid communities, ensuring seamless operations and engagement. Affiliates I Become an affiliate Ignited 1% reward Earn money by bringing customers to Ignited. Every time a customer purchases using your link, you&#x27;ll earn a commission."
  ],
  "priceTokens": [
    "$997.00",
    "$997.00",
    "$997.00",
    "$1",
    "$1",
    "$1",
    "$22",
    "$1",
    "$1",
    "$1",
    "$1",
    "$1",
    "$2",
    "$1",
    "$2",
    "$2",
    "$2",
    "$2",
    "$3",
    "$3"
  ],
  "faq": [],
  "textSample": "Ignited Apps | Whop Sign in I Ignited Apps We Create Whop Apps FAST 5.0 ( 13 ) Other Get A Custom Whop app built out for your community. REALLY fast. We take about 3-7 days to build Whop apps, and you OWN the source code. TYPES OF APPS WE HAVE CREATED Whop Chat Bots Support Related Automations Upsell with auto delivery AND MANY MORE, BOOK A CALL HERE FOR MORE INFO: https://cal.com/ignited/15min We have worked with HUGE creators on Whop including Frugal SZN Sharpline Sports Courtside Locks Freebie Frenzy Frozen Freebies Foodie Back To Basics Icey Isps Cosmic Flips From the same maker of: Lofi Radio | Used By 500+ Whops Forms | Used By 500+ Whops Discord Forwarder | Used By 300+ Whops Flappy Bird | Used By 80+ Whops Money Tycoon | Used By 60+ Whops Flashcards | Used By 150+ Whops Tasks | Used By 60+ Whops Testimonials | Used By 140+ Whops These apps have had 1000s of installs across several Whops and MANY users. WE HAVE BEEN WORKING WITH THE WHOP API SINCE 2022. BOOK A CALL FOR MORE INFO https://cal.com/ignited/15min $997.00 one-time purchase Pay Join Join 46 members Features We provide you the source code so you can host and run your app without relying on us after it&#x27;s built. Get a Whop App Built in 3-7 days Learn how to deploy your app Reviews 5 out of 5 13 total reviews 5 stars 4 stars 3 stars 2 stars 1 star A Andy 17 days ago Amazing developer and awesome flashcard app! Lemos is one of the most genuine and responsive devs I’ve ever talked to. He actually listens to feedback, improves the app fast, and cares about creators using it. The flashcards system is clean, easy to use, and gets better with every update. Huge respe... Show more Written 1 hour after purchase D Doppy 1 month ago Super helpful for my company Written 2 months after purchase A AC 2 months ago Great app with great use for collecting all testimonials! Written 1 minute after purchase D Doppy 3 months ago Super useful for my company Written 18 hours after purchase See all reviews About the creator L View profile Lemos @ lemos • Joined Mar 2022 I&#x27;ve dedicated my career to developing tools that empower community leaders. With Ignited Tools, I aim to simplify the management of paid communities, ensuring seamless operations and engagement. Affiliates I Become an affiliate Ignited 1% reward Earn money by bringing customers to Ignited. Every time a customer purchases using your link, you&#x27;ll earn a commission. Ignited Apps $997.00 one-time purchase Join $997.00 one-time purchase Pay Join Pay Join",
  "finalUrl": "https://whop.com/ignited/ignited-tools/",
  "fetchedAt": "2025-11-04T21:55:52.405Z",
  "textHash": "317c434436e8bd625d2e600b7574474a9aa3556ecaa8f6325acad4caca7072bb",
  "drilled": false
}