{
  "baseUrl": "https://whop.com/ambassador-academy/influencer-university/",
  "title": "Influencer University ðŸ¥‡ | Whop",
  "h1": "Influencer University ðŸ¥‡",
  "bullets": [
    "Influencer University ðŸ¥‡ | Whop Sign in Unmute Unmute AA Influencer University ðŸ¥‡ Gain 10,000+ Followers Within 10 Days Guaranteed 4.3 ( 97 ) Careers Gain 10K+ followers in 10 days and land your first paid brand deal as a brand ambassador! $19.00 / 10 days 3 day trial Pay Join Join 92 members Features +10,000 Instagram Followers",
    "Paid Brand Deals",
    "Influencer University Course",
    "TA Tocarra Anderson 4 months ago Iâ€™m not happy with service I received Written 2 months after purchase",
    "CS Cassandra Simmons 8 months ago I love it Written 7 minutes after purchase",
    "PA Pamela Alston 9 months ago I have also been waiting on my certificate, what's going on? Written 1 month after purchase",
    "OD Olga Delacruz 9 months ago I can't wait... Just very curious and excited about learning the tricks and trades of the retail online business.... Meeting people all around the world...it's going to open so many doors... Written 21 hours after purchase"
  ],
  "paras": [
    "Sign in Unmute Unmute AA Influencer University ðŸ¥‡ Gain 10,000+ Followers Within 10 Days Guaranteed 4.3 ( 97 ) Careers Gain 10K+ followers in 10 days and land your first paid brand deal as a brand ambassador!",
    "$19.00 / 10 days 3 day trial Pay Join Join 92 members Features +10,000 Instagram Followers Paid Brand Deals Influencer University Course Reviews 4.29 out of 5 97 total reviews 5 stars 4 stars 3 stars 2 stars 1 star TA Tocarra Anderson 4 months ago Iâ€™m not happy with service I received",
    "8 months ago I love it",
    "9 months ago I have also been waiting on my certificate, what's going on?",
    "9 months ago I can't wait... Just very curious and excited about learning the tricks and trades of the retail online business.... Meeting people all around the world...it's going to open so many doors...",
    "About the creator TA View profile The Academy @ ambassadoracademy â€¢ Joined Jan 2025 Learn how to get paid by your favorite brands for reviewing products! We&#x27;re partnered with over 100 major fashion brands to help bridge the gap between brand and creator. FAQs How does this work? How many hauls will I get? What is The Ambassador Academy? Affiliates AA Become an affiliate Ambassador Academy 30% reward Earn money by bringing customers to Ambassador Academy. Every time a customer purchases using your link, you&#x27;ll earn a commission."
  ],
  "priceTokens": [
    "$19.00",
    "$19.00",
    "$19.00",
    "$1",
    "$1",
    "$1",
    "$22",
    "$1",
    "$1",
    "$1",
    "$1",
    "$1",
    "$2",
    "$1",
    "$2",
    "$2",
    "$2",
    "$2",
    "$3",
    "$3"
  ],
  "faq": [],
  "textSample": "Influencer University ðŸ¥‡ | Whop Sign in Unmute Unmute AA Influencer University ðŸ¥‡ Gain 10,000+ Followers Within 10 Days Guaranteed 4.3 ( 97 ) Careers Gain 10K+ followers in 10 days and land your first paid brand deal as a brand ambassador! $19.00 / 10 days 3 day trial Pay Join Join 92 members Features +10,000 Instagram Followers Paid Brand Deals Influencer University Course Reviews 4.29 out of 5 97 total reviews 5 stars 4 stars 3 stars 2 stars 1 star TA Tocarra Anderson 4 months ago Iâ€™m not happy with service I received Written 2 months after purchase CS Cassandra Simmons 8 months ago I love it Written 7 minutes after purchase PA Pamela Alston 9 months ago I have also been waiting on my certificate, what's going on? Written 1 month after purchase OD Olga Delacruz 9 months ago I can't wait... Just very curious and excited about learning the tricks and trades of the retail online business.... Meeting people all around the world...it's going to open so many doors... Written 21 hours after purchase See all reviews About the creator TA View profile The Academy @ ambassadoracademy â€¢ Joined Jan 2025 Learn how to get paid by your favorite brands for reviewing products! We&#x27;re partnered with over 100 major fashion brands to help bridge the gap between brand and creator. FAQs How does this work? How many hauls will I get? What is The Ambassador Academy? Affiliates AA Become an affiliate Ambassador Academy 30% reward Earn money by bringing customers to Ambassador Academy. Every time a customer purchases using your link, you&#x27;ll earn a commission. Influencer University ðŸ¥‡ $19.00 / 10 days +1 option Join $19.00 / 10 days 1 option Pay Join Pay Join",
  "finalUrl": "https://whop.com/ambassador-academy/influencer-university/",
  "fetchedAt": "2025-11-04T21:41:05.202Z",
  "textHash": "1657ae8276cff19b20cb29c1f517dfb1f623e26cc5fe24d5741bfe3897e3402b",
  "drilled": false
}