{
  "baseUrl": "https://whop.com/amazon-inner-circle/inner-circle-amazon-platinum/",
  "title": "Inner Circle Amazon Platinum | Whop",
  "h1": "Inner Circle Amazon Platinum",
  "bullets": [
    "Sign in EC Inner Circle Amazon Platinum Selling on Amazon 4.6 ( 44 ) Amazon FBA Selling on Amazon $1,000.00 one-time purchase Pay Join Join 3 members Features Lifetime Access to Inner Circle Amazon Platinium",
    "V VerdDuex5 25 days ago Muy bueno Written 3 months after purchase",
    "PM Patrick melvin 2 months ago U guys have shown me a lot I would definitely recommend Emoney to anyone trying or already buying and selling!! Written 3 months after purchase",
    "FS Fred SanSoucie 5 days ago Written 2 months after purchase",
    "RV Rodolfo Vera 5 days ago Written 24 days after purchase"
  ],
  "paras": [
    "Sign in EC Inner Circle Amazon Platinum Selling on Amazon 4.6 ( 44 ) Amazon FBA Selling on Amazon",
    "Join 3 members Features Lifetime Access to Inner Circle Amazon Platinium Reviews 4.61 out of 5 44 total reviews 5 stars 4 stars 3 stars 2 stars 1 star V VerdDuex5 25 days ago Muy bueno",
    "2 months ago U guys have shown me a lot I would definitely recommend Emoney to anyone trying or already buying and selling!!",
    "5 days ago",
    "5 days ago",
    "About the creator NE View profile Nick from eMoney @ nickresell • Joined May 2022 FAQs How to Contact Us? Affiliates EC Become an affiliate eMoney Inner Circle 30% reward Earn money by bringing customers to eMoney Inner Circle. Every time a customer purchases using your link, you&#x27;ll earn a commission."
  ],
  "priceTokens": [
    "$1,000.00",
    "$1,000.00",
    "$1,000.00",
    "$1",
    "$1",
    "$1",
    "$23",
    "$1",
    "$1",
    "$1",
    "$1",
    "$1",
    "$2",
    "$1",
    "$2",
    "$2",
    "$2",
    "$2",
    "$3",
    "$3"
  ],
  "faq": [],
  "textSample": "Sign in EC Inner Circle Amazon Platinum Selling on Amazon 4.6 ( 44 ) Amazon FBA Selling on Amazon $1,000.00 one-time purchase Pay Join Join 3 members Features Lifetime Access to Inner Circle Amazon Platinium Reviews 4.61 out of 5 44 total reviews 5 stars 4 stars 3 stars 2 stars 1 star V VerdDuex5 25 days ago Muy bueno Written 3 months after purchase PM Patrick melvin 2 months ago U guys have shown me a lot I would definitely recommend Emoney to anyone trying or already buying and selling!! Written 3 months after purchase FS Fred SanSoucie 5 days ago Written 2 months after purchase RV Rodolfo Vera 5 days ago Written 24 days after purchase See all reviews About the creator NE View profile Nick from eMoney @ nickresell • Joined May 2022 FAQs How to Contact Us? Affiliates EC Become an affiliate eMoney Inner Circle 30% reward Earn money by bringing customers to eMoney Inner Circle. Every time a customer purchases using your link, you&#x27;ll earn a commission. Inner Circle Amazon Platinum $1,000.00 one-time purchase Join $1,000.00 one-time purchase Pay Join Pay Join Inner Circle Amazon Platinum | Whop",
  "finalUrl": "https://whop.com/amazon-inner-circle/inner-circle-amazon-platinum/",
  "fetchedAt": "2025-11-04T19:42:40.846Z",
  "textHash": "b80a207b954083492e0bf694da625c6a5ded0d025bb4d714239fcc3690d6945d",
  "drilled": false
}