{
  "baseUrl": "https://whop.com/jaypickzem/?a=alexburnett21",
  "title": "JayPickzEm | Whop",
  "h1": "JayPickzEm",
  "bullets": [
    "Powered by J JayPickzEm Professional Sports Capper 5.0 ( 6 ) Contact seller Products $10.00 / week Turning Sports Betting Into A Profitable Side Hustle For you JayPickzEm 5.0 ( 6 ) Free earn up to $4k/M clipping my videos and posting! jaypickzem clipping New Contact seller Reviews SO Samuel Montes De Oca â€¢ JayPickzEm 10 months ago This is the best community, made my money back same day !!! and continuing to make money!! Written 4 days after purchase",
    "AB Antonio Bido â€¢ JayPickzEm 1 year ago This place is the best I made 200$ in 2 days with this group i definitely recommend joining youâ€™ll make your money back and more so fast itâ€™s unreal Written 4 days after purchase",
    "A Aleson â€¢ JayPickzEm 1 year ago JayPickEmz VIP is the real deal! His parlays are ðŸ”¥ and consistently hit. Great insights, easy to follow plays. The best out here fr! Written 7 days after purchase",
    "NM Noah Medina â€¢ JayPickzEm 1 year ago amazing picks, amazing consistency, he actually texts back unlike others and he has helped me get out of financial situations multiple times, cannot recommend more yall Written 5 days after purchase"
  ],
  "paras": [
    "J JayPickzEm Professional Sports Capper 5.0 ( 6 ) Contact seller Products $10.00 / week Turning Sports Betting Into A Profitable Side Hustle For you JayPickzEm 5.0 ( 6 ) Free earn up to $4k/M clipping my videos and posting! jaypickzem clipping New Contact seller Reviews SO Samuel Montes De Oca â€¢ JayPickzEm 10 months ago This is the best community, made my money back same day !!! and continuing to make money!!",
    "1 year ago This place is the best I made 200$ in 2 days with this group i definitely recommend joining youâ€™ll make your money back and more so fast itâ€™s unreal",
    "1 year ago JayPickEmz VIP is the real deal! His parlays are ðŸ”¥ and consistently hit. Great insights, easy to follow plays. The best out here fr!",
    "1 year ago amazing picks, amazing consistency, he actually texts back unlike others and he has helped me get out of financial situations multiple times, cannot recommend more yall"
  ],
  "priceTokens": [
    "$10.00",
    "$4",
    "$1",
    "$1",
    "$1",
    "$21",
    "$1",
    "$1",
    "$1",
    "$1",
    "$28",
    "$1",
    "$28",
    "$28",
    "$28",
    "$28",
    "$3",
    "$3",
    "$3",
    "$10"
  ],
  "faq": [],
  "textSample": "Powered by J JayPickzEm Professional Sports Capper 5.0 ( 6 ) Contact seller Products $10.00 / week Turning Sports Betting Into A Profitable Side Hustle For you JayPickzEm 5.0 ( 6 ) Free earn up to $4k/M clipping my videos and posting! jaypickzem clipping New Contact seller Reviews SO Samuel Montes De Oca â€¢ JayPickzEm 10 months ago This is the best community, made my money back same day !!! and continuing to make money!! Written 4 days after purchase AB Antonio Bido â€¢ JayPickzEm 1 year ago This place is the best I made 200$ in 2 days with this group i definitely recommend joining youâ€™ll make your money back and more so fast itâ€™s unreal Written 4 days after purchase A Aleson â€¢ JayPickzEm 1 year ago JayPickEmz VIP is the real deal! His parlays are ðŸ”¥ and consistently hit. Great insights, easy to follow plays. The best out here fr! Written 7 days after purchase NM Noah Medina â€¢ JayPickzEm 1 year ago amazing picks, amazing consistency, he actually texts back unlike others and he has helped me get out of financial situations multiple times, cannot recommend more yall Written 5 days after purchase See all reviews JayPickzEm | Whop",
  "finalUrl": "https://whop.com/jaypickzem/?a=alexburnett21",
  "fetchedAt": "2025-11-05T10:06:42.269Z",
  "textHash": "102b3071314f709bbf974cc1175a3dc10a71ee963af5b185bca63017ae9beff6",
  "drilled": false
}