{
  "baseUrl": "https://whop.com/elitevip/jomo-s-alerts/",
  "title": "JoMo’s Trades | Whop",
  "h1": "JoMo’s Trades",
  "bullets": [
    "Sign in CS JoMo’s Trades Access JOMO’s trade alerts and market insights ONLY 5.0 ( 38 ) Trading JOMO’s Alerts – Full access to JOMO’s trade alerts and market updates. No extras, no coaching, no direct access, just the insights you need $266.00 / month Pay Join Features Real-Time Trade Alerts",
    "Market Updates – Stay informed with concise insights",
    "U Umatic 1 day ago If you want to actually make money and eventually KEEP it this is the best group to join and get the skills and guidance to do so .Jomo and CM are professionals and say things as they are they give the bitter truth and not sweet lies ! Best VIP i joined ! Written 4 months after purchase",
    "B Bart 19 days ago Been in the CM community since 2020 and oh boy…. Didn’t regret my membership. Written 19 minutes after purchase",
    "DB Daryl H Baker 21 days ago JoMo and CM are excellent. These guys are pros with a track record scaling back several years and multiple cycles. They are chart maxi’s. No cultish behavior here. They look to extract as much money from the market as possible. Short or long. They do the heavy lifting. 24/7 market surveillance. Trad... Show more Written 3 months after purchase",
    "H Howard 1 month ago This is my review of jomo's Trade Club. After 3 years i can appreciate the benefit of having a true mentor who understands that i as an amateur only need the high probability trade's. to be fare what stands out the most looking back is how he accelerated my learning by teaching me how to fish for se... Show more Written 2 months after purchase"
  ],
  "paras": [
    "Sign in CS JoMo’s Trades Access JOMO’s trade alerts and market insights ONLY 5.0 ( 38 ) Trading JOMO’s Alerts – Full access to JOMO’s trade alerts and market updates. No extras, no coaching, no direct access, just the insights you need",
    "Real-Time Trade Alerts Market Updates – Stay informed with concise insights Reviews 4.95 out of 5 38 total reviews 5 stars 4 stars 3 stars 2 stars 1 star U Umatic 1 day ago If you want to actually make money and eventually KEEP it this is the best group to join and get the skills and guidance to do so .Jomo and CM are professionals and say things as they are they give the bitter truth and not sweet lies ! Best VIP i joined !",
    "19 days ago Been in the CM community since 2020 and oh boy…. Didn’t regret my membership.",
    "21 days ago JoMo and CM are excellent. These guys are pros with a track record scaling back several years and multiple cycles. They are chart maxi’s. No cultish behavior here. They look to extract as much money from the market as possible. Short or long. They do the heavy lifting. 24/7 market surveillance. Trad...",
    "Written 3 months after purchase H Howard 1 month ago This is my review of jomo's Trade Club. After 3 years i can appreciate the benefit of having a true mentor who understands that i as an amateur only need the high probability trade's. to be fare what stands out the most looking back is how he accelerated my learning by teaching me how to fish for se...",
    "Written 2 months after purchase See all reviews About the creator CM View profile Crypto Mindset @ cryptomindset00 • Joined Jan 2025 Affiliates CS Become an affiliate Crypto Mindset VIP Service 30% reward Earn money by bringing customers to Crypto Mindset VIP Service. Every time a customer purchases using your link, you&#x27;ll earn a commission."
  ],
  "priceTokens": [
    "$266.00",
    "$266.00",
    "$266.00",
    "$1",
    "$1",
    "$1",
    "$22",
    "$1",
    "$1",
    "$1",
    "$1",
    "$1",
    "$2",
    "$1",
    "$2",
    "$2",
    "$2",
    "$2",
    "$3",
    "$3"
  ],
  "faq": [],
  "textSample": "Sign in CS JoMo’s Trades Access JOMO’s trade alerts and market insights ONLY 5.0 ( 38 ) Trading JOMO’s Alerts – Full access to JOMO’s trade alerts and market updates. No extras, no coaching, no direct access, just the insights you need $266.00 / month Pay Join Features Real-Time Trade Alerts Market Updates – Stay informed with concise insights Reviews 4.95 out of 5 38 total reviews 5 stars 4 stars 3 stars 2 stars 1 star U Umatic 1 day ago If you want to actually make money and eventually KEEP it this is the best group to join and get the skills and guidance to do so .Jomo and CM are professionals and say things as they are they give the bitter truth and not sweet lies ! Best VIP i joined ! Written 4 months after purchase B Bart 19 days ago Been in the CM community since 2020 and oh boy…. Didn’t regret my membership. Written 19 minutes after purchase DB Daryl H Baker 21 days ago JoMo and CM are excellent. These guys are pros with a track record scaling back several years and multiple cycles. They are chart maxi’s. No cultish behavior here. They look to extract as much money from the market as possible. Short or long. They do the heavy lifting. 24/7 market surveillance. Trad... Show more Written 3 months after purchase H Howard 1 month ago This is my review of jomo's Trade Club. After 3 years i can appreciate the benefit of having a true mentor who understands that i as an amateur only need the high probability trade's. to be fare what stands out the most looking back is how he accelerated my learning by teaching me how to fish for se... Show more Written 2 months after purchase See all reviews About the creator CM View profile Crypto Mindset @ cryptomindset00 • Joined Jan 2025 Affiliates CS Become an affiliate Crypto Mindset VIP Service 30% reward Earn money by bringing customers to Crypto Mindset VIP Service. Every time a customer purchases using your link, you&#x27;ll earn a commission. JoMo’s Trades $266.00 / month Join $266.00 / month Pay Join Pay Join JoMo’s Trades | Whop",
  "finalUrl": "https://whop.com/elitevip/jomo-s-alerts/",
  "fetchedAt": "2025-11-05T17:34:43.260Z",
  "textHash": "388b1d78a4da37064c1ca73dbd4ab2db28524a2a7104e5d1d7f4fac2173bca85",
  "drilled": false
}