{
  "baseUrl": "https://whop.com/korvato/korvato-copy-1d/",
  "title": "Korvato Gold Rush | Whop",
  "h1": "Korvato Gold Rush",
  "bullets": [
    "Sign in K Korvato Gold Rush Fully automate how you trade XAU/USD with AI. 5.0 ( 3 ) Trading Gold Rush AI is a fully automated trading system on MT4 &amp; MT5, adapting to market cycles, managing risk intelligently, and delivering precise, optimized returns for all traders. $20,000.00 one-time purchase Pay Purchase Join 56 members Features Access the most sophisticated AI trading algorithms on the market",
    "Dedicated customer support with personalized training and assistance",
    "High customization to meet diverse client needs effectively",
    "Real-time AI risk assessment for smarter, safer trades",
    "Fully compatible with MT4 &amp; MT5 trading platforms",
    "DP David A Pellinen 4 months ago I am using Korvato's Optimus AI for about three months now. I have seen consistent positive results. It is a very powerful tool for a passive income stream. The team has been responsive, helpful and knowledgeable. Would recommend to anyone who has the initial setup cost available, plus a sizeable ac... Show more Written 4 months after purchase",
    "D dustins 9 months ago Paul and his team are amazing, this bot is the top of the line, and you become a family of very successful hands free traders. The bot isn't cheap, but you also always get what you pay for. Written 3 months after purchase",
    "TW Tobias WIlliams 1 year ago Incredibly speedy setup, great customer service. Written 15 days after purchase"
  ],
  "paras": [
    "Sign in K Korvato Gold Rush Fully automate how you trade XAU/USD with AI. 5.0 ( 3 ) Trading Gold Rush AI is a fully automated trading system on MT4 &amp; MT5, adapting to market cycles, managing risk intelligently, and delivering precise, optimized returns for all traders.",
    "Join 56 members Features Access the most sophisticated AI trading algorithms on the market Dedicated customer support with personalized training and assistance High customization to meet diverse client needs effectively Real-time AI risk assessment for smarter, safer trades Fully compatible with MT4 &amp; MT5 trading platforms Reviews 5 out of 5 3 total reviews 5 stars 4 stars 3 stars 2 stars 1 star DP David A Pellinen 4 months ago I am using Korvato's Optimus AI for about three months now. I have seen consistent positive results. It is a very powerful tool for a passive income stream. The team has been responsive, helpful and knowledgeable. Would recommend to anyone who has the initial setup cost available, plus a sizeable ac...",
    "Written 4 months after purchase D dustins 9 months ago Paul and his team are amazing, this bot is the top of the line, and you become a family of very successful hands free traders. The bot isn't cheap, but you also always get what you pay for.",
    "1 year ago Incredibly speedy setup, great customer service.",
    "FAQs How does Korvato ensure security? What kind of support does Korvato offer? How does Korvato’s AI benefit my trading? How does Korvato ensure the safety and security of its trading algorithms? Can I customize the AI Trading Algorithms to fit my specific trading strategy and risk tolerance? Affiliates K Become an affiliate Korvato 30% reward Earn money by bringing customers to Korvato. Every time a customer purchases using your link, you&#x27;ll earn a commission."
  ],
  "priceTokens": [
    "$20,000.00",
    "$20,000.00",
    "$20,000.00",
    "$1",
    "$1",
    "$1",
    "$22",
    "$1",
    "$1",
    "$1",
    "$1",
    "$1",
    "$2",
    "$1",
    "$2",
    "$2",
    "$2",
    "$2",
    "$3",
    "$3"
  ],
  "faq": [],
  "textSample": "Sign in K Korvato Gold Rush Fully automate how you trade XAU/USD with AI. 5.0 ( 3 ) Trading Gold Rush AI is a fully automated trading system on MT4 &amp; MT5, adapting to market cycles, managing risk intelligently, and delivering precise, optimized returns for all traders. $20,000.00 one-time purchase Pay Purchase Join 56 members Features Access the most sophisticated AI trading algorithms on the market Dedicated customer support with personalized training and assistance High customization to meet diverse client needs effectively Real-time AI risk assessment for smarter, safer trades Fully compatible with MT4 &amp; MT5 trading platforms Reviews 5 out of 5 3 total reviews 5 stars 4 stars 3 stars 2 stars 1 star DP David A Pellinen 4 months ago I am using Korvato's Optimus AI for about three months now. I have seen consistent positive results. It is a very powerful tool for a passive income stream. The team has been responsive, helpful and knowledgeable. Would recommend to anyone who has the initial setup cost available, plus a sizeable ac... Show more Written 4 months after purchase D dustins 9 months ago Paul and his team are amazing, this bot is the top of the line, and you become a family of very successful hands free traders. The bot isn't cheap, but you also always get what you pay for. Written 3 months after purchase TW Tobias WIlliams 1 year ago Incredibly speedy setup, great customer service. Written 15 days after purchase About the creator K View profile Korvato @ korvatollc • Joined Apr 2024 At Korvato, we aim to reshape investing by blending traditional financial strategies with cutting-edge technology. Powered by a team of experts, Optimus AI delivers automated trading, optimized performance, and intelligent risk management for traders of all levels. We’re redefining trading to make financial success accessible, empowering a brighter future for all. FAQs How does Korvato ensure security? What kind of support does Korvato offer? How does Korvato’s AI benefit my trading? How does Korvato ensure the safety and security of its trading algorithms? Can I customize the AI Trading Algorithms to fit my specific trading strategy and risk tolerance? Affiliates K Become an affiliate Korvato 30% reward Earn money by bringing customers to Korvato. Every time a customer purchases using your link, you&#x27;ll earn a commission. Korvato Gold Rush $20,000.00 one-time purchase Purchase $20,000.00 one-time purchase Pay Purchase Pay Purchase Korvato Gold Rush | Whop",
  "finalUrl": "https://whop.com/korvato/korvato-copy-1d/",
  "fetchedAt": "2025-11-04T19:58:19.959Z",
  "textHash": "de3bb383f38f01a6bb6ea52a00fcc3dd56e650b8a31518ce7ee12fe80c0cbb18",
  "drilled": false
}