{
  "baseUrl": "https://whop.com/linesnipers/?a=alexburnett21",
  "title": "Line Snipers | Whop",
  "h1": "Line Snipers",
  "bullets": [
    "Powered by LS Line Snipers I&#x27;ve dedicated my career to mastering the art of profitable betting. By gathering a team of sharp bettors, I&#x27;ve created a community where members can access daily +EV plays, personalized advice, and l... More 5.0 ( 7 ) Contact seller Products $10.00 / week Free trial Gain a Competitive Edge in Gambling Line Snipers Membership 5.0 ( 7 ) Contact seller Reviews A Alleykat 5 months ago Been cashing out with Line Snipers since October 2023. Theyâ€™re elite at finding +EV SGPs, especially using devigged boosts. If youâ€™re serious about value betting, this Discord is a must. ðŸ’°ðŸ”¥ Written 2 years after purchase",
    "AZ Anthony Zangrillo 5 months ago Great community and have received a lot of helpful plays from the team Written 1 year after purchase",
    "EG Evan Gagnon 5 months ago My experience has been great so far. Consistently making money while engaging in a fun community is all you can ask for. Written 1 month after purchase",
    "W wangste002 1 year ago Love the set-up of the Discord and have received a lot of helpful plays from Tennessee, JV, and Tom. The Line Snipers Discord is rich with knowledge and great customer service. Written 3 months after purchase"
  ],
  "paras": [
    "LS Line Snipers I&#x27;ve dedicated my career to mastering the art of profitable betting. By gathering a team of sharp bettors, I&#x27;ve created a community where members can access daily +EV plays, personalized advice, and l... More 5.0 ( 7 ) Contact seller Products $10.00 / week Free trial Gain a Competitive Edge in Gambling Line Snipers Membership 5.0 ( 7 ) Contact seller Reviews A Alleykat 5 months ago Been cashing out with Line Snipers since October 2023. Theyâ€™re elite at finding +EV SGPs, especially using devigged boosts. If youâ€™re serious about value betting, this Discord is a must. ðŸ’°ðŸ”¥",
    "5 months ago Great community and have received a lot of helpful plays from the team",
    "5 months ago My experience has been great so far. Consistently making money while engaging in a fun community is all you can ask for.",
    "1 year ago Love the set-up of the Discord and have received a lot of helpful plays from Tennessee, JV, and Tom. The Line Snipers Discord is rich with knowledge and great customer service."
  ],
  "priceTokens": [
    "$10.00",
    "$1",
    "$1",
    "$1",
    "$21",
    "$1",
    "$1",
    "$1",
    "$1",
    "$28",
    "$1",
    "$28",
    "$28",
    "$28",
    "$28",
    "$3",
    "$3",
    "$3",
    "$10",
    "$100,000"
  ],
  "faq": [],
  "textSample": "Powered by LS Line Snipers I&#x27;ve dedicated my career to mastering the art of profitable betting. By gathering a team of sharp bettors, I&#x27;ve created a community where members can access daily +EV plays, personalized advice, and l... More 5.0 ( 7 ) Contact seller Products $10.00 / week Free trial Gain a Competitive Edge in Gambling Line Snipers Membership 5.0 ( 7 ) Contact seller Reviews A Alleykat 5 months ago Been cashing out with Line Snipers since October 2023. Theyâ€™re elite at finding +EV SGPs, especially using devigged boosts. If youâ€™re serious about value betting, this Discord is a must. ðŸ’°ðŸ”¥ Written 2 years after purchase AZ Anthony Zangrillo 5 months ago Great community and have received a lot of helpful plays from the team Written 1 year after purchase EG Evan Gagnon 5 months ago My experience has been great so far. Consistently making money while engaging in a fun community is all you can ask for. Written 1 month after purchase W wangste002 1 year ago Love the set-up of the Discord and have received a lot of helpful plays from Tennessee, JV, and Tom. The Line Snipers Discord is rich with knowledge and great customer service. Written 3 months after purchase See all reviews Line Snipers | Whop",
  "finalUrl": "https://whop.com/linesnipers/?a=alexburnett21",
  "fetchedAt": "2025-11-05T10:39:12.133Z",
  "textHash": "4796d2460375c4235713232e833cfde61db6e540db1c38d40fef7fdb52f7a095",
  "drilled": false
}