{
  "baseUrl": "https://whop.com/evolution-traders/gold-members-live-trading/",
  "title": "LIVE TRADING Gold Monthly | Whop",
  "h1": "LIVE TRADING Gold Monthly",
  "bullets": [
    "Sign in ET LIVE TRADING Gold Monthly DAILY LIVE TRADING ACCESS 5.0 ( 6 ) Other LIVE TRADING STREAM SCHEDULE MON-FRIDAY 11:30AM EST -2PM EST $25.00 / month Pay Join Join 2 members Features Daily Live Trading",
    "Education Strategy Courses (all my setups in video lessons)",
    "Real Time Technical Analysis",
    "Strategy Setup Signals",
    "Weekly Webinar Training Sessions",
    "DS David Schanzlin 9 months ago Dee (Dennis) is first class and Evolution Traders is a homerun for the beginner or a seasoned trader. I was really impressed in the education department, as the lessons are clear cut and to the point. Dee is a no holds back teacher that isn't afraid to tell it like it is, (which in this industry is ... Show more Written 2 months after purchase",
    "RR Rebecca Reitz 10 months ago Trading is immensely challenging and can often leave individuals feeling psychologically and financially overwhelmed. Despite the incredible perks of financial independence, the difficulties in acquiring this independence can sometimes make it feel impossible to attain. As I trek along my own tradin... Show more Written 19 days after purchase",
    "HS Harinder Singh 10 months ago This group is actually a game changer. Instead of signal selling Dee teaches u in depth knowledge of his strategies so that u can take trades on your own. His strategies do work 80-90% of time and he also provides free limited time access to his discord (strategies) for anyone who wants to join his... Show more Written 3 months after purchase",
    "IF Iokepa S Fraticelli 10 months ago Before joining Dee and Evolution Traders community, I spent a lot of money and time trying to learn trading futures with very poor results. My journey with Evolution Traders began in Spring 2024, and since then I have been able to pass evaluations and take multiple withdrawals in less than a year. ... Show more Written 9 months after purchase"
  ],
  "paras": [
    "Sign in ET LIVE TRADING Gold Monthly DAILY LIVE TRADING ACCESS 5.0 ( 6 ) Other LIVE TRADING STREAM SCHEDULE",
    "MON-FRIDAY 11:30AM EST -2PM EST",
    "Join 2 members Features Daily Live Trading Education Strategy Courses (all my setups in video lessons) Real Time Technical Analysis Strategy Setup Signals Weekly Webinar Training Sessions Reviews 5 out of 5 6 total reviews 5 stars 4 stars 3 stars 2 stars 1 star DS David Schanzlin 9 months ago Dee (Dennis) is first class and Evolution Traders is a homerun for the beginner or a seasoned trader. I was really impressed in the education department, as the lessons are clear cut and to the point. Dee is a no holds back teacher that isn't afraid to tell it like it is, (which in this industry is ...",
    "Written 2 months after purchase RR Rebecca Reitz 10 months ago Trading is immensely challenging and can often leave individuals feeling psychologically and financially overwhelmed. Despite the incredible perks of financial independence, the difficulties in acquiring this independence can sometimes make it feel impossible to attain. As I trek along my own tradin...",
    "Written 19 days after purchase HS Harinder Singh 10 months ago This group is actually a game changer. Instead of signal selling Dee teaches u in depth knowledge of his strategies so that u can take trades on your own. His strategies do work 80-90% of time and he also provides free limited time access to his discord (strategies) for anyone who wants to join his...",
    "Written 3 months after purchase IF Iokepa S Fraticelli 10 months ago Before joining Dee and Evolution Traders community, I spent a lot of money and time trying to learn trading futures with very poor results. My journey with Evolution Traders began in Spring 2024, and since then I have been able to pass evaluations and take multiple withdrawals in less than a year. ...",
    "Written 9 months after purchase See all reviews About the creator DW View profile dennis white @ deeanthonytrades • Joined Aug 2023 I’ve dedicated my career to mastering the art of trading. My mission is to share my knowledge and help others excel in stocks, options, and futures through my Evolution Trader System. With daily live webinars, one-on-one coaching, and a supportive community, I&#x27;m here to guide you towards consistent trading success. FAQs What Is Your Refund Policy? How can I book a 1-1 coaching session? Affiliates ET Become an affiliate Evolution Traders 30% reward Earn money by bringing customers to Evolution Traders. Every time a customer purchases using your link, you&#x27;ll earn a commission."
  ],
  "priceTokens": [
    "$25.00",
    "$25.00",
    "$25.00",
    "$1",
    "$1",
    "$1",
    "$22",
    "$1",
    "$1",
    "$1",
    "$1",
    "$1",
    "$2",
    "$1",
    "$2",
    "$2",
    "$2",
    "$2",
    "$3",
    "$3"
  ],
  "faq": [],
  "textSample": "Sign in ET LIVE TRADING Gold Monthly DAILY LIVE TRADING ACCESS 5.0 ( 6 ) Other LIVE TRADING STREAM SCHEDULE MON-FRIDAY 11:30AM EST -2PM EST $25.00 / month Pay Join Join 2 members Features Daily Live Trading Education Strategy Courses (all my setups in video lessons) Real Time Technical Analysis Strategy Setup Signals Weekly Webinar Training Sessions Reviews 5 out of 5 6 total reviews 5 stars 4 stars 3 stars 2 stars 1 star DS David Schanzlin 9 months ago Dee (Dennis) is first class and Evolution Traders is a homerun for the beginner or a seasoned trader. I was really impressed in the education department, as the lessons are clear cut and to the point. Dee is a no holds back teacher that isn't afraid to tell it like it is, (which in this industry is ... Show more Written 2 months after purchase RR Rebecca Reitz 10 months ago Trading is immensely challenging and can often leave individuals feeling psychologically and financially overwhelmed. Despite the incredible perks of financial independence, the difficulties in acquiring this independence can sometimes make it feel impossible to attain. As I trek along my own tradin... Show more Written 19 days after purchase HS Harinder Singh 10 months ago This group is actually a game changer. Instead of signal selling Dee teaches u in depth knowledge of his strategies so that u can take trades on your own. His strategies do work 80-90% of time and he also provides free limited time access to his discord (strategies) for anyone who wants to join his... Show more Written 3 months after purchase IF Iokepa S Fraticelli 10 months ago Before joining Dee and Evolution Traders community, I spent a lot of money and time trying to learn trading futures with very poor results. My journey with Evolution Traders began in Spring 2024, and since then I have been able to pass evaluations and take multiple withdrawals in less than a year. ... Show more Written 9 months after purchase See all reviews About the creator DW View profile dennis white @ deeanthonytrades • Joined Aug 2023 I’ve dedicated my career to mastering the art of trading. My mission is to share my knowledge and help others excel in stocks, options, and futures through my Evolution Trader System. With daily live webinars, one-on-one coaching, and a supportive community, I&#x27;m here to guide you towards consistent trading success. FAQs What Is Your Refund Policy? How can I book a 1-1 coaching session? Affiliates ET Become an affiliate Evolution Traders 30% reward Earn money by bringing customers to Evolution Traders. Every time a customer purchases using your link, you&#x27;ll earn a commission. LIVE TRADING Gold Monthly $25.00 / month Join $25.00 / month Pay Join Pay Join LIVE TRADING Gold Monthly | Whop",
  "finalUrl": "https://whop.com/evolution-traders/gold-members-live-trading/",
  "fetchedAt": "2025-11-05T10:49:41.747Z",
  "textHash": "1f7e31088c42100152e7a9c33fb18212f01c3e6b1e13ede92e861b90d0078a3e",
  "drilled": false
}