{
  "baseUrl": "https://whop.com/lordsportspicks/lordsports-baseball/",
  "title": "LordSports Baseball | Whop",
  "h1": "LordSports Baseball",
  "bullets": [
    "Sign in LK LordSports Baseball All coverage of Baseball Leagues including MLB +Asia 4.6 ( 36 ) Sports betting All sports betting coverage for baseball including Major League Baseball and Asia leagues such as Korea and Japan. Daily bets, future bets, 24/7 action from the King of Baseball! $60.00 / week Pay Join Features Improve your Sports Betting Results in Baseball.",
    "Coverage of Major League Baseball and Asia Baseball Leagues. 24/7 Action",
    "Access to every bet daily, including parlays.",
    "TB Terry Bland 1 month ago Great site Written 1 month after purchase",
    "D Darek 1 month ago Good Written 3 days after purchase",
    "CP Curan P 1 month ago gg Written 4 days after purchase",
    "SC SportsBook Cash 2 months ago üêê Written 2 days after purchase"
  ],
  "paras": [
    "Sign in LK LordSports Baseball All coverage of Baseball Leagues including MLB +Asia 4.6 ( 36 ) Sports betting All sports betting coverage for baseball including Major League Baseball and Asia leagues such as Korea and Japan. Daily bets, future bets, 24/7 action from the King of Baseball!",
    "$60.00 / week Pay Join Features Improve your Sports Betting Results in Baseball. Coverage of Major League Baseball and Asia Baseball Leagues. 24/7 Action Access to every bet daily, including parlays. Reviews 4.64 out of 5 36 total reviews 5 stars 4 stars 3 stars 2 stars 1 star TB Terry Bland 1 month ago Great site",
    "1 month ago Good",
    "1 month ago gg",
    "2 months ago üêê",
    "About the creator MP View profile Michael P @ lordsportspicks ‚Ä¢ Joined Feb 2023 I&#x27;ve mastered the art of sports betting, focusing on long-term profits. My passion is to guide others in beating the bookies and generating extra income. FAQs What sports/leagues does it includes? What units size do you use? Affiliates LK Become an affiliate LordSportsPicks - Max Bets King 30% reward Earn money by bringing customers to LordSportsPicks - Max Bets King. Every time a customer purchases using your link, you&#x27;ll earn a commission."
  ],
  "priceTokens": [
    "$60.00",
    "$60.00",
    "$60.00",
    "$1",
    "$1",
    "$1",
    "$22",
    "$1",
    "$1",
    "$1",
    "$1",
    "$1",
    "$2",
    "$1",
    "$2",
    "$2",
    "$2",
    "$2",
    "$3",
    "$3"
  ],
  "faq": [],
  "textSample": "Sign in LK LordSports Baseball All coverage of Baseball Leagues including MLB +Asia 4.6 ( 36 ) Sports betting All sports betting coverage for baseball including Major League Baseball and Asia leagues such as Korea and Japan. Daily bets, future bets, 24/7 action from the King of Baseball! $60.00 / week Pay Join Features Improve your Sports Betting Results in Baseball. Coverage of Major League Baseball and Asia Baseball Leagues. 24/7 Action Access to every bet daily, including parlays. Reviews 4.64 out of 5 36 total reviews 5 stars 4 stars 3 stars 2 stars 1 star TB Terry Bland 1 month ago Great site Written 1 month after purchase D Darek 1 month ago Good Written 3 days after purchase CP Curan P 1 month ago gg Written 4 days after purchase SC SportsBook Cash 2 months ago üêê Written 2 days after purchase See all reviews About the creator MP View profile Michael P @ lordsportspicks ‚Ä¢ Joined Feb 2023 I&#x27;ve mastered the art of sports betting, focusing on long-term profits. My passion is to guide others in beating the bookies and generating extra income. FAQs What sports/leagues does it includes? What units size do you use? Affiliates LK Become an affiliate LordSportsPicks - Max Bets King 30% reward Earn money by bringing customers to LordSportsPicks - Max Bets King. Every time a customer purchases using your link, you&#x27;ll earn a commission. LordSports Baseball $60.00 / week +3 options Join $60.00 / week 3 options Pay Join Pay Join LordSports Baseball | Whop",
  "finalUrl": "https://whop.com/lordsportspicks/lordsports-baseball/",
  "fetchedAt": "2025-11-04T20:06:43.716Z",
  "textHash": "9fdcb6f91371d7d42ff5c8fbde279dd2f54d8a3209ccce7fe70c075a86466a92",
  "drilled": false
}