{
  "baseUrl": "https://whop.com/madcharts-academy/madcharts/",
  "title": "The Madness Trading FLoor | Whop",
  "h1": "The Madness Trading FLoor",
  "bullets": [
    "Sign in M The Madness Trading FLoor Trade Live. Learn Fast. Win Big with MadCharts. 4.4 ( 27 ) Trading The Madness Trading Floor is the biggest trading community in the world. Get access today! $69.00 / month Pay Get access Join 478 members Features Real-time market insights with 3-5 live streams per week.",
    "Customized trading journal to track and enhance your progress.",
    "Exclusive access to weekly educational webinars.",
    "In-house tools &amp; indicators generating over 7Figures annually.",
    "Join a thriving community of like-minded traders.",
    "CD Clive Dunton 1 month ago Best guy Written 2 years after purchase",
    "G gideongrobbelaargg 1 year ago The amount of information we getting from MadCharts is insane and the bestðŸ”¥ðŸ”¥ Best trader out there! Written 10 days after purchase",
    "G gerlinrichards7 1 year ago Joined last week was a slow week but I'm profitable only following madmoney instructions and I promise you'll make money I've doubled my account in just this week it's a small account but hey small steps count and I believe I'll grow and be profitable with you my mentor you don't just give signals b... Show more Written 13 days after purchase",
    "R ryankiatfb 1 year ago Quality signals are sent to the group! I wish he'd continue to put up more videos of him breaking down the market to really understand how he analyzes the charts and to see how a pro trader like him undertakes the market ! :) Written 13 days after purchase"
  ],
  "paras": [
    "Sign in M The Madness Trading FLoor Trade Live. Learn Fast. Win Big with MadCharts. 4.4 ( 27 ) Trading The Madness Trading Floor is the biggest trading community in the world. Get access today!",
    "$69.00 / month Pay Get access Join 478 members Features Real-time market insights with 3-5 live streams per week. Customized trading journal to track and enhance your progress. Exclusive access to weekly educational webinars. In-house tools &amp; indicators generating over 7Figures annually. Join a thriving community of like-minded traders. Reviews 4.44 out of 5 27 total reviews 5 stars 4 stars 3 stars 2 stars 1 star CD Clive Dunton 1 month ago Best guy",
    "1 year ago The amount of information we getting from MadCharts is insane and the bestðŸ”¥ðŸ”¥ Best trader out there!",
    "1 year ago Joined last week was a slow week but I'm profitable only following madmoney instructions and I promise you'll make money I've doubled my account in just this week it's a small account but hey small steps count and I believe I'll grow and be profitable with you my mentor you don't just give signals b...",
    "Written 13 days after purchase R ryankiatfb 1 year ago Quality signals are sent to the group! I wish he'd continue to put up more videos of him breaking down the market to really understand how he analyzes the charts and to see how a pro trader like him undertakes the market ! :)",
    "About the creator M View profile MadCharts @ madcharts â€¢ Joined Feb 2024 Affiliates M Become an affiliate MadCharts 30% reward Earn money by bringing customers to MadCharts. Every time a customer purchases using your link, you&#x27;ll earn a commission."
  ],
  "priceTokens": [
    "$69.00",
    "$69.00",
    "$69.00",
    "$1",
    "$1",
    "$1",
    "$22",
    "$1",
    "$1",
    "$1",
    "$1",
    "$1",
    "$2",
    "$1",
    "$2",
    "$2",
    "$2",
    "$2",
    "$3",
    "$3"
  ],
  "faq": [],
  "textSample": "Sign in M The Madness Trading FLoor Trade Live. Learn Fast. Win Big with MadCharts. 4.4 ( 27 ) Trading The Madness Trading Floor is the biggest trading community in the world. Get access today! $69.00 / month Pay Get access Join 478 members Features Real-time market insights with 3-5 live streams per week. Customized trading journal to track and enhance your progress. Exclusive access to weekly educational webinars. In-house tools &amp; indicators generating over 7Figures annually. Join a thriving community of like-minded traders. Reviews 4.44 out of 5 27 total reviews 5 stars 4 stars 3 stars 2 stars 1 star CD Clive Dunton 1 month ago Best guy Written 2 years after purchase G gideongrobbelaargg 1 year ago The amount of information we getting from MadCharts is insane and the bestðŸ”¥ðŸ”¥ Best trader out there! Written 10 days after purchase G gerlinrichards7 1 year ago Joined last week was a slow week but I'm profitable only following madmoney instructions and I promise you'll make money I've doubled my account in just this week it's a small account but hey small steps count and I believe I'll grow and be profitable with you my mentor you don't just give signals b... Show more Written 13 days after purchase R ryankiatfb 1 year ago Quality signals are sent to the group! I wish he'd continue to put up more videos of him breaking down the market to really understand how he analyzes the charts and to see how a pro trader like him undertakes the market ! :) Written 13 days after purchase See all reviews About the creator M View profile MadCharts @ madcharts â€¢ Joined Feb 2024 Affiliates M Become an affiliate MadCharts 30% reward Earn money by bringing customers to MadCharts. Every time a customer purchases using your link, you&#x27;ll earn a commission. The Madness Trading FLoor $69.00 / month +2 options Get access $69.00 / month 2 options Pay Get access Pay Get access The Madness Trading FLoor | Whop",
  "finalUrl": "https://whop.com/madcharts-academy/madcharts/",
  "fetchedAt": "2025-11-05T10:39:09.891Z",
  "textHash": "3a3d3d6c145c492a94664b4af0b14abfe57363aaeee488e0573f9169dc65b1b4",
  "drilled": false
}