{
  "baseUrl": "https://whop.com/majorwagers/?a=alexburnett21",
  "title": "Major Wagers | Whop",
  "h1": "Major Wagers",
  "bullets": [
    "Powered by MW Major Wagers Major Wagers is led by a seasoned sports analyst with over 15 years of betting experience. We specialize in American sports and European soccer. 5.0 ( 8 ) Contact seller Products Unmute $28.99 / week Free trial ðŸš¨ Turn $100 into $1000 - Worldâ€™s Best Sports Picks Major Wagers 5.0 ( 8 ) Contact seller Reviews JL James Lomis 6 months ago The video classes are a wealth of knowledge and major is a nice guy. 100% recommend. Written 26 minutes after purchase",
    "AJ Adam Johnson 6 months ago Heâ€™s been solid for meâ€”definitely worth the subscription. Youâ€™ll learn a bunch and bet like a pro. Written 4 minutes after purchase",
    "JB James Ball 6 months ago Been with Major for about 5 years now. Always appreciate his insight and willingness to help with any questions. Always has consistent plays daily and helps keep on track. Love to see him putting out new content to help with education. Written 8 months after purchase",
    "JR Javier Rubio 6 months ago On my second year with major. This guy really knows his stuff. What works? His long term strategy approach because sports are unpredictable short term but very predictable long term. The only ones not winning are the ones looking for unrealistic short term gratification wins. These people will be br... Show more Written 1 hour after purchase"
  ],
  "paras": [
    "MW Major Wagers Major Wagers is led by a seasoned sports analyst with over 15 years of betting experience. We specialize in American sports and European soccer. 5.0 ( 8 ) Contact seller Products Unmute $28.99 / week Free trial ðŸš¨ Turn $100 into $1000 - Worldâ€™s Best Sports Picks Major Wagers 5.0 ( 8 ) Contact seller Reviews JL James Lomis 6 months ago The video classes are a wealth of knowledge and major is a nice guy. 100% recommend.",
    "6 months ago Heâ€™s been solid for meâ€”definitely worth the subscription. Youâ€™ll learn a bunch and bet like a pro.",
    "6 months ago Been with Major for about 5 years now. Always appreciate his insight and willingness to help with any questions. Always has consistent plays daily and helps keep on track. Love to see him putting out new content to help with education.",
    "6 months ago On my second year with major. This guy really knows his stuff. What works? His long term strategy approach because sports are unpredictable short term but very predictable long term. The only ones not winning are the ones looking for unrealistic short term gratification wins. These people will be br..."
  ],
  "priceTokens": [
    "$28.99",
    "$100",
    "$100",
    "$1",
    "$1",
    "$1",
    "$21",
    "$1",
    "$1",
    "$1",
    "$1",
    "$28",
    "$1",
    "$28",
    "$28",
    "$28",
    "$28",
    "$3",
    "$3",
    "$3"
  ],
  "faq": [],
  "textSample": "Powered by MW Major Wagers Major Wagers is led by a seasoned sports analyst with over 15 years of betting experience. We specialize in American sports and European soccer. 5.0 ( 8 ) Contact seller Products Unmute $28.99 / week Free trial ðŸš¨ Turn $100 into $1000 - Worldâ€™s Best Sports Picks Major Wagers 5.0 ( 8 ) Contact seller Reviews JL James Lomis 6 months ago The video classes are a wealth of knowledge and major is a nice guy. 100% recommend. Written 26 minutes after purchase AJ Adam Johnson 6 months ago Heâ€™s been solid for meâ€”definitely worth the subscription. Youâ€™ll learn a bunch and bet like a pro. Written 4 minutes after purchase JB James Ball 6 months ago Been with Major for about 5 years now. Always appreciate his insight and willingness to help with any questions. Always has consistent plays daily and helps keep on track. Love to see him putting out new content to help with education. Written 8 months after purchase JR Javier Rubio 6 months ago On my second year with major. This guy really knows his stuff. What works? His long term strategy approach because sports are unpredictable short term but very predictable long term. The only ones not winning are the ones looking for unrealistic short term gratification wins. These people will be br... Show more Written 1 hour after purchase See all reviews Major Wagers | Whop",
  "finalUrl": "https://whop.com/majorwagers/?a=alexburnett21",
  "fetchedAt": "2025-11-05T10:48:35.352Z",
  "textHash": "dfce1a4554aaed3b5c0f9b6a629003549613a97104b2b8a3d25446129737eda9",
  "drilled": false
}