{
  "baseUrl": "https://whop.com/zero-cookgroup/?a=alexburnett21",
  "title": "Zero Cookgroup | Whop",
  "h1": "Zero Cookgroup",
  "bullets": [
    "Powered by ZC Zero Cookgroup He creado Zero Cookgroup para ofrecerte las mejores herramientas y soporte en el mundo de los sneakers y coleccionables. Con a√±os de experiencia, mi objetivo es mantenerte siempre un paso adelante en ... More 5.0 ( 24 ) Contact seller Products MX$300.00 / month Consigue lo m√°s exclusivo del mundo de la reventa Membres√≠a Cl√°sica Zero 5.0 ( 17 ) MX$800.00 / 3 months Free trial Accede a nuestra membresia clasica por 3 meses Membresia Clasica Trimestral New MX$1,520.00 / 6 months Acceso exclusivo por 6 meses Membresia Clasica Semestral 5.0 ( 1 ) MX$200.00 / month üéüÔ∏è Zero Tickets: Tu acceso VIP al mundo de los eventos Membresia Boletos New MX$149.00 / month Free trial Zero Geekverse: Monitores y oportunidades para coleccionistas serios Membres√≠a Coleccionables New Contact seller Reviews FR Fernando rodriguez ‚Ä¢ Membres√≠a Cl√°sica Zero 2 months ago El Cook Zero me ayud√≥ a tener un Panorama m√°s amplio en este mundo de los sneakers, tener la mejor info y poder la oportunidad de conseguir la mayor cantidad de pares Written 1 year after purchase",
    "A ArmandoRdz02 ‚Ä¢ Membres√≠a Cl√°sica Zero 2 years ago Lo mejorrr que pude haber encontrado, este gpo me ayudo a crecer mas en el ambito de SNKRS, lo recomiendo 100% Written 1 hour after purchase",
    "W Woody 2 years ago El Cook Zero me ayudo bastante en los lanzamientos mas esperados tanto como informaci√≥n y donde iba a salir el par, hasta si era buena la demanda. Sin duda el mejor Cook. Written 1 month after purchase",
    "EH Edwin de Jesus Salinas Hernandez ‚Ä¢ Membres√≠a Cl√°sica Zero 2 years ago Sin duda el mejor cook de M√©xico, cuentan con los mejores monitores y gente dispuesta a ayudarte siempre, es una gran comunidad, m√°s que un grupo una familiaü´∂üèº Written 1 month after purchase"
  ],
  "paras": [
    "ZC Zero Cookgroup He creado Zero Cookgroup para ofrecerte las mejores herramientas y soporte en el mundo de los sneakers y coleccionables. Con a√±os de experiencia, mi objetivo es mantenerte siempre un paso adelante en ... More 5.0 ( 24 ) Contact seller Products MX$300.00 / month Consigue lo m√°s exclusivo del mundo de la reventa Membres√≠a Cl√°sica Zero 5.0 ( 17 ) MX$800.00 / 3 months Free trial Accede a nuestra membresia clasica por 3 meses Membresia Clasica Trimestral New MX$1,520.00 / 6 months Acceso exclusivo por 6 meses Membresia Clasica Semestral 5.0 ( 1 ) MX$200.00 / month üéüÔ∏è Zero Tickets: Tu acceso VIP al mundo de los eventos Membresia Boletos New MX$149.00 / month Free trial Zero Geekverse: Monitores y oportunidades para coleccionistas serios Membres√≠a Coleccionables New Contact seller Reviews FR Fernando rodriguez ‚Ä¢ Membres√≠a Cl√°sica Zero 2 months ago El Cook Zero me ayud√≥ a tener un Panorama m√°s amplio en este mundo de los sneakers, tener la mejor info y poder la oportunidad de conseguir la mayor cantidad de pares",
    "2 years ago Lo mejorrr que pude haber encontrado, este gpo me ayudo a crecer mas en el ambito de SNKRS, lo recomiendo 100%",
    "2 years ago El Cook Zero me ayudo bastante en los lanzamientos mas esperados tanto como informaci√≥n y donde iba a salir el par, hasta si era buena la demanda. Sin duda el mejor Cook.",
    "2 years ago Sin duda el mejor cook de M√©xico, cuentan con los mejores monitores y gente dispuesta a ayudarte siempre, es una gran comunidad, m√°s que un grupo una familiaü´∂üèº"
  ],
  "priceTokens": [
    "$300.00",
    "$800.00",
    "$1,520.00",
    "$200.00",
    "$149.00",
    "$1",
    "$1",
    "$1",
    "$21",
    "$1",
    "$1",
    "$1",
    "$1",
    "$28",
    "$1",
    "$28",
    "$28",
    "$28",
    "$28",
    "$3"
  ],
  "faq": [],
  "textSample": "Powered by ZC Zero Cookgroup He creado Zero Cookgroup para ofrecerte las mejores herramientas y soporte en el mundo de los sneakers y coleccionables. Con a√±os de experiencia, mi objetivo es mantenerte siempre un paso adelante en ... More 5.0 ( 24 ) Contact seller Products MX$300.00 / month Consigue lo m√°s exclusivo del mundo de la reventa Membres√≠a Cl√°sica Zero 5.0 ( 17 ) MX$800.00 / 3 months Free trial Accede a nuestra membresia clasica por 3 meses Membresia Clasica Trimestral New MX$1,520.00 / 6 months Acceso exclusivo por 6 meses Membresia Clasica Semestral 5.0 ( 1 ) MX$200.00 / month üéüÔ∏è Zero Tickets: Tu acceso VIP al mundo de los eventos Membresia Boletos New MX$149.00 / month Free trial Zero Geekverse: Monitores y oportunidades para coleccionistas serios Membres√≠a Coleccionables New Contact seller Reviews FR Fernando rodriguez ‚Ä¢ Membres√≠a Cl√°sica Zero 2 months ago El Cook Zero me ayud√≥ a tener un Panorama m√°s amplio en este mundo de los sneakers, tener la mejor info y poder la oportunidad de conseguir la mayor cantidad de pares Written 1 year after purchase A ArmandoRdz02 ‚Ä¢ Membres√≠a Cl√°sica Zero 2 years ago Lo mejorrr que pude haber encontrado, este gpo me ayudo a crecer mas en el ambito de SNKRS, lo recomiendo 100% Written 1 hour after purchase W Woody 2 years ago El Cook Zero me ayudo bastante en los lanzamientos mas esperados tanto como informaci√≥n y donde iba a salir el par, hasta si era buena la demanda. Sin duda el mejor Cook. Written 1 month after purchase EH Edwin de Jesus Salinas Hernandez ‚Ä¢ Membres√≠a Cl√°sica Zero 2 years ago Sin duda el mejor cook de M√©xico, cuentan con los mejores monitores y gente dispuesta a ayudarte siempre, es una gran comunidad, m√°s que un grupo una familiaü´∂üèº Written 1 month after purchase See all reviews Zero Cookgroup | Whop",
  "finalUrl": "https://whop.com/zero-cookgroup/?a=alexburnett21",
  "fetchedAt": "2025-11-05T09:55:23.675Z",
  "textHash": "aaf96d8c3926bc186b65a1d212ea55480c0c48d8e466090161b3d649ef33075c",
  "drilled": false
}