{
  "baseUrl": "https://whop.com/zero-cookgroup/membresia-boletos-00/",
  "title": "Membresia Boletos | Whop",
  "h1": "Membresia Boletos",
  "bullets": [
    "Sign in ZC Membresia Boletos ğŸŸï¸ Zero Tickets: Tu acceso VIP al mundo de los eventos 5.0 ( 24 ) Reselling OlvÃ­date de llegar tarde y quedarte sin boletos. Con Zero Tickets, tendrÃ¡s acceso a monitores en tiempo real de los conciertos, festivales y eventos mÃ¡s esperados. Mientras la gente comÃºn batalla contra filas virtuales y pÃ¡ginas saturadas, tÃº recibes alertas instantÃ¡neas que te ponen varios pasos adelante. Con Zero Tickets, no solo vas a los conciertos, vas con ventaja. ğŸš€ğŸ¶ MX$200.00 / month Pay Join Features Monitores 24/7 de boletos para conciertos, festivales y shows exclusivos.",
    "Notificaciones inmediatas de preventas, restocks y drops sorpresa.",
    "MÃ¡s oportunidades de asegurar tus boletos antes de que se agoten",
    "Acceso a una comunidad que comparte tips y estrategias para comprar con Ã©xito",
    "Ahorro de tiempo y cero frustraciones al evitar filas infinitas.",
    "FR Fernando rodriguez 2 months ago El Cook Zero me ayudÃ³ a tener un Panorama mÃ¡s amplio en este mundo de los sneakers, tener la mejor info y poder la oportunidad de conseguir la mayor cantidad de pares Written 1 year after purchase",
    "A ArmandoRdz02 2 years ago Lo mejorrr que pude haber encontrado, este gpo me ayudo a crecer mas en el ambito de SNKRS, lo recomiendo 100% Written 1 hour after purchase",
    "W Woody 2 years ago El Cook Zero me ayudo bastante en los lanzamientos mas esperados tanto como informaciÃ³n y donde iba a salir el par, hasta si era buena la demanda. Sin duda el mejor Cook. Written 1 month after purchase",
    "EH Edwin de Jesus Salinas Hernandez 2 years ago Sin duda el mejor cook de MÃ©xico, cuentan con los mejores monitores y gente dispuesta a ayudarte siempre, es una gran comunidad, mÃ¡s que un grupo una familiağŸ«¶ğŸ¼ Written 1 month after purchase"
  ],
  "paras": [
    "Sign in ZC Membresia Boletos ğŸŸï¸ Zero Tickets: Tu acceso VIP al mundo de los eventos 5.0 ( 24 ) Reselling OlvÃ­date de llegar tarde y quedarte sin boletos. Con Zero Tickets, tendrÃ¡s acceso a monitores en tiempo real de los conciertos, festivales y eventos mÃ¡s esperados. Mientras la gente comÃºn batalla contra filas virtuales y pÃ¡ginas saturadas, tÃº recibes alertas instantÃ¡neas que te ponen varios pasos adelante.",
    "Con Zero Tickets, no solo vas a los conciertos, vas con ventaja. ğŸš€ğŸ¶",
    "Monitores 24/7 de boletos para conciertos, festivales y shows exclusivos. Notificaciones inmediatas de preventas, restocks y drops sorpresa. MÃ¡s oportunidades de asegurar tus boletos antes de que se agoten Acceso a una comunidad que comparte tips y estrategias para comprar con Ã©xito Ahorro de tiempo y cero frustraciones al evitar filas infinitas. Reviews 5 out of 5 24 total reviews 5 stars 4 stars 3 stars 2 stars 1 star FR Fernando rodriguez 2 months ago El Cook Zero me ayudÃ³ a tener un Panorama mÃ¡s amplio en este mundo de los sneakers, tener la mejor info y poder la oportunidad de conseguir la mayor cantidad de pares",
    "2 years ago Lo mejorrr que pude haber encontrado, este gpo me ayudo a crecer mas en el ambito de SNKRS, lo recomiendo 100%",
    "2 years ago El Cook Zero me ayudo bastante en los lanzamientos mas esperados tanto como informaciÃ³n y donde iba a salir el par, hasta si era buena la demanda. Sin duda el mejor Cook.",
    "2 years ago Sin duda el mejor cook de MÃ©xico, cuentan con los mejores monitores y gente dispuesta a ayudarte siempre, es una gran comunidad, mÃ¡s que un grupo una familiağŸ«¶ğŸ¼",
    "About the creator Z View profile ZeroCG @ parallelcontentment5140 â€¢ Joined Mar 2023 He creado Zero Cookgroup para ofrecerte las mejores herramientas y soporte en el mundo de los sneakers y coleccionables. Con aÃ±os de experiencia, mi objetivo es mantenerte siempre un paso adelante en este emocionante mercado. FAQs Â¿Que es un Cookgroup? Soy nuevo en esto, Â¿Ustedes me ayudaran a usarlo? Â¿En que pais tienen soporte? Â¿Que es un cookgroup? Â¿Es seguro y garantizado ganar un par con ustedes? Affiliates ZC Become an affiliate Zero Cookgroup 10% reward Earn money by bringing customers to Zero Cookgroup. Every time a customer purchases using your link, you&#x27;ll earn a commission."
  ],
  "priceTokens": [
    "$200.00",
    "$200.00",
    "$200.00",
    "$1",
    "$1",
    "$1",
    "$22",
    "$1",
    "$1",
    "$1",
    "$1",
    "$1",
    "$2",
    "$1",
    "$2",
    "$2",
    "$2",
    "$2",
    "$3",
    "$3"
  ],
  "faq": [],
  "textSample": "Sign in ZC Membresia Boletos ğŸŸï¸ Zero Tickets: Tu acceso VIP al mundo de los eventos 5.0 ( 24 ) Reselling OlvÃ­date de llegar tarde y quedarte sin boletos. Con Zero Tickets, tendrÃ¡s acceso a monitores en tiempo real de los conciertos, festivales y eventos mÃ¡s esperados. Mientras la gente comÃºn batalla contra filas virtuales y pÃ¡ginas saturadas, tÃº recibes alertas instantÃ¡neas que te ponen varios pasos adelante. Con Zero Tickets, no solo vas a los conciertos, vas con ventaja. ğŸš€ğŸ¶ MX$200.00 / month Pay Join Features Monitores 24/7 de boletos para conciertos, festivales y shows exclusivos. Notificaciones inmediatas de preventas, restocks y drops sorpresa. MÃ¡s oportunidades de asegurar tus boletos antes de que se agoten Acceso a una comunidad que comparte tips y estrategias para comprar con Ã©xito Ahorro de tiempo y cero frustraciones al evitar filas infinitas. Reviews 5 out of 5 24 total reviews 5 stars 4 stars 3 stars 2 stars 1 star FR Fernando rodriguez 2 months ago El Cook Zero me ayudÃ³ a tener un Panorama mÃ¡s amplio en este mundo de los sneakers, tener la mejor info y poder la oportunidad de conseguir la mayor cantidad de pares Written 1 year after purchase A ArmandoRdz02 2 years ago Lo mejorrr que pude haber encontrado, este gpo me ayudo a crecer mas en el ambito de SNKRS, lo recomiendo 100% Written 1 hour after purchase W Woody 2 years ago El Cook Zero me ayudo bastante en los lanzamientos mas esperados tanto como informaciÃ³n y donde iba a salir el par, hasta si era buena la demanda. Sin duda el mejor Cook. Written 1 month after purchase EH Edwin de Jesus Salinas Hernandez 2 years ago Sin duda el mejor cook de MÃ©xico, cuentan con los mejores monitores y gente dispuesta a ayudarte siempre, es una gran comunidad, mÃ¡s que un grupo una familiağŸ«¶ğŸ¼ Written 1 month after purchase See all reviews About the creator Z View profile ZeroCG @ parallelcontentment5140 â€¢ Joined Mar 2023 He creado Zero Cookgroup para ofrecerte las mejores herramientas y soporte en el mundo de los sneakers y coleccionables. Con aÃ±os de experiencia, mi objetivo es mantenerte siempre un paso adelante en este emocionante mercado. FAQs Â¿Que es un Cookgroup? Soy nuevo en esto, Â¿Ustedes me ayudaran a usarlo? Â¿En que pais tienen soporte? Â¿Que es un cookgroup? Â¿Es seguro y garantizado ganar un par con ustedes? Affiliates ZC Become an affiliate Zero Cookgroup 10% reward Earn money by bringing customers to Zero Cookgroup. Every time a customer purchases using your link, you&#x27;ll earn a commission. Membresia Boletos MX$200.00 / month Join MX$200.00 / month Pay Join Pay Join Membresia Boletos | Whop",
  "finalUrl": "https://whop.com/zero-cookgroup/membresia-boletos-00/",
  "fetchedAt": "2025-11-05T10:10:26.371Z",
  "textHash": "381213504cb1d3e84ee68ed2419db5fbdb28cf6920da6b04e895fab4a0d87134",
  "drilled": false
}