{
  "baseUrl": "https://whop.com/mikkjo-trading/mikkjo-trading/?a=alexburnett21",
  "title": "Mikkjo Trading VIP | Whop",
  "h1": "Mikkjo Trading VIP",
  "bullets": [
    "Sign in MT Mikkjo Trading VIP Mikkjo Trading VIP - Get Access 5.0 ( 1 ) Trading The Official SDL Trading Community Join my Community for FREE the next 7 days ğŸ’»| Courses And Education ğŸ™‹ğŸ»â€â™‚ï¸| 24/7 Support ğŸ“ˆ | Signals ğŸ”´ | Live streams and market recaps $99.00 / month 7 day trial Pay Get access Join 25 members Features Accsess to my full course on SDL",
    "Accsess to the Mikkjo Trading community",
    "Accsess to my signals",
    "Accsess to my support and mentorship",
    "S Sallar 5 days ago Written 1 month after purchase"
  ],
  "paras": [
    "Sign in MT Mikkjo Trading VIP Mikkjo Trading VIP - Get Access 5.0 ( 1 ) Trading The Official SDL Trading Community",
    "Join my Community for FREE the next 7 days",
    "ğŸ’»| Courses And Education ğŸ™‹ğŸ»â€â™‚ï¸| 24/7 Support ğŸ“ˆ | Signals ğŸ”´ | Live streams and market recaps",
    "$99.00 / month 7 day trial Pay Get access Join 25 members Features Accsess to my full course on SDL Accsess to the Mikkjo Trading community Accsess to my signals Accsess to my support and mentorship Reviews 5 out of 5 1 review 5 stars 4 stars 3 stars 2 stars 1 star S Sallar 5 days ago",
    "Affiliates MT Become an affiliate Mikkjo Trading 30% reward Earn money by bringing customers to Mikkjo Trading. Every time a customer purchases using your link, you&#x27;ll earn a commission."
  ],
  "priceTokens": [
    "$99.00",
    "$99.00",
    "$99.00",
    "$1",
    "$1",
    "$1",
    "$23",
    "$1",
    "$1",
    "$1",
    "$1",
    "$1",
    "$2",
    "$1",
    "$2",
    "$2",
    "$2",
    "$2",
    "$3",
    "$3"
  ],
  "faq": [],
  "textSample": "Sign in MT Mikkjo Trading VIP Mikkjo Trading VIP - Get Access 5.0 ( 1 ) Trading The Official SDL Trading Community Join my Community for FREE the next 7 days ğŸ’»| Courses And Education ğŸ™‹ğŸ»â€â™‚ï¸| 24/7 Support ğŸ“ˆ | Signals ğŸ”´ | Live streams and market recaps $99.00 / month 7 day trial Pay Get access Join 25 members Features Accsess to my full course on SDL Accsess to the Mikkjo Trading community Accsess to my signals Accsess to my support and mentorship Reviews 5 out of 5 1 review 5 stars 4 stars 3 stars 2 stars 1 star S Sallar 5 days ago Written 1 month after purchase About the creator M View profile Mikkjo @ mikkjo â€¢ Joined Jul 2024 Affiliates MT Become an affiliate Mikkjo Trading 30% reward Earn money by bringing customers to Mikkjo Trading. Every time a customer purchases using your link, you&#x27;ll earn a commission. Mikkjo Trading VIP $99.00 / month +1 option Get access $99.00 / month 1 option Pay Get access Pay Get access Mikkjo Trading VIP | Whop",
  "finalUrl": "https://whop.com/mikkjo-trading/mikkjo-trading/?a=alexburnett21",
  "fetchedAt": "2025-11-05T10:34:23.418Z",
  "textHash": "67fbdfd09f502237831e0ffd7e49b23f129fa611b522e5118f8bcdd41c70cdc5",
  "drilled": true
}