{
  "baseUrl": "https://whop.com/miles-high-club/miles-high-club-1/",
  "title": "Miles High Club Crypto Pay | Whop",
  "h1": "Miles High Club Crypto Pay",
  "bullets": [
    "Sign in MC Miles High Club Crypto Pay The #1 Crypto Community 4.9 ( 195 ) Trading ACTUALLY make money this cycle: Premium Crypto Alpha, Charts, Signals From Miles &amp; His Team Of Expert Analysts alongside HOURS of exclusive educational content $1,850.00 for 1 year Pay Join Features Exclusive altcoin alpha, airdrop alerts &amp; trade ideas",
    "Private weekly livestreams with Miles, Paradise, Fabian, Doc &amp; Morin",
    "100+ hours of educational content &amp; trading streams",
    "Full Discord access",
    "All crypto sales are final",
    "C CKw00t 1 month ago just started and already got at least $100 worth in the first 5 days.. incredible community with sooo many ways to attack the market, it can almost be overwhelming. There is literally something for everyone in here, and everyone including succesfull traders could use this program to get better. AMAZ... Show more Written 5 days after purchase",
    "J JayQuant 1 month ago A wide spectrum of alpha and level heads providing the alpha in a space that can feel very chaotic at times. Highly recommend. Written 6 months after purchase",
    "P Patch 1 month ago Don't know where I'd be in this space without coming across Paradise & Morin. Good place to learn for anyone wanting to take trading more seriously. Written 1 year after purchase",
    "H henry 1 month ago excellent discord! i would say the best ive been in. Nice vibe too. a good combo of education and signals. perhaps slightly too much info to absorb/ some channel consolidation would be helpful. thanks Miles and team!! Written 9 days after purchase"
  ],
  "paras": [
    "Sign in MC Miles High Club Crypto Pay The #1 Crypto Community 4.9 ( 195 ) Trading ACTUALLY make money this cycle: Premium Crypto Alpha, Charts, Signals From Miles &amp; His Team Of Expert Analysts alongside HOURS of exclusive educational content",
    "Exclusive altcoin alpha, airdrop alerts &amp; trade ideas Private weekly livestreams with Miles, Paradise, Fabian, Doc &amp; Morin 100+ hours of educational content &amp; trading streams Full Discord access All crypto sales are final Reviews 4.87 out of 5 195 total reviews 5 stars 4 stars 3 stars 2 stars 1 star C CKw00t 1 month ago just started and already got at least $100 worth in the first 5 days.. incredible community with sooo many ways to attack the market, it can almost be overwhelming. There is literally something for everyone in here, and everyone including succesfull traders could use this program to get better. AMAZ...",
    "Written 5 days after purchase J JayQuant 1 month ago A wide spectrum of alpha and level heads providing the alpha in a space that can feel very chaotic at times. Highly recommend.",
    "1 month ago Don't know where I'd be in this space without coming across Paradise & Morin. Good place to learn for anyone wanting to take trading more seriously.",
    "1 month ago excellent discord! i would say the best ive been in. Nice vibe too. a good combo of education and signals. perhaps slightly too much info to absorb/ some channel consolidation would be helpful. thanks Miles and team!!",
    "About the creator M View profile milesdeutscher @ milesdeutscher • Joined Mar 2024 My name is Miles Deutscher and I&#x27;m a crypto analyst and investor. I&#x27;ve been investing in crypto for over 5 years and have a deep passion for crypto, DeFi and personal finance that I&#x27;d love to share with you. FAQs What is your refund policy? Is the Miles High Club suitable for beginner crypto enthusiasts? Affiliates MC Become an affiliate Miles High Club 30% reward Earn money by bringing customers to Miles High Club. Every time a customer purchases using your link, you&#x27;ll earn a commission."
  ],
  "priceTokens": [
    "$1,850.00",
    "$100",
    "$1,850.00",
    "$1,850.00",
    "$1",
    "$1",
    "$1",
    "$22",
    "$1",
    "$1",
    "$1",
    "$1",
    "$1",
    "$2",
    "$1",
    "$2",
    "$2",
    "$2",
    "$2",
    "$3"
  ],
  "faq": [],
  "textSample": "Sign in MC Miles High Club Crypto Pay The #1 Crypto Community 4.9 ( 195 ) Trading ACTUALLY make money this cycle: Premium Crypto Alpha, Charts, Signals From Miles &amp; His Team Of Expert Analysts alongside HOURS of exclusive educational content $1,850.00 for 1 year Pay Join Features Exclusive altcoin alpha, airdrop alerts &amp; trade ideas Private weekly livestreams with Miles, Paradise, Fabian, Doc &amp; Morin 100+ hours of educational content &amp; trading streams Full Discord access All crypto sales are final Reviews 4.87 out of 5 195 total reviews 5 stars 4 stars 3 stars 2 stars 1 star C CKw00t 1 month ago just started and already got at least $100 worth in the first 5 days.. incredible community with sooo many ways to attack the market, it can almost be overwhelming. There is literally something for everyone in here, and everyone including succesfull traders could use this program to get better. AMAZ... Show more Written 5 days after purchase J JayQuant 1 month ago A wide spectrum of alpha and level heads providing the alpha in a space that can feel very chaotic at times. Highly recommend. Written 6 months after purchase P Patch 1 month ago Don't know where I'd be in this space without coming across Paradise & Morin. Good place to learn for anyone wanting to take trading more seriously. Written 1 year after purchase H henry 1 month ago excellent discord! i would say the best ive been in. Nice vibe too. a good combo of education and signals. perhaps slightly too much info to absorb/ some channel consolidation would be helpful. thanks Miles and team!! Written 9 days after purchase See all reviews About the creator M View profile milesdeutscher @ milesdeutscher • Joined Mar 2024 My name is Miles Deutscher and I&#x27;m a crypto analyst and investor. I&#x27;ve been investing in crypto for over 5 years and have a deep passion for crypto, DeFi and personal finance that I&#x27;d love to share with you. FAQs What is your refund policy? Is the Miles High Club suitable for beginner crypto enthusiasts? Affiliates MC Become an affiliate Miles High Club 30% reward Earn money by bringing customers to Miles High Club. Every time a customer purchases using your link, you&#x27;ll earn a commission. Miles High Club Crypto Pay $1,850.00 for 1 year Join $1,850.00 for 1 year Join Miles High Club Crypto Pay | Whop",
  "finalUrl": "https://whop.com/miles-high-club/miles-high-club-1/",
  "fetchedAt": "2025-11-04T21:42:01.458Z",
  "textHash": "300e94d57ed663b0c99aa7ef2fe92053839a414d5ba6b025de8c735344e1be35",
  "drilled": false
}