{
  "baseUrl": "https://whop.com/militia-mentor/militia-mentor/?a=alexburnett21",
  "title": "Militia Mentor | Whop",
  "h1": "Militia Mentor",
  "bullets": [
    "Sign in MM Militia Mentor CEO Life, Business &amp; Mindset Coaching Program 5.0 ( 1 ) Marketing agency Elite Life, Business &amp; Mindset This program is designed to address the challenges holding you back and unlock your full potential and to BUILD the life YOU always wanted $1,500.00 / month + $2,500.00 initial fee Pay Join Join 5 members Features Access To The Militia Mindset Blueprints (FIles)",
    "Access To Chat W/ Michael Melicia",
    "Access to Industry Leaders",
    "Access To Health and Wellness Plans",
    "1-1 and Group Coaching Calls",
    "CB Charles Black 9 months ago Michael is a great mentor he has a answer to everyone of my questions hears me out like no other and always gives me a creative strategy to my game plan to move up and rise in this life of a entrepreneur Written 5 days after purchase"
  ],
  "paras": [
    "Sign in MM Militia Mentor CEO Life, Business &amp; Mindset Coaching Program 5.0 ( 1 ) Marketing agency Elite Life, Business &amp; Mindset",
    "This program is designed to address the challenges holding you back and unlock your full potential and to BUILD the life YOU always wanted",
    "$1,500.00 / month + $2,500.00 initial fee Pay Join Join 5 members Features Access To The Militia Mindset Blueprints (FIles) Access To Chat W/ Michael Melicia Access to Industry Leaders Access To Health and Wellness Plans 1-1 and Group Coaching Calls Reviews 5 out of 5 1 review 5 stars 4 stars 3 stars 2 stars 1 star CB Charles Black 9 months ago Michael is a great mentor he has a answer to everyone of my questions hears me out like no other and always gives me a creative strategy to my game plan to move up and rise in this life of a entrepreneur",
    "Affiliates MM Become an affiliate Militia Mentor 30% reward Earn money by bringing customers to Militia Mentor . Every time a customer purchases using your link, you&#x27;ll earn a commission."
  ],
  "priceTokens": [
    "$1,500.00",
    "$2,500.00",
    "$1,500.00",
    "$1,500.00",
    "$1",
    "$1",
    "$1",
    "$23",
    "$1",
    "$1",
    "$1",
    "$1",
    "$1",
    "$2",
    "$1",
    "$2",
    "$2",
    "$2",
    "$2",
    "$3"
  ],
  "faq": [],
  "textSample": "Sign in MM Militia Mentor CEO Life, Business &amp; Mindset Coaching Program 5.0 ( 1 ) Marketing agency Elite Life, Business &amp; Mindset This program is designed to address the challenges holding you back and unlock your full potential and to BUILD the life YOU always wanted $1,500.00 / month + $2,500.00 initial fee Pay Join Join 5 members Features Access To The Militia Mindset Blueprints (FIles) Access To Chat W/ Michael Melicia Access to Industry Leaders Access To Health and Wellness Plans 1-1 and Group Coaching Calls Reviews 5 out of 5 1 review 5 stars 4 stars 3 stars 2 stars 1 star CB Charles Black 9 months ago Michael is a great mentor he has a answer to everyone of my questions hears me out like no other and always gives me a creative strategy to my game plan to move up and rise in this life of a entrepreneur Written 5 days after purchase About the creator MM View profile Michael Melicia @ mikemelicia â€¢ Joined Jan 2025 Michael A. Melicia, shaped by a rough childhood that instilled resilience and determination, has risen as a visionary entrepreneur. As the owner of Coastal Paving, ranked #241 on the INC 5000, and founder of Militia Co. Clothing, he channels his grit into building impactful ventures. Leading CPEX, he merges innovation with hard-earned discipline, embodying strength, growth, and relentless pursuit Affiliates MM Become an affiliate Militia Mentor 30% reward Earn money by bringing customers to Militia Mentor . Every time a customer purchases using your link, you&#x27;ll earn a commission. Militia Mentor $1,500.00 / month +2 options Join $1,500.00 / month 2 options Pay Join Pay Join Militia Mentor | Whop",
  "finalUrl": "https://whop.com/militia-mentor/militia-mentor/?a=alexburnett21",
  "fetchedAt": "2025-11-05T10:00:45.253Z",
  "textHash": "85f40aa6153fcf5739ec29286d1c2bff587c7df6c7bdbbf7fa3a29128e6b11ef",
  "drilled": true
}