{
  "baseUrl": "https://whop.com/standard-access-b0/trade-signals-private-chatroom/",
  "title": "Millionaires MetaForum Live | Whop",
  "h1": "Millionaires MetaForum Live",
  "bullets": [
    "Sign in Unmute Unmute Unmute Unmute MM Millionaires MetaForum Live Get Access Of Up To $3500 In Value for just $99 / Month 5.0 ( 5 ) Other Join our exclusive community to trade live every morning, learn market strategies, and receive weekly mentoring. Be the 1% in trading. $125.00 / month Pay Get access Features Access to weekly live classes and market updates",
    "Full access to our Discord community and educational tabs",
    "Receive frequent trade alerts and pre-market plans",
    "Participate in live trading sessions every day",
    "24/7 support and real-time market analysis",
    "MN Maximus Neamt 1 year ago I want to extend my deepest gratitude to Vaylees for his mentorship—it has been an invaluable investment in my journey. When I started, I knew absolutely nothing about trading, but through his guidance, I’ve grown tremendously in both knowledge and confidence. His teaching methods make complex ideas... Show more Written 1 month after purchase",
    "O Oscar 1 year ago Vayless has been an incredible mentor, guiding me towards a better understanding of patience, risk management, and confidence. His enthusiasm is contagious, and his positive feedback truly motivates those who follow him. He's a valuable resource for anyone looking to improve their skills and achieve... Show more Written 17 days after purchase",
    "RU Randon User 1 year ago This chat consistently demonstrates its excellence. This group has been truly life-changing! The calls are incredibly insightful, and the daily lessons reflects a mentor that genuinely cares about your learning and growth. I feel incredibly fortunate to have found this group! Special thanks to Vayle... Show more Written 10 days after purchase",
    "MS Mohanjit Singh 2 years ago Great mentor in the game and one of the real one out there in the trading community. Written 9 days after purchase"
  ],
  "paras": [
    "Sign in Unmute Unmute Unmute Unmute MM Millionaires MetaForum Live Get Access Of Up To $3500 In Value for just $99 / Month 5.0 ( 5 ) Other Join our exclusive community to trade live every morning, learn market strategies, and receive weekly mentoring. Be the 1% in trading.",
    "Access to weekly live classes and market updates Full access to our Discord community and educational tabs Receive frequent trade alerts and pre-market plans Participate in live trading sessions every day 24/7 support and real-time market analysis Reviews 5 out of 5 5 total reviews 5 stars 4 stars 3 stars 2 stars 1 star MN Maximus Neamt 1 year ago I want to extend my deepest gratitude to Vaylees for his mentorship—it has been an invaluable investment in my journey. When I started, I knew absolutely nothing about trading, but through his guidance, I’ve grown tremendously in both knowledge and confidence. His teaching methods make complex ideas...",
    "Written 1 month after purchase O Oscar 1 year ago Vayless has been an incredible mentor, guiding me towards a better understanding of patience, risk management, and confidence. His enthusiasm is contagious, and his positive feedback truly motivates those who follow him. He's a valuable resource for anyone looking to improve their skills and achieve...",
    "Written 17 days after purchase RU Randon User 1 year ago This chat consistently demonstrates its excellence. This group has been truly life-changing! The calls are incredibly insightful, and the daily lessons reflects a mentor that genuinely cares about your learning and growth. I feel incredibly fortunate to have found this group! Special thanks to Vayle...",
    "Written 10 days after purchase MS Mohanjit Singh 2 years ago Great mentor in the game and one of the real one out there in the trading community.",
    "About the creator V View profile vayless @ vayless • Joined Jan 2024 I&#x27;ve dedicated my life to mastering the art of trading. From understanding market psychology to executing real-time trades, I aim to empower others to achieve financial independence through strategic trading insights. FAQs What&#x27;s your refund policy? How can I access the live trading sessions? Affiliates MM Become an affiliate Millionaires MetaForum 30% reward Earn money by bringing customers to Millionaires MetaForum. Every time a customer purchases using your link, you&#x27;ll earn a commission."
  ],
  "priceTokens": [
    "$350",
    "$99",
    "$125.00",
    "$125.00",
    "$125.00",
    "$1",
    "$1",
    "$1",
    "$23",
    "$1",
    "$1",
    "$1",
    "$1",
    "$1",
    "$2",
    "$1",
    "$2",
    "$2",
    "$2",
    "$2"
  ],
  "faq": [],
  "textSample": "Sign in Unmute Unmute Unmute Unmute MM Millionaires MetaForum Live Get Access Of Up To $3500 In Value for just $99 / Month 5.0 ( 5 ) Other Join our exclusive community to trade live every morning, learn market strategies, and receive weekly mentoring. Be the 1% in trading. $125.00 / month Pay Get access Features Access to weekly live classes and market updates Full access to our Discord community and educational tabs Receive frequent trade alerts and pre-market plans Participate in live trading sessions every day 24/7 support and real-time market analysis Reviews 5 out of 5 5 total reviews 5 stars 4 stars 3 stars 2 stars 1 star MN Maximus Neamt 1 year ago I want to extend my deepest gratitude to Vaylees for his mentorship—it has been an invaluable investment in my journey. When I started, I knew absolutely nothing about trading, but through his guidance, I’ve grown tremendously in both knowledge and confidence. His teaching methods make complex ideas... Show more Written 1 month after purchase O Oscar 1 year ago Vayless has been an incredible mentor, guiding me towards a better understanding of patience, risk management, and confidence. His enthusiasm is contagious, and his positive feedback truly motivates those who follow him. He's a valuable resource for anyone looking to improve their skills and achieve... Show more Written 17 days after purchase RU Randon User 1 year ago This chat consistently demonstrates its excellence. This group has been truly life-changing! The calls are incredibly insightful, and the daily lessons reflects a mentor that genuinely cares about your learning and growth. I feel incredibly fortunate to have found this group! Special thanks to Vayle... Show more Written 10 days after purchase MS Mohanjit Singh 2 years ago Great mentor in the game and one of the real one out there in the trading community. Written 9 days after purchase See all reviews About the creator V View profile vayless @ vayless • Joined Jan 2024 I&#x27;ve dedicated my life to mastering the art of trading. From understanding market psychology to executing real-time trades, I aim to empower others to achieve financial independence through strategic trading insights. FAQs What&#x27;s your refund policy? How can I access the live trading sessions? Affiliates MM Become an affiliate Millionaires MetaForum 30% reward Earn money by bringing customers to Millionaires MetaForum. Every time a customer purchases using your link, you&#x27;ll earn a commission. Millionaires MetaForum Live $125.00 / month Get access $125.00 / month Pay Get access Pay Get access Millionaires MetaForum Live | Whop",
  "finalUrl": "https://whop.com/standard-access-b0/trade-signals-private-chatroom/",
  "fetchedAt": "2025-11-05T09:33:37.184Z",
  "textHash": "9be945815dd39c518774f770cfbd8510878802c787324bc8e1f8354360057f1d",
  "drilled": false
}