{
  "baseUrl": "https://whop.com/minteddao/?a=alexburnett21",
  "title": "Minted | Whop",
  "h1": "Minted",
  "bullets": [
    "Powered by M Minted MintedDAO is a cross chain Alpha Group focusing on Solana &amp; Ethereum. We have an expert team on both the Solana/Ethereum blockchain as well as upcoming emerging blockchains (Canto, NEAR and Aptos) and... More 4.8 ( 51 ) Contact seller Products $160.00 Join a top-tier crypto and NFT group MintedDAO Monthly (Crypto Pay) 4.6 ( 18 ) $1,700.00 Join MintedDAO for Alpha Crypto Insights Minted Yearly Access (Crypto) 5.0 ( 2 ) $150.00 / month Learn NFTs &amp; Crypto Trading! üöÄ Hop in the trenches! Minted Monthly Access 5.0 ( 1 ) $50.00 / week Join Minted for 1 Week! ‚≠ê Learn NFTS / CRYPTO + MORE Minted Weekly Access (Crypto) New Free Stay Informed on Crypto Trends with Minted HQ Minted HQ 4.5 ( 2 ) Contact seller Reviews E ETHachi ‚Ä¢ Minted Yearly Access (Crypto) 10 months ago Best group to be a part of. ROI is over 1000% already. Covers everything from NFT's, Crypto, Memecoins etc... Cover most chains as well. Always will renew yearly. Ali and the team are GOAT's Written 8 months after purchase",
    "M Minion ‚Ä¢ Minted HQ 10 months ago I cannot begin to explain how much joining Minted has helped me; learn, make money, and learn how to make money. Top notch community for real and I‚Äôm grateful to be a part of it. What‚Äôs wild to me, is what‚Äôs delivered is more than what‚Äôs promised for the membership, and I am frankly excited to see h... Show more Written 1 month after purchase",
    "C Cez ‚Ä¢ MintedDAO Monthly (Crypto Pay) 2 years ago Top notch Written 4 months after purchase",
    "C Cheysser ‚Ä¢ MintedDAO Monthly (Crypto Pay) 2 years ago I've been in many alpha groups since 2021 but MintedDao just cooks differently. I started January and now it's my third month. Only regret was not joining last year. I've had more wins these past few months than the whole 2023 combined. We always ready to cook! Written 2 months after purchase"
  ],
  "paras": [
    "M Minted MintedDAO is a cross chain Alpha Group focusing on Solana &amp; Ethereum. We have an expert team on both the Solana/Ethereum blockchain as well as upcoming emerging blockchains (Canto, NEAR and Aptos) and... More 4.8 ( 51 ) Contact seller Products $160.00 Join a top-tier crypto and NFT group MintedDAO Monthly (Crypto Pay) 4.6 ( 18 ) $1,700.00 Join MintedDAO for Alpha Crypto Insights Minted Yearly Access (Crypto) 5.0 ( 2 ) $150.00 / month Learn NFTs &amp; Crypto Trading! üöÄ Hop in the trenches! Minted Monthly Access 5.0 ( 1 ) $50.00 / week Join Minted for 1 Week! ‚≠ê Learn NFTS / CRYPTO + MORE Minted Weekly Access (Crypto) New Free Stay Informed on Crypto Trends with Minted HQ Minted HQ 4.5 ( 2 ) Contact seller Reviews E ETHachi ‚Ä¢ Minted Yearly Access (Crypto) 10 months ago Best group to be a part of. ROI is over 1000% already. Covers everything from NFT's, Crypto, Memecoins etc... Cover most chains as well. Always will renew yearly. Ali and the team are GOAT's",
    "10 months ago I cannot begin to explain how much joining Minted has helped me; learn, make money, and learn how to make money. Top notch community for real and I‚Äôm grateful to be a part of it. What‚Äôs wild to me, is what‚Äôs delivered is more than what‚Äôs promised for the membership, and I am frankly excited to see h...",
    "Written 1 month after purchase C Cez ‚Ä¢ MintedDAO Monthly (Crypto Pay) 2 years ago Top notch",
    "2 years ago I've been in many alpha groups since 2021 but MintedDao just cooks differently. I started January and now it's my third month. Only regret was not joining last year. I've had more wins these past few months than the whole 2023 combined. We always ready to cook!"
  ],
  "priceTokens": [
    "$160.00",
    "$1,700.00",
    "$150.00",
    "$50.00",
    "$1",
    "$1",
    "$1",
    "$21",
    "$1",
    "$1",
    "$1",
    "$1",
    "$28",
    "$1",
    "$28",
    "$28",
    "$28",
    "$28",
    "$3",
    "$3"
  ],
  "faq": [],
  "textSample": "Powered by M Minted MintedDAO is a cross chain Alpha Group focusing on Solana &amp; Ethereum. We have an expert team on both the Solana/Ethereum blockchain as well as upcoming emerging blockchains (Canto, NEAR and Aptos) and... More 4.8 ( 51 ) Contact seller Products $160.00 Join a top-tier crypto and NFT group MintedDAO Monthly (Crypto Pay) 4.6 ( 18 ) $1,700.00 Join MintedDAO for Alpha Crypto Insights Minted Yearly Access (Crypto) 5.0 ( 2 ) $150.00 / month Learn NFTs &amp; Crypto Trading! üöÄ Hop in the trenches! Minted Monthly Access 5.0 ( 1 ) $50.00 / week Join Minted for 1 Week! ‚≠ê Learn NFTS / CRYPTO + MORE Minted Weekly Access (Crypto) New Free Stay Informed on Crypto Trends with Minted HQ Minted HQ 4.5 ( 2 ) Contact seller Reviews E ETHachi ‚Ä¢ Minted Yearly Access (Crypto) 10 months ago Best group to be a part of. ROI is over 1000% already. Covers everything from NFT's, Crypto, Memecoins etc... Cover most chains as well. Always will renew yearly. Ali and the team are GOAT's Written 8 months after purchase M Minion ‚Ä¢ Minted HQ 10 months ago I cannot begin to explain how much joining Minted has helped me; learn, make money, and learn how to make money. Top notch community for real and I‚Äôm grateful to be a part of it. What‚Äôs wild to me, is what‚Äôs delivered is more than what‚Äôs promised for the membership, and I am frankly excited to see h... Show more Written 1 month after purchase C Cez ‚Ä¢ MintedDAO Monthly (Crypto Pay) 2 years ago Top notch Written 4 months after purchase C Cheysser ‚Ä¢ MintedDAO Monthly (Crypto Pay) 2 years ago I've been in many alpha groups since 2021 but MintedDao just cooks differently. I started January and now it's my third month. Only regret was not joining last year. I've had more wins these past few months than the whole 2023 combined. We always ready to cook! Written 2 months after purchase See all reviews Minted | Whop",
  "finalUrl": "https://whop.com/minteddao/?a=alexburnett21",
  "fetchedAt": "2025-11-05T09:14:51.283Z",
  "textHash": "f1cc54c3c51db79eadee20726af77dee1b7fc74e6ce1b1f954b45519e58380b1",
  "drilled": false
}