{
  "baseUrl": "https://whop.com/cashflowgang/mogulbuilder/",
  "title": "Mogul Builder | Whop",
  "h1": "Mogul Builder",
  "bullets": [
    "Sign in DS Mogul Builder All The Tools Need To Become A Business Mogul 4.8 ( 10 ) AI agency This will be strictly Business and Business Only. From Building Your Brand, Offer, Funnel, Ads, and Everything required to run a Business. $97.00 / month Pay Get access Join 4 members Reviews 4.80 out of 5 10 total reviews 5 stars 4 stars 3 stars 2 stars 1 star LB Lucy Brenton 1 month ago I am consistently blown away by the things Derrick teaches. He holds nothing back. He is constantly releasing new stuff. Written 7 months after purchase",
    "JI Jayla Infini 2 months ago ğŸğŸğŸğŸ‰ Written 24 days after purchase",
    "SD Sandra Daniels 2 days ago Written 8 months after purchase",
    "JF Jose Francisco 1 month ago Written 4 months after purchase"
  ],
  "paras": [
    "Sign in DS Mogul Builder All The Tools Need To Become A Business Mogul 4.8 ( 10 ) AI agency This will be strictly Business and Business Only. From Building Your Brand, Offer, Funnel, Ads, and Everything required to run a Business.",
    "$97.00 / month Pay Get access Join 4 members Reviews 4.80 out of 5 10 total reviews 5 stars 4 stars 3 stars 2 stars 1 star LB Lucy Brenton 1 month ago I am consistently blown away by the things Derrick teaches. He holds nothing back. He is constantly releasing new stuff.",
    "2 months ago ğŸğŸğŸğŸ‰",
    "2 days ago",
    "1 month ago",
    "About the creator DS View profile Derrick A Harper Sr @ derrickharpersr â€¢ Joined Feb 2025 I Help Coaches, Marketers, and Funders Fix Their Credit, Build Their Communities, Then Use Their Resources To Buy Real Estate, Tech, and Other Businesses W/ No Money Out Of Pocket FAQs What is Cash Flow Gang? What is The Refund Policy? When Are You Live? What If I Do Not Know What I Need? Is This 1 on 1 Coaching? Affiliates DS Become an affiliate Derrick Harper Sr 30% reward Earn money by bringing customers to Derrick Harper Sr. Every time a customer purchases using your link, you&#x27;ll earn a commission."
  ],
  "priceTokens": [
    "$97.00",
    "$97.00",
    "$97.00",
    "$1",
    "$1",
    "$1",
    "$22",
    "$1",
    "$1",
    "$1",
    "$1",
    "$1",
    "$2",
    "$1",
    "$2",
    "$2",
    "$2",
    "$2",
    "$3",
    "$3"
  ],
  "faq": [],
  "textSample": "Sign in DS Mogul Builder All The Tools Need To Become A Business Mogul 4.8 ( 10 ) AI agency This will be strictly Business and Business Only. From Building Your Brand, Offer, Funnel, Ads, and Everything required to run a Business. $97.00 / month Pay Get access Join 4 members Reviews 4.80 out of 5 10 total reviews 5 stars 4 stars 3 stars 2 stars 1 star LB Lucy Brenton 1 month ago I am consistently blown away by the things Derrick teaches. He holds nothing back. He is constantly releasing new stuff. Written 7 months after purchase JI Jayla Infini 2 months ago ğŸğŸğŸğŸ‰ Written 24 days after purchase SD Sandra Daniels 2 days ago Written 8 months after purchase JF Jose Francisco 1 month ago Written 4 months after purchase See all reviews About the creator DS View profile Derrick A Harper Sr @ derrickharpersr â€¢ Joined Feb 2025 I Help Coaches, Marketers, and Funders Fix Their Credit, Build Their Communities, Then Use Their Resources To Buy Real Estate, Tech, and Other Businesses W/ No Money Out Of Pocket FAQs What is Cash Flow Gang? What is The Refund Policy? When Are You Live? What If I Do Not Know What I Need? Is This 1 on 1 Coaching? Affiliates DS Become an affiliate Derrick Harper Sr 30% reward Earn money by bringing customers to Derrick Harper Sr. Every time a customer purchases using your link, you&#x27;ll earn a commission. Mogul Builder $97.00 / month +2 options Get access $97.00 / month 2 options Pay Get access Pay Get access Mogul Builder | Whop",
  "finalUrl": "https://whop.com/cashflowgang/mogulbuilder/",
  "fetchedAt": "2025-11-05T10:53:06.907Z",
  "textHash": "2290f9ca538fd2efc2f2f09b43236bd208f1af5a22350482134c1213aa36f246",
  "drilled": false
}