{
  "baseUrl": "https://whop.com/mogul-stock-group/mogul-stock-group-monthly-premium/",
  "title": "Mogul Premium Alert Service | Whop",
  "h1": "Mogul Premium Alert Service",
  "bullets": [
    "Mogul Premium Alert Service | Whop Sign in MG Mogul Premium Alert Service Real-time alerts &amp; trading transparency 4.4 ( 27 ) Trading Mogul Stock Group offers a monthly subscription with real-time alerts and transparency, covering stocks, IPOs, and crypto on Discord. $75.00 / week Pay Join Join 142 members Features Access to all stock and crypto channels on Discord",
    "24/7 support from our dedicated team",
    "Weekly payment option available for flexibility",
    "Exclusive access to our discord server.",
    "Mogual Golden indicator is included.",
    "CL Clarence Larkins 24 days ago I love this group it has changed my life and motivated me to educate others to do the same Written 8 months after purchase",
    "J Jackie 1 month ago The best way to learn is to get in the room with people who are already moving Written 22 days after purchase",
    "DS Deonte Smith 1 month ago Awesome resources for traders looking to expand their knowledge Written 4 months after purchase",
    "JF Janay Forth 8 months ago New to the community and trading. Looking forward to learning more and joining a premium tier once I gain a better understanding of the fundamentals of trading. However so far so good , loving the community Written 20 hours after purchase"
  ],
  "paras": [
    "Sign in MG Mogul Premium Alert Service Real-time alerts &amp; trading transparency 4.4 ( 27 ) Trading Mogul Stock Group offers a monthly subscription with real-time alerts and transparency, covering stocks, IPOs, and crypto on Discord.",
    "$75.00 / week Pay Join Join 142 members Features Access to all stock and crypto channels on Discord 24/7 support from our dedicated team Weekly payment option available for flexibility Exclusive access to our discord server. Mogual Golden indicator is included. Reviews 4.41 out of 5 27 total reviews 5 stars 4 stars 3 stars 2 stars 1 star CL Clarence Larkins 24 days ago I love this group it has changed my life and motivated me to educate others to do the same",
    "1 month ago The best way to learn is to get in the room with people who are already moving",
    "1 month ago Awesome resources for traders looking to expand their knowledge",
    "8 months ago New to the community and trading. Looking forward to learning more and joining a premium tier once I gain a better understanding of the fundamentals of trading. However so far so good , loving the community",
    "About the creator CB View profile Cortt Biggs @ stockmarketbiggs • Joined Jul 2024 I&#x27;ve dedicated my career to mastering the stock market, and now I&#x27;m sharing my insights with you. Join me for real-time alerts and transparent trading strategies. FAQs What&#x27;s your refund policy? For the Premium Membership can we do weekly payments? What do you get with Premium Membership? Does Premium include live training or just alerts/live trading? What if I have zero experience? Affiliates MG Become an affiliate Mogul Stock Group 20% reward Earn money by bringing customers to Mogul Stock Group. Every time a customer purchases using your link, you&#x27;ll earn a commission."
  ],
  "priceTokens": [
    "$75.00",
    "$75.00",
    "$75.00",
    "$1",
    "$1",
    "$1",
    "$23",
    "$1",
    "$1",
    "$1",
    "$1",
    "$1",
    "$2",
    "$1",
    "$2",
    "$2",
    "$2",
    "$2",
    "$3",
    "$3"
  ],
  "faq": [],
  "textSample": "Mogul Premium Alert Service | Whop Sign in MG Mogul Premium Alert Service Real-time alerts &amp; trading transparency 4.4 ( 27 ) Trading Mogul Stock Group offers a monthly subscription with real-time alerts and transparency, covering stocks, IPOs, and crypto on Discord. $75.00 / week Pay Join Join 142 members Features Access to all stock and crypto channels on Discord 24/7 support from our dedicated team Weekly payment option available for flexibility Exclusive access to our discord server. Mogual Golden indicator is included. Reviews 4.41 out of 5 27 total reviews 5 stars 4 stars 3 stars 2 stars 1 star CL Clarence Larkins 24 days ago I love this group it has changed my life and motivated me to educate others to do the same Written 8 months after purchase J Jackie 1 month ago The best way to learn is to get in the room with people who are already moving Written 22 days after purchase DS Deonte Smith 1 month ago Awesome resources for traders looking to expand their knowledge Written 4 months after purchase JF Janay Forth 8 months ago New to the community and trading. Looking forward to learning more and joining a premium tier once I gain a better understanding of the fundamentals of trading. However so far so good , loving the community Written 20 hours after purchase See all reviews About the creator CB View profile Cortt Biggs @ stockmarketbiggs • Joined Jul 2024 I&#x27;ve dedicated my career to mastering the stock market, and now I&#x27;m sharing my insights with you. Join me for real-time alerts and transparent trading strategies. FAQs What&#x27;s your refund policy? For the Premium Membership can we do weekly payments? What do you get with Premium Membership? Does Premium include live training or just alerts/live trading? What if I have zero experience? Affiliates MG Become an affiliate Mogul Stock Group 20% reward Earn money by bringing customers to Mogul Stock Group. Every time a customer purchases using your link, you&#x27;ll earn a commission. Mogul Premium Alert Service $75.00 / week +3 options Join $75.00 / week 3 options Pay Join Pay Join",
  "finalUrl": "https://whop.com/mogul-stock-group/mogul-stock-group-monthly-premium/",
  "fetchedAt": "2025-11-04T21:35:09.785Z",
  "textHash": "7e8330f884069acd0197d78c75b70b96f0a52fa6c2d86ff3bd5523bed054000c",
  "drilled": false
}