{
  "baseUrl": "https://whop.com/vinted-bot-monitorius/?a=alexburnett21",
  "title": "Monitorius - Vinted Bot | Whop",
  "h1": "Monitorius - Vinted Bot",
  "bullets": [
    "Powered by MB Monitorius - Vinted Bot It all started with a frustration: missing the best deals on Vinted. With years of experience in e-commerce, I created Monitorius, a powerful tool to maximize your profits effortlessly. It instantly i... More 5.0 ( 4 ) Contact seller Products €8.00 / week Take advantage of Vinted buying and reselling Monitorius – Vinted Bot #1 5.0 ( 4 ) Contact seller Reviews S Skinner 5 months ago Incredibly helpful to snipe those deals. I was using another Vinted bot prior to this and it is a good 5-10 seconds faster at displaying items. I tried it on work break for 30 mins and snagged a potential profit of £60. I ran it along side the other bot and all the items I bought before they even lo... Show more Written 1 day after purchase",
    "P paolo 6 months ago Perfect service Written 1 month after purchase",
    "RO Roy Oosting 7 months ago 10/10 i would recommend this hard time! Written 11 days after purchase",
    "L luna 8 months ago Great service Written 4 months after purchase"
  ],
  "paras": [
    "MB Monitorius - Vinted Bot It all started with a frustration: missing the best deals on Vinted. With years of experience in e-commerce, I created Monitorius, a powerful tool to maximize your profits effortlessly. It instantly i... More 5.0 ( 4 ) Contact seller Products €8.00 / week Take advantage of Vinted buying and reselling Monitorius – Vinted Bot #1 5.0 ( 4 ) Contact seller Reviews S Skinner 5 months ago Incredibly helpful to snipe those deals. I was using another Vinted bot prior to this and it is a good 5-10 seconds faster at displaying items. I tried it on work break for 30 mins and snagged a potential profit of £60. I ran it along side the other bot and all the items I bought before they even lo...",
    "Written 1 day after purchase P paolo 6 months ago Perfect service",
    "7 months ago 10/10 i would recommend this hard time!",
    "8 months ago Great service"
  ],
  "priceTokens": [
    "€8.00",
    "£60",
    "$1",
    "$1",
    "$1",
    "$21",
    "$1",
    "$1",
    "$1",
    "$1",
    "$28",
    "$1",
    "$28",
    "$28",
    "$28",
    "$28",
    "$3",
    "$3",
    "$3",
    "$10"
  ],
  "faq": [],
  "textSample": "Powered by MB Monitorius - Vinted Bot It all started with a frustration: missing the best deals on Vinted. With years of experience in e-commerce, I created Monitorius, a powerful tool to maximize your profits effortlessly. It instantly i... More 5.0 ( 4 ) Contact seller Products €8.00 / week Take advantage of Vinted buying and reselling Monitorius – Vinted Bot #1 5.0 ( 4 ) Contact seller Reviews S Skinner 5 months ago Incredibly helpful to snipe those deals. I was using another Vinted bot prior to this and it is a good 5-10 seconds faster at displaying items. I tried it on work break for 30 mins and snagged a potential profit of £60. I ran it along side the other bot and all the items I bought before they even lo... Show more Written 1 day after purchase P paolo 6 months ago Perfect service Written 1 month after purchase RO Roy Oosting 7 months ago 10/10 i would recommend this hard time! Written 11 days after purchase L luna 8 months ago Great service Written 4 months after purchase Monitorius - Vinted Bot | Whop",
  "finalUrl": "https://whop.com/vinted-bot-monitorius/?a=alexburnett21",
  "fetchedAt": "2025-11-05T09:58:33.328Z",
  "textHash": "58fa168b68516422133d0a4baa8545daaab15e9a992241269c92f1dbdfc0dca0",
  "drilled": false
}