{
  "baseUrl": "https://whop.com/snewjdubs/monthly-straight-plays-vip-elite/",
  "title": "MONTHLY-Straight Plays (ELITE) | Whop",
  "h1": "MONTHLY-Straight Plays (ELITE)",
  "bullets": [
    "MONTHLY-Straight Plays (ELITE) | Whop Sign in Unmute Unmute SD MONTHLY-Straight Plays (ELITE) **Rated One Of The Top Sports Consultants On Whop** 4.9 ( 97 ) Other Best Value Monthly Straight Picks / Plays. Where The BIG Money Is Made. Cashing Over 50k+ Satisfied Clients! Over $3.1m+ generated in client profits in 2024! $49.95 / month Pay Join Features Elite Expert Straight Plays for Serious Money Makers and sports enthusiast",
    "Straight Plays for the NBA, NFL, MLB, Tennis, and Soccer daily",
    "Consistent Wins and Major Cash Outs just like our other satifised clients",
    "Carefully curated researched straight plays for maximum success",
    "Access to SnewJ Dubs VIP Elite Discord, our top-tier package.",
    "DC Domingo castillo 2 days ago Excellent Written 2 years after purchase",
    "SD Set Damian 1 month ago He donâ€™t play ğŸ˜®â€ğŸ’¨ Written 10 months after purchase",
    "HR Henry Rosario 1 month ago Copping again ğŸ¤£ğŸ¤£ğŸ¤¦â€â™‚ï¸ğŸ‘Œ Written 1 year after purchase",
    "DC Dylan chappell 1 month ago SnewJ tha goat. Letâ€™s cash Written 1 day after purchase"
  ],
  "paras": [
    "Sign in Unmute Unmute SD MONTHLY-Straight Plays (ELITE) **Rated One Of The Top Sports Consultants On Whop** 4.9 ( 97 ) Other Best Value Monthly Straight Picks / Plays. Where The BIG Money Is Made. Cashing Over 50k+ Satisfied Clients! Over $3.1m+ generated in client profits in 2024!",
    "$49.95 / month Pay Join Features Elite Expert Straight Plays for Serious Money Makers and sports enthusiast Straight Plays for the NBA, NFL, MLB, Tennis, and Soccer daily Consistent Wins and Major Cash Outs just like our other satifised clients Carefully curated researched straight plays for maximum success Access to SnewJ Dubs VIP Elite Discord, our top-tier package. Reviews 4.89 out of 5 97 total reviews 5 stars 4 stars 3 stars 2 stars 1 star DC Domingo castillo 2 days ago Excellent",
    "1 month ago He donâ€™t play ğŸ˜®â€ğŸ’¨",
    "1 month ago Copping again ğŸ¤£ğŸ¤£ğŸ¤¦â€â™‚ï¸ğŸ‘Œ",
    "1 month ago SnewJ tha goat. Letâ€™s cash",
    "About the creator S View profile SnewJ @ snewj â€¢ Joined Jan 2024 SnewJ Dub&#x27;s shares Straight Plays and Players Prop Picks that are highly researched by Elite Expert(s)-with immense knowledge about the game. All picks have high chances of success. FAQs How is this Worth It? How do I cancel Subscription? Affiliates SD Become an affiliate SnewJ Dubs 30% reward Earn money by bringing customers to SnewJ Dubs . Every time a customer purchases using your link, you&#x27;ll earn a commission."
  ],
  "priceTokens": [
    "$3",
    "$3",
    "$3",
    "$3",
    "$49.95",
    "$49.95",
    "$49.95",
    "$3",
    "$1",
    "$1",
    "$1",
    "$22",
    "$1",
    "$1",
    "$1",
    "$1",
    "$1",
    "$2",
    "$1",
    "$2"
  ],
  "faq": [],
  "textSample": "MONTHLY-Straight Plays (ELITE) | Whop Sign in Unmute Unmute SD MONTHLY-Straight Plays (ELITE) **Rated One Of The Top Sports Consultants On Whop** 4.9 ( 97 ) Other Best Value Monthly Straight Picks / Plays. Where The BIG Money Is Made. Cashing Over 50k+ Satisfied Clients! Over $3.1m+ generated in client profits in 2024! $49.95 / month Pay Join Features Elite Expert Straight Plays for Serious Money Makers and sports enthusiast Straight Plays for the NBA, NFL, MLB, Tennis, and Soccer daily Consistent Wins and Major Cash Outs just like our other satifised clients Carefully curated researched straight plays for maximum success Access to SnewJ Dubs VIP Elite Discord, our top-tier package. Reviews 4.89 out of 5 97 total reviews 5 stars 4 stars 3 stars 2 stars 1 star DC Domingo castillo 2 days ago Excellent Written 2 years after purchase SD Set Damian 1 month ago He donâ€™t play ğŸ˜®â€ğŸ’¨ Written 10 months after purchase HR Henry Rosario 1 month ago Copping again ğŸ¤£ğŸ¤£ğŸ¤¦â€â™‚ï¸ğŸ‘Œ Written 1 year after purchase DC Dylan chappell 1 month ago SnewJ tha goat. Letâ€™s cash Written 1 day after purchase See all reviews About the creator S View profile SnewJ @ snewj â€¢ Joined Jan 2024 SnewJ Dub&#x27;s shares Straight Plays and Players Prop Picks that are highly researched by Elite Expert(s)-with immense knowledge about the game. All picks have high chances of success. FAQs How is this Worth It? How do I cancel Subscription? Affiliates SD Become an affiliate SnewJ Dubs 30% reward Earn money by bringing customers to SnewJ Dubs . Every time a customer purchases using your link, you&#x27;ll earn a commission. MONTHLY-Straight Plays (ELITE) $49.95 / month +1 option Join $49.95 / month 1 option Pay Join Pay Join",
  "finalUrl": "https://whop.com/snewjdubs/monthly-straight-plays-vip-elite/",
  "fetchedAt": "2025-11-05T09:54:32.676Z",
  "textHash": "e538ec55fce77009972bed0b509782aa9d5bcc2c4503985a03d43eeac603bce8",
  "drilled": false
}