{
  "baseUrl": "https://whop.com/upturnprofits/monthly-premium-membership-b5-7e84/",
  "title": "Monthly Premium Membership | Whop",
  "h1": "Monthly Premium Membership",
  "bullets": [
    "Sign in UP Monthly Premium Membership Unlock Your Reselling Potential 4.6 ( 30 ) Reselling Join the top reselling community and earn thousands monthly. Access suppliers, tips, and exclusive deals. No experience needed! $67.00 / month Pay Join Features Access to personal suppliers and product sourcing.",
    "One-on-one message support for personalized guidance.",
    "Coaching calls for live support and networking.",
    "Exclusive deals on food, travel, and tech.",
    "Stock, investing, credit, and travel hacking tips.",
    "F Frxddyxv 2 months ago best reselling discord you will ever find. Written 2 months after purchase",
    "KN Koside Nwafor 7 months ago Derek is mad helpful and legit make sure to tap in!! Written 1 month after purchase",
    "CS connor slaughter 7 months ago This was the best start to any side hustle ever, I was hesitant at first. Then I got in contact with Derek and he told the basics and this is everything he said and a whole bunch more. If your looking to start reselling this is your place Written 2 months after purchase",
    "JK Junaid A Khera 9 months ago Ts legit Written 1 minute after purchase"
  ],
  "paras": [
    "Sign in UP Monthly Premium Membership Unlock Your Reselling Potential 4.6 ( 30 ) Reselling Join the top reselling community and earn thousands monthly. Access suppliers, tips, and exclusive deals. No experience needed!",
    "Access to personal suppliers and product sourcing. One-on-one message support for personalized guidance. Coaching calls for live support and networking. Exclusive deals on food, travel, and tech. Stock, investing, credit, and travel hacking tips. Reviews 4.63 out of 5 30 total reviews 5 stars 4 stars 3 stars 2 stars 1 star F Frxddyxv 2 months ago best reselling discord you will ever find.",
    "7 months ago Derek is mad helpful and legit make sure to tap in!!",
    "7 months ago This was the best start to any side hustle ever, I was hesitant at first. Then I got in contact with Derek and he told the basics and this is everything he said and a whole bunch more. If your looking to start reselling this is your place",
    "9 months ago Ts legit",
    "About the creator D View profile Derek @ derekresells2 • Joined May 2024 I&#x27;ve built Upturn Profits to empower individuals to unlock their reselling potential. With insider knowledge, personal suppliers, and a supportive community, we help you scale and profit. Whether you&#x27;re new or experienced, our resources and network are designed to maximize your success. FAQs What do you do in this group? Can I cancel anytime? How much do I need to start? How fast can I make money? Do I need experience? Affiliates UP Become an affiliate Upturn Profits 30% reward Earn money by bringing customers to Upturn Profits . Every time a customer purchases using your link, you&#x27;ll earn a commission."
  ],
  "priceTokens": [
    "$67.00",
    "$67.00",
    "$67.00",
    "$1",
    "$1",
    "$1",
    "$23",
    "$1",
    "$1",
    "$1",
    "$1",
    "$1",
    "$2",
    "$1",
    "$2",
    "$2",
    "$2",
    "$2",
    "$3",
    "$3"
  ],
  "faq": [],
  "textSample": "Sign in UP Monthly Premium Membership Unlock Your Reselling Potential 4.6 ( 30 ) Reselling Join the top reselling community and earn thousands monthly. Access suppliers, tips, and exclusive deals. No experience needed! $67.00 / month Pay Join Features Access to personal suppliers and product sourcing. One-on-one message support for personalized guidance. Coaching calls for live support and networking. Exclusive deals on food, travel, and tech. Stock, investing, credit, and travel hacking tips. Reviews 4.63 out of 5 30 total reviews 5 stars 4 stars 3 stars 2 stars 1 star F Frxddyxv 2 months ago best reselling discord you will ever find. Written 2 months after purchase KN Koside Nwafor 7 months ago Derek is mad helpful and legit make sure to tap in!! Written 1 month after purchase CS connor slaughter 7 months ago This was the best start to any side hustle ever, I was hesitant at first. Then I got in contact with Derek and he told the basics and this is everything he said and a whole bunch more. If your looking to start reselling this is your place Written 2 months after purchase JK Junaid A Khera 9 months ago Ts legit Written 1 minute after purchase See all reviews About the creator D View profile Derek @ derekresells2 • Joined May 2024 I&#x27;ve built Upturn Profits to empower individuals to unlock their reselling potential. With insider knowledge, personal suppliers, and a supportive community, we help you scale and profit. Whether you&#x27;re new or experienced, our resources and network are designed to maximize your success. FAQs What do you do in this group? Can I cancel anytime? How much do I need to start? How fast can I make money? Do I need experience? Affiliates UP Become an affiliate Upturn Profits 30% reward Earn money by bringing customers to Upturn Profits . Every time a customer purchases using your link, you&#x27;ll earn a commission. Monthly Premium Membership $67.00 / month Join $67.00 / month Pay Join Pay Join Monthly Premium Membership | Whop",
  "finalUrl": "https://whop.com/upturnprofits/monthly-premium-membership-b5-7e84/",
  "fetchedAt": "2025-11-05T09:20:28.804Z",
  "textHash": "9c00e325bde1de44fd114581184ce107e478acbb0f92cafe590dece4c1950612",
  "drilled": false
}