{
  "baseUrl": "https://whop.com/mainmenmedia/?a=alexburnett21",
  "title": "The Main Men Media | Whop",
  "h1": "The Main Men Media",
  "bullets": [
    "Powered by TM The Main Men Media I&#x27;ve dedicated myself to helping others unlock the potential of TikTok Shop. With personalized guidance and a supportive community, I&#x27;m here to help you achieve financial success. 5.0 ( 20 ) Contact seller Products Unmute $6.00 / week Learn to Earn Online Weekly Membership Of MMM 5.0 ( 3 ) Unmute $20.00 / month Learn to Earn Online Doing TikTok Monthly Member of MMM 5.0 ( 14 ) Unmute $250.00 Learn to Earn Online Forever Membership of MMM 5.0 ( 1 ) Contact seller Reviews JB Jeff Bilzerian • Monthly Member of MMM 3 months ago Bizmo is one of the most genuine creators out there! Awesome community would highly recommend! Written 3 months after purchase",
    "M mykuuh • Monthly Member of MMM 4 months ago amazing community, learned & continue to learn a lot. from the modules to the meetings! very saucey :) Written 5 months after purchase",
    "I Imri • Forever Membership of MMM 6 months ago This discord made by Bizmo is a Top notch full community that has support, adds value to the day, and provides so much guidance for new and seasoned tikTok shop affiliates! 10/10! Written 3 months after purchase",
    "JL Jack Laurie • Monthly Member of MMM 6 months ago I cant get over the value of this discord. The price for info is unmatched and Biz really cares for every in the discord. He does not fall short of making sure everyone is helped and truly wants the members to succeed. The community is super motivating and active. If you're serious about making mone... Show more Written 21 days after purchase"
  ],
  "paras": [
    "TM The Main Men Media I&#x27;ve dedicated myself to helping others unlock the potential of TikTok Shop. With personalized guidance and a supportive community, I&#x27;m here to help you achieve financial success. 5.0 ( 20 ) Contact seller Products Unmute $6.00 / week Learn to Earn Online Weekly Membership Of MMM 5.0 ( 3 ) Unmute $20.00 / month Learn to Earn Online Doing TikTok Monthly Member of MMM 5.0 ( 14 ) Unmute $250.00 Learn to Earn Online Forever Membership of MMM 5.0 ( 1 ) Contact seller Reviews JB Jeff Bilzerian • Monthly Member of MMM 3 months ago Bizmo is one of the most genuine creators out there! Awesome community would highly recommend!",
    "4 months ago amazing community, learned & continue to learn a lot. from the modules to the meetings! very saucey :)",
    "6 months ago This discord made by Bizmo is a Top notch full community that has support, adds value to the day, and provides so much guidance for new and seasoned tikTok shop affiliates! 10/10!",
    "6 months ago I cant get over the value of this discord. The price for info is unmatched and Biz really cares for every in the discord. He does not fall short of making sure everyone is helped and truly wants the members to succeed. The community is super motivating and active. If you're serious about making mone..."
  ],
  "priceTokens": [
    "$6.00",
    "$20.00",
    "$250.00",
    "$1",
    "$1",
    "$1",
    "$21",
    "$1",
    "$1",
    "$1",
    "$1",
    "$28",
    "$1",
    "$28",
    "$28",
    "$28",
    "$28",
    "$3",
    "$3",
    "$3"
  ],
  "faq": [],
  "textSample": "Powered by TM The Main Men Media I&#x27;ve dedicated myself to helping others unlock the potential of TikTok Shop. With personalized guidance and a supportive community, I&#x27;m here to help you achieve financial success. 5.0 ( 20 ) Contact seller Products Unmute $6.00 / week Learn to Earn Online Weekly Membership Of MMM 5.0 ( 3 ) Unmute $20.00 / month Learn to Earn Online Doing TikTok Monthly Member of MMM 5.0 ( 14 ) Unmute $250.00 Learn to Earn Online Forever Membership of MMM 5.0 ( 1 ) Contact seller Reviews JB Jeff Bilzerian • Monthly Member of MMM 3 months ago Bizmo is one of the most genuine creators out there! Awesome community would highly recommend! Written 3 months after purchase M mykuuh • Monthly Member of MMM 4 months ago amazing community, learned & continue to learn a lot. from the modules to the meetings! very saucey :) Written 5 months after purchase I Imri • Forever Membership of MMM 6 months ago This discord made by Bizmo is a Top notch full community that has support, adds value to the day, and provides so much guidance for new and seasoned tikTok shop affiliates! 10/10! Written 3 months after purchase JL Jack Laurie • Monthly Member of MMM 6 months ago I cant get over the value of this discord. The price for info is unmatched and Biz really cares for every in the discord. He does not fall short of making sure everyone is helped and truly wants the members to succeed. The community is super motivating and active. If you're serious about making mone... Show more Written 21 days after purchase See all reviews The Main Men Media | Whop",
  "finalUrl": "https://whop.com/mainmenmedia/?a=alexburnett21",
  "fetchedAt": "2025-11-04T20:03:31.992Z",
  "textHash": "a8869f852f0721c267faf7f6015fcf7c628aaa48745af0fe7c26a952090567fd",
  "drilled": false
}