{
  "baseUrl": "https://whop.com/moontrades/?a=alexburnett21",
  "title": "Moon Trades ðŸŒ™ | Whop",
  "h1": "Moon Trades ðŸŒ™",
  "bullets": [
    "Powered by MT Moon Trades ðŸŒ™ Teaching you how to become a profitable trader; $1k to $10k months. 5.0 ( 220 ) Contact seller Products $39.99 / month Moon Trades Vip Vip MONTHLY 5.0 ( 212 ) $499.00 / year VIP LIFETIME Vip LIFETIME 5.0 ( 8 ) Contact seller Reviews LJ luis pereira jr â€¢ Vip MONTHLY 22 days ago Awesome ass community, dropped $40 on the cord and made double on the day- it's not js calls from moon but from other traders as well Written 3 hours after purchase",
    "SS Sebastian Santamaria â€¢ Vip MONTHLY 22 days ago Really good, Everything organized and professional, making money Written 6 minutes after purchase",
    "BA Ben Apelbaum â€¢ Vip MONTHLY 24 days ago Already made my money back and more Written 2 days after purchase",
    "IA Issa Abuayyash â€¢ Vip MONTHLY 24 days ago Best decision of my life ngl Written 2 days after purchase"
  ],
  "paras": [
    "MT Moon Trades ðŸŒ™ Teaching you how to become a profitable trader; $1k to $10k months. 5.0 ( 220 ) Contact seller Products $39.99 / month Moon Trades Vip Vip MONTHLY 5.0 ( 212 ) $499.00 / year VIP LIFETIME Vip LIFETIME 5.0 ( 8 ) Contact seller Reviews LJ luis pereira jr â€¢ Vip MONTHLY 22 days ago Awesome ass community, dropped $40 on the cord and made double on the day- it's not js calls from moon but from other traders as well",
    "22 days ago Really good, Everything organized and professional, making money",
    "24 days ago Already made my money back and more",
    "24 days ago Best decision of my life ngl"
  ],
  "priceTokens": [
    "$1",
    "$10",
    "$39.99",
    "$499.00",
    "$40",
    "$1",
    "$1",
    "$1",
    "$21",
    "$1",
    "$1",
    "$1",
    "$1",
    "$28",
    "$1",
    "$28",
    "$28",
    "$28",
    "$28",
    "$3"
  ],
  "faq": [],
  "textSample": "Powered by MT Moon Trades ðŸŒ™ Teaching you how to become a profitable trader; $1k to $10k months. 5.0 ( 220 ) Contact seller Products $39.99 / month Moon Trades Vip Vip MONTHLY 5.0 ( 212 ) $499.00 / year VIP LIFETIME Vip LIFETIME 5.0 ( 8 ) Contact seller Reviews LJ luis pereira jr â€¢ Vip MONTHLY 22 days ago Awesome ass community, dropped $40 on the cord and made double on the day- it's not js calls from moon but from other traders as well Written 3 hours after purchase SS Sebastian Santamaria â€¢ Vip MONTHLY 22 days ago Really good, Everything organized and professional, making money Written 6 minutes after purchase BA Ben Apelbaum â€¢ Vip MONTHLY 24 days ago Already made my money back and more Written 2 days after purchase IA Issa Abuayyash â€¢ Vip MONTHLY 24 days ago Best decision of my life ngl Written 2 days after purchase See all reviews Moon Trades ðŸŒ™ | Whop",
  "finalUrl": "https://whop.com/moontrades/?a=alexburnett21",
  "fetchedAt": "2025-11-05T09:11:59.346Z",
  "textHash": "e88267fba66b64a024bedb866a3d57e96a02a5c0427973a1f87962bd8bcf9ea5",
  "drilled": false
}