{
  "baseUrl": "https://whop.com/clientacquisitionio/nbl/",
  "title": "NBL Community Access | Whop",
  "h1": "NBL Community Access",
  "bullets": [
    "Sign in Unmute Unmute C NBL Community Access Natural Born Leaders 4.5 ( 11 ) Marketing agency Join The Top 1% Of Growth Creators And Industry Experts Implementing The Build &amp; Release Model To Effortlessly Scale Past $100K/month $49.00 / week 7 day trial + $22.50 initial fee Pay Get access Join 19 members Features Access the 4-Week Growth Creator Challenge for step-by-step scaling strategies.",
    "Unlock 20+ hours of actionable growth creation training and insights.",
    "Gain access to Build &amp; Release infrastructures in 50+ profitable niches.",
    "Join a thriving community of entrepreneurs and high-performing peers.",
    "Get live group calls and personalized 1-on-1 sessions with Serge.",
    "AA Ammar Alassaf 7 months ago Once I saw the offer I immediately took it Written 6 minutes after purchase",
    "DC Denis - Ionut - Costel Cucu 8 months ago One of the best webinars I’ve ever attended! It was supposed to be 3 hours, but Serge took it to 6—full of insights, not just on AI but on how business really works. A must for entrepreneurs who want to succeed! Written 9 days after purchase",
    "FK Franz Kallert 9 months ago Mandatory for everyone, who wants to thrive in business! Written 7 days after purchase",
    "LJ Leroy K Davis Jr 5 days ago Written 2 months after purchase"
  ],
  "paras": [
    "Sign in Unmute Unmute C NBL Community Access Natural Born Leaders 4.5 ( 11 ) Marketing agency Join The Top 1% Of Growth Creators And Industry Experts Implementing The Build &amp; Release Model To Effortlessly Scale Past $100K/month",
    "$49.00 / week 7 day trial + $22.50 initial fee Pay Get access Join 19 members Features Access the 4-Week Growth Creator Challenge for step-by-step scaling strategies. Unlock 20+ hours of actionable growth creation training and insights. Gain access to Build &amp; Release infrastructures in 50+ profitable niches. Join a thriving community of entrepreneurs and high-performing peers. Get live group calls and personalized 1-on-1 sessions with Serge. Reviews 4.45 out of 5 11 total reviews 5 stars 4 stars 3 stars 2 stars 1 star AA Ammar Alassaf 7 months ago Once I saw the offer I immediately took it",
    "8 months ago One of the best webinars I’ve ever attended! It was supposed to be 3 hours, but Serge took it to 6—full of insights, not just on AI but on how business really works. A must for entrepreneurs who want to succeed!",
    "9 months ago Mandatory for everyone, who wants to thrive in business!",
    "5 days ago",
    "About the creator SG View profile Serge Gatari @ clientacquisitionio • Joined Jul 2024 Affiliates C Become an affiliate ClientAcquisition.io 30% reward Earn money by bringing customers to ClientAcquisition.io. Every time a customer purchases using your link, you&#x27;ll earn a commission."
  ],
  "priceTokens": [
    "$100",
    "$49.00",
    "$22.50",
    "$49.00",
    "$49.00",
    "$1",
    "$1",
    "$1",
    "$22",
    "$1",
    "$1",
    "$1",
    "$1",
    "$1",
    "$2",
    "$1",
    "$2",
    "$2",
    "$2",
    "$2"
  ],
  "faq": [],
  "textSample": "Sign in Unmute Unmute C NBL Community Access Natural Born Leaders 4.5 ( 11 ) Marketing agency Join The Top 1% Of Growth Creators And Industry Experts Implementing The Build &amp; Release Model To Effortlessly Scale Past $100K/month $49.00 / week 7 day trial + $22.50 initial fee Pay Get access Join 19 members Features Access the 4-Week Growth Creator Challenge for step-by-step scaling strategies. Unlock 20+ hours of actionable growth creation training and insights. Gain access to Build &amp; Release infrastructures in 50+ profitable niches. Join a thriving community of entrepreneurs and high-performing peers. Get live group calls and personalized 1-on-1 sessions with Serge. Reviews 4.45 out of 5 11 total reviews 5 stars 4 stars 3 stars 2 stars 1 star AA Ammar Alassaf 7 months ago Once I saw the offer I immediately took it Written 6 minutes after purchase DC Denis - Ionut - Costel Cucu 8 months ago One of the best webinars I’ve ever attended! It was supposed to be 3 hours, but Serge took it to 6—full of insights, not just on AI but on how business really works. A must for entrepreneurs who want to succeed! Written 9 days after purchase FK Franz Kallert 9 months ago Mandatory for everyone, who wants to thrive in business! Written 7 days after purchase LJ Leroy K Davis Jr 5 days ago Written 2 months after purchase See all reviews About the creator SG View profile Serge Gatari @ clientacquisitionio • Joined Jul 2024 Affiliates C Become an affiliate ClientAcquisition.io 30% reward Earn money by bringing customers to ClientAcquisition.io. Every time a customer purchases using your link, you&#x27;ll earn a commission. NBL Community Access $49.00 / week +1 option Get access $49.00 / week 1 option Pay Get access Pay Get access NBL Community Access | Whop",
  "finalUrl": "https://whop.com/clientacquisitionio/nbl/",
  "fetchedAt": "2025-11-04T20:05:08.318Z",
  "textHash": "240d84e442d87e384b5e0baa561e4b2a1037fdff1b85d37cdf60cbeb77908cea",
  "drilled": false
}