{
  "baseUrl": "https://whop.com/monthly-premium-access-0f/weekly-premium-access-65/",
  "title": "NicksPicks Premium | Whop",
  "h1": "NicksPicks Premium",
  "bullets": [
    "Sign in N NicksPicks Premium Weekly Wins with Premium Access by NicksPicks üåç 4.8 ( 102 ) Sports betting Unlock expert sports betting advice with NicksPicks Premium. Enjoy daily picks for all major sports, 24/7 support, and smart gambling tips from expert analysts. $8.00 / week Pay Join Features Daily picks for all major sports including NBA, NFL, and more.",
    "24/7 access to a vibrant Discord community and expert analysts.",
    "Exclusive bankroll management tips to maximize your profits.",
    "R Ri3l 3 days ago I‚Äôm new Written 1 year after purchase",
    "EB Eric Brass 2 months ago Hot Written 15 days after purchase",
    "LM Leah Myers 8 months ago So far so good! Written 1 day after purchase",
    "WC William Coleman 9 months ago Hands down the best discord out there for the research alone it's worth the price of admission.But the tennis üéæ capper is the best in the GAMEüî•üî•üî• Written 6 days after purchase"
  ],
  "paras": [
    "Sign in N NicksPicks Premium Weekly Wins with Premium Access by NicksPicks üåç 4.8 ( 102 ) Sports betting Unlock expert sports betting advice with NicksPicks Premium. Enjoy daily picks for all major sports, 24/7 support, and smart gambling tips from expert analysts.",
    "Daily picks for all major sports including NBA, NFL, and more. 24/7 access to a vibrant Discord community and expert analysts. Exclusive bankroll management tips to maximize your profits. Reviews 4.75 out of 5 102 total reviews 5 stars 4 stars 3 stars 2 stars 1 star R Ri3l 3 days ago I‚Äôm new",
    "2 months ago Hot",
    "8 months ago So far so good!",
    "9 months ago Hands down the best discord out there for the research alone it's worth the price of admission.But the tennis üéæ capper is the best in the GAMEüî•üî•üî•",
    "About the creator NP View profile Nick&#x27;s Picks @ nickssportsbets ‚Ä¢ Joined Dec 2023 Complete statistical sports betting and analytic information provided by 6 analysts. Join us today and experience the NicksPick advantage. From bank roll builders, straights to jaw-dropping lottos. Let us help make every sports bet rewarding! FAQs How exclusive is the monthly access? How do I get my discord role? Affiliates N Become an affiliate NicksPicks 30% reward Earn money by bringing customers to NicksPicks. Every time a customer purchases using your link, you&#x27;ll earn a commission."
  ],
  "priceTokens": [
    "$8.00",
    "$8.00",
    "$8.00",
    "$1",
    "$1",
    "$1",
    "$23",
    "$1",
    "$1",
    "$1",
    "$1",
    "$1",
    "$2",
    "$1",
    "$2",
    "$2",
    "$2",
    "$2",
    "$3",
    "$3"
  ],
  "faq": [],
  "textSample": "Sign in N NicksPicks Premium Weekly Wins with Premium Access by NicksPicks üåç 4.8 ( 102 ) Sports betting Unlock expert sports betting advice with NicksPicks Premium. Enjoy daily picks for all major sports, 24/7 support, and smart gambling tips from expert analysts. $8.00 / week Pay Join Features Daily picks for all major sports including NBA, NFL, and more. 24/7 access to a vibrant Discord community and expert analysts. Exclusive bankroll management tips to maximize your profits. Reviews 4.75 out of 5 102 total reviews 5 stars 4 stars 3 stars 2 stars 1 star R Ri3l 3 days ago I‚Äôm new Written 1 year after purchase EB Eric Brass 2 months ago Hot Written 15 days after purchase LM Leah Myers 8 months ago So far so good! Written 1 day after purchase WC William Coleman 9 months ago Hands down the best discord out there for the research alone it's worth the price of admission.But the tennis üéæ capper is the best in the GAMEüî•üî•üî• Written 6 days after purchase See all reviews About the creator NP View profile Nick&#x27;s Picks @ nickssportsbets ‚Ä¢ Joined Dec 2023 Complete statistical sports betting and analytic information provided by 6 analysts. Join us today and experience the NicksPick advantage. From bank roll builders, straights to jaw-dropping lottos. Let us help make every sports bet rewarding! FAQs How exclusive is the monthly access? How do I get my discord role? Affiliates N Become an affiliate NicksPicks 30% reward Earn money by bringing customers to NicksPicks. Every time a customer purchases using your link, you&#x27;ll earn a commission. NicksPicks Premium $8.00 / week Join $8.00 / week Pay Join Pay Join NicksPicks Premium | Whop",
  "finalUrl": "https://whop.com/monthly-premium-access-0f/weekly-premium-access-65/",
  "fetchedAt": "2025-11-05T10:00:46.697Z",
  "textHash": "c7dea5d8c98c8b6b710b0725d447758a793e1e9dbb291ce65c295f05aa53df6e",
  "drilled": false
}