{
  "baseUrl": "https://whop.com/monthly-premium-access-0f/?a=alexburnett21",
  "title": "NicksPicks | Whop",
  "h1": "NicksPicks",
  "bullets": [
    "Powered by N NicksPicks Complete statistical sports betting and analytic information provided by 6 analysts. Join us today and experience the NicksPick advantage. From bank roll builders, straights to jaw-dropping lottos. Le... More 4.8 ( 102 ) Contact seller Products $10.00 / month Elevate Your Game with Monthly Premium Picks by NicksPicks NicksPicks Premium Monthly 4.3 ( 29 ) Free Try Nick‚Äôs Picks for Free! NicksPicks Free Access 4.9 ( 65 ) $8.00 / week Weekly Wins with Premium Access by NicksPicks üåç NicksPicks Premium 5.0 ( 1 ) $3.00 / day Join for your Daily Dose of Expert Picks! NicksPicks Premium 5.0 ( 4 ) $100.00 / year Year-Long Sports Betting with Major Savings! NicksPicks Premium Yearly New $20.00 / 3 months Join the Top 1% with NicksPicks NicksPicks Quarterly 5.0 ( 1 ) $250.00 Secure Lifetime Wins with One-time Fee from NicksPicks! NicksPicks Lifetime New Unmute $20.00 / month Monthly Access to All VIP Picks Exclusive Monthly Access New Contact seller Reviews R Ri3l ‚Ä¢ NicksPicks Free Access 3 days ago I‚Äôm new Written 1 year after purchase",
    "EB Eric Brass ‚Ä¢ NicksPicks Premium Monthly 2 months ago Hot Written 15 days after purchase",
    "LM Leah Myers ‚Ä¢ NicksPicks Premium Monthly 8 months ago So far so good! Written 1 day after purchase",
    "WC William Coleman ‚Ä¢ NicksPicks Free Access 9 months ago Hands down the best discord out there for the research alone it's worth the price of admission.But the tennis üéæ capper is the best in the GAMEüî•üî•üî• Written 6 days after purchase"
  ],
  "paras": [
    "N NicksPicks Complete statistical sports betting and analytic information provided by 6 analysts. Join us today and experience the NicksPick advantage. From bank roll builders, straights to jaw-dropping lottos. Le... More 4.8 ( 102 ) Contact seller Products $10.00 / month Elevate Your Game with Monthly Premium Picks by NicksPicks NicksPicks Premium Monthly 4.3 ( 29 ) Free Try Nick‚Äôs Picks for Free! NicksPicks Free Access 4.9 ( 65 ) $8.00 / week Weekly Wins with Premium Access by NicksPicks üåç NicksPicks Premium 5.0 ( 1 ) $3.00 / day Join for your Daily Dose of Expert Picks! NicksPicks Premium 5.0 ( 4 ) $100.00 / year Year-Long Sports Betting with Major Savings! NicksPicks Premium Yearly New $20.00 / 3 months Join the Top 1% with NicksPicks NicksPicks Quarterly 5.0 ( 1 ) $250.00 Secure Lifetime Wins with One-time Fee from NicksPicks! NicksPicks Lifetime New Unmute $20.00 / month Monthly Access to All VIP Picks Exclusive Monthly Access New Contact seller Reviews R Ri3l ‚Ä¢ NicksPicks Free Access 3 days ago I‚Äôm new",
    "2 months ago Hot",
    "8 months ago So far so good!",
    "9 months ago Hands down the best discord out there for the research alone it's worth the price of admission.But the tennis üéæ capper is the best in the GAMEüî•üî•üî•"
  ],
  "priceTokens": [
    "$10.00",
    "$8.00",
    "$3.00",
    "$100.00",
    "$20.00",
    "$250.00",
    "$20.00",
    "$1",
    "$1",
    "$1",
    "$21",
    "$1",
    "$1",
    "$1",
    "$1",
    "$28",
    "$1",
    "$28",
    "$28",
    "$28"
  ],
  "faq": [],
  "textSample": "Powered by N NicksPicks Complete statistical sports betting and analytic information provided by 6 analysts. Join us today and experience the NicksPick advantage. From bank roll builders, straights to jaw-dropping lottos. Le... More 4.8 ( 102 ) Contact seller Products $10.00 / month Elevate Your Game with Monthly Premium Picks by NicksPicks NicksPicks Premium Monthly 4.3 ( 29 ) Free Try Nick‚Äôs Picks for Free! NicksPicks Free Access 4.9 ( 65 ) $8.00 / week Weekly Wins with Premium Access by NicksPicks üåç NicksPicks Premium 5.0 ( 1 ) $3.00 / day Join for your Daily Dose of Expert Picks! NicksPicks Premium 5.0 ( 4 ) $100.00 / year Year-Long Sports Betting with Major Savings! NicksPicks Premium Yearly New $20.00 / 3 months Join the Top 1% with NicksPicks NicksPicks Quarterly 5.0 ( 1 ) $250.00 Secure Lifetime Wins with One-time Fee from NicksPicks! NicksPicks Lifetime New Unmute $20.00 / month Monthly Access to All VIP Picks Exclusive Monthly Access New Contact seller Reviews R Ri3l ‚Ä¢ NicksPicks Free Access 3 days ago I‚Äôm new Written 1 year after purchase EB Eric Brass ‚Ä¢ NicksPicks Premium Monthly 2 months ago Hot Written 15 days after purchase LM Leah Myers ‚Ä¢ NicksPicks Premium Monthly 8 months ago So far so good! Written 1 day after purchase WC William Coleman ‚Ä¢ NicksPicks Free Access 9 months ago Hands down the best discord out there for the research alone it's worth the price of admission.But the tennis üéæ capper is the best in the GAMEüî•üî•üî• Written 6 days after purchase See all reviews NicksPicks | Whop",
  "finalUrl": "https://whop.com/monthly-premium-access-0f/?a=alexburnett21",
  "fetchedAt": "2025-11-05T09:19:09.408Z",
  "textHash": "d9190e47ebac0f7d9468a8cd8d2613b92ff823b80cf0ea3cd2a8200f053bd754",
  "drilled": false
}