{
  "baseUrl": "https://whop.com/nighteye-agency/nighteye-agency/?a=alexburnett21",
  "title": "Nighteye Agency | Whop",
  "h1": "Nighteye Agency",
  "bullets": [
    "Sign in NA Nighteye Agency My goal? To help YOU make as much money as possible! Other I will provide daily indepth and well-researched plays, and we will continue to aim for profitable futures! $6.99 / week Pay Get access Join 1 member Features Weekly Free Plays",
    "Free POTD (Play Of The Day)",
    "Giveaways",
    "Daily and Monthly Recaps"
  ],
  "paras": [
    "Sign in NA Nighteye Agency My goal? To help YOU make as much money as possible! Other I will provide daily indepth and well-researched plays, and we will continue to aim for profitable futures!",
    "$6.99 / week Pay Get access Join 1 member Features Weekly Free Plays Free POTD (Play Of The Day) Giveaways Daily and Monthly Recaps About the creator S View profile sanighteye @ sanighteye • Joined Mar 2025 I have been part of the eSports betting community since 2022 and I will continue to provide indepth and well researched plays to help YOU make as much money as possible! Affiliates NA Become an affiliate Nighteye Agency 30% reward Earn money by bringing customers to Nighteye Agency. Every time a customer purchases using your link, you&#x27;ll earn a commission."
  ],
  "priceTokens": [
    "$6.99",
    "$6.99",
    "$6.99",
    "$1",
    "$1",
    "$1",
    "$23",
    "$1",
    "$1",
    "$1",
    "$1",
    "$1",
    "$2",
    "$1",
    "$2",
    "$2",
    "$2",
    "$2",
    "$3",
    "$3"
  ],
  "faq": [],
  "textSample": "Sign in NA Nighteye Agency My goal? To help YOU make as much money as possible! Other I will provide daily indepth and well-researched plays, and we will continue to aim for profitable futures! $6.99 / week Pay Get access Join 1 member Features Weekly Free Plays Free POTD (Play Of The Day) Giveaways Daily and Monthly Recaps About the creator S View profile sanighteye @ sanighteye • Joined Mar 2025 I have been part of the eSports betting community since 2022 and I will continue to provide indepth and well researched plays to help YOU make as much money as possible! Affiliates NA Become an affiliate Nighteye Agency 30% reward Earn money by bringing customers to Nighteye Agency. Every time a customer purchases using your link, you&#x27;ll earn a commission. Nighteye Agency $6.99 / week +5 options Get access $6.99 / week 5 options Pay Get access Pay Get access Nighteye Agency | Whop",
  "finalUrl": "https://whop.com/nighteye-agency/nighteye-agency/?a=alexburnett21",
  "fetchedAt": "2025-11-04T20:15:18.854Z",
  "textHash": "9a95f18b2f6abebdca65b05ab326c3a313dc838e884345ce044ec019257d78b1",
  "drilled": true
}