{
  "baseUrl": "https://whop.com/novahittas/novahittas/?a=alexburnett21",
  "title": "NOVAHITTAS | Whop",
  "h1": "NOVAHITTAS",
  "bullets": [
    "Sign in N NOVAHITTAS NovaHittas: Expert Sports Betting &amp; Winning Community 5.0 ( 5 ) Other Welcome to NovaHittas, your go-to sports betting community! Expert analysis, insider tips, and a supportive group of fans‚Äîjoin us to turn passion into winning strategies! $15.00 / week Pay Subscribe Join 3 members Features Affordable Access",
    "Active Community",
    "Exclusive Content",
    "Interactive Events",
    "OG Oscar Gavina 9 months ago Best sports betting community in the game. Never a month without profitüèÜ Written 1 day after purchase",
    "JC Josue Campoverde 9 months ago Great community! Been making daily profit ever since I joined this community! Written 4 minutes after purchase",
    "BE Brando Esquivel 9 months ago One of the best communities out there for sure, I have been in other communities before but nova is on a different level!! Written 10 days after purchase",
    "T tuffmoonman 9 months ago Great community that has you winning every day ! Written 7 days after purchase"
  ],
  "paras": [
    "Sign in N NOVAHITTAS NovaHittas: Expert Sports Betting &amp; Winning Community 5.0 ( 5 ) Other Welcome to NovaHittas, your go-to sports betting community! Expert analysis, insider tips, and a supportive group of fans‚Äîjoin us to turn passion into winning strategies!",
    "$15.00 / week Pay Subscribe Join 3 members Features Affordable Access Active Community Exclusive Content Interactive Events Reviews 5 out of 5 5 total reviews 5 stars 4 stars 3 stars 2 stars 1 star OG Oscar Gavina 9 months ago Best sports betting community in the game. Never a month without profitüèÜ",
    "9 months ago Great community! Been making daily profit ever since I joined this community!",
    "9 months ago One of the best communities out there for sure, I have been in other communities before but nova is on a different level!!",
    "9 months ago Great community that has you winning every day !",
    "About the creator R View profile Reborn @ reborn22 ‚Ä¢ Joined Oct 2022 FAQs What is the refund policy? Why should I join a betting Discord instead of betting alone? How do I get started in your betting Discord? What kind of sports do you cover? Affiliates N Become an affiliate NOVAHITTAS 5% reward Earn money by bringing customers to NOVAHITTAS. Every time a customer purchases using your link, you&#x27;ll earn a commission."
  ],
  "priceTokens": [
    "$15.00",
    "$15.00",
    "$15.00",
    "$1",
    "$1",
    "$1",
    "$23",
    "$1",
    "$1",
    "$1",
    "$1",
    "$1",
    "$2",
    "$1",
    "$2",
    "$2",
    "$2",
    "$2",
    "$3",
    "$3"
  ],
  "faq": [],
  "textSample": "Sign in N NOVAHITTAS NovaHittas: Expert Sports Betting &amp; Winning Community 5.0 ( 5 ) Other Welcome to NovaHittas, your go-to sports betting community! Expert analysis, insider tips, and a supportive group of fans‚Äîjoin us to turn passion into winning strategies! $15.00 / week Pay Subscribe Join 3 members Features Affordable Access Active Community Exclusive Content Interactive Events Reviews 5 out of 5 5 total reviews 5 stars 4 stars 3 stars 2 stars 1 star OG Oscar Gavina 9 months ago Best sports betting community in the game. Never a month without profitüèÜ Written 1 day after purchase JC Josue Campoverde 9 months ago Great community! Been making daily profit ever since I joined this community! Written 4 minutes after purchase BE Brando Esquivel 9 months ago One of the best communities out there for sure, I have been in other communities before but nova is on a different level!! Written 10 days after purchase T tuffmoonman 9 months ago Great community that has you winning every day ! Written 7 days after purchase See all reviews About the creator R View profile Reborn @ reborn22 ‚Ä¢ Joined Oct 2022 FAQs What is the refund policy? Why should I join a betting Discord instead of betting alone? How do I get started in your betting Discord? What kind of sports do you cover? Affiliates N Become an affiliate NOVAHITTAS 5% reward Earn money by bringing customers to NOVAHITTAS. Every time a customer purchases using your link, you&#x27;ll earn a commission. NOVAHITTAS $15.00 / week +1 option Subscribe $15.00 / week 1 option Pay Subscribe Pay Subscribe NOVAHITTAS | Whop",
  "finalUrl": "https://whop.com/novahittas/novahittas/?a=alexburnett21",
  "fetchedAt": "2025-11-05T10:47:01.530Z",
  "textHash": "4385a6aa3324babf39494ee8aa6846292972ee21b567b21d1a08ffdd8f41c63a",
  "drilled": true
}