{
  "baseUrl": "https://whop.com/nycalert/?a=alexburnett21",
  "title": "NYCAlert | Whop",
  "h1": "NYCAlert",
  "bullets": [
    "Powered by N NYCAlert I&#x27;ve built NYCAlert to be a supportive community for resellers, offering premium in-store and online info. Our experienced team and active members are dedicated to helping you succeed in securing limi... More 5.0 ( 8 ) Contact seller Products $50.00 / month Join the NYCAlert Community NYCAlert Pass 5.0 ( 8 ) Contact seller Reviews S SneakerResellers 2 years ago 100% worth it, been in this group over a year and it’s costed me around $800 for the 16 months i’ve been there, but it was worth it, there was months where I multiplied that $50 a month by 20x with the profitable loops the staff members would post for us Written 8 months after purchase",
    "M Mod 2 years ago Amazing server, couldn’t ask for a better instore/online group the provides the best information day in and day out. Written 1 year after purchase",
    "O Oxalv 2 years ago Amazing group, amazing resources and help. Couldn't ask for more. Written 2 years after purchase",
    "L Levu95 2 years ago Amazing info provided and great staff Written 1 year after purchase"
  ],
  "paras": [
    "N NYCAlert I&#x27;ve built NYCAlert to be a supportive community for resellers, offering premium in-store and online info. Our experienced team and active members are dedicated to helping you succeed in securing limi... More 5.0 ( 8 ) Contact seller Products $50.00 / month Join the NYCAlert Community NYCAlert Pass 5.0 ( 8 ) Contact seller Reviews S SneakerResellers 2 years ago 100% worth it, been in this group over a year and it’s costed me around $800 for the 16 months i’ve been there, but it was worth it, there was months where I multiplied that $50 a month by 20x with the profitable loops the staff members would post for us",
    "2 years ago Amazing server, couldn’t ask for a better instore/online group the provides the best information day in and day out.",
    "2 years ago Amazing group, amazing resources and help. Couldn't ask for more.",
    "2 years ago Amazing info provided and great staff"
  ],
  "priceTokens": [
    "$50.00",
    "$800",
    "$50",
    "$1",
    "$1",
    "$1",
    "$21",
    "$1",
    "$1",
    "$1",
    "$1",
    "$28",
    "$1",
    "$28",
    "$28",
    "$28",
    "$28",
    "$3",
    "$3",
    "$3"
  ],
  "faq": [],
  "textSample": "Powered by N NYCAlert I&#x27;ve built NYCAlert to be a supportive community for resellers, offering premium in-store and online info. Our experienced team and active members are dedicated to helping you succeed in securing limi... More 5.0 ( 8 ) Contact seller Products $50.00 / month Join the NYCAlert Community NYCAlert Pass 5.0 ( 8 ) Contact seller Reviews S SneakerResellers 2 years ago 100% worth it, been in this group over a year and it’s costed me around $800 for the 16 months i’ve been there, but it was worth it, there was months where I multiplied that $50 a month by 20x with the profitable loops the staff members would post for us Written 8 months after purchase M Mod 2 years ago Amazing server, couldn’t ask for a better instore/online group the provides the best information day in and day out. Written 1 year after purchase O Oxalv 2 years ago Amazing group, amazing resources and help. Couldn't ask for more. Written 2 years after purchase L Levu95 2 years ago Amazing info provided and great staff Written 1 year after purchase See all reviews NYCAlert | Whop",
  "finalUrl": "https://whop.com/nycalert/?a=alexburnett21",
  "fetchedAt": "2025-11-05T17:29:36.445Z",
  "textHash": "8475e4878abbe7d5ecfed4635277b57ebd8c14579aba3cea9ba1aeb511430b57",
  "drilled": false
}