{
  "baseUrl": "https://whop.com/exclusive-33/?a=alexburnett21",
  "title": "OceanAIO | Whop",
  "h1": "OceanAIO",
  "bullets": [
    "Powered by O OceanAIO Having dedicated my life to creating value, I designed OceanAIO Exclusive+ for those who seek to excel. This package combines my passion for guidance and innovation, ensuring you have the tools and su... More 5.0 ( 7 ) Contact seller Products $39.99 / month Maximize your profits with Exclusive+! OceanAIO Exclusive+ 5.0 ( 4 ) $19.99 / month OceanAIO Premium OceanAIO Premium 5.0 ( 3 ) Contact seller Reviews R Rkic • OceanAIO Exclusive+ 1 year ago Best group to make money Written 9 days after purchase",
    "ZG Zhane Garcia • OceanAIO Exclusive+ 1 year ago Best group to make some money with a awesome owner who cares and will help. Highly recommend to be honest! Written 6 days after purchase",
    "BA Before And After • OceanAIO Premium 1 year ago Been here since 2021, greatest group out there with helpful guides and quick support. Written 5 days after purchase",
    "S SecThreat • OceanAIO Premium 1 year ago Great server with a lot of helpful and informative guides and an overall good community Written 6 days after purchase"
  ],
  "paras": [
    "O OceanAIO Having dedicated my life to creating value, I designed OceanAIO Exclusive+ for those who seek to excel. This package combines my passion for guidance and innovation, ensuring you have the tools and su... More 5.0 ( 7 ) Contact seller Products $39.99 / month Maximize your profits with Exclusive+! OceanAIO Exclusive+ 5.0 ( 4 ) $19.99 / month OceanAIO Premium OceanAIO Premium 5.0 ( 3 ) Contact seller Reviews R Rkic • OceanAIO Exclusive+ 1 year ago Best group to make money",
    "1 year ago Best group to make some money with a awesome owner who cares and will help. Highly recommend to be honest!",
    "1 year ago Been here since 2021, greatest group out there with helpful guides and quick support.",
    "1 year ago Great server with a lot of helpful and informative guides and an overall good community"
  ],
  "priceTokens": [
    "$39.99",
    "$19.99",
    "$1",
    "$1",
    "$1",
    "$21",
    "$1",
    "$1",
    "$1",
    "$1",
    "$28",
    "$1",
    "$28",
    "$28",
    "$28",
    "$28",
    "$3",
    "$3",
    "$3",
    "$10"
  ],
  "faq": [],
  "textSample": "Powered by O OceanAIO Having dedicated my life to creating value, I designed OceanAIO Exclusive+ for those who seek to excel. This package combines my passion for guidance and innovation, ensuring you have the tools and su... More 5.0 ( 7 ) Contact seller Products $39.99 / month Maximize your profits with Exclusive+! OceanAIO Exclusive+ 5.0 ( 4 ) $19.99 / month OceanAIO Premium OceanAIO Premium 5.0 ( 3 ) Contact seller Reviews R Rkic • OceanAIO Exclusive+ 1 year ago Best group to make money Written 9 days after purchase ZG Zhane Garcia • OceanAIO Exclusive+ 1 year ago Best group to make some money with a awesome owner who cares and will help. Highly recommend to be honest! Written 6 days after purchase BA Before And After • OceanAIO Premium 1 year ago Been here since 2021, greatest group out there with helpful guides and quick support. Written 5 days after purchase S SecThreat • OceanAIO Premium 1 year ago Great server with a lot of helpful and informative guides and an overall good community Written 6 days after purchase See all reviews OceanAIO | Whop",
  "finalUrl": "https://whop.com/exclusive-33/?a=alexburnett21",
  "fetchedAt": "2025-11-04T21:57:35.275Z",
  "textHash": "349a7863d0badf01506278e65ed09af5ab74c31fd7cf5fcd58ffe3d0a396969e",
  "drilled": false
}