{
  "baseUrl": "https://whop.com/adamoption/adambot/",
  "title": "One Trade System | Whop",
  "h1": "One Trade System",
  "bullets": [
    "Sign in OS One Trade System Elevate Your Trading With Our One Trade System 4.9 ( 123 ) Trading The Ultimate SPY/QQQ Options Trading System - Join Our Exclusive Community &amp; Weekly LIVE Trading Sessions! $199.00 / month 3 day trial Pay Join Features Real-Time Trade Alerts — 90%+ Win Rate!",
    "Recommended for traders with small accounts and full-time jobs who can’t watch the market closely",
    "Weekly Podcast / Trades Recaps",
    "A very easy trading system anyone can use",
    "One high-quality trade per day (10–11 AM EST) / One swing trade per week",
    "KP Karen poh 7 months ago Adam has always been consistent in day trading and to me that's the most important reason why I'm following the bot and learning from him. Written 2 years after purchase",
    "Z zack 7 months ago I have been using this bot for over a year now, it has had a lot of changes since the beginning, but I have serious confidence in it now after all the testing Adam has done with the bot. Adam really cares about the performance of this bot and is always looking for improvements. I trade MES/MNQ and t... Show more Written 2 years after purchase",
    "JB Jacob Burkardt 7 months ago This has the best win rate I have seen out of any group or bot. Adam has perfected this bot to execute the most accurate signals. I highly recommend! Written 7 months after purchase",
    "CS Cody Schrader 7 months ago Been trading for two years. This is the best system I’ve seen and Adam provides educational tools for traders to better themselves 10/10 Written 6 days after purchase"
  ],
  "paras": [
    "Sign in OS One Trade System Elevate Your Trading With Our One Trade System 4.9 ( 123 ) Trading The Ultimate SPY/QQQ Options Trading System - Join Our Exclusive Community &amp; Weekly LIVE Trading Sessions!",
    "3 day trial Pay Join Features Real-Time Trade Alerts — 90%+ Win Rate! Recommended for traders with small accounts and full-time jobs who can’t watch the market closely Weekly Podcast / Trades Recaps A very easy trading system anyone can use One high-quality trade per day (10–11 AM EST) / One swing trade per week Reviews 4.90 out of 5 123 total reviews 5 stars 4 stars 3 stars 2 stars 1 star KP Karen poh 7 months ago Adam has always been consistent in day trading and to me that's the most important reason why I'm following the bot and learning from him.",
    "7 months ago I have been using this bot for over a year now, it has had a lot of changes since the beginning, but I have serious confidence in it now after all the testing Adam has done with the bot. Adam really cares about the performance of this bot and is always looking for improvements. I trade MES/MNQ and t...",
    "Written 2 years after purchase JB Jacob Burkardt 7 months ago This has the best win rate I have seen out of any group or bot. Adam has perfected this bot to execute the most accurate signals. I highly recommend!",
    "7 months ago Been trading for two years. This is the best system I’ve seen and Adam provides educational tools for traders to better themselves 10/10",
    "About the creator A View profile ADAM @ adamtrades • Joined Jun 2023 Hello everyone, my name is Adam. I&#x27;ve been trading for 14 years. I created this trading system to help traders with small accounts grow their capital, and also for those who have a day job but want to make extra weekly income without watching charts all day. Professional traders can also use it as an additional confirmation tool, because this system reads market direction very accurately FAQs Which Tickers You Trade ? What are the One Trade System ? Cancellation and refund policy Can I trade futures with it? What is the win rate of the bot? Affiliates OS Become an affiliate One Trade System 10% reward Earn money by bringing customers to One Trade System. Every time a customer purchases using your link, you&#x27;ll earn a commission."
  ],
  "priceTokens": [
    "$199.00",
    "$199.00",
    "$199.00",
    "$1",
    "$1",
    "$1",
    "$22",
    "$1",
    "$1",
    "$1",
    "$1",
    "$1",
    "$2",
    "$1",
    "$2",
    "$2",
    "$2",
    "$2",
    "$3",
    "$3"
  ],
  "faq": [],
  "textSample": "Sign in OS One Trade System Elevate Your Trading With Our One Trade System 4.9 ( 123 ) Trading The Ultimate SPY/QQQ Options Trading System - Join Our Exclusive Community &amp; Weekly LIVE Trading Sessions! $199.00 / month 3 day trial Pay Join Features Real-Time Trade Alerts — 90%+ Win Rate! Recommended for traders with small accounts and full-time jobs who can’t watch the market closely Weekly Podcast / Trades Recaps A very easy trading system anyone can use One high-quality trade per day (10–11 AM EST) / One swing trade per week Reviews 4.90 out of 5 123 total reviews 5 stars 4 stars 3 stars 2 stars 1 star KP Karen poh 7 months ago Adam has always been consistent in day trading and to me that's the most important reason why I'm following the bot and learning from him. Written 2 years after purchase Z zack 7 months ago I have been using this bot for over a year now, it has had a lot of changes since the beginning, but I have serious confidence in it now after all the testing Adam has done with the bot. Adam really cares about the performance of this bot and is always looking for improvements. I trade MES/MNQ and t... Show more Written 2 years after purchase JB Jacob Burkardt 7 months ago This has the best win rate I have seen out of any group or bot. Adam has perfected this bot to execute the most accurate signals. I highly recommend! Written 7 months after purchase CS Cody Schrader 7 months ago Been trading for two years. This is the best system I’ve seen and Adam provides educational tools for traders to better themselves 10/10 Written 6 days after purchase See all reviews About the creator A View profile ADAM @ adamtrades • Joined Jun 2023 Hello everyone, my name is Adam. I&#x27;ve been trading for 14 years. I created this trading system to help traders with small accounts grow their capital, and also for those who have a day job but want to make extra weekly income without watching charts all day. Professional traders can also use it as an additional confirmation tool, because this system reads market direction very accurately FAQs Which Tickers You Trade ? What are the One Trade System ? Cancellation and refund policy Can I trade futures with it? What is the win rate of the bot? Affiliates OS Become an affiliate One Trade System 10% reward Earn money by bringing customers to One Trade System. Every time a customer purchases using your link, you&#x27;ll earn a commission. One Trade System $199.00 / month Join $199.00 / month Pay Join Pay Join One Trade System | Whop",
  "finalUrl": "https://whop.com/adamoption/adambot/",
  "fetchedAt": "2025-11-05T09:49:16.963Z",
  "textHash": "2eeb187be4ecae052d07731316b1e339e92c00d8e754ef9e594613f0f2de75c3",
  "drilled": false
}