{
  "baseUrl": "https://whop.com/operatorlabs/?a=alexburnett21",
  "title": "Operator Labs | Whop",
  "h1": "Operator Labs",
  "bullets": [
    "Powered by OL Operator Labs i build + scale info products for creators. I&#x27;ve helped creators to consistent 5/6 figure months and I&#x27;ve built Operator Labs to teach you the exact systems, strategies &amp; tools I&#x27;ve perfected over my ... More 4.7 ( 27 ) Contact seller Products Unmute Free Ultimate Growth Operating Community Operator Labs FREE 4.0 ( 7 ) Unmute $97.00 / month Scale to $10K+ Months with Proven Growth Systems! Operator Labs 5.0 ( 20 ) Scale to $20K in 12 Weeks With A Info Client Operator Accelerator New Contact seller Reviews D Dan • Operator Labs 25 days ago Bro Mason is actually a G. Plus the GHL accounts literally pay for the membership Written 4 months after purchase",
    "CM Chingakham Manish • Operator Labs 2 months ago if you're not joining then you are loosing alot Written 8 months after purchase",
    "FF Fidel Fondem • Operator Labs 4 months ago Went from skimming through YT tutorials and communities to now being able to instead focus on mastering the skill and acquiring clients. Everyone in there is hungry and constantly getting crazy results. You won't regret haven tried it. Written 2 months after purchase",
    "TK Tymek Karecki • Operator Labs 9 months ago The best community for growth operators. Mason is always here for you to help you and you get a LOT of value and sauce inside. Highly recommend! Written 1 month after purchase"
  ],
  "paras": [
    "OL Operator Labs i build + scale info products for creators. I&#x27;ve helped creators to consistent 5/6 figure months and I&#x27;ve built Operator Labs to teach you the exact systems, strategies &amp; tools I&#x27;ve perfected over my ... More 4.7 ( 27 ) Contact seller Products Unmute Free Ultimate Growth Operating Community Operator Labs FREE 4.0 ( 7 ) Unmute $97.00 / month Scale to $10K+ Months with Proven Growth Systems! Operator Labs 5.0 ( 20 ) Scale to $20K in 12 Weeks With A Info Client Operator Accelerator New Contact seller Reviews D Dan • Operator Labs 25 days ago Bro Mason is actually a G. Plus the GHL accounts literally pay for the membership",
    "2 months ago if you're not joining then you are loosing alot",
    "4 months ago Went from skimming through YT tutorials and communities to now being able to instead focus on mastering the skill and acquiring clients. Everyone in there is hungry and constantly getting crazy results. You won't regret haven tried it.",
    "9 months ago The best community for growth operators. Mason is always here for you to help you and you get a LOT of value and sauce inside. Highly recommend!"
  ],
  "priceTokens": [
    "$97.00",
    "$10",
    "$20",
    "$1",
    "$1",
    "$1",
    "$21",
    "$1",
    "$1",
    "$1",
    "$1",
    "$28",
    "$1",
    "$28",
    "$28",
    "$28",
    "$28",
    "$3",
    "$3",
    "$3"
  ],
  "faq": [],
  "textSample": "Powered by OL Operator Labs i build + scale info products for creators. I&#x27;ve helped creators to consistent 5/6 figure months and I&#x27;ve built Operator Labs to teach you the exact systems, strategies &amp; tools I&#x27;ve perfected over my ... More 4.7 ( 27 ) Contact seller Products Unmute Free Ultimate Growth Operating Community Operator Labs FREE 4.0 ( 7 ) Unmute $97.00 / month Scale to $10K+ Months with Proven Growth Systems! Operator Labs 5.0 ( 20 ) Scale to $20K in 12 Weeks With A Info Client Operator Accelerator New Contact seller Reviews D Dan • Operator Labs 25 days ago Bro Mason is actually a G. Plus the GHL accounts literally pay for the membership Written 4 months after purchase CM Chingakham Manish • Operator Labs 2 months ago if you're not joining then you are loosing alot Written 8 months after purchase FF Fidel Fondem • Operator Labs 4 months ago Went from skimming through YT tutorials and communities to now being able to instead focus on mastering the skill and acquiring clients. Everyone in there is hungry and constantly getting crazy results. You won't regret haven tried it. Written 2 months after purchase TK Tymek Karecki • Operator Labs 9 months ago The best community for growth operators. Mason is always here for you to help you and you get a LOT of value and sauce inside. Highly recommend! Written 1 month after purchase See all reviews Operator Labs | Whop",
  "finalUrl": "https://whop.com/operatorlabs/?a=alexburnett21",
  "fetchedAt": "2025-11-05T09:55:21.890Z",
  "textHash": "45bbe9866074e4b8fb16afffc7852c8b1e084b1853fdd8422395c3588334416e",
  "drilled": false
}