{
  "baseUrl": "https://whop.com/premium-membership-7e-8c6f/oracle-insight-s-qt-indicator/",
  "title": "Oracle Insight&#x27;s QT Indicator | Whop",
  "h1": "Oracle Insight&#x27;s QT Indicator",
  "bullets": [
    "Sign in OI Oracle Insight&#x27;s QT Indicator All-in-one Quarterly Theory indicator. 5.0 ( 42 ) Trading An all-in-one Quarterly Theory indicator that highlights all the important QT concepts, making trading easier and more efficient with clear insights and automation. $25.00 / month 3 day trial Pay Join Features Highlights important QT concepts - SSMT, PSPs, PSCs, True Opens, DFR + more",
    "Apply the indicator to every single market; Futures, FX, Commodities, etc",
    "View all cycles from monthly-micro",
    "Fully automate your trading, let the indicator do all the hard work",
    "Great for getting a deeper understanding on QT concepts",
    "T TL 17 days ago Bucko has excellent knowledge on QT and has helped add clarity and conviction to my trading Written 4 days after purchase",
    "O OSAMA 22 days ago Best information Written 2 days after purchase",
    "R relle0074 1 month ago Has given me more clarity on my trading analysis and taken the emotion out it all. Finally an uncomplicated way to trade and so well explained and supported. Thank you Written 3 months after purchase",
    "P PmacTrades 1 month ago Bucko is the absolute GOAT, I have learned so much important information from him and now trading with QT concepts have become so much more clear. Forever grateful for his teachings! Written 1 month after purchase"
  ],
  "paras": [
    "Sign in OI Oracle Insight&#x27;s QT Indicator All-in-one Quarterly Theory indicator. 5.0 ( 42 ) Trading An all-in-one Quarterly Theory indicator that highlights all the important QT concepts, making trading easier and more efficient with clear insights and automation.",
    "$25.00 / month 3 day trial Pay Join Features Highlights important QT concepts - SSMT, PSPs, PSCs, True Opens, DFR + more Apply the indicator to every single market; Futures, FX, Commodities, etc View all cycles from monthly-micro Fully automate your trading, let the indicator do all the hard work Great for getting a deeper understanding on QT concepts Reviews 5 out of 5 42 total reviews 5 stars 4 stars 3 stars 2 stars 1 star T TL 17 days ago Bucko has excellent knowledge on QT and has helped add clarity and conviction to my trading",
    "22 days ago Best information",
    "1 month ago Has given me more clarity on my trading analysis and taken the emotion out it all. Finally an uncomplicated way to trade and so well explained and supported. Thank you",
    "1 month ago Bucko is the absolute GOAT, I have learned so much important information from him and now trading with QT concepts have become so much more clear. Forever grateful for his teachings!",
    "About the creator B View profile bucko @ buckotrades • Joined Jan 2023 I’m a dedicated trader with years of experience, offering an exclusive teaching service to help you succeed in the markets. Whether you&#x27;re a beginner or experienced, I&#x27;ll guide you through proven strategies, risk management, and market analysis. My goal is to equip you with the skills and confidence to consistently win trades and read the markets so you know exactly when and where price will move. FAQs Is Oracle Insight&#x27;s beginner friendly? What is the main goal of Oracle Insights? How often do you give analysis? What assets do your provide analysis for? What time do you live trade? Affiliates OI Become an affiliate Oracle Insights 25% reward Earn money by bringing customers to Oracle Insights. Every time a customer purchases using your link, you&#x27;ll earn a commission."
  ],
  "priceTokens": [
    "$25.00",
    "$25.00",
    "$25.00",
    "$1",
    "$1",
    "$1",
    "$23",
    "$1",
    "$1",
    "$1",
    "$1",
    "$1",
    "$2",
    "$1",
    "$2",
    "$2",
    "$2",
    "$2",
    "$3",
    "$3"
  ],
  "faq": [],
  "textSample": "Sign in OI Oracle Insight&#x27;s QT Indicator All-in-one Quarterly Theory indicator. 5.0 ( 42 ) Trading An all-in-one Quarterly Theory indicator that highlights all the important QT concepts, making trading easier and more efficient with clear insights and automation. $25.00 / month 3 day trial Pay Join Features Highlights important QT concepts - SSMT, PSPs, PSCs, True Opens, DFR + more Apply the indicator to every single market; Futures, FX, Commodities, etc View all cycles from monthly-micro Fully automate your trading, let the indicator do all the hard work Great for getting a deeper understanding on QT concepts Reviews 5 out of 5 42 total reviews 5 stars 4 stars 3 stars 2 stars 1 star T TL 17 days ago Bucko has excellent knowledge on QT and has helped add clarity and conviction to my trading Written 4 days after purchase O OSAMA 22 days ago Best information Written 2 days after purchase R relle0074 1 month ago Has given me more clarity on my trading analysis and taken the emotion out it all. Finally an uncomplicated way to trade and so well explained and supported. Thank you Written 3 months after purchase P PmacTrades 1 month ago Bucko is the absolute GOAT, I have learned so much important information from him and now trading with QT concepts have become so much more clear. Forever grateful for his teachings! Written 1 month after purchase See all reviews About the creator B View profile bucko @ buckotrades • Joined Jan 2023 I’m a dedicated trader with years of experience, offering an exclusive teaching service to help you succeed in the markets. Whether you&#x27;re a beginner or experienced, I&#x27;ll guide you through proven strategies, risk management, and market analysis. My goal is to equip you with the skills and confidence to consistently win trades and read the markets so you know exactly when and where price will move. FAQs Is Oracle Insight&#x27;s beginner friendly? What is the main goal of Oracle Insights? How often do you give analysis? What assets do your provide analysis for? What time do you live trade? Affiliates OI Become an affiliate Oracle Insights 25% reward Earn money by bringing customers to Oracle Insights. Every time a customer purchases using your link, you&#x27;ll earn a commission. Oracle Insight&#x27;s QT Indicator $25.00 / month +1 option Join $25.00 / month 1 option Pay Join Pay Join Oracle Insight&#x27;s QT Indicator | Whop",
  "finalUrl": "https://whop.com/premium-membership-7e-8c6f/oracle-insight-s-qt-indicator/",
  "fetchedAt": "2025-11-04T21:46:10.309Z",
  "textHash": "88334b8a2d5aad3f14810df2682db286c2588f91eea5426468c96de2c642c553",
  "drilled": false
}