{
  "baseUrl": "https://whop.com/sharpmoney/origination/",
  "title": "SharpMoney VIP | Whop",
  "h1": "SharpMoney VIP",
  "bullets": [
    "SharpMoney VIP | Whop Sign in Unmute Unmute Unmute Unmute S SharpMoney VIP Proprietary, bottom-up originated plays shipped daily! 5.0 ( 86 ) Sports betting Join this exclusive group at SharpMoney, and find profitable bets using our models and projections from SigmaSquirrel (SigmaBet) MathWins and ClosingDime $59.99 / week Pay Join Features Originated, model-based plays shipped daily to members",
    "Bet lines with value BEFORE the EV apps find them - generate massive edges",
    "&quot;The Grind&quot; - NBA and WNBA Props, Sides and Totals from MathWins",
    "&quot;SigmaBet&quot; - NFL Props, Sides and Totals + NBA Props from SigmaSquirrel",
    "Access to our most experience, highest-volume members in VIP-only chat",
    "TB Todd Buckholt 15 days ago In my first 3 months of using Sharp Money, I profited more than I had in the previous 9 months as a square bettor. The tools are amazingly helpful, but the commitment to educating and developing smarter betting habits is invaluable. Highly recommend to anyone looking to become a winning sports betto... Show more Written 2 months after purchase",
    "L LetsGoSquale 15 days ago The Sharp Money Discord changed my life. In only 3 months I have profit over 20k God bless Written 4 months after purchase",
    "RP Rob Purchase 16 days ago VIP & +EV Bundle member. I can't say enough about the Sharp Money team, its been a great ride, and will continue to be great. VIP with ClosingDime, MathWins, and Sigma has been phenomenal; its great because they post the plays and what range of odds to take those plays at. All we have to do is us... Show more Written 3 months after purchase",
    "NC Nicholas Cobb 17 days ago VIP subscription is where it’s at if you’re ready to take your getting to the next level! With 3 phenomenal originators in Closing Dime, MathWins and SigmaSquirrel, you get a diverse portfolio of plays from the entire team. There’s no better time to join than NOW - we are in the pinnacle of sports w... Show more Written 1 year after purchase"
  ],
  "paras": [
    "Sign in Unmute Unmute Unmute Unmute S SharpMoney VIP Proprietary, bottom-up originated plays shipped daily! 5.0 ( 86 ) Sports betting Join this exclusive group at SharpMoney, and find profitable bets using our models and projections from SigmaSquirrel (SigmaBet) MathWins and ClosingDime",
    "$59.99 / week Pay Join Features Originated, model-based plays shipped daily to members Bet lines with value BEFORE the EV apps find them - generate massive edges &quot;The Grind&quot; - NBA and WNBA Props, Sides and Totals from MathWins &quot;SigmaBet&quot; - NFL Props, Sides and Totals + NBA Props from SigmaSquirrel Access to our most experience, highest-volume members in VIP-only chat Reviews 5 out of 5 86 total reviews 5 stars 4 stars 3 stars 2 stars 1 star TB Todd Buckholt 15 days ago In my first 3 months of using Sharp Money, I profited more than I had in the previous 9 months as a square bettor. The tools are amazingly helpful, but the commitment to educating and developing smarter betting habits is invaluable. Highly recommend to anyone looking to become a winning sports betto...",
    "Written 2 months after purchase L LetsGoSquale 15 days ago The Sharp Money Discord changed my life. In only 3 months I have profit over 20k God bless",
    "16 days ago VIP & +EV Bundle member. I can't say enough about the Sharp Money team, its been a great ride, and will continue to be great. VIP with ClosingDime, MathWins, and Sigma has been phenomenal; its great because they post the plays and what range of odds to take those plays at. All we have to do is us...",
    "Written 3 months after purchase NC Nicholas Cobb 17 days ago VIP subscription is where it’s at if you’re ready to take your getting to the next level! With 3 phenomenal originators in Closing Dime, MathWins and SigmaSquirrel, you get a diverse portfolio of plays from the entire team. There’s no better time to join than NOW - we are in the pinnacle of sports w..."
  ],
  "priceTokens": [
    "$59.99",
    "$59.99",
    "$59.99",
    "$1",
    "$1",
    "$1",
    "$22",
    "$1",
    "$1",
    "$1",
    "$1",
    "$1",
    "$2",
    "$1",
    "$2",
    "$2",
    "$2",
    "$2",
    "$3",
    "$3"
  ],
  "faq": [],
  "textSample": "SharpMoney VIP | Whop Sign in Unmute Unmute Unmute Unmute S SharpMoney VIP Proprietary, bottom-up originated plays shipped daily! 5.0 ( 86 ) Sports betting Join this exclusive group at SharpMoney, and find profitable bets using our models and projections from SigmaSquirrel (SigmaBet) MathWins and ClosingDime $59.99 / week Pay Join Features Originated, model-based plays shipped daily to members Bet lines with value BEFORE the EV apps find them - generate massive edges &quot;The Grind&quot; - NBA and WNBA Props, Sides and Totals from MathWins &quot;SigmaBet&quot; - NFL Props, Sides and Totals + NBA Props from SigmaSquirrel Access to our most experience, highest-volume members in VIP-only chat Reviews 5 out of 5 86 total reviews 5 stars 4 stars 3 stars 2 stars 1 star TB Todd Buckholt 15 days ago In my first 3 months of using Sharp Money, I profited more than I had in the previous 9 months as a square bettor. The tools are amazingly helpful, but the commitment to educating and developing smarter betting habits is invaluable. Highly recommend to anyone looking to become a winning sports betto... Show more Written 2 months after purchase L LetsGoSquale 15 days ago The Sharp Money Discord changed my life. In only 3 months I have profit over 20k God bless Written 4 months after purchase RP Rob Purchase 16 days ago VIP & +EV Bundle member. I can't say enough about the Sharp Money team, its been a great ride, and will continue to be great. VIP with ClosingDime, MathWins, and Sigma has been phenomenal; its great because they post the plays and what range of odds to take those plays at. All we have to do is us... Show more Written 3 months after purchase NC Nicholas Cobb 17 days ago VIP subscription is where it’s at if you’re ready to take your getting to the next level! With 3 phenomenal originators in Closing Dime, MathWins and SigmaSquirrel, you get a diverse portfolio of plays from the entire team. There’s no better time to join than NOW - we are in the pinnacle of sports w... Show more Written 1 year after purchase See all reviews About the creator S View profile SharpMoney @ sharpmoneydiscord • Joined Mar 2024 +EV Betting Bots and VIP Picks SharpMoney VIP $59.99 / week +2 options Join $59.99 / week 2 options Pay Join Pay Join",
  "finalUrl": "https://whop.com/sharpmoney/origination/",
  "fetchedAt": "2025-11-04T20:00:39.334Z",
  "textHash": "c95fc7112dc69b49aac324c9822ebb4a3661f07fe9cd72c2cae47c58c3226d52",
  "drilled": false
}