{
  "baseUrl": "https://whop.com/otc-bot/?a=alexburnett21",
  "title": "Hype Automation | Whop",
  "h1": "Hype Automation",
  "bullets": [
    "Powered by HA Hype Automation I&#x27;ve dedicated my career to simplifying savings. With Hype Automation, I bring you the OTC Bot, designed to automate couponing and maximize your free product gains effortlessly. 4.7 ( 12 ) Contact seller Products Free Join Hype Automation Discord Free! Hype Automation Free Access 4.2 ( 5 ) $5.00 / month Free trial Unlock Industry-Leading Monitors Hype Automation Monitor 5.0 ( 1 ) Automate your savings effortlessly otc New $29.00 / month Save on Daily Purchases with Automated Code Generation! otc-bot 5.0 ( 4 ) Contact seller Reviews DP Dana Pink • otc-bot 9 months ago This bot is a game changer makes it super easy to earn money, and the dev is a very helpful Written 16 days after purchase",
    "G G1 • otc-bot 9 months ago Easiest money i've made, tons of support too for newer members Written 16 days after purchase",
    "FG Fernando Garcia • otc-bot 9 months ago Really easy way to make and save money with this! Written 21 days after purchase",
    "S shrock8 • otc-bot 9 months ago The easiest money I have ever made for real the owner is super helpful, and bot is extremely user friendly my favorite server by far Written 2 months after purchase"
  ],
  "paras": [
    "HA Hype Automation I&#x27;ve dedicated my career to simplifying savings. With Hype Automation, I bring you the OTC Bot, designed to automate couponing and maximize your free product gains effortlessly. 4.7 ( 12 ) Contact seller Products Free Join Hype Automation Discord Free! Hype Automation Free Access 4.2 ( 5 ) $5.00 / month Free trial Unlock Industry-Leading Monitors Hype Automation Monitor 5.0 ( 1 ) Automate your savings effortlessly otc New $29.00 / month Save on Daily Purchases with Automated Code Generation! otc-bot 5.0 ( 4 ) Contact seller Reviews DP Dana Pink • otc-bot 9 months ago This bot is a game changer makes it super easy to earn money, and the dev is a very helpful",
    "9 months ago Easiest money i've made, tons of support too for newer members",
    "9 months ago Really easy way to make and save money with this!",
    "9 months ago The easiest money I have ever made for real the owner is super helpful, and bot is extremely user friendly my favorite server by far"
  ],
  "priceTokens": [
    "$5.00",
    "$29.00",
    "$1",
    "$1",
    "$1",
    "$21",
    "$1",
    "$1",
    "$1",
    "$1",
    "$28",
    "$1",
    "$28",
    "$28",
    "$28",
    "$28",
    "$3",
    "$3",
    "$3",
    "$10"
  ],
  "faq": [],
  "textSample": "Powered by HA Hype Automation I&#x27;ve dedicated my career to simplifying savings. With Hype Automation, I bring you the OTC Bot, designed to automate couponing and maximize your free product gains effortlessly. 4.7 ( 12 ) Contact seller Products Free Join Hype Automation Discord Free! Hype Automation Free Access 4.2 ( 5 ) $5.00 / month Free trial Unlock Industry-Leading Monitors Hype Automation Monitor 5.0 ( 1 ) Automate your savings effortlessly otc New $29.00 / month Save on Daily Purchases with Automated Code Generation! otc-bot 5.0 ( 4 ) Contact seller Reviews DP Dana Pink • otc-bot 9 months ago This bot is a game changer makes it super easy to earn money, and the dev is a very helpful Written 16 days after purchase G G1 • otc-bot 9 months ago Easiest money i've made, tons of support too for newer members Written 16 days after purchase FG Fernando Garcia • otc-bot 9 months ago Really easy way to make and save money with this! Written 21 days after purchase S shrock8 • otc-bot 9 months ago The easiest money I have ever made for real the owner is super helpful, and bot is extremely user friendly my favorite server by far Written 2 months after purchase See all reviews Hype Automation | Whop",
  "finalUrl": "https://whop.com/otc-bot/?a=alexburnett21",
  "fetchedAt": "2025-11-04T20:10:11.932Z",
  "textHash": "2edd4a7fb3f1d60ccd3ca34a0f9166d19e0a8264956bcf65e4afef26410f01a9",
  "drilled": false
}