{
  "baseUrl": "https://whop.com/palmfx/copytrader-access/",
  "title": "PALM FX Copytrader | Whop",
  "h1": "PALM FX Copytrader",
  "bullets": [
    "Sign in Unmute Unmute Unmute Unmute Unmute Unmute Unmute Unmute Unmute Unmute Unmute Unmute PF PALM FX Copytrader Never Miss a Trade with PALM FX 5.0 ( 30 ) Trading Join our group for specialist XAUUSD, Forex and Crypto signals from two seasoned professionals. Experience consistent profits and learn market analysis Head over to our discord for free signals and to check all our past trade results: https://discord.gg/sZFrjzDwYg Â£29.99 / month Pay Join Join 7 members Features Pinpoint entries with Copytrader for only Â£30 per month.",
    "Get 1-4 daily Forex and Crypto signals from seasoned professionals",
    "Access live trading sessions with interactive Q&amp;A.",
    "ME Michael Earle 10 months ago These guys are the best traders u will find- there entries are spot on. They just print money ðŸ’°. I kid you not . Try it you will not be disappointed Written 1 month after purchase",
    "TW Taylor Wilson 1 year ago Canâ€™t rate Palm FX Copytrader more highly, so good, I got the x2! Written 1 month after purchase",
    "TW Taylor Wilson 1 year ago Canâ€™t rate Palm FX Copytrader more highly, ran by 2 experienced gentlemen, trading has never been easier! Never miss a sniper entry again, without even lifting a finger! L Thanks KJ & Harry Written 15 days after purchase",
    "TW Taylor Wilson 1 year ago Started with a $50k funded account and these 2 wizards had hit the 10% profit target in less than a weekâ€¦ ðŸ¤¯ Written 1 month after purchase"
  ],
  "paras": [
    "Sign in Unmute Unmute Unmute Unmute Unmute Unmute Unmute Unmute Unmute Unmute Unmute Unmute PF PALM FX Copytrader Never Miss a Trade with PALM FX 5.0 ( 30 ) Trading Join our group for specialist XAUUSD, Forex and Crypto signals from two seasoned professionals. Experience consistent profits and learn market analysis",
    "Head over to our discord for free signals and to check all our past trade results: https://discord.gg/sZFrjzDwYg",
    "Join 7 members Features Pinpoint entries with Copytrader for only Â£30 per month. Get 1-4 daily Forex and Crypto signals from seasoned professionals Access live trading sessions with interactive Q&amp;A. Reviews 5 out of 5 30 total reviews 5 stars 4 stars 3 stars 2 stars 1 star ME Michael Earle 10 months ago These guys are the best traders u will find- there entries are spot on. They just print money ðŸ’°. I kid you not . Try it you will not be disappointed",
    "1 year ago Canâ€™t rate Palm FX Copytrader more highly, so good, I got the x2!",
    "1 year ago Canâ€™t rate Palm FX Copytrader more highly, ran by 2 experienced gentlemen, trading has never been easier! Never miss a sniper entry again, without even lifting a finger! L Thanks KJ & Harry",
    "1 year ago Started with a $50k funded account and these 2 wizards had hit the 10% profit target in less than a weekâ€¦ ðŸ¤¯",
    "About the creator HM View profile H McNeill @ harrymcneill11 â€¢ Joined Aug 2024 Weâ€™ve been trading professionally for over 5 years, developing a passion for XAUUSD signals and robust trading strategies. My goal is to bring consistent results to traders through our state-of-the-art copytrader service and educational resources. Head over to our discord for free signals and to see all our past trade results: https://discord.gg/sZFrjzDwYg FAQs How can I assess the performance of your signals and what kind of results can I expect? What does the copytrader do? How long have you been trading? Affiliates PF Become an affiliate PALM FX 20% reward Earn money by bringing customers to PALM FX. Every time a customer purchases using your link, you&#x27;ll earn a commission."
  ],
  "priceTokens": [
    "Â£29.99",
    "Â£30",
    "$50",
    "Â£29.99",
    "Â£29.99",
    "$1",
    "$1",
    "$1",
    "$22",
    "$1",
    "$1",
    "$1",
    "$1",
    "$1",
    "$2",
    "$1",
    "$2",
    "$2",
    "$2",
    "$2"
  ],
  "faq": [],
  "textSample": "Sign in Unmute Unmute Unmute Unmute Unmute Unmute Unmute Unmute Unmute Unmute Unmute Unmute PF PALM FX Copytrader Never Miss a Trade with PALM FX 5.0 ( 30 ) Trading Join our group for specialist XAUUSD, Forex and Crypto signals from two seasoned professionals. Experience consistent profits and learn market analysis Head over to our discord for free signals and to check all our past trade results: https://discord.gg/sZFrjzDwYg Â£29.99 / month Pay Join Join 7 members Features Pinpoint entries with Copytrader for only Â£30 per month. Get 1-4 daily Forex and Crypto signals from seasoned professionals Access live trading sessions with interactive Q&amp;A. Reviews 5 out of 5 30 total reviews 5 stars 4 stars 3 stars 2 stars 1 star ME Michael Earle 10 months ago These guys are the best traders u will find- there entries are spot on. They just print money ðŸ’°. I kid you not . Try it you will not be disappointed Written 1 month after purchase TW Taylor Wilson 1 year ago Canâ€™t rate Palm FX Copytrader more highly, so good, I got the x2! Written 1 month after purchase TW Taylor Wilson 1 year ago Canâ€™t rate Palm FX Copytrader more highly, ran by 2 experienced gentlemen, trading has never been easier! Never miss a sniper entry again, without even lifting a finger! L Thanks KJ & Harry Written 15 days after purchase TW Taylor Wilson 1 year ago Started with a $50k funded account and these 2 wizards had hit the 10% profit target in less than a weekâ€¦ ðŸ¤¯ Written 1 month after purchase See all reviews About the creator HM View profile H McNeill @ harrymcneill11 â€¢ Joined Aug 2024 Weâ€™ve been trading professionally for over 5 years, developing a passion for XAUUSD signals and robust trading strategies. My goal is to bring consistent results to traders through our state-of-the-art copytrader service and educational resources. Head over to our discord for free signals and to see all our past trade results: https://discord.gg/sZFrjzDwYg FAQs How can I assess the performance of your signals and what kind of results can I expect? What does the copytrader do? How long have you been trading? Affiliates PF Become an affiliate PALM FX 20% reward Earn money by bringing customers to PALM FX. Every time a customer purchases using your link, you&#x27;ll earn a commission. PALM FX Copytrader Â£29.99 / month Join Â£29.99 / month Pay Join Pay Join PALM FX Copytrader | Whop",
  "finalUrl": "https://whop.com/palmfx/copytrader-access/",
  "fetchedAt": "2025-11-04T21:49:14.129Z",
  "textHash": "91383fb96262f66d07a09485a11641db38610ae0e9dbd98ffe697fd19d8fdd87",
  "drilled": false
}