{
  "baseUrl": "https://whop.com/community-membership-1e/?a=alexburnett21",
  "title": "Papecheck Picks | Whop",
  "h1": "Papecheck Picks",
  "bullets": [
    "Powered by PP Papecheck Picks We&#x27;ve always been passionate about sports betting, combining our love for sports with data-driven strategies. With Papecheck Picks, We aim to create a community where bettors can thrive, learn, and w... More 5.0 ( 20 ) Contact seller Products $50.00 / week Go Green with our VIP Sports Picks Papecheck Picks Premium 5.0 ( 20 ) $25.00 / week Community Chat Papecheck Picks Community New Free FREE SPORTS BETTING, GAMING AND MUSIC DISCORD COMMUNITY Papecheck Picks New Contact seller Reviews BJ Brian McElrath Jr • Papecheck Picks Premium 1 year ago He goated, getting his whole city paid ! Written 5 days after purchase",
    "JM Jeremy Miller • Papecheck Picks Premium 1 year ago Great group! Great picks daily! Any issues you have they’re super responsive. Written 1 month after purchase",
    "DT Daniel Tilley • Papecheck Picks Premium 2 years ago Fire bets 24/7 real researchers no random picks Written 17 days after purchase",
    "BW Brooke Walker • Papecheck Picks Premium 2 years ago Papecheck is really getting everyone paid! If you’re not getting picks from them then you are missing out on major cash flow. Highly recommend Written 4 days after purchase"
  ],
  "paras": [
    "PP Papecheck Picks We&#x27;ve always been passionate about sports betting, combining our love for sports with data-driven strategies. With Papecheck Picks, We aim to create a community where bettors can thrive, learn, and w... More 5.0 ( 20 ) Contact seller Products $50.00 / week Go Green with our VIP Sports Picks Papecheck Picks Premium 5.0 ( 20 ) $25.00 / week Community Chat Papecheck Picks Community New Free FREE SPORTS BETTING, GAMING AND MUSIC DISCORD COMMUNITY Papecheck Picks New Contact seller Reviews BJ Brian McElrath Jr • Papecheck Picks Premium 1 year ago He goated, getting his whole city paid !",
    "1 year ago Great group! Great picks daily! Any issues you have they’re super responsive.",
    "2 years ago Fire bets 24/7 real researchers no random picks",
    "2 years ago Papecheck is really getting everyone paid! If you’re not getting picks from them then you are missing out on major cash flow. Highly recommend"
  ],
  "priceTokens": [
    "$50.00",
    "$25.00",
    "$1",
    "$1",
    "$1",
    "$21",
    "$1",
    "$1",
    "$1",
    "$1",
    "$28",
    "$1",
    "$28",
    "$28",
    "$28",
    "$28",
    "$3",
    "$3",
    "$3",
    "$10"
  ],
  "faq": [],
  "textSample": "Powered by PP Papecheck Picks We&#x27;ve always been passionate about sports betting, combining our love for sports with data-driven strategies. With Papecheck Picks, We aim to create a community where bettors can thrive, learn, and w... More 5.0 ( 20 ) Contact seller Products $50.00 / week Go Green with our VIP Sports Picks Papecheck Picks Premium 5.0 ( 20 ) $25.00 / week Community Chat Papecheck Picks Community New Free FREE SPORTS BETTING, GAMING AND MUSIC DISCORD COMMUNITY Papecheck Picks New Contact seller Reviews BJ Brian McElrath Jr • Papecheck Picks Premium 1 year ago He goated, getting his whole city paid ! Written 5 days after purchase JM Jeremy Miller • Papecheck Picks Premium 1 year ago Great group! Great picks daily! Any issues you have they’re super responsive. Written 1 month after purchase DT Daniel Tilley • Papecheck Picks Premium 2 years ago Fire bets 24/7 real researchers no random picks Written 17 days after purchase BW Brooke Walker • Papecheck Picks Premium 2 years ago Papecheck is really getting everyone paid! If you’re not getting picks from them then you are missing out on major cash flow. Highly recommend Written 4 days after purchase See all reviews Papecheck Picks | Whop",
  "finalUrl": "https://whop.com/community-membership-1e/?a=alexburnett21",
  "fetchedAt": "2025-11-04T20:05:04.142Z",
  "textHash": "8584e7a77acc4b80a74ecf43384b06044365364ac2ef686ac5f06b4adc465725",
  "drilled": false
}