{
  "baseUrl": "https://whop.com/community-membership-1e/papecheckpicks/",
  "title": "Papecheck Picks Premium | Whop",
  "h1": "Papecheck Picks Premium",
  "bullets": [
    "Sign in PP Papecheck Picks Premium Go Green with our VIP Sports Picks 5.0 ( 20 ) Sports betting Daily research and sports betting picks to help you go Green! Enjoy expert advice, bankroll management, and bet tracking. $50.00 / week Pay Get access Features Exclusive plays from Mont x Bemmitt",
    "Free Access to our community chat with VIP membership",
    "Access to daily sports betting picks for all major sports",
    "BJ Brian McElrath Jr 1 year ago He goated, getting his whole city paid ! Written 5 days after purchase",
    "JM Jeremy Miller 1 year ago Great group! Great picks daily! Any issues you have they’re super responsive. Written 1 month after purchase",
    "DT Daniel Tilley 2 years ago Fire bets 24/7 real researchers no random picks Written 17 days after purchase",
    "BW Brooke Walker 2 years ago Papecheck is really getting everyone paid! If you’re not getting picks from them then you are missing out on major cash flow. Highly recommend Written 4 days after purchase"
  ],
  "paras": [
    "Sign in PP Papecheck Picks Premium Go Green with our VIP Sports Picks 5.0 ( 20 ) Sports betting Daily research and sports betting picks to help you go Green! Enjoy expert advice, bankroll management, and bet tracking.",
    "Exclusive plays from Mont x Bemmitt Free Access to our community chat with VIP membership Access to daily sports betting picks for all major sports Reviews 5 out of 5 20 total reviews 5 stars 4 stars 3 stars 2 stars 1 star BJ Brian McElrath Jr 1 year ago He goated, getting his whole city paid !",
    "1 year ago Great group! Great picks daily! Any issues you have they’re super responsive.",
    "2 years ago Fire bets 24/7 real researchers no random picks",
    "2 years ago Papecheck is really getting everyone paid! If you’re not getting picks from them then you are missing out on major cash flow. Highly recommend",
    "About the creator PP View profile Papecheck Picks @ papecheckpicks • Joined Dec 2023 We&#x27;ve always been passionate about sports betting, combining our love for sports with data-driven strategies. With Papecheck Picks, We aim to create a community where bettors can thrive, learn, and win together. Our experience and dedication to research ensure that our members receive top-notch betting advice and plays. FAQs What&#x27;s your Refund Policy? How can I join the Telegram chat? Affiliates PP Become an affiliate Papecheck Picks 15% reward Earn money by bringing customers to Papecheck Picks. Every time a customer purchases using your link, you&#x27;ll earn a commission."
  ],
  "priceTokens": [
    "$50.00",
    "$50.00",
    "$50.00",
    "$1",
    "$1",
    "$1",
    "$22",
    "$1",
    "$1",
    "$1",
    "$1",
    "$1",
    "$2",
    "$1",
    "$2",
    "$2",
    "$2",
    "$2",
    "$3",
    "$3"
  ],
  "faq": [],
  "textSample": "Sign in PP Papecheck Picks Premium Go Green with our VIP Sports Picks 5.0 ( 20 ) Sports betting Daily research and sports betting picks to help you go Green! Enjoy expert advice, bankroll management, and bet tracking. $50.00 / week Pay Get access Features Exclusive plays from Mont x Bemmitt Free Access to our community chat with VIP membership Access to daily sports betting picks for all major sports Reviews 5 out of 5 20 total reviews 5 stars 4 stars 3 stars 2 stars 1 star BJ Brian McElrath Jr 1 year ago He goated, getting his whole city paid ! Written 5 days after purchase JM Jeremy Miller 1 year ago Great group! Great picks daily! Any issues you have they’re super responsive. Written 1 month after purchase DT Daniel Tilley 2 years ago Fire bets 24/7 real researchers no random picks Written 17 days after purchase BW Brooke Walker 2 years ago Papecheck is really getting everyone paid! If you’re not getting picks from them then you are missing out on major cash flow. Highly recommend Written 4 days after purchase See all reviews About the creator PP View profile Papecheck Picks @ papecheckpicks • Joined Dec 2023 We&#x27;ve always been passionate about sports betting, combining our love for sports with data-driven strategies. With Papecheck Picks, We aim to create a community where bettors can thrive, learn, and win together. Our experience and dedication to research ensure that our members receive top-notch betting advice and plays. FAQs What&#x27;s your Refund Policy? How can I join the Telegram chat? Affiliates PP Become an affiliate Papecheck Picks 15% reward Earn money by bringing customers to Papecheck Picks. Every time a customer purchases using your link, you&#x27;ll earn a commission. Papecheck Picks Premium $50.00 / week Get access $50.00 / week Pay Get access Pay Get access Papecheck Picks Premium | Whop",
  "finalUrl": "https://whop.com/community-membership-1e/papecheckpicks/",
  "fetchedAt": "2025-11-05T10:37:18.188Z",
  "textHash": "a717c1ea98701786c5026df059bf74d3ac877d691481260e912171bf67ca8cfe",
  "drilled": false
}