{
  "baseUrl": "https://whop.com/parlayxpapi-props/?a=alexburnett21",
  "title": "ParlayxPapi Props | Whop",
  "h1": "ParlayxPapi Props",
  "bullets": [
    "Powered by PP ParlayxPapi Props I&#x27;ve mastered the art of sports betting, turning a mere $10 into a staggering $35K. My passion is to share this success with you through exclusive insights, strategies, and a vibrant community of bett... More 5.0 ( 20 ) Contact seller Products $5.00 / week Score Big with Expert Prop Picks and Real-Time Game Insights ParlayxPapi Props 5.0 ( 16 ) $20.00 / month Tier 2 Access - POTDs, 2U plays, Streaks ParlayxPapi Tier 2 5.0 ( 2 ) Free Join ParlayxPapi&#x27;s Community Free ParlayxPapi Free Community 5.0 ( 2 ) Contact seller Reviews P Papwop • ParlayxPapi Props 2 months ago Great Experience Written 1 year after purchase",
    "BA BENJAMIN ANDERSON • ParlayxPapi Props 2 years ago Fantastic spot. Good reads and a lot of good information. Written 2 months after purchase",
    "RS Rudy Sandigo • ParlayxPapi Props 2 years ago hybrid capper covers all DFS apps with quality picks weekly ! Written 8 days after purchase",
    "LB Laura Blackberg • ParlayxPapi Props 2 years ago Positivity equals profit! Join for the profit- that’s a given, and stay for the brotherhood! We a team and we bank together! ParlayxPapi is the real thing!! Written 5 days after purchase"
  ],
  "paras": [
    "PP ParlayxPapi Props I&#x27;ve mastered the art of sports betting, turning a mere $10 into a staggering $35K. My passion is to share this success with you through exclusive insights, strategies, and a vibrant community of bett... More 5.0 ( 20 ) Contact seller Products $5.00 / week Score Big with Expert Prop Picks and Real-Time Game Insights ParlayxPapi Props 5.0 ( 16 ) $20.00 / month Tier 2 Access - POTDs, 2U plays, Streaks ParlayxPapi Tier 2 5.0 ( 2 ) Free Join ParlayxPapi&#x27;s Community Free ParlayxPapi Free Community 5.0 ( 2 ) Contact seller Reviews P Papwop • ParlayxPapi Props 2 months ago Great Experience",
    "2 years ago Fantastic spot. Good reads and a lot of good information.",
    "2 years ago hybrid capper covers all DFS apps with quality picks weekly !",
    "2 years ago Positivity equals profit! Join for the profit- that’s a given, and stay for the brotherhood! We a team and we bank together! ParlayxPapi is the real thing!!"
  ],
  "priceTokens": [
    "$10",
    "$35",
    "$5.00",
    "$20.00",
    "$1",
    "$1",
    "$1",
    "$21",
    "$1",
    "$1",
    "$1",
    "$1",
    "$28",
    "$1",
    "$28",
    "$28",
    "$28",
    "$28",
    "$3",
    "$3"
  ],
  "faq": [],
  "textSample": "Powered by PP ParlayxPapi Props I&#x27;ve mastered the art of sports betting, turning a mere $10 into a staggering $35K. My passion is to share this success with you through exclusive insights, strategies, and a vibrant community of bett... More 5.0 ( 20 ) Contact seller Products $5.00 / week Score Big with Expert Prop Picks and Real-Time Game Insights ParlayxPapi Props 5.0 ( 16 ) $20.00 / month Tier 2 Access - POTDs, 2U plays, Streaks ParlayxPapi Tier 2 5.0 ( 2 ) Free Join ParlayxPapi&#x27;s Community Free ParlayxPapi Free Community 5.0 ( 2 ) Contact seller Reviews P Papwop • ParlayxPapi Props 2 months ago Great Experience Written 1 year after purchase BA BENJAMIN ANDERSON • ParlayxPapi Props 2 years ago Fantastic spot. Good reads and a lot of good information. Written 2 months after purchase RS Rudy Sandigo • ParlayxPapi Props 2 years ago hybrid capper covers all DFS apps with quality picks weekly ! Written 8 days after purchase LB Laura Blackberg • ParlayxPapi Props 2 years ago Positivity equals profit! Join for the profit- that’s a given, and stay for the brotherhood! We a team and we bank together! ParlayxPapi is the real thing!! Written 5 days after purchase See all reviews ParlayxPapi Props | Whop",
  "finalUrl": "https://whop.com/parlayxpapi-props/?a=alexburnett21",
  "fetchedAt": "2025-11-05T10:41:42.222Z",
  "textHash": "e1eb1c00f0d167d9ccd6cf3b7628f796936e4256ddce71d6c239977861e9614f",
  "drilled": false
}