{
  "baseUrl": "https://whop.com/phantompicks/?a=alexburnett21",
  "title": "Phantom Picks | Whop",
  "h1": "Phantom Picks",
  "bullets": [
    "Powered by PP Phantom Picks 5.0 ( 18 ) Contact seller Products $19.99 / month Dominate Sports Betting &amp; Earn Thousands Daily! Phantom Picks 5.0 ( 18 ) $75.00 / month VIP Access to a real edge with sports betting. Make $1K/Day Phantom Picks VIP Access New it&#x27;ll never be dead... ðŸ¤« Legacy Calls New $350.00 Get LIFETIME access to the #1 Sports betting Server. Lifetime Access - PhantomPicks New Get FREE access to premium sports analysts and strategies! Free Access New $25.00 Receive 1 Day Access - VIP Whale Bet Slips DAILY VIP SLIPS New Contact seller Reviews M Mstar1090 â€¢ Phantom Picks 10 months ago Instant wins 2 days straight from joining Written 3 days after purchase",
    "LM Logan Mathews â€¢ Phantom Picks 10 months ago Real genuine people, made a lot of profit since iâ€™ve joined just 2 weeks ago, definitely worth the money! Written 8 days after purchase",
    "RI Ryan ivory â€¢ Phantom Picks 10 months ago Been the best since Iâ€™ve joined Written 17 days after purchase",
    "JS James Spigner â€¢ Phantom Picks 10 months ago In the time where it seems like everyone is making a discord, this is by far one of the best ones Iâ€™ve been on. Super active community, multiple days where weâ€™ve hit every pick back to back days. Written 22 days after purchase"
  ],
  "paras": [
    "PP Phantom Picks 5.0 ( 18 ) Contact seller Products $19.99 / month Dominate Sports Betting &amp; Earn Thousands Daily! Phantom Picks 5.0 ( 18 ) $75.00 / month VIP Access to a real edge with sports betting. Make $1K/Day Phantom Picks VIP Access New it&#x27;ll never be dead... ðŸ¤« Legacy Calls New $350.00 Get LIFETIME access to the #1 Sports betting Server. Lifetime Access - PhantomPicks New Get FREE access to premium sports analysts and strategies! Free Access New $25.00 Receive 1 Day Access - VIP Whale Bet Slips DAILY VIP SLIPS New Contact seller Reviews M Mstar1090 â€¢ Phantom Picks 10 months ago Instant wins 2 days straight from joining",
    "10 months ago Real genuine people, made a lot of profit since iâ€™ve joined just 2 weeks ago, definitely worth the money!",
    "10 months ago Been the best since Iâ€™ve joined",
    "10 months ago In the time where it seems like everyone is making a discord, this is by far one of the best ones Iâ€™ve been on. Super active community, multiple days where weâ€™ve hit every pick back to back days."
  ],
  "priceTokens": [
    "$19.99",
    "$75.00",
    "$1",
    "$350.00",
    "$25.00",
    "$1",
    "$1",
    "$1",
    "$21",
    "$1",
    "$1",
    "$1",
    "$1",
    "$28",
    "$1",
    "$28",
    "$28",
    "$28",
    "$28",
    "$3"
  ],
  "faq": [],
  "textSample": "Powered by PP Phantom Picks 5.0 ( 18 ) Contact seller Products $19.99 / month Dominate Sports Betting &amp; Earn Thousands Daily! Phantom Picks 5.0 ( 18 ) $75.00 / month VIP Access to a real edge with sports betting. Make $1K/Day Phantom Picks VIP Access New it&#x27;ll never be dead... ðŸ¤« Legacy Calls New $350.00 Get LIFETIME access to the #1 Sports betting Server. Lifetime Access - PhantomPicks New Get FREE access to premium sports analysts and strategies! Free Access New $25.00 Receive 1 Day Access - VIP Whale Bet Slips DAILY VIP SLIPS New Contact seller Reviews M Mstar1090 â€¢ Phantom Picks 10 months ago Instant wins 2 days straight from joining Written 3 days after purchase LM Logan Mathews â€¢ Phantom Picks 10 months ago Real genuine people, made a lot of profit since iâ€™ve joined just 2 weeks ago, definitely worth the money! Written 8 days after purchase RI Ryan ivory â€¢ Phantom Picks 10 months ago Been the best since Iâ€™ve joined Written 17 days after purchase JS James Spigner â€¢ Phantom Picks 10 months ago In the time where it seems like everyone is making a discord, this is by far one of the best ones Iâ€™ve been on. Super active community, multiple days where weâ€™ve hit every pick back to back days. Written 22 days after purchase See all reviews Phantom Picks | Whop",
  "finalUrl": "https://whop.com/phantompicks/?a=alexburnett21",
  "fetchedAt": "2025-11-05T17:38:44.849Z",
  "textHash": "37297e6c40c8a9f6bba219cc2dbb1ec6f5f3b04e6278c623190bcd529efe640b",
  "drilled": false
}