{
  "baseUrl": "https://whop.com/pickcity/weekly-95/",
  "title": "Pick City Weekly | Whop",
  "h1": "Pick City Weekly",
  "bullets": [
    "Pick City Weekly | Whop Sign in Unmute Unmute PC Pick City Weekly The #1 Most Profitable Sports Betting Group 4.8 ( 173 ) Sports betting 7 verified analysts. 71%+ hit rate. 23K+ members. NBA, MLB, NFL, NHL, and more. This isnâ€™t luckâ€”just numbers, data, and wins. ğŸ˜ˆ $19.99 / week Pay Join Features ğŸ”¥ 17 people purchased this in the last 3 hours!",
    "Access 8+ expert analysts with a 71%+ win rate year-round.",
    "Research tools and bankroll management for FREE!",
    "Picks year round for NBA, MLB, NFL, NHL, and more!",
    "24/7 exclusive chat and engage with 23,200+ members!",
    "ME Marsha V Escalera 19 days ago Up 1k in a weekâœ… Written 8 months after purchase",
    "J jordan 22 days ago been here a month & up 1kğŸ¤the goat ğŸ Written 1 month after purchase",
    "W whoops 2 months ago Great! Written 5 days after purchase",
    "T Ty 4 months ago literally just made my money back this is no joke bro is the real deal. Written 2 months after purchase"
  ],
  "paras": [
    "Sign in Unmute Unmute PC Pick City Weekly The #1 Most Profitable Sports Betting Group 4.8 ( 173 ) Sports betting 7 verified analysts. 71%+ hit rate. 23K+ members. NBA, MLB, NFL, NHL, and more. This isnâ€™t luckâ€”just numbers, data, and wins. ğŸ˜ˆ",
    "ğŸ”¥ 17 people purchased this in the last 3 hours! Access 8+ expert analysts with a 71%+ win rate year-round. Research tools and bankroll management for FREE! Picks year round for NBA, MLB, NFL, NHL, and more! 24/7 exclusive chat and engage with 23,200+ members! Reviews 4.80 out of 5 173 total reviews 5 stars 4 stars 3 stars 2 stars 1 star ME Marsha V Escalera 19 days ago Up 1k in a weekâœ…",
    "22 days ago been here a month & up 1kğŸ¤the goat ğŸ",
    "2 months ago Great!",
    "4 months ago literally just made my money back this is no joke bro is the real deal.",
    "About the creator PC View profile Pick City @ pickcityhq â€¢ Joined Dec 2022 There&#x27;s a reason why members leave other groups to join us... because we actually show proof of wins, testimonials, full transparency of numbers, and we have the funniest chat ever WHILE profiting. End of story. FAQs I purchased Pick City Premium, how do I gain access? Can I cancel the subscription at anytime? Why should I get Pick City Premium? Affiliates PC Become an affiliate Pick City 50% reward Earn money by bringing customers to Pick City. Every time a customer purchases using your link, you&#x27;ll earn a commission."
  ],
  "priceTokens": [
    "$19.99",
    "$19.99",
    "$19.99",
    "$1",
    "$1",
    "$1",
    "$22",
    "$1",
    "$1",
    "$1",
    "$1",
    "$1",
    "$2",
    "$1",
    "$2",
    "$2",
    "$2",
    "$2",
    "$3",
    "$3"
  ],
  "faq": [],
  "textSample": "Pick City Weekly | Whop Sign in Unmute Unmute PC Pick City Weekly The #1 Most Profitable Sports Betting Group 4.8 ( 173 ) Sports betting 7 verified analysts. 71%+ hit rate. 23K+ members. NBA, MLB, NFL, NHL, and more. This isnâ€™t luckâ€”just numbers, data, and wins. ğŸ˜ˆ $19.99 / week Pay Join Features ğŸ”¥ 17 people purchased this in the last 3 hours! Access 8+ expert analysts with a 71%+ win rate year-round. Research tools and bankroll management for FREE! Picks year round for NBA, MLB, NFL, NHL, and more! 24/7 exclusive chat and engage with 23,200+ members! Reviews 4.80 out of 5 173 total reviews 5 stars 4 stars 3 stars 2 stars 1 star ME Marsha V Escalera 19 days ago Up 1k in a weekâœ… Written 8 months after purchase J jordan 22 days ago been here a month & up 1kğŸ¤the goat ğŸ Written 1 month after purchase W whoops 2 months ago Great! Written 5 days after purchase T Ty 4 months ago literally just made my money back this is no joke bro is the real deal. Written 2 months after purchase See all reviews About the creator PC View profile Pick City @ pickcityhq â€¢ Joined Dec 2022 There&#x27;s a reason why members leave other groups to join us... because we actually show proof of wins, testimonials, full transparency of numbers, and we have the funniest chat ever WHILE profiting. End of story. FAQs I purchased Pick City Premium, how do I gain access? Can I cancel the subscription at anytime? Why should I get Pick City Premium? Affiliates PC Become an affiliate Pick City 50% reward Earn money by bringing customers to Pick City. Every time a customer purchases using your link, you&#x27;ll earn a commission. Pick City Weekly $19.99 / week Join $19.99 / week Pay Join Pay Join",
  "finalUrl": "https://whop.com/pickcity/weekly-95/",
  "fetchedAt": "2025-11-05T09:14:50.616Z",
  "textHash": "3243dda20a5d9f5cc60722bc7c6073dbda02b6ca1b1bbffec0dd99e4dd94cc4d",
  "drilled": false
}