{
  "baseUrl": "https://whop.com/mois-premium/mois-super/",
  "title": "PING&#x27;TED - MOIS SUPER | Whop",
  "h1": "PING&#x27;TED - MOIS SUPER",
  "bullets": [
    "Sign in Unmute Unmute P PING&#x27;TED - MOIS SUPER La clé de l&#x27;achat revente Vinted 4.9 ( 63 ) Software Le meilleur serveur d&#x27;achat revente Vinted. #1 Communauté resell Vinted en France €79.00 / month Pay Join Join 1 member Features Accès au serveur Discord classique et au bot sur app web et app mobile.",
    "Guides formateurs, forme toi de A à Z en quelques heures.",
    "Intelligence artificielle pour négocier et vendre à ta place connectée à Vinted.",
    "Accompagnement privé et personalisé si besoin par nos staffs.",
    "Communuaté de 450 membres VIP.",
    "OK Olivier Kanyamikenke 1 year ago Incroyable vraiment auto buy tout incroyable et les gens sont toujours là pour bien estimer ou conseiller vraiment Written 6 days after purchase",
    "GB Gabriel Bue 1 year ago L’abonnement premium est vrm très bien il est renta en 1 article, les articles tu les as avant que les gens le voient. Tu as accès à des avantages incroyables. Meilleur bot Written 16 days after purchase",
    "AB Aurelien Bourdel 1 year ago Incroyable, rien a redire! Le serveur est complet et très facile à manier. Written 16 days after purchase",
    "NS Nicolas Sannier 1 year ago Je suis abonné depuis quelques mois, et franchement, juste avec l'autobuy, j'arrive à trouver de belles pépites et à me faire de belles marges. Je recommande fortement ce bot. Written 3 months after purchase"
  ],
  "paras": [
    "Sign in Unmute Unmute P PING&#x27;TED - MOIS SUPER La clé de l&#x27;achat revente Vinted 4.9 ( 63 ) Software Le meilleur serveur d&#x27;achat revente Vinted. #1 Communauté resell Vinted en France",
    "Join 1 member Features Accès au serveur Discord classique et au bot sur app web et app mobile. Guides formateurs, forme toi de A à Z en quelques heures. Intelligence artificielle pour négocier et vendre à ta place connectée à Vinted. Accompagnement privé et personalisé si besoin par nos staffs. Communuaté de 450 membres VIP. Reviews 4.94 out of 5 63 total reviews 5 stars 4 stars 3 stars 2 stars 1 star OK Olivier Kanyamikenke 1 year ago Incroyable vraiment auto buy tout incroyable et les gens sont toujours là pour bien estimer ou conseiller vraiment",
    "1 year ago L’abonnement premium est vrm très bien il est renta en 1 article, les articles tu les as avant que les gens le voient. Tu as accès à des avantages incroyables. Meilleur bot",
    "1 year ago Incroyable, rien a redire! Le serveur est complet et très facile à manier.",
    "1 year ago Je suis abonné depuis quelques mois, et franchement, juste avec l'autobuy, j'arrive à trouver de belles pépites et à me faire de belles marges. Je recommande fortement ce bot.",
    "About the creator Z View profile Zayko @ zayko • Joined Oct 2022 J&#x27;ai créé PING&#x27;TED pour aider les jeunes à se lancer dans l&#x27;achat revente Vinted, qu&#x27;ils soient débutants ou experts. Avec plus de 450 membres, notre communauté est là pour vous soutenir et vous apprendre les meilleures stratégies de revente. FAQs A Quel Âge Peut-On Commencer ? Quel Est Le Budget Minimum ? On Peut Faire Du Resell Même Avec Les Cours ? Combien Je Peux Gagner Avec Ce Business ? Affiliates P Become an affiliate PING&#x27;TED 30% reward Earn money by bringing customers to PING&#x27;TED. Every time a customer purchases using your link, you&#x27;ll earn a commission."
  ],
  "priceTokens": [
    "€79.00",
    "€79.00",
    "€79.00",
    "$1",
    "$1",
    "$1",
    "$22",
    "$1",
    "$1",
    "$1",
    "$1",
    "$1",
    "$2",
    "$1",
    "$2",
    "$2",
    "$2",
    "$2",
    "$3",
    "$3"
  ],
  "faq": [],
  "textSample": "Sign in Unmute Unmute P PING&#x27;TED - MOIS SUPER La clé de l&#x27;achat revente Vinted 4.9 ( 63 ) Software Le meilleur serveur d&#x27;achat revente Vinted. #1 Communauté resell Vinted en France €79.00 / month Pay Join Join 1 member Features Accès au serveur Discord classique et au bot sur app web et app mobile. Guides formateurs, forme toi de A à Z en quelques heures. Intelligence artificielle pour négocier et vendre à ta place connectée à Vinted. Accompagnement privé et personalisé si besoin par nos staffs. Communuaté de 450 membres VIP. Reviews 4.94 out of 5 63 total reviews 5 stars 4 stars 3 stars 2 stars 1 star OK Olivier Kanyamikenke 1 year ago Incroyable vraiment auto buy tout incroyable et les gens sont toujours là pour bien estimer ou conseiller vraiment Written 6 days after purchase GB Gabriel Bue 1 year ago L’abonnement premium est vrm très bien il est renta en 1 article, les articles tu les as avant que les gens le voient. Tu as accès à des avantages incroyables. Meilleur bot Written 16 days after purchase AB Aurelien Bourdel 1 year ago Incroyable, rien a redire! Le serveur est complet et très facile à manier. Written 16 days after purchase NS Nicolas Sannier 1 year ago Je suis abonné depuis quelques mois, et franchement, juste avec l'autobuy, j'arrive à trouver de belles pépites et à me faire de belles marges. Je recommande fortement ce bot. Written 3 months after purchase See all reviews About the creator Z View profile Zayko @ zayko • Joined Oct 2022 J&#x27;ai créé PING&#x27;TED pour aider les jeunes à se lancer dans l&#x27;achat revente Vinted, qu&#x27;ils soient débutants ou experts. Avec plus de 450 membres, notre communauté est là pour vous soutenir et vous apprendre les meilleures stratégies de revente. FAQs A Quel Âge Peut-On Commencer ? Quel Est Le Budget Minimum ? On Peut Faire Du Resell Même Avec Les Cours ? Combien Je Peux Gagner Avec Ce Business ? Affiliates P Become an affiliate PING&#x27;TED 30% reward Earn money by bringing customers to PING&#x27;TED. Every time a customer purchases using your link, you&#x27;ll earn a commission. PING&#x27;TED - MOIS SUPER €79.00 / month Join €79.00 / month Pay Join Pay Join PING&#x27;TED - MOIS SUPER | Whop",
  "finalUrl": "https://whop.com/mois-premium/mois-super/",
  "fetchedAt": "2025-11-04T22:02:18.671Z",
  "textHash": "1bb30e71924e4d884615be14ff74cd549f58d05a5a572b8ab919547de6924812",
  "drilled": false
}