{
  "baseUrl": "https://whop.com/pip-club-savage-ea/?a=alexburnett21",
  "title": "Pip Club - Savage EA Forex Robot | Whop",
  "h1": "Pip Club - Savage EA Forex Robot",
  "bullets": [
    "Powered by PR Pip Club - Savage EA Forex Robot Automate your Forex trading with Pip Club Savage EA! Advanced, reliable, and hands-free. Perfect for all traders. Join us and let Ai trade for you. 4.6 ( 19 ) Contact seller Products $499.00 Automated Forex Trading Algorithm Pip Club Savage EA 2.0 PipClub Savage EA 2.0 Fx Robot 4.7 ( 13 ) Free Free Forex Robot Pip Club EA Forex Expert Advisor Free Forex Trading Robot EA 4.2 ( 5 ) Breakout Profits EA Breakout Profits EA New ðŸ¤– AutoSniper FX â€“ Advanced AI Forex Trading System AutoSniper FX â€“ Advanced AI New Strike Heist EA Mt4/Mt5 Forex Trading Algo Lifetime Access Strike Hesit EA New Contact seller Reviews M Michel â€¢ Free Forex Trading Robot EA 1 month ago The Best ea, all comming Written 7 months after purchase",
    "EA Edward Abbey â€¢ Free Forex Trading Robot EA 1 month ago Great app Written 4 months after purchase",
    "AI Albert isingoma â€¢ Free Forex Trading Robot EA 4 months ago Pure scam just blowing accounts Written 6 months after purchase",
    "J jeffforex â€¢ PipClub Savage EA 2.0 Fx Robot 9 months ago Best Trading Bot Ever! Pip Club Savage EA is a game-changer! It passed my $100K The Funded Trader Phase 1 in just 4 days. The automation is flawless, and the results are incredible. Hands down the best trading bot out thereâ€”Savage EA delivers! Highly recommend! Written 3 days after purchase"
  ],
  "paras": [
    "PR Pip Club - Savage EA Forex Robot Automate your Forex trading with Pip Club Savage EA! Advanced, reliable, and hands-free. Perfect for all traders. Join us and let Ai trade for you. 4.6 ( 19 ) Contact seller Products $499.00 Automated Forex Trading Algorithm Pip Club Savage EA 2.0 PipClub Savage EA 2.0 Fx Robot 4.7 ( 13 ) Free Free Forex Robot Pip Club EA Forex Expert Advisor Free Forex Trading Robot EA 4.2 ( 5 ) Breakout Profits EA Breakout Profits EA New ðŸ¤– AutoSniper FX â€“ Advanced AI Forex Trading System AutoSniper FX â€“ Advanced AI New Strike Heist EA Mt4/Mt5 Forex Trading Algo Lifetime Access Strike Hesit EA New Contact seller Reviews M Michel â€¢ Free Forex Trading Robot EA 1 month ago The Best ea, all comming",
    "1 month ago Great app",
    "4 months ago Pure scam just blowing accounts",
    "9 months ago Best Trading Bot Ever! Pip Club Savage EA is a game-changer! It passed my $100K The Funded Trader Phase 1 in just 4 days. The automation is flawless, and the results are incredible. Hands down the best trading bot out thereâ€”Savage EA delivers! Highly recommend!"
  ],
  "priceTokens": [
    "$499.00",
    "$100",
    "$1",
    "$1",
    "$1",
    "$21",
    "$1",
    "$1",
    "$1",
    "$1",
    "$28",
    "$1",
    "$28",
    "$28",
    "$28",
    "$28",
    "$3",
    "$3",
    "$3",
    "$10"
  ],
  "faq": [],
  "textSample": "Powered by PR Pip Club - Savage EA Forex Robot Automate your Forex trading with Pip Club Savage EA! Advanced, reliable, and hands-free. Perfect for all traders. Join us and let Ai trade for you. 4.6 ( 19 ) Contact seller Products $499.00 Automated Forex Trading Algorithm Pip Club Savage EA 2.0 PipClub Savage EA 2.0 Fx Robot 4.7 ( 13 ) Free Free Forex Robot Pip Club EA Forex Expert Advisor Free Forex Trading Robot EA 4.2 ( 5 ) Breakout Profits EA Breakout Profits EA New ðŸ¤– AutoSniper FX â€“ Advanced AI Forex Trading System AutoSniper FX â€“ Advanced AI New Strike Heist EA Mt4/Mt5 Forex Trading Algo Lifetime Access Strike Hesit EA New Contact seller Reviews M Michel â€¢ Free Forex Trading Robot EA 1 month ago The Best ea, all comming Written 7 months after purchase EA Edward Abbey â€¢ Free Forex Trading Robot EA 1 month ago Great app Written 4 months after purchase AI Albert isingoma â€¢ Free Forex Trading Robot EA 4 months ago Pure scam just blowing accounts Written 6 months after purchase J jeffforex â€¢ PipClub Savage EA 2.0 Fx Robot 9 months ago Best Trading Bot Ever! Pip Club Savage EA is a game-changer! It passed my $100K The Funded Trader Phase 1 in just 4 days. The automation is flawless, and the results are incredible. Hands down the best trading bot out thereâ€”Savage EA delivers! Highly recommend! Written 3 days after purchase See all reviews Pip Club - Savage EA Forex Robot | Whop",
  "finalUrl": "https://whop.com/pip-club-savage-ea/?a=alexburnett21",
  "fetchedAt": "2025-11-05T09:20:29.298Z",
  "textHash": "0aed9d84ee358abfd9910e07fd19f430b823b253837470f664c414a3e19140ff",
  "drilled": false
}