{
  "baseUrl": "https://whop.com/pokefinder/pokefinder/?a=alexburnett21",
  "title": "PokeFinder | Whop",
  "h1": "PokeFinder",
  "bullets": [
    "PokeFinder | Whop Sign in P PokeFinder Beat the bots, never miss a Pokémon drop again! 5.0 ( 186 ) Marketing agency Join PokeFinder to stay ahead! Get lightning-fast monitors for all major retailers, early info, in-store updates, and exclusive giveaways to help you secure the best Pokémon deals $5.99 / month 3 day trial Pay Join Join 1,345 members Features Access to our Discord Community with lightning fast restock notifications!",
    "Instore Stock Checkers!",
    "Exclusive Drop Information",
    "Giveaways!",
    "CD collin dulin 21 days ago Have hit so many times due to this server. Big ups Written 2 months after purchase",
    "T Teehalie 21 days ago Hope I win!!! Written 21 hours after purchase",
    "S StillLoaded 21 days ago Was able to get my hands on product!! Thanks!! Written 9 days after purchase",
    "K Koolaid 21 days ago Very reliable Written 6 months after purchase"
  ],
  "paras": [
    "Sign in P PokeFinder Beat the bots, never miss a Pokémon drop again! 5.0 ( 186 ) Marketing agency Join PokeFinder to stay ahead! Get lightning-fast monitors for all major retailers, early info, in-store updates, and exclusive giveaways to help you secure the best Pokémon deals",
    "$5.99 / month 3 day trial Pay Join Join 1,345 members Features Access to our Discord Community with lightning fast restock notifications! Instore Stock Checkers! Exclusive Drop Information Giveaways! Reviews 4.97 out of 5 186 total reviews 5 stars 4 stars 3 stars 2 stars 1 star CD collin dulin 21 days ago Have hit so many times due to this server. Big ups",
    "21 days ago Hope I win!!!",
    "21 days ago Was able to get my hands on product!! Thanks!!",
    "21 days ago Very reliable",
    "About the creator H View profile HK @ pokefinderhk • Joined Nov 2021 I&#x27;ve been collecting Pokemon cards for close to two decades and am dedicated to sharing what I&#x27;ve learned over the years with new collectors to give them the best chances at getting Pokemon product for MSRP! No more losing to the bots and scalpers! FAQs Is PokeFinder a botting community? Does PokeFinder only cover US restocks? What is the refund policy? Affiliates P Become an affiliate PokeFinder 50% reward Earn money by bringing customers to PokeFinder. Every time a customer purchases using your link, you&#x27;ll earn a commission."
  ],
  "priceTokens": [
    "$5.99",
    "$5.99",
    "$5.99",
    "$1",
    "$1",
    "$1",
    "$23",
    "$1",
    "$1",
    "$1",
    "$1",
    "$1",
    "$2",
    "$1",
    "$2",
    "$2",
    "$2",
    "$2",
    "$3",
    "$3"
  ],
  "faq": [],
  "textSample": "PokeFinder | Whop Sign in P PokeFinder Beat the bots, never miss a Pokémon drop again! 5.0 ( 186 ) Marketing agency Join PokeFinder to stay ahead! Get lightning-fast monitors for all major retailers, early info, in-store updates, and exclusive giveaways to help you secure the best Pokémon deals $5.99 / month 3 day trial Pay Join Join 1,345 members Features Access to our Discord Community with lightning fast restock notifications! Instore Stock Checkers! Exclusive Drop Information Giveaways! Reviews 4.97 out of 5 186 total reviews 5 stars 4 stars 3 stars 2 stars 1 star CD collin dulin 21 days ago Have hit so many times due to this server. Big ups Written 2 months after purchase T Teehalie 21 days ago Hope I win!!! Written 21 hours after purchase S StillLoaded 21 days ago Was able to get my hands on product!! Thanks!! Written 9 days after purchase K Koolaid 21 days ago Very reliable Written 6 months after purchase See all reviews About the creator H View profile HK @ pokefinderhk • Joined Nov 2021 I&#x27;ve been collecting Pokemon cards for close to two decades and am dedicated to sharing what I&#x27;ve learned over the years with new collectors to give them the best chances at getting Pokemon product for MSRP! No more losing to the bots and scalpers! FAQs Is PokeFinder a botting community? Does PokeFinder only cover US restocks? What is the refund policy? Affiliates P Become an affiliate PokeFinder 50% reward Earn money by bringing customers to PokeFinder. Every time a customer purchases using your link, you&#x27;ll earn a commission. PokeFinder $5.99 / month +1 option Join $5.99 / month 1 option Pay Join Pay Join",
  "finalUrl": "https://whop.com/pokefinder/pokefinder/?a=alexburnett21",
  "fetchedAt": "2025-11-05T09:54:37.280Z",
  "textHash": "a481aed5c2ba33f3d87d36e85fb4ce0e250b9404e1a4558c9649a1cde3b7d797",
  "drilled": true
}