{
  "baseUrl": "https://whop.com/potion-alpha/potiontracker-starter/",
  "title": "Potion Tracker Starter | Whop",
  "h1": "Potion Tracker Starter",
  "bullets": [
    "Sign in Unmute Unmute PA Potion Tracker Starter Track 20 Wallets with Ease 4.8 ( 323 ) Other Get access to the fastest Solana Wallet Tracker, with custom sounds, colors &amp; tags for wallets. Check wallet PNL&#x27;s &amp; their best trades. Used by the best traders on-chain. $40.00 / month Pay Join Join 10 members Features THIS DOES NOT INCLUDE DISCORD ACCESS",
    "Allows you to access up to 20 Wallets (No Wallet IDs are given in this product)",
    "60 Notifications per Minute, 600 per Hour",
    "Max Notifications per day: 4000",
    "Custom sounds and wallet tagging for personalized tracking.",
    "VI Victor Ianiu 23 days ago The platform is often described as easy to use, especially for managing digital products, subscriptions, and memberships. Written 9 months after purchase",
    "EA Engr. Angela 1 month ago Mod team are very helpful, fastest support i have experienced. I learned most during Stages which is very beginner friendly! Written 10 months after purchase",
    "J Jordan 5 months ago One of the best Whops out there, 100% recommended. This helped me cook hella money on memecoins, W Orangie. Written 1 month after purchase",
    "J Jonathan 7 months ago All payments are done and really good whop Written 20 days after purchase"
  ],
  "paras": [
    "Sign in Unmute Unmute PA Potion Tracker Starter Track 20 Wallets with Ease 4.8 ( 323 ) Other Get access to the fastest Solana Wallet Tracker, with custom sounds, colors &amp; tags for wallets. Check wallet PNL&#x27;s &amp; their best trades.",
    "Used by the best traders on-chain.",
    "$40.00 / month Pay Join Join 10 members Features THIS DOES NOT INCLUDE DISCORD ACCESS Allows you to access up to 20 Wallets (No Wallet IDs are given in this product) 60 Notifications per Minute, 600 per Hour Max Notifications per day: 4000 Custom sounds and wallet tagging for personalized tracking. Reviews 4.80 out of 5 323 total reviews 5 stars 4 stars 3 stars 2 stars 1 star VI Victor Ianiu 23 days ago The platform is often described as easy to use, especially for managing digital products, subscriptions, and memberships.",
    "1 month ago Mod team are very helpful, fastest support i have experienced. I learned most during Stages which is very beginner friendly!",
    "5 months ago One of the best Whops out there, 100% recommended. This helped me cook hella money on memecoins, W Orangie.",
    "7 months ago All payments are done and really good whop",
    "About the creator O View profile Orangie @ orangie • Joined Sep 2023 I’m Orangie, the founder of Potion Alpha, the #1 online crypto platform where over 100,000 members collaborate to master blockchain trading. Whether you&#x27;re a beginner or an experienced trader, our entire team at Potion Alpha is focused on helping you win with real-time tools, memecoin scanning, and exclusive bots. Join us, and let’s grow together! FAQs Is Potion Alpha suitable for beginners? Do you provide live trading signals? What is Potion Alpha? How can I benefit from joining? Affiliates PA Become an affiliate Potion Alpha 30% reward Earn money by bringing customers to Potion Alpha. Every time a customer purchases using your link, you&#x27;ll earn a commission."
  ],
  "priceTokens": [
    "$40.00",
    "$40.00",
    "$40.00",
    "$1",
    "$1",
    "$1",
    "$22",
    "$1",
    "$1",
    "$1",
    "$1",
    "$1",
    "$2",
    "$1",
    "$2",
    "$2",
    "$2",
    "$2",
    "$3",
    "$3"
  ],
  "faq": [],
  "textSample": "Sign in Unmute Unmute PA Potion Tracker Starter Track 20 Wallets with Ease 4.8 ( 323 ) Other Get access to the fastest Solana Wallet Tracker, with custom sounds, colors &amp; tags for wallets. Check wallet PNL&#x27;s &amp; their best trades. Used by the best traders on-chain. $40.00 / month Pay Join Join 10 members Features THIS DOES NOT INCLUDE DISCORD ACCESS Allows you to access up to 20 Wallets (No Wallet IDs are given in this product) 60 Notifications per Minute, 600 per Hour Max Notifications per day: 4000 Custom sounds and wallet tagging for personalized tracking. Reviews 4.80 out of 5 323 total reviews 5 stars 4 stars 3 stars 2 stars 1 star VI Victor Ianiu 23 days ago The platform is often described as easy to use, especially for managing digital products, subscriptions, and memberships. Written 9 months after purchase EA Engr. Angela 1 month ago Mod team are very helpful, fastest support i have experienced. I learned most during Stages which is very beginner friendly! Written 10 months after purchase J Jordan 5 months ago One of the best Whops out there, 100% recommended. This helped me cook hella money on memecoins, W Orangie. Written 1 month after purchase J Jonathan 7 months ago All payments are done and really good whop Written 20 days after purchase See all reviews About the creator O View profile Orangie @ orangie • Joined Sep 2023 I’m Orangie, the founder of Potion Alpha, the #1 online crypto platform where over 100,000 members collaborate to master blockchain trading. Whether you&#x27;re a beginner or an experienced trader, our entire team at Potion Alpha is focused on helping you win with real-time tools, memecoin scanning, and exclusive bots. Join us, and let’s grow together! FAQs Is Potion Alpha suitable for beginners? Do you provide live trading signals? What is Potion Alpha? How can I benefit from joining? Affiliates PA Become an affiliate Potion Alpha 30% reward Earn money by bringing customers to Potion Alpha. Every time a customer purchases using your link, you&#x27;ll earn a commission. Potion Tracker Starter $40.00 / month +1 option Join $40.00 / month 1 option Pay Join Pay Join Potion Tracker Starter | Whop",
  "finalUrl": "https://whop.com/potion-alpha/potiontracker-starter/",
  "fetchedAt": "2025-11-04T21:43:44.680Z",
  "textHash": "97f75c29a0f053eeae35db1578345da15182f51fd6d69d9ca1e76d1fa21e8ba5",
  "drilled": false
}