{
  "baseUrl": "https://whop.com/rawstocks/?a=alexburnett21",
  "title": "Rawstocks Options Trading Discord | Whop",
  "h1": "Rawstocks Options Trading Discord",
  "bullets": [
    "Powered by RD Rawstocks Options Trading Discord Master Stock Options Trading With Professional Grade Tools and Analysis 4.9 ( 25 ) Contact seller Products Unmute Free ðŸš€ Join Our FREE Trading Discord â€“ Learn, Share &amp; Profit Rawstocks Free Limited 4.8 ( 5 ) Unmute $7.00 Join Rawstocks&#x27; Premium Discord Community RawStocks 7-Day Promo New Unmute $99.00 / month The #1 Stock, Options, and Futures Trading Community Rawstocks Premium Trader 4.9 ( 18 ) $1,000.00 Join RawStocks for Real-Time Trading Lifetime Member 5.0 ( 1 ) Become an Independent Trader Mentor Training New Contact seller Reviews B bigashell â€¢ Rawstocks Premium Trader 2 months ago honestly the best trading community. nice people, good call outs, great learnings resources. I joined on a free trial and one of the call outs got me about $500 that day. decided to stay and that was the best decision of my trading career. I think I've made about $5k net since joining this group in ... Show more Written 2 months after purchase",
    "AZ Amber Z â€¢ Rawstocks Premium Trader 2 months ago Best trading community. Very easy to follow and learn. Rustik and other traders are very professional and so helpful. Written 4 months after purchase",
    "TS Trade Sajur â€¢ Rawstocks Free Limited 2 months ago Rawstocks Discord is honestly one of the few trading groups that feels legit. People share real setups, explain the reasoning, and actually want you to learn. Itâ€™s been a solid spot to get better at trading without all the fake hype. Written 3m after purchase",
    "N Ninjaboy â€¢ Rawstocks Free Limited 2 months ago Best discord by far! I am a new trader but the Rawstocks Team makes it easy to learn and follow. Written 4m after purchase"
  ],
  "paras": [
    "RD Rawstocks Options Trading Discord Master Stock Options Trading With Professional Grade Tools and Analysis 4.9 ( 25 ) Contact seller Products Unmute Free ðŸš€ Join Our FREE Trading Discord â€“ Learn, Share &amp; Profit Rawstocks Free Limited 4.8 ( 5 ) Unmute $7.00 Join Rawstocks&#x27; Premium Discord Community RawStocks 7-Day Promo New Unmute $99.00 / month The #1 Stock, Options, and Futures Trading Community Rawstocks Premium Trader 4.9 ( 18 ) $1,000.00 Join RawStocks for Real-Time Trading Lifetime Member 5.0 ( 1 ) Become an Independent Trader Mentor Training New Contact seller Reviews B bigashell â€¢ Rawstocks Premium Trader 2 months ago honestly the best trading community. nice people, good call outs, great learnings resources. I joined on a free trial and one of the call outs got me about $500 that day. decided to stay and that was the best decision of my trading career. I think I've made about $5k net since joining this group in ...",
    "Written 2 months after purchase AZ Amber Z â€¢ Rawstocks Premium Trader 2 months ago Best trading community. Very easy to follow and learn. Rustik and other traders are very professional and so helpful.",
    "2 months ago Rawstocks Discord is honestly one of the few trading groups that feels legit. People share real setups, explain the reasoning, and actually want you to learn. Itâ€™s been a solid spot to get better at trading without all the fake hype.",
    "2 months ago Best discord by far! I am a new trader but the Rawstocks Team makes it easy to learn and follow."
  ],
  "priceTokens": [
    "$7.00",
    "$99.00",
    "$1,000.00",
    "$500",
    "$5",
    "$1",
    "$1",
    "$1",
    "$21",
    "$1",
    "$1",
    "$1",
    "$1",
    "$28",
    "$1",
    "$28",
    "$28",
    "$28",
    "$28",
    "$3"
  ],
  "faq": [],
  "textSample": "Powered by RD Rawstocks Options Trading Discord Master Stock Options Trading With Professional Grade Tools and Analysis 4.9 ( 25 ) Contact seller Products Unmute Free ðŸš€ Join Our FREE Trading Discord â€“ Learn, Share &amp; Profit Rawstocks Free Limited 4.8 ( 5 ) Unmute $7.00 Join Rawstocks&#x27; Premium Discord Community RawStocks 7-Day Promo New Unmute $99.00 / month The #1 Stock, Options, and Futures Trading Community Rawstocks Premium Trader 4.9 ( 18 ) $1,000.00 Join RawStocks for Real-Time Trading Lifetime Member 5.0 ( 1 ) Become an Independent Trader Mentor Training New Contact seller Reviews B bigashell â€¢ Rawstocks Premium Trader 2 months ago honestly the best trading community. nice people, good call outs, great learnings resources. I joined on a free trial and one of the call outs got me about $500 that day. decided to stay and that was the best decision of my trading career. I think I've made about $5k net since joining this group in ... Show more Written 2 months after purchase AZ Amber Z â€¢ Rawstocks Premium Trader 2 months ago Best trading community. Very easy to follow and learn. Rustik and other traders are very professional and so helpful. Written 4 months after purchase TS Trade Sajur â€¢ Rawstocks Free Limited 2 months ago Rawstocks Discord is honestly one of the few trading groups that feels legit. People share real setups, explain the reasoning, and actually want you to learn. Itâ€™s been a solid spot to get better at trading without all the fake hype. Written 3m after purchase N Ninjaboy â€¢ Rawstocks Free Limited 2 months ago Best discord by far! I am a new trader but the Rawstocks Team makes it easy to learn and follow. Written 4m after purchase See all reviews Rawstocks Options Trading Discord | Whop",
  "finalUrl": "https://whop.com/rawstocks/?a=alexburnett21",
  "fetchedAt": "2025-11-04T20:10:07.837Z",
  "textHash": "e0bd7bb82dbd007bf2fd84d75b551dc864deb0b45945695e72b479bf04cd118d",
  "drilled": false
}