{
  "baseUrl": "https://whop.com/jonnyoptions/jonnyoptionss/",
  "title": "Premium Live Trading | Whop",
  "h1": "Premium Live Trading",
  "bullets": [
    "Sign in BT Premium Live Trading Master the Markets with JonnyOptions 4.8 ( 144 ) Trading Watch me trade LIVE every morning at 9:00am EST. Giving you my exact entries and market analysis so you can follow along and make money with me $49.00 / month 3 day trial Pay Join Join 54 members Features Access to my LIVE trading group where i callout all my trades",
    "Sunday psychology classes working on your mindset, analysis, strategy &amp; more",
    "Like-Minded community with people that have a huge desire for day trading",
    "JF Jacob Firch 4 hours ago 100% recommend Written 4 months after purchase",
    "D dashtothecash 5 days ago perfect community, great mentor. Couldnt ask for anyone better. Written 19 days after purchase",
    "J James 11 days ago Good dude good community. Written 3 months after purchase",
    "J Jaffer.altamimi 13 days ago More than blessed to have come across this man Jonny. I look back at myself from a few months ago and think how much things have truly changed for me. Joined this group with zero education to my mind I didn't know what anything was except for a dang call and a put this man prioritizes us as students... Show more Written 4 months after purchase"
  ],
  "paras": [
    "Sign in BT Premium Live Trading Master the Markets with JonnyOptions 4.8 ( 144 ) Trading Watch me trade LIVE every morning at 9:00am EST.",
    "Giving you my exact entries and market analysis so you can follow along and make money with me",
    "3 day trial Pay Join Join 54 members Features Access to my LIVE trading group where i callout all my trades Sunday psychology classes working on your mindset, analysis, strategy &amp; more Like-Minded community with people that have a huge desire for day trading Reviews 4.84 out of 5 144 total reviews 5 stars 4 stars 3 stars 2 stars 1 star JF Jacob Firch 4 hours ago 100% recommend",
    "5 days ago perfect community, great mentor. Couldnt ask for anyone better.",
    "11 days ago Good dude good community.",
    "13 days ago More than blessed to have come across this man Jonny. I look back at myself from a few months ago and think how much things have truly changed for me. Joined this group with zero education to my mind I didn't know what anything was except for a dang call and a put this man prioritizes us as students...",
    "Written 4 months after purchase See all reviews About the creator JC View profile Jonathan Clegg @ jonnyoptions • Joined May 2023 Hey i’m Jonny a trader and mentor who helps people build freedom through trading. I went from failing high school and being broke to creating a life built on discipline and consistency. Now i help traders learn a proven strategy develop structure and build the confidence to finally start winning in the markets FAQs What strategy does Jonny teach? What brokerage does Jonny use? How long has Jonny been trading? What strategy does Jonny teach? How long has Jonny been trading? Affiliates BT Become an affiliate Boka Trading 30% reward Earn money by bringing customers to Boka Trading . Every time a customer purchases using your link, you&#x27;ll earn a commission."
  ],
  "priceTokens": [
    "$49.00",
    "$49.00",
    "$49.00",
    "$1",
    "$1",
    "$1",
    "$22",
    "$1",
    "$1",
    "$1",
    "$1",
    "$1",
    "$2",
    "$1",
    "$2",
    "$2",
    "$2",
    "$2",
    "$3",
    "$3"
  ],
  "faq": [],
  "textSample": "Sign in BT Premium Live Trading Master the Markets with JonnyOptions 4.8 ( 144 ) Trading Watch me trade LIVE every morning at 9:00am EST. Giving you my exact entries and market analysis so you can follow along and make money with me $49.00 / month 3 day trial Pay Join Join 54 members Features Access to my LIVE trading group where i callout all my trades Sunday psychology classes working on your mindset, analysis, strategy &amp; more Like-Minded community with people that have a huge desire for day trading Reviews 4.84 out of 5 144 total reviews 5 stars 4 stars 3 stars 2 stars 1 star JF Jacob Firch 4 hours ago 100% recommend Written 4 months after purchase D dashtothecash 5 days ago perfect community, great mentor. Couldnt ask for anyone better. Written 19 days after purchase J James 11 days ago Good dude good community. Written 3 months after purchase J Jaffer.altamimi 13 days ago More than blessed to have come across this man Jonny. I look back at myself from a few months ago and think how much things have truly changed for me. Joined this group with zero education to my mind I didn't know what anything was except for a dang call and a put this man prioritizes us as students... Show more Written 4 months after purchase See all reviews About the creator JC View profile Jonathan Clegg @ jonnyoptions • Joined May 2023 Hey i’m Jonny a trader and mentor who helps people build freedom through trading. I went from failing high school and being broke to creating a life built on discipline and consistency. Now i help traders learn a proven strategy develop structure and build the confidence to finally start winning in the markets FAQs What strategy does Jonny teach? What brokerage does Jonny use? How long has Jonny been trading? What strategy does Jonny teach? How long has Jonny been trading? Affiliates BT Become an affiliate Boka Trading 30% reward Earn money by bringing customers to Boka Trading . Every time a customer purchases using your link, you&#x27;ll earn a commission. Premium Live Trading $49.00 / month Join $49.00 / month Pay Join Pay Join Premium Live Trading | Whop",
  "finalUrl": "https://whop.com/jonnyoptions/jonnyoptionss/",
  "fetchedAt": "2025-11-05T09:17:33.757Z",
  "textHash": "8770df4e38829224abcec242628d6cc702d8a3caea0feda31c756153707795d3",
  "drilled": false
}