{
  "baseUrl": "https://whop.com/premium-membership-7e-8c6f/?a=alexburnett21",
  "title": "Oracle Insights | Whop",
  "h1": "Oracle Insights",
  "bullets": [
    "Powered by OI Oracle Insights Iâ€™m a dedicated trader with years of experience, offering an exclusive teaching service to help you succeed in the markets. Whether you&#x27;re a beginner or experienced, I&#x27;ll guide you through proven stra... More 5.0 ( 42 ) Contact seller Products $100.00 / month Free trial Master time/price theory with expert trading guidance. Premium Membership ðŸ’Ž 5.0 ( 17 ) Free Master the markets via the weekly analysis &amp; trade recaps. Oracle Insights Access 5.0 ( 20 ) $50.00 Master trading with advanced time/price models &amp; psychology. A-Z Trading Guide ðŸ“– New $25.00 / month Free trial All-in-one Quarterly Theory indicator. Oracle Insight&#x27;s QT Indicator 5.0 ( 3 ) $15.00 / month Free trial Quarterly Theory Entry Model â€“ Powered by TCISD + SSMT tCISD Model (Bucko) 5.0 ( 1 ) $35.00 / month Free trial Oracle Insight&#x27;s QT Toolkit &amp; tCISD Model (Bucko) Indicators Oracle Insight&#x27;s Tools New $80.00 A Complete A-Z Course on Quarterly Theory. Premium QuarterlyTheory Course 5.0 ( 1 ) Contact seller Reviews T TL â€¢ Oracle Insights Access 18 days ago Bucko has excellent knowledge on QT and has helped add clarity and conviction to my trading Written 4 days after purchase",
    "O OSAMA â€¢ Premium QuarterlyTheory Course 23 days ago Best information Written 2 days after purchase",
    "R relle0074 â€¢ Oracle Insights Access 1 month ago Has given me more clarity on my trading analysis and taken the emotion out it all. Finally an uncomplicated way to trade and so well explained and supported. Thank you Written 3 months after purchase",
    "P PmacTrades â€¢ Oracle Insights Access 1 month ago Bucko is the absolute GOAT, I have learned so much important information from him and now trading with QT concepts have become so much more clear. Forever grateful for his teachings! Written 1 month after purchase"
  ],
  "paras": [
    "OI Oracle Insights Iâ€™m a dedicated trader with years of experience, offering an exclusive teaching service to help you succeed in the markets. Whether you&#x27;re a beginner or experienced, I&#x27;ll guide you through proven stra... More 5.0 ( 42 ) Contact seller Products $100.00 / month Free trial Master time/price theory with expert trading guidance. Premium Membership ðŸ’Ž 5.0 ( 17 ) Free Master the markets via the weekly analysis &amp; trade recaps. Oracle Insights Access 5.0 ( 20 ) $50.00 Master trading with advanced time/price models &amp; psychology. A-Z Trading Guide ðŸ“– New $25.00 / month Free trial All-in-one Quarterly Theory indicator. Oracle Insight&#x27;s QT Indicator 5.0 ( 3 ) $15.00 / month Free trial Quarterly Theory Entry Model â€“ Powered by TCISD + SSMT tCISD Model (Bucko) 5.0 ( 1 ) $35.00 / month Free trial Oracle Insight&#x27;s QT Toolkit &amp; tCISD Model (Bucko) Indicators Oracle Insight&#x27;s Tools New $80.00 A Complete A-Z Course on Quarterly Theory. Premium QuarterlyTheory Course 5.0 ( 1 ) Contact seller Reviews T TL â€¢ Oracle Insights Access 18 days ago Bucko has excellent knowledge on QT and has helped add clarity and conviction to my trading",
    "23 days ago Best information",
    "1 month ago Has given me more clarity on my trading analysis and taken the emotion out it all. Finally an uncomplicated way to trade and so well explained and supported. Thank you",
    "1 month ago Bucko is the absolute GOAT, I have learned so much important information from him and now trading with QT concepts have become so much more clear. Forever grateful for his teachings!"
  ],
  "priceTokens": [
    "$100.00",
    "$50.00",
    "$25.00",
    "$15.00",
    "$35.00",
    "$80.00",
    "$1",
    "$1",
    "$1",
    "$21",
    "$1",
    "$1",
    "$1",
    "$1",
    "$28",
    "$1",
    "$28",
    "$28",
    "$28",
    "$28"
  ],
  "faq": [],
  "textSample": "Powered by OI Oracle Insights Iâ€™m a dedicated trader with years of experience, offering an exclusive teaching service to help you succeed in the markets. Whether you&#x27;re a beginner or experienced, I&#x27;ll guide you through proven stra... More 5.0 ( 42 ) Contact seller Products $100.00 / month Free trial Master time/price theory with expert trading guidance. Premium Membership ðŸ’Ž 5.0 ( 17 ) Free Master the markets via the weekly analysis &amp; trade recaps. Oracle Insights Access 5.0 ( 20 ) $50.00 Master trading with advanced time/price models &amp; psychology. A-Z Trading Guide ðŸ“– New $25.00 / month Free trial All-in-one Quarterly Theory indicator. Oracle Insight&#x27;s QT Indicator 5.0 ( 3 ) $15.00 / month Free trial Quarterly Theory Entry Model â€“ Powered by TCISD + SSMT tCISD Model (Bucko) 5.0 ( 1 ) $35.00 / month Free trial Oracle Insight&#x27;s QT Toolkit &amp; tCISD Model (Bucko) Indicators Oracle Insight&#x27;s Tools New $80.00 A Complete A-Z Course on Quarterly Theory. Premium QuarterlyTheory Course 5.0 ( 1 ) Contact seller Reviews T TL â€¢ Oracle Insights Access 18 days ago Bucko has excellent knowledge on QT and has helped add clarity and conviction to my trading Written 4 days after purchase O OSAMA â€¢ Premium QuarterlyTheory Course 23 days ago Best information Written 2 days after purchase R relle0074 â€¢ Oracle Insights Access 1 month ago Has given me more clarity on my trading analysis and taken the emotion out it all. Finally an uncomplicated way to trade and so well explained and supported. Thank you Written 3 months after purchase P PmacTrades â€¢ Oracle Insights Access 1 month ago Bucko is the absolute GOAT, I have learned so much important information from him and now trading with QT concepts have become so much more clear. Forever grateful for his teachings! Written 1 month after purchase See all reviews Oracle Insights | Whop",
  "finalUrl": "https://whop.com/premium-membership-7e-8c6f/?a=alexburnett21",
  "fetchedAt": "2025-11-05T09:19:09.393Z",
  "textHash": "4cfcd687d89ec4e99342cd0d6c764cc6a2381eed2a3730d9b2b77a348f929685",
  "drilled": false
}