{
  "baseUrl": "https://whop.com/premium-pinterest/le-cercle/",
  "title": "Premium Pinterest+ | Whop",
  "h1": "Premium Pinterest+",
  "bullets": [
    "Premium Pinterest+ | Whop Sign in LC Premium Pinterest+ Le guide ultime pour Pinterest ads en France 5.0 ( 15 ) Other Découvrez des stratégies exclusives, des études de cas, et des produits à tester chaque semaine. Rejoignez notre communauté active et accédez à un agent privé. €249.00 one-time purchase Pay Join Join 195 members Features Tout ce qui est inclu dans le Premium Pinterest",
    "Accès aux meet-ups IRL trimestriels",
    "Appels réguliers pour répondre à toutes vos questions (Membres Pinterest+)",
    "Accès à un agent privé (Prix très compétitif)",
    "Accès à des informations exclusives (stratégie worldwide..)",
    "S Snash 2 years ago Meilleur serveur Franco Written 1 year after purchase",
    "DF Dylan Ferreira 2 years ago Je conseille le cercle à n'importe quel personne qui souhaite ce lancé sure pinterest ADS. Pour un tout petit investissement vous avez tout ce qu'il faut pour généré vos premiers profits de façon constante et sure le long terme. Written 5 months after purchase",
    "HI Hamllaoui Ibrahim 2 years ago La formation le plus complète sur le marché. Full plus-value ✅✅ Written 7 months after purchase",
    "IS Ibrahim ben Salem 2 years ago Incroyable groupe d’entraide cette Anne mini 100k de ça Written 13 days after purchase"
  ],
  "paras": [
    "Sign in LC Premium Pinterest+ Le guide ultime pour Pinterest ads en France 5.0 ( 15 ) Other Découvrez des stratégies exclusives, des études de cas, et des produits à tester chaque semaine. Rejoignez notre communauté active et accédez à un agent privé.",
    "Join 195 members Features Tout ce qui est inclu dans le Premium Pinterest Accès aux meet-ups IRL trimestriels Appels réguliers pour répondre à toutes vos questions (Membres Pinterest+) Accès à un agent privé (Prix très compétitif) Accès à des informations exclusives (stratégie worldwide..) Reviews 5 out of 5 15 total reviews 5 stars 4 stars 3 stars 2 stars 1 star S Snash 2 years ago Meilleur serveur Franco",
    "2 years ago Je conseille le cercle à n'importe quel personne qui souhaite ce lancé sure pinterest ADS. Pour un tout petit investissement vous avez tout ce qu'il faut pour généré vos premiers profits de façon constante et sure le long terme.",
    "2 years ago La formation le plus complète sur le marché. Full plus-value ✅✅",
    "2 years ago Incroyable groupe d’entraide cette Anne mini 100k de ça",
    "About the creator E View profile EcomGuy @ weakestadmirer9b59 • Joined Jun 2022 J&#x27;ai passé des années à perfectionner mes stratégies sur Pinterest. Ce guide est le fruit de mon expérience et vous offre des informations exclusives pour réussir en dropshipping. FAQs Comment puis-je accéder aux salons exclusifs ? Le contenu est-il adapté aux débutants ? Affiliates LC Become an affiliate Le Cercle 30% reward Earn money by bringing customers to Le Cercle. Every time a customer purchases using your link, you&#x27;ll earn a commission."
  ],
  "priceTokens": [
    "€249.00",
    "€249.00",
    "€249.00",
    "$1",
    "$1",
    "$1",
    "$22",
    "$1",
    "$1",
    "$1",
    "$1",
    "$1",
    "$2",
    "$1",
    "$2",
    "$2",
    "$2",
    "$2",
    "$3",
    "$3"
  ],
  "faq": [],
  "textSample": "Premium Pinterest+ | Whop Sign in LC Premium Pinterest+ Le guide ultime pour Pinterest ads en France 5.0 ( 15 ) Other Découvrez des stratégies exclusives, des études de cas, et des produits à tester chaque semaine. Rejoignez notre communauté active et accédez à un agent privé. €249.00 one-time purchase Pay Join Join 195 members Features Tout ce qui est inclu dans le Premium Pinterest Accès aux meet-ups IRL trimestriels Appels réguliers pour répondre à toutes vos questions (Membres Pinterest+) Accès à un agent privé (Prix très compétitif) Accès à des informations exclusives (stratégie worldwide..) Reviews 5 out of 5 15 total reviews 5 stars 4 stars 3 stars 2 stars 1 star S Snash 2 years ago Meilleur serveur Franco Written 1 year after purchase DF Dylan Ferreira 2 years ago Je conseille le cercle à n'importe quel personne qui souhaite ce lancé sure pinterest ADS. Pour un tout petit investissement vous avez tout ce qu'il faut pour généré vos premiers profits de façon constante et sure le long terme. Written 5 months after purchase HI Hamllaoui Ibrahim 2 years ago La formation le plus complète sur le marché. Full plus-value ✅✅ Written 7 months after purchase IS Ibrahim ben Salem 2 years ago Incroyable groupe d’entraide cette Anne mini 100k de ça Written 13 days after purchase See all reviews About the creator E View profile EcomGuy @ weakestadmirer9b59 • Joined Jun 2022 J&#x27;ai passé des années à perfectionner mes stratégies sur Pinterest. Ce guide est le fruit de mon expérience et vous offre des informations exclusives pour réussir en dropshipping. FAQs Comment puis-je accéder aux salons exclusifs ? Le contenu est-il adapté aux débutants ? Affiliates LC Become an affiliate Le Cercle 30% reward Earn money by bringing customers to Le Cercle. Every time a customer purchases using your link, you&#x27;ll earn a commission. Premium Pinterest+ €249.00 one-time purchase Join €249.00 one-time purchase Pay Join Pay Join",
  "finalUrl": "https://whop.com/premium-pinterest/le-cercle/",
  "fetchedAt": "2025-11-05T09:26:55.849Z",
  "textHash": "6e4881f16172d8d39f9f2e8c979118c3dbdbf41119ed5cb6761b1efecc8cfbd4",
  "drilled": false
}