{
  "baseUrl": "https://whop.com/vnkumartrades/?a=alexburnett21",
  "title": "vnkumartrades | Whop",
  "h1": "vnkumartrades",
  "bullets": [
    "Powered by V vnkumartrades 3.9 ( 58 ) Contact seller Products $75.00 / month Master Stocks and Options with VNKumarTrades! Basic Plan 3.6 ( 9 ) $99.00 / month Master Stocks and Options with VNKumarTrades! Premium Plan 4.4 ( 8 ) $149.00 / month 10KTO50K CHALLENGE ELITE PLAN 10KTO50K CHALLENGE ELITE PLAN 4.6 ( 29 ) Contact seller Reviews CC Chirag Chaudhari • Premium Plan 1 month ago Very good at trading Written 4 months after purchase",
    "SC Saravanan Chinniah • 10KTO50K CHALLENGE ELITE PLAN 9 months ago Kumar is an amazing trader with good return rate on his strangles! Appreciate and keep it up. Written 21 days after purchase",
    "NU Nageswara R Uppuluri • Basic Plan 9 months ago King of Strangle player, always play on safe bet. Written 1 year after purchase",
    "S SKK • 10KTO50K CHALLENGE ELITE PLAN 9 months ago Great Strangle player.. Safe calls!! Written 22 days after purchase"
  ],
  "paras": [
    "V vnkumartrades 3.9 ( 58 ) Contact seller Products $75.00 / month Master Stocks and Options with VNKumarTrades! Basic Plan 3.6 ( 9 ) $99.00 / month Master Stocks and Options with VNKumarTrades! Premium Plan 4.4 ( 8 ) $149.00 / month 10KTO50K CHALLENGE ELITE PLAN 10KTO50K CHALLENGE ELITE PLAN 4.6 ( 29 ) Contact seller Reviews CC Chirag Chaudhari • Premium Plan 1 month ago Very good at trading",
    "9 months ago Kumar is an amazing trader with good return rate on his strangles! Appreciate and keep it up.",
    "9 months ago King of Strangle player, always play on safe bet.",
    "9 months ago Great Strangle player.. Safe calls!!"
  ],
  "priceTokens": [
    "$75.00",
    "$99.00",
    "$149.00",
    "$1",
    "$1",
    "$1",
    "$21",
    "$1",
    "$1",
    "$1",
    "$1",
    "$28",
    "$1",
    "$28",
    "$28",
    "$28",
    "$28",
    "$3",
    "$3",
    "$3"
  ],
  "faq": [],
  "textSample": "Powered by V vnkumartrades 3.9 ( 58 ) Contact seller Products $75.00 / month Master Stocks and Options with VNKumarTrades! Basic Plan 3.6 ( 9 ) $99.00 / month Master Stocks and Options with VNKumarTrades! Premium Plan 4.4 ( 8 ) $149.00 / month 10KTO50K CHALLENGE ELITE PLAN 10KTO50K CHALLENGE ELITE PLAN 4.6 ( 29 ) Contact seller Reviews CC Chirag Chaudhari • Premium Plan 1 month ago Very good at trading Written 4 months after purchase SC Saravanan Chinniah • 10KTO50K CHALLENGE ELITE PLAN 9 months ago Kumar is an amazing trader with good return rate on his strangles! Appreciate and keep it up. Written 21 days after purchase NU Nageswara R Uppuluri • Basic Plan 9 months ago King of Strangle player, always play on safe bet. Written 1 year after purchase S SKK • 10KTO50K CHALLENGE ELITE PLAN 9 months ago Great Strangle player.. Safe calls!! Written 22 days after purchase See all reviews vnkumartrades | Whop",
  "finalUrl": "https://whop.com/vnkumartrades/?a=alexburnett21",
  "fetchedAt": "2025-11-04T20:00:40.806Z",
  "textHash": "24e6f49f9b93413df730cdaee321dae1262a141e54353e4364719ca04a971c70",
  "drilled": false
}