{
  "baseUrl": "https://whop.com/prodigy-investors/premium-discord-weekly/",
  "title": "Premium Discord (Weekly) | Whop",
  "h1": "Premium Discord (Weekly)",
  "bullets": [
    "Sign in PI Premium Discord (Weekly) #1 AND MOST PROFITABLE TRADING COMMUNITY 5.0 ( 19 ) Other Get access to premium signals, live stream trading, UnusualWhales Bot, and more... $20.00 / week Pay Join Join 6 members Features Unlimited access to UnusualWhales Bot for tracking options activity.",
    "Join live trading sessions and learn from real-time trades.",
    "Receive daily actionable trade signals for informed decisions.",
    "Access mentorship and learning tools from expert mentors.",
    "Participate in after-market Q&amp;A sessions for trade reviews.",
    "TS Tony Stonks 1 year ago Hands down one of the best trading servers out there! Not only are they live every day but the community is welcoming and engaged. Not to mention its banger after to banger call out for insane gains every day, every week, every month. I followed these guys from another server and will follow them to... Show more Written 5 days after purchase",
    "C CM 1 year ago These guys take the time to explain in detail why they trade what they trade . I learned a lot here and theyâ€™re always willing to help Written 1 month after purchase",
    "JA Jace Angelette 1 year ago This group is definitely set apart from the others, itâ€™s only been around a month and I have already learned a lot. They are very transparent and perform lives daily. Overall a solid place to be if you are trying to level up! Written 1 month after purchase",
    "ID Ivan Clyde Dimabayao 1 year ago HELLLLAA GOATED COMMUNITY, EXCELLENT DEAL FOR PURCHASE TYPE SHIII, We got CARLITOS, RAD, LIRQS, GARRETT, TORQUE â€” Helping the ENTIRE community to get profit. This is act insane omm, YOU GUYS AND THE COMMUNITY IS GOATED !!! Shoutout to POPETH FOR BEING LIVELY AND A GREAT FACTOR OF THE COMMUNITYðŸ’¯ðŸ’¯... Show more Written 2 months after purchase"
  ],
  "paras": [
    "Sign in PI Premium Discord (Weekly) #1 AND MOST PROFITABLE TRADING COMMUNITY 5.0 ( 19 ) Other Get access to premium signals, live stream trading, UnusualWhales Bot, and more...",
    "Join 6 members Features Unlimited access to UnusualWhales Bot for tracking options activity. Join live trading sessions and learn from real-time trades. Receive daily actionable trade signals for informed decisions. Access mentorship and learning tools from expert mentors. Participate in after-market Q&amp;A sessions for trade reviews. Reviews 5 out of 5 19 total reviews 5 stars 4 stars 3 stars 2 stars 1 star TS Tony Stonks 1 year ago Hands down one of the best trading servers out there! Not only are they live every day but the community is welcoming and engaged. Not to mention its banger after to banger call out for insane gains every day, every week, every month. I followed these guys from another server and will follow them to...",
    "Written 5 days after purchase C CM 1 year ago These guys take the time to explain in detail why they trade what they trade . I learned a lot here and theyâ€™re always willing to help",
    "1 year ago This group is definitely set apart from the others, itâ€™s only been around a month and I have already learned a lot. They are very transparent and perform lives daily. Overall a solid place to be if you are trying to level up!",
    "1 year ago HELLLLAA GOATED COMMUNITY, EXCELLENT DEAL FOR PURCHASE TYPE SHIII, We got CARLITOS, RAD, LIRQS, GARRETT, TORQUE â€” Helping the ENTIRE community to get profit. This is act insane omm, YOU GUYS AND THE COMMUNITY IS GOATED !!! Shoutout to POPETH FOR BEING LIVELY AND A GREAT FACTOR OF THE COMMUNITYðŸ’¯ðŸ’¯...",
    "Written 2 months after purchase See all reviews About the creator PI View profile Prodigy Investors @ prodigyassociatesllc â€¢ Joined Sep 2024 Prodigy Investors was founded by passionate and experienced traders with a clear vision: to create a community where aspiring and experienced traders alike could learn, grow, and succeed together. With years of experience in options and day trading, our founders have developed a deep understanding of chart analysis, market trends, and trade execution. FAQs What do I get with daily signals? How do live trading sessions work? What is the refund policy? What is the UnusualWhales bot? What is included in the Premium Discord access? Affiliates PI Become an affiliate Prodigy Investors 10% reward Earn money by bringing customers to Prodigy Investors. Every time a customer purchases using your link, you&#x27;ll earn a commission."
  ],
  "priceTokens": [
    "$20.00",
    "$20.00",
    "$20.00",
    "$1",
    "$1",
    "$1",
    "$22",
    "$1",
    "$1",
    "$1",
    "$1",
    "$1",
    "$2",
    "$1",
    "$2",
    "$2",
    "$2",
    "$2",
    "$3",
    "$3"
  ],
  "faq": [],
  "textSample": "Sign in PI Premium Discord (Weekly) #1 AND MOST PROFITABLE TRADING COMMUNITY 5.0 ( 19 ) Other Get access to premium signals, live stream trading, UnusualWhales Bot, and more... $20.00 / week Pay Join Join 6 members Features Unlimited access to UnusualWhales Bot for tracking options activity. Join live trading sessions and learn from real-time trades. Receive daily actionable trade signals for informed decisions. Access mentorship and learning tools from expert mentors. Participate in after-market Q&amp;A sessions for trade reviews. Reviews 5 out of 5 19 total reviews 5 stars 4 stars 3 stars 2 stars 1 star TS Tony Stonks 1 year ago Hands down one of the best trading servers out there! Not only are they live every day but the community is welcoming and engaged. Not to mention its banger after to banger call out for insane gains every day, every week, every month. I followed these guys from another server and will follow them to... Show more Written 5 days after purchase C CM 1 year ago These guys take the time to explain in detail why they trade what they trade . I learned a lot here and theyâ€™re always willing to help Written 1 month after purchase JA Jace Angelette 1 year ago This group is definitely set apart from the others, itâ€™s only been around a month and I have already learned a lot. They are very transparent and perform lives daily. Overall a solid place to be if you are trying to level up! Written 1 month after purchase ID Ivan Clyde Dimabayao 1 year ago HELLLLAA GOATED COMMUNITY, EXCELLENT DEAL FOR PURCHASE TYPE SHIII, We got CARLITOS, RAD, LIRQS, GARRETT, TORQUE â€” Helping the ENTIRE community to get profit. This is act insane omm, YOU GUYS AND THE COMMUNITY IS GOATED !!! Shoutout to POPETH FOR BEING LIVELY AND A GREAT FACTOR OF THE COMMUNITYðŸ’¯ðŸ’¯... Show more Written 2 months after purchase See all reviews About the creator PI View profile Prodigy Investors @ prodigyassociatesllc â€¢ Joined Sep 2024 Prodigy Investors was founded by passionate and experienced traders with a clear vision: to create a community where aspiring and experienced traders alike could learn, grow, and succeed together. With years of experience in options and day trading, our founders have developed a deep understanding of chart analysis, market trends, and trade execution. FAQs What do I get with daily signals? How do live trading sessions work? What is the refund policy? What is the UnusualWhales bot? What is included in the Premium Discord access? Affiliates PI Become an affiliate Prodigy Investors 10% reward Earn money by bringing customers to Prodigy Investors. Every time a customer purchases using your link, you&#x27;ll earn a commission. Premium Discord (Weekly) $20.00 / week Join $20.00 / week Pay Join Pay Join Premium Discord (Weekly) | Whop",
  "finalUrl": "https://whop.com/prodigy-investors/premium-discord-weekly/",
  "fetchedAt": "2025-11-05T09:28:21.059Z",
  "textHash": "2430ea5085d100f8b4c8875c63de6b530365243adc097010e1333e70b7ae7fab",
  "drilled": false
}