{
  "baseUrl": "https://whop.com/prime-picks-whop/primepicks-weekly-subscription/",
  "title": "PrimePicks Premium Membership | Whop",
  "h1": "PrimePicks Premium Membership",
  "bullets": [
    "Sign in Unmute Unmute Unmute Unmute Unmute Unmute P PrimePicks Premium Membership Join the #1 Sports Picks Community &amp; Start To Win 10k+/Month 4.9 ( 160 ) Other Get expert picks, proven strategies, and step-by-step guidance to consistently beat the books. Join members already turning their sports knowledge into reliable 10k+ monthly income $19.99 / week Pay Join Features ğŸ¯ Premium Picks : Access to expert daily picks and in-depth analysis",
    "ğŸ“Š Bankroll Management: Learn key strategies and tracking methods to profit",
    "ğŸ“š Exclusive Resources: Gain access to advanced betting tips, and strategies",
    "ğŸ¤ Premium Community: Connect with a vibrant, high-level group of analyst",
    "N NinoEvans 1 month ago Loving the experience & learning something new everyday ğŸ’¯ Written 2 days after purchase",
    "M MT84 5 months ago Very cool club to be a part of very informative and helpful i highly recommend this discord Written 1 month after purchase",
    "GD Glenn DaSilva 5 months ago Excellent picks in the premium. Have to be in it for the long haul and you will prosper !!!!!!! Written 5 months after purchase",
    "AR Andrew Ramos 5 months ago Been in free chat for about a month, them free plays clutch, good reads. Written 4 months after purchase"
  ],
  "paras": [
    "Sign in Unmute Unmute Unmute Unmute Unmute Unmute P PrimePicks Premium Membership Join the #1 Sports Picks Community &amp; Start To Win 10k+/Month 4.9 ( 160 ) Other Get expert picks, proven strategies, and step-by-step guidance to consistently beat the books. Join members already turning their sports knowledge into reliable 10k+ monthly income",
    "$19.99 / week Pay Join Features ğŸ¯ Premium Picks : Access to expert daily picks and in-depth analysis ğŸ“Š Bankroll Management: Learn key strategies and tracking methods to profit ğŸ“š Exclusive Resources: Gain access to advanced betting tips, and strategies ğŸ¤ Premium Community: Connect with a vibrant, high-level group of analyst Reviews 4.93 out of 5 160 total reviews 5 stars 4 stars 3 stars 2 stars 1 star N NinoEvans 1 month ago Loving the experience & learning something new everyday ğŸ’¯",
    "5 months ago Very cool club to be a part of very informative and helpful i highly recommend this discord",
    "5 months ago Excellent picks in the premium. Have to be in it for the long haul and you will prosper !!!!!!!",
    "5 months ago Been in free chat for about a month, them free plays clutch, good reads.",
    "About the creator J View profile Jay @ jayscaledlt â€¢ Joined Jun 2024 I&#x27;ve dedicated my career to mastering sports betting analysis. With PrimePicks, I share my expertise to help you make informed bets and maximize your winnings. FAQs How often are plays posted? Can I switch between memberships? Is the Free Discord Access really free? How does the 3-day free trial work? Can I cancel the free trial without being charged? Affiliates P Become an affiliate PrimePicks 30% reward Earn money by bringing customers to PrimePicks. Every time a customer purchases using your link, you&#x27;ll earn a commission."
  ],
  "priceTokens": [
    "$19.99",
    "$19.99",
    "$19.99",
    "$1",
    "$1",
    "$1",
    "$23",
    "$1",
    "$1",
    "$1",
    "$1",
    "$1",
    "$2",
    "$1",
    "$2",
    "$2",
    "$2",
    "$2",
    "$3",
    "$3"
  ],
  "faq": [],
  "textSample": "Sign in Unmute Unmute Unmute Unmute Unmute Unmute P PrimePicks Premium Membership Join the #1 Sports Picks Community &amp; Start To Win 10k+/Month 4.9 ( 160 ) Other Get expert picks, proven strategies, and step-by-step guidance to consistently beat the books. Join members already turning their sports knowledge into reliable 10k+ monthly income $19.99 / week Pay Join Features ğŸ¯ Premium Picks : Access to expert daily picks and in-depth analysis ğŸ“Š Bankroll Management: Learn key strategies and tracking methods to profit ğŸ“š Exclusive Resources: Gain access to advanced betting tips, and strategies ğŸ¤ Premium Community: Connect with a vibrant, high-level group of analyst Reviews 4.93 out of 5 160 total reviews 5 stars 4 stars 3 stars 2 stars 1 star N NinoEvans 1 month ago Loving the experience & learning something new everyday ğŸ’¯ Written 2 days after purchase M MT84 5 months ago Very cool club to be a part of very informative and helpful i highly recommend this discord Written 1 month after purchase GD Glenn DaSilva 5 months ago Excellent picks in the premium. Have to be in it for the long haul and you will prosper !!!!!!! Written 5 months after purchase AR Andrew Ramos 5 months ago Been in free chat for about a month, them free plays clutch, good reads. Written 4 months after purchase See all reviews About the creator J View profile Jay @ jayscaledlt â€¢ Joined Jun 2024 I&#x27;ve dedicated my career to mastering sports betting analysis. With PrimePicks, I share my expertise to help you make informed bets and maximize your winnings. FAQs How often are plays posted? Can I switch between memberships? Is the Free Discord Access really free? How does the 3-day free trial work? Can I cancel the free trial without being charged? Affiliates P Become an affiliate PrimePicks 30% reward Earn money by bringing customers to PrimePicks. Every time a customer purchases using your link, you&#x27;ll earn a commission. PrimePicks Premium Membership $19.99 / week +2 options Join $19.99 / week 2 options Pay Join Pay Join PrimePicks Premium Membership | Whop",
  "finalUrl": "https://whop.com/prime-picks-whop/primepicks-weekly-subscription/",
  "fetchedAt": "2025-11-04T21:43:46.134Z",
  "textHash": "fadb0a910a5af72185af91a4b484c6d782ab188a6af972470a762168ae54160c",
  "drilled": false
}