{
  "baseUrl": "https://whop.com/youtube-ranking-masterclass/product-pushers/",
  "title": "Product Pushers Lifetime | Whop",
  "h1": "Product Pushers Lifetime",
  "bullets": [
    "Product Pushers Lifetime | Whop Sign in PP Product Pushers Lifetime Join the #1 Digital Product Community 4.8 ( 13 ) Social media Unlock various organic traffic strategies $249.99 one-time purchase Pay Join Join 246 members Features Access to a private community of over 200 digital business owners.",
    "Learn 4 traffic generation methods that turned $0 to $40k profit.",
    "1 on 1 access to EP for personalized guidance.",
    "Joint-ventures channel to partner with other professionals.",
    "E Ershad 1 year ago You will have a direct access to EP which is of great value and he is always present when you need him but I feel it's a bit advanced for beginners Written 1 month after purchase",
    "KS Kyle Savidge 1 year ago Fantastic community for WiFi money. Community is engaging, collaborative, and active. EP provides valuable knowledge and insights, and drops guides to help with various online business verticals. As always, it requires putting in the work and effort to be valuable for you. Equal opportunity, unequal... Show more Written 1 month after purchase",
    "GS George Sparrow 1 year ago You get 1:1 mentorship from a guy who made millions selling infoproducts, i guess it's worth it Written 1 month after purchase",
    "JW Jeremy West 1 year ago honestly never experienced a better community than this one , value is insane and i recommend yall to join us Written 1 month after purchase"
  ],
  "paras": [
    "Sign in PP Product Pushers Lifetime Join the #1 Digital Product Community 4.8 ( 13 ) Social media Unlock various organic traffic strategies",
    "Join 246 members Features Access to a private community of over 200 digital business owners. Learn 4 traffic generation methods that turned $0 to $40k profit. 1 on 1 access to EP for personalized guidance. Joint-ventures channel to partner with other professionals. Reviews 4.85 out of 5 13 total reviews 5 stars 4 stars 3 stars 2 stars 1 star E Ershad 1 year ago You will have a direct access to EP which is of great value and he is always present when you need him but I feel it's a bit advanced for beginners",
    "1 year ago Fantastic community for WiFi money. Community is engaging, collaborative, and active. EP provides valuable knowledge and insights, and drops guides to help with various online business verticals. As always, it requires putting in the work and effort to be valuable for you. Equal opportunity, unequal...",
    "Written 1 month after purchase GS George Sparrow 1 year ago You get 1:1 mentorship from a guy who made millions selling infoproducts, i guess it's worth it",
    "1 year ago honestly never experienced a better community than this one , value is insane and i recommend yall to join us",
    "About the creator E View profile ep @ twitterep • Joined Apr 2024 Affiliates PP Become an affiliate Product Pushers 30% reward Earn money by bringing customers to Product Pushers. Every time a customer purchases using your link, you&#x27;ll earn a commission."
  ],
  "priceTokens": [
    "$249.99",
    "$0",
    "$40",
    "$249.99",
    "$249.99",
    "$1",
    "$1",
    "$1",
    "$22",
    "$1",
    "$1",
    "$1",
    "$1",
    "$1",
    "$2",
    "$1",
    "$2",
    "$2",
    "$2",
    "$2"
  ],
  "faq": [],
  "textSample": "Product Pushers Lifetime | Whop Sign in PP Product Pushers Lifetime Join the #1 Digital Product Community 4.8 ( 13 ) Social media Unlock various organic traffic strategies $249.99 one-time purchase Pay Join Join 246 members Features Access to a private community of over 200 digital business owners. Learn 4 traffic generation methods that turned $0 to $40k profit. 1 on 1 access to EP for personalized guidance. Joint-ventures channel to partner with other professionals. Reviews 4.85 out of 5 13 total reviews 5 stars 4 stars 3 stars 2 stars 1 star E Ershad 1 year ago You will have a direct access to EP which is of great value and he is always present when you need him but I feel it's a bit advanced for beginners Written 1 month after purchase KS Kyle Savidge 1 year ago Fantastic community for WiFi money. Community is engaging, collaborative, and active. EP provides valuable knowledge and insights, and drops guides to help with various online business verticals. As always, it requires putting in the work and effort to be valuable for you. Equal opportunity, unequal... Show more Written 1 month after purchase GS George Sparrow 1 year ago You get 1:1 mentorship from a guy who made millions selling infoproducts, i guess it's worth it Written 1 month after purchase JW Jeremy West 1 year ago honestly never experienced a better community than this one , value is insane and i recommend yall to join us Written 1 month after purchase See all reviews About the creator E View profile ep @ twitterep • Joined Apr 2024 Affiliates PP Become an affiliate Product Pushers 30% reward Earn money by bringing customers to Product Pushers. Every time a customer purchases using your link, you&#x27;ll earn a commission. Product Pushers Lifetime $249.99 one-time purchase Join $249.99 one-time purchase Pay Join Pay Join",
  "finalUrl": "https://whop.com/youtube-ranking-masterclass/product-pushers/",
  "fetchedAt": "2025-11-05T10:00:47.710Z",
  "textHash": "439d8a775ee3fe89c4ab756b56704fdf9f162030c16e0919facd7bfa349e1ae1",
  "drilled": false
}