{
  "baseUrl": "https://whop.com/profitbeasts/?a=alexburnett21",
  "title": "ProfitBeasts Sports Bets | Whop",
  "h1": "ProfitBeasts Sports Bets",
  "bullets": [
    "Powered by PB ProfitBeasts Sports Bets ProfitBeasts Sports Bets offers the most accurate and affordable sports picks with an 83.4% hit rate. Our expert team simplifies betting for beginners and pros alike, delivering daily picks, giveaways... More 4.7 ( 703 ) Contact seller Products Unmute $9.99 / 3 days #1 Ranked Sports Picks In The World üèÜ ProfitBeasts Sports Bets 4.7 ( 645 ) $297.00 / month The only private group where $10K+ months are the standard. ProfitBeasts Inner Circle 5.0 ( 1 ) Contact seller Reviews D DQGM ‚Ä¢ ProfitBeasts Inner Circle 10 hours ago very beginner friendly and solid straight bets Written 2 days after purchase",
    "CW Camerie Williams ‚Ä¢ ProfitBeasts Sports Bets 2 days ago Great picks Written 10 days after purchase",
    "TO Tyler Owens 4 days ago That good Written 6 months after purchase",
    "CR Chauncey Rogers ‚Ä¢ ProfitBeasts Sports Bets 6 days ago In the green since joining Written 2 days after purchase"
  ],
  "paras": [
    "PB ProfitBeasts Sports Bets ProfitBeasts Sports Bets offers the most accurate and affordable sports picks with an 83.4% hit rate. Our expert team simplifies betting for beginners and pros alike, delivering daily picks, giveaways... More 4.7 ( 703 ) Contact seller Products Unmute $9.99 / 3 days #1 Ranked Sports Picks In The World üèÜ ProfitBeasts Sports Bets 4.7 ( 645 ) $297.00 / month The only private group where $10K+ months are the standard. ProfitBeasts Inner Circle 5.0 ( 1 ) Contact seller Reviews D DQGM ‚Ä¢ ProfitBeasts Inner Circle 10 hours ago very beginner friendly and solid straight bets",
    "2 days ago Great picks",
    "4 days ago That good",
    "6 days ago In the green since joining"
  ],
  "priceTokens": [
    "$9.99",
    "$297.00",
    "$10",
    "$1",
    "$1",
    "$1",
    "$21",
    "$1",
    "$1",
    "$1",
    "$1",
    "$28",
    "$1",
    "$28",
    "$28",
    "$28",
    "$28",
    "$3",
    "$3",
    "$3"
  ],
  "faq": [],
  "textSample": "Powered by PB ProfitBeasts Sports Bets ProfitBeasts Sports Bets offers the most accurate and affordable sports picks with an 83.4% hit rate. Our expert team simplifies betting for beginners and pros alike, delivering daily picks, giveaways... More 4.7 ( 703 ) Contact seller Products Unmute $9.99 / 3 days #1 Ranked Sports Picks In The World üèÜ ProfitBeasts Sports Bets 4.7 ( 645 ) $297.00 / month The only private group where $10K+ months are the standard. ProfitBeasts Inner Circle 5.0 ( 1 ) Contact seller Reviews D DQGM ‚Ä¢ ProfitBeasts Inner Circle 10 hours ago very beginner friendly and solid straight bets Written 2 days after purchase CW Camerie Williams ‚Ä¢ ProfitBeasts Sports Bets 2 days ago Great picks Written 10 days after purchase TO Tyler Owens 4 days ago That good Written 6 months after purchase CR Chauncey Rogers ‚Ä¢ ProfitBeasts Sports Bets 6 days ago In the green since joining Written 2 days after purchase See all reviews ProfitBeasts Sports Bets | Whop",
  "finalUrl": "https://whop.com/profitbeasts/?a=alexburnett21",
  "fetchedAt": "2025-11-05T09:49:15.684Z",
  "textHash": "de301c5162f37c3c24d1f1456405f50d749193b62ded947eca83eccc48c47cf2",
  "drilled": false
}