{
  "baseUrl": "https://whop.com/purrnet/royal-british/",
  "title": "Royal British | Whop",
  "h1": "Royal British",
  "bullets": [
    "Sign in P Royal British Greatly aid your multiplayer game development Video games Get access to the highest priority public support channel $100.00 / month Pay Subscribe Features Custom Discord role with access to the highest tier support",
    "Devs download project if needed",
    "Early Access Features",
    "Pure breed cat role (very important)"
  ],
  "paras": [
    "Sign in P Royal British Greatly aid your multiplayer game development Video games Get access to the highest priority public support channel",
    "Custom Discord role with access to the highest tier support Devs download project if needed Early Access Features Pure breed cat role (very important) About the creator B View profile Bobsi @ bobsi • Joined Nov 2024 FAQs How do I get priority support? Affiliates P Become an affiliate PurrNet 30% reward Earn money by bringing customers to PurrNet. Every time a customer purchases using your link, you&#x27;ll earn a commission."
  ],
  "priceTokens": [
    "$100.00",
    "$100.00",
    "$100.00",
    "$1",
    "$1",
    "$1",
    "$22",
    "$1",
    "$1",
    "$1",
    "$1",
    "$1",
    "$2",
    "$1",
    "$2",
    "$2",
    "$2",
    "$2",
    "$3",
    "$3"
  ],
  "faq": [],
  "textSample": "Sign in P Royal British Greatly aid your multiplayer game development Video games Get access to the highest priority public support channel $100.00 / month Pay Subscribe Features Custom Discord role with access to the highest tier support Devs download project if needed Early Access Features Pure breed cat role (very important) About the creator B View profile Bobsi @ bobsi • Joined Nov 2024 FAQs How do I get priority support? Affiliates P Become an affiliate PurrNet 30% reward Earn money by bringing customers to PurrNet. Every time a customer purchases using your link, you&#x27;ll earn a commission. Royal British $100.00 / month Subscribe $100.00 / month Pay Subscribe Pay Subscribe Royal British | Whop",
  "finalUrl": "https://whop.com/purrnet/royal-british/",
  "fetchedAt": "2025-11-05T10:53:05.535Z",
  "textHash": "0f9c48e20dfdf931358c03b49061182af36917035839bef032a217146b511975",
  "drilled": false
}