{
  "baseUrl": "https://whop.com/ryan-wagner-sports-vip-plays/ryan-wagner-sports-vip-plays/?a=alexburnett21",
  "title": "Ryan Wagner Sports VIP Plays! | Whop",
  "h1": "Ryan Wagner Sports VIP Plays!",
  "bullets": [
    "Sign in RP Ryan Wagner Sports VIP Plays! Sports Betting VIP Picks! 3.8 ( 24 ) Sports betting Full card that includes my 3-5 most confident picks every single day! We bet MLB, NFL, NCAAB and NCAAF! $20.00 / week Pay Join Features 3-5 Of My Most Confident Plays Every Single Night Backed By My Computer Model!",
    "ZR Zeke Rhodes 2 months ago Wide variety of sports. Doesn’t take heavy favorites. I definitely recommend getting in here. Written 2 minutes after purchase",
    "KB Kirk Ball 2 months ago Second time joining and it’s straight cash consistency is key Written 3 days after purchase",
    "FT Frank Thames 2 months ago Good College Football Written 12 hours after purchase",
    "ML Matthew long 2 months ago Not that good continues to go 1-3 and 2-2 Written 6 days after purchase"
  ],
  "paras": [
    "Sign in RP Ryan Wagner Sports VIP Plays! Sports Betting VIP Picks! 3.8 ( 24 ) Sports betting Full card that includes my 3-5 most confident picks every single day! We bet MLB, NFL, NCAAB and NCAAF!",
    "$20.00 / week Pay Join Features 3-5 Of My Most Confident Plays Every Single Night Backed By My Computer Model! Reviews 3.83 out of 5 24 total reviews 5 stars 4 stars 3 stars 2 stars 1 star ZR Zeke Rhodes 2 months ago Wide variety of sports. Doesn’t take heavy favorites. I definitely recommend getting in here.",
    "2 months ago Second time joining and it’s straight cash consistency is key",
    "2 months ago Good College Football",
    "2 months ago Not that good continues to go 1-3 and 2-2",
    "About the creator R View profile Ryan @ ryanwagnersports • Joined Feb 2025 FAQs What is a unit? Why don&#x27;t you parlay? What is your refund policy? Affiliates RP Become an affiliate Ryan Wagner Sports VIP Plays! 30% reward Earn money by bringing customers to Ryan Wagner Sports VIP Plays!. Every time a customer purchases using your link, you&#x27;ll earn a commission."
  ],
  "priceTokens": [
    "$20.00",
    "$20.00",
    "$20.00",
    "$1",
    "$1",
    "$1",
    "$23",
    "$1",
    "$1",
    "$1",
    "$1",
    "$1",
    "$2",
    "$1",
    "$2",
    "$2",
    "$2",
    "$2",
    "$3",
    "$3"
  ],
  "faq": [],
  "textSample": "Sign in RP Ryan Wagner Sports VIP Plays! Sports Betting VIP Picks! 3.8 ( 24 ) Sports betting Full card that includes my 3-5 most confident picks every single day! We bet MLB, NFL, NCAAB and NCAAF! $20.00 / week Pay Join Features 3-5 Of My Most Confident Plays Every Single Night Backed By My Computer Model! Reviews 3.83 out of 5 24 total reviews 5 stars 4 stars 3 stars 2 stars 1 star ZR Zeke Rhodes 2 months ago Wide variety of sports. Doesn’t take heavy favorites. I definitely recommend getting in here. Written 2 minutes after purchase KB Kirk Ball 2 months ago Second time joining and it’s straight cash consistency is key Written 3 days after purchase FT Frank Thames 2 months ago Good College Football Written 12 hours after purchase ML Matthew long 2 months ago Not that good continues to go 1-3 and 2-2 Written 6 days after purchase See all reviews About the creator R View profile Ryan @ ryanwagnersports • Joined Feb 2025 FAQs What is a unit? Why don&#x27;t you parlay? What is your refund policy? Affiliates RP Become an affiliate Ryan Wagner Sports VIP Plays! 30% reward Earn money by bringing customers to Ryan Wagner Sports VIP Plays!. Every time a customer purchases using your link, you&#x27;ll earn a commission. Ryan Wagner Sports VIP Plays! $20.00 / week +1 option Join $20.00 / week 1 option Pay Join Pay Join Ryan Wagner Sports VIP Plays! | Whop",
  "finalUrl": "https://whop.com/ryan-wagner-sports-vip-plays/ryan-wagner-sports-vip-plays/?a=alexburnett21",
  "fetchedAt": "2025-11-04T20:03:30.365Z",
  "textHash": "480b7047079140983a075d6f282127553e7890331bfc2f733e8f000cb8b1c76e",
  "drilled": true
}