{
  "baseUrl": "https://whop.com/sharpmoney/sharpmoney-premium/",
  "title": "SharpMoney +EV Main Markets | Whop",
  "h1": "SharpMoney +EV Main Markets",
  "bullets": [
    "Sign in Unmute Unmute S SharpMoney +EV Main Markets Start Your Profitable Sports Betting Journey Today! 5.0 ( 88 ) Sports betting Join SharpMoney for expert betting advice, daily callouts, and a bot identifying positive EV bets. Elevate your betting game with our community. $39.99 / month 3 day trial Pay Join Join 69 members Features +EV Bots for Spreads, Totals and Moneylines",
    "Circa, BookMaker and Pinnacle odds",
    "Receive daily callouts from successful sports bettors.",
    "Identify betting market trends through line movement.",
    "Gain access to real-time data from top sportsbooks.",
    "TB Todd Buckholt 16 days ago In my first 3 months of using Sharp Money, I profited more than I had in the previous 9 months as a square bettor. The tools are amazingly helpful, but the commitment to educating and developing smarter betting habits is invaluable. Highly recommend to anyone looking to become a winning sports betto... Show more Written 2 months after purchase",
    "L LetsGoSquale 16 days ago The Sharp Money Discord changed my life. In only 3 months I have profit over 20k God bless Written 4 months after purchase",
    "RP Rob Purchase 16 days ago VIP & +EV Bundle member. I can't say enough about the Sharp Money team, its been a great ride, and will continue to be great. VIP with ClosingDime, MathWins, and Sigma has been phenomenal; its great because they post the plays and what range of odds to take those plays at. All we have to do is us... Show more Written 3 months after purchase",
    "NC Nicholas Cobb 17 days ago VIP subscription is where it’s at if you’re ready to take your getting to the next level! With 3 phenomenal originators in Closing Dime, MathWins and SigmaSquirrel, you get a diverse portfolio of plays from the entire team. There’s no better time to join than NOW - we are in the pinnacle of sports w... Show more Written 1 year after purchase"
  ],
  "paras": [
    "Sign in Unmute Unmute S SharpMoney +EV Main Markets Start Your Profitable Sports Betting Journey Today! 5.0 ( 88 ) Sports betting Join SharpMoney for expert betting advice, daily callouts, and a bot identifying positive EV bets. Elevate your betting game with our community.",
    "$39.99 / month 3 day trial Pay Join Join 69 members Features +EV Bots for Spreads, Totals and Moneylines Circa, BookMaker and Pinnacle odds Receive daily callouts from successful sports bettors. Identify betting market trends through line movement. Gain access to real-time data from top sportsbooks. Reviews 5 out of 5 88 total reviews 5 stars 4 stars 3 stars 2 stars 1 star TB Todd Buckholt 16 days ago In my first 3 months of using Sharp Money, I profited more than I had in the previous 9 months as a square bettor. The tools are amazingly helpful, but the commitment to educating and developing smarter betting habits is invaluable. Highly recommend to anyone looking to become a winning sports betto...",
    "Written 2 months after purchase L LetsGoSquale 16 days ago The Sharp Money Discord changed my life. In only 3 months I have profit over 20k God bless",
    "16 days ago VIP & +EV Bundle member. I can't say enough about the Sharp Money team, its been a great ride, and will continue to be great. VIP with ClosingDime, MathWins, and Sigma has been phenomenal; its great because they post the plays and what range of odds to take those plays at. All we have to do is us...",
    "Written 3 months after purchase NC Nicholas Cobb 17 days ago VIP subscription is where it’s at if you’re ready to take your getting to the next level! With 3 phenomenal originators in Closing Dime, MathWins and SigmaSquirrel, you get a diverse portfolio of plays from the entire team. There’s no better time to join than NOW - we are in the pinnacle of sports w...",
    "Written 1 year after purchase See all reviews About the creator S View profile SharpMoney @ sharpmoneydiscord • Joined Mar 2024 +EV Betting Bots and VIP Picks Affiliates S Become an affiliate SharpMoney 25% reward Earn money by bringing customers to SharpMoney. Every time a customer purchases using your link, you&#x27;ll earn a commission."
  ],
  "priceTokens": [
    "$39.99",
    "$39.99",
    "$39.99",
    "$1",
    "$1",
    "$1",
    "$22",
    "$1",
    "$1",
    "$1",
    "$1",
    "$1",
    "$2",
    "$1",
    "$2",
    "$2",
    "$2",
    "$2",
    "$3",
    "$3"
  ],
  "faq": [],
  "textSample": "Sign in Unmute Unmute S SharpMoney +EV Main Markets Start Your Profitable Sports Betting Journey Today! 5.0 ( 88 ) Sports betting Join SharpMoney for expert betting advice, daily callouts, and a bot identifying positive EV bets. Elevate your betting game with our community. $39.99 / month 3 day trial Pay Join Join 69 members Features +EV Bots for Spreads, Totals and Moneylines Circa, BookMaker and Pinnacle odds Receive daily callouts from successful sports bettors. Identify betting market trends through line movement. Gain access to real-time data from top sportsbooks. Reviews 5 out of 5 88 total reviews 5 stars 4 stars 3 stars 2 stars 1 star TB Todd Buckholt 16 days ago In my first 3 months of using Sharp Money, I profited more than I had in the previous 9 months as a square bettor. The tools are amazingly helpful, but the commitment to educating and developing smarter betting habits is invaluable. Highly recommend to anyone looking to become a winning sports betto... Show more Written 2 months after purchase L LetsGoSquale 16 days ago The Sharp Money Discord changed my life. In only 3 months I have profit over 20k God bless Written 4 months after purchase RP Rob Purchase 16 days ago VIP & +EV Bundle member. I can't say enough about the Sharp Money team, its been a great ride, and will continue to be great. VIP with ClosingDime, MathWins, and Sigma has been phenomenal; its great because they post the plays and what range of odds to take those plays at. All we have to do is us... Show more Written 3 months after purchase NC Nicholas Cobb 17 days ago VIP subscription is where it’s at if you’re ready to take your getting to the next level! With 3 phenomenal originators in Closing Dime, MathWins and SigmaSquirrel, you get a diverse portfolio of plays from the entire team. There’s no better time to join than NOW - we are in the pinnacle of sports w... Show more Written 1 year after purchase See all reviews About the creator S View profile SharpMoney @ sharpmoneydiscord • Joined Mar 2024 +EV Betting Bots and VIP Picks Affiliates S Become an affiliate SharpMoney 25% reward Earn money by bringing customers to SharpMoney. Every time a customer purchases using your link, you&#x27;ll earn a commission. SharpMoney +EV Main Markets $39.99 / month +1 option Join $39.99 / month 1 option Pay Join Pay Join SharpMoney +EV Main Markets | Whop",
  "finalUrl": "https://whop.com/sharpmoney/sharpmoney-premium/",
  "fetchedAt": "2025-11-05T09:17:34.848Z",
  "textHash": "2e28ee44d0f86394bb65e3fbac4ef0199289f500e4e96ab76acd8962b78ebf03",
  "drilled": false
}