{
  "baseUrl": "https://whop.com/sharpmoney/sharpmoney-ev-player-props/",
  "title": "SharpMoney +EV Player Props | Whop",
  "h1": "SharpMoney +EV Player Props",
  "bullets": [
    "Sign in Unmute Unmute S SharpMoney +EV Player Props FInd +EV bets for the player prop market 5.0 ( 86 ) Sports betting Receive alerts for NBA,NFL,MLB and NHL player props $19.99 / month Pay Join Join 22 members Features NFL +EV Player Props",
    "NBA +EV Player Props",
    "NHL +EV Player Props",
    "MLB +EV Player Props",
    "TB Todd Buckholt 15 days ago In my first 3 months of using Sharp Money, I profited more than I had in the previous 9 months as a square bettor. The tools are amazingly helpful, but the commitment to educating and developing smarter betting habits is invaluable. Highly recommend to anyone looking to become a winning sports betto... Show more Written 2 months after purchase",
    "L LetsGoSquale 15 days ago The Sharp Money Discord changed my life. In only 3 months I have profit over 20k God bless Written 4 months after purchase",
    "RP Rob Purchase 16 days ago VIP & +EV Bundle member. I can't say enough about the Sharp Money team, its been a great ride, and will continue to be great. VIP with ClosingDime, MathWins, and Sigma has been phenomenal; its great because they post the plays and what range of odds to take those plays at. All we have to do is us... Show more Written 3 months after purchase",
    "NC Nicholas Cobb 17 days ago VIP subscription is where it’s at if you’re ready to take your getting to the next level! With 3 phenomenal originators in Closing Dime, MathWins and SigmaSquirrel, you get a diverse portfolio of plays from the entire team. There’s no better time to join than NOW - we are in the pinnacle of sports w... Show more Written 1 year after purchase"
  ],
  "paras": [
    "Sign in Unmute Unmute S SharpMoney +EV Player Props FInd +EV bets for the player prop market 5.0 ( 86 ) Sports betting Receive alerts for NBA,NFL,MLB and NHL player props",
    "$19.99 / month Pay Join Join 22 members Features NFL +EV Player Props NBA +EV Player Props NHL +EV Player Props MLB +EV Player Props Reviews 5 out of 5 86 total reviews 5 stars 4 stars 3 stars 2 stars 1 star TB Todd Buckholt 15 days ago In my first 3 months of using Sharp Money, I profited more than I had in the previous 9 months as a square bettor. The tools are amazingly helpful, but the commitment to educating and developing smarter betting habits is invaluable. Highly recommend to anyone looking to become a winning sports betto...",
    "Written 2 months after purchase L LetsGoSquale 15 days ago The Sharp Money Discord changed my life. In only 3 months I have profit over 20k God bless",
    "16 days ago VIP & +EV Bundle member. I can't say enough about the Sharp Money team, its been a great ride, and will continue to be great. VIP with ClosingDime, MathWins, and Sigma has been phenomenal; its great because they post the plays and what range of odds to take those plays at. All we have to do is us...",
    "Written 3 months after purchase NC Nicholas Cobb 17 days ago VIP subscription is where it’s at if you’re ready to take your getting to the next level! With 3 phenomenal originators in Closing Dime, MathWins and SigmaSquirrel, you get a diverse portfolio of plays from the entire team. There’s no better time to join than NOW - we are in the pinnacle of sports w...",
    "Written 1 year after purchase See all reviews About the creator S View profile SharpMoney @ sharpmoneydiscord • Joined Mar 2024 +EV Betting Bots and VIP Picks Affiliates S Become an affiliate SharpMoney 30% reward Earn money by bringing customers to SharpMoney. Every time a customer purchases using your link, you&#x27;ll earn a commission."
  ],
  "priceTokens": [
    "$19.99",
    "$19.99",
    "$19.99",
    "$1",
    "$1",
    "$1",
    "$22",
    "$1",
    "$1",
    "$1",
    "$1",
    "$1",
    "$2",
    "$1",
    "$2",
    "$2",
    "$2",
    "$2",
    "$3",
    "$3"
  ],
  "faq": [],
  "textSample": "Sign in Unmute Unmute S SharpMoney +EV Player Props FInd +EV bets for the player prop market 5.0 ( 86 ) Sports betting Receive alerts for NBA,NFL,MLB and NHL player props $19.99 / month Pay Join Join 22 members Features NFL +EV Player Props NBA +EV Player Props NHL +EV Player Props MLB +EV Player Props Reviews 5 out of 5 86 total reviews 5 stars 4 stars 3 stars 2 stars 1 star TB Todd Buckholt 15 days ago In my first 3 months of using Sharp Money, I profited more than I had in the previous 9 months as a square bettor. The tools are amazingly helpful, but the commitment to educating and developing smarter betting habits is invaluable. Highly recommend to anyone looking to become a winning sports betto... Show more Written 2 months after purchase L LetsGoSquale 15 days ago The Sharp Money Discord changed my life. In only 3 months I have profit over 20k God bless Written 4 months after purchase RP Rob Purchase 16 days ago VIP & +EV Bundle member. I can't say enough about the Sharp Money team, its been a great ride, and will continue to be great. VIP with ClosingDime, MathWins, and Sigma has been phenomenal; its great because they post the plays and what range of odds to take those plays at. All we have to do is us... Show more Written 3 months after purchase NC Nicholas Cobb 17 days ago VIP subscription is where it’s at if you’re ready to take your getting to the next level! With 3 phenomenal originators in Closing Dime, MathWins and SigmaSquirrel, you get a diverse portfolio of plays from the entire team. There’s no better time to join than NOW - we are in the pinnacle of sports w... Show more Written 1 year after purchase See all reviews About the creator S View profile SharpMoney @ sharpmoneydiscord • Joined Mar 2024 +EV Betting Bots and VIP Picks Affiliates S Become an affiliate SharpMoney 30% reward Earn money by bringing customers to SharpMoney. Every time a customer purchases using your link, you&#x27;ll earn a commission. SharpMoney +EV Player Props $19.99 / month +1 option Join $19.99 / month 1 option Pay Join Pay Join SharpMoney +EV Player Props | Whop",
  "finalUrl": "https://whop.com/sharpmoney/sharpmoney-ev-player-props/",
  "fetchedAt": "2025-11-04T20:09:02.059Z",
  "textHash": "381fa1369bc0526d468ffa1e79b901e2e0faa7ed261050d3e2a486473b8cd420",
  "drilled": false
}