{
  "baseUrl": "https://whop.com/mokstudios/forex-and-futures-trading-course/",
  "title": "Smart Money Concepts Course | Whop",
  "h1": "Smart Money Concepts Course",
  "bullets": [
    "Sign in Unmute Unmute MS Smart Money Concepts Course Master Forex &amp; Futures in Hours 4.5 ( 2 ) Marketing agency Learn Forex and Futures Trading using Smart Money Concepts in an easy-to-follow course. Get expert support post-purchase. $50.00 one-time purchase Pay Purchase Join 2 members Features Comprehensive course crafted for Forex and Futures trading success.",
    "Access to experienced support for all your queries and concerns.",
    "Personalized learning experiences tailored to your needs.",
    "AM Anderson Mathura 1 year ago I am very pleased with the services Written 1 month after purchase",
    "S salehhussayn 11 days ago Written 8 months after purchase"
  ],
  "paras": [
    "Sign in Unmute Unmute MS Smart Money Concepts Course Master Forex &amp; Futures in Hours 4.5 ( 2 ) Marketing agency Learn Forex and Futures Trading using Smart Money Concepts in an easy-to-follow course. Get expert support post-purchase.",
    "Join 2 members Features Comprehensive course crafted for Forex and Futures trading success. Access to experienced support for all your queries and concerns. Personalized learning experiences tailored to your needs. Reviews 4.50 out of 5 2 total reviews 5 stars 4 stars 3 stars 2 stars 1 star AM Anderson Mathura 1 year ago I am very pleased with the services",
    "11 days ago",
    "Affiliates MS Become an affiliate Mind of Khan Studios 50% reward Earn money by bringing customers to Mind of Khan Studios. Every time a customer purchases using your link, you&#x27;ll earn a commission."
  ],
  "priceTokens": [
    "$50.00",
    "$50.00",
    "$50.00",
    "$1",
    "$1",
    "$1",
    "$22",
    "$1",
    "$1",
    "$1",
    "$1",
    "$1",
    "$2",
    "$1",
    "$2",
    "$2",
    "$2",
    "$2",
    "$3",
    "$3"
  ],
  "faq": [],
  "textSample": "Sign in Unmute Unmute MS Smart Money Concepts Course Master Forex &amp; Futures in Hours 4.5 ( 2 ) Marketing agency Learn Forex and Futures Trading using Smart Money Concepts in an easy-to-follow course. Get expert support post-purchase. $50.00 one-time purchase Pay Purchase Join 2 members Features Comprehensive course crafted for Forex and Futures trading success. Access to experienced support for all your queries and concerns. Personalized learning experiences tailored to your needs. Reviews 4.50 out of 5 2 total reviews 5 stars 4 stars 3 stars 2 stars 1 star AM Anderson Mathura 1 year ago I am very pleased with the services Written 1 month after purchase S salehhussayn 11 days ago Written 8 months after purchase About the creator MK View profile Mikkell Khan @ mindofkhan â€¢ Joined Aug 2024 Affiliates MS Become an affiliate Mind of Khan Studios 50% reward Earn money by bringing customers to Mind of Khan Studios. Every time a customer purchases using your link, you&#x27;ll earn a commission. Smart Money Concepts Course $50.00 one-time purchase Purchase $50.00 one-time purchase Pay Purchase Pay Purchase Smart Money Concepts Course | Whop",
  "finalUrl": "https://whop.com/mokstudios/forex-and-futures-trading-course/",
  "fetchedAt": "2025-11-04T19:59:19.658Z",
  "textHash": "f6a86d984f9d4aeaf0e2fdc90098272af66d986e7eb06acfc97d6a5e0c077b2f",
  "drilled": false
}