{
  "baseUrl": "https://whop.com/kaikicks-apprentice/sneaker-cookgroup/",
  "title": "Kaikicks Apprentice Sneakers | Whop",
  "h1": "Kaikicks Apprentice Sneakers",
  "bullets": [
    "Sign in KA Kaikicks Apprentice Sneakers Sneaker &amp; Streetwear Cookgroup! 4.9 ( 119 ) Reselling We supply all the information for Sneakers &amp; Streetwear. This includes information for upcoming releases, raffles, restock notifications, 1on1 support &amp; so much more! We have taught over 1,000 different members to resell inside our community. Join today to get instant access! Â£15.00 / month Pay Get access Features All Sneaker Information",
    "Regular Sneaker Brick Flips",
    "ACO For Sneaker Releases",
    "Blazing Fast Monitors - All RESTOCKS!",
    "Guides &amp; 24/7 Personal 1 To 1 Support",
    "J Jake 2 months ago Joined this group brand new to reselling, and its helped me make loads of profit so far, resubbed for my second month. Very helpful discord (: Written 1 month after purchase",
    "E Em0105 2 months ago Made me a lot of ðŸ’· Written 3 months after purchase",
    "TH tom hoey 2 months ago great monitor Written 8 days after purchase",
    "J Jack6855 2 months ago Top group, great monitor and amazing support! Written 1 month after purchase"
  ],
  "paras": [
    "Sign in KA Kaikicks Apprentice Sneakers Sneaker &amp; Streetwear Cookgroup! 4.9 ( 119 ) Reselling We supply all the information for Sneakers &amp; Streetwear. This includes information for upcoming releases, raffles, restock notifications, 1on1 support &amp; so much more! We have taught over 1,000 different members to resell inside our community. Join today to get instant access!",
    "All Sneaker Information Regular Sneaker Brick Flips ACO For Sneaker Releases Blazing Fast Monitors - All RESTOCKS! Guides &amp; 24/7 Personal 1 To 1 Support Reviews 4.87 out of 5 119 total reviews 5 stars 4 stars 3 stars 2 stars 1 star J Jake 2 months ago Joined this group brand new to reselling, and its helped me make loads of profit so far, resubbed for my second month. Very helpful discord (:",
    "2 months ago Made me a lot of ðŸ’·",
    "2 months ago great monitor",
    "2 months ago Top group, great monitor and amazing support!",
    "About the creator KB View profile Kai Bray @ knrb0219376 â€¢ Joined Jul 2021 Weâ€™re a reselling community focused on helping you make money in the EU and UK markets. From sneakers and PokÃ©mon to streetwear and random flips, plus our own custom Vinted monitor. FAQs What makes us different to other cookgroups? How do I Profit from this Service? How Much Money Can I Make? Can I cancel this service whenever I want? How is Reselling RISK FREE!? Affiliates KA Become an affiliate Kaikicks Apprentice 30% reward Earn money by bringing customers to Kaikicks Apprentice. Every time a customer purchases using your link, you&#x27;ll earn a commission."
  ],
  "priceTokens": [
    "Â£15.00",
    "Â£15.00",
    "Â£15.00",
    "$1",
    "$1",
    "$1",
    "$22",
    "$1",
    "$1",
    "$1",
    "$1",
    "$1",
    "$2",
    "$1",
    "$2",
    "$2",
    "$2",
    "$2",
    "$3",
    "$3"
  ],
  "faq": [],
  "textSample": "Sign in KA Kaikicks Apprentice Sneakers Sneaker &amp; Streetwear Cookgroup! 4.9 ( 119 ) Reselling We supply all the information for Sneakers &amp; Streetwear. This includes information for upcoming releases, raffles, restock notifications, 1on1 support &amp; so much more! We have taught over 1,000 different members to resell inside our community. Join today to get instant access! Â£15.00 / month Pay Get access Features All Sneaker Information Regular Sneaker Brick Flips ACO For Sneaker Releases Blazing Fast Monitors - All RESTOCKS! Guides &amp; 24/7 Personal 1 To 1 Support Reviews 4.87 out of 5 119 total reviews 5 stars 4 stars 3 stars 2 stars 1 star J Jake 2 months ago Joined this group brand new to reselling, and its helped me make loads of profit so far, resubbed for my second month. Very helpful discord (: Written 1 month after purchase E Em0105 2 months ago Made me a lot of ðŸ’· Written 3 months after purchase TH tom hoey 2 months ago great monitor Written 8 days after purchase J Jack6855 2 months ago Top group, great monitor and amazing support! Written 1 month after purchase See all reviews About the creator KB View profile Kai Bray @ knrb0219376 â€¢ Joined Jul 2021 Weâ€™re a reselling community focused on helping you make money in the EU and UK markets. From sneakers and PokÃ©mon to streetwear and random flips, plus our own custom Vinted monitor. FAQs What makes us different to other cookgroups? How do I Profit from this Service? How Much Money Can I Make? Can I cancel this service whenever I want? How is Reselling RISK FREE!? Affiliates KA Become an affiliate Kaikicks Apprentice 30% reward Earn money by bringing customers to Kaikicks Apprentice. Every time a customer purchases using your link, you&#x27;ll earn a commission. Kaikicks Apprentice Sneakers Â£15.00 / month Get access Â£15.00 / month Pay Get access Pay Get access Kaikicks Apprentice Sneakers | Whop",
  "finalUrl": "https://whop.com/kaikicks-apprentice/sneaker-cookgroup/",
  "fetchedAt": "2025-11-04T21:54:22.894Z",
  "textHash": "e56a466e084ec70ba25970fdfc74222919345774634c5750a4a02836b74b24a4",
  "drilled": false
}