{
  "baseUrl": "https://whop.com/vintedseekers/?a=alexburnett21",
  "title": "VintedSeekers | Whop",
  "h1": "VintedSeekers",
  "bullets": [
    "Powered by V VintedSeekers Our Discord bot scans listings lightning-fast âš¡ â€” with AutoBuy, AutoChat, and smart filters to secure the steals you want. Stay ahead of the crowd and never miss a bargain again. ğŸš€ 5.0 ( 14 ) Contact seller Products â‚¬15.00 / month Free trial âš¡ Revolutionize Vinted Botting with Speed &amp; Precision! ğŸ” ğŸ§Solo | VintedSeekers 5.0 ( 9 ) â‚¬30.00 / month âš¡ Revolutionize Vinted Botting with Speed &amp; Precision! ğŸ” ğŸ§Solo Plus | VintedSeekers 5.0 ( 5 ) â‚¬39.90 / month ğŸ¤– Bring Vinted Botting to Your Own Discord Server! ğŸ” ğŸ§‘â€ğŸ¤â€ğŸ§‘F&amp;F | VintedSeekers New Contact seller Reviews WM Wilfred Taylor Mcgeever â€¢ ğŸ§Solo Plus | VintedSeekers 1 month ago amazing sever quick resolution to any issues and helps to get deals faster than anyone else Written 4 months after purchase",
    "IF Imran FERRAROTTO â€¢ ğŸ§Solo Plus | VintedSeekers 1 month ago fantastic server and very nice stuff, thanks ;) Written 9 days after purchase",
    "E Emil â€¢ ğŸ§Solo | VintedSeekers 2 months ago fantastic service, itâ€™s a real game changer, saves so so much time as i donâ€™t need to check vinted every minute Written 7 days after purchase",
    "AR Aleksander Racicki â€¢ ğŸ§Solo | VintedSeekers 2 months ago Fantastic stuff going on here, have to give it 5 stars just for how good it isâ€¦ wouldnâ€™t mind gatekeeping this, only buy this is you mean business ğŸ˜› Written 4 months after purchase"
  ],
  "paras": [
    "V VintedSeekers Our Discord bot scans listings lightning-fast âš¡ â€” with AutoBuy, AutoChat, and smart filters to secure the steals you want. Stay ahead of the crowd and never miss a bargain again. ğŸš€ 5.0 ( 14 ) Contact seller Products â‚¬15.00 / month Free trial âš¡ Revolutionize Vinted Botting with Speed &amp; Precision! ğŸ” ğŸ§Solo | VintedSeekers 5.0 ( 9 ) â‚¬30.00 / month âš¡ Revolutionize Vinted Botting with Speed &amp; Precision! ğŸ” ğŸ§Solo Plus | VintedSeekers 5.0 ( 5 ) â‚¬39.90 / month ğŸ¤– Bring Vinted Botting to Your Own Discord Server! ğŸ” ğŸ§‘â€ğŸ¤â€ğŸ§‘F&amp;F | VintedSeekers New Contact seller Reviews WM Wilfred Taylor Mcgeever â€¢ ğŸ§Solo Plus | VintedSeekers 1 month ago amazing sever quick resolution to any issues and helps to get deals faster than anyone else",
    "1 month ago fantastic server and very nice stuff, thanks ;)",
    "2 months ago fantastic service, itâ€™s a real game changer, saves so so much time as i donâ€™t need to check vinted every minute",
    "2 months ago Fantastic stuff going on here, have to give it 5 stars just for how good it isâ€¦ wouldnâ€™t mind gatekeeping this, only buy this is you mean business ğŸ˜›"
  ],
  "priceTokens": [
    "â‚¬15.00",
    "â‚¬30.00",
    "â‚¬39.90",
    "$1",
    "$1",
    "$1",
    "$21",
    "$1",
    "$1",
    "$1",
    "$1",
    "$28",
    "$1",
    "$28",
    "$28",
    "$28",
    "$28",
    "$3",
    "$3",
    "$3"
  ],
  "faq": [],
  "textSample": "Powered by V VintedSeekers Our Discord bot scans listings lightning-fast âš¡ â€” with AutoBuy, AutoChat, and smart filters to secure the steals you want. Stay ahead of the crowd and never miss a bargain again. ğŸš€ 5.0 ( 14 ) Contact seller Products â‚¬15.00 / month Free trial âš¡ Revolutionize Vinted Botting with Speed &amp; Precision! ğŸ” ğŸ§Solo | VintedSeekers 5.0 ( 9 ) â‚¬30.00 / month âš¡ Revolutionize Vinted Botting with Speed &amp; Precision! ğŸ” ğŸ§Solo Plus | VintedSeekers 5.0 ( 5 ) â‚¬39.90 / month ğŸ¤– Bring Vinted Botting to Your Own Discord Server! ğŸ” ğŸ§‘â€ğŸ¤â€ğŸ§‘F&amp;F | VintedSeekers New Contact seller Reviews WM Wilfred Taylor Mcgeever â€¢ ğŸ§Solo Plus | VintedSeekers 1 month ago amazing sever quick resolution to any issues and helps to get deals faster than anyone else Written 4 months after purchase IF Imran FERRAROTTO â€¢ ğŸ§Solo Plus | VintedSeekers 1 month ago fantastic server and very nice stuff, thanks ;) Written 9 days after purchase E Emil â€¢ ğŸ§Solo | VintedSeekers 2 months ago fantastic service, itâ€™s a real game changer, saves so so much time as i donâ€™t need to check vinted every minute Written 7 days after purchase AR Aleksander Racicki â€¢ ğŸ§Solo | VintedSeekers 2 months ago Fantastic stuff going on here, have to give it 5 stars just for how good it isâ€¦ wouldnâ€™t mind gatekeeping this, only buy this is you mean business ğŸ˜› Written 4 months after purchase See all reviews VintedSeekers | Whop",
  "finalUrl": "https://whop.com/vintedseekers/?a=alexburnett21",
  "fetchedAt": "2025-11-04T21:49:12.123Z",
  "textHash": "1a6b6d033c4a0fe3e1302ba978b75b984a46f162029059d76d8c8cc2c2d99bbc",
  "drilled": false
}