{
  "baseUrl": "https://whop.com/strategy-school/strategy-school/?a=alexburnett21",
  "title": "Strategy School | Whop",
  "h1": "Strategy School",
  "bullets": [
    "Sign in Unmute Unmute SS Strategy School Land elite strategy roles 5.0 ( 1 ) Careers Learn the secrets to landing six-figure management consulting or corporate strategy jobs $49.00 / month Pay Join Join 8 members Features 50+ course modules (5+ hours)",
    "1:1 onboarding call with Matt",
    "Master list of interview prep resources",
    "Weekly coaching calls",
    "Join a community of likeminded individuals",
    "YV yugal verma 1 month ago Written 1 month after purchase"
  ],
  "paras": [
    "Sign in Unmute Unmute SS Strategy School Land elite strategy roles 5.0 ( 1 ) Careers Learn the secrets to landing six-figure management consulting or corporate strategy jobs",
    "Join 8 members Features 50+ course modules (5+ hours) 1:1 onboarding call with Matt Master list of interview prep resources Weekly coaching calls Join a community of likeminded individuals Reviews 5 out of 5 1 review 5 stars 4 stars 3 stars 2 stars 1 star YV yugal verma 1 month ago",
    "FAQs What&#x27;s included in the course? Affiliates SS Become an affiliate Strategy School 25% reward Earn money by bringing customers to Strategy School. Every time a customer purchases using your link, you&#x27;ll earn a commission."
  ],
  "priceTokens": [
    "$49.00",
    "$49.00",
    "$49.00",
    "$1",
    "$1",
    "$1",
    "$23",
    "$1",
    "$1",
    "$1",
    "$1",
    "$1",
    "$2",
    "$1",
    "$2",
    "$2",
    "$2",
    "$2",
    "$3",
    "$3"
  ],
  "faq": [],
  "textSample": "Sign in Unmute Unmute SS Strategy School Land elite strategy roles 5.0 ( 1 ) Careers Learn the secrets to landing six-figure management consulting or corporate strategy jobs $49.00 / month Pay Join Join 8 members Features 50+ course modules (5+ hours) 1:1 onboarding call with Matt Master list of interview prep resources Weekly coaching calls Join a community of likeminded individuals Reviews 5 out of 5 1 review 5 stars 4 stars 3 stars 2 stars 1 star YV yugal verma 1 month ago Written 1 month after purchase About the creator MH View profile Matt Huang @ huangmatt â€¢ Joined Feb 2025 I&#x27;ve landed strategy roles at Google and BCG. Now, I&#x27;m sharing my entire system to help you land elite roles and start your career on the right foot. FAQs What&#x27;s included in the course? Affiliates SS Become an affiliate Strategy School 25% reward Earn money by bringing customers to Strategy School. Every time a customer purchases using your link, you&#x27;ll earn a commission. Strategy School $49.00 / month Join $49.00 / month Pay Join Pay Join Strategy School | Whop",
  "finalUrl": "https://whop.com/strategy-school/strategy-school/?a=alexburnett21",
  "fetchedAt": "2025-11-04T21:49:15.922Z",
  "textHash": "c81f593a86c4296c141d0efde7712aaea6d383cc944757dd396eacefb9896f6f",
  "drilled": true
}