{
  "baseUrl": "https://whop.com/snewj-props/monthly-straight-plays-vip-elite-56/",
  "title": "Straight Plays (ELITE) | Whop",
  "h1": "Straight Plays (ELITE)",
  "bullets": [
    "Straight Plays (ELITE) | Whop Sign in Unmute Unmute Unmute Unmute SP Straight Plays (ELITE) BIGGEST SPORTS COMMUNITY IN THE WORLD - 130,000+ CLIENTS 4.5 ( 637 ) Other Monthly Straight Picks / Plays. Where The BIG Money Is Made. Over $4.1m+ generated in client profits in 2024! $49.95 / month Pay Join Join 661 members Features Elite expert straight plays for serious money makers and sports enthusiasts",
    "Straight plays for the NBA, NFL, MLB, Tennis, and Soccer Daily",
    "Consistently cash out like tens of thousands of satisfied clients",
    "Carefully curated researched straight plays for maximum success",
    "Access to the exclusive SnewJProps VIP elite server, our top-tier package",
    "M motionman 4 hours ago Ngl Written 1 day after purchase",
    "AD Ace daGoon 1 day ago Bro ion care what nobody say I be hitting bro the goat Fs !!! You jus gotta realize iss hit or miss n you but I’ve profited way more than I’ve lost Written 5 days after purchase",
    "DB DA BO$$ 3 days ago SUPERDOPE MY BOI !!!!! YEEEEEEE!!!! Written 1 day after purchase",
    "BH Breyon HEATH 4 days ago l lol Written 1 year after purchase"
  ],
  "paras": [
    "Sign in Unmute Unmute Unmute Unmute SP Straight Plays (ELITE) BIGGEST SPORTS COMMUNITY IN THE WORLD - 130,000+ CLIENTS 4.5 ( 637 ) Other Monthly Straight Picks / Plays. Where The BIG Money Is Made. Over $4.1m+ generated in client profits in 2024!",
    "Join 661 members Features Elite expert straight plays for serious money makers and sports enthusiasts Straight plays for the NBA, NFL, MLB, Tennis, and Soccer Daily Consistently cash out like tens of thousands of satisfied clients Carefully curated researched straight plays for maximum success Access to the exclusive SnewJProps VIP elite server, our top-tier package Reviews 4.51 out of 5 637 total reviews 5 stars 4 stars 3 stars 2 stars 1 star M motionman 4 hours ago Ngl",
    "1 day ago Bro ion care what nobody say I be hitting bro the goat Fs !!! You jus gotta realize iss hit or miss n you but I’ve profited way more than I’ve lost",
    "3 days ago SUPERDOPE MY BOI !!!!! YEEEEEEE!!!!",
    "4 days ago l lol",
    "About the creator SP View profile SNEWJ PROPS @ snewjprops • Joined Mar 2024 With over a decade of experience. SnewJ Props shares Players Prop Picks that are highly researched by Elite Expert(s)-with immense knowledge about the game. All picks have high chances of success. FAQs What is included in my Purchase? How do I cancel Subscription? How is this Worth it? What is included in my Purchase? How do I cancel Subscription? Affiliates SP Become an affiliate SnewJ Props 30% reward Earn money by bringing customers to SnewJ Props. Every time a customer purchases using your link, you&#x27;ll earn a commission."
  ],
  "priceTokens": [
    "$4",
    "$4",
    "$4",
    "$4",
    "$49.95",
    "$49.95",
    "$49.95",
    "$4",
    "$1",
    "$1",
    "$1",
    "$23",
    "$1",
    "$1",
    "$1",
    "$1",
    "$1",
    "$2",
    "$1",
    "$2"
  ],
  "faq": [],
  "textSample": "Straight Plays (ELITE) | Whop Sign in Unmute Unmute Unmute Unmute SP Straight Plays (ELITE) BIGGEST SPORTS COMMUNITY IN THE WORLD - 130,000+ CLIENTS 4.5 ( 637 ) Other Monthly Straight Picks / Plays. Where The BIG Money Is Made. Over $4.1m+ generated in client profits in 2024! $49.95 / month Pay Join Join 661 members Features Elite expert straight plays for serious money makers and sports enthusiasts Straight plays for the NBA, NFL, MLB, Tennis, and Soccer Daily Consistently cash out like tens of thousands of satisfied clients Carefully curated researched straight plays for maximum success Access to the exclusive SnewJProps VIP elite server, our top-tier package Reviews 4.51 out of 5 637 total reviews 5 stars 4 stars 3 stars 2 stars 1 star M motionman 4 hours ago Ngl Written 1 day after purchase AD Ace daGoon 1 day ago Bro ion care what nobody say I be hitting bro the goat Fs !!! You jus gotta realize iss hit or miss n you but I’ve profited way more than I’ve lost Written 5 days after purchase DB DA BO$$ 3 days ago SUPERDOPE MY BOI !!!!! YEEEEEEE!!!! Written 1 day after purchase BH Breyon HEATH 4 days ago l lol Written 1 year after purchase See all reviews About the creator SP View profile SNEWJ PROPS @ snewjprops • Joined Mar 2024 With over a decade of experience. SnewJ Props shares Players Prop Picks that are highly researched by Elite Expert(s)-with immense knowledge about the game. All picks have high chances of success. FAQs What is included in my Purchase? How do I cancel Subscription? How is this Worth it? What is included in my Purchase? How do I cancel Subscription? Affiliates SP Become an affiliate SnewJ Props 30% reward Earn money by bringing customers to SnewJ Props. Every time a customer purchases using your link, you&#x27;ll earn a commission. Straight Plays (ELITE) $49.95 / month Join $49.95 / month Pay Join Pay Join",
  "finalUrl": "https://whop.com/snewj-props/monthly-straight-plays-vip-elite-56/",
  "fetchedAt": "2025-11-05T09:52:32.749Z",
  "textHash": "94bef2328b125a517a1a421f9c52d29174fea789ad75f024dcdc24c1bd0fcb04",
  "drilled": false
}