{
  "baseUrl": "https://whop.com/stupid-simple-devs/stupid-simple-devs/?a=alexburnett21",
  "title": "Stupid Simple Devs | Whop",
  "h1": "Stupid Simple Devs",
  "bullets": [
    "Sign in Unmute Unmute SD Stupid Simple Devs 5 people have sold $1,000+ apps following my strategy 3.0 ( 2 ) Other Learn to build apps with AI",
    "Learn to sell apps",
    "???",
    "Profit",
    "20% discount on all 1 on 1 calls.",
    "Access to coding bounties.",
    "Private Hackathons",
    "A Adam 1 month ago Written 5 months after purchase"
  ],
  "paras": [
    "Sign in Unmute Unmute SD Stupid Simple Devs 5 people have sold $1,000+ apps following my strategy 3.0 ( 2 ) Other Learn to build apps with AI Learn to sell apps ??? Profit 20% discount on all 1 on 1 calls. Access to coding bounties. Private Hackathons Free one-time purchase Pay Join Join 14 members Reviews 3 out of 5 2 total reviews 5 stars 4 stars 3 stars 2 stars 1 star A Adam 1 month ago",
    "Affiliates SD Become an affiliate Stupid Simple Devs 30% reward Earn money by bringing customers to Stupid Simple Devs. Every time a customer purchases using your link, you&#x27;ll earn a commission."
  ],
  "priceTokens": [
    "$1,000",
    "$1",
    "$1",
    "$1",
    "$23",
    "$1",
    "$1",
    "$1",
    "$1",
    "$1",
    "$2",
    "$1",
    "$2",
    "$2",
    "$2",
    "$2",
    "$3",
    "$3",
    "$3",
    "$10"
  ],
  "faq": [],
  "textSample": "Sign in Unmute Unmute SD Stupid Simple Devs 5 people have sold $1,000+ apps following my strategy 3.0 ( 2 ) Other Learn to build apps with AI Learn to sell apps ??? Profit 20% discount on all 1 on 1 calls. Access to coding bounties. Private Hackathons Free one-time purchase Pay Join Join 14 members Reviews 3 out of 5 2 total reviews 5 stars 4 stars 3 stars 2 stars 1 star A Adam 1 month ago Written 5 months after purchase About the creator BH View profile Billy Howell @ stupidsimpleapps â€¢ Joined Apr 2025 Affiliates SD Become an affiliate Stupid Simple Devs 30% reward Earn money by bringing customers to Stupid Simple Devs. Every time a customer purchases using your link, you&#x27;ll earn a commission. Stupid Simple Devs Free one-time purchase +2 options Join Free one-time purchase 2 options Join Stupid Simple Devs | Whop",
  "finalUrl": "https://whop.com/stupid-simple-devs/stupid-simple-devs/?a=alexburnett21",
  "fetchedAt": "2025-11-05T10:41:43.666Z",
  "textHash": "9ac3c50f85878042d3c8a747c6fc8995b4b469e89b87464d33ea2947456fb903",
  "drilled": true
}