{
  "baseUrl": "https://whop.com/system-based/system-based/?a=alexburnett21",
  "title": "System Based Betting | Whop",
  "h1": "System Based Betting",
  "bullets": [
    "Sign in WC System Based Betting Join our data-driven tipping community! Other Profitable. Predictable. Proven. System Based Betting is a data-driven sports betting service designed for serious bettors who understand the value of long-term profitability. A$19.99 / week Pay Sign up Features Expert betting tips on Racing, NFL, and NBA.",
    "Access to a thriving community of tippers and punters.",
    "Daily cheat sheets and game insights to inform your betting.",
    "Learn responsible bankroll management techniques."
  ],
  "paras": [
    "Sign in WC System Based Betting Join our data-driven tipping community! Other Profitable. Predictable. Proven.",
    "System Based Betting is a data-driven sports betting service designed for serious bettors who understand the value of long-term profitability.",
    "A$19.99 / week Pay Sign up Features Expert betting tips on Racing, NFL, and NBA. Access to a thriving community of tippers and punters. Daily cheat sheets and game insights to inform your betting. Learn responsible bankroll management techniques. About the creator H View profile harrywhitaker @ harrywhitaker • Joined Jan 2024 ✅ Positive EV Betting – We target bets with a mathematical edge, ensuring long-term sustainability. ✅ Market Inefficiencies – Early-season pricing errors, injury adjustments, and mispriced player props. ✅ NFL &amp; NBA Expertise – Proven models built from years of data, focusing on key statistical trends. ✅ Transparent Results – No hype, no “locks,” just consistent, data-backed FAQs What sports do you cover? What is included my subscription? What is our purpose? Affiliates WC Become an affiliate Whits Premium Tipping Community 30% reward Earn money by bringing customers to Whits Premium Tipping Community. Every time a customer purchases using your link, you&#x27;ll earn a commission."
  ],
  "priceTokens": [
    "$19.99",
    "$19.99",
    "$19.99",
    "$1",
    "$1",
    "$1",
    "$23",
    "$1",
    "$1",
    "$1",
    "$1",
    "$1",
    "$2",
    "$1",
    "$2",
    "$2",
    "$2",
    "$2",
    "$3",
    "$3"
  ],
  "faq": [],
  "textSample": "Sign in WC System Based Betting Join our data-driven tipping community! Other Profitable. Predictable. Proven. System Based Betting is a data-driven sports betting service designed for serious bettors who understand the value of long-term profitability. A$19.99 / week Pay Sign up Features Expert betting tips on Racing, NFL, and NBA. Access to a thriving community of tippers and punters. Daily cheat sheets and game insights to inform your betting. Learn responsible bankroll management techniques. About the creator H View profile harrywhitaker @ harrywhitaker • Joined Jan 2024 ✅ Positive EV Betting – We target bets with a mathematical edge, ensuring long-term sustainability. ✅ Market Inefficiencies – Early-season pricing errors, injury adjustments, and mispriced player props. ✅ NFL &amp; NBA Expertise – Proven models built from years of data, focusing on key statistical trends. ✅ Transparent Results – No hype, no “locks,” just consistent, data-backed FAQs What sports do you cover? What is included my subscription? What is our purpose? Affiliates WC Become an affiliate Whits Premium Tipping Community 30% reward Earn money by bringing customers to Whits Premium Tipping Community. Every time a customer purchases using your link, you&#x27;ll earn a commission. System Based Betting A$19.99 / week +1 option Sign up A$19.99 / week 1 option Pay Sign up Pay Sign up System Based Betting | Whop",
  "finalUrl": "https://whop.com/system-based/system-based/?a=alexburnett21",
  "fetchedAt": "2025-11-05T10:48:37.305Z",
  "textHash": "c634fecd38bd08106fb9a0fd05487fab072362ebf5e970b3e0116e127051309c",
  "drilled": true
}