{
  "baseUrl": "https://whop.com/teamalphatrading/team-alpha-daily-text-alerts/",
  "title": "Team Alpha VIP Penny Stocks | Whop",
  "h1": "Team Alpha VIP Penny Stocks",
  "bullets": [
    "Sign in TT Team Alpha VIP Penny Stocks Daily Stock Alerts Texted to your Phone With a 75% Win Rate 5.0 ( 2 ) Trading The #1 Penny Stock Trading Strategy You’ve Been Waiting For! $44.99 / month Pay Get access Features Daily Text Alerts: Receive our Team Alpha Breakout Stock Alerts",
    "Access to 5 Proprietary Scanners: Unlock the tools that power our strategy.",
    "Insider Trade Alerts: Gain exclusive insights into actual insider trades",
    "Congressional Trade Notifications: Follow the market moves of the Elite",
    "Full Access to the Journal: See every trade we’ve made, backed by real-time data",
    "P psindha33 2 days ago Written 5 months after purchase",
    "JV Jose Vivanco 2 months ago Written 9 months after purchase"
  ],
  "paras": [
    "Sign in TT Team Alpha VIP Penny Stocks Daily Stock Alerts Texted to your Phone With a 75% Win Rate 5.0 ( 2 ) Trading The #1 Penny Stock Trading Strategy You’ve Been Waiting For!",
    "$44.99 / month Pay Get access Features Daily Text Alerts: Receive our Team Alpha Breakout Stock Alerts Access to 5 Proprietary Scanners: Unlock the tools that power our strategy. Insider Trade Alerts: Gain exclusive insights into actual insider trades Congressional Trade Notifications: Follow the market moves of the Elite Full Access to the Journal: See every trade we’ve made, backed by real-time data Reviews 5 out of 5 2 total reviews 5 stars 4 stars 3 stars 2 stars 1 star P psindha33 2 days ago",
    "2 months ago",
    "Affiliates TT Become an affiliate Team Alpha Trading 30% reward Earn money by bringing customers to Team Alpha Trading. Every time a customer purchases using your link, you&#x27;ll earn a commission."
  ],
  "priceTokens": [
    "$44.99",
    "$44.99",
    "$44.99",
    "$1",
    "$1",
    "$1",
    "$23",
    "$1",
    "$1",
    "$1",
    "$1",
    "$1",
    "$2",
    "$1",
    "$2",
    "$2",
    "$2",
    "$2",
    "$3",
    "$3"
  ],
  "faq": [],
  "textSample": "Sign in TT Team Alpha VIP Penny Stocks Daily Stock Alerts Texted to your Phone With a 75% Win Rate 5.0 ( 2 ) Trading The #1 Penny Stock Trading Strategy You’ve Been Waiting For! $44.99 / month Pay Get access Features Daily Text Alerts: Receive our Team Alpha Breakout Stock Alerts Access to 5 Proprietary Scanners: Unlock the tools that power our strategy. Insider Trade Alerts: Gain exclusive insights into actual insider trades Congressional Trade Notifications: Follow the market moves of the Elite Full Access to the Journal: See every trade we’ve made, backed by real-time data Reviews 5 out of 5 2 total reviews 5 stars 4 stars 3 stars 2 stars 1 star P psindha33 2 days ago Written 5 months after purchase JV Jose Vivanco 2 months ago Written 9 months after purchase About the creator BG View profile Brendan Guastaferro @ brendanteamalpha • Joined Feb 2024 Affiliates TT Become an affiliate Team Alpha Trading 30% reward Earn money by bringing customers to Team Alpha Trading. Every time a customer purchases using your link, you&#x27;ll earn a commission. Team Alpha VIP Penny Stocks $44.99 / month +1 option Get access $44.99 / month 1 option Pay Get access Pay Get access Team Alpha VIP Penny Stocks | Whop",
  "finalUrl": "https://whop.com/teamalphatrading/team-alpha-daily-text-alerts/",
  "fetchedAt": "2025-11-05T09:54:32.766Z",
  "textHash": "5e61bde1411121df2d732b00a7468859d5688194038bd1bab5ae580b2832c5dc",
  "drilled": false
}