{
  "baseUrl": "https://whop.com/the-trade-syndicate/?a=alexburnett21",
  "title": "The Trade Syndicate | Whop",
  "h1": "The Trade Syndicate",
  "bullets": [
    "Powered by TS The Trade Syndicate Seasoned futures trader, creator of Rocket Trades, and founder of The Stock Syndicate. I specialize in mastering chart reading and guiding traders in futures &amp; options to consistent, confident results... More 5.0 ( 6 ) Contact seller Products Free FREE Discord + Flow Access TTS — Basic Access 5.0 ( 3 ) $50.00 / month TTS | Full Premium Access The Stock Syndicate 5.0 ( 3 ) $30.00 / month Rocket Trades | A Futures Algo RocketTrades New Contact seller Reviews A AbstractMinimal • TTS — Basic Access 1 month ago The best of the best! Amazing options and future alerts with an amazing active community for free. High quality videos inside the Whop for learning as well! Best group I've joined, earned a long time member Written 1 month after purchase",
    "AS Adam Serviss • The Stock Syndicate 2 months ago Fun group, best I’ve found, and very supportive. Love them all. Written 4 months after purchase",
    "B Bingbong • The Stock Syndicate 3 months ago Nice tight knit group. Good for options and futures. All analysts are great and willing to answer your questions anytime. Written 3 months after purchase",
    "C Caz • The Stock Syndicate 4 months ago Awesome Community. Full of very skilled traders Written 2 months after purchase"
  ],
  "paras": [
    "TS The Trade Syndicate Seasoned futures trader, creator of Rocket Trades, and founder of The Stock Syndicate. I specialize in mastering chart reading and guiding traders in futures &amp; options to consistent, confident results... More 5.0 ( 6 ) Contact seller Products Free FREE Discord + Flow Access TTS — Basic Access 5.0 ( 3 ) $50.00 / month TTS | Full Premium Access The Stock Syndicate 5.0 ( 3 ) $30.00 / month Rocket Trades | A Futures Algo RocketTrades New Contact seller Reviews A AbstractMinimal • TTS — Basic Access 1 month ago The best of the best! Amazing options and future alerts with an amazing active community for free. High quality videos inside the Whop for learning as well! Best group I've joined, earned a long time member",
    "2 months ago Fun group, best I’ve found, and very supportive. Love them all.",
    "3 months ago Nice tight knit group. Good for options and futures. All analysts are great and willing to answer your questions anytime.",
    "4 months ago Awesome Community. Full of very skilled traders"
  ],
  "priceTokens": [
    "$50.00",
    "$30.00",
    "$1",
    "$1",
    "$1",
    "$21",
    "$1",
    "$1",
    "$1",
    "$1",
    "$28",
    "$1",
    "$28",
    "$28",
    "$28",
    "$28",
    "$3",
    "$3",
    "$3",
    "$10"
  ],
  "faq": [],
  "textSample": "Powered by TS The Trade Syndicate Seasoned futures trader, creator of Rocket Trades, and founder of The Stock Syndicate. I specialize in mastering chart reading and guiding traders in futures &amp; options to consistent, confident results... More 5.0 ( 6 ) Contact seller Products Free FREE Discord + Flow Access TTS — Basic Access 5.0 ( 3 ) $50.00 / month TTS | Full Premium Access The Stock Syndicate 5.0 ( 3 ) $30.00 / month Rocket Trades | A Futures Algo RocketTrades New Contact seller Reviews A AbstractMinimal • TTS — Basic Access 1 month ago The best of the best! Amazing options and future alerts with an amazing active community for free. High quality videos inside the Whop for learning as well! Best group I've joined, earned a long time member Written 1 month after purchase AS Adam Serviss • The Stock Syndicate 2 months ago Fun group, best I’ve found, and very supportive. Love them all. Written 4 months after purchase B Bingbong • The Stock Syndicate 3 months ago Nice tight knit group. Good for options and futures. All analysts are great and willing to answer your questions anytime. Written 3 months after purchase C Caz • The Stock Syndicate 4 months ago Awesome Community. Full of very skilled traders Written 2 months after purchase See all reviews The Trade Syndicate | Whop",
  "finalUrl": "https://whop.com/the-trade-syndicate/?a=alexburnett21",
  "fetchedAt": "2025-11-05T10:35:46.216Z",
  "textHash": "1d633f212fc303ce56acd7513e5bd12e846304a3d8f5b1233bba67ff3baa300b",
  "drilled": false
}