{
  "baseUrl": "https://whop.com/microefutures-trading-room/?a=alexburnett21",
  "title": "Microefutures Trading Room | Whop",
  "h1": "Microefutures Trading Room",
  "bullets": [
    "Powered by MR Microefutures Trading Room I&#x27;ve spent over 20 years mastering the markets. As JJ (@vwaptrader1), I am passionate about sharing my strategies and insights to help traders succeed. 5.0 ( 2 ) Contact seller Products $39.00 / month Free trial Microefutures &amp; EquitiesETC has merged into the Syndicate The Trading Syndicate 5.0 ( 2 ) $299.00 / year Free trial Master Markets with JJ&#x27;s Guidance Microefutures Annual New $399.00 Microefutures &amp; EquitiesETC have merged into the SYNDICATE The Trading Syndicate New $14.99 / week Trading Syndicate Community Room Weekly Membership New Contact seller Reviews HG Hatim Gulamabbass • The Trading Syndicate 1 year ago I have subscribed to many groups before but not satisfied. This one is a brilliant group and JJ our mentor is too good. He keeps trading simple and sweet. Try it for the trial period and see for yourself. Written 7 days after purchase",
    "JA Josh Adams • The Trading Syndicate 1 year ago There is no better place to invest your time and resources than into this room. Written 14 days after purchase"
  ],
  "paras": [
    "MR Microefutures Trading Room I&#x27;ve spent over 20 years mastering the markets. As JJ (@vwaptrader1), I am passionate about sharing my strategies and insights to help traders succeed. 5.0 ( 2 ) Contact seller Products $39.00 / month Free trial Microefutures &amp; EquitiesETC has merged into the Syndicate The Trading Syndicate 5.0 ( 2 ) $299.00 / year Free trial Master Markets with JJ&#x27;s Guidance Microefutures Annual New $399.00 Microefutures &amp; EquitiesETC have merged into the SYNDICATE The Trading Syndicate New $14.99 / week Trading Syndicate Community Room Weekly Membership New Contact seller Reviews HG Hatim Gulamabbass • The Trading Syndicate 1 year ago I have subscribed to many groups before but not satisfied. This one is a brilliant group and JJ our mentor is too good. He keeps trading simple and sweet. Try it for the trial period and see for yourself.",
    "1 year ago There is no better place to invest your time and resources than into this room."
  ],
  "priceTokens": [
    "$39.00",
    "$299.00",
    "$399.00",
    "$14.99",
    "$1",
    "$1",
    "$1",
    "$21",
    "$1",
    "$1",
    "$1",
    "$1",
    "$28",
    "$1",
    "$28",
    "$28",
    "$28",
    "$28",
    "$3",
    "$3"
  ],
  "faq": [],
  "textSample": "Powered by MR Microefutures Trading Room I&#x27;ve spent over 20 years mastering the markets. As JJ (@vwaptrader1), I am passionate about sharing my strategies and insights to help traders succeed. 5.0 ( 2 ) Contact seller Products $39.00 / month Free trial Microefutures &amp; EquitiesETC has merged into the Syndicate The Trading Syndicate 5.0 ( 2 ) $299.00 / year Free trial Master Markets with JJ&#x27;s Guidance Microefutures Annual New $399.00 Microefutures &amp; EquitiesETC have merged into the SYNDICATE The Trading Syndicate New $14.99 / week Trading Syndicate Community Room Weekly Membership New Contact seller Reviews HG Hatim Gulamabbass • The Trading Syndicate 1 year ago I have subscribed to many groups before but not satisfied. This one is a brilliant group and JJ our mentor is too good. He keeps trading simple and sweet. Try it for the trial period and see for yourself. Written 7 days after purchase JA Josh Adams • The Trading Syndicate 1 year ago There is no better place to invest your time and resources than into this room. Written 14 days after purchase Microefutures Trading Room | Whop",
  "finalUrl": "https://whop.com/microefutures-trading-room/?a=alexburnett21",
  "fetchedAt": "2025-11-04T20:11:08.934Z",
  "textHash": "af4cb38d9f9700e491d1dd8e35e781f01a0619b26af0d8052176e884df2c0363",
  "drilled": false
}