{
  "baseUrl": "https://whop.com/the-traders-club/?a=alexburnett21",
  "title": "The Traders Club | Whop",
  "h1": "The Traders Club",
  "bullets": [
    "Powered by TC The Traders Club I founded the Market Mastery program to empower aspiring traders in achieving full-time futures trading success. With a focus on liquidity trading in gold futures, I provide individuals with the tools... More 4.9 ( 35 ) Contact seller Products $125.00 / month Master the Markets with The Traders Club! The Traders Club 5.0 ( 17 ) Free Kickstart Your Trading Mastery with a Free E-Book! Free Day Trading E-Book 5.0 ( 2 ) Free FREE Access To Aaron&#x27;s Trading Community Aaron&#x27;s FREE Community 5.0 ( 5 ) $45.00 / month Stock Investing Alerts Private Stock Investing Group New Contact seller Reviews AO Adam Ogilvie • The Traders Club Premium 11 days ago Cant big this up enough, get on this asap it’ll change your trading life, dont waste any more time on anyone else, Aaron is the best I’ve come across, amazing videos that are easy to follow, i wish i found this sooner is all I can say! Written 2 days after purchase",
    "CC Chris Clifford • Free Day Trading E-Book 16 days ago Great information professionally presented. Would highly recommend Written 4 months after purchase",
    "HW Harvey Whitehead • Aaron&#x27;s FREE Community 1 month ago Top g Written 4 months after purchase",
    "DN Dunith Nallaperuma • The Traders Club 1 month ago Aaron is the best. Simple strategy to trade! Written 6 days after purchase"
  ],
  "paras": [
    "TC The Traders Club I founded the Market Mastery program to empower aspiring traders in achieving full-time futures trading success. With a focus on liquidity trading in gold futures, I provide individuals with the tools... More 4.9 ( 35 ) Contact seller Products $125.00 / month Master the Markets with The Traders Club! The Traders Club 5.0 ( 17 ) Free Kickstart Your Trading Mastery with a Free E-Book! Free Day Trading E-Book 5.0 ( 2 ) Free FREE Access To Aaron&#x27;s Trading Community Aaron&#x27;s FREE Community 5.0 ( 5 ) $45.00 / month Stock Investing Alerts Private Stock Investing Group New Contact seller Reviews AO Adam Ogilvie • The Traders Club Premium 11 days ago Cant big this up enough, get on this asap it’ll change your trading life, dont waste any more time on anyone else, Aaron is the best I’ve come across, amazing videos that are easy to follow, i wish i found this sooner is all I can say!",
    "16 days ago Great information professionally presented. Would highly recommend",
    "1 month ago Top g",
    "1 month ago Aaron is the best. Simple strategy to trade!"
  ],
  "priceTokens": [
    "$125.00",
    "$45.00",
    "$1",
    "$1",
    "$1",
    "$21",
    "$1",
    "$1",
    "$1",
    "$1",
    "$28",
    "$1",
    "$28",
    "$28",
    "$28",
    "$28",
    "$3",
    "$3",
    "$3",
    "$10"
  ],
  "faq": [],
  "textSample": "Powered by TC The Traders Club I founded the Market Mastery program to empower aspiring traders in achieving full-time futures trading success. With a focus on liquidity trading in gold futures, I provide individuals with the tools... More 4.9 ( 35 ) Contact seller Products $125.00 / month Master the Markets with The Traders Club! The Traders Club 5.0 ( 17 ) Free Kickstart Your Trading Mastery with a Free E-Book! Free Day Trading E-Book 5.0 ( 2 ) Free FREE Access To Aaron&#x27;s Trading Community Aaron&#x27;s FREE Community 5.0 ( 5 ) $45.00 / month Stock Investing Alerts Private Stock Investing Group New Contact seller Reviews AO Adam Ogilvie • The Traders Club Premium 11 days ago Cant big this up enough, get on this asap it’ll change your trading life, dont waste any more time on anyone else, Aaron is the best I’ve come across, amazing videos that are easy to follow, i wish i found this sooner is all I can say! Written 2 days after purchase CC Chris Clifford • Free Day Trading E-Book 16 days ago Great information professionally presented. Would highly recommend Written 4 months after purchase HW Harvey Whitehead • Aaron&#x27;s FREE Community 1 month ago Top g Written 4 months after purchase DN Dunith Nallaperuma • The Traders Club 1 month ago Aaron is the best. Simple strategy to trade! Written 6 days after purchase See all reviews The Traders Club | Whop",
  "finalUrl": "https://whop.com/the-traders-club/?a=alexburnett21",
  "fetchedAt": "2025-11-04T21:36:17.920Z",
  "textHash": "f7481de2ace8007bb4703f48cbac03b4d61a16434ce194bc4f089df4347d4006",
  "drilled": false
}