{
  "baseUrl": "https://whop.com/early-byrds/the-early-byrd/?a=alexburnett21",
  "title": "The Early Byrd Free Trial | Whop",
  "h1": "The Early Byrd Free Trial",
  "bullets": [
    "Sign in TB The Early Byrd Free Trial Experience AI-Driven Arbitrage 5.0 ( 2 ) Other Explore analytical arbitrage with real-time AI. Get instant notifications for products over 15% ROI. Boost sales on Amazon, Ebay, and Walmart. $19.99 / month 1 day trial Pay Join Features Real-time AI notifications for products with over 15% ROI.",
    "Comprehensive guides to boost sales on Amazon, Ebay, and Walmart.",
    "Tools to monitor stock levels and limited quantities.",
    "Monitors for Wine &amp; Spirits",
    "J JKoontz13 2 years ago Great small group with tons of knowledge. Written 4 months after purchase",
    "S SupremeMachuca 3 years ago Amazing group with small community that is beyond willing to help others grow. Written 4 months after purchase"
  ],
  "paras": [
    "Sign in TB The Early Byrd Free Trial Experience AI-Driven Arbitrage 5.0 ( 2 ) Other Explore analytical arbitrage with real-time AI. Get instant notifications for products over 15% ROI. Boost sales on Amazon, Ebay, and Walmart.",
    "1 day trial Pay Join Features Real-time AI notifications for products with over 15% ROI. Comprehensive guides to boost sales on Amazon, Ebay, and Walmart. Tools to monitor stock levels and limited quantities. Monitors for Wine &amp; Spirits Reviews 5 out of 5 2 total reviews 5 stars 4 stars 3 stars 2 stars 1 star J JKoontz13 2 years ago Great small group with tons of knowledge.",
    "3 years ago Amazing group with small community that is beyond willing to help others grow.",
    "FAQs How does the AI script work? What stores are monitored? Affiliates TB Become an affiliate The Early Byrd 30% reward Earn money by bringing customers to The Early Byrd. Every time a customer purchases using your link, you&#x27;ll earn a commission."
  ],
  "priceTokens": [
    "$19.99",
    "$19.99",
    "$19.99",
    "$1",
    "$1",
    "$1",
    "$23",
    "$1",
    "$1",
    "$1",
    "$1",
    "$1",
    "$2",
    "$1",
    "$2",
    "$2",
    "$2",
    "$2",
    "$3",
    "$3"
  ],
  "faq": [],
  "textSample": "Sign in TB The Early Byrd Free Trial Experience AI-Driven Arbitrage 5.0 ( 2 ) Other Explore analytical arbitrage with real-time AI. Get instant notifications for products over 15% ROI. Boost sales on Amazon, Ebay, and Walmart. $19.99 / month 1 day trial Pay Join Features Real-time AI notifications for products with over 15% ROI. Comprehensive guides to boost sales on Amazon, Ebay, and Walmart. Tools to monitor stock levels and limited quantities. Monitors for Wine &amp; Spirits Reviews 5 out of 5 2 total reviews 5 stars 4 stars 3 stars 2 stars 1 star J JKoontz13 2 years ago Great small group with tons of knowledge. Written 4 months after purchase S SupremeMachuca 3 years ago Amazing group with small community that is beyond willing to help others grow. Written 4 months after purchase About the creator AQ View profile Aidan Quinn @ lemmebuyit â€¢ Joined Jun 2022 I&#x27;ve crafted The Early Byrd to empower you with sophisticated tools, from AI-driven arbitrage scripts to retail monitors, ensuring you never miss profitable opportunities. FAQs How does the AI script work? What stores are monitored? Affiliates TB Become an affiliate The Early Byrd 30% reward Earn money by bringing customers to The Early Byrd. Every time a customer purchases using your link, you&#x27;ll earn a commission. The Early Byrd Free Trial $19.99 / month Join $19.99 / month Pay Join Pay Join The Early Byrd Free Trial | Whop",
  "finalUrl": "https://whop.com/early-byrds/the-early-byrd/?a=alexburnett21",
  "fetchedAt": "2025-11-05T10:07:04.901Z",
  "textHash": "3681b7fa811de94281bbbeb2d7faad7e09475af7671cd8a6e2ed3878844ef20a",
  "drilled": true
}