{
  "baseUrl": "https://whop.com/thinkorswim-trading-premium/master-scalper/",
  "title": "ThinkorSwim Master Scalper | Whop",
  "h1": "ThinkorSwim Master Scalper",
  "bullets": [
    "Sign in Unmute Unmute TT ThinkorSwim Master Scalper Master Scalping with ThinkorSwim 4.9 ( 16 ) Trading Unlock the power of ThinkorSwim indicators to enhance your trading skills and master the art of scalping with precision and confidence. $99.95 one-time purchase Pay Join Join 352 members Features 5 Indicators",
    "Video Tutorial",
    "P Pops 10 months ago love RFG and all he does Written 6 months after purchase",
    "H Happy 1 year ago Best trading community ever! Joining this community has been the best decision in my trading journey. Other than having consecutive green weeks since joining, I have gained lots of valuable insights and the indicators are what every beginner and experienced trader should have. The Blessing indicator... Show more Written 1 month after purchase",
    "H Happy 1 year ago Best trading community ever! Joining this community has been the best decision in my trading journey. Other than having consecutive green weeks since joining, I have gained lots of valuable insights and the indicators are what every beginner and experienced trader should have. The Blessing indicator... Show more Written 2 months after purchase",
    "JR JUSTIN LEE RIFE 2 years ago This investment is definitely worth considering. I spent a month day trading, utilizing the provided indicators and attending the live stream sessions each morning. To my satisfaction, my p&l for the month surpassed my usual performance... that's no coincidence. If you're on the fence about subscri... Show more Written 25 days after purchase"
  ],
  "paras": [
    "Sign in Unmute Unmute TT ThinkorSwim Master Scalper Master Scalping with ThinkorSwim 4.9 ( 16 ) Trading Unlock the power of ThinkorSwim indicators to enhance your trading skills and master the art of scalping with precision and confidence.",
    "Join 352 members Features 5 Indicators Video Tutorial Reviews 4.88 out of 5 16 total reviews 5 stars 4 stars 3 stars 2 stars 1 star P Pops 10 months ago love RFG and all he does",
    "1 year ago Best trading community ever! Joining this community has been the best decision in my trading journey. Other than having consecutive green weeks since joining, I have gained lots of valuable insights and the indicators are what every beginner and experienced trader should have. The Blessing indicator...",
    "Written 1 month after purchase H Happy 1 year ago Best trading community ever! Joining this community has been the best decision in my trading journey. Other than having consecutive green weeks since joining, I have gained lots of valuable insights and the indicators are what every beginner and experienced trader should have. The Blessing indicator...",
    "Written 2 months after purchase JR JUSTIN LEE RIFE 2 years ago This investment is definitely worth considering. I spent a month day trading, utilizing the provided indicators and attending the live stream sessions each morning. To my satisfaction, my p&l for the month surpassed my usual performance... that's no coincidence. If you're on the fence about subscri...",
    "Written 25 days after purchase See all reviews About the creator RG View profile Ricky Gaspard @ uptwobucks • Joined Feb 2024 FAQs What custom tools are included? Do I get live support? Affiliates TT Become an affiliate ThinkorSwim Trading 30% reward Earn money by bringing customers to ThinkorSwim Trading. Every time a customer purchases using your link, you&#x27;ll earn a commission."
  ],
  "priceTokens": [
    "$99.95",
    "$99.95",
    "$99.95",
    "$1",
    "$1",
    "$1",
    "$22",
    "$1",
    "$1",
    "$1",
    "$1",
    "$1",
    "$2",
    "$1",
    "$2",
    "$2",
    "$2",
    "$2",
    "$3",
    "$3"
  ],
  "faq": [],
  "textSample": "Sign in Unmute Unmute TT ThinkorSwim Master Scalper Master Scalping with ThinkorSwim 4.9 ( 16 ) Trading Unlock the power of ThinkorSwim indicators to enhance your trading skills and master the art of scalping with precision and confidence. $99.95 one-time purchase Pay Join Join 352 members Features 5 Indicators Video Tutorial Reviews 4.88 out of 5 16 total reviews 5 stars 4 stars 3 stars 2 stars 1 star P Pops 10 months ago love RFG and all he does Written 6 months after purchase H Happy 1 year ago Best trading community ever! Joining this community has been the best decision in my trading journey. Other than having consecutive green weeks since joining, I have gained lots of valuable insights and the indicators are what every beginner and experienced trader should have. The Blessing indicator... Show more Written 1 month after purchase H Happy 1 year ago Best trading community ever! Joining this community has been the best decision in my trading journey. Other than having consecutive green weeks since joining, I have gained lots of valuable insights and the indicators are what every beginner and experienced trader should have. The Blessing indicator... Show more Written 2 months after purchase JR JUSTIN LEE RIFE 2 years ago This investment is definitely worth considering. I spent a month day trading, utilizing the provided indicators and attending the live stream sessions each morning. To my satisfaction, my p&l for the month surpassed my usual performance... that's no coincidence. If you're on the fence about subscri... Show more Written 25 days after purchase See all reviews About the creator RG View profile Ricky Gaspard @ uptwobucks • Joined Feb 2024 FAQs What custom tools are included? Do I get live support? Affiliates TT Become an affiliate ThinkorSwim Trading 30% reward Earn money by bringing customers to ThinkorSwim Trading. Every time a customer purchases using your link, you&#x27;ll earn a commission. ThinkorSwim Master Scalper $99.95 one-time purchase Join $99.95 one-time purchase Pay Join Pay Join ThinkorSwim Master Scalper | Whop",
  "finalUrl": "https://whop.com/thinkorswim-trading-premium/master-scalper/",
  "fetchedAt": "2025-11-04T20:08:55.845Z",
  "textHash": "6cbddd905b77b3e5a1efc9cfe55b51e50f5bb46fb15a5e97046e95bf21337251",
  "drilled": false
}