{
  "baseUrl": "https://whop.com/titansalgo-pro/titans-algo-pro-plus/?a=alexburnett21",
  "title": "Titans Algo Pro+ | Whop",
  "h1": "Titans Algo Pro+",
  "bullets": [
    "Sign in TA Titans Algo Pro+ Premium Indicator and Discord access 5.0 ( 2 ) Trading Get Premium TradingView Indicator. Access Pro Discord community for expert signals and analysis. Account Management and Algo Trading $189.00 / month Pay Get access Join 1 member Features Monthly profits with Premium Indicator and personal guidence in every session",
    "Daily High Winrate Signals and access to Market Analysis by Pro Traders",
    "Get access to Personal Account Management Service at your ease",
    "Get access Algo Trading Setups",
    "HA Haider Ali 9 months ago Great signals from indicator, im a beginner in trading and im already making some decent profits. Written 3 minutes after purchase",
    "9 months ago Great Indicator, till now making money with the signals given by indicator. Very helpful admin! Written 17 days after purchase"
  ],
  "paras": [
    "Sign in TA Titans Algo Pro+ Premium Indicator and Discord access 5.0 ( 2 ) Trading Get Premium TradingView Indicator. Access Pro Discord community for expert signals and analysis. Account Management and Algo Trading",
    "$189.00 / month Pay Get access Join 1 member Features Monthly profits with Premium Indicator and personal guidence in every session Daily High Winrate Signals and access to Market Analysis by Pro Traders Get access to Personal Account Management Service at your ease Get access Algo Trading Setups Reviews 5 out of 5 2 total reviews 5 stars 4 stars 3 stars 2 stars 1 star HA Haider Ali 9 months ago Great signals from indicator, im a beginner in trading and im already making some decent profits.",
    "9 months ago Great Indicator, till now making money with the signals given by indicator. Very helpful admin!",
    "FAQs What services does Titans Algo provide? How do I access my TradingView indicator subscription? Does Titans Algo guarantee monthly profits? Is there a free trial available for your services? Are refunds available if I am unsatisfied with the service? Affiliates TA Become an affiliate Titans Algo 25% reward Earn money by bringing customers to Titans Algo. Every time a customer purchases using your link, you&#x27;ll earn a commission."
  ],
  "priceTokens": [
    "$189.00",
    "$189.00",
    "$189.00",
    "$1",
    "$1",
    "$1",
    "$23",
    "$1",
    "$1",
    "$1",
    "$1",
    "$1",
    "$2",
    "$1",
    "$2",
    "$2",
    "$2",
    "$2",
    "$3",
    "$3"
  ],
  "faq": [],
  "textSample": "Sign in TA Titans Algo Pro+ Premium Indicator and Discord access 5.0 ( 2 ) Trading Get Premium TradingView Indicator. Access Pro Discord community for expert signals and analysis. Account Management and Algo Trading $189.00 / month Pay Get access Join 1 member Features Monthly profits with Premium Indicator and personal guidence in every session Daily High Winrate Signals and access to Market Analysis by Pro Traders Get access to Personal Account Management Service at your ease Get access Algo Trading Setups Reviews 5 out of 5 2 total reviews 5 stars 4 stars 3 stars 2 stars 1 star HA Haider Ali 9 months ago Great signals from indicator, im a beginner in trading and im already making some decent profits. Written 3 minutes after purchase 9 months ago Great Indicator, till now making money with the signals given by indicator. Very helpful admin! Written 17 days after purchase About the creator RM View profile Ruth Mark @ ruthmark â€¢ Joined Jan 2025 For any help about Titans algo. Contact me at titansalgo@gmail.com FAQs What services does Titans Algo provide? How do I access my TradingView indicator subscription? Does Titans Algo guarantee monthly profits? Is there a free trial available for your services? Are refunds available if I am unsatisfied with the service? Affiliates TA Become an affiliate Titans Algo 25% reward Earn money by bringing customers to Titans Algo. Every time a customer purchases using your link, you&#x27;ll earn a commission. Titans Algo Pro+ $189.00 / month +1 option Get access $189.00 / month 1 option Pay Get access Pay Get access Titans Algo Pro+ | Whop",
  "finalUrl": "https://whop.com/titansalgo-pro/titans-algo-pro-plus/?a=alexburnett21",
  "fetchedAt": "2025-11-04T21:57:38.897Z",
  "textHash": "2f78a014839b17b3d5449431c4b912e3cda3ff4c9b56c75b2f8a7196547523ec",
  "drilled": true
}