{
  "baseUrl": "https://whop.com/trading-room-ca/trading-room-ca/?a=alexburnett21",
  "title": "TRADING EN VIVO | Whop",
  "h1": "TRADING EN VIVO",
  "bullets": [
    "TRADING EN VIVO | Whop Sign in TR TRADING EN VIVO Deja de adivinar. Empieza a operar en vivo con profesionales. 5.0 ( 65 ) Trading Este no es un grupo más. Es el acceso directo a las señales y trades en vivo de Oscar Fontecha. Vas a ver cada entrada, cada salida y cada decisión en tiempo real. Aquí se aprende viendo cómo un profesional enfrenta el mercado día tras día. Si buscas señales reales y sesiones sin filtros, este es tu lugar. Pero esto no se trata solo de copiar señales — también vas a tener acceso a todo el contenido educativo para aprender la estrategia completa, entender la lógica detrás de cada entrada y operar por tu cuenta con la misma confianza y estructura. $25.00 / month Pay Join Join 304 members Features Trading en VIvo Con Oscar Fontecha Todos los dias Lunes-Viernes",
    "Recibe señales de Oscar Fontecha en la sesion de New York",
    "Cada Semana Sesion Grupal de Aprendizaje 4pm New York",
    "Sorteos de Cuentas de 50k",
    "WS WILDERSON SOTO 1 day ago Buen servicio, y acompañamiento de lunes a viernes en vivos Written 5 days after purchase",
    "JM Jose magaña 1 day ago excelente PPP Written 1 month after purchase",
    "H Hans0250 9 days ago Buena estrategia Written 1 month after purchase",
    "JE Jose Ricardo Espejo 10 days ago Solo gratitud Written 1 month after purchase"
  ],
  "paras": [
    "Sign in TR TRADING EN VIVO Deja de adivinar. Empieza a operar en vivo con profesionales. 5.0 ( 65 ) Trading Este no es un grupo más. Es el acceso directo a las señales y trades en vivo de Oscar Fontecha. Vas a ver cada entrada, cada salida y cada decisión en tiempo real. Aquí se aprende viendo cómo un profesional enfrenta el mercado día tras día. Si buscas señales reales y sesiones sin filtros, este es tu lugar.",
    "Pero esto no se trata solo de copiar señales — también vas a tener acceso a todo el contenido educativo para aprender la estrategia completa, entender la lógica detrás de cada entrada y operar por tu cuenta con la misma confianza y estructura.",
    "$25.00 / month Pay Join Join 304 members Features Trading en VIvo Con Oscar Fontecha Todos los dias Lunes-Viernes Recibe señales de Oscar Fontecha en la sesion de New York Cada Semana Sesion Grupal de Aprendizaje 4pm New York Sorteos de Cuentas de 50k Reviews 4.95 out of 5 65 total reviews 5 stars 4 stars 3 stars 2 stars 1 star WS WILDERSON SOTO 1 day ago Buen servicio, y acompañamiento de lunes a viernes en vivos",
    "1 day ago excelente PPP",
    "9 days ago Buena estrategia",
    "10 days ago Solo gratitud",
    "About the creator B View profile businessfontecha @ businessfontecha • Joined Jan 2025 Llevo años operando y domino el mercado de Futuros. Mi pasión es enseñar a otros a operar con confianza, simplificando estrategias para que operar sea accesible y rentable para todos. FAQs Como puedo acceder a la sala premium Que mercados se operan en el curso Puedo cancelar mi suscripcion cuando quiera Affiliates TR Become an affiliate TRADING ROOM 12% reward Earn money by bringing customers to TRADING ROOM. Every time a customer purchases using your link, you&#x27;ll earn a commission."
  ],
  "priceTokens": [
    "$25.00",
    "$25.00",
    "$25.00",
    "$1",
    "$1",
    "$1",
    "$23",
    "$1",
    "$1",
    "$1",
    "$1",
    "$1",
    "$2",
    "$1",
    "$2",
    "$2",
    "$2",
    "$2",
    "$3",
    "$3"
  ],
  "faq": [],
  "textSample": "TRADING EN VIVO | Whop Sign in TR TRADING EN VIVO Deja de adivinar. Empieza a operar en vivo con profesionales. 5.0 ( 65 ) Trading Este no es un grupo más. Es el acceso directo a las señales y trades en vivo de Oscar Fontecha. Vas a ver cada entrada, cada salida y cada decisión en tiempo real. Aquí se aprende viendo cómo un profesional enfrenta el mercado día tras día. Si buscas señales reales y sesiones sin filtros, este es tu lugar. Pero esto no se trata solo de copiar señales — también vas a tener acceso a todo el contenido educativo para aprender la estrategia completa, entender la lógica detrás de cada entrada y operar por tu cuenta con la misma confianza y estructura. $25.00 / month Pay Join Join 304 members Features Trading en VIvo Con Oscar Fontecha Todos los dias Lunes-Viernes Recibe señales de Oscar Fontecha en la sesion de New York Cada Semana Sesion Grupal de Aprendizaje 4pm New York Sorteos de Cuentas de 50k Reviews 4.95 out of 5 65 total reviews 5 stars 4 stars 3 stars 2 stars 1 star WS WILDERSON SOTO 1 day ago Buen servicio, y acompañamiento de lunes a viernes en vivos Written 5 days after purchase JM Jose magaña 1 day ago excelente PPP Written 1 month after purchase H Hans0250 9 days ago Buena estrategia Written 1 month after purchase JE Jose Ricardo Espejo 10 days ago Solo gratitud Written 1 month after purchase See all reviews About the creator B View profile businessfontecha @ businessfontecha • Joined Jan 2025 Llevo años operando y domino el mercado de Futuros. Mi pasión es enseñar a otros a operar con confianza, simplificando estrategias para que operar sea accesible y rentable para todos. FAQs Como puedo acceder a la sala premium Que mercados se operan en el curso Puedo cancelar mi suscripcion cuando quiera Affiliates TR Become an affiliate TRADING ROOM 12% reward Earn money by bringing customers to TRADING ROOM. Every time a customer purchases using your link, you&#x27;ll earn a commission. TRADING EN VIVO $25.00 / month +2 options Join $25.00 / month 2 options Pay Join Pay Join",
  "finalUrl": "https://whop.com/trading-room-ca/trading-room-ca/?a=alexburnett21",
  "fetchedAt": "2025-11-04T20:03:30.039Z",
  "textHash": "451a500f89fb1342b3baff0f04d8b2823958af15553ed95953055c11fab57b64",
  "drilled": true
}