{
  "baseUrl": "https://whop.com/trading-levels-algo-standard/trading-levels-algo-standard/?a=alexburnett21",
  "title": "Trading Levels Algo Standard | Whop",
  "h1": "Trading Levels Algo Standard",
  "bullets": [
    "Sign in Unmute Unmute Unmute Unmute Unmute Unmute Unmute Unmute TA Trading Levels Algo Standard Automated Futures Trading Trading Ninjatrader addon to automatically trade the futures market using MNQ. https://www.tradinglevelsalgo.com/ $100.00 for 2 weeks Pay Get access Features Access to the Standard Package",
    "Up to 7 MNQ Contracts"
  ],
  "paras": [
    "Sign in Unmute Unmute Unmute Unmute Unmute Unmute Unmute Unmute TA Trading Levels Algo Standard Automated Futures Trading Trading Ninjatrader addon to automatically trade the futures market using MNQ.",
    "https://www.tradinglevelsalgo.com/",
    "$100.00 for 2 weeks Pay Get access Features Access to the Standard Package Up to 7 MNQ Contracts About the creator KV View profile Kanthavel Vivekananda @ mayuuuu • Joined Jan 2024 I’m a software engineer from Canada with experience trading across different markets—stocks, options, futures, and CFDs. Through my trading journey, I realized that while I knew a lot about the how of trading, I wasn’t as sharp on the execution. That led me, at the beginning of this year, to start developing a bot to improve my trading performance. FAQs What platform is this for? What does this trade? Affiliates TA Become an affiliate Trading Levels Algo 10% reward Earn money by bringing customers to Trading Levels Algo. Every time a customer purchases using your link, you&#x27;ll earn a commission."
  ],
  "priceTokens": [
    "$100.00",
    "$100.00",
    "$100.00",
    "$1",
    "$1",
    "$1",
    "$23",
    "$1",
    "$1",
    "$1",
    "$1",
    "$1",
    "$2",
    "$1",
    "$2",
    "$2",
    "$2",
    "$2",
    "$3",
    "$3"
  ],
  "faq": [],
  "textSample": "Sign in Unmute Unmute Unmute Unmute Unmute Unmute Unmute Unmute TA Trading Levels Algo Standard Automated Futures Trading Trading Ninjatrader addon to automatically trade the futures market using MNQ. https://www.tradinglevelsalgo.com/ $100.00 for 2 weeks Pay Get access Features Access to the Standard Package Up to 7 MNQ Contracts About the creator KV View profile Kanthavel Vivekananda @ mayuuuu • Joined Jan 2024 I’m a software engineer from Canada with experience trading across different markets—stocks, options, futures, and CFDs. Through my trading journey, I realized that while I knew a lot about the how of trading, I wasn’t as sharp on the execution. That led me, at the beginning of this year, to start developing a bot to improve my trading performance. FAQs What platform is this for? What does this trade? Affiliates TA Become an affiliate Trading Levels Algo 10% reward Earn money by bringing customers to Trading Levels Algo. Every time a customer purchases using your link, you&#x27;ll earn a commission. Trading Levels Algo Standard $100.00 for 2 weeks +1 option Get access $100.00 for 2 weeks 1 option Pay Get access Pay Get access Trading Levels Algo Standard | Whop",
  "finalUrl": "https://whop.com/trading-levels-algo-standard/trading-levels-algo-standard/?a=alexburnett21",
  "fetchedAt": "2025-11-04T20:12:49.333Z",
  "textHash": "59f333587332cf70300c01a11e8dcd718f37f3d08e2eb2898f67b9ccc4418c9d",
  "drilled": true
}