{
  "baseUrl": "https://whop.com/unity-academy/unity-academy-membership/",
  "title": "Unity Academy (Pay with Card) | Whop",
  "h1": "Unity Academy (Pay with Card)",
  "bullets": [
    "Sign in UA Unity Academy (Pay with Card) Unity Academy - Automatic Renewal (Full Access) 5.0 ( 469 ) Trading Join Unity Academy, built in 2022 to elevate your trading with our crypto community, gain access to our 14 elite traders + their setups. Benefit from daily live calls, educational modules and professional tools such as OracleAlgo V2, top gainers / losers, breaking &amp; funding alerts all designed to accelerate your trading journey. Connect with a community of like-minded traders and take your skills to the next level. $89.99 / month Pay Get access Join 251 members Features Join our active crypto community filled with like minded traders who share ideas, and engage in real-time market discussions.",
    "Access expert market analysis, easy to follow trades, and setup recommendations to make smarter, informed trading decisions.",
    "Attend our daily live trading sessions and login to our educational dashboard to accelerate your knowledge and strategy development.",
    "Take advantage of our advanced tools such as our Top Gainers &amp; Losers, Funding Rates &amp; OracleAlgo V2 Alerts.",
    "Learn proven risk management strategies that safeguard your capital and drive consistent, long-term profitability.",
    "ES Emmanuel Saez 15 hours ago I joined Unity just two weeks after it was created, and honestly, it’s one of the best decisions I’ve ever made. From day one, I got to experience what it actually means to make money in the markets — not just theory, but real, actionable strategies that work. The opportunities and tools the team p... Show more Written 1 month after purchase",
    "DV Death Vortex 3 days ago This is the best place to learn how to trade. Not only do they have a ton of callers/traders who do really well and share their thought process but they also have Unity academy, which has tons of resources for even a beginner to get started. Written 1 year after purchase",
    "MM Marcelo Morera Mugarra 6 days ago The all-in-one cheat sheet for being a profitable trader. Written 6 days after purchase",
    "K Katev 22 days ago I've been in Unity for a few months, and the group is top tier. It's noy only about the callers, it's about what they share regarding their reasoning for trades and their streamings which makes this great, because it helps you to learn and trade on your own. I've also been using OracleAlgo v2 for a ... Show more Written 9 days after purchase"
  ],
  "paras": [
    "Sign in UA Unity Academy (Pay with Card) Unity Academy - Automatic Renewal (Full Access) 5.0 ( 469 ) Trading Join Unity Academy, built in 2022 to elevate your trading with our crypto community, gain access to our 14 elite traders + their setups. Benefit from daily live calls, educational modules and professional tools such as OracleAlgo V2, top gainers / losers, breaking &amp; funding alerts all designed to accelerate your trading journey. Connect with a community of like-minded traders and take your skills to the next level.",
    "$89.99 / month Pay Get access Join 251 members Features Join our active crypto community filled with like minded traders who share ideas, and engage in real-time market discussions. Access expert market analysis, easy to follow trades, and setup recommendations to make smarter, informed trading decisions. Attend our daily live trading sessions and login to our educational dashboard to accelerate your knowledge and strategy development. Take advantage of our advanced tools such as our Top Gainers &amp; Losers, Funding Rates &amp; OracleAlgo V2 Alerts. Learn proven risk management strategies that safeguard your capital and drive consistent, long-term profitability. Reviews 4.98 out of 5 469 total reviews 5 stars 4 stars 3 stars 2 stars 1 star ES Emmanuel Saez 15 hours ago I joined Unity just two weeks after it was created, and honestly, it’s one of the best decisions I’ve ever made. From day one, I got to experience what it actually means to make money in the markets — not just theory, but real, actionable strategies that work. The opportunities and tools the team p...",
    "Written 1 month after purchase DV Death Vortex 3 days ago This is the best place to learn how to trade. Not only do they have a ton of callers/traders who do really well and share their thought process but they also have Unity academy, which has tons of resources for even a beginner to get started.",
    "6 days ago The all-in-one cheat sheet for being a profitable trader.",
    "22 days ago I've been in Unity for a few months, and the group is top tier. It's noy only about the callers, it's about what they share regarding their reasoning for trades and their streamings which makes this great, because it helps you to learn and trade on your own. I've also been using OracleAlgo v2 for a ...",
    "Written 9 days after purchase See all reviews About the creator UA View profile Unity Academy @ unityacademyinc • Joined May 2023 Crypto Wealth Accelerator: Step into Unity Academy, and elevate your trading with our community, elite trading setups, daily live sessions, education modules. Power up professional tools like with OracleAlgo V2 and pro tools—top gainers/losers, breakout and funding alerts. Scale portfolios seamlessly with the strongest community in crypto. FAQs What can I expect from the daily masterclasses? How do I benefit from the Academy Education App? Affiliates UA Become an affiliate Unity Academy 30% reward Earn money by bringing customers to Unity Academy. Every time a customer purchases using your link, you&#x27;ll earn a commission."
  ],
  "priceTokens": [
    "$89.99",
    "$89.99",
    "$89.99",
    "$1",
    "$1",
    "$1",
    "$22",
    "$1",
    "$1",
    "$1",
    "$1",
    "$1",
    "$2",
    "$1",
    "$2",
    "$2",
    "$2",
    "$2",
    "$3",
    "$3"
  ],
  "faq": [],
  "textSample": "Sign in UA Unity Academy (Pay with Card) Unity Academy - Automatic Renewal (Full Access) 5.0 ( 469 ) Trading Join Unity Academy, built in 2022 to elevate your trading with our crypto community, gain access to our 14 elite traders + their setups. Benefit from daily live calls, educational modules and professional tools such as OracleAlgo V2, top gainers / losers, breaking &amp; funding alerts all designed to accelerate your trading journey. Connect with a community of like-minded traders and take your skills to the next level. $89.99 / month Pay Get access Join 251 members Features Join our active crypto community filled with like minded traders who share ideas, and engage in real-time market discussions. Access expert market analysis, easy to follow trades, and setup recommendations to make smarter, informed trading decisions. Attend our daily live trading sessions and login to our educational dashboard to accelerate your knowledge and strategy development. Take advantage of our advanced tools such as our Top Gainers &amp; Losers, Funding Rates &amp; OracleAlgo V2 Alerts. Learn proven risk management strategies that safeguard your capital and drive consistent, long-term profitability. Reviews 4.98 out of 5 469 total reviews 5 stars 4 stars 3 stars 2 stars 1 star ES Emmanuel Saez 15 hours ago I joined Unity just two weeks after it was created, and honestly, it’s one of the best decisions I’ve ever made. From day one, I got to experience what it actually means to make money in the markets — not just theory, but real, actionable strategies that work. The opportunities and tools the team p... Show more Written 1 month after purchase DV Death Vortex 3 days ago This is the best place to learn how to trade. Not only do they have a ton of callers/traders who do really well and share their thought process but they also have Unity academy, which has tons of resources for even a beginner to get started. Written 1 year after purchase MM Marcelo Morera Mugarra 6 days ago The all-in-one cheat sheet for being a profitable trader. Written 6 days after purchase K Katev 22 days ago I've been in Unity for a few months, and the group is top tier. It's noy only about the callers, it's about what they share regarding their reasoning for trades and their streamings which makes this great, because it helps you to learn and trade on your own. I've also been using OracleAlgo v2 for a ... Show more Written 9 days after purchase See all reviews About the creator UA View profile Unity Academy @ unityacademyinc • Joined May 2023 Crypto Wealth Accelerator: Step into Unity Academy, and elevate your trading with our community, elite trading setups, daily live sessions, education modules. Power up professional tools like with OracleAlgo V2 and pro tools—top gainers/losers, breakout and funding alerts. Scale portfolios seamlessly with the strongest community in crypto. FAQs What can I expect from the daily masterclasses? How do I benefit from the Academy Education App? Affiliates UA Become an affiliate Unity Academy 30% reward Earn money by bringing customers to Unity Academy. Every time a customer purchases using your link, you&#x27;ll earn a commission. Unity Academy (Pay with Card) $89.99 / month +1 option Get access $89.99 / month 1 option Pay Get access Pay Get access Unity Academy (Pay with Card) | Whop",
  "finalUrl": "https://whop.com/unity-academy/unity-academy-membership/",
  "fetchedAt": "2025-11-05T09:14:52.085Z",
  "textHash": "f3bf30034ecb72e87bd1cf6f9b274d10a605e944457d19ff51a7e9901c5944bd",
  "drilled": false
}