{
  "baseUrl": "https://whop.com/btz/vip-telegram-bots-download-spoofer/",
  "title": "VIP Download &amp; Spoofer Bot | Whop",
  "h1": "VIP Download &amp; Spoofer Bot",
  "bullets": [
    "Sign in OV VIP Download &amp; Spoofer Bot Join the ultimate OFM community. 5.0 ( 95 ) Social media The highest class community for serious OFM agencies. Join us to network, learn, and scale your agency. $29.00 / month Pay Join Join 154 members Features Premium OFMSpooferBot",
    "Premium OFMDownloadBot",
    "Unlimited OFMRedditBot usage",
    "SP sora pieron 7 months ago just joined after the call with tim regarding his twitter strategies, pure melody to hear these kind of people explaining their way of working Written 1 month after purchase",
    "AB Ariel Ben-zvy 1 year ago I have been doing OFM for a year and a half now, and never succeeded until now. Failure after failure after failure. I attribute most of my success now to this group. It's almost impossible to navigate OFM without running into bad actors, terrible and outdated strategies, etc. BTZ and DNK have done ... Show more Written 1 year after purchase",
    "DB daniel butterick 1 year ago Amazing group/course it is jamb packed with information. Written 14 days after purchase",
    "AC Adam Csizmar 1 year ago Worth it, solid group! Written 19 days after purchase"
  ],
  "paras": [
    "Sign in OV VIP Download &amp; Spoofer Bot Join the ultimate OFM community. 5.0 ( 95 ) Social media The highest class community for serious OFM agencies. Join us to network, learn, and scale your agency.",
    "Join 154 members Features Premium OFMSpooferBot Premium OFMDownloadBot Unlimited OFMRedditBot usage Reviews 4.99 out of 5 95 total reviews 5 stars 4 stars 3 stars 2 stars 1 star SP sora pieron 7 months ago just joined after the call with tim regarding his twitter strategies, pure melody to hear these kind of people explaining their way of working",
    "1 year ago I have been doing OFM for a year and a half now, and never succeeded until now. Failure after failure after failure. I attribute most of my success now to this group. It's almost impossible to navigate OFM without running into bad actors, terrible and outdated strategies, etc. BTZ and DNK have done ...",
    "Written 1 year after purchase DB daniel butterick 1 year ago Amazing group/course it is jamb packed with information.",
    "1 year ago Worth it, solid group!",
    "About the creator B View profile BTZ @ btz • Joined Jun 2023 As the owner of a multi seven-figure OFM agency, I’ve built OFM Empire VIP to support serious agency owners looking to grow. Starting in the OFM space 3 years ago, I&#x27;ve grown to be the largest and most well known OFM group owner on Telegram. I created OFMEVIP to offer a mature, scam-free environment where members can learn, grow, and network along side me and other serious high earning agencies. FAQs Is there any more information on the 1 on 1 coaching? Will there be updates to the program? What&#x27;s the maximum number of members you plan to have in the VIP group? What is your refund &amp; cancellation policy? How does the auto billing work? Can I still join if I was previously banned or muted? Affiliates OV Become an affiliate OFM Empire VIP 30% reward Earn money by bringing customers to OFM Empire VIP. Every time a customer purchases using your link, you&#x27;ll earn a commission."
  ],
  "priceTokens": [
    "$29.00",
    "$29.00",
    "$29.00",
    "$1",
    "$1",
    "$1",
    "$22",
    "$1",
    "$1",
    "$1",
    "$1",
    "$1",
    "$2",
    "$1",
    "$2",
    "$2",
    "$2",
    "$2",
    "$3",
    "$3"
  ],
  "faq": [],
  "textSample": "Sign in OV VIP Download &amp; Spoofer Bot Join the ultimate OFM community. 5.0 ( 95 ) Social media The highest class community for serious OFM agencies. Join us to network, learn, and scale your agency. $29.00 / month Pay Join Join 154 members Features Premium OFMSpooferBot Premium OFMDownloadBot Unlimited OFMRedditBot usage Reviews 4.99 out of 5 95 total reviews 5 stars 4 stars 3 stars 2 stars 1 star SP sora pieron 7 months ago just joined after the call with tim regarding his twitter strategies, pure melody to hear these kind of people explaining their way of working Written 1 month after purchase AB Ariel Ben-zvy 1 year ago I have been doing OFM for a year and a half now, and never succeeded until now. Failure after failure after failure. I attribute most of my success now to this group. It's almost impossible to navigate OFM without running into bad actors, terrible and outdated strategies, etc. BTZ and DNK have done ... Show more Written 1 year after purchase DB daniel butterick 1 year ago Amazing group/course it is jamb packed with information. Written 14 days after purchase AC Adam Csizmar 1 year ago Worth it, solid group! Written 19 days after purchase See all reviews About the creator B View profile BTZ @ btz • Joined Jun 2023 As the owner of a multi seven-figure OFM agency, I’ve built OFM Empire VIP to support serious agency owners looking to grow. Starting in the OFM space 3 years ago, I&#x27;ve grown to be the largest and most well known OFM group owner on Telegram. I created OFMEVIP to offer a mature, scam-free environment where members can learn, grow, and network along side me and other serious high earning agencies. FAQs Is there any more information on the 1 on 1 coaching? Will there be updates to the program? What&#x27;s the maximum number of members you plan to have in the VIP group? What is your refund &amp; cancellation policy? How does the auto billing work? Can I still join if I was previously banned or muted? Affiliates OV Become an affiliate OFM Empire VIP 30% reward Earn money by bringing customers to OFM Empire VIP. Every time a customer purchases using your link, you&#x27;ll earn a commission. VIP Download &amp; Spoofer Bot $29.00 / month Join $29.00 / month Pay Join Pay Join VIP Download &amp; Spoofer Bot | Whop",
  "finalUrl": "https://whop.com/btz/vip-telegram-bots-download-spoofer/",
  "fetchedAt": "2025-11-04T20:00:40.872Z",
  "textHash": "83bba2497f060b944313abcf292f8c5519ee863b55e2739f7834867ac1f2314a",
  "drilled": false
}