{
  "baseUrl": "https://whop.com/game-changers-sports-betting/vip-3-months-83/",
  "title": "VIP 3 MONTHS | Whop",
  "h1": "VIP 3 MONTHS",
  "bullets": [
    "Sign in GB VIP 3 MONTHS GET ACCESS TO THE GREATEST SPORTS BETTING GROUP ðŸ”¥ 5.0 ( 4 ) Other I use the BEST analytics and data to help you PRINT money betting on sports. I hit the lab daily to help my community EAT! A community that wins with strategy, not just gut feeling CA$45.00 / 3 months Pay Join Features 3 months of access to expert sports betting strategies.",
    "Bankroll management tips to stay consistently profitable.",
    "Access to whale bets with a 90% success rate.",
    "Receive early picks several hours in advance.",
    "100% transparent profit tracking.",
    "N Nikolas 7 months ago HonnÃªtement câ€™est le meilleur gars que jâ€™ai eu pour le BETTING Et oui je me suis fait avoir par quelques un des quebecois qui disais Ãªtre des machines etc avec 15 ans dâ€™expÃ©rience !! Mais pour vrai ce groupe est honnÃªte transparent et il nous fait faire de lâ€™argent !!! Je mettrais 100 Ã©toiles surto... Show more Written 4 minutes after purchase",
    "YP Yoshan Perera 7 months ago Wow what a run..keep it up.. thanks for your excellent insight into sports betting. Written 5 months after purchase",
    "AB Andre-Luc Bellemare 7 months ago The best capper i've seen in a while, great system and proof for a long time. 100% ðŸ”¥ Written 22 days after purchase",
    "ZB Zone bet 7 months ago This groups makes good decisions and is one of the best that Iâ€™ve known Written 7 days after purchase"
  ],
  "paras": [
    "Sign in GB VIP 3 MONTHS GET ACCESS TO THE GREATEST SPORTS BETTING GROUP ðŸ”¥ 5.0 ( 4 ) Other I use the BEST analytics and data to help you PRINT money betting on sports. I hit the lab daily to help my community EAT! A community that wins with strategy, not just gut feeling",
    "3 months of access to expert sports betting strategies. Bankroll management tips to stay consistently profitable. Access to whale bets with a 90% success rate. Receive early picks several hours in advance. 100% transparent profit tracking. Reviews 5 out of 5 4 total reviews 5 stars 4 stars 3 stars 2 stars 1 star N Nikolas 7 months ago HonnÃªtement câ€™est le meilleur gars que jâ€™ai eu pour le BETTING Et oui je me suis fait avoir par quelques un des quebecois qui disais Ãªtre des machines etc avec 15 ans dâ€™expÃ©rience !! Mais pour vrai ce groupe est honnÃªte transparent et il nous fait faire de lâ€™argent !!! Je mettrais 100 Ã©toiles surto...",
    "Written 4 minutes after purchase YP Yoshan Perera 7 months ago Wow what a run..keep it up.. thanks for your excellent insight into sports betting.",
    "7 months ago The best capper i've seen in a while, great system and proof for a long time. 100% ðŸ”¥",
    "7 months ago This groups makes good decisions and is one of the best that Iâ€™ve known",
    "Affiliates GB Become an affiliate Game Changers Sports Betting 50% reward Earn money by bringing customers to Game Changers Sports Betting. Every time a customer purchases using your link, you&#x27;ll earn a commission."
  ],
  "priceTokens": [
    "$45.00",
    "$45.00",
    "$45.00",
    "$1",
    "$1",
    "$1",
    "$22",
    "$1",
    "$1",
    "$1",
    "$1",
    "$1",
    "$2",
    "$1",
    "$2",
    "$2",
    "$2",
    "$2",
    "$3",
    "$3"
  ],
  "faq": [],
  "textSample": "Sign in GB VIP 3 MONTHS GET ACCESS TO THE GREATEST SPORTS BETTING GROUP ðŸ”¥ 5.0 ( 4 ) Other I use the BEST analytics and data to help you PRINT money betting on sports. I hit the lab daily to help my community EAT! A community that wins with strategy, not just gut feeling CA$45.00 / 3 months Pay Join Features 3 months of access to expert sports betting strategies. Bankroll management tips to stay consistently profitable. Access to whale bets with a 90% success rate. Receive early picks several hours in advance. 100% transparent profit tracking. Reviews 5 out of 5 4 total reviews 5 stars 4 stars 3 stars 2 stars 1 star N Nikolas 7 months ago HonnÃªtement câ€™est le meilleur gars que jâ€™ai eu pour le BETTING Et oui je me suis fait avoir par quelques un des quebecois qui disais Ãªtre des machines etc avec 15 ans dâ€™expÃ©rience !! Mais pour vrai ce groupe est honnÃªte transparent et il nous fait faire de lâ€™argent !!! Je mettrais 100 Ã©toiles surto... Show more Written 4 minutes after purchase YP Yoshan Perera 7 months ago Wow what a run..keep it up.. thanks for your excellent insight into sports betting. Written 5 months after purchase AB Andre-Luc Bellemare 7 months ago The best capper i've seen in a while, great system and proof for a long time. 100% ðŸ”¥ Written 22 days after purchase ZB Zone bet 7 months ago This groups makes good decisions and is one of the best that Iâ€™ve known Written 7 days after purchase About the creator G View profile gcsportsbetting @ gcsportsbetting â€¢ Joined May 2024 I&#x27;ve dedicated my life to mastering sports betting, developing strategies that consistently yield profits. With Game Changers, I aim to share my expertise and help others achieve betting success. Affiliates GB Become an affiliate Game Changers Sports Betting 50% reward Earn money by bringing customers to Game Changers Sports Betting. Every time a customer purchases using your link, you&#x27;ll earn a commission. VIP 3 MONTHS CA$45.00 / 3 months Join CA$45.00 / 3 months Pay Join Pay Join VIP 3 MONTHS | Whop",
  "finalUrl": "https://whop.com/game-changers-sports-betting/vip-3-months-83/",
  "fetchedAt": "2025-11-05T10:09:07.344Z",
  "textHash": "528eb9ce4d610b69a9a5f6996f542dd4a40391ac6a8d5816faffd9385f81e001",
  "drilled": false
}