{
  "baseUrl": "https://whop.com/vipweek-64/?a=alexburnett21",
  "title": "Mebpicks | Whop",
  "h1": "Mebpicks",
  "bullets": [
    "Powered by M Mebpicks I&#x27;ve dedicated my career to sports analysis, ensuring you get the best picks. With Mebpicks, you&#x27;re not just betting; you&#x27;re betting smarter and with confidence. 4.9 ( 34 ) Contact seller Products $30.00 / week Play by Data, Not by Heart â¤ï¸ VipWeek ğŸ˜ˆ 3.0 ( 2 ) $100.00 / month Play by Data, Not by Heart â¤ï¸ Vip monthly ğŸ˜ˆ New Contact seller Reviews AP Alejandro Pelaez 3 months ago Been with meb for couple of months now and hes always consistent with the plays. Makes you understand how to bet properly and make hella bread. I started betting on prizepicks 3 months ago and already won $12,836.26. In meb we trustğŸ˜ˆğŸ”¥ Written 3 days after purchase",
    "NE Nicholas Estrada 4 months ago If you like winning money then this should be a no brainer. Super simple to betting with Meb. Highly recommend Written 2 days after purchase",
    "OS Oscar M Suarez 4 months ago Best decision ğŸ‘ was a little iffy about joining but everything is legit should have joined way soonerğŸ¤‘ğŸ’ªğŸ™ğŸ™ Written 2 minutes after purchase",
    "TB Trenton Booth 4 months ago Active everyday and helpful. Smaller community you can actually talk with people and be seen or heard with any questions or problems. Written 8 days after purchase"
  ],
  "paras": [
    "M Mebpicks I&#x27;ve dedicated my career to sports analysis, ensuring you get the best picks. With Mebpicks, you&#x27;re not just betting; you&#x27;re betting smarter and with confidence. 4.9 ( 34 ) Contact seller Products $30.00 / week Play by Data, Not by Heart â¤ï¸ VipWeek ğŸ˜ˆ 3.0 ( 2 ) $100.00 / month Play by Data, Not by Heart â¤ï¸ Vip monthly ğŸ˜ˆ New Contact seller Reviews AP Alejandro Pelaez 3 months ago Been with meb for couple of months now and hes always consistent with the plays. Makes you understand how to bet properly and make hella bread. I started betting on prizepicks 3 months ago and already won $12,836.26. In meb we trustğŸ˜ˆğŸ”¥",
    "4 months ago If you like winning money then this should be a no brainer. Super simple to betting with Meb. Highly recommend",
    "4 months ago Best decision ğŸ‘ was a little iffy about joining but everything is legit should have joined way soonerğŸ¤‘ğŸ’ªğŸ™ğŸ™",
    "4 months ago Active everyday and helpful. Smaller community you can actually talk with people and be seen or heard with any questions or problems."
  ],
  "priceTokens": [
    "$30.00",
    "$100.00",
    "$12,836.26",
    "$1",
    "$1",
    "$1",
    "$21",
    "$1",
    "$1",
    "$1",
    "$1",
    "$28",
    "$1",
    "$28",
    "$28",
    "$28",
    "$28",
    "$3",
    "$3",
    "$3"
  ],
  "faq": [],
  "textSample": "Powered by M Mebpicks I&#x27;ve dedicated my career to sports analysis, ensuring you get the best picks. With Mebpicks, you&#x27;re not just betting; you&#x27;re betting smarter and with confidence. 4.9 ( 34 ) Contact seller Products $30.00 / week Play by Data, Not by Heart â¤ï¸ VipWeek ğŸ˜ˆ 3.0 ( 2 ) $100.00 / month Play by Data, Not by Heart â¤ï¸ Vip monthly ğŸ˜ˆ New Contact seller Reviews AP Alejandro Pelaez 3 months ago Been with meb for couple of months now and hes always consistent with the plays. Makes you understand how to bet properly and make hella bread. I started betting on prizepicks 3 months ago and already won $12,836.26. In meb we trustğŸ˜ˆğŸ”¥ Written 3 days after purchase NE Nicholas Estrada 4 months ago If you like winning money then this should be a no brainer. Super simple to betting with Meb. Highly recommend Written 2 days after purchase OS Oscar M Suarez 4 months ago Best decision ğŸ‘ was a little iffy about joining but everything is legit should have joined way soonerğŸ¤‘ğŸ’ªğŸ™ğŸ™ Written 2 minutes after purchase TB Trenton Booth 4 months ago Active everyday and helpful. Smaller community you can actually talk with people and be seen or heard with any questions or problems. Written 8 days after purchase See all reviews Mebpicks | Whop",
  "finalUrl": "https://whop.com/vipweek-64/?a=alexburnett21",
  "fetchedAt": "2025-11-05T10:45:37.173Z",
  "textHash": "d855211357444f59ad88e826d540f816368068ad31b4a9dbfbf47d1355fe1b83",
  "drilled": false
}