{
  "baseUrl": "https://whop.com/vulture/?a=alexburnett21",
  "title": "Vulture | Whop",
  "h1": "Vulture",
  "bullets": [
    "Vulture | Whop Powered by V Vulture I&#x27;m passionate about sports betting and have created Vulture to empower bettors like you. In our Discord community, you&#x27;ll find innovative tools and real-time alerts that help you capitalize on profit... More 4.7 ( 20 ) Contact seller Products $75.00 / month Predators of odds Vulture 4.7 ( 19 ) Contact seller Reviews R randomdegen 1 year ago Much faster speeds for odds than some sites people pay upwards of $200 a month for and almost every other discord I’ve tried. The new updates have made this discord like Barry Bonds on steroids Written 2 years after purchase",
    "BK Brandon Koebel 1 year ago Don’t know what I would do without this. Constantly improving also! Written 10 days after purchase",
    "RP Ryan Pittell 2 years ago this discord should be 5k a month. incredible value Written 1 month after purchase",
    "TN T A I Z E N 2 years ago I love this discord and community. I've killed it since joining and you will too Written 2 months after purchase"
  ],
  "paras": [
    "V Vulture I&#x27;m passionate about sports betting and have created Vulture to empower bettors like you. In our Discord community, you&#x27;ll find innovative tools and real-time alerts that help you capitalize on profit... More 4.7 ( 20 ) Contact seller Products $75.00 / month Predators of odds Vulture 4.7 ( 19 ) Contact seller Reviews R randomdegen 1 year ago Much faster speeds for odds than some sites people pay upwards of $200 a month for and almost every other discord I’ve tried. The new updates have made this discord like Barry Bonds on steroids",
    "1 year ago Don’t know what I would do without this. Constantly improving also!",
    "2 years ago this discord should be 5k a month. incredible value",
    "2 years ago I love this discord and community. I've killed it since joining and you will too"
  ],
  "priceTokens": [
    "$75.00",
    "$200",
    "$1",
    "$1",
    "$1",
    "$21",
    "$1",
    "$1",
    "$1",
    "$1",
    "$28",
    "$1",
    "$28",
    "$28",
    "$28",
    "$28",
    "$3",
    "$3",
    "$3",
    "$10"
  ],
  "faq": [],
  "textSample": "Vulture | Whop Powered by V Vulture I&#x27;m passionate about sports betting and have created Vulture to empower bettors like you. In our Discord community, you&#x27;ll find innovative tools and real-time alerts that help you capitalize on profit... More 4.7 ( 20 ) Contact seller Products $75.00 / month Predators of odds Vulture 4.7 ( 19 ) Contact seller Reviews R randomdegen 1 year ago Much faster speeds for odds than some sites people pay upwards of $200 a month for and almost every other discord I’ve tried. The new updates have made this discord like Barry Bonds on steroids Written 2 years after purchase BK Brandon Koebel 1 year ago Don’t know what I would do without this. Constantly improving also! Written 10 days after purchase RP Ryan Pittell 2 years ago this discord should be 5k a month. incredible value Written 1 month after purchase TN T A I Z E N 2 years ago I love this discord and community. I've killed it since joining and you will too Written 2 months after purchase See all reviews",
  "finalUrl": "https://whop.com/vulture/?a=alexburnett21",
  "fetchedAt": "2025-11-05T17:27:30.674Z",
  "textHash": "e33db077814a160e78ad6d8404009a0a89c6785296b1dd7a4333fab8a5c6b265",
  "drilled": false
}