{
  "baseUrl": "https://whop.com/wagerhub/wagerhub/?a=alexburnett21",
  "title": "WagerHub Premium | Whop",
  "h1": "WagerHub Premium",
  "bullets": [
    "Sign in W WagerHub Premium DAILY Locks - Backed by Data &amp; Stats 5.0 ( 8 ) Sports betting Using our advanced projections/statistics, we went up 172 units in 2024. So far in 2025, we have already gone up 192 units. $4.99 / week Pay Join Features 3-5 Picks Daily",
    "Extra Projections/Statistics",
    "Anytime Q&amp;A",
    "H Hudson 8 days ago This guy is crazy and is a damn near every day profit typa guy Written 3 days after purchase",
    "T TopGreene 12 days ago nothing but greens so farðŸ«¡ Written 3 days after purchase",
    "KB Kendel Brown 8 months ago they always have great picks and always have research with their picks! i have already made the money back Written 6 days after purchase",
    "SG Santiago Guzman 8 months ago Always appreciate the server's help with picks, 100& recommend! Written 9 days after purchase"
  ],
  "paras": [
    "Sign in W WagerHub Premium DAILY Locks - Backed by Data &amp; Stats 5.0 ( 8 ) Sports betting Using our advanced projections/statistics, we went up 172 units in 2024. So far in 2025, we have already gone up 192 units.",
    "$4.99 / week Pay Join Features 3-5 Picks Daily Extra Projections/Statistics Anytime Q&amp;A Reviews 5 out of 5 8 total reviews 5 stars 4 stars 3 stars 2 stars 1 star H Hudson 8 days ago This guy is crazy and is a damn near every day profit typa guy",
    "12 days ago nothing but greens so farðŸ«¡",
    "8 months ago they always have great picks and always have research with their picks! i have already made the money back",
    "8 months ago Always appreciate the server's help with picks, 100& recommend!",
    "About the creator W View profile WagerHub @ wagerhub â€¢ Joined Jan 2025 Affiliates W Become an affiliate WagerHub 30% reward Earn money by bringing customers to WagerHub. Every time a customer purchases using your link, you&#x27;ll earn a commission."
  ],
  "priceTokens": [
    "$4.99",
    "$4.99",
    "$4.99",
    "$1",
    "$1",
    "$1",
    "$22",
    "$1",
    "$1",
    "$1",
    "$1",
    "$1",
    "$2",
    "$1",
    "$2",
    "$2",
    "$2",
    "$2",
    "$3",
    "$3"
  ],
  "faq": [],
  "textSample": "Sign in W WagerHub Premium DAILY Locks - Backed by Data &amp; Stats 5.0 ( 8 ) Sports betting Using our advanced projections/statistics, we went up 172 units in 2024. So far in 2025, we have already gone up 192 units. $4.99 / week Pay Join Features 3-5 Picks Daily Extra Projections/Statistics Anytime Q&amp;A Reviews 5 out of 5 8 total reviews 5 stars 4 stars 3 stars 2 stars 1 star H Hudson 8 days ago This guy is crazy and is a damn near every day profit typa guy Written 3 days after purchase T TopGreene 12 days ago nothing but greens so farðŸ«¡ Written 3 days after purchase KB Kendel Brown 8 months ago they always have great picks and always have research with their picks! i have already made the money back Written 6 days after purchase SG Santiago Guzman 8 months ago Always appreciate the server's help with picks, 100& recommend! Written 9 days after purchase See all reviews About the creator W View profile WagerHub @ wagerhub â€¢ Joined Jan 2025 Affiliates W Become an affiliate WagerHub 30% reward Earn money by bringing customers to WagerHub. Every time a customer purchases using your link, you&#x27;ll earn a commission. WagerHub Premium $4.99 / week +5 options Join $4.99 / week 5 options Pay Join Pay Join WagerHub Premium | Whop",
  "finalUrl": "https://whop.com/wagerhub/wagerhub/?a=alexburnett21",
  "fetchedAt": "2025-11-04T21:54:25.157Z",
  "textHash": "0560b6e8219e47f415ed1ded6d5f9e71f0b191d9b0a2f0e99069e9655f312fa9",
  "drilled": true
}