{
  "baseUrl": "https://whop.com/weekly-cooks-52/?a=alexburnett21",
  "title": "Top Tier Chefs | Whop",
  "h1": "Top Tier Chefs",
  "bullets": [
    "Powered by TC Top Tier Chefs ğŸ² Exclusive betting Discord | Top Tier Chefs ğŸ§‘â€ğŸ³ Where precision meets profit â€” come eat with the winners. ğŸ½ï¸ 4.6 ( 19 ) Contact seller Products Free Join the Winning Team of Top Tier Chefs! Free Appetizers 5.0 ( 13 ) $180.00 Join the Winning Team of Chefs Life Time Cooks 1.0 ( 1 ) $10.00 / week Join the Winning Team of Chefs Weekly Cooks New $20.00 / month Monthly cooks Monthly cooks 3.7 ( 3 ) Contact seller Reviews WJ Wyatt Jensen â€¢ Free Appetizers 8 months ago There service is like non other discord. They cash out everyday! Written 1 year after purchase",
    "RR ricardo ruballos 1 year ago One of the best discord that helped me manage my units , and grow my money. I been greening ever since I got here. Soccer, mlb, nhl wtv come join the winning team !ğŸ«¡ Written 1 month after purchase",
    "B blackice 1 year ago Hey guys my account was hack and now I'm banned I have deleted that account and has a new one I am on prieume and I would like to continue with you guys Written 9 days after purchase",
    "TO Tyrik Oneal â€¢ Monthly cooks 3 days ago Written 8 days after purchase"
  ],
  "paras": [
    "TC Top Tier Chefs ğŸ² Exclusive betting Discord | Top Tier Chefs ğŸ§‘â€ğŸ³ Where precision meets profit â€” come eat with the winners. ğŸ½ï¸ 4.6 ( 19 ) Contact seller Products Free Join the Winning Team of Top Tier Chefs! Free Appetizers 5.0 ( 13 ) $180.00 Join the Winning Team of Chefs Life Time Cooks 1.0 ( 1 ) $10.00 / week Join the Winning Team of Chefs Weekly Cooks New $20.00 / month Monthly cooks Monthly cooks 3.7 ( 3 ) Contact seller Reviews WJ Wyatt Jensen â€¢ Free Appetizers 8 months ago There service is like non other discord. They cash out everyday!",
    "1 year ago One of the best discord that helped me manage my units , and grow my money. I been greening ever since I got here. Soccer, mlb, nhl wtv come join the winning team !ğŸ«¡",
    "1 year ago Hey guys my account was hack and now I'm banned I have deleted that account and has a new one I am on prieume and I would like to continue with you guys",
    "3 days ago"
  ],
  "priceTokens": [
    "$180.00",
    "$10.00",
    "$20.00",
    "$1",
    "$1",
    "$1",
    "$21",
    "$1",
    "$1",
    "$1",
    "$1",
    "$28",
    "$1",
    "$28",
    "$28",
    "$28",
    "$28",
    "$3",
    "$3",
    "$3"
  ],
  "faq": [],
  "textSample": "Powered by TC Top Tier Chefs ğŸ² Exclusive betting Discord | Top Tier Chefs ğŸ§‘â€ğŸ³ Where precision meets profit â€” come eat with the winners. ğŸ½ï¸ 4.6 ( 19 ) Contact seller Products Free Join the Winning Team of Top Tier Chefs! Free Appetizers 5.0 ( 13 ) $180.00 Join the Winning Team of Chefs Life Time Cooks 1.0 ( 1 ) $10.00 / week Join the Winning Team of Chefs Weekly Cooks New $20.00 / month Monthly cooks Monthly cooks 3.7 ( 3 ) Contact seller Reviews WJ Wyatt Jensen â€¢ Free Appetizers 8 months ago There service is like non other discord. They cash out everyday! Written 1 year after purchase RR ricardo ruballos 1 year ago One of the best discord that helped me manage my units , and grow my money. I been greening ever since I got here. Soccer, mlb, nhl wtv come join the winning team !ğŸ«¡ Written 1 month after purchase B blackice 1 year ago Hey guys my account was hack and now I'm banned I have deleted that account and has a new one I am on prieume and I would like to continue with you guys Written 9 days after purchase TO Tyrik Oneal â€¢ Monthly cooks 3 days ago Written 8 days after purchase See all reviews Top Tier Chefs | Whop",
  "finalUrl": "https://whop.com/weekly-cooks-52/?a=alexburnett21",
  "fetchedAt": "2025-11-05T09:58:32.268Z",
  "textHash": "5b373572e4b9bd2d20663e5cbd31198d957a4f42a91e4aa9524ce9c517d2210c",
  "drilled": false
}