{
  "baseUrl": "https://whop.com/wifirouteclub/wifi-route-club-20/",
  "title": "Wi-Fi Route Eliteâ„¢ | Whop",
  "h1": "Wi-Fi Route Eliteâ„¢",
  "bullets": [
    "Sign in WC Wi-Fi Route Eliteâ„¢ The ORB Blueprintâ„¢ 5.0 ( 8 ) Trading $250.00 / 3 months 3 left Pay Join Features Proven Strategy â€“ Master the Opening Range Breakout method with step-by-step guidance.",
    "Risk Management â€“ Learn how to protect your capital and grow with confidence.",
    "Daily Playbook â€“ Clear, structured rules to remove guesswork from your trading.",
    "Backtesting Insights â€“ See real data comparisons (5-min vs 15-min) to sharpen your edge.",
    "Freedom Roadmap â€“ A simple plan designed to scale your account and change your lifestyle.",
    "MS Max Sanders 2 months ago Iâ€™ve been working with Raffeal for quite some time now, and I can honestly say he has always been there to help me with every single question I had. His guidance is clear, patient, and straight to the point. The ORB strategy he teaches is truly outstanding â€“ simple to understand, effective to apply... Show more Written 23 days after purchase",
    "R robert 4 months ago Been part of this community for 3 months now and itâ€™s the real deal. No fluff, no hype just raw value. The setups are clean, the education is clear, and the live calls actually help you level up. Whether youâ€™re new or experienced, this page will sharpen your game. Salute to the consistency and the d... Show more Written 11 minutes after purchase",
    "B Benny 4 months ago Rafaell goes above and beyond WIFI CLUB is a 5 star. Heâ€™s helped me improve my trading to next level. Written 2 months after purchase",
    "LM luis marquez 7 months ago Deff a recomended , He is always there to help and helps out alot on any question you may have love the fact that he follows up with you. Currently on my way to funded but much more secure and shore about how my strategy works and everything goes around it. Written 12 days after purchase"
  ],
  "paras": [
    "Sign in WC Wi-Fi Route Eliteâ„¢ The ORB Blueprintâ„¢ 5.0 ( 8 ) Trading $250.00 / 3 months 3 left Pay Join Features Proven Strategy â€“ Master the Opening Range Breakout method with step-by-step guidance. Risk Management â€“ Learn how to protect your capital and grow with confidence. Daily Playbook â€“ Clear, structured rules to remove guesswork from your trading. Backtesting Insights â€“ See real data comparisons (5-min vs 15-min) to sharpen your edge. Freedom Roadmap â€“ A simple plan designed to scale your account and change your lifestyle. Reviews 5 out of 5 8 total reviews 5 stars 4 stars 3 stars 2 stars 1 star MS Max Sanders 2 months ago Iâ€™ve been working with Raffeal for quite some time now, and I can honestly say he has always been there to help me with every single question I had. His guidance is clear, patient, and straight to the point. The ORB strategy he teaches is truly outstanding â€“ simple to understand, effective to apply...",
    "Written 23 days after purchase R robert 4 months ago Been part of this community for 3 months now and itâ€™s the real deal. No fluff, no hype just raw value. The setups are clean, the education is clear, and the live calls actually help you level up. Whether youâ€™re new or experienced, this page will sharpen your game. Salute to the consistency and the d...",
    "Written 11 minutes after purchase B Benny 4 months ago Rafaell goes above and beyond WIFI CLUB is a 5 star. Heâ€™s helped me improve my trading to next level.",
    "7 months ago Deff a recomended , He is always there to help and helps out alot on any question you may have love the fact that he follows up with you. Currently on my way to funded but much more secure and shore about how my strategy works and everything goes around it.",
    "About the creator RT View profile Rafael Trades @ rafaelmayeta86 â€¢ Joined Jan 2023 Day Trader and mentor . FAQs ðŸ”¹ 1. Who is this mentorship for? ðŸ”¹ 2. Do I need experience to join? ðŸ”¹ 3. Will I learn how to pass a prop firm challenge? Affiliates WC Become an affiliate Wi-Fi Route Club 25% reward Earn money by bringing customers to Wi-Fi Route Club. Every time a customer purchases using your link, you&#x27;ll earn a commission."
  ],
  "priceTokens": [
    "$250.00",
    "$250.00",
    "$250.00",
    "$1",
    "$1",
    "$1",
    "$22",
    "$1",
    "$1",
    "$1",
    "$1",
    "$1",
    "$2",
    "$1",
    "$2",
    "$2",
    "$2",
    "$2",
    "$3",
    "$3"
  ],
  "faq": [],
  "textSample": "Sign in WC Wi-Fi Route Eliteâ„¢ The ORB Blueprintâ„¢ 5.0 ( 8 ) Trading $250.00 / 3 months 3 left Pay Join Features Proven Strategy â€“ Master the Opening Range Breakout method with step-by-step guidance. Risk Management â€“ Learn how to protect your capital and grow with confidence. Daily Playbook â€“ Clear, structured rules to remove guesswork from your trading. Backtesting Insights â€“ See real data comparisons (5-min vs 15-min) to sharpen your edge. Freedom Roadmap â€“ A simple plan designed to scale your account and change your lifestyle. Reviews 5 out of 5 8 total reviews 5 stars 4 stars 3 stars 2 stars 1 star MS Max Sanders 2 months ago Iâ€™ve been working with Raffeal for quite some time now, and I can honestly say he has always been there to help me with every single question I had. His guidance is clear, patient, and straight to the point. The ORB strategy he teaches is truly outstanding â€“ simple to understand, effective to apply... Show more Written 23 days after purchase R robert 4 months ago Been part of this community for 3 months now and itâ€™s the real deal. No fluff, no hype just raw value. The setups are clean, the education is clear, and the live calls actually help you level up. Whether youâ€™re new or experienced, this page will sharpen your game. Salute to the consistency and the d... Show more Written 11 minutes after purchase B Benny 4 months ago Rafaell goes above and beyond WIFI CLUB is a 5 star. Heâ€™s helped me improve my trading to next level. Written 2 months after purchase LM luis marquez 7 months ago Deff a recomended , He is always there to help and helps out alot on any question you may have love the fact that he follows up with you. Currently on my way to funded but much more secure and shore about how my strategy works and everything goes around it. Written 12 days after purchase See all reviews About the creator RT View profile Rafael Trades @ rafaelmayeta86 â€¢ Joined Jan 2023 Day Trader and mentor . FAQs ðŸ”¹ 1. Who is this mentorship for? ðŸ”¹ 2. Do I need experience to join? ðŸ”¹ 3. Will I learn how to pass a prop firm challenge? Affiliates WC Become an affiliate Wi-Fi Route Club 25% reward Earn money by bringing customers to Wi-Fi Route Club. Every time a customer purchases using your link, you&#x27;ll earn a commission. Wi-Fi Route Eliteâ„¢ $250.00 / 3 months Join $250.00 / 3 months Pay Join Pay Join Wi-Fi Route Eliteâ„¢ | Whop",
  "finalUrl": "https://whop.com/wifirouteclub/wifi-route-club-20/",
  "fetchedAt": "2025-11-04T20:12:51.818Z",
  "textHash": "48790643379f14a61d0aa36c20e710038048dfd8b3bda9eabcc14cb3019fe6a8",
  "drilled": false
}