{
  "baseUrl": "https://whop.com/win-the-day-discord/?a=alexburnett21",
  "title": "WinTheDay | Whop",
  "h1": "WinTheDay",
  "bullets": [
    "Powered by W WinTheDay I&#x27;ve dedicated my journey to helping traders reach the next level with proven strategies. My focus is on education, not just alerts, empowering you for long-term success. 4.7 ( 46 ) Contact seller Products $99.00 / month Join A Group Of Elite Traders To Acheive Financial Freedom Win The Day Monthly 4.6 ( 40 ) $540.00 / 6 months Accelerate Your Trading Success Win The Day 6 Month New $995.00 / year Elevate Your Trading Game Year-Round Win The Day Yearly Access New Contact seller Reviews T Treasure 8 months ago I came across this from a friend on Twitter and he told me how organized and well coached community this was. I hope to get valuable insights too! Written 1 minute after purchase",
    "F fasholaebere 8 months ago Am ready to learn more than ever Written 9 minutes after purchase",
    "P pedrocruz7315 9 months ago ðŸ”¥ Nice learning programme... Written 4 minutes after purchase",
    "UO Umeh Odera 9 months ago Nice server Written 3 minutes after purchase"
  ],
  "paras": [
    "W WinTheDay I&#x27;ve dedicated my journey to helping traders reach the next level with proven strategies. My focus is on education, not just alerts, empowering you for long-term success. 4.7 ( 46 ) Contact seller Products $99.00 / month Join A Group Of Elite Traders To Acheive Financial Freedom Win The Day Monthly 4.6 ( 40 ) $540.00 / 6 months Accelerate Your Trading Success Win The Day 6 Month New $995.00 / year Elevate Your Trading Game Year-Round Win The Day Yearly Access New Contact seller Reviews T Treasure 8 months ago I came across this from a friend on Twitter and he told me how organized and well coached community this was. I hope to get valuable insights too!",
    "8 months ago Am ready to learn more than ever",
    "9 months ago ðŸ”¥ Nice learning programme...",
    "9 months ago Nice server"
  ],
  "priceTokens": [
    "$99.00",
    "$540.00",
    "$995.00",
    "$1",
    "$1",
    "$1",
    "$21",
    "$1",
    "$1",
    "$1",
    "$1",
    "$28",
    "$1",
    "$28",
    "$28",
    "$28",
    "$28",
    "$3",
    "$3",
    "$3"
  ],
  "faq": [],
  "textSample": "Powered by W WinTheDay I&#x27;ve dedicated my journey to helping traders reach the next level with proven strategies. My focus is on education, not just alerts, empowering you for long-term success. 4.7 ( 46 ) Contact seller Products $99.00 / month Join A Group Of Elite Traders To Acheive Financial Freedom Win The Day Monthly 4.6 ( 40 ) $540.00 / 6 months Accelerate Your Trading Success Win The Day 6 Month New $995.00 / year Elevate Your Trading Game Year-Round Win The Day Yearly Access New Contact seller Reviews T Treasure 8 months ago I came across this from a friend on Twitter and he told me how organized and well coached community this was. I hope to get valuable insights too! Written 1 minute after purchase F fasholaebere 8 months ago Am ready to learn more than ever Written 9 minutes after purchase P pedrocruz7315 9 months ago ðŸ”¥ Nice learning programme... Written 4 minutes after purchase UO Umeh Odera 9 months ago Nice server Written 3 minutes after purchase See all reviews WinTheDay | Whop",
  "finalUrl": "https://whop.com/win-the-day-discord/?a=alexburnett21",
  "fetchedAt": "2025-11-05T09:55:23.081Z",
  "textHash": "c5b5ee33f0c54179931c11cfac04e08f97998fdaf78c9796801e46419eb569fd",
  "drilled": false
}