{
  "baseUrl": "https://whop.com/toodegrees/xlevels/",
  "title": "X-Levels [Pro+] (TradeX) | Whop",
  "h1": "X-Levels [Pro+] (TradeX)",
  "bullets": [
    "Sign in Unmute Unmute Unmute Unmute T X-Levels [Pro+] (TradeX) Experience Automated Dealing Ranges With X-Levels 4.8 ( 216 ) Trading Uncover Automated Dealing Ranges and XLevels with a Price Delivery Framework for Entries and Exits $45.00 / month Pay Get access Join 25 members Features Automatic DR Measurements – Measures and populates any timeframe Dealing Ranges",
    "X-Level Percentages – % shown for each Dealing Range with clear chart markers",
    "Killzone Delineation – Customize times and colors to highlight set killzones",
    "Opening Price Delineations – Mark opening times vertically &amp; horizontally",
    "Works Across Multiple Assets – Use it on Forex, Stocks, Indices, and Crypto",
    "CT CHANG Toma 13 hours ago TTFM really changed my life ! Written 2 days after purchase",
    "K Ktrades718 6 days ago Love it Written 1 month after purchase",
    "JK Jincy Kelly 8 days ago I really like the TTFM Fractal Model indicator as well as the ADR Pro indicator. The TTFM Fractal model indicator surprisingly doesn't really lag that much and promptly displays SMTs and the alerts really help you focus on the direction of the trade. The ADR indicator gives you that added confirmati... Show more Written 4 days after purchase",
    "M Mr.Bear 19 days ago Great indicator also TT is a great mentor! Written 5 months after purchase"
  ],
  "paras": [
    "Sign in Unmute Unmute Unmute Unmute T X-Levels [Pro+] (TradeX) Experience Automated Dealing Ranges With X-Levels 4.8 ( 216 ) Trading Uncover Automated Dealing Ranges and XLevels with a Price Delivery Framework for Entries and Exits",
    "$45.00 / month Pay Get access Join 25 members Features Automatic DR Measurements – Measures and populates any timeframe Dealing Ranges X-Level Percentages – % shown for each Dealing Range with clear chart markers Killzone Delineation – Customize times and colors to highlight set killzones Opening Price Delineations – Mark opening times vertically &amp; horizontally Works Across Multiple Assets – Use it on Forex, Stocks, Indices, and Crypto Reviews 4.78 out of 5 216 total reviews 5 stars 4 stars 3 stars 2 stars 1 star CT CHANG Toma 13 hours ago TTFM really changed my life !",
    "6 days ago Love it",
    "8 days ago I really like the TTFM Fractal Model indicator as well as the ADR Pro indicator. The TTFM Fractal model indicator surprisingly doesn't really lag that much and promptly displays SMTs and the alerts really help you focus on the direction of the trade. The ADR indicator gives you that added confirmati...",
    "Written 4 days after purchase M Mr.Bear 19 days ago Great indicator also TT is a great mentor!",
    "About the creator T View profile Toodegrees @ toodegrees • Joined Feb 2024 Our algorithmic-driven approach leverages ICT Concepts and simplifies complex data, transforming it into actionable trading insights. This empowers your judgement, resulting in smarter decisions and clearer opportunities. FAQs How do I add purchased indicators to my TradingView chart? Do you need a premium TradingView subscription to use our indicators? What support or resources are available for assistance with using the indicators effectively? What assets are compatible with our indicators? What is Toodegrees refund policy? Affiliates T Become an affiliate Toodegrees 10% reward Earn money by bringing customers to Toodegrees. Every time a customer purchases using your link, you&#x27;ll earn a commission."
  ],
  "priceTokens": [
    "$45.00",
    "$45.00",
    "$45.00",
    "$1",
    "$1",
    "$1",
    "$22",
    "$1",
    "$1",
    "$1",
    "$1",
    "$1",
    "$2",
    "$1",
    "$2",
    "$2",
    "$2",
    "$2",
    "$3",
    "$3"
  ],
  "faq": [],
  "textSample": "Sign in Unmute Unmute Unmute Unmute T X-Levels [Pro+] (TradeX) Experience Automated Dealing Ranges With X-Levels 4.8 ( 216 ) Trading Uncover Automated Dealing Ranges and XLevels with a Price Delivery Framework for Entries and Exits $45.00 / month Pay Get access Join 25 members Features Automatic DR Measurements – Measures and populates any timeframe Dealing Ranges X-Level Percentages – % shown for each Dealing Range with clear chart markers Killzone Delineation – Customize times and colors to highlight set killzones Opening Price Delineations – Mark opening times vertically &amp; horizontally Works Across Multiple Assets – Use it on Forex, Stocks, Indices, and Crypto Reviews 4.78 out of 5 216 total reviews 5 stars 4 stars 3 stars 2 stars 1 star CT CHANG Toma 13 hours ago TTFM really changed my life ! Written 2 days after purchase K Ktrades718 6 days ago Love it Written 1 month after purchase JK Jincy Kelly 8 days ago I really like the TTFM Fractal Model indicator as well as the ADR Pro indicator. The TTFM Fractal model indicator surprisingly doesn't really lag that much and promptly displays SMTs and the alerts really help you focus on the direction of the trade. The ADR indicator gives you that added confirmati... Show more Written 4 days after purchase M Mr.Bear 19 days ago Great indicator also TT is a great mentor! Written 5 months after purchase See all reviews About the creator T View profile Toodegrees @ toodegrees • Joined Feb 2024 Our algorithmic-driven approach leverages ICT Concepts and simplifies complex data, transforming it into actionable trading insights. This empowers your judgement, resulting in smarter decisions and clearer opportunities. FAQs How do I add purchased indicators to my TradingView chart? Do you need a premium TradingView subscription to use our indicators? What support or resources are available for assistance with using the indicators effectively? What assets are compatible with our indicators? What is Toodegrees refund policy? Affiliates T Become an affiliate Toodegrees 10% reward Earn money by bringing customers to Toodegrees. Every time a customer purchases using your link, you&#x27;ll earn a commission. X-Levels [Pro+] (TradeX) $45.00 / month +2 options Get access $45.00 / month 2 options Pay Get access Pay Get access X-Levels [Pro+] (TradeX) | Whop",
  "finalUrl": "https://whop.com/toodegrees/xlevels/",
  "fetchedAt": "2025-11-04T21:45:03.467Z",
  "textHash": "f2d829fd8ba1c988645b5d442587420c937370627a647568bbccf31f70aff58d",
  "drilled": false
}