{
  "baseUrl": "https://whop.com/zeniqle/xtyphoon/",
  "title": "XTyphoon | Whop",
  "h1": "XTyphoon",
  "bullets": [
    "Sign in Z XTyphoon X (Twitter) Growth Automation Tool 5.0 ( 1 ) Other XTyphoon is your powerful ally in building a genuine, engaged following on X (formerly Twitter). $997.00 / month 3 left Pay Get access Features Automated Engagement to bring traffic back to your Twitter profile",
    "Automated AI comments to pull attention to your profile",
    "One-click X (Twitter) login",
    "Run from multiple backup accounts simultaneously",
    "Option to disable media load to save data and improve performance",
    "ZT Zeniqle Two 1 month ago Written 1 day after purchase"
  ],
  "paras": [
    "Sign in Z XTyphoon X (Twitter) Growth Automation Tool 5.0 ( 1 ) Other XTyphoon is your powerful ally in building a genuine, engaged following on X (formerly Twitter).",
    "3 left Pay Get access Features Automated Engagement to bring traffic back to your Twitter profile Automated AI comments to pull attention to your profile One-click X (Twitter) login Run from multiple backup accounts simultaneously Option to disable media load to save data and improve performance Reviews 5 out of 5 1 review 5 stars 4 stars 3 stars 2 stars 1 star ZT Zeniqle Two 1 month ago",
    "FAQs Do I need to give XTyphoon access to my X account? Can I use XTyphoon on my phone? Is my account safe using XTyphoon? Is it easy to set up? How long does it take to start seeing results? Affiliates Z Become an affiliate Zeniqle 30% reward Earn money by bringing customers to Zeniqle. Every time a customer purchases using your link, you&#x27;ll earn a commission."
  ],
  "priceTokens": [
    "$997.00",
    "$997.00",
    "$997.00",
    "$1",
    "$1",
    "$1",
    "$22",
    "$1",
    "$1",
    "$1",
    "$1",
    "$1",
    "$2",
    "$1",
    "$2",
    "$2",
    "$2",
    "$2",
    "$3",
    "$3"
  ],
  "faq": [],
  "textSample": "Sign in Z XTyphoon X (Twitter) Growth Automation Tool 5.0 ( 1 ) Other XTyphoon is your powerful ally in building a genuine, engaged following on X (formerly Twitter). $997.00 / month 3 left Pay Get access Features Automated Engagement to bring traffic back to your Twitter profile Automated AI comments to pull attention to your profile One-click X (Twitter) login Run from multiple backup accounts simultaneously Option to disable media load to save data and improve performance Reviews 5 out of 5 1 review 5 stars 4 stars 3 stars 2 stars 1 star ZT Zeniqle Two 1 month ago Written 1 day after purchase About the creator ZS View profile Zen Sajnani @ zensajnani â€¢ Joined Jan 2025 FAQs Do I need to give XTyphoon access to my X account? Can I use XTyphoon on my phone? Is my account safe using XTyphoon? Is it easy to set up? How long does it take to start seeing results? Affiliates Z Become an affiliate Zeniqle 30% reward Earn money by bringing customers to Zeniqle. Every time a customer purchases using your link, you&#x27;ll earn a commission. XTyphoon $997.00 / month Get access $997.00 / month Pay Get access Pay Get access XTyphoon | Whop",
  "finalUrl": "https://whop.com/zeniqle/xtyphoon/",
  "fetchedAt": "2025-11-05T10:43:27.019Z",
  "textHash": "95ed3f9ee587760dd87d00aecaaa69beebd47e13d8b72baad0c24063d9ef8962",
  "drilled": false
}