{
  "baseUrl": "https://whop.com/bez-clips/yutaka-alpha/",
  "title": "Yutaka Alpha | Whop",
  "h1": "Yutaka Alpha",
  "bullets": [
    "Sign in Unmute Unmute YA Yutaka Alpha Make $10,000 a month trading memecoins 4.2 ( 5 ) Other Yutaka Alpha: Your beginner-friendly hub for crypto &amp; meme coin success. Join 5,000+ members, get private tools, 1-on-1 help, and easy guides to start thriving today! $60.00 / month Pay Join waitlist Features Enjoy 24/7 access to support from expert traders and personalised assistance.",
    "Access 50+ custom tools for everything needed to avoid scam tokens",
    "Access 20+ curated guides to master trading basics",
    "Stay updated with our instant Twitter monitor, providing real-time insights.",
    "Follow top traders buys and sells with private tracking tools.",
    "CV Chris v 8 months ago Really well put together course for beginners. Then gets deeper and deeper as far as technicals and market dynamics go. Would recommend, and has a generous affiliate program. Written 25 days after purchase",
    "K kohai_sweet 9 months ago Best Server with the nicest ppl and great calls, Managed to get a 550% PnL. Written 6 days after purchase",
    "L Liz 9 months ago This is by far the best place to learn and trade. Lots of great resources to use on my journey to memecoin trading! Very responsive team, had my questions responded almost instantly! This is a great place with great people! Written 15 days after purchase",
    "S solmadepotato 9 months ago best tools for the best price I have found so far! helped me up my port 50x! Written 14 days after purchase"
  ],
  "paras": [
    "Sign in Unmute Unmute YA Yutaka Alpha Make $10,000 a month trading memecoins 4.2 ( 5 ) Other Yutaka Alpha: Your beginner-friendly hub for crypto &amp; meme coin success. Join 5,000+ members, get private tools, 1-on-1 help, and easy guides to start thriving today!",
    "Enjoy 24/7 access to support from expert traders and personalised assistance. Access 50+ custom tools for everything needed to avoid scam tokens Access 20+ curated guides to master trading basics Stay updated with our instant Twitter monitor, providing real-time insights. Follow top traders buys and sells with private tracking tools. Reviews 4.20 out of 5 5 total reviews 5 stars 4 stars 3 stars 2 stars 1 star CV Chris v 8 months ago Really well put together course for beginners. Then gets deeper and deeper as far as technicals and market dynamics go. Would recommend, and has a generous affiliate program.",
    "9 months ago Best Server with the nicest ppl and great calls, Managed to get a 550% PnL.",
    "9 months ago This is by far the best place to learn and trade. Lots of great resources to use on my journey to memecoin trading! Very responsive team, had my questions responded almost instantly! This is a great place with great people!",
    "9 months ago best tools for the best price I have found so far! helped me up my port 50x!",
    "About the creator B View profile Bez @ beztrades • Joined Mar 2023 FAQs Do I need Money To Start? What if I don&#x27;t know how to edit? Where do I get the videos from? Affiliates YA Become an affiliate Yutaka Alpha 50% reward Earn money by bringing customers to Yutaka Alpha. Every time a customer purchases using your link, you&#x27;ll earn a commission."
  ],
  "priceTokens": [
    "$10,000",
    "$60.00",
    "$60.00",
    "$60.00",
    "$1",
    "$1",
    "$1",
    "$22",
    "$1",
    "$1",
    "$1",
    "$1",
    "$1",
    "$2",
    "$1",
    "$2",
    "$2",
    "$2",
    "$2",
    "$3"
  ],
  "faq": [],
  "textSample": "Sign in Unmute Unmute YA Yutaka Alpha Make $10,000 a month trading memecoins 4.2 ( 5 ) Other Yutaka Alpha: Your beginner-friendly hub for crypto &amp; meme coin success. Join 5,000+ members, get private tools, 1-on-1 help, and easy guides to start thriving today! $60.00 / month Pay Join waitlist Features Enjoy 24/7 access to support from expert traders and personalised assistance. Access 50+ custom tools for everything needed to avoid scam tokens Access 20+ curated guides to master trading basics Stay updated with our instant Twitter monitor, providing real-time insights. Follow top traders buys and sells with private tracking tools. Reviews 4.20 out of 5 5 total reviews 5 stars 4 stars 3 stars 2 stars 1 star CV Chris v 8 months ago Really well put together course for beginners. Then gets deeper and deeper as far as technicals and market dynamics go. Would recommend, and has a generous affiliate program. Written 25 days after purchase K kohai_sweet 9 months ago Best Server with the nicest ppl and great calls, Managed to get a 550% PnL. Written 6 days after purchase L Liz 9 months ago This is by far the best place to learn and trade. Lots of great resources to use on my journey to memecoin trading! Very responsive team, had my questions responded almost instantly! This is a great place with great people! Written 15 days after purchase S solmadepotato 9 months ago best tools for the best price I have found so far! helped me up my port 50x! Written 14 days after purchase See all reviews About the creator B View profile Bez @ beztrades • Joined Mar 2023 FAQs Do I need Money To Start? What if I don&#x27;t know how to edit? Where do I get the videos from? Affiliates YA Become an affiliate Yutaka Alpha 50% reward Earn money by bringing customers to Yutaka Alpha. Every time a customer purchases using your link, you&#x27;ll earn a commission. Yutaka Alpha $60.00 / month Get access $60.00 / month Pay Join waitlist Pay Join waitlist Yutaka Alpha | Whop",
  "finalUrl": "https://whop.com/bez-clips/yutaka-alpha/",
  "fetchedAt": "2025-11-04T20:10:08.986Z",
  "textHash": "9e48a8800cfccf1cd38c13e4a8dba230f55d04949ee9bb3dc73f3594e2bdbef7",
  "drilled": false
}