{
  "baseUrl": "https://whop.com/ztrading/ztradingcommunity/",
  "title": "Zen Trading Premium | Whop",
  "h1": "Zen Trading Premium",
  "bullets": [
    "Sign in Unmute Unmute Unmute Unmute Unmute Unmute Unmute Unmute Unmute Unmute ZT Zen Trading Premium ðŸ•– Predict Moves BEFORE They Happen &amp; Conquer the Market ðŸš€ 5.0 ( 41 ) Trading Learn to predict moves before they happen. Get REAL education that is HIGH QUALITY. Join an options trading community built for serious traders! - GET 20% OFF WITH CODE: ZENFTW $125.00 / month 3 day trial Pay Join Join 239 members Features ðŸ“š Education Room &amp; Resources, Market Analysis, Market News, and Custom Indicators",
    "ðŸš¨ ALL Zen Trading Trade Ideas - Swings, Day-Trades, Unicorns, Stocks - ONE Analyst - NO NOISE",
    "ðŸ“° Weekly Trading Newsletter",
    "âŒš Monthly Giveaways - Watches, Movie Tickets, Gift Cards &amp; More!",
    "ðŸ¤– Access to Automatic Trading Bots - Bullseye - Insider Flow - Option Sweeps - Breakout Detector",
    "SM Shreesham Mukherjee 11 days ago Never considered joining a group like this before, Zen is amazing, the group provides daily plays, swing trades, leaps, and best of all legitimate education to make yourself a better trader. Written 1 month after purchase",
    "AL Anthony Leontiev 22 days ago Solid community and signals, both AI and human Written 1 month after purchase",
    "M Mars 1 month ago Zen is amazing!! Responsive , follows the fundamentals, no emotions , just right strategy which always works! Glad I found his contact and he has been helping me with the hard financial journey. Written 7 days after purchase",
    "T Tim 1 month ago Really great community. Very interactive in the chat, always keeping everyone up to date on current moves. ZEN is a ðŸ§™ðŸ§™ðŸ§™ Written 7 days after purchase"
  ],
  "paras": [
    "Sign in Unmute Unmute Unmute Unmute Unmute Unmute Unmute Unmute Unmute Unmute ZT Zen Trading Premium ðŸ•– Predict Moves BEFORE They Happen &amp; Conquer the Market ðŸš€ 5.0 ( 41 ) Trading Learn to predict moves before they happen. Get REAL education that is HIGH QUALITY. Join an options trading community built for serious traders! - GET 20% OFF WITH CODE: ZENFTW",
    "3 day trial Pay Join Join 239 members Features ðŸ“š Education Room &amp; Resources, Market Analysis, Market News, and Custom Indicators ðŸš¨ ALL Zen Trading Trade Ideas - Swings, Day-Trades, Unicorns, Stocks - ONE Analyst - NO NOISE ðŸ“° Weekly Trading Newsletter âŒš Monthly Giveaways - Watches, Movie Tickets, Gift Cards &amp; More! ðŸ¤– Access to Automatic Trading Bots - Bullseye - Insider Flow - Option Sweeps - Breakout Detector Reviews 4.98 out of 5 41 total reviews 5 stars 4 stars 3 stars 2 stars 1 star SM Shreesham Mukherjee 11 days ago Never considered joining a group like this before, Zen is amazing, the group provides daily plays, swing trades, leaps, and best of all legitimate education to make yourself a better trader.",
    "22 days ago Solid community and signals, both AI and human",
    "1 month ago Zen is amazing!! Responsive , follows the fundamentals, no emotions , just right strategy which always works! Glad I found his contact and he has been helping me with the hard financial journey.",
    "1 month ago Really great community. Very interactive in the chat, always keeping everyone up to date on current moves. ZEN is a ðŸ§™ðŸ§™ðŸ§™",
    "About the creator Z View profile Zen @ zenftw â€¢ Joined Mar 2025 Hey! I&#x27;m Zen! I have over 6 years of experience trading options, I&#x27;m a TPO trader at heart and trading is my passion. My ultimate goal is to help others learn about options trading and develop themselves to become a better trader. What are you waiting for? I&#x27;ll see you in the community! : ) FAQs Where can I access your Terms of Service? Affiliates ZT Become an affiliate Zen Trading 70% reward Earn money by bringing customers to Zen Trading. Every time a customer purchases using your link, you&#x27;ll earn a commission."
  ],
  "priceTokens": [
    "$125.00",
    "$125.00",
    "$125.00",
    "$1",
    "$1",
    "$1",
    "$22",
    "$1",
    "$1",
    "$1",
    "$1",
    "$1",
    "$2",
    "$1",
    "$2",
    "$2",
    "$2",
    "$2",
    "$3",
    "$3"
  ],
  "faq": [],
  "textSample": "Sign in Unmute Unmute Unmute Unmute Unmute Unmute Unmute Unmute Unmute Unmute ZT Zen Trading Premium ðŸ•– Predict Moves BEFORE They Happen &amp; Conquer the Market ðŸš€ 5.0 ( 41 ) Trading Learn to predict moves before they happen. Get REAL education that is HIGH QUALITY. Join an options trading community built for serious traders! - GET 20% OFF WITH CODE: ZENFTW $125.00 / month 3 day trial Pay Join Join 239 members Features ðŸ“š Education Room &amp; Resources, Market Analysis, Market News, and Custom Indicators ðŸš¨ ALL Zen Trading Trade Ideas - Swings, Day-Trades, Unicorns, Stocks - ONE Analyst - NO NOISE ðŸ“° Weekly Trading Newsletter âŒš Monthly Giveaways - Watches, Movie Tickets, Gift Cards &amp; More! ðŸ¤– Access to Automatic Trading Bots - Bullseye - Insider Flow - Option Sweeps - Breakout Detector Reviews 4.98 out of 5 41 total reviews 5 stars 4 stars 3 stars 2 stars 1 star SM Shreesham Mukherjee 11 days ago Never considered joining a group like this before, Zen is amazing, the group provides daily plays, swing trades, leaps, and best of all legitimate education to make yourself a better trader. Written 1 month after purchase AL Anthony Leontiev 22 days ago Solid community and signals, both AI and human Written 1 month after purchase M Mars 1 month ago Zen is amazing!! Responsive , follows the fundamentals, no emotions , just right strategy which always works! Glad I found his contact and he has been helping me with the hard financial journey. Written 7 days after purchase T Tim 1 month ago Really great community. Very interactive in the chat, always keeping everyone up to date on current moves. ZEN is a ðŸ§™ðŸ§™ðŸ§™ Written 7 days after purchase See all reviews About the creator Z View profile Zen @ zenftw â€¢ Joined Mar 2025 Hey! I&#x27;m Zen! I have over 6 years of experience trading options, I&#x27;m a TPO trader at heart and trading is my passion. My ultimate goal is to help others learn about options trading and develop themselves to become a better trader. What are you waiting for? I&#x27;ll see you in the community! : ) FAQs Where can I access your Terms of Service? Affiliates ZT Become an affiliate Zen Trading 70% reward Earn money by bringing customers to Zen Trading. Every time a customer purchases using your link, you&#x27;ll earn a commission. Zen Trading Premium $125.00 / month Join $125.00 / month Pay Join Pay Join Zen Trading Premium | Whop",
  "finalUrl": "https://whop.com/ztrading/ztradingcommunity/",
  "fetchedAt": "2025-11-04T21:35:10.635Z",
  "textHash": "1c86b232d8af6b815d56a5f4366140a6b0519bc4aaf54460d3d28e67cc7e1789",
  "drilled": false
}